"id","address","subregion","neighborhood","date","id.1","state","nature","nature_description","aerial_means","terrestrial_means","aquatic_means","operational","date.1","Concelho","Distrito","NUTII_DSG","longitude","latitude"
24952255,"Nogueira e Silva Escura","Area M. Porto",309,"2025-02-12T22:30:00",24952255,"Em conclusão","2101","Incêndio em edifícios habitacionais",0,1,0,5,"2025-02-12T22:30:00","Maia","Porto","Norte",-8.587025,41.248568
24952244,"Pinheiro da Bemposta, Travanca e Palmaz","Area M. Porto",309,"2025-02-12T22:24:00",24952244,"Em resolução","2301","Incêndio em transporte rodoviário",0,2,0,7,"2025-02-12T22:24:00","Oliveira De Azeméis","Aveiro","Norte",-8.48914,40.8039
24952364,"Santo António da Charneca","Península de Setúbal",311,"2025-02-12T23:12:00",24952364,"Em despacho","3317","Inundação de estruturas por água canalizada",0,1,0,5,"2025-02-12T23:12:00","Barreiro","Setúbal","Área Metropolitana De Lisboa",-9.029919,38.624451
24952083,"Mação, Penhascoso e Aboboreira","Médio Tejo",311,"2025-02-12T21:28:00",24952083,"Em conclusão","2407","Despiste",0,5,0,13,"2025-02-12T21:28:00","Mação","Santarém","Centro",-7.984748,39.521677
24877003,"Malagueira e Horta Das Figueiras","Alentejo Central",312,"2025-01-27T11:41:00",24877003,"Em conclusão","3315","Inundação de estruturas por precipitação intensa",0,0,0,0,"2025-01-27T11:41:00","Évora","Évora","Alentejo",-7.924277,38.57285
24951530,"Ferreira do Alentejo e Canhestros","Baixo Alentejo",312,"2025-02-12T18:49:00",24951530,"Em conclusão","2403","Colisão rodoviária",0,1,0,2,"2025-02-12T18:49:00","Ferreira Do Alentejo","Beja","Alentejo",-8.170632,37.977713
