"id","address","subregion","neighborhood","date","id.1","state","nature","nature_description","aerial_means","terrestrial_means","aquatic_means","operational","date.1","Concelho","Distrito","NUTII_DSG","longitude","latitude"
25370342,"Nogueira, Fraião e Lamaçães","Cávado",309,"2025-05-13T23:42:00",25370342,"Em conclusão","2101","Incêndio em edifícios habitacionais",0,3,0,10,"2025-05-13T23:42:00","Braga","Braga","Norte",-8.40485,41.5408
25370456,"Azeitão (São Lourenço e São Simão)","Península de Setúbal",311,"2025-05-14T00:45:00",25370456,"Em despacho","3111","Queima",0,2,0,5,"2025-05-14T00:45:00","Setúbal","Setúbal","Área Metropolitana De Lisboa",-9.002401,38.532777
25071496,"São Manços e São Vicente do Pigeiro","Alentejo Central",312,"2025-03-11T13:18:00",25071496,"Em conclusão","1101","Cheia",0,0,0,0,"2025-03-11T13:18:00","Évora","Évora","Alentejo",-7.713313,38.513673
25370382,"Ovar, São João, Arada e São Vicente de Pereira Jusã","Região de Aveiro",310,"2025-05-14T00:00:00",25370382,"Em conclusão","3203","Detritos confinados",0,2,0,7,"2025-05-14T00:00:00","Ovar","Aveiro","Centro",-8.535223,40.86441
25370449,"Camarate, Unhos e Apelação","Grande Lisboa",311,"2025-05-14T00:35:00",25370449,"Em curso","2403","Colisão rodoviária",0,2,0,7,"2025-05-14T00:35:00","Loures","Lisboa","Área Metropolitana De Lisboa",-9.139208,38.802817
25366291,"Matosinhos e Leça da Palmeira","Area M. Porto",309,"2025-05-12T23:59:00",25366291,"Em curso","9115","Operação nacional de assistência",0,0,0,0,"2025-05-12T23:59:00","Matosinhos","Porto","Norte",-8.682603,41.186161
25368476,"Aljubarrota","Oeste",311,"2025-05-13T14:51:00",25368476,"Em conclusão","4327","Busca e resgate terrestre de pessoas",0,2,0,4,"2025-05-13T14:51:00","Alcobaça","Leiria","Centro",-8.952185,39.552779
