"id","address","subregion","neighborhood","date","id.1","state","nature","nature_description","aerial_means","terrestrial_means","aquatic_means","operational","date.1","Concelho","Distrito","NUTII_DSG","longitude","latitude"
24622774,"Avintes","Area M. Porto",309,"2024-12-01T18:03:00",24622774,"Em despacho","4331","Busca e resgate terrestre de animais",0,1,0,4,"2024-12-01T18:03:00","Vila Nova De Gaia","Porto","Norte",-8.547155,41.105347
24552947,"Pias","Baixo Alentejo",312,"2024-11-15T20:38:00",24552947,"Em conclusão","2301","Incêndio em transporte rodoviário",0,0,0,0,"2024-11-15T20:38:00","Serpa","Beja","Alentejo",-7.472605,38.015257
24623475,"Almancil","Algarve",313,"2024-12-01T22:50:00",24623475,"Em conclusão","2301","Incêndio em transporte rodoviário",0,1,0,5,"2024-12-01T22:50:00","Loulé","Faro","Algarve",-8.04184,37.10268
24623379,"Azinhal","Algarve",313,"2024-12-01T21:50:00",24623379,"Em conclusão","2407","Despiste",0,2,0,5,"2024-12-01T21:50:00","Castro Marim","Faro","Algarve",-7.459623,37.311535
24623480,"Santo António da Charneca","Península de Setúbal",311,"2024-12-01T22:46:00",24623480,"Em curso","2407","Despiste",0,5,0,12,"2024-12-01T22:46:00","Barreiro","Setúbal","Área Metropolitana De Lisboa",-9.025237,38.617281
24623512,"Santa Maria, São Pedro e Sobral da Lagoa","Oeste",311,"2024-12-01T22:58:00",24623512,"Em despacho","4331","Busca e resgate terrestre de animais",0,1,0,2,"2024-12-01T22:58:00","Óbidos","Leiria","Centro",-9.16565,39.354731
24623560,"Charneca de Caparica e Sobreda","Península de Setúbal",311,"2024-12-01T23:31:00",24623560,"Em despacho","2301","Incêndio em transporte rodoviário",0,2,0,6,"2024-12-01T23:31:00","Almada","Setúbal","Área Metropolitana De Lisboa",-9.16306,38.58382
