"id","address","subregion","neighborhood","date","id.1","state","nature","nature_description","aerial_means","terrestrial_means","aquatic_means","operational","date.1","Concelho","Distrito","NUTII_DSG","longitude","latitude"
24838234,"Soure","Região de Coimbra",310,"2025-01-18T22:35:00",24838234,"Em curso","4327","Busca e resgate terrestre de pessoas",0,5,0,11,"2025-01-18T22:35:00","Soure","Coimbra","Centro",-8.61128,40.055439
24839037,"S.julião, N.s. da Anunciada e S. Maria da Graça","Península de Setúbal",311,"2025-01-19T08:20:00",24839037,"Em despacho","2301","Incêndio em transporte rodoviário",0,1,0,5,"2025-01-19T08:20:00","Setúbal","Setúbal","Área Metropolitana De Lisboa",-8.892376,38.52206
24839201,"Moita","Península de Setúbal",311,"2025-01-19T09:01:00",24839201,"Em curso","2301","Incêndio em transporte rodoviário",0,2,0,7,"2025-01-19T09:01:00","Moita","Setúbal","Área Metropolitana De Lisboa",-8.985364,38.643702
24838895,"Campo e Campinho","Alentejo Central",312,"2025-01-19T07:23:00",24838895,"Em conclusão","2101","Incêndio em edifícios habitacionais",0,4,0,10,"2025-01-19T07:23:00","Reguengos De Monsaraz","Évora","Alentejo",-7.514513,38.368363
24837529,"Vila do Bispo e Raposeira","Algarve",313,"2025-01-18T18:59:00",24837529,"Em curso","4329","Busca e resgate aquático de pessoas",1,2,0,5,"2025-01-18T18:59:00","Vila Do Bispo","Faro","Algarve",-8.955216,37.086227
24839023,"São João da Madeira","Area M. Porto",309,"2025-01-19T08:07:00",24839023,"Em conclusão","2129","Incêndio em edifícios degradados ou devolutos",0,3,0,9,"2025-01-19T08:07:00","São João Da Madeira","Aveiro","Norte",-8.497441,40.896053
24839080,"Odivelas","Grande Lisboa",311,"2025-01-19T08:20:00",24839080,"Em despacho","3317","Inundação de estruturas por água canalizada",0,1,0,4,"2025-01-19T08:20:00","Odivelas","Lisboa","Área Metropolitana De Lisboa",-9.182813,38.793425
24839173,"Bougado (São Martinho e Santiago)","Area M. Porto",309,"2025-01-19T08:53:00",24839173,"Em despacho","2101","Incêndio em edifícios habitacionais",0,2,0,5,"2025-01-19T08:53:00","Trofa","Porto","Norte",-8.55788,41.33355
