"id","address","subregion","neighborhood","date","id.1","state","nature","nature_description","aerial_means","terrestrial_means","aquatic_means","operational","date.1","Concelho","Distrito","NUTII_DSG","longitude","latitude"
24911232,"São Salvador e Santa Maria","Alentejo Litoral",312,"2025-02-03T19:14:00",24911232,"Em resolução","2403","Colisão rodoviária",0,3,0,6,"2025-02-03T19:14:00","Odemira","Beja","Alentejo",-8.764685,37.509583
24911282,"Almada, Cova da Piedade, Pragal e Cacilhas","Península de Setúbal",311,"2025-02-03T19:34:00",24911282,"Em conclusão","2201","Incêndio em equipamentos ou produtos",0,1,0,1,"2025-02-03T19:34:00","Almada","Setúbal","Área Metropolitana De Lisboa",-9.17885,38.67221
24911651,"Beirã","Alto Alentejo",312,"2025-02-03T21:34:00",24911651,"Em curso","2101","Incêndio em edifícios habitacionais",0,7,0,18,"2025-02-03T21:34:00","Marvão","Portalegre","Alentejo",-7.369857,39.445572
24911314,"Quinta do Conde","Península de Setúbal",311,"2025-02-03T19:35:00",24911314,"Em conclusão","2401","Atropelamento rodoviário",0,4,0,8,"2025-02-03T19:35:00","Sesimbra","Setúbal","Área Metropolitana De Lisboa",-9.03613,38.570355
24911582,"Nossa Senhora do Pópulo, Coto e São Gregório","Oeste",311,"2025-02-03T21:12:00",24911582,"Em conclusão","2101","Incêndio em edifícios habitacionais",0,3,0,8,"2025-02-03T21:12:00","Caldas Da Rainha","Leiria","Centro",-9.13195,39.40742
24911660,"Pinhal Novo","Península de Setúbal",311,"2025-02-03T21:38:00",24911660,"Em conclusão","2201","Incêndio em equipamentos ou produtos",0,3,0,9,"2025-02-03T21:38:00","Palmela","Setúbal","Área Metropolitana De Lisboa",-8.91283,38.62187
24911727,"Setúbal (São Sebastião)","Península de Setúbal",311,"2025-02-03T22:02:00",24911727,"Em curso","3203","Detritos confinados",0,2,0,7,"2025-02-03T22:02:00","Setúbal","Setúbal","Área Metropolitana De Lisboa",-8.862337,38.527365
24877003,"Malagueira e Horta Das Figueiras","Alentejo Central",312,"2025-01-27T11:41:00",24877003,"Em conclusão","3315","Inundação de estruturas por precipitação intensa",0,0,0,0,"2025-01-27T11:41:00","Évora","Évora","Alentejo",-7.924277,38.57285
24911522,"Ourique","Baixo Alentejo",312,"2025-02-03T20:37:00",24911522,"Em conclusão","2101","Incêndio em edifícios habitacionais",0,4,0,12,"2025-02-03T20:37:00","Ourique","Beja","Alentejo",-8.274995,37.5726
24911690,"Marvila, Ribeira Santarém, S.salvador, S.nicolau","Lezíria do Tejo",311,"2025-02-03T21:48:00",24911690,"Em curso","2513","Fuga de gás em conduta",0,2,0,7,"2025-02-03T21:48:00","Santarém","Santarém","Alentejo",-8.69534,39.263777
