"id","address","subregion","neighborhood","date","id.1","state","nature","nature_description","aerial_means","terrestrial_means","aquatic_means","operational","date.1","Concelho","Distrito","NUTII_DSG","longitude","latitude"
24467528,"Real, Ataíde e Oliveira","Tâmega e Sousa",309,"2024-10-26T20:30:00",24467528,"Em conclusão","2101","Incêndio em edifícios habitacionais",0,1,0,5,"2024-10-26T20:30:00","Amarante","Porto","Norte",-8.198678,41.254058
24467532,"Fundão, Valverde, Donas, Aldeia de Joanes e Aldeia Nova do Cabo","Beiras e Serra da Estrela",310,"2024-10-26T20:20:00",24467532,"Em conclusão","3201","Detritos não confinados",0,2,0,7,"2024-10-26T20:20:00","Fundão","Castelo Branco","Centro",-7.494635,40.148865
24467174,"Fundão, Valverde, Donas, Aldeia de Joanes e Aldeia Nova do Cabo","Beiras e Serra da Estrela",310,"2024-10-26T18:38:00",24467174,"Em conclusão","2101","Incêndio em edifícios habitacionais",0,1,0,1,"2024-10-26T18:38:00","Fundão","Castelo Branco","Centro",-7.514323,40.138198
24467692,"Almargem do Bispo, Pêro Pinheiro e Montelavar","Grande Lisboa",311,"2024-10-26T21:18:00",24467692,"Em conclusão","2403","Colisão rodoviária",0,1,0,2,"2024-10-26T21:18:00","Sintra","Lisboa","Área Metropolitana De Lisboa",-9.297507,38.825783
24467828,"Rio Tinto","Area M. Porto",309,"2024-10-26T22:21:00",24467828,"Em curso","2407","Despiste",0,2,0,4,"2024-10-26T22:21:00","Gondomar","Porto","Norte",-8.580677,41.188757
24467842,"Santa Maria Maior","Grande Lisboa",311,"2024-10-26T22:35:00",24467842,"Em despacho","2101","Incêndio em edifícios habitacionais",0,1,0,2,"2024-10-26T22:35:00","Lisboa","Lisboa","Área Metropolitana De Lisboa",-9.1423,38.7114
24467858,"S.maria, S.miguel, S.martinho, S.pedro Penaferrim","Grande Lisboa",311,"2024-10-26T22:37:00",24467858,"Em despacho","3317","Inundação de estruturas por água canalizada",0,1,0,2,"2024-10-26T22:37:00","Sintra","Lisboa","Área Metropolitana De Lisboa",-9.385912,38.758094
24360487,"Mões","Viseu Dão Lafões",310,"2024-10-03T08:00:00",24360487,"Em curso","4339","Corte ou remoção de elementos",0,1,0,1,"2024-10-03T08:00:00","Castro Daire","Viseu","Centro",-7.893519,40.867571
24467747,"Mexilhoeira Grande","Algarve",313,"2024-10-26T21:47:00",24467747,"Em resolução","2515","Fuga de gás em garrafa",0,6,0,17,"2024-10-26T21:47:00","Portimão","Faro","Algarve",-8.61598,37.15716
24467772,"Almodôvar e Graça Dos Padrões","Baixo Alentejo",312,"2024-10-26T21:54:00",24467772,"Em conclusão","2401","Atropelamento rodoviário",0,1,0,2,"2024-10-26T21:54:00","Almodôvar","Beja","Alentejo",-8.057478,37.512967
24467813,"Albufeira e Olhos de Água","Algarve",313,"2024-10-26T22:17:00",24467813,"Em conclusão","3201","Detritos não confinados",0,2,0,8,"2024-10-26T22:17:00","Albufeira","Faro","Algarve",-8.246672,37.09912
24467350,"Verim, Friande e Ajude","Ave",309,"2024-10-26T19:30:00",24467350,"Em resolução","2407","Despiste",0,4,0,9,"2024-10-26T19:30:00","Póvoa De Lanhoso","Braga","Norte",-8.265245,41.636797
24467667,"Sanguinheira","Região de Coimbra",310,"2024-10-26T21:14:00",24467667,"Em conclusão","2407","Despiste",0,1,0,2,"2024-10-26T21:14:00","Cantanhede","Coimbra","Centro",-8.719031,40.319712
24467837,"Alcanede","Lezíria do Tejo",311,"2024-10-26T22:29:00",24467837,"Em resolução","3201","Detritos não confinados",0,3,0,7,"2024-10-26T22:29:00","Santarém","Santarém","Alentejo",-8.85554,39.452968
24467851,"Tavira (Santa Maria e Santiago)","Algarve",313,"2024-10-26T22:33:00",24467851,"Em despacho","2407","Despiste",0,3,0,9,"2024-10-26T22:33:00","Tavira","Faro","Algarve",-7.650217,37.141268
24467853,"Bougado (São Martinho e Santiago)","Area M. Porto",309,"2024-10-26T22:35:00",24467853,"Em despacho","2403","Colisão rodoviária",0,2,0,4,"2024-10-26T22:35:00","Trofa","Porto","Norte",-8.558796,41.329536
24467869,"Pedrouços","Area M. Porto",309,"2024-10-26T22:35:00",24467869,"Em despacho","2127","Incêndio em edifícios e recintos industriais, oficinas e armazéns",0,1,0,3,"2024-10-26T22:35:00","Maia","Porto","Norte",-8.595565,41.182042
