"id","address","subregion","neighborhood","date","id.1","state","nature","nature_description","aerial_means","terrestrial_means","aquatic_means","operational","date.1","Concelho","Distrito","NUTII_DSG","longitude","latitude"
24843112,"Aljustrel e Rio de Moinhos","Baixo Alentejo",312,"2025-01-20T09:22:00",24843112,"Em conclusão","2407","Despiste",0,3,0,6,"2025-01-20T09:22:00","Aljustrel","Beja","Alentejo",-8.164812,37.888237
24843597,"Castelo Branco","Terras de Trás-os-Montes",309,"2025-01-20T10:14:00",24843597,"Em resolução","2407","Despiste",0,4,0,8,"2025-01-20T10:14:00","Mogadouro","Bragança","Norte",-6.770085,41.278468
24843700,"Cernache","Região de Coimbra",310,"2025-01-20T10:56:00",24843700,"Em conclusão","2101","Incêndio em edifícios habitacionais",0,5,0,17,"2025-01-20T10:56:00","Coimbra","Coimbra","Centro",-8.469946,40.1514
24843717,"Portimão","Algarve",313,"2025-01-20T11:01:00",24843717,"Em conclusão","2117","Incêndio em edifícios comerciais e gares de transporte",0,11,0,24,"2025-01-20T11:01:00","Portimão","Faro","Algarve",-8.532608,37.137966
24843732,"Melres e Medas","Area M. Porto",309,"2025-01-20T11:04:00",24843732,"Em curso","2201","Incêndio em equipamentos ou produtos",0,3,0,8,"2025-01-20T11:04:00","Gondomar","Porto","Norte",-8.40431,41.07183
24843781,"Tavira (Santa Maria e Santiago)","Algarve",313,"2025-01-20T10:55:00",24843781,"Em despacho","3315","Inundação de estruturas por precipitação intensa",0,1,0,5,"2025-01-20T10:55:00","Tavira","Faro","Algarve",-7.64691,37.130442
24843884,"Eixo e Eirol","Região de Aveiro",310,"2025-01-20T11:25:00",24843884,"Em despacho","4331","Busca e resgate terrestre de animais",0,1,0,2,"2025-01-20T11:25:00","Aveiro","Aveiro","Centro",-8.564536,40.629276
24843951,"Alferce","Algarve",313,"2025-01-20T11:34:00",24843951,"Em despacho","3313","Deslizamento de terras",0,1,0,1,"2025-01-20T11:34:00","Monchique","Faro","Algarve",-8.493023,37.333617
24843998,"Santa Maria da Feira, Travanca, Sanfins e Espargo","Area M. Porto",309,"2025-01-20T11:45:00",24843998,"Em curso","2403","Colisão rodoviária",0,6,0,14,"2025-01-20T11:45:00","Santa Maria Da Feira","Aveiro","Norte",-8.554076,40.92915
24844015,"Tavira (Santa Maria e Santiago)","Algarve",313,"2025-01-20T11:40:00",24844015,"Em despacho","3315","Inundação de estruturas por precipitação intensa",0,2,0,8,"2025-01-20T11:40:00","Tavira","Faro","Algarve",-7.64691,37.130442
24844034,"São Bartolomeu de Messines","Algarve",313,"2025-01-20T11:52:00",24844034,"Em despacho","2407","Despiste",0,0,0,0,"2025-01-20T11:52:00","Silves","Faro","Algarve",-8.283554,37.282885
24843541,"Vila Nova de Foz Côa","Douro",309,"2025-01-20T10:23:00",24843541,"Em despacho","3111","Queima",0,1,0,2,"2025-01-20T10:23:00","Vila Nova De Foz Côa","Guarda","Norte",-7.133474,41.085004
24843755,"Almada, Cova da Piedade, Pragal e Cacilhas","Península de Setúbal",311,"2025-01-20T11:08:00",24843755,"Em conclusão","2201","Incêndio em equipamentos ou produtos",0,2,0,8,"2025-01-20T11:08:00","Almada","Setúbal","Área Metropolitana De Lisboa",-9.1641,38.6784
24843889,"Oeiras e S. Julião da Barra, Paço de Arcos e Caxias","Grande Lisboa",311,"2025-01-20T11:20:00",24843889,"Em despacho","3317","Inundação de estruturas por água canalizada",0,1,0,5,"2025-01-20T11:20:00","Oeiras","Lisboa","Área Metropolitana De Lisboa",-9.310159,38.698531
24843924,"Lagos (São Sebastião e Santa Maria)","Algarve",313,"2025-01-20T11:21:00",24843924,"Em conclusão","2403","Colisão rodoviária",0,1,0,2,"2025-01-20T11:21:00","Lagos","Faro","Algarve",-8.686965,37.112811
24844092,"Fradelos","Ave",309,"2025-01-20T11:48:00",24844092,"Em despacho","2127","Incêndio em edifícios e recintos industriais, oficinas e armazéns",0,2,0,7,"2025-01-20T11:48:00","Vila Nova De Famalicão","Braga","Norte",-8.59786,41.370931
24843343,"Santa Maria do Castelo e Santiago e Santa Susana","Alentejo Litoral",312,"2025-01-20T09:44:00",24843343,"Em curso","4331","Busca e resgate terrestre de animais",0,1,0,3,"2025-01-20T09:44:00","Alcácer Do Sal","Setúbal","Alentejo",-8.527897,38.375893
24843902,"Algueirão-Mem Martins","Grande Lisboa",311,"2025-01-20T11:27:00",24843902,"Em conclusão","2407","Despiste",0,2,0,5,"2025-01-20T11:27:00","Sintra","Lisboa","Área Metropolitana De Lisboa",-9.345795,38.786998
24844004,"Palmela","Península de Setúbal",311,"2025-01-20T11:46:00",24844004,"Em despacho","2407","Despiste",0,4,0,9,"2025-01-20T11:46:00","Palmela","Setúbal","Área Metropolitana De Lisboa",-8.814348,38.58472
24843110,"Póvoa de Rio de Moinhos e Cafede","Beira Baixa",310,"2025-01-20T09:23:00",24843110,"Em conclusão","2101","Incêndio em edifícios habitacionais",0,3,0,5,"2025-01-20T09:23:00","Castelo Branco","Castelo Branco","Centro",-7.50305,39.94113
24843342,"Campia","Viseu Dão Lafões",310,"2025-01-20T09:54:00",24843342,"Em resolução","2407","Despiste",0,3,0,5,"2025-01-20T09:54:00","Vouzela","Viseu","Centro",-8.239228,40.688742
24843828,"Beduído e Veiros","Região de Aveiro",310,"2025-01-20T11:14:00",24843828,"Em conclusão","2407","Despiste",0,2,0,4,"2025-01-20T11:14:00","Estarreja","Aveiro","Centro",-8.616237,40.750638
24843835,"Tavira (Santa Maria e Santiago)","Algarve",313,"2025-01-20T11:00:00",24843835,"Em despacho","3315","Inundação de estruturas por precipitação intensa",0,1,0,2,"2025-01-20T11:00:00","Tavira","Faro","Algarve",-7.64691,37.130442
24843851,"Loulé (São Sebastião)","Algarve",313,"2025-01-20T11:24:00",24843851,"Em curso","2407","Despiste",0,7,0,15,"2025-01-20T11:24:00","Loulé","Faro","Algarve",-8.06938,37.148961
24843871,"Sines","Alentejo Litoral",312,"2025-01-20T11:05:00",24843871,"Em conclusão","3315","Inundação de estruturas por precipitação intensa",0,1,0,4,"2025-01-20T11:05:00","Sines","Setúbal","Alentejo",-8.854536,37.963534
