"id","address","subregion","neighborhood","date","id.1","state","nature","nature_description","aerial_means","terrestrial_means","aquatic_means","operational","date.1","Concelho","Distrito","NUTII_DSG","longitude","latitude"
24795135,"Póvoa de Varzim, Beiriz e Argivai","Area M. Porto",309,"2025-01-09T11:03:00",24795135,"Em resolução","3311","Queda de elementos de estruturas edificados",0,3,0,8,"2025-01-09T11:03:00","Póvoa De Varzim","Porto","Norte",-8.757465,41.37961
24795144,"S.julião, N.s. da Anunciada e S. Maria da Graça","Península de Setúbal",311,"2025-01-09T11:03:00",24795144,"Em despacho","2403","Colisão rodoviária",0,6,0,17,"2025-01-09T11:03:00","Setúbal","Setúbal","Área Metropolitana De Lisboa",-8.889983,38.529955
24795235,"Mazarefes e Vila Fria","Alto Minho",309,"2025-01-09T11:19:00",24795235,"Em despacho","2407","Despiste",0,1,0,2,"2025-01-09T11:19:00","Viana Do Castelo","Viana Do Castelo","Norte",-8.77421,41.67302
24795412,"Albufeira e Olhos de Água","Algarve",313,"2025-01-09T11:58:00",24795412,"Em conclusão","2115","Incêndio em edifícios hoteleiros e de restauração",0,6,0,19,"2025-01-09T11:58:00","Albufeira","Faro","Algarve",-8.2293,37.08818
24782982,"Almada, Cova da Piedade, Pragal e Cacilhas","Península de Setúbal",311,"2025-01-06T17:08:00",24782982,"Em curso","2425","Abalroamento aquático",0,2,0,6,"2025-01-06T17:08:00","Almada","Setúbal","Área Metropolitana De Lisboa",-9.164498,38.675268
24795331,"São José da Lamarosa","Lezíria do Tejo",311,"2025-01-09T11:39:00",24795331,"Em resolução","2407","Despiste",0,3,0,8,"2025-01-09T11:39:00","Coruche","Santarém","Alentejo",-8.565753,39.068748
24795417,"Pinhal Novo","Península de Setúbal",311,"2025-01-09T11:54:00",24795417,"Em curso","2403","Colisão rodoviária",0,2,0,6,"2025-01-09T11:54:00","Palmela","Setúbal","Área Metropolitana De Lisboa",-8.85817,38.673386
24795483,"Ovar, São João, Arada e São Vicente de Pereira Jusã","Região de Aveiro",310,"2025-01-09T12:09:00",24795483,"Em despacho","2403","Colisão rodoviária",0,2,0,6,"2025-01-09T12:09:00","Ovar","Aveiro","Centro",-8.632482,40.864029
24795089,"Lamego (Almacave e Sé)","Douro",309,"2025-01-09T10:59:00",24795089,"Em resolução","2407","Despiste",0,3,0,6,"2025-01-09T10:59:00","Lamego","Viseu","Norte",-7.774592,41.104125
24795292,"Charneca de Caparica e Sobreda","Península de Setúbal",311,"2025-01-09T11:27:00",24795292,"Em conclusão","2403","Colisão rodoviária",0,2,0,7,"2025-01-09T11:27:00","Almada","Setúbal","Área Metropolitana De Lisboa",-9.194473,38.648295
24795440,"Parque Das Nações","Grande Lisboa",311,"2025-01-09T11:56:00",24795440,"Em despacho","2403","Colisão rodoviária",0,1,0,2,"2025-01-09T11:56:00","Lisboa","Lisboa","Área Metropolitana De Lisboa",-9.09548,38.774802
24795476,"Cedofeita, Ildefonso, Sé, Miragaia, Nicolau e Vitória","Area M. Porto",309,"2025-01-09T12:00:00",24795476,"Em despacho","2513","Fuga de gás em conduta",0,1,0,5,"2025-01-09T12:00:00","Porto","Porto","Norte",-8.615939,41.15359
24795491,"Cedofeita, Ildefonso, Sé, Miragaia, Nicolau e Vitória","Area M. Porto",309,"2025-01-09T12:11:00",24795491,"Em despacho","3311","Queda de elementos de estruturas edificados",0,1,0,5,"2025-01-09T12:11:00","Porto","Porto","Norte",-8.615939,41.15359
24780664,"Póvoa de Varzim, Beiriz e Argivai","Area M. Porto",309,"2025-01-06T10:06:00",24780664,"Em conclusão","4329","Busca e resgate aquático de pessoas",0,0,0,0,"2025-01-06T10:06:00","Póvoa De Varzim","Porto","Norte",-8.76679,41.37906
24794350,"Amor","Região de Leiria",310,"2025-01-09T08:39:00",24794350,"Em despacho","3321","Dano na rede de fornecimento de eletricidade ",0,1,0,1,"2025-01-09T08:39:00","Leiria","Leiria","Centro",-8.880606,39.80632
24794436,"São Salvador e Santa Maria","Alentejo Litoral",312,"2025-01-09T08:54:00",24794436,"Em conclusão","2403","Colisão rodoviária",0,2,0,4,"2025-01-09T08:54:00","Odemira","Beja","Alentejo",-8.627228,37.633647
24794459,"Alcanena e Vila Moreira","Médio Tejo",311,"2025-01-09T09:04:00",24794459,"Em despacho","3311","Queda de elementos de estruturas edificados",0,3,0,7,"2025-01-09T09:04:00","Alcanena","Santarém","Centro",-8.666413,39.458072
24794834,"Atei","Ave",309,"2025-01-09T10:14:00",24794834,"Em resolução","2407","Despiste",0,9,0,25,"2025-01-09T10:14:00","Mondim De Basto","Vila Real","Norte",-7.92451,41.44905
24795086,"Loulé (São Clemente)","Algarve",313,"2025-01-09T10:58:00",24795086,"Em conclusão","2407","Despiste",0,2,0,4,"2025-01-09T10:58:00","Loulé","Faro","Algarve",-7.995698,37.171003
24795304,"São Mamede de Infesta e Senhora da Hora","Area M. Porto",309,"2025-01-09T11:24:00",24795304,"Em resolução","2407","Despiste",0,4,0,7,"2025-01-09T11:24:00","Matosinhos","Porto","Norte",-8.669523,41.183918
