"id","address","subregion","neighborhood","date","id.1","state","nature","nature_description","aerial_means","terrestrial_means","aquatic_means","operational","date.1","Concelho","Distrito","NUTII_DSG","longitude","latitude"
24851780,"São Miguel, Santa Eufémia e Rabaçal","Região de Coimbra",310,"2025-01-21T23:25:00",24851780,"Em curso","3315","Inundação de estruturas por precipitação intensa",0,0,0,0,"2025-01-21T23:25:00","Penela","Coimbra","Centro",-8.399036,40.025502
24884684,"Pombal","Região de Leiria",310,"2025-01-28T21:35:00",24884684,"Em conclusão","2115","Incêndio em edifícios hoteleiros e de restauração",0,2,0,6,"2025-01-28T21:35:00","Pombal","Leiria","Centro",-8.62781,39.910371
24884718,"Gulpilhares e Valadares","Area M. Porto",309,"2025-01-28T21:56:00",24884718,"Em conclusão","2101","Incêndio em edifícios habitacionais",0,7,0,21,"2025-01-28T21:56:00","Vila Nova De Gaia","Porto","Norte",-8.62208,41.093978
24884836,"Mafamude e Vilar do Paraíso","Area M. Porto",309,"2025-01-28T22:51:00",24884836,"Em conclusão","2513","Fuga de gás em conduta",0,2,0,8,"2025-01-28T22:51:00","Vila Nova De Gaia","Porto","Norte",-8.60596,41.1284
24884581,"Cernache do Bonjardim, Nesperal e Palhais","Beira Baixa",310,"2025-01-28T21:03:00",24884581,"Em curso","4327","Busca e resgate terrestre de pessoas",0,4,0,8,"2025-01-28T21:03:00","Sertã","Castelo Branco","Centro",-8.182161,39.815954
24884126,"Rio Tinto","Area M. Porto",309,"2025-01-28T18:21:00",24884126,"Em despacho","4331","Busca e resgate terrestre de animais",0,1,0,4,"2025-01-28T18:21:00","Gondomar","Porto","Norte",-8.560102,41.179302
24884677,"Oleiros","Alto Minho",309,"2025-01-28T21:35:00",24884677,"Em conclusão","3301","Queda de árvore",0,0,0,0,"2025-01-28T21:35:00","Ponte Da Barca","Viana Do Castelo","Norte",-8.442838,41.798815
24884926,"Amora","Península de Setúbal",311,"2025-01-28T23:28:00",24884926,"Em despacho","3317","Inundação de estruturas por água canalizada",0,1,0,5,"2025-01-28T23:28:00","Seixal","Setúbal","Área Metropolitana De Lisboa",-9.125227,38.624582
24874756,"Tocha","Região de Coimbra",310,"2025-01-26T22:40:00",24874756,"Em curso","4327","Busca e resgate terrestre de pessoas",0,5,0,18,"2025-01-26T22:40:00","Cantanhede","Coimbra","Centro",-8.782308,40.341926
24877003,"Malagueira e Horta Das Figueiras","Alentejo Central",312,"2025-01-27T11:41:00",24877003,"Em conclusão","3315","Inundação de estruturas por precipitação intensa",0,0,0,0,"2025-01-27T11:41:00","Évora","Évora","Alentejo",-7.924277,38.57285
24884432,"Mazedo e Cortes","Alto Minho",309,"2025-01-28T20:17:00",24884432,"Em conclusão","2407","Despiste",0,1,0,2,"2025-01-28T20:17:00","Monção","Viana Do Castelo","Norte",-8.49547,42.072967
24884882,"Olivais","Grande Lisboa",311,"2025-01-28T23:16:00",24884882,"Em curso","2403","Colisão rodoviária",0,3,0,8,"2025-01-28T23:16:00","Lisboa","Lisboa","Área Metropolitana De Lisboa",-9.096294,38.778858
24884898,"Matosinhos e Leça da Palmeira","Area M. Porto",309,"2025-01-28T23:19:00",24884898,"Em conclusão","2407","Despiste",0,1,0,2,"2025-01-28T23:19:00","Matosinhos","Porto","Norte",-8.683588,41.195818
24884909,"Albufeira e Olhos de Água","Algarve",313,"2025-01-28T23:19:00",24884909,"Em curso","2517","Fuga de gás em reservatório",0,1,0,5,"2025-01-28T23:19:00","Albufeira","Faro","Algarve",-8.252292,37.091727
