"id","address","subregion","neighborhood","date","id.1","state","nature","nature_description","aerial_means","terrestrial_means","aquatic_means","operational","date.1","Concelho","Distrito","NUTII_DSG","longitude","latitude"
25071496,"São Manços e São Vicente do Pigeiro","Alentejo Central",312,"2025-03-11T13:18:00",25071496,"Em conclusão","1101","Cheia",0,0,0,0,"2025-03-11T13:18:00","Évora","Évora","Alentejo",-7.713313,38.513673
25318424,"Nossa Senhora da Graça Dos Degolados","Alto Alentejo",312,"2025-05-02T13:10:00",25318424,"Em conclusão","1103","Vento forte",0,0,0,0,"2025-05-02T13:10:00","Campo Maior","Portalegre","Alentejo",-7.12147,39.062622
25321398,"Cernache do Bonjardim, Nesperal e Palhais","Beira Baixa",310,"2025-05-03T03:33:00",25321398,"Em resolução","2407","Despiste",0,1,0,2,"2025-05-03T03:33:00","Sertã","Castelo Branco","Centro",-8.161598,39.825715
25316776,"Guarda","Beiras e Serra da Estrela",310,"2025-05-02T07:17:00",25316776,"Em conclusão","3311","Queda de elementos de estruturas edificados",0,9,0,18,"2025-05-02T07:17:00","Guarda","Guarda","Centro",-7.269039,40.539292
25321570,"Almargem do Bispo, Pêro Pinheiro e Montelavar","Grande Lisboa",311,"2025-05-03T06:39:00",25321570,"Em despacho","2403","Colisão rodoviária",0,3,0,9,"2025-05-03T06:39:00","Sintra","Lisboa","Área Metropolitana De Lisboa",-9.2837,38.840214
25298444,"Carnaxide e Queijas","Grande Lisboa",311,"2025-04-28T11:44:00",25298444,"Em curso","9999","Situação crítica",0,0,0,0,"2025-04-28T11:44:00","Oeiras","Lisboa","Área Metropolitana De Lisboa",-9.243421,38.725234
25321556,"Marrazes e Barosa","Região de Leiria",310,"2025-05-03T06:26:00",25321556,"Em conclusão","2109","Incêndio em edifícios escolares",0,2,0,8,"2025-05-03T06:26:00","Leiria","Leiria","Centro",-8.813484,39.764428
25321455,"Faro (Sé e São Pedro)","Algarve",313,"2025-05-03T04:44:00",25321455,"Em curso","3317","Inundação de estruturas por água canalizada",0,0,0,0,"2025-05-03T04:44:00","Faro","Faro","Algarve",-7.942032,37.01865
25321494,"Anais","Alto Minho",309,"2025-05-03T05:35:00",25321494,"Em resolução","4327","Busca e resgate terrestre de pessoas",0,1,0,2,"2025-05-03T05:35:00","Ponte De Lima","Viana Do Castelo","Norte",-8.520043,41.708658
