"id","address","subregion","neighborhood","date","id.1","state","nature","nature_description","aerial_means","terrestrial_means","aquatic_means","operational","date.1","Concelho","Distrito","NUTII_DSG","longitude","latitude"
24888293,"Pernes","Lezíria do Tejo",311,"2025-01-29T16:41:00",24888293,"Em curso","3301","Queda de árvore",0,0,0,0,"2025-01-29T16:41:00","Santarém","Santarém","Alentejo",-8.658865,39.381547
24987831,"Aljustrel e Rio de Moinhos","Baixo Alentejo",312,"2025-02-20T19:16:00",24987831,"Em conclusão","2101","Incêndio em edifícios habitacionais",0,0,0,0,"2025-02-20T19:16:00","Aljustrel","Beja","Alentejo",-8.20747,37.89749
24988760,"São João da Madeira","Area M. Porto",309,"2025-02-21T01:30:00",24988760,"Em resolução","2127","Incêndio em edifícios e recintos industriais, oficinas e armazéns",0,7,0,20,"2025-02-21T01:30:00","São João Da Madeira","Aveiro","Norte",-8.497441,40.896053
24988776,"Póvoa de Varzim, Beiriz e Argivai","Area M. Porto",309,"2025-02-21T01:47:00",24988776,"Em despacho","4331","Busca e resgate terrestre de animais",0,1,0,4,"2025-02-21T01:47:00","Póvoa De Varzim","Porto","Norte",-8.716677,41.398488
24877003,"Malagueira e Horta Das Figueiras","Alentejo Central",312,"2025-01-27T11:41:00",24877003,"Em conclusão","3315","Inundação de estruturas por precipitação intensa",0,0,0,0,"2025-01-27T11:41:00","Évora","Évora","Alentejo",-7.924277,38.57285
24988741,"Azeitão (São Lourenço e São Simão)","Península de Setúbal",311,"2025-02-21T01:08:00",24988741,"Em curso","2407","Despiste",0,3,0,9,"2025-02-21T01:08:00","Setúbal","Setúbal","Área Metropolitana De Lisboa",-9.032678,38.477598
24988748,"Associação de Freguesias do Vale do Neiva","Alto Minho",309,"2025-02-21T01:13:00",24988748,"Em resolução","2407","Despiste",0,3,0,5,"2025-02-21T01:13:00","Ponte De Lima","Viana Do Castelo","Norte",-8.554778,41.644203
24988793,"Junqueira","Area M. Porto",309,"2025-02-21T02:06:00",24988793,"Em despacho","2115","Incêndio em edifícios hoteleiros e de restauração",0,1,0,5,"2025-02-21T02:06:00","Vila Do Conde","Porto","Norte",-8.678271,41.381569
