"id","address","subregion","neighborhood","date","id.1","state","nature","nature_description","aerial_means","terrestrial_means","aquatic_means","operational","date.1","Concelho","Distrito","NUTII_DSG","longitude","latitude","state_2"
26261502,"S.maria, S.miguel, S.martinho, S.pedro Penaferrim","Grande Lisboa",311,"2025-11-10T04:05:00",26261502,"Em Despacho","3301","Queda de árvore",0,1,0,5,"2025-11-10T04:05:00","Sintra","Lisboa","Área Metropolitana De Lisboa",-9.387899,38.805813,"Despacho"
26261457,"Aguçadoura e Navais","Area M. Porto",309,"2025-11-10T03:24:00",26261457,"Em resolução/conclusão","2101","Incêndio em edifícios habitacionais",0,5,0,14,"2025-11-10T03:24:00","Póvoa De Varzim","Porto","Norte",-8.7591,41.43775,"Resolução/Conclusão"
26261494,"Santa Marinha e São Pedro da Afurada","Area M. Porto",309,"2025-11-10T04:02:00",26261494,"Em resolução/conclusão","2301","Incêndio em transporte rodoviário",0,4,0,12,"2025-11-10T04:02:00","Vila Nova De Gaia","Porto","Norte",-8.634248,41.137706,"Resolução/Conclusão"
26261405,"Pombal","Região de Leiria",310,"2025-11-10T01:56:00",26261405,"Em resolução/conclusão","2407","Despiste",0,2,0,4,"2025-11-10T01:56:00","Pombal","Leiria","Centro",-8.641897,39.917515,"Resolução/Conclusão"
26261512,"Queluz e Belas","Grande Lisboa",311,"2025-11-10T04:13:00",26261512,"Em resolução/conclusão","2407","Despiste",0,4,0,10,"2025-11-10T04:13:00","Sintra","Lisboa","Área Metropolitana De Lisboa",-9.253541,38.753134,"Resolução/Conclusão"
26248654,"Golegã","Lezíria do Tejo",311,"2025-11-07T09:04:00",26248654,"Em Curso","9115","Operação nacional de assistência",0,7,0,12,"2025-11-07T09:04:00","Golegã","Santarém","Alentejo",-8.472127,39.406562,"Curso"
26261270,"Vila Franca de Xira","Grande Lisboa",311,"2025-11-10T00:11:00",26261270,"Em resolução/conclusão","3325","Dano na rede de abastecimento de gás",0,2,0,7,"2025-11-10T00:11:00","Vila Franca De Xira","Lisboa","Área Metropolitana De Lisboa",-8.982169,38.955394,"Resolução/Conclusão"
26261479,"Quarteira","Algarve",313,"2025-11-10T03:52:00",26261479,"Em resolução/conclusão","2101","Incêndio em edifícios habitacionais",0,7,0,21,"2025-11-10T03:52:00","Loulé","Faro","Algarve",-8.12969,37.102601,"Resolução/Conclusão"
26261497,"Castanheira do Ribatejo e Cachoeiras","Grande Lisboa",311,"2025-11-10T03:55:00",26261497,"Em resolução/conclusão","2403","Colisão rodoviária",0,4,0,9,"2025-11-10T03:55:00","Vila Franca De Xira","Lisboa","Área Metropolitana De Lisboa",-8.971247,38.992471,"Resolução/Conclusão"
