"id","address","subregion","neighborhood","date","id.1","state","nature","nature_description","aerial_means","terrestrial_means","aquatic_means","operational","date.1","Concelho","Distrito","NUTII_DSG","longitude","latitude"
24434215,"Santo António Dos Olivais","Região de Coimbra",310,"2024-10-19T06:43:00",24434215,"Em despacho","4331","Busca e resgate terrestre de animais",0,1,0,2,"2024-10-19T06:43:00","Coimbra","Coimbra","Centro",-8.426807,40.217261
24434158,"S.maria, S.miguel, S.martinho, S.pedro Penaferrim","Grande Lisboa",311,"2024-10-19T05:57:00",24434158,"Em conclusão","2403","Colisão rodoviária",0,2,0,7,"2024-10-19T05:57:00","Sintra","Lisboa","Área Metropolitana De Lisboa",-9.358238,38.821441
24434211,"São Bartolomeu de Messines","Algarve",313,"2024-10-19T06:35:00",24434211,"Em conclusão","2407","Despiste",0,4,0,11,"2024-10-19T06:35:00","Silves","Faro","Algarve",-8.287502,37.25838
24434225,"Almodôvar e Graça Dos Padrões","Baixo Alentejo",312,"2024-10-19T06:56:00",24434225,"Em despacho","3301","Queda de árvore",0,1,0,2,"2024-10-19T06:56:00","Almodôvar","Beja","Alentejo",-8.07199,37.515257
24411958,"São Martinho Das Moitas e Covas do Rio","Viseu Dão Lafões",310,"2024-10-14T08:00:00",24411958,"Em curso","4339","Corte ou remoção de elementos",0,2,0,2,"2024-10-14T08:00:00","São Pedro Do Sul","Viseu","Centro",-8.08089,40.891495
24434169,"Conde e Gandarela","Ave",309,"2024-10-19T06:04:00",24434169,"Em curso","2403","Colisão rodoviária",0,2,0,4,"2024-10-19T06:04:00","Guimarães","Braga","Norte",-8.339596,41.394277
24360487,"Mões","Viseu Dão Lafões",310,"2024-10-03T08:00:00",24360487,"Em curso","4339","Corte ou remoção de elementos",0,1,0,1,"2024-10-03T08:00:00","Castro Daire","Viseu","Centro",-7.893519,40.867571
24434180,"St.tirso, Couto (S.cristina e S.miguel) e Burgães","Area M. Porto",309,"2024-10-19T06:13:00",24434180,"Em despacho","2407","Despiste",0,1,0,2,"2024-10-19T06:13:00","Santo Tirso","Porto","Norte",-8.474679,41.335886
