"id","address","subregion","neighborhood","date","id.1","state","nature","nature_description","aerial_means","terrestrial_means","aquatic_means","operational","date.1","Concelho","Distrito","NUTII_DSG","longitude","latitude"
24877003,"Malagueira e Horta Das Figueiras","Alentejo Central",312,"2025-01-27T11:41:00",24877003,"Em conclusão","3315","Inundação de estruturas por precipitação intensa",0,0,0,0,"2025-01-27T11:41:00","Évora","Évora","Alentejo",-7.924277,38.57285
24965075,"Avintes","Area M. Porto",309,"2025-02-15T19:27:00",24965075,"Em conclusão","2127","Incêndio em edifícios e recintos industriais, oficinas e armazéns",0,3,0,7,"2025-02-15T19:27:00","Vila Nova De Gaia","Porto","Norte",-8.53227,41.09298
24966220,"Guia, Ilha e Mata Mourisca","Região de Leiria",310,"2025-02-16T04:11:00",24966220,"Em resolução","2407","Despiste",0,4,0,11,"2025-02-16T04:11:00","Pombal","Leiria","Centro",-8.789424,39.933884
24966322,"Silvares","Ave",309,"2025-02-16T05:40:00",24966322,"Em despacho","2301","Incêndio em transporte rodoviário",0,1,0,5,"2025-02-16T05:40:00","Guimarães","Braga","Norte",-8.34079,41.44667
24888293,"Pernes","Lezíria do Tejo",311,"2025-01-29T16:41:00",24888293,"Em curso","3301","Queda de árvore",0,0,0,0,"2025-01-29T16:41:00","Santarém","Santarém","Alentejo",-8.658865,39.381547
24964526,"Aldoar, Foz do Douro e Nevogilde","Area M. Porto",309,"2025-02-15T16:36:00",24964526,"Em conclusão","4329","Busca e resgate aquático de pessoas",0,0,0,0,"2025-02-15T16:36:00","Porto","Porto","Norte",-8.67565,41.14698
24966076,"Lago","Cávado",309,"2025-02-16T02:10:00",24966076,"Em conclusão","2127","Incêndio em edifícios e recintos industriais, oficinas e armazéns",0,2,0,7,"2025-02-16T02:10:00","Amares","Braga","Norte",-8.421853,41.61778
