"id","address","subregion","neighborhood","date","id.1","state","nature","nature_description","aerial_means","terrestrial_means","aquatic_means","operational","date.1","Concelho","Distrito","NUTII_DSG","longitude","latitude"
24756134,"Charneca de Caparica e Sobreda","Península de Setúbal",311,"2024-12-31T21:13:00",24756134,"Em conclusão","3201","Detritos não confinados",0,1,0,5,"2024-12-31T21:13:00","Almada","Setúbal","Área Metropolitana De Lisboa",-9.18656,38.60837
24756148,"Barrô e Aguada de Baixo","Região de Aveiro",310,"2024-12-31T21:11:00",24756148,"Em conclusão","2407","Despiste",0,2,0,4,"2024-12-31T21:11:00","Águeda","Aveiro","Centro",-8.467136,40.533244
24756165,"Gualtar","Cávado",309,"2024-12-31T21:19:00",24756165,"Em conclusão","2101","Incêndio em edifícios habitacionais",0,1,0,6,"2024-12-31T21:19:00","Braga","Braga","Norte",-8.387989,41.567983
24756185,"Seixal, Arrentela e Aldeia de Paio Pires","Península de Setúbal",311,"2024-12-31T21:33:00",24756185,"Em despacho","3103","Incêndio rural",0,1,0,4,"2024-12-31T21:33:00","Seixal","Setúbal","Área Metropolitana De Lisboa",-9.07811,38.59543
24756060,"O. Azeméis, Riba-Ul, Ul, Macinhata Seixa, Madail","Area M. Porto",309,"2024-12-31T20:44:00",24756060,"Em conclusão","2101","Incêndio em edifícios habitacionais",0,4,0,10,"2024-12-31T20:44:00","Oliveira De Azeméis","Aveiro","Norte",-8.489222,40.815425
24756159,"Cascais e Estoril","Grande Lisboa",311,"2024-12-31T21:21:00",24756159,"Em conclusão","2101","Incêndio em edifícios habitacionais",0,1,0,5,"2024-12-31T21:21:00","Cascais","Lisboa","Área Metropolitana De Lisboa",-9.4223,38.71066
24756227,"Requeixo, Nossa Senhora de Fátima e Nariz","Região de Aveiro",310,"2024-12-31T21:44:00",24756227,"Em curso","3105","Incêndio rural",0,2,0,8,"2024-12-31T21:44:00","Aveiro","Aveiro","Centro",-8.537161,40.597857
24756241,"Coz, Alpedriz e Montes","Oeste",311,"2024-12-31T21:41:00",24756241,"Em conclusão","2101","Incêndio em edifícios habitacionais",0,2,0,6,"2024-12-31T21:41:00","Alcobaça","Leiria","Centro",-8.945942,39.615869
24756342,"Eixo e Eirol","Região de Aveiro",310,"2024-12-31T22:18:00",24756342,"Em despacho","2101","Incêndio em edifícios habitacionais",0,1,0,5,"2024-12-31T22:18:00","Aveiro","Aveiro","Centro",-8.534841,40.60507
24756343,"Pinheiro da Bemposta, Travanca e Palmaz","Area M. Porto",309,"2024-12-31T22:05:00",24756343,"Em despacho","4331","Busca e resgate terrestre de animais",0,1,0,2,"2024-12-31T22:05:00","Oliveira De Azeméis","Aveiro","Norte",-8.468107,40.789674
24755911,"Olho Marinho","Oeste",311,"2024-12-31T19:50:00",24755911,"Em conclusão","3111","Queima",0,2,0,7,"2024-12-31T19:50:00","Óbidos","Leiria","Centro",-9.214965,39.335778
24755995,"Beja (Santiago Maior e São João Baptista)","Baixo Alentejo",312,"2024-12-31T20:10:00",24755995,"Em conclusão","3103","Incêndio rural",0,0,0,0,"2024-12-31T20:10:00","Beja","Beja","Alentejo",-7.893835,38.035233
24756131,"Portimão","Algarve",313,"2024-12-31T21:12:00",24756131,"Em conclusão","2101","Incêndio em edifícios habitacionais",0,6,0,13,"2024-12-31T21:12:00","Portimão","Faro","Algarve",-8.53929,37.12015
24756338,"Borba (Matriz)","Alentejo Central",312,"2024-12-31T22:15:00",24756338,"Em conclusão","2101","Incêndio em edifícios habitacionais",0,2,0,5,"2024-12-31T22:15:00","Borba","Évora","Alentejo",-7.450322,38.800187
24756003,"São Pedro do Sul, Várzea e Baiões","Viseu Dão Lafões",310,"2024-12-31T20:20:00",24756003,"Em resolução","2101","Incêndio em edifícios habitacionais",0,9,0,22,"2024-12-31T20:20:00","São Pedro Do Sul","Viseu","Centro",-8.067856,40.756654
24756171,"Ermesinde","Area M. Porto",309,"2024-12-31T21:26:00",24756171,"Em resolução","2101","Incêndio em edifícios habitacionais",0,4,0,10,"2024-12-31T21:26:00","Valongo","Porto","Norte",-8.54698,41.21235
24756262,"Esmoriz","Região de Aveiro",310,"2024-12-31T21:47:00",24756262,"Em curso","2513","Fuga de gás em conduta",0,3,0,9,"2024-12-31T21:47:00","Ovar","Aveiro","Centro",-8.637974,40.962156
