"id","address","subregion","neighborhood","date","id.1","state","nature","nature_description","aerial_means","terrestrial_means","aquatic_means","operational","date.1","Concelho","Distrito","NUTII_DSG","longitude","latitude"
25071496,"São Manços e São Vicente do Pigeiro","Alentejo Central",312,"2025-03-11T13:18:00",25071496,"Em conclusão","1101","Cheia",0,0,0,0,"2025-03-11T13:18:00","Évora","Évora","Alentejo",-7.713313,38.513673
25202441,"Serpa (Salvador e Santa Maria)","Baixo Alentejo",312,"2025-04-06T10:25:00",25202441,"Em conclusão","1101","Cheia",0,0,0,0,"2025-04-06T10:25:00","Serpa","Beja","Alentejo",-7.555783,37.88592
25266333,"Cantanhede e Pocariça","Região de Coimbra",310,"2025-04-21T09:38:00",25266333,"Em conclusão","2101","Incêndio em edifícios habitacionais",0,5,0,14,"2025-04-21T09:38:00","Cantanhede","Coimbra","Centro",-8.625624,40.317303
25266070,"Pêra Velha, Aldeia de Nacomba e Ariz","Douro",309,"2025-04-21T08:37:00",25266070,"Em conclusão","2301","Incêndio em transporte rodoviário",0,1,0,4,"2025-04-21T08:37:00","Moimenta Da Beira","Viseu","Norte",-7.672897,40.940647
25266075,"Moncarapacho e Fuseta","Algarve",313,"2025-04-21T08:38:00",25266075,"Em conclusão","2407","Despiste",0,1,0,2,"2025-04-21T08:38:00","Olhão","Faro","Algarve",-7.763146,37.063282
25266102,"São João de Areias","Viseu Dão Lafões",310,"2025-04-21T08:33:00",25266102,"Em curso","3301","Queda de árvore",0,1,0,3,"2025-04-21T08:33:00","Santa Comba Dão","Viseu","Centro",-8.068341,40.390527
25266486,"São Martinho do Bispo e Ribeira de Frades","Região de Coimbra",310,"2025-04-21T10:05:00",25266486,"Em despacho","2407","Despiste",0,1,0,2,"2025-04-21T10:05:00","Coimbra","Coimbra","Centro",-8.487841,40.211499
25266128,"Belmonte e Colmeal da Torre","Beiras e Serra da Estrela",310,"2025-04-21T08:46:00",25266128,"Em conclusão","2201","Incêndio em equipamentos ou produtos",0,3,0,9,"2025-04-21T08:46:00","Belmonte","Castelo Branco","Centro",-7.347598,40.345002
25266219,"Vila Franca de Xira","Grande Lisboa",311,"2025-04-21T09:13:00",25266219,"Em resolução","2101","Incêndio em edifícios habitacionais",0,2,0,6,"2025-04-21T09:13:00","Vila Franca De Xira","Lisboa","Área Metropolitana De Lisboa",-8.9938,38.95661
25266553,"Gulpilhares e Valadares","Area M. Porto",309,"2025-04-21T10:16:00",25266553,"Em despacho","2407","Despiste",0,1,0,2,"2025-04-21T10:16:00","Vila Nova De Gaia","Porto","Norte",-8.637978,41.084091
25266596,"São Pedro e Santa Maria e Vila Boa do Mondego","Beiras e Serra da Estrela",310,"2025-04-21T10:29:00",25266596,"Em despacho","2301","Incêndio em transporte rodoviário",0,1,0,4,"2025-04-21T10:29:00","Celorico Da Beira","Guarda","Centro",-7.396689,40.636751
25266388,"Braga (São Vítor)","Cávado",309,"2025-04-21T09:43:00",25266388,"Em curso","2513","Fuga de gás em conduta",0,2,0,5,"2025-04-21T09:43:00","Braga","Braga","Norte",-8.406451,41.557726
25266423,"Aveiras de Cima","Lezíria do Tejo",311,"2025-04-21T09:59:00",25266423,"Em conclusão","2201","Incêndio em equipamentos ou produtos",0,1,0,3,"2025-04-21T09:59:00","Azambuja","Lisboa","Alentejo",-8.892945,39.130188
25266473,"Carregado e Cadafais","Oeste",311,"2025-04-21T10:04:00",25266473,"Em curso","2407","Despiste",0,4,0,10,"2025-04-21T10:04:00","Alenquer","Lisboa","Centro",-9.003561,39.006579
25266525,"Ferreiros, Prozelo e Besteiros","Cávado",309,"2025-04-21T10:13:00",25266525,"Em despacho","4331","Busca e resgate terrestre de animais",0,1,0,2,"2025-04-21T10:13:00","Amares","Braga","Norte",-8.365459,41.626656
