"id","address","subregion","neighborhood","date","id.1","state","nature","nature_description","aerial_means","terrestrial_means","aquatic_means","operational","date.1","Concelho","Distrito","NUTII_DSG","longitude","latitude"
24924402,"Montenegro","Algarve",313,"2025-02-06T17:47:00",24924402,"Em conclusão","2513","Fuga de gás em conduta",0,0,0,0,"2025-02-06T17:47:00","Faro","Faro","Algarve",-7.968974,37.031305
24925558,"Ovar, São João, Arada e São Vicente de Pereira Jusã","Região de Aveiro",310,"2025-02-06T23:21:00",24925558,"Em conclusão","4327","Busca e resgate terrestre de pessoas",0,1,0,2,"2025-02-06T23:21:00","Ovar","Aveiro","Centro",-8.677577,40.873062
24925630,"Canidelo","Area M. Porto",309,"2025-02-07T00:20:00",24925630,"Em curso","2101","Incêndio em edifícios habitacionais",0,8,0,24,"2025-02-07T00:20:00","Vila Nova De Gaia","Porto","Norte",-8.660673,41.11508
24925647,"Loures","Grande Lisboa",311,"2025-02-07T00:20:00",24925647,"Em curso","3325","Dano na rede de abastecimento de gás",0,1,0,5,"2025-02-07T00:20:00","Loures","Lisboa","Área Metropolitana De Lisboa",-9.198552,38.845527
24877003,"Malagueira e Horta Das Figueiras","Alentejo Central",312,"2025-01-27T11:41:00",24877003,"Em conclusão","3315","Inundação de estruturas por precipitação intensa",0,0,0,0,"2025-01-27T11:41:00","Évora","Évora","Alentejo",-7.924277,38.57285
24912072,"Romeira e Várzea","Lezíria do Tejo",311,"2025-02-04T01:22:00",24912072,"Em conclusão","2127","Incêndio em edifícios e recintos industriais, oficinas e armazéns",0,1,0,1,"2025-02-04T01:22:00","Santarém","Santarém","Alentejo",-8.714057,39.254832
24925610,"Alfragide","Grande Lisboa",311,"2025-02-06T23:59:00",24925610,"Em conclusão","2407","Despiste",0,2,0,4,"2025-02-06T23:59:00","Amadora","Lisboa","Área Metropolitana De Lisboa",-9.213123,38.742706
