"id","address","subregion","neighborhood","date","id.1","state","nature","nature_description","aerial_means","terrestrial_means","aquatic_means","operational","date.1","Concelho","Distrito","NUTII_DSG","longitude","latitude"
24468838,"São Pedro do Sul, Várzea e Baiões","Viseu Dão Lafões",310,"2024-10-27T08:00:00",24468838,"Em despacho","4339","Corte ou remoção de elementos",0,2,0,2,"2024-10-27T08:00:00","São Pedro Do Sul","Viseu","Centro",-8.067856,40.756654
24469090,"Madalena e Beselga","Médio Tejo",311,"2024-10-27T09:23:00",24469090,"Em curso","4333","Busca e resgate aquático de animais",0,3,0,8,"2024-10-27T09:23:00","Tomar","Santarém","Centro",-8.461306,39.574121
24469103,"Marinhais","Lezíria do Tejo",311,"2024-10-27T09:27:00",24469103,"Em resolução","2401","Atropelamento rodoviário",0,4,0,11,"2024-10-27T09:27:00","Salvaterra De Magos","Santarém","Alentejo",-8.701627,39.04943
24468634,"Perafita, Lavra e Santa Cruz do Bispo","Area M. Porto",309,"2024-10-27T07:09:00",24468634,"Em conclusão","2127","Incêndio em edifícios e recintos industriais, oficinas e armazéns",0,9,0,30,"2024-10-27T07:09:00","Matosinhos","Porto","Norte",-8.698498,41.236193
24469041,"Guarda","Beiras e Serra da Estrela",310,"2024-10-27T09:14:00",24469041,"Em despacho","3309","Desabamento de estruturas edificadas",0,1,0,1,"2024-10-27T09:14:00","Guarda","Guarda","Centro",-7.260869,40.536751
24469177,"Caparica e Trafaria","Península de Setúbal",311,"2024-10-27T09:36:00",24469177,"Em despacho","3321","Dano na rede de fornecimento de eletricidade ",0,1,0,4,"2024-10-27T09:36:00","Almada","Setúbal","Área Metropolitana De Lisboa",-9.231582,38.671372
24360487,"Mões","Viseu Dão Lafões",310,"2024-10-03T08:00:00",24360487,"Em curso","4339","Corte ou remoção de elementos",0,1,0,1,"2024-10-03T08:00:00","Castro Daire","Viseu","Centro",-7.893519,40.867571
24469076,"Santa Maria da Feira, Travanca, Sanfins e Espargo","Area M. Porto",309,"2024-10-27T09:16:00",24469076,"Em conclusão","2407","Despiste",0,1,0,2,"2024-10-27T09:16:00","Santa Maria Da Feira","Aveiro","Norte",-8.555837,40.9255
24469158,"Odivelas","Grande Lisboa",311,"2024-10-27T09:36:00",24469158,"Em despacho","2407","Despiste",0,2,0,4,"2024-10-27T09:36:00","Odivelas","Lisboa","Área Metropolitana De Lisboa",-9.182813,38.793425
