"id","address","subregion","neighborhood","date","id.1","state","nature","nature_description","aerial_means","terrestrial_means","aquatic_means","operational","date.1","Concelho","Distrito","NUTII_DSG","longitude","latitude"
25025326,"Mundão","Viseu Dão Lafões",310,"2025-03-01T04:59:00",25025326,"Em despacho","2403","Colisão rodoviária",0,0,0,0,"2025-03-01T04:59:00","Viseu","Viseu","Centro",-7.864563,40.70139
25025313,"Benedita","Oeste",311,"2025-03-01T04:34:00",25025313,"Em conclusão","3317","Inundação de estruturas por água canalizada",0,3,0,5,"2025-03-01T04:34:00","Alcobaça","Leiria","Centro",-8.979714,39.424686
25024736,"Campo de Ourique","Grande Lisboa",311,"2025-02-28T22:28:00",25024736,"Em despacho","3325","Dano na rede de abastecimento de gás",0,1,0,2,"2025-02-28T22:28:00","Lisboa","Lisboa","Área Metropolitana De Lisboa",-9.169863,38.718496
24877003,"Malagueira e Horta Das Figueiras","Alentejo Central",312,"2025-01-27T11:41:00",24877003,"Em conclusão","3315","Inundação de estruturas por precipitação intensa",0,0,0,0,"2025-01-27T11:41:00","Évora","Évora","Alentejo",-7.924277,38.57285
25024657,"Azeitão (São Lourenço e São Simão)","Península de Setúbal",311,"2025-02-28T22:09:00",25024657,"Em curso","2403","Colisão rodoviária",0,0,0,0,"2025-02-28T22:09:00","Setúbal","Setúbal","Área Metropolitana De Lisboa",-9.008871,38.513402
