"id","address","subregion","neighborhood","date","id.1","state","nature","nature_description","aerial_means","terrestrial_means","aquatic_means","operational","date.1","Concelho","Distrito","NUTII_DSG","longitude","latitude"
24574961,"Poceirão e Marateca","Península de Setúbal",311,"2024-11-20T23:14:00",24574961,"Em despacho","2119","Incêndio em edifícios e recintos desportivos e de lazer",0,1,0,4,"2024-11-20T23:14:00","Palmela","Setúbal","Área Metropolitana De Lisboa",-8.691001,38.60116
24573882,"Campolide","Grande Lisboa",311,"2024-11-20T17:32:00",24573882,"Em conclusão","2127","Incêndio em edifícios e recintos industriais, oficinas e armazéns",0,0,0,0,"2024-11-20T17:32:00","Lisboa","Lisboa","Área Metropolitana De Lisboa",-9.16914,38.7253
24573722,"Cedofeita, Ildefonso, Sé, Miragaia, Nicolau e Vitória","Area M. Porto",309,"2024-11-20T16:48:00",24573722,"Em conclusão","2115","Incêndio em edifícios hoteleiros e de restauração",0,18,0,57,"2024-11-20T16:48:00","Porto","Porto","Norte",-8.6073,41.14514
24574806,"Corroios","Península de Setúbal",311,"2024-11-20T22:01:00",24574806,"Em conclusão","3105","Incêndio rural",0,0,0,0,"2024-11-20T22:01:00","Seixal","Setúbal","Área Metropolitana De Lisboa",-9.155453,38.59019
24523090,"Carnaxide e Queijas","Grande Lisboa",311,"2024-11-08T18:49:00",24523090,"Em curso","9119","Missão internacional de assistência",0,47,0,102,"2024-11-08T18:49:00","Oeiras","Lisboa","Área Metropolitana De Lisboa",-9.243421,38.725234
24574823,"Pegões","Península de Setúbal",311,"2024-11-20T21:59:00",24574823,"Em conclusão","3103","Incêndio rural",0,2,0,7,"2024-11-20T21:59:00","Montijo","Setúbal","Área Metropolitana De Lisboa",-8.659163,38.685652
24574825,"Algueirão-Mem Martins","Grande Lisboa",311,"2024-11-20T22:02:00",24574825,"Em conclusão","2401","Atropelamento rodoviário",0,2,0,7,"2024-11-20T22:02:00","Sintra","Lisboa","Área Metropolitana De Lisboa",-9.335956,38.797352
24574839,"Carriço","Região de Leiria",310,"2024-11-20T22:00:00",24574839,"Em despacho","2407","Despiste",0,2,0,4,"2024-11-20T22:00:00","Pombal","Leiria","Centro",-8.848751,40.013686
