"id","address","subregion","neighborhood","date","id.1","state","nature","nature_description","aerial_means","terrestrial_means","aquatic_means","operational","date.1","Concelho","Distrito","NUTII_DSG","longitude","latitude"
24888293,"Pernes","Lezíria do Tejo",311,"2025-01-29T16:41:00",24888293,"Em curso","3301","Queda de árvore",0,0,0,0,"2025-01-29T16:41:00","Santarém","Santarém","Alentejo",-8.658865,39.381547
24964526,"Aldoar, Foz do Douro e Nevogilde","Area M. Porto",309,"2025-02-15T16:36:00",24964526,"Em conclusão","4329","Busca e resgate aquático de pessoas",0,0,0,0,"2025-02-15T16:36:00","Porto","Porto","Norte",-8.67565,41.14698
24877003,"Malagueira e Horta Das Figueiras","Alentejo Central",312,"2025-01-27T11:41:00",24877003,"Em conclusão","3315","Inundação de estruturas por precipitação intensa",0,0,0,0,"2025-01-27T11:41:00","Évora","Évora","Alentejo",-7.924277,38.57285
24970009,"Campo de Ourique","Grande Lisboa",311,"2025-02-17T02:03:00",24970009,"Em despacho","2407","Despiste",0,1,0,3,"2025-02-17T02:03:00","Lisboa","Lisboa","Área Metropolitana De Lisboa",-9.169863,38.718496
24970059,"Lousado","Ave",309,"2025-02-17T03:06:00",24970059,"Em despacho","2101","Incêndio em edifícios habitacionais",0,0,0,0,"2025-02-17T03:06:00","Vila Nova De Famalicão","Braga","Norte",-8.531181,41.35167
