"id","address","subregion","neighborhood","date","id.1","state","nature","nature_description","aerial_means","terrestrial_means","aquatic_means","operational","date.1","Concelho","Distrito","NUTII_DSG","longitude","latitude"
24874756,"Tocha","Região de Coimbra",310,"2025-01-26T22:40:00",24874756,"Em curso","4327","Busca e resgate terrestre de pessoas",0,5,0,18,"2025-01-26T22:40:00","Cantanhede","Coimbra","Centro",-8.782308,40.341926
24877003,"Malagueira e Horta Das Figueiras","Alentejo Central",312,"2025-01-27T11:41:00",24877003,"Em conclusão","3315","Inundação de estruturas por precipitação intensa",0,0,0,0,"2025-01-27T11:41:00","Évora","Évora","Alentejo",-7.924277,38.57285
24885309,"Oeiras e S. Julião da Barra, Paço de Arcos e Caxias","Grande Lisboa",311,"2025-01-29T05:56:00",24885309,"Em resolução","3317","Inundação de estruturas por água canalizada",0,1,0,4,"2025-01-29T05:56:00","Oeiras","Lisboa","Área Metropolitana De Lisboa",-9.32032,38.67882
24885384,"Borbela e Lamas de Olo","Douro",309,"2025-01-29T06:58:00",24885384,"Em conclusão","2101","Incêndio em edifícios habitacionais",0,2,0,7,"2025-01-29T06:58:00","Vila Real","Vila Real","Norte",-7.795807,41.371657
24885491,"Taíde","Ave",309,"2025-01-29T07:31:00",24885491,"Em despacho","3301","Queda de árvore",0,1,0,2,"2025-01-29T07:31:00","Póvoa De Lanhoso","Braga","Norte",-8.230344,41.559405
24885507,"Pedroso e Seixezelo","Area M. Porto",309,"2025-01-29T07:39:00",24885507,"Em despacho","4331","Busca e resgate terrestre de animais",0,1,0,3,"2025-01-29T07:39:00","Vila Nova De Gaia","Porto","Norte",-8.55728,41.067659
24885428,"Vilar e Mosteiró","Area M. Porto",309,"2025-01-29T07:10:00",24885428,"Em conclusão","2407","Despiste",0,1,0,2,"2025-01-29T07:10:00","Vila Do Conde","Porto","Norte",-8.651313,41.285528
24885463,"Azurara","Area M. Porto",309,"2025-01-29T07:37:00",24885463,"Em despacho","2201","Incêndio em equipamentos ou produtos",0,1,0,2,"2025-01-29T07:37:00","Vila Do Conde","Porto","Norte",-8.74077,41.33914
24851780,"São Miguel, Santa Eufémia e Rabaçal","Região de Coimbra",310,"2025-01-21T23:25:00",24851780,"Em curso","3315","Inundação de estruturas por precipitação intensa",0,0,0,0,"2025-01-21T23:25:00","Penela","Coimbra","Centro",-8.399036,40.025502
24885370,"Lama","Cávado",309,"2025-01-29T06:42:00",24885370,"Em conclusão","2407","Despiste",0,7,0,21,"2025-01-29T06:42:00","Barcelos","Braga","Norte",-8.548932,41.572555
24885419,"Samora Correia","Lezíria do Tejo",311,"2025-01-29T07:17:00",24885419,"Em conclusão","2407","Despiste",0,5,0,13,"2025-01-29T07:17:00","Montijo","Setúbal","Área Metropolitana De Lisboa",-8.684018,38.752007
24885420,"Matosinhos e Leça da Palmeira","Area M. Porto",309,"2025-01-29T07:19:00",24885420,"Em curso","3315","Inundação de estruturas por precipitação intensa",0,1,0,2,"2025-01-29T07:19:00","Matosinhos","Porto","Norte",-8.683879,41.19629
24885423,"Cedofeita, Ildefonso, Sé, Miragaia, Nicolau e Vitória","Area M. Porto",309,"2025-01-29T07:20:00",24885423,"Em despacho","3321","Dano na rede de fornecimento de eletricidade ",0,0,0,0,"2025-01-29T07:20:00","Porto","Porto","Norte",-8.61864,41.15619
24885503,"Santa Joana","Região de Aveiro",310,"2025-01-29T07:44:00",24885503,"Em resolução","2401","Atropelamento rodoviário",0,3,0,8,"2025-01-29T07:44:00","Aveiro","Aveiro","Centro",-8.616608,40.631861
24885505,"Silva Escura e Dornelas","Região de Aveiro",310,"2025-01-29T07:47:00",24885505,"Em despacho","3321","Dano na rede de fornecimento de eletricidade ",0,1,0,2,"2025-01-29T07:47:00","Sever Do Vouga","Aveiro","Centro",-8.380649,40.763093
24885506,"Encarnação","Grande Lisboa",311,"2025-01-29T07:41:00",24885506,"Em despacho","3321","Dano na rede de fornecimento de eletricidade ",0,1,0,3,"2025-01-29T07:41:00","Mafra","Lisboa","Área Metropolitana De Lisboa",-9.410413,39.034355
24885538,"Sandim, Olival, Lever e Crestuma","Area M. Porto",309,"2025-01-29T07:59:00",24885538,"Em despacho","3301","Queda de árvore",0,1,0,2,"2025-01-29T07:59:00","Vila Nova De Gaia","Porto","Norte",-8.498367,41.063535
24884581,"Cernache do Bonjardim, Nesperal e Palhais","Beira Baixa",310,"2025-01-28T21:03:00",24884581,"Em curso","4327","Busca e resgate terrestre de pessoas",0,3,0,6,"2025-01-28T21:03:00","Sertã","Castelo Branco","Centro",-8.182161,39.815954
24885460,"Fânzeres e São Pedro da Cova","Area M. Porto",309,"2025-01-29T07:30:00",24885460,"Em despacho","2301","Incêndio em transporte rodoviário",0,1,0,4,"2025-01-29T07:30:00","Gondomar","Porto","Norte",-8.511531,41.155311
24885467,"Bonfim","Area M. Porto",309,"2025-01-29T07:17:00",24885467,"Em despacho","3315","Inundação de estruturas por precipitação intensa",0,1,0,4,"2025-01-29T07:17:00","Porto","Porto","Norte",-8.596119,41.151713
24885474,"Campanhã","Area M. Porto",309,"2025-01-29T07:18:00",24885474,"Em despacho","2201","Incêndio em equipamentos ou produtos",0,1,0,5,"2025-01-29T07:18:00","Porto","Porto","Norte",-8.575994,41.158637
24885501,"Igreja Nova e Cheleiros","Grande Lisboa",311,"2025-01-29T07:42:00",24885501,"Em curso","2403","Colisão rodoviária",0,4,0,12,"2025-01-29T07:42:00","Mafra","Lisboa","Área Metropolitana De Lisboa",-9.324495,38.915003
24885508,"Sandim, Olival, Lever e Crestuma","Area M. Porto",309,"2025-01-29T07:45:00",24885508,"Em despacho","3301","Queda de árvore",0,1,0,2,"2025-01-29T07:45:00","Vila Nova De Gaia","Porto","Norte",-8.476953,41.063601
