"id","address","subregion","neighborhood","date","id.1","state","nature","nature_description","aerial_means","terrestrial_means","aquatic_means","operational","date.1","Concelho","Distrito","NUTII_DSG","longitude","latitude"
24925940,"Moledo","Viseu Dão Lafões",310,"2025-02-07T06:20:00",24925940,"Em resolução","2127","Incêndio em edifícios e recintos industriais, oficinas e armazéns",0,5,0,15,"2025-02-07T06:20:00","Castro Daire","Viseu","Centro",-7.932827,40.814353
24926224,"Infias","Ave",309,"2025-02-07T08:37:00",24926224,"Em despacho","3301","Queda de árvore",0,2,0,3,"2025-02-07T08:37:00","Vizela","Braga","Norte",-8.31057,41.395982
24926510,"Cedofeita, Ildefonso, Sé, Miragaia, Nicolau e Vitória","Area M. Porto",309,"2025-02-07T09:28:00",24926510,"Em despacho","3311","Queda de elementos de estruturas edificados",0,1,0,5,"2025-02-07T09:28:00","Porto","Porto","Norte",-8.615939,41.15359
24926644,"Sé Nova, Santa Cruz, Almedina e São Bartolomeu","Região de Coimbra",310,"2025-02-07T09:54:00",24926644,"Em despacho","2407","Despiste",0,1,0,2,"2025-02-07T09:54:00","Coimbra","Coimbra","Centro",-8.437288,40.221746
24926658,"S.maria, S.miguel, S.martinho, S.pedro Penaferrim","Grande Lisboa",311,"2025-02-07T10:01:00",24926658,"Em conclusão","2301","Incêndio em transporte rodoviário",0,4,0,11,"2025-02-07T10:01:00","Sintra","Lisboa","Área Metropolitana De Lisboa",-9.393304,38.794377
24926661,"Ermesinde","Area M. Porto",309,"2025-02-07T09:47:00",24926661,"Em conclusão","2301","Incêndio em transporte rodoviário",0,1,0,2,"2025-02-07T09:47:00","Valongo","Porto","Norte",-8.549319,41.21602
24926338,"Chamusca e Pinheiro Grande","Lezíria do Tejo",311,"2025-02-07T09:02:00",24926338,"Em conclusão","2403","Colisão rodoviária",0,2,0,4,"2025-02-07T09:02:00","Chamusca","Santarém","Alentejo",-8.4541,39.380728
24926411,"Almada, Cova da Piedade, Pragal e Cacilhas","Península de Setúbal",311,"2025-02-07T09:10:00",24926411,"Em conclusão","2403","Colisão rodoviária",0,3,0,10,"2025-02-07T09:10:00","Almada","Setúbal","Área Metropolitana De Lisboa",-9.164498,38.675268
24926506,"Laranjeiro e Feijó","Península de Setúbal",311,"2025-02-07T09:35:00",24926506,"Em resolução","2403","Colisão rodoviária",0,3,0,8,"2025-02-07T09:35:00","Almada","Setúbal","Área Metropolitana De Lisboa",-9.16603,38.65458
24926554,"Gafanha da Nazaré","Região de Aveiro",310,"2025-02-07T09:40:00",24926554,"Em conclusão","2407","Despiste",0,3,0,9,"2025-02-07T09:40:00","Ílhavo","Aveiro","Centro",-8.719411,40.633995
24926590,"Queluz e Belas","Grande Lisboa",311,"2025-02-07T09:47:00",24926590,"Em despacho","4335","Prevenção a queimadas",0,1,0,3,"2025-02-07T09:47:00","Sintra","Lisboa","Área Metropolitana De Lisboa",-9.27166710458797,38.786881174273
24926049,"Santa Iria de Azoia, São João da Talha e Bobadela","Grande Lisboa",311,"2025-02-07T07:26:00",24926049,"Em curso","2201","Incêndio em equipamentos ou produtos",0,2,0,6,"2025-02-07T07:26:00","Loures","Lisboa","Área Metropolitana De Lisboa",-9.093217,38.806807
24926198,"Portimão","Algarve",313,"2025-02-07T08:29:00",24926198,"Em conclusão","2101","Incêndio em edifícios habitacionais",0,8,0,18,"2025-02-07T08:29:00","Portimão","Faro","Algarve",-8.541412,37.183837
24926398,"Serrazes","Viseu Dão Lafões",310,"2025-02-07T09:13:00",24926398,"Em despacho","4339","Corte ou remoção de elementos",0,4,0,9,"2025-02-07T09:13:00","São Pedro Do Sul","Viseu","Centro",-8.108261,40.745348
24926465,"Praia do Ribatejo","Médio Tejo",311,"2025-02-07T09:27:00",24926465,"Em resolução","3313","Deslizamento de terras",0,1,0,4,"2025-02-07T09:27:00","Vila Nova Da Barquinha","Santarém","Centro",-8.340015,39.472785
24926517,"Arcozelo","Area M. Porto",309,"2025-02-07T09:35:00",24926517,"Em despacho","3301","Queda de árvore",0,1,0,4,"2025-02-07T09:35:00","Vila Nova De Gaia","Porto","Norte",-8.640388,41.056331
24926534,"São Martinho do Bispo e Ribeira de Frades","Região de Coimbra",310,"2025-02-07T09:41:00",24926534,"Em curso","3301","Queda de árvore",0,2,0,4,"2025-02-07T09:41:00","Coimbra","Coimbra","Centro",-8.487837,40.206282
24926700,"Alvega e Concavada","Médio Tejo",311,"2025-02-07T10:13:00",24926700,"Em despacho","3313","Deslizamento de terras",0,1,0,2,"2025-02-07T10:13:00","Abrantes","Santarém","Centro",-8.009964,39.444825
24877003,"Malagueira e Horta Das Figueiras","Alentejo Central",312,"2025-01-27T11:41:00",24877003,"Em conclusão","3315","Inundação de estruturas por precipitação intensa",0,0,0,0,"2025-01-27T11:41:00","Évora","Évora","Alentejo",-7.924277,38.57285
24912072,"Romeira e Várzea","Lezíria do Tejo",311,"2025-02-04T01:22:00",24912072,"Em conclusão","2127","Incêndio em edifícios e recintos industriais, oficinas e armazéns",0,1,0,1,"2025-02-04T01:22:00","Santarém","Santarém","Alentejo",-8.714057,39.254832
24926244,"Baixa da Banheira e Vale da Amoreira","Península de Setúbal",311,"2025-02-07T08:40:00",24926244,"Em curso","4331","Busca e resgate terrestre de animais",0,2,0,7,"2025-02-07T08:40:00","Moita","Setúbal","Área Metropolitana De Lisboa",-9.043028,38.662183
24926364,"Seia, São Romão e Lapa Dos Dinheiros","Beiras e Serra da Estrela",310,"2025-02-07T09:03:00",24926364,"Em conclusão","2403","Colisão rodoviária",0,2,0,4,"2025-02-07T09:03:00","Seia","Guarda","Centro",-7.706962,40.416913
24926421,"Cacém e São Marcos","Grande Lisboa",311,"2025-02-07T09:10:00",24926421,"Em conclusão","2407","Despiste",0,1,0,2,"2025-02-07T09:10:00","Sintra","Lisboa","Área Metropolitana De Lisboa",-9.316991,38.764218
24926571,"Alto do Seixalinho, Santo André e Verderena","Península de Setúbal",311,"2025-02-07T09:42:00",24926571,"Em curso","2515","Fuga de gás em garrafa",0,2,0,7,"2025-02-07T09:42:00","Barreiro","Setúbal","Área Metropolitana De Lisboa",-9.072252,38.651508
24926628,"Moscavide e Portela","Grande Lisboa",311,"2025-02-07T10:05:00",24926628,"Em despacho","2403","Colisão rodoviária",0,3,0,9,"2025-02-07T10:05:00","Loures","Lisboa","Área Metropolitana De Lisboa",-9.109504,38.781924
24926664,"Caranguejeira","Região de Leiria",310,"2025-02-07T10:02:00",24926664,"Em despacho","2403","Colisão rodoviária",0,1,0,3,"2025-02-07T10:02:00","Leiria","Leiria","Centro",-8.713996,39.729844
