"id","address","subregion","neighborhood","date","id.1","state","nature","nature_description","aerial_means","terrestrial_means","aquatic_means","operational","date.1","Concelho","Distrito","NUTII_DSG","longitude","latitude"
24636788,"Camarate, Unhos e Apelação","Grande Lisboa",311,"2024-12-04T22:50:00",24636788,"Em curso","3325","Dano na rede de abastecimento de gás",0,0,0,0,"2024-12-04T22:50:00","Loures","Lisboa","Área Metropolitana De Lisboa",-9.14896,38.79757
24636018,"Covelas","Ave",309,"2024-12-04T18:28:00",24636018,"Em conclusão","2403","Colisão rodoviária",0,1,0,2,"2024-12-04T18:28:00","Braga","Braga","Norte",-8.34559,41.591478
24636854,"Oliveira, São Paio e São Sebastião","Ave",309,"2024-12-04T23:15:00",24636854,"Em despacho","2407","Despiste",0,3,0,6,"2024-12-04T23:15:00","Guimarães","Braga","Norte",-8.29239,41.444174
24636879,"Santa Iria de Azoia, São João da Talha e Bobadela","Grande Lisboa",311,"2024-12-04T23:39:00",24636879,"Em despacho","4331","Busca e resgate terrestre de animais",0,1,0,5,"2024-12-04T23:39:00","Loures","Lisboa","Área Metropolitana De Lisboa",-9.090295,38.846465
24627884,"Souselas e Botão","Região de Coimbra",310,"2024-12-02T21:32:00",24627884,"Em conclusão","2127","Incêndio em edifícios e recintos industriais, oficinas e armazéns",0,6,0,17,"2024-12-02T21:32:00","Coimbra","Coimbra","Centro",-8.44389,40.28278
24636601,"Malagueira e Horta Das Figueiras","Alentejo Central",312,"2024-12-04T21:25:00",24636601,"Em resolução","3301","Queda de árvore",0,5,0,9,"2024-12-04T21:25:00","Évora","Évora","Alentejo",-7.92285,38.575943
24636701,"Arrouquelas","Lezíria do Tejo",311,"2024-12-04T22:13:00",24636701,"Em conclusão","2101","Incêndio em edifícios habitacionais",0,4,0,10,"2024-12-04T22:13:00","Rio Maior","Santarém","Alentejo",-8.897198,39.256268
24636853,"Cascais e Estoril","Grande Lisboa",311,"2024-12-04T23:11:00",24636853,"Em curso","2407","Despiste",0,3,0,10,"2024-12-04T23:11:00","Cascais","Lisboa","Área Metropolitana De Lisboa",-9.398759,38.70391
24636499,"Vila do Bispo e Raposeira","Algarve",313,"2024-12-04T20:54:00",24636499,"Em conclusão","2101","Incêndio em edifícios habitacionais",0,4,0,7,"2024-12-04T20:54:00","Vila Do Bispo","Faro","Algarve",-8.875151,37.06599
