"id","address","subregion","neighborhood","date","id.1","state","nature","nature_description","aerial_means","terrestrial_means","aquatic_means","operational","date.1","Concelho","Distrito","NUTII_DSG","longitude","latitude"
24460263,"Assunção","Alto Alentejo",312,"2024-10-25T07:30:00",24460263,"Em conclusão","2407","Despiste",0,4,0,8,"2024-10-25T07:30:00","Arronches","Portalegre","Alentejo",-7.240158,39.141383
24460299,"Queluz e Belas","Grande Lisboa",311,"2024-10-25T07:34:00",24460299,"Em curso","2403","Colisão rodoviária",0,2,0,7,"2024-10-25T07:34:00","Sintra","Lisboa","Área Metropolitana De Lisboa",-9.253541,38.753134
24460187,"Cruz","Ave",309,"2024-10-25T06:37:00",24460187,"Em resolução","2407","Despiste",0,5,0,10,"2024-10-25T06:37:00","Vila Nova De Famalicão","Braga","Norte",-8.486558,41.454242
24460307,"S.maria, S.miguel, S.martinho, S.pedro Penaferrim","Grande Lisboa",311,"2024-10-25T07:45:00",24460307,"Em resolução","2403","Colisão rodoviária",0,2,0,7,"2024-10-25T07:45:00","Sintra","Lisboa","Área Metropolitana De Lisboa",-9.366763,38.781718
24460324,"Sacavém e Prior Velho","Grande Lisboa",311,"2024-10-25T07:56:00",24460324,"Em despacho","2403","Colisão rodoviária",0,1,0,2,"2024-10-25T07:56:00","Lisboa","Lisboa","Área Metropolitana De Lisboa",-9.097627,38.792359
24460341,"Sacavém e Prior Velho","Grande Lisboa",311,"2024-10-25T07:55:00",24460341,"Em despacho","2401","Atropelamento rodoviário",0,2,0,4,"2024-10-25T07:55:00","Lisboa","Lisboa","Área Metropolitana De Lisboa",-9.097627,38.792359
24460194,"S.julião, N.s. da Anunciada e S. Maria da Graça","Península de Setúbal",311,"2024-10-25T06:53:00",24460194,"Em despacho","3317","Inundação de estruturas por água canalizada",0,1,0,5,"2024-10-25T06:53:00","Setúbal","Setúbal","Área Metropolitana De Lisboa",-8.89444,38.53818
24460310,"Queluz e Belas","Grande Lisboa",311,"2024-10-25T07:38:00",24460310,"Em conclusão","2403","Colisão rodoviária",0,2,0,7,"2024-10-25T07:38:00","Sintra","Lisboa","Área Metropolitana De Lisboa",-9.253541,38.753134
24360487,"Mões","Viseu Dão Lafões",310,"2024-10-03T08:00:00",24360487,"Em curso","4339","Corte ou remoção de elementos",0,1,0,1,"2024-10-03T08:00:00","Castro Daire","Viseu","Centro",-7.893519,40.867571
24451451,"Sul","Viseu Dão Lafões",310,"2024-10-23T08:10:00",24451451,"Em curso","4339","Corte ou remoção de elementos",0,1,0,2,"2024-10-23T08:10:00","São Pedro Do Sul","Viseu","Centro",-8.050962,40.841282
24460302,"Serpa (Salvador e Santa Maria)","Baixo Alentejo",312,"2024-10-25T07:50:00",24460302,"Em despacho","2301","Incêndio em transporte rodoviário",0,1,0,4,"2024-10-25T07:50:00","Serpa","Beja","Alentejo",-7.59177,37.94089
24460336,"Pinhal Novo","Península de Setúbal",311,"2024-10-25T07:55:00",24460336,"Em despacho","3111","Queima",0,1,0,5,"2024-10-25T07:55:00","Palmela","Setúbal","Área Metropolitana De Lisboa",-8.91294,38.637902
