"id","address","subregion","neighborhood","date","id.1","state","nature","nature_description","aerial_means","terrestrial_means","aquatic_means","operational","date.1","Concelho","Distrito","NUTII_DSG","longitude","latitude"
25071496,"São Manços e São Vicente do Pigeiro","Alentejo Central",312,"2025-03-11T13:18:00",25071496,"Em conclusão","1101","Cheia",0,0,0,0,"2025-03-11T13:18:00","Évora","Évora","Alentejo",-7.713313,38.513673
25438057,"Santo Agostinho e São João Baptista e Santo Amador","Baixo Alentejo",312,"2025-05-27T23:30:00",25438057,"Em conclusão","2407","Despiste",0,2,0,4,"2025-05-27T23:30:00","Moura","Beja","Alentejo",-7.524443,38.129842
25438189,"Faro (Sé e São Pedro)","Algarve",313,"2025-05-28T00:46:00",25438189,"Em conclusão","2201","Incêndio em equipamentos ou produtos",0,4,0,9,"2025-05-28T00:46:00","Faro","Faro","Algarve",-7.91988,37.01511
25438289,"Santa Marta de Portuzelo","Alto Minho",309,"2025-05-28T02:09:00",25438289,"Em despacho","2101","Incêndio em edifícios habitacionais",0,1,0,4,"2025-05-28T02:09:00","Viana Do Castelo","Viana Do Castelo","Norte",-8.76542,41.70426
25436571,"Nossa Senhora Das Misericórdias","Médio Tejo",311,"2025-05-27T16:47:00",25436571,"Em conclusão","3101","Incêndio rural",0,1,0,5,"2025-05-27T16:47:00","Ourém","Santarém","Centro",-8.578222,39.646628
25438217,"Areias, Sequeiró, Lama e Palmeira","Area M. Porto",309,"2025-05-28T00:58:00",25438217,"Em conclusão","2201","Incêndio em equipamentos ou produtos",0,1,0,5,"2025-05-28T00:58:00","Santo Tirso","Porto","Norte",-8.45822,41.36327
