"id","address","subregion","neighborhood","date","id.1","state","nature","nature_description","aerial_means","terrestrial_means","aquatic_means","operational","date.1","Concelho","Distrito","NUTII_DSG","longitude","latitude"
25366291,"Matosinhos e Leça da Palmeira","Area M. Porto",309,"2025-05-12T23:59:00",25366291,"Em curso","9115","Operação nacional de assistência",0,1,0,5,"2025-05-12T23:59:00","Matosinhos","Porto","Norte",-8.682603,41.186161
25374599,"Azeitão (São Lourenço e São Simão)","Península de Setúbal",311,"2025-05-14T21:12:00",25374599,"Em despacho","4331","Busca e resgate terrestre de animais",0,1,0,5,"2025-05-14T21:12:00","Setúbal","Setúbal","Área Metropolitana De Lisboa",-9.008871,38.513402
25071496,"São Manços e São Vicente do Pigeiro","Alentejo Central",312,"2025-03-11T13:18:00",25071496,"Em conclusão","1101","Cheia",0,0,0,0,"2025-03-11T13:18:00","Évora","Évora","Alentejo",-7.713313,38.513673
25373810,"Famalicão","Oeste",311,"2025-05-14T17:44:00",25373810,"Em conclusão","2407","Despiste",1,7,0,18,"2025-05-14T17:44:00","Nazaré","Leiria","Centro",-9.068462,39.536377
25374143,"Azueira e Sobral da Abelheira","Grande Lisboa",311,"2025-05-14T19:06:00",25374143,"Em conclusão","2301","Incêndio em transporte rodoviário",0,0,0,0,"2025-05-14T19:06:00","Mafra","Lisboa","Área Metropolitana De Lisboa",-9.3334,38.99027
25374346,"Urqueira","Médio Tejo",311,"2025-05-14T20:04:00",25374346,"Em conclusão","2407","Despiste",0,4,0,8,"2025-05-14T20:04:00","Ourém","Santarém","Centro",-8.564491,39.721957
25374647,"Fermentelos","Região de Aveiro",310,"2025-05-14T21:32:00",25374647,"Em curso","3111","Queima",0,1,0,5,"2025-05-14T21:32:00","Águeda","Aveiro","Centro",-8.533996,40.56073
25374661,"Cativelos","Beiras e Serra da Estrela",310,"2025-05-14T21:30:00",25374661,"Em conclusão","4329","Busca e resgate aquático de pessoas",0,4,0,12,"2025-05-14T21:30:00","Gouveia","Guarda","Centro",-7.705822,40.540149
25374727,"Creixomil","Ave",309,"2025-05-14T21:55:00",25374727,"Em despacho","4331","Busca e resgate terrestre de animais",0,1,0,2,"2025-05-14T21:55:00","Guimarães","Braga","Norte",-8.312208,41.438348
25374730,"Ramalde","Area M. Porto",309,"2025-05-14T21:47:00",25374730,"Em despacho","4331","Busca e resgate terrestre de animais",0,1,0,5,"2025-05-14T21:47:00","Porto","Porto","Norte",-8.642922,41.17139
25374736,"Faro (Sé e São Pedro)","Algarve",313,"2025-05-14T22:04:00",25374736,"Em curso","2101","Incêndio em edifícios habitacionais",0,3,0,9,"2025-05-14T22:04:00","Faro","Faro","Algarve",-7.92453,37.01263
25374755,"Sandim, Olival, Lever e Crestuma","Area M. Porto",309,"2025-05-14T22:10:00",25374755,"Em despacho","3103","Incêndio rural",0,1,0,2,"2025-05-14T22:10:00","Vila Nova De Gaia","Porto","Norte",-8.49637,41.04678
25374771,"Baixa da Banheira e Vale da Amoreira","Península de Setúbal",311,"2025-05-14T22:11:00",25374771,"Em despacho","2201","Incêndio em equipamentos ou produtos",0,1,0,4,"2025-05-14T22:11:00","Moita","Setúbal","Área Metropolitana De Lisboa",-9.043028,38.662183
25374430,"Almancil","Algarve",313,"2025-05-14T20:28:00",25374430,"Em conclusão","2127","Incêndio em edifícios e recintos industriais, oficinas e armazéns",0,5,0,12,"2025-05-14T20:28:00","Loulé","Faro","Algarve",-8.02027,37.03395
25374614,"Laundos","Area M. Porto",309,"2025-05-14T21:12:00",25374614,"Em conclusão","2403","Colisão rodoviária",0,3,0,5,"2025-05-14T21:12:00","Póvoa De Varzim","Porto","Norte",-8.743636,41.432634
25374743,"Sé e São Lourenço","Alto Alentejo",312,"2025-05-14T22:04:00",25374743,"Em resolução","2401","Atropelamento rodoviário",0,4,0,9,"2025-05-14T22:04:00","Portalegre","Portalegre","Alentejo",-7.432243,39.300138
25374750,"Creixomil","Ave",309,"2025-05-14T22:09:00",25374750,"Em despacho","3201","Detritos não confinados",0,2,0,7,"2025-05-14T22:09:00","Guimarães","Braga","Norte",-8.302351,41.43961
25374768,"N. S. da Vila, N. S. do Bispo e Silveiras","Alentejo Central",312,"2025-05-14T22:09:00",25374768,"Em despacho","2101","Incêndio em edifícios habitacionais",0,3,0,8,"2025-05-14T22:09:00","Montemor-o-Novo","Évora","Alentejo",-8.221533,38.643177
