"id","address","subregion","neighborhood","date","id.1","state","nature","nature_description","aerial_means","terrestrial_means","aquatic_means","operational","date.1","Concelho","Distrito","NUTII_DSG","longitude","latitude"
24756148,"Barrô e Aguada de Baixo","Região de Aveiro",310,"2024-12-31T21:11:00",24756148,"Em despacho","2407","Despiste",0,1,0,2,"2024-12-31T21:11:00","Águeda","Aveiro","Centro",-8.467136,40.533244
24755794,"Souto da Carpalhosa e Ortigosa","Região de Leiria",310,"2024-12-31T19:02:00",24755794,"Em conclusão","3103","Incêndio rural",0,1,0,1,"2024-12-31T19:02:00","Leiria","Leiria","Centro",-8.837503,39.830931
24756003,"São Pedro do Sul, Várzea e Baiões","Viseu Dão Lafões",310,"2024-12-31T20:20:00",24756003,"Em resolução","2101","Incêndio em edifícios habitacionais",0,8,0,20,"2024-12-31T20:20:00","São Pedro Do Sul","Viseu","Centro",-8.067856,40.756654
24756121,"Margaride (Santa Eulália), Várzea, Lagares, Varziela e Moure","Tâmega e Sousa",309,"2024-12-31T20:55:00",24756121,"Em despacho","2101","Incêndio em edifícios habitacionais",0,1,0,4,"2024-12-31T20:55:00","Felgueiras","Porto","Norte",-8.203814,41.358592
24755672,"Santa Maria Maior e Monserrate e Meadela","Alto Minho",309,"2024-12-31T18:28:00",24755672,"Em conclusão","2101","Incêndio em edifícios habitacionais",0,4,0,10,"2024-12-31T18:28:00","Viana Do Castelo","Viana Do Castelo","Norte",-8.826408,41.704552
24756040,"Santa Maria da Feira, Travanca, Sanfins e Espargo","Area M. Porto",309,"2024-12-31T19:54:00",24756040,"Em despacho","4331","Busca e resgate terrestre de animais",0,1,0,2,"2024-12-31T19:54:00","Santa Maria Da Feira","Aveiro","Norte",-8.555837,40.9255
24756043,"São João Baptista","Alto Alentejo",312,"2024-12-31T20:37:00",24756043,"Em conclusão","2101","Incêndio em edifícios habitacionais",0,6,0,15,"2024-12-31T20:37:00","Campo Maior","Portalegre","Alentejo",-7.067403,39.017057
24756060,"O. Azeméis, Riba-Ul, Ul, Macinhata Seixa, Madail","Area M. Porto",309,"2024-12-31T20:44:00",24756060,"Em conclusão","2101","Incêndio em edifícios habitacionais",0,3,0,8,"2024-12-31T20:44:00","Oliveira De Azeméis","Aveiro","Norte",-8.489222,40.815425
24756074,"Matosinhos e Leça da Palmeira","Area M. Porto",309,"2024-12-31T20:47:00",24756074,"Em conclusão","2101","Incêndio em edifícios habitacionais",0,3,0,8,"2024-12-31T20:47:00","Matosinhos","Porto","Norte",-8.682603,41.186161
24755911,"Olho Marinho","Oeste",311,"2024-12-31T19:50:00",24755911,"Em conclusão","3111","Queima",0,1,0,5,"2024-12-31T19:50:00","Óbidos","Leiria","Centro",-9.214965,39.335778
24755947,"Bordeira","Algarve",313,"2024-12-31T20:02:00",24755947,"Em conclusão","3111","Queima",0,2,0,8,"2024-12-31T20:02:00","Aljezur","Faro","Algarve",-8.85917,37.16833
24755995,"Beja (Santiago Maior e São João Baptista)","Baixo Alentejo",312,"2024-12-31T20:10:00",24755995,"Em resolução","3103","Incêndio rural",0,4,0,13,"2024-12-31T20:10:00","Beja","Beja","Alentejo",-7.893835,38.035233
24756002,"Pedrógão Pequeno","Beira Baixa",310,"2024-12-31T20:20:00",24756002,"Em conclusão","2101","Incêndio em edifícios habitacionais",0,2,0,7,"2024-12-31T20:20:00","Sertã","Castelo Branco","Centro",-8.135928,39.898657
24756004,"Póvoa de Santa Iria e Forte da Casa","Grande Lisboa",311,"2024-12-31T20:15:00",24756004,"Em resolução","2407","Despiste",0,1,0,2,"2024-12-31T20:15:00","Vila Franca De Xira","Lisboa","Área Metropolitana De Lisboa",-9.051508,38.875602
24756056,"São Pedro de Tomar","Médio Tejo",311,"2024-12-31T20:42:00",24756056,"Em despacho","4331","Busca e resgate terrestre de animais",0,2,0,4,"2024-12-31T20:42:00","Tomar","Santarém","Centro",-8.340195,39.550083
24756131,"Portimão","Algarve",313,"2024-12-31T21:12:00",24756131,"Em despacho","2101","Incêndio em edifícios habitacionais",0,1,0,5,"2024-12-31T21:12:00","Portimão","Faro","Algarve",-8.53929,37.12015
