"id","address","subregion","neighborhood","date","id.1","state","nature","nature_description","aerial_means","terrestrial_means","aquatic_means","operational","date.1","Concelho","Distrito","NUTII_DSG","longitude","latitude","state_2"
26278163,"Santa Maria Maior e Monserrate e Meadela","Alto Minho",309,"2025-11-13T10:15:00",26278163,"Em Curso","3315","Inundação de estruturas por precipitação intensa",0,1,0,2,"2025-11-13T10:15:00","Viana Do Castelo","Viana Do Castelo","Norte",-8.837157,41.690707,"Curso"
26308603,"Sacavém e Prior Velho","Grande Lisboa",311,"2025-11-19T03:18:00",26308603,"Em Curso","2407","Despiste",0,7,0,24,"2025-11-19T03:18:00","Lisboa","Lisboa","Área Metropolitana De Lisboa",-9.097627,38.792359,"Curso"
26308701,"Marvila","Grande Lisboa",311,"2025-11-19T04:57:00",26308701,"Em Despacho","3325","Dano na rede de abastecimento de gás",0,1,0,2,"2025-11-19T04:57:00","Lisboa","Lisboa","Área Metropolitana De Lisboa",-9.112127,38.742646,"Despacho"
26308776,"Nossa Senhora da Conceição, São Pedro e São Dinis","Douro",309,"2025-11-19T06:30:00",26308776,"Em Despacho","2101","Incêndio em edifícios habitacionais",0,3,0,8,"2025-11-19T06:30:00","Vila Real","Vila Real","Norte",-7.735278,41.295,"Despacho"
26308759,"Santa Marinha","Area M. Porto",309,"2025-11-19T05:58:00",26308759,"Em Despacho","2127","Incêndio em edifícios e recintos industriais, oficinas e armazéns",0,1,0,2,"2025-11-19T05:58:00","Vila Nova De Gaia","Porto","Norte",-8.621937,41.131065,"Despacho"
26308784,"Cascais e Estoril","Grande Lisboa",311,"2025-11-19T06:28:00",26308784,"Em Despacho","3317","Inundação de estruturas por água canalizada",0,1,0,5,"2025-11-19T06:28:00","Cascais","Lisboa","Área Metropolitana De Lisboa",-9.419397,38.700982,"Despacho"
