"id","address","subregion","neighborhood","date","id.1","state","nature","nature_description","aerial_means","terrestrial_means","aquatic_means","operational","date.1","Concelho","Distrito","NUTII_DSG","longitude","latitude"
24877003,"Malagueira e Horta Das Figueiras","Alentejo Central",312,"2025-01-27T11:41:00",24877003,"Em conclusão","3315","Inundação de estruturas por precipitação intensa",0,0,0,0,"2025-01-27T11:41:00","Évora","Évora","Alentejo",-7.924277,38.57285
24943703,"Refóios do Lima","Alto Minho",309,"2025-02-11T06:40:00",24943703,"Em resolução","2407","Despiste",0,3,0,7,"2025-02-11T06:40:00","Ponte De Lima","Viana Do Castelo","Norte",-8.54672,41.796917
24943837,"Cacém e São Marcos","Grande Lisboa",311,"2025-02-11T07:45:00",24943837,"Em conclusão","2201","Incêndio em equipamentos ou produtos",0,1,0,4,"2025-02-11T07:45:00","Sintra","Lisboa","Área Metropolitana De Lisboa",-9.316991,38.764218
24943926,"Almada, Cova da Piedade, Pragal e Cacilhas","Península de Setúbal",311,"2025-02-11T08:10:00",24943926,"Em conclusão","2401","Atropelamento rodoviário",0,3,0,7,"2025-02-11T08:10:00","Almada","Setúbal","Área Metropolitana De Lisboa",-9.173069,38.677312
24943996,"Sé, Santa Maria e Meixedo","Terras de Trás-os-Montes",309,"2025-02-11T08:31:00",24943996,"Em curso","2403","Colisão rodoviária",0,4,0,7,"2025-02-11T08:31:00","Bragança","Bragança","Norte",-6.761223,41.813164
24944019,"Póvoa de Santa Iria e Forte da Casa","Grande Lisboa",311,"2025-02-11T08:37:00",24944019,"Em despacho","2403","Colisão rodoviária",0,0,0,0,"2025-02-11T08:37:00","Vila Franca De Xira","Lisboa","Área Metropolitana De Lisboa",-9.080109,38.86006
24943886,"Rio Maior","Lezíria do Tejo",311,"2025-02-11T08:04:00",24943886,"Em resolução","2403","Colisão rodoviária",0,4,0,10,"2025-02-11T08:04:00","Rio Maior","Santarém","Alentejo",-8.921023,39.314835
24943927,"Palmela","Península de Setúbal",311,"2025-02-11T08:14:00",24943927,"Em resolução","2407","Despiste",0,3,0,6,"2025-02-11T08:14:00","Palmela","Setúbal","Área Metropolitana De Lisboa",-8.86819,38.58094
24943929,"Gulpilhares e Valadares","Area M. Porto",309,"2025-02-11T08:05:00",24943929,"Em despacho","4331","Busca e resgate terrestre de animais",0,1,0,3,"2025-02-11T08:05:00","Vila Nova De Gaia","Porto","Norte",-8.654425,41.089946
24944002,"Matosinhos e Leça da Palmeira","Area M. Porto",309,"2025-02-11T08:29:00",24944002,"Em despacho","3111","Queima",0,1,0,3,"2025-02-11T08:29:00","Matosinhos","Porto","Norte",-8.682603,41.186161
24944029,"Monchique","Algarve",313,"2025-02-11T08:30:00",24944029,"Em curso","3311","Queda de elementos de estruturas edificados",0,1,0,3,"2025-02-11T08:30:00","Monchique","Faro","Algarve",-8.567422,37.320753
24943839,"Modivas","Area M. Porto",309,"2025-02-11T07:44:00",24943839,"Em resolução","2127","Incêndio em edifícios e recintos industriais, oficinas e armazéns",0,2,0,8,"2025-02-11T07:44:00","Vila Do Conde","Porto","Norte",-8.696705,41.299678
24943907,"Costa da Caparica","Península de Setúbal",311,"2025-02-11T08:08:00",24943907,"Em conclusão","2201","Incêndio em equipamentos ou produtos",0,3,0,9,"2025-02-11T08:08:00","Almada","Setúbal","Área Metropolitana De Lisboa",-9.23031,38.63638
24943975,"Gâmbia-Pontes-Alto da Guerra","Península de Setúbal",311,"2025-02-11T08:27:00",24943975,"Em despacho","3321","Dano na rede de fornecimento de eletricidade ",0,1,0,5,"2025-02-11T08:27:00","Setúbal","Setúbal","Área Metropolitana De Lisboa",-8.78939,38.547536
24944007,"Vila Nova de Tazem","Beiras e Serra da Estrela",310,"2025-02-11T08:31:00",24944007,"Em despacho","3301","Queda de árvore",0,2,0,5,"2025-02-11T08:31:00","Gouveia","Guarda","Centro",-7.716662,40.505068
24944058,"Alcabideche","Grande Lisboa",311,"2025-02-11T08:36:00",24944058,"Em despacho","3315","Inundação de estruturas por precipitação intensa",0,1,0,5,"2025-02-11T08:36:00","Cascais","Lisboa","Área Metropolitana De Lisboa",-9.385597,38.740082
24941257,"Vimieiro","Alentejo Central",312,"2025-02-10T14:50:00",24941257,"Em curso","4329","Busca e resgate aquático de pessoas",0,3,0,7,"2025-02-10T14:50:00","Arraiolos","Évora","Alentejo",-7.837248,38.82704
24943730,"Galegos","Tâmega e Sousa",309,"2025-02-11T06:52:00",24943730,"Em conclusão","2101","Incêndio em edifícios habitacionais",0,0,0,0,"2025-02-11T06:52:00","Penafiel","Porto","Norte",-8.295158,41.16354
24943863,"São Domingos de Rana","Grande Lisboa",311,"2025-02-11T07:51:00",24943863,"Em conclusão","2407","Despiste",0,3,0,7,"2025-02-11T07:51:00","Cascais","Lisboa","Área Metropolitana De Lisboa",-9.347651,38.740483
24943881,"Setúbal (São Sebastião)","Península de Setúbal",311,"2025-02-11T08:00:00",24943881,"Em curso","2401","Atropelamento rodoviário",0,1,0,2,"2025-02-11T08:00:00","Setúbal","Setúbal","Área Metropolitana De Lisboa",-8.862337,38.527365
24943897,"Santa Iria de Azoia, São João da Talha e Bobadela","Grande Lisboa",311,"2025-02-11T08:03:00",24943897,"Em conclusão","2403","Colisão rodoviária",0,3,0,9,"2025-02-11T08:03:00","Loures","Lisboa","Área Metropolitana De Lisboa",-9.098065,38.824783
