"id","address","subregion","neighborhood","date","id.1","state","nature","nature_description","aerial_means","terrestrial_means","aquatic_means","operational","date.1","Concelho","Distrito","NUTII_DSG","longitude","latitude"
24904447,"Penafiel","Tâmega e Sousa",309,"2025-02-02T09:17:00",24904447,"Em conclusão","2407","Despiste",0,6,0,13,"2025-02-02T09:17:00","Penafiel","Porto","Norte",-8.273828,41.209
24851780,"São Miguel, Santa Eufémia e Rabaçal","Região de Coimbra",310,"2025-01-21T23:25:00",24851780,"Em curso","3315","Inundação de estruturas por precipitação intensa",0,0,0,0,"2025-01-21T23:25:00","Penela","Coimbra","Centro",-8.399036,40.025502
24904407,"Nogueira da Regedoura","Area M. Porto",309,"2025-02-02T08:56:00",24904407,"Em despacho","4331","Busca e resgate terrestre de animais",0,1,0,2,"2025-02-02T08:56:00","Santa Maria Da Feira","Aveiro","Norte",-8.588364,41.002884
24877003,"Malagueira e Horta Das Figueiras","Alentejo Central",312,"2025-01-27T11:41:00",24877003,"Em conclusão","3315","Inundação de estruturas por precipitação intensa",0,0,0,0,"2025-01-27T11:41:00","Évora","Évora","Alentejo",-7.924277,38.57285
24901885,"Colares","Grande Lisboa",311,"2025-02-01T15:33:00",24901885,"Em curso","4327","Busca e resgate terrestre de pessoas",0,5,0,16,"2025-02-01T15:33:00","Sintra","Lisboa","Área Metropolitana De Lisboa",-9.498875,38.780347
24903766,"Válega","Região de Aveiro",310,"2025-02-02T02:06:00",24903766,"Em conclusão","2201","Incêndio em equipamentos ou produtos",0,0,0,0,"2025-02-02T02:06:00","Ovar","Aveiro","Centro",-8.583651,40.834515
24904075,"S.pedro e Santiago, S.maria e S.miguel e Matacães","Oeste",311,"2025-02-02T06:47:00",24904075,"Em curso","3321","Dano na rede de fornecimento de eletricidade ",0,2,0,4,"2025-02-02T06:47:00","Torres Vedras","Lisboa","Centro",-9.251952,39.091829
24904384,"Santo António da Charneca","Península de Setúbal",311,"2025-02-02T09:04:00",24904384,"Em conclusão","3203","Detritos confinados",0,1,0,5,"2025-02-02T09:04:00","Barreiro","Setúbal","Área Metropolitana De Lisboa",-9.037395,38.63585
24904103,"Melo e Nabais","Beiras e Serra da Estrela",310,"2025-02-02T07:05:00",24904103,"Em conclusão","2407","Despiste",0,1,0,2,"2025-02-02T07:05:00","Gouveia","Guarda","Centro",-7.553315,40.535077
24904226,"Turiz","Cávado",309,"2025-02-02T08:10:00",24904226,"Em conclusão","2407","Despiste",0,2,0,4,"2025-02-02T08:10:00","Vila Verde","Braga","Norte",-8.435183,41.627392
24904326,"Igreja Nova do Sobral","Médio Tejo",311,"2025-02-02T08:49:00",24904326,"Em conclusão","2407","Despiste",0,2,0,4,"2025-02-02T08:49:00","Ferreira Do Zêzere","Santarém","Centro",-8.308657,39.692618
24904401,"Valongo","Area M. Porto",309,"2025-02-02T09:06:00",24904401,"Em despacho","4331","Busca e resgate terrestre de animais",0,1,0,3,"2025-02-02T09:06:00","Valongo","Porto","Norte",-8.48714,41.18783
24904462,"Corroios","Península de Setúbal",311,"2025-02-02T09:21:00",24904462,"Em despacho","2201","Incêndio em equipamentos ou produtos",0,1,0,4,"2025-02-02T09:21:00","Seixal","Setúbal","Área Metropolitana De Lisboa",-9.1484,38.62681
