"id","address","subregion","neighborhood","date","id.1","state","nature","nature_description","aerial_means","terrestrial_means","aquatic_means","operational","date.1","Concelho","Distrito","NUTII_DSG","longitude","latitude"
24840624,"Águeda e Borralha","Região de Aveiro",310,"2025-01-19T15:04:00",24840624,"Em conclusão","2101","Incêndio em edifícios habitacionais",0,2,0,7,"2025-01-19T15:04:00","Águeda","Aveiro","Centro",-8.457725,40.58226
24841190,"Carnaxide e Queijas","Grande Lisboa",311,"2025-01-19T17:52:00",24841190,"Em resolução","2403","Colisão rodoviária",0,3,0,9,"2025-01-19T17:52:00","Oeiras","Lisboa","Área Metropolitana De Lisboa",-9.259903,38.718843
24841034,"Queluz e Belas","Grande Lisboa",311,"2025-01-19T17:03:00",24841034,"Em conclusão","2201","Incêndio em equipamentos ou produtos",0,3,0,10,"2025-01-19T17:03:00","Sintra","Lisboa","Área Metropolitana De Lisboa",-9.253541,38.753134
24841051,"Alcoutim e Pereiro","Algarve",313,"2025-01-19T17:09:00",24841051,"Em resolução","2101","Incêndio em edifícios habitacionais",0,5,0,13,"2025-01-19T17:09:00","Alcoutim","Faro","Algarve",-7.509085,37.426108
24841148,"Sandim, Olival, Lever e Crestuma","Area M. Porto",309,"2025-01-19T17:26:00",24841148,"Em despacho","4331","Busca e resgate terrestre de animais",0,1,0,2,"2025-01-19T17:26:00","Vila Nova De Gaia","Porto","Norte",-8.502382,41.048753
24841183,"Póvoa de Santa Iria e Forte da Casa","Grande Lisboa",311,"2025-01-19T17:45:00",24841183,"Em despacho","2101","Incêndio em edifícios habitacionais",0,1,0,5,"2025-01-19T17:45:00","Vila Franca De Xira","Lisboa","Área Metropolitana De Lisboa",-9.080109,38.86006
24841200,"Casal de Cambra","Grande Lisboa",311,"2025-01-19T17:58:00",24841200,"Em despacho","2101","Incêndio em edifícios habitacionais",0,2,0,6,"2025-01-19T17:58:00","Sintra","Lisboa","Área Metropolitana De Lisboa",-9.235142,38.803137
24840796,"Vidigueira","Baixo Alentejo",312,"2025-01-19T15:50:00",24840796,"Em conclusão","3317","Inundação de estruturas por água canalizada",0,2,0,4,"2025-01-19T15:50:00","Vidigueira","Beja","Alentejo",-7.80916,38.205708
24840851,"Algés, Linda-a-Velha e Cruz Quebrada-Dafundo","Grande Lisboa",311,"2025-01-19T15:54:00",24840851,"Em curso","3323","Dano na rede de abastecimento de água",0,0,0,0,"2025-01-19T15:54:00","Oeiras","Lisboa","Área Metropolitana De Lisboa",-9.24227414640936,38.7081610512437
24840869,"Pessegueiro do Vouga","Região de Aveiro",310,"2025-01-19T16:04:00",24840869,"Em conclusão","2407","Despiste",0,2,0,4,"2025-01-19T16:04:00","Sever Do Vouga","Aveiro","Centro",-8.367434,40.709991
24841019,"Seixal, Arrentela e Aldeia de Paio Pires","Península de Setúbal",311,"2025-01-19T17:00:00",24841019,"Em conclusão","2407","Despiste",0,3,0,9,"2025-01-19T17:00:00","Seixal","Setúbal","Área Metropolitana De Lisboa",-9.102077,38.61358
24841044,"Cercal","Alentejo Litoral",312,"2025-01-19T17:06:00",24841044,"Em resolução","2127","Incêndio em edifícios e recintos industriais, oficinas e armazéns",0,2,0,9,"2025-01-19T17:06:00","Santiago Do Cacém","Setúbal","Alentejo",-8.68472,37.79365
24841046,"Oeiras e S. Julião da Barra, Paço de Arcos e Caxias","Grande Lisboa",311,"2025-01-19T16:58:00",24841046,"Em conclusão","2407","Despiste",0,3,0,7,"2025-01-19T16:58:00","Oeiras","Lisboa","Área Metropolitana De Lisboa",-9.290593,38.696925
24841212,"São Teotónio","Alentejo Litoral",312,"2025-01-19T18:03:00",24841212,"Em despacho","3111","Queima",0,1,0,2,"2025-01-19T18:03:00","Odemira","Beja","Alentejo",-8.75049,37.43809
24841255,"Pinhal Novo","Península de Setúbal",311,"2025-01-19T18:08:00",24841255,"Em despacho","2403","Colisão rodoviária",0,2,0,6,"2025-01-19T18:08:00","Palmela","Setúbal","Área Metropolitana De Lisboa",-8.91294,38.637902
24841262,"Benfica","Grande Lisboa",311,"2025-01-19T18:11:00",24841262,"Em despacho","2403","Colisão rodoviária",0,1,0,2,"2025-01-19T18:11:00","Lisboa","Lisboa","Área Metropolitana De Lisboa",-9.190004,38.73481
24840634,"Fráguas","Lezíria do Tejo",311,"2025-01-19T15:06:00",24840634,"Em conclusão","2403","Colisão rodoviária",0,1,0,2,"2025-01-19T15:06:00","Rio Maior","Santarém","Alentejo",-8.86367,39.367843
24840793,"Alcabideche","Grande Lisboa",311,"2025-01-19T15:38:00",24840793,"Em conclusão","2201","Incêndio em equipamentos ou produtos",0,2,0,6,"2025-01-19T15:38:00","Cascais","Lisboa","Área Metropolitana De Lisboa",-9.430278,38.730587
24840920,"S.maria, S.miguel, S.martinho, S.pedro Penaferrim","Grande Lisboa",311,"2025-01-19T16:26:00",24840920,"Em conclusão","2403","Colisão rodoviária",0,4,0,12,"2025-01-19T16:26:00","Sintra","Lisboa","Área Metropolitana De Lisboa",-9.35802,38.8133
24841186,"Azurém","Ave",309,"2025-01-19T17:48:00",24841186,"Em conclusão","2301","Incêndio em transporte rodoviário",0,2,0,7,"2025-01-19T17:48:00","Guimarães","Braga","Norte",-8.299573,41.447643
24841238,"Bougado (São Martinho e Santiago)","Area M. Porto",309,"2025-01-19T17:59:00",24841238,"Em curso","2201","Incêndio em equipamentos ou produtos",0,1,0,3,"2025-01-19T17:59:00","Trofa","Porto","Norte",-8.576762,41.315775
24841263,"Macedo de Cavaleiros","Terras de Trás-os-Montes",309,"2025-01-19T18:13:00",24841263,"Em despacho","2101","Incêndio em edifícios habitacionais",0,1,0,3,"2025-01-19T18:13:00","Macedo De Cavaleiros","Bragança","Norte",-6.958775,41.538051
