"id","address","subregion","neighborhood","date","id.1","state","nature","nature_description","aerial_means","terrestrial_means","aquatic_means","operational","date.1","Concelho","Distrito","NUTII_DSG","longitude","latitude","state_2"
26121354,"Outeiro Seco","Alto Tâmega e Barroso",309,"2025-10-11T14:00:00",26121354,"Em Curso","4331","Busca e resgate terrestre de animais",0,0,0,0,"2025-10-11T14:00:00","Chaves","Vila Real","Norte",-7.445173,41.775173,"Curso"
26225004,"Bougado (São Martinho e Santiago)","Area M. Porto",309,"2025-11-02T10:01:00",26225004,"Em Curso","2127","Incêndio em edifícios e recintos industriais, oficinas e armazéns",0,1,0,4,"2025-11-02T10:01:00","Trofa","Porto","Norte",-8.56125,41.32154,"Curso"
26225013,"Ansiães","Tâmega e Sousa",309,"2025-11-02T09:56:00",26225013,"Em resolução/conclusão","2301","Incêndio em transporte rodoviário",0,3,0,6,"2025-11-02T09:56:00","Amarante","Porto","Norte",-7.935475,41.268025,"Resolução/Conclusão"
26225063,"São João Das Lampas e Terrugem","Grande Lisboa",311,"2025-11-02T10:07:00",26225063,"Em resolução/conclusão","4329","Busca e resgate aquático de pessoas",0,4,0,12,"2025-11-02T10:07:00","Sintra","Lisboa","Área Metropolitana De Lisboa",-9.360194,38.868259,"Resolução/Conclusão"
26225088,"Vila Nova da Telha","Area M. Porto",309,"2025-11-02T10:10:00",26225088,"Em resolução/conclusão","2201","Incêndio em equipamentos ou produtos",0,1,0,2,"2025-11-02T10:10:00","Maia","Porto","Norte",-8.666885,41.251145,"Resolução/Conclusão"
26225156,"Boa Aldeia, Farminhão e Torredeita","Viseu Dão Lafões",310,"2025-11-02T10:28:00",26225156,"Em Despacho","4331","Busca e resgate terrestre de animais",0,1,0,2,"2025-11-02T10:28:00","Viseu","Viseu","Centro",-8.010225,40.615614,"Despacho"
26224774,"Algueirão-Mem Martins","Grande Lisboa",311,"2025-11-02T09:01:00",26224774,"Em resolução/conclusão","2403","Colisão rodoviária",0,2,0,4,"2025-11-02T09:01:00","Sintra","Lisboa","Área Metropolitana De Lisboa",-9.345795,38.786998,"Resolução/Conclusão"
26225058,"S.maria, S.miguel, S.martinho, S.pedro Penaferrim","Grande Lisboa",311,"2025-11-02T10:04:00",26225058,"Em resolução/conclusão","2101","Incêndio em edifícios habitacionais",0,5,0,17,"2025-11-02T10:04:00","Sintra","Lisboa","Área Metropolitana De Lisboa",-9.367323,38.814139,"Resolução/Conclusão"
26225094,"S.julião, N.s. da Anunciada e S. Maria da Graça","Península de Setúbal",311,"2025-11-02T10:10:00",26225094,"Em Despacho","3317","Inundação de estruturas por água canalizada",0,2,0,9,"2025-11-02T10:10:00","Setúbal","Setúbal","Área Metropolitana De Lisboa",-8.889983,38.529955,"Despacho"
26225141,"Oliveirinha","Região de Aveiro",310,"2025-11-02T10:29:00",26225141,"Em Despacho","4333","Busca e resgate aquático de animais",0,1,0,3,"2025-11-02T10:29:00","Aveiro","Aveiro","Centro",-8.595116,40.607545,"Despacho"
26224896,"Poceirão e Marateca","Península de Setúbal",311,"2025-11-02T09:33:00",26224896,"Em resolução/conclusão","2407","Despiste",0,2,0,4,"2025-11-02T09:33:00","Palmela","Setúbal","Área Metropolitana De Lisboa",-8.747517,38.633484,"Resolução/Conclusão"
26225164,"Venteira","Grande Lisboa",311,"2025-11-02T10:26:00",26225164,"Em Curso","3323","Dano na rede de abastecimento de água",0,1,0,2,"2025-11-02T10:26:00","Amadora","Lisboa","Área Metropolitana De Lisboa",-9.24198977353569,38.74661342854,"Curso"
26225180,"Vilarandelo","Alto Tâmega e Barroso",309,"2025-11-02T10:36:00",26225180,"Em Despacho","2403","Colisão rodoviária",0,2,0,7,"2025-11-02T10:36:00","Valpaços","Vila Real","Norte",-7.32387,41.665444,"Despacho"
26224801,"Cedrim e Paradela","Região de Aveiro",310,"2025-11-02T09:10:00",26224801,"Em resolução/conclusão","4331","Busca e resgate terrestre de animais",0,1,0,3,"2025-11-02T09:10:00","Sever Do Vouga","Aveiro","Centro",-8.35439,40.701913,"Resolução/Conclusão"
26224983,"Sesimbra (Castelo)","Península de Setúbal",311,"2025-11-02T09:50:00",26224983,"Em resolução/conclusão","2407","Despiste",0,2,0,6,"2025-11-02T09:50:00","Sesimbra","Setúbal","Área Metropolitana De Lisboa",-9.112506,38.449031,"Resolução/Conclusão"
26225183,"Marinha Grande","Região de Leiria",310,"2025-11-02T10:37:00",26225183,"Em Despacho","2403","Colisão rodoviária",0,2,0,4,"2025-11-02T10:37:00","Marinha Grande","Leiria","Centro",-8.948601,39.742841,"Despacho"
26225201,"Braga (São Vicente)","Cávado",309,"2025-11-02T10:20:00",26225201,"Em Despacho","3301","Queda de árvore",0,1,0,2,"2025-11-02T10:20:00","Braga","Braga","Norte",-8.419631,41.563364,"Despacho"
