"id","address","subregion","neighborhood","date","id.1","state","nature","nature_description","aerial_means","terrestrial_means","aquatic_means","operational","date.1","Concelho","Distrito","NUTII_DSG","longitude","latitude"
24467667,"Sanguinheira","Região de Coimbra",310,"2024-10-26T21:14:00",24467667,"Em conclusão","2407","Despiste",0,1,0,2,"2024-10-26T21:14:00","Cantanhede","Coimbra","Centro",-8.719031,40.319712
24467851,"Tavira (Santa Maria e Santiago)","Algarve",313,"2024-10-26T22:33:00",24467851,"Em resolução","2407","Despiste",0,5,0,12,"2024-10-26T22:33:00","Tavira","Faro","Algarve",-7.655378,37.130807
24467952,"Vila Nova de Cacela","Algarve",313,"2024-10-26T23:23:00",24467952,"Em conclusão","3111","Queima",0,2,0,7,"2024-10-26T23:23:00","Vila Real De Santo António","Faro","Algarve",-7.529578,37.167748
24467954,"Oeiras e S. Julião da Barra, Paço de Arcos e Caxias","Grande Lisboa",311,"2024-10-26T23:20:00",24467954,"Em resolução","4331","Busca e resgate terrestre de animais",0,1,0,2,"2024-10-26T23:20:00","Oeiras","Lisboa","Área Metropolitana De Lisboa",-9.290593,38.696925
24467986,"Pontinha e Famões","Grande Lisboa",311,"2024-10-26T23:42:00",24467986,"Em conclusão","2127","Incêndio em edifícios e recintos industriais, oficinas e armazéns",0,3,0,9,"2024-10-26T23:42:00","Odivelas","Lisboa","Área Metropolitana De Lisboa",-9.19573,38.77993
24468117,"Campanhã","Area M. Porto",309,"2024-10-27T00:45:00",24468117,"Em despacho","2101","Incêndio em edifícios habitacionais",0,0,0,0,"2024-10-27T00:45:00","Porto","Porto","Norte",-8.59351,41.15818
24467842,"Santa Maria Maior","Grande Lisboa",311,"2024-10-26T22:35:00",24467842,"Em resolução","2101","Incêndio em edifícios habitacionais",0,7,0,25,"2024-10-26T22:35:00","Lisboa","Lisboa","Área Metropolitana De Lisboa",-9.1423,38.7114
24468060,"Odivelas","Grande Lisboa",311,"2024-10-27T00:22:00",24468060,"Em conclusão","3203","Detritos confinados",0,1,0,5,"2024-10-27T00:22:00","Odivelas","Lisboa","Área Metropolitana De Lisboa",-9.192729,38.79647
24360487,"Mões","Viseu Dão Lafões",310,"2024-10-03T08:00:00",24360487,"Em curso","4339","Corte ou remoção de elementos",0,1,0,1,"2024-10-03T08:00:00","Castro Daire","Viseu","Centro",-7.893519,40.867571
24467747,"Mexilhoeira Grande","Algarve",313,"2024-10-26T21:47:00",24467747,"Em resolução","2515","Fuga de gás em garrafa",0,1,0,1,"2024-10-26T21:47:00","Portimão","Faro","Algarve",-8.61598,37.15716
24468090,"Quinta do Conde","Península de Setúbal",311,"2024-10-27T00:31:00",24468090,"Em despacho","3317","Inundação de estruturas por água canalizada",0,1,0,2,"2024-10-27T00:31:00","Sesimbra","Setúbal","Área Metropolitana De Lisboa",-9.03613,38.570355
24467528,"Real, Ataíde e Oliveira","Tâmega e Sousa",309,"2024-10-26T20:30:00",24467528,"Em conclusão","2101","Incêndio em edifícios habitacionais",0,1,0,5,"2024-10-26T20:30:00","Amarante","Porto","Norte",-8.198678,41.254058
24467973,"Corroios","Península de Setúbal",311,"2024-10-26T23:36:00",24467973,"Em conclusão","2301","Incêndio em transporte rodoviário",0,4,0,11,"2024-10-26T23:36:00","Seixal","Setúbal","Área Metropolitana De Lisboa",-9.16307,38.64371
24468046,"Malveira e São Miguel de Alcainça","Grande Lisboa",311,"2024-10-27T00:13:00",24468046,"Em resolução","2407","Despiste",0,4,0,11,"2024-10-27T00:13:00","Mafra","Lisboa","Área Metropolitana De Lisboa",-9.29127,38.91929
