"id","address","subregion","neighborhood","date","id.1","state","nature","nature_description","aerial_means","terrestrial_means","aquatic_means","operational","date.1","Concelho","Distrito","NUTII_DSG","longitude","latitude"
24662386,"Monte Redondo e Carreira","Região de Leiria",310,"2024-12-10T22:16:00",24662386,"Em curso","2115","Incêndio em edifícios hoteleiros e de restauração",0,2,0,6,"2024-12-10T22:16:00","Leiria","Leiria","Centro",-8.847483,39.892112
24662422,"Camarate, Unhos e Apelação","Grande Lisboa",311,"2024-12-10T22:43:00",24662422,"Em conclusão","2515","Fuga de gás em garrafa",0,3,0,9,"2024-12-10T22:43:00","Loures","Lisboa","Área Metropolitana De Lisboa",-9.14438,38.79904
24662012,"Oeiras e S. Julião da Barra, Paço de Arcos e Caxias","Grande Lisboa",311,"2024-12-10T20:11:00",24662012,"Em conclusão","2101","Incêndio em edifícios habitacionais",0,1,0,2,"2024-12-10T20:11:00","Oeiras","Lisboa","Área Metropolitana De Lisboa",-9.310159,38.698531
24662062,"S.pedro e Santiago, S.maria e S.miguel e Matacães","Oeste",311,"2024-12-10T20:17:00",24662062,"Em curso","2401","Atropelamento rodoviário",0,1,0,2,"2024-12-10T20:17:00","Torres Vedras","Lisboa","Centro",-9.251952,39.091829
24662142,"Padornelo","Alto Minho",309,"2024-12-10T20:57:00",24662142,"Em conclusão","2407","Despiste",0,1,0,2,"2024-12-10T20:57:00","Paredes De Coura","Viana Do Castelo","Norte",-8.541893,41.925357
24662209,"São João Das Lampas e Terrugem","Grande Lisboa",311,"2024-12-10T21:14:00",24662209,"Em conclusão","3325","Dano na rede de abastecimento de gás",0,4,0,10,"2024-12-10T21:14:00","Sintra","Lisboa","Área Metropolitana De Lisboa",-9.404642,38.905614
24662341,"Póvoa de Santo Adrião e Olival Basto","Grande Lisboa",311,"2024-12-10T22:07:00",24662341,"Em curso","2201","Incêndio em equipamentos ou produtos",0,3,0,8,"2024-12-10T22:07:00","Odivelas","Lisboa","Área Metropolitana De Lisboa",-9.15545,38.79572
24662476,"Almada, Cova da Piedade, Pragal e Cacilhas","Península de Setúbal",311,"2024-12-10T23:17:00",24662476,"Em despacho","2515","Fuga de gás em garrafa",0,2,0,6,"2024-12-10T23:17:00","Almada","Setúbal","Área Metropolitana De Lisboa",-9.15943,38.68157
