"id","address","subregion","neighborhood","date","id.1","state","nature","nature_description","aerial_means","terrestrial_means","aquatic_means","operational","date.1","Concelho","Distrito","NUTII_DSG","longitude","latitude"
24846892,"Tavira (Santa Maria e Santiago)","Algarve",313,"2025-01-20T23:37:00",24846892,"Em curso","3315","Inundação de estruturas por precipitação intensa",0,0,0,0,"2025-01-20T23:37:00","Tavira","Faro","Algarve",-7.650217,37.141268
24849714,"Portimão","Algarve",313,"2025-01-21T14:52:00",24849714,"Em resolução","3311","Queda de elementos de estruturas edificados",0,3,0,7,"2025-01-21T14:52:00","Portimão","Faro","Algarve",-8.53551,37.13965
24849764,"Lumiar","Grande Lisboa",311,"2025-01-21T14:58:00",24849764,"Em conclusão","2407","Despiste",0,1,0,2,"2025-01-21T14:58:00","Lisboa","Lisboa","Área Metropolitana De Lisboa",-9.167579,38.774645
24850014,"Zibreira","Médio Tejo",311,"2025-01-21T15:54:00",24850014,"Em despacho","3313","Deslizamento de terras",0,1,0,2,"2025-01-21T15:54:00","Torres Novas","Santarém","Centro",-8.613148,39.484424
24850051,"Alhandra, São João Dos Montes e Calhandriz","Grande Lisboa",311,"2025-01-21T15:40:00",24850051,"Em despacho","3301","Queda de árvore",0,2,0,6,"2025-01-21T15:40:00","Vila Franca De Xira","Lisboa","Área Metropolitana De Lisboa",-9.006082,38.929996
24850100,"Fânzeres e São Pedro da Cova","Area M. Porto",309,"2025-01-21T16:05:00",24850100,"Em despacho","4331","Busca e resgate terrestre de animais",0,1,0,5,"2025-01-21T16:05:00","Gondomar","Porto","Norte",-8.511531,41.155311
24849406,"Santa Bárbara de Nexe","Algarve",313,"2025-01-21T13:55:00",24849406,"Em despacho","3315","Inundação de estruturas por precipitação intensa",0,2,0,3,"2025-01-21T13:55:00","Faro","Faro","Algarve",-7.921522,37.121336
24850041,"Castelo Branco","Beira Baixa",310,"2025-01-21T15:55:00",24850041,"Em despacho","2101","Incêndio em edifícios habitacionais",0,2,0,3,"2025-01-21T15:55:00","Castelo Branco","Castelo Branco","Centro",-7.490756,39.816895
24847907,"Aldeia do Bispo, Águas e Aldeia de João Pires","Beira Baixa",310,"2025-01-21T09:20:00",24847907,"Em curso","4327","Busca e resgate terrestre de pessoas",0,13,0,29,"2025-01-21T09:20:00","Penamacor","Castelo Branco","Centro",-7.2077,40.109481
24849609,"Febres","Região de Coimbra",310,"2025-01-21T14:28:00",24849609,"Em despacho","4333","Busca e resgate aquático de animais",0,2,0,5,"2025-01-21T14:28:00","Cantanhede","Coimbra","Centro",-8.628858,40.397696
24849843,"Beja (Salvador e Santa Maria da Feira)","Baixo Alentejo",312,"2025-01-21T15:11:00",24849843,"Em conclusão","3203","Detritos confinados",0,0,0,0,"2025-01-21T15:11:00","Beja","Beja","Alentejo",-7.851128,38.02342
24850013,"Rio de Moinhos","Tâmega e Sousa",309,"2025-01-21T15:53:00",24850013,"Em despacho","2407","Despiste",0,3,0,9,"2025-01-21T15:53:00","Penafiel","Porto","Norte",-8.272097,41.10641
24850079,"Nossa Senhora da Graça Dos Degolados","Alto Alentejo",312,"2025-01-21T16:01:00",24850079,"Em curso","2403","Colisão rodoviária",0,3,0,8,"2025-01-21T16:01:00","Campo Maior","Portalegre","Alentejo",-7.120465,39.059811
24847222,"Castelo Branco","Beira Baixa",310,"2025-01-21T04:20:00",24847222,"Em conclusão","3309","Desabamento de estruturas edificadas",0,2,0,3,"2025-01-21T04:20:00","Castelo Branco","Castelo Branco","Centro",-7.493762,39.824047
24847288,"Rio Maior","Lezíria do Tejo",311,"2025-01-21T05:40:00",24847288,"Em conclusão","2127","Incêndio em edifícios e recintos industriais, oficinas e armazéns",0,3,0,5,"2025-01-21T05:40:00","Rio Maior","Santarém","Alentejo",-8.91264,39.311329
24849717,"Penamacor","Beira Baixa",310,"2025-01-21T14:50:00",24849717,"Em resolução","3315","Inundação de estruturas por precipitação intensa",0,1,0,2,"2025-01-21T14:50:00","Penamacor","Castelo Branco","Centro",-7.123052,40.202433
24849869,"Cedofeita, Ildefonso, Sé, Miragaia, Nicolau e Vitória","Area M. Porto",309,"2025-01-21T15:24:00",24849869,"Em despacho","2403","Colisão rodoviária",0,6,0,20,"2025-01-21T15:24:00","Porto","Porto","Norte",-8.62256,41.14401
24849896,"Massamá e Monte Abraão","Grande Lisboa",311,"2025-01-21T15:29:00",24849896,"Em resolução","3325","Dano na rede de abastecimento de gás",0,5,0,11,"2025-01-21T15:29:00","Sintra","Lisboa","Área Metropolitana De Lisboa",-9.26267,38.76494
24850103,"São Bartolomeu de Messines","Algarve",313,"2025-01-21T15:50:00",24850103,"Em resolução","3301","Queda de árvore",0,1,0,5,"2025-01-21T15:50:00","Silves","Faro","Algarve",-8.283554,37.282885
