"id","address","subregion","neighborhood","date","id.1","state","nature","nature_description","aerial_means","terrestrial_means","aquatic_means","operational","date.1","Concelho","Distrito","NUTII_DSG","longitude","latitude"
25005550,"Sines","Alentejo Litoral",312,"2025-02-24T19:12:00",25005550,"Em conclusão","3313","Deslizamento de terras",0,0,0,0,"2025-02-24T19:12:00","Sines","Setúbal","Alentejo",-8.849778,37.961314
25019055,"Costa da Caparica","Península de Setúbal",311,"2025-02-27T17:16:00",25019055,"Em conclusão","3313","Deslizamento de terras",0,1,0,3,"2025-02-27T17:16:00","Almada","Setúbal","Área Metropolitana De Lisboa",-9.220385,38.624272
25019220,"Marvila","Grande Lisboa",311,"2025-02-27T18:00:00",25019220,"Em conclusão","2403","Colisão rodoviária",0,1,0,2,"2025-02-27T18:00:00","Lisboa","Lisboa","Área Metropolitana De Lisboa",-9.11087,38.73503
25019589,"Alverca do Ribatejo e Sobralinho","Grande Lisboa",311,"2025-02-27T19:28:00",25019589,"Em conclusão","2401","Atropelamento rodoviário",0,2,0,4,"2025-02-27T19:28:00","Vila Franca De Xira","Lisboa","Área Metropolitana De Lisboa",-9.036827,38.899136
25019673,"Santo António","Grande Lisboa",311,"2025-02-27T19:43:00",25019673,"Em despacho","2403","Colisão rodoviária",0,2,0,4,"2025-02-27T19:43:00","Lisboa","Lisboa","Área Metropolitana De Lisboa",-9.14881,38.72134
25019690,"Colares","Grande Lisboa",311,"2025-02-27T19:55:00",25019690,"Em conclusão","3203","Detritos confinados",0,1,0,2,"2025-02-27T19:55:00","Sintra","Lisboa","Área Metropolitana De Lisboa",-9.460841,38.828425
25019741,"Arcos","Alentejo Central",312,"2025-02-27T20:19:00",25019741,"Em resolução","2403","Colisão rodoviária",0,4,0,7,"2025-02-27T20:19:00","Estremoz","Évora","Alentejo",-7.490715,38.820112
25019788,"Encosta do Sol","Grande Lisboa",311,"2025-02-27T20:24:00",25019788,"Em despacho","2301","Incêndio em transporte rodoviário",0,2,0,8,"2025-02-27T20:24:00","Amadora","Lisboa","Área Metropolitana De Lisboa",-9.214086,38.769383
25018244,"Olhão","Algarve",313,"2025-02-27T14:25:00",25018244,"Em conclusão","2403","Colisão rodoviária",0,0,0,0,"2025-02-27T14:25:00","Olhão","Faro","Algarve",-7.836023,37.014671
25019713,"Viseu","Viseu Dão Lafões",310,"2025-02-27T20:05:00",25019713,"Em conclusão","2117","Incêndio em edifícios comerciais e gares de transporte",0,3,0,7,"2025-02-27T20:05:00","Viseu","Viseu","Centro",-7.910413,40.65597
25019730,"Venda do Pinheiro e Santo Estêvão Das Galés","Grande Lisboa",311,"2025-02-27T19:57:00",25019730,"Em conclusão","2403","Colisão rodoviária",0,3,0,9,"2025-02-27T19:57:00","Mafra","Lisboa","Área Metropolitana De Lisboa",-9.208921,38.921996
25019766,"Seixal, Arrentela e Aldeia de Paio Pires","Península de Setúbal",311,"2025-02-27T20:22:00",25019766,"Em despacho","2403","Colisão rodoviária",0,1,0,2,"2025-02-27T20:22:00","Seixal","Setúbal","Área Metropolitana De Lisboa",-9.102119,38.613966
25019780,"Loures","Grande Lisboa",311,"2025-02-27T20:22:00",25019780,"Em curso","2403","Colisão rodoviária",0,2,0,7,"2025-02-27T20:22:00","Loures","Lisboa","Área Metropolitana De Lisboa",-9.176421,38.828612
24877003,"Malagueira e Horta Das Figueiras","Alentejo Central",312,"2025-01-27T11:41:00",24877003,"Em conclusão","3315","Inundação de estruturas por precipitação intensa",0,0,0,0,"2025-01-27T11:41:00","Évora","Évora","Alentejo",-7.924277,38.57285
25018171,"São Domingos de Rana","Grande Lisboa",311,"2025-02-27T14:11:00",25018171,"Em curso","3315","Inundação de estruturas por precipitação intensa",0,2,0,3,"2025-02-27T14:11:00","Cascais","Lisboa","Área Metropolitana De Lisboa",-9.340115,38.702729
25019566,"Charneca de Caparica e Sobreda","Península de Setúbal",311,"2025-02-27T19:18:00",25019566,"Em despacho","3315","Inundação de estruturas por precipitação intensa",0,2,0,8,"2025-02-27T19:18:00","Almada","Setúbal","Área Metropolitana De Lisboa",-9.194473,38.648295
25019711,"Camarate, Unhos e Apelação","Grande Lisboa",311,"2025-02-27T20:08:00",25019711,"Em despacho","2301","Incêndio em transporte rodoviário",0,1,0,4,"2025-02-27T20:08:00","Loures","Lisboa","Área Metropolitana De Lisboa",-9.148988,38.80223
25019734,"Almada, Cova da Piedade, Pragal e Cacilhas","Península de Setúbal",311,"2025-02-27T20:15:00",25019734,"Em curso","2201","Incêndio em equipamentos ou produtos",0,2,0,4,"2025-02-27T20:15:00","Almada","Setúbal","Área Metropolitana De Lisboa",-9.15728,38.66658
25019834,"Carcavelos e Parede","Grande Lisboa",311,"2025-02-27T20:45:00",25019834,"Em despacho","2401","Atropelamento rodoviário",0,2,0,6,"2025-02-27T20:45:00","Cascais","Lisboa","Área Metropolitana De Lisboa",-9.325114,38.69928
25018999,"Pedroso e Seixezelo","Area M. Porto",309,"2025-02-27T17:01:00",25018999,"Em curso","2301","Incêndio em transporte rodoviário",0,7,0,22,"2025-02-27T17:01:00","Vila Nova De Gaia","Porto","Norte",-8.58146,41.092838
25019251,"Vila Pouca de Aguiar","Alto Tâmega e Barroso",309,"2025-02-27T18:08:00",25019251,"Em conclusão","2101","Incêndio em edifícios habitacionais",0,6,0,14,"2025-02-27T18:08:00","Vila Pouca De Aguiar","Vila Real","Norte",-7.635573,41.504715
25019769,"Falagueira-Venda Nova","Grande Lisboa",311,"2025-02-27T20:18:00",25019769,"Em curso","2401","Atropelamento rodoviário",0,2,0,6,"2025-02-27T20:18:00","Amadora","Lisboa","Área Metropolitana De Lisboa",-9.224815,38.755208
25019787,"Pontinha e Famões","Grande Lisboa",311,"2025-02-27T20:19:00",25019787,"Em despacho","3323","Dano na rede de abastecimento de água",0,1,0,4,"2025-02-27T20:19:00","Odivelas","Lisboa","Área Metropolitana De Lisboa",-9.200241,38.764933
25019792,"Refojos de Basto, Outeiro e Painzela","Ave",309,"2025-02-27T20:28:00",25019792,"Em despacho","4331","Busca e resgate terrestre de animais",0,1,0,2,"2025-02-27T20:28:00","Cabeceiras De Basto","Braga","Norte",-8.010408,41.514146
25019810,"Queluz e Belas","Grande Lisboa",311,"2025-02-27T20:41:00",25019810,"Em despacho","3315","Inundação de estruturas por precipitação intensa",0,1,0,4,"2025-02-27T20:41:00","Sintra","Lisboa","Área Metropolitana De Lisboa",-9.27314,38.77344
25019844,"Cacém e São Marcos","Grande Lisboa",311,"2025-02-27T20:41:00",25019844,"Em despacho","3315","Inundação de estruturas por precipitação intensa",0,1,0,4,"2025-02-27T20:41:00","Sintra","Lisboa","Área Metropolitana De Lisboa",-9.296125,38.754519
