"id","address","subregion","neighborhood","date","id.1","state","nature","nature_description","aerial_means","terrestrial_means","aquatic_means","operational","date.1","Concelho","Distrito","NUTII_DSG","longitude","latitude"
24851780,"São Miguel, Santa Eufémia e Rabaçal","Região de Coimbra",310,"2025-01-21T23:25:00",24851780,"Em curso","3315","Inundação de estruturas por precipitação intensa",0,0,0,0,"2025-01-21T23:25:00","Penela","Coimbra","Centro",-8.399036,40.025502
24852348,"S.julião, N.s. da Anunciada e S. Maria da Graça","Península de Setúbal",311,"2025-01-22T05:57:00",24852348,"Em conclusão","2201","Incêndio em equipamentos ou produtos",0,1,0,5,"2025-01-22T05:57:00","Setúbal","Setúbal","Área Metropolitana De Lisboa",-8.889983,38.529955
24852563,"Ílhavo (São Salvador)","Região de Aveiro",310,"2025-01-22T07:43:00",24852563,"Em conclusão","2403","Colisão rodoviária",0,2,0,7,"2025-01-22T07:43:00","Ílhavo","Aveiro","Centro",-8.699143,40.613385
24852597,"São Brás de Alportel","Algarve",313,"2025-01-22T08:04:00",24852597,"Em despacho","3315","Inundação de estruturas por precipitação intensa",0,2,0,10,"2025-01-22T08:04:00","São Brás De Alportel","Faro","Algarve",-7.90377,37.15284
24852616,"Seixal, Arrentela e Aldeia de Paio Pires","Península de Setúbal",311,"2025-01-22T08:03:00",24852616,"Em despacho","3329","Queda de estruturas temporárias ou móveis",0,1,0,3,"2025-01-22T08:03:00","Seixal","Setúbal","Área Metropolitana De Lisboa",-9.092719,38.597829
24852648,"Bonfim","Area M. Porto",309,"2025-01-22T08:09:00",24852648,"Em despacho","3329","Queda de estruturas temporárias ou móveis",0,1,0,5,"2025-01-22T08:09:00","Porto","Porto","Norte",-8.596119,41.151713
24852680,"Santana da Serra","Baixo Alentejo",312,"2025-01-22T08:21:00",24852680,"Em curso","2407","Despiste",0,1,0,3,"2025-01-22T08:21:00","Ourique","Beja","Alentejo",-8.306833,37.490798
24852682,"Coruche, Fajarda e Erra","Lezíria do Tejo",311,"2025-01-22T08:22:00",24852682,"Em despacho","3315","Inundação de estruturas por precipitação intensa",0,1,0,2,"2025-01-22T08:22:00","Coruche","Santarém","Alentejo",-8.531156,38.965014
24852683,"Santa Maria, São Pedro e Sobral da Lagoa","Oeste",311,"2025-01-22T08:23:00",24852683,"Em curso","2403","Colisão rodoviária",0,4,0,11,"2025-01-22T08:23:00","Óbidos","Leiria","Centro",-9.15462,39.3613
24852733,"Tavira (Santa Maria e Santiago)","Algarve",313,"2025-01-22T08:29:00",24852733,"Em despacho","3315","Inundação de estruturas por precipitação intensa",0,1,0,2,"2025-01-22T08:29:00","Tavira","Faro","Algarve",-7.64691,37.130442
24852763,"Pias","Baixo Alentejo",312,"2025-01-22T08:30:00",24852763,"Em despacho","3317","Inundação de estruturas por água canalizada",0,1,0,4,"2025-01-22T08:30:00","Serpa","Beja","Alentejo",-7.605206,38.103314
24847907,"Aldeia do Bispo, Águas e Aldeia de João Pires","Beira Baixa",310,"2025-01-21T09:20:00",24847907,"Em curso","4327","Busca e resgate terrestre de pessoas",0,4,0,11,"2025-01-21T09:20:00","Penamacor","Castelo Branco","Centro",-7.2077,40.109481
24852419,"Castelo Branco","Beira Baixa",310,"2025-01-22T06:36:00",24852419,"Em conclusão","3325","Dano na rede de abastecimento de gás",0,2,0,3,"2025-01-22T06:36:00","Castelo Branco","Castelo Branco","Centro",-7.489248,39.833285
24852478,"Pereira","Região de Coimbra",310,"2025-01-22T07:09:00",24852478,"Em despacho","2407","Despiste",0,2,0,4,"2025-01-22T07:09:00","Montemor-o-Velho","Coimbra","Centro",-8.58521,40.188831
24852551,"Alvorge","Região de Leiria",310,"2025-01-22T07:38:00",24852551,"Em despacho","3315","Inundação de estruturas por precipitação intensa",0,1,0,4,"2025-01-22T07:38:00","Ansião","Leiria","Centro",-8.437457,39.972271
24852562,"Samora Correia","Lezíria do Tejo",311,"2025-01-22T07:48:00",24852562,"Em curso","2407","Despiste",0,1,0,2,"2025-01-22T07:48:00","Benavente","Santarém","Alentejo",-8.860734,38.925589
24852651,"Baleizão","Baixo Alentejo",312,"2025-01-22T08:12:00",24852651,"Em curso","2407","Despiste",0,3,0,8,"2025-01-22T08:12:00","Beja","Beja","Alentejo",-7.709847,38.048167
24852694,"Nossa Senhora Das Misericórdias","Médio Tejo",311,"2025-01-22T08:26:00",24852694,"Em resolução","3315","Inundação de estruturas por precipitação intensa",0,2,0,7,"2025-01-22T08:26:00","Ourém","Santarém","Centro",-8.60697,39.64998
24852742,"Caparica e Trafaria","Península de Setúbal",311,"2025-01-22T08:25:00",24852742,"Em despacho","3315","Inundação de estruturas por precipitação intensa",0,1,0,5,"2025-01-22T08:25:00","Almada","Setúbal","Área Metropolitana De Lisboa",-9.230296,38.662376
24852751,"Fronteira","Alto Alentejo",312,"2025-01-22T08:35:00",24852751,"Em curso","3301","Queda de árvore",0,2,0,7,"2025-01-22T08:35:00","Fronteira","Portalegre","Alentejo",-7.666567,39.071044
24852760,"Glória do Ribatejo e Granho","Lezíria do Tejo",311,"2025-01-22T08:41:00",24852760,"Em despacho","3315","Inundação de estruturas por precipitação intensa",0,1,0,5,"2025-01-22T08:41:00","Salvaterra De Magos","Santarém","Alentejo",-8.650894,39.087947
24850898,"Sepins e Bolho","Região de Coimbra",310,"2025-01-21T18:50:00",24850898,"Em curso","4327","Busca e resgate terrestre de pessoas",0,7,0,13,"2025-01-21T18:50:00","Cantanhede","Coimbra","Centro",-8.530113,40.405168
24850991,"Santa Maria da Feira, Travanca, Sanfins e Espargo","Area M. Porto",309,"2025-01-21T19:32:00",24850991,"Em despacho","3315","Inundação de estruturas por precipitação intensa",0,1,0,2,"2025-01-21T19:32:00","Santa Maria Da Feira","Aveiro","Norte",-8.53693,40.93173
24852411,"Fronteira","Alto Alentejo",312,"2025-01-22T06:12:00",24852411,"Em curso","3301","Queda de árvore",0,2,0,6,"2025-01-22T06:12:00","Fronteira","Portalegre","Alentejo",-7.64399,39.041888
24852427,"Azeitão (São Lourenço e São Simão)","Península de Setúbal",311,"2025-01-22T06:47:00",24852427,"Em despacho","2201","Incêndio em equipamentos ou produtos",0,1,0,5,"2025-01-22T06:47:00","Setúbal","Setúbal","Área Metropolitana De Lisboa",-9.000141,38.50642
24852486,"Sé Nova, Santa Cruz, Almedina e São Bartolomeu","Região de Coimbra",310,"2025-01-22T07:09:00",24852486,"Em conclusão","2201","Incêndio em equipamentos ou produtos",0,3,0,9,"2025-01-22T07:09:00","Coimbra","Coimbra","Centro",-8.425582,40.205556
24852502,"Serzedelo","Ave",309,"2025-01-22T07:23:00",24852502,"Em resolução","2403","Colisão rodoviária",0,2,0,4,"2025-01-22T07:23:00","Guimarães","Braga","Norte",-8.36693,41.405418
24852570,"São Mamede de Infesta e Senhora da Hora","Area M. Porto",309,"2025-01-22T07:51:00",24852570,"Em curso","2411","Atropelamento ferroviário",0,3,0,7,"2025-01-22T07:51:00","Matosinhos","Porto","Norte",-8.654568,41.18634
24852595,"Algueirão-Mem Martins","Grande Lisboa",311,"2025-01-22T08:03:00",24852595,"Em despacho","3321","Dano na rede de fornecimento de eletricidade ",0,1,0,2,"2025-01-22T08:03:00","Sintra","Lisboa","Área Metropolitana De Lisboa",-9.3202,38.80391
24852602,"Caranguejeira","Região de Leiria",310,"2025-01-22T08:03:00",24852602,"Em despacho","3321","Dano na rede de fornecimento de eletricidade ",0,1,0,2,"2025-01-22T08:03:00","Leiria","Leiria","Centro",-8.711905,39.758676
24852778,"Albergaria-a-Velha e Valmaior","Região de Aveiro",310,"2025-01-22T08:38:00",24852778,"Em despacho","2407","Despiste",0,2,0,3,"2025-01-22T08:38:00","Albergaria-a-Velha","Aveiro","Centro",-8.479745,40.688996
24851587,"Costa da Caparica","Península de Setúbal",311,"2025-01-21T22:25:00",24851587,"Em conclusão","2115","Incêndio em edifícios hoteleiros e de restauração",0,8,0,17,"2025-01-21T22:25:00","Almada","Setúbal","Área Metropolitana De Lisboa",-9.21176,38.60968
24851821,"Santa Maria do Castelo e Santiago e Santa Susana","Alentejo Litoral",312,"2025-01-21T23:41:00",24851821,"Em resolução","1103","Vento forte",0,11,0,21,"2025-01-21T23:41:00","Alcácer Do Sal","Setúbal","Alentejo",-8.598678,38.397168
24852523,"São Brás de Alportel","Algarve",313,"2025-01-22T07:34:00",24852523,"Em despacho","3315","Inundação de estruturas por precipitação intensa",0,0,0,0,"2025-01-22T07:34:00","São Brás De Alportel","Faro","Algarve",-7.89716,37.17049
24852640,"Cabril","Região de Coimbra",310,"2025-01-22T08:10:00",24852640,"Em resolução","3313","Deslizamento de terras",0,1,0,2,"2025-01-22T08:10:00","Pampilhosa Da Serra","Coimbra","Centro",-7.870566,40.06154
24852655,"Loulé (São Clemente)","Algarve",313,"2025-01-22T08:16:00",24852655,"Em curso","3315","Inundação de estruturas por precipitação intensa",0,1,0,3,"2025-01-22T08:16:00","Loulé","Faro","Algarve",-8.018267,37.137687
24852725,"Caires","Cávado",309,"2025-01-22T08:30:00",24852725,"Em despacho","2301","Incêndio em transporte rodoviário",0,3,0,8,"2025-01-22T08:30:00","Amares","Braga","Norte",-8.352815,41.647098
24852788,"Espite","Médio Tejo",311,"2025-01-22T08:44:00",24852788,"Em despacho","2101","Incêndio em edifícios habitacionais",0,1,0,2,"2025-01-22T08:44:00","Ourém","Santarém","Centro",-8.631521,39.777062
24852627,"Santa Iria de Azoia, São João da Talha e Bobadela","Grande Lisboa",311,"2025-01-22T08:01:00",24852627,"Em conclusão","2403","Colisão rodoviária",0,3,0,8,"2025-01-22T08:01:00","Loures","Lisboa","Área Metropolitana De Lisboa",-9.079846,38.840245
24852652,"Vila Nova de Foz Côa","Douro",309,"2025-01-22T08:07:00",24852652,"Em curso","2413","Abalroamento ferroviário",0,0,0,0,"2025-01-22T08:07:00","Vila Nova De Foz Côa","Guarda","Norte",-7.169529,41.12452
24852702,"Feitosa","Alto Minho",309,"2025-01-22T08:28:00",24852702,"Em curso","2407","Despiste",0,5,0,11,"2025-01-22T08:28:00","Ponte De Lima","Viana Do Castelo","Norte",-8.58691,41.75254
24852727,"Santa Marinha e São Pedro da Afurada","Area M. Porto",309,"2025-01-22T08:28:00",24852727,"Em despacho","4331","Busca e resgate terrestre de animais",0,1,0,3,"2025-01-22T08:28:00","Vila Nova De Gaia","Porto","Norte",-8.633352,41.135962
24852752,"Algés, Linda-a-Velha e Cruz Quebrada-Dafundo","Grande Lisboa",311,"2025-01-22T08:41:00",24852752,"Em despacho","3325","Dano na rede de abastecimento de gás",0,0,0,0,"2025-01-22T08:41:00","Oeiras","Lisboa","Área Metropolitana De Lisboa",-9.2448,38.71091
