"id","address","subregion","neighborhood","date","id.1","state","nature","nature_description","aerial_means","terrestrial_means","aquatic_means","operational","date.1","Concelho","Distrito","NUTII_DSG","longitude","latitude","state_2"
26205297,"Tavira (Santa Maria e Santiago)","Algarve",313,"2025-10-29T05:50:00",26205297,"Em resolução/conclusão","2201","Incêndio em equipamentos ou produtos",0,2,0,7,"2025-10-29T05:50:00","Tavira","Faro","Algarve",-7.678349,37.14228,"Resolução/Conclusão"
26205328,"Bacelo e Senhora da Saúde","Alentejo Central",312,"2025-10-29T06:11:00",26205328,"Em Despacho","3323","Dano na rede de abastecimento de água",0,2,0,3,"2025-10-29T06:11:00","Évora","Évora","Alentejo",-7.869122,38.593644,"Despacho"
26205326,"Almada, Cova da Piedade, Pragal e Cacilhas","Península de Setúbal",311,"2025-10-29T06:07:00",26205326,"Em resolução/conclusão","2201","Incêndio em equipamentos ou produtos",0,1,0,5,"2025-10-29T06:07:00","Almada","Setúbal","Área Metropolitana De Lisboa",-9.164498,38.675268,"Resolução/Conclusão"
26205333,"Odiáxere","Algarve",313,"2025-10-29T06:10:00",26205333,"Em resolução/conclusão","3315","Inundação de estruturas por precipitação intensa",0,1,0,3,"2025-10-29T06:10:00","Lagos","Faro","Algarve",-8.666629,37.150953,"Resolução/Conclusão"
26203717,"Leiria, Pousos, Barreira e Cortes","Região de Leiria",310,"2025-10-28T18:16:00",26203717,"Em Despacho","3315","Inundação de estruturas por precipitação intensa",0,1,0,2,"2025-10-28T18:16:00","Leiria","Leiria","Centro",-8.80207,39.74722,"Despacho"
26205303,"Igrejinha","Alentejo Central",312,"2025-10-29T05:56:00",26205303,"Em resolução/conclusão","3315","Inundação de estruturas por precipitação intensa",0,1,0,3,"2025-10-29T05:56:00","Arraiolos","Évora","Alentejo",-7.895485,38.711728,"Resolução/Conclusão"
26205338,"Rogil","Algarve",313,"2025-10-29T06:23:00",26205338,"Em resolução/conclusão","2201","Incêndio em equipamentos ou produtos",0,1,0,4,"2025-10-29T06:23:00","Aljezur","Faro","Algarve",-8.80035,37.384792,"Resolução/Conclusão"
26205355,"Barcarena","Grande Lisboa",311,"2025-10-29T06:25:00",26205355,"Em Despacho","3301","Queda de árvore",0,1,0,5,"2025-10-29T06:25:00","Oeiras","Lisboa","Área Metropolitana De Lisboa",-9.282164,38.744749,"Despacho"
26205266,"São Brás de Alportel","Algarve",313,"2025-10-29T04:59:00",26205266,"Em Despacho","3321","Dano na rede de fornecimento de eletricidade ",0,1,0,5,"2025-10-29T04:59:00","São Brás De Alportel","Faro","Algarve",-7.909012,37.166366,"Despacho"
26205334,"Campo de Ourique","Grande Lisboa",311,"2025-10-29T06:09:00",26205334,"Em Despacho","3315","Inundação de estruturas por precipitação intensa",0,2,0,5,"2025-10-29T06:09:00","Lisboa","Lisboa","Área Metropolitana De Lisboa",-9.169863,38.718496,"Despacho"
