"id","address","subregion","neighborhood","date","id.1","state","nature","nature_description","aerial_means","terrestrial_means","aquatic_means","operational","date.1","Concelho","Distrito","NUTII_DSG","longitude","latitude","state_2"
26273353,"Caminha (Matriz) e Vilarelho","Alto Minho",309,"2025-11-12T12:44:00",26273353,"Em Curso","3315","Inundação de estruturas por precipitação intensa",0,2,0,5,"2025-11-12T12:44:00","Caminha","Viana Do Castelo","Norte",-8.833052,41.857288,"Curso"
26276438,"Vimeiro","Oeste",311,"2025-11-13T05:51:00",26276438,"Em resolução/conclusão","2127","Incêndio em edifícios e recintos industriais, oficinas e armazéns",0,3,0,10,"2025-11-13T05:51:00","Alcobaça","Leiria","Centro",-9.01222,39.48278,"Resolução/Conclusão"
26280698,"Portela do Fojo-Machio","Região de Coimbra",310,"2025-11-13T15:34:00",26280698,"Em Despacho","3301","Queda de árvore",0,1,0,3,"2025-11-13T15:34:00","Pampilhosa Da Serra","Coimbra","Centro",-8.04522,39.986459,"Despacho"
26282088,"S.pedro e Santiago, S.maria e S.miguel e Matacães","Oeste",311,"2025-11-13T19:35:00",26282088,"Em resolução/conclusão","3315","Inundação de estruturas por precipitação intensa",0,4,0,9,"2025-11-13T19:35:00","Torres Vedras","Lisboa","Centro",-9.251952,39.091829,"Resolução/Conclusão"
26282322,"S.julião, N.s. da Anunciada e S. Maria da Graça","Península de Setúbal",311,"2025-11-13T20:33:00",26282322,"Em Curso","3315","Inundação de estruturas por precipitação intensa",0,0,0,0,"2025-11-13T20:33:00","Setúbal","Setúbal","Área Metropolitana De Lisboa",-8.889983,38.529955,"Curso"
26282713,"São Marcos da Serra","Algarve",313,"2025-11-13T22:38:00",26282713,"Em resolução/conclusão","2403","Colisão rodoviária",0,3,0,5,"2025-11-13T22:38:00","Silves","Faro","Algarve",-8.336467,37.402877,"Resolução/Conclusão"
26283029,"Mafra","Grande Lisboa",311,"2025-11-14T01:15:00",26283029,"Em Despacho","3301","Queda de árvore",0,1,0,5,"2025-11-14T01:15:00","Mafra","Lisboa","Área Metropolitana De Lisboa",-9.335577,38.956433,"Despacho"
26283040,"Seixal, Arrentela e Aldeia de Paio Pires","Península de Setúbal",311,"2025-11-14T01:20:00",26283040,"Em Despacho","3315","Inundação de estruturas por precipitação intensa",0,1,0,3,"2025-11-14T01:20:00","Seixal","Setúbal","Área Metropolitana De Lisboa",-9.087279,38.620394,"Despacho"
26283072,"Castelo Branco","Beira Baixa",310,"2025-11-14T01:30:00",26283072,"Em Curso","3201","Detritos não confinados",0,3,0,6,"2025-11-14T01:30:00","Castelo Branco","Castelo Branco","Centro",-7.486262,39.797957,"Curso"
26277267,"Azeitão (São Lourenço e São Simão)","Península de Setúbal",311,"2025-11-13T08:31:00",26277267,"Em Despacho","3315","Inundação de estruturas por precipitação intensa",0,0,0,0,"2025-11-13T08:31:00","Setúbal","Setúbal","Área Metropolitana De Lisboa",-8.973042,38.5075,"Despacho"
26278137,"Azeitão (São Lourenço e São Simão)","Península de Setúbal",311,"2025-11-13T10:24:00",26278137,"Em Despacho","3315","Inundação de estruturas por precipitação intensa",0,1,0,4,"2025-11-13T10:24:00","Setúbal","Setúbal","Área Metropolitana De Lisboa",-8.98876,38.55409,"Despacho"
26278838,"São Matias","Alto Alentejo",312,"2025-11-13T11:46:00",26278838,"Em resolução/conclusão","1103","Vento forte",0,4,0,7,"2025-11-13T11:46:00","Nisa","Portalegre","Alentejo",-7.747565,39.534658,"Resolução/Conclusão"
26281229,"Santiago de Montalegre","Médio Tejo",311,"2025-11-13T17:11:00",26281229,"Em resolução/conclusão","3313","Deslizamento de terras",0,2,0,4,"2025-11-13T17:11:00","Sardoal","Santarém","Centro",-8.14039,39.601274,"Resolução/Conclusão"
26281413,"S.pedro e Santiago, S.maria e S.miguel e Matacães","Oeste",311,"2025-11-13T14:17:00",26281413,"Em resolução/conclusão","3315","Inundação de estruturas por precipitação intensa",0,0,0,0,"2025-11-13T14:17:00","Torres Vedras","Lisboa","Centro",-9.251952,39.091829,"Resolução/Conclusão"
26281614,"São Martinho de Árvore e Lamarosa","Região de Coimbra",310,"2025-11-13T17:50:00",26281614,"Em Despacho","3311","Queda de elementos de estruturas edificados",0,1,0,2,"2025-11-13T17:50:00","Coimbra","Coimbra","Centro",-8.570188,40.226713,"Despacho"
26282017,"S.pedro e Santiago, S.maria e S.miguel e Matacães","Oeste",311,"2025-11-13T18:00:00",26282017,"Em Despacho","3315","Inundação de estruturas por precipitação intensa",0,2,0,9,"2025-11-13T18:00:00","Torres Vedras","Lisboa","Centro",-9.251952,39.091829,"Despacho"
26282080,"Maxial e Monte Redondo","Oeste",311,"2025-11-13T19:00:00",26282080,"Em resolução/conclusão","3313","Deslizamento de terras",0,1,0,5,"2025-11-13T19:00:00","Torres Vedras","Lisboa","Centro",-9.1958,39.12388,"Resolução/Conclusão"
26278163,"Santa Maria Maior e Monserrate e Meadela","Alto Minho",309,"2025-11-13T10:15:00",26278163,"Em Curso","3315","Inundação de estruturas por precipitação intensa",0,0,0,0,"2025-11-13T10:15:00","Viana Do Castelo","Viana Do Castelo","Norte",-8.837157,41.690707,"Curso"
26279467,"Azeitão (São Lourenço e São Simão)","Península de Setúbal",311,"2025-11-13T13:09:00",26279467,"Em Despacho","3301","Queda de árvore",0,0,0,0,"2025-11-13T13:09:00","Setúbal","Setúbal","Área Metropolitana De Lisboa",-8.99576,38.53837,"Despacho"
26281371,"Sé Nova, Santa Cruz, Almedina e São Bartolomeu","Região de Coimbra",310,"2025-11-13T17:26:00",26281371,"Em Despacho","3309","Desabamento de estruturas edificadas",0,1,0,3,"2025-11-13T17:26:00","Coimbra","Coimbra","Centro",-8.45395,40.243305,"Despacho"
26283059,"Buarcos","Região de Coimbra",310,"2025-11-14T00:30:00",26283059,"Em Despacho","3315","Inundação de estruturas por precipitação intensa",0,1,0,2,"2025-11-14T00:30:00","Figueira Da Foz","Coimbra","Centro",-8.876337,40.178363,"Despacho"
26248654,"Golegã","Lezíria do Tejo",311,"2025-11-07T09:04:00",26248654,"Em Curso","9115","Operação nacional de assistência",0,5,0,7,"2025-11-07T09:04:00","Golegã","Santarém","Alentejo",-8.472127,39.406562,"Curso"
26275117,"Regueira de Pontes","Região de Leiria",310,"2025-11-12T19:00:00",26275117,"Em resolução/conclusão","2101","Incêndio em edifícios habitacionais",0,1,0,2,"2025-11-12T19:00:00","Leiria","Leiria","Centro",-8.830185,39.800354,"Resolução/Conclusão"
26277482,"Rio Maior","Lezíria do Tejo",311,"2025-11-13T09:00:00",26277482,"Em Curso","3315","Inundação de estruturas por precipitação intensa",0,0,0,0,"2025-11-13T09:00:00","Rio Maior","Santarém","Alentejo",-8.95426,39.333899,"Curso"
26280488,"São Vicente da Beira","Beira Baixa",310,"2025-11-13T15:11:00",26280488,"Em Despacho","3313","Deslizamento de terras",0,2,0,4,"2025-11-13T15:11:00","Castelo Branco","Castelo Branco","Centro",-7.618568,40.061598,"Despacho"
26282412,"Moita","Península de Setúbal",311,"2025-11-13T06:30:00",26282412,"Em Curso","3315","Inundação de estruturas por precipitação intensa",0,0,0,0,"2025-11-13T06:30:00","Moita","Setúbal","Área Metropolitana De Lisboa",-8.960014,38.636677,"Curso"
26282773,"Três Povos","Beiras e Serra da Estrela",310,"2025-11-13T23:07:00",26282773,"Em Despacho","3315","Inundação de estruturas por precipitação intensa",0,2,0,4,"2025-11-13T23:07:00","Fundão","Castelo Branco","Centro",-7.29023,40.24863,"Despacho"
26282928,"S.maria, S.miguel, S.martinho, S.pedro Penaferrim","Grande Lisboa",311,"2025-11-14T00:16:00",26282928,"Em resolução/conclusão","2201","Incêndio em equipamentos ou produtos",0,2,0,7,"2025-11-14T00:16:00","Sintra","Lisboa","Área Metropolitana De Lisboa",-9.39172,38.79731,"Resolução/Conclusão"
26283057,"Tavira (Santa Maria e Santiago)","Algarve",313,"2025-11-14T01:28:00",26283057,"Em Despacho","3301","Queda de árvore",0,1,0,3,"2025-11-14T01:28:00","Tavira","Faro","Algarve",-7.64691,37.130442,"Despacho"
26282149,"Valado Dos Frades","Oeste",311,"2025-11-13T19:45:00",26282149,"Em Curso","1101","Cheia",0,1,0,2,"2025-11-13T19:45:00","Nazaré","Leiria","Centro",-9.041021,39.584542,"Curso"
26282749,"Friões","Alto Tâmega e Barroso",309,"2025-11-13T22:58:00",26282749,"Em resolução/conclusão","2407","Despiste",0,3,0,6,"2025-11-13T22:58:00","Valpaços","Vila Real","Norte",-7.407515,41.665623,"Resolução/Conclusão"
26282969,"Santa Maria Maior","Alto Tâmega e Barroso",309,"2025-11-14T00:38:00",26282969,"Em resolução/conclusão","2101","Incêndio em edifícios habitacionais",0,0,0,0,"2025-11-14T00:38:00","Chaves","Vila Real","Norte",-7.48173,41.74903,"Resolução/Conclusão"
26282984,"Guardão","Viseu Dão Lafões",310,"2025-11-14T00:44:00",26282984,"Em resolução/conclusão","2101","Incêndio em edifícios habitacionais",0,9,0,26,"2025-11-14T00:44:00","Tondela","Viseu","Centro",-8.201362,40.539122,"Resolução/Conclusão"
