"id","address","subregion","neighborhood","date","id.1","state","nature","nature_description","aerial_means","terrestrial_means","aquatic_means","operational","date.1","Concelho","Distrito","NUTII_DSG","longitude","latitude"
24729710,"Nagozelo do Douro","Douro",309,"2024-12-25T21:24:00",24729710,"Em despacho","3203","Detritos confinados",0,1,0,3,"2024-12-25T21:24:00","São João Da Pesqueira","Viseu","Norte",-7.413253,41.183434
24729743,"Azoia de Cima e Tremês","Lezíria do Tejo",311,"2024-12-25T21:44:00",24729743,"Em curso","2407","Despiste",0,4,0,11,"2024-12-25T21:44:00","Santarém","Santarém","Alentejo",-8.74937,39.36299
24729776,"Algueirão-Mem Martins","Grande Lisboa",311,"2024-12-25T21:41:00",24729776,"Em conclusão","2101","Incêndio em edifícios habitacionais",0,2,0,8,"2024-12-25T21:41:00","Sintra","Lisboa","Área Metropolitana De Lisboa",-9.330827,38.796332
24729385,"Vila Velha de Ródão","Beira Baixa",310,"2024-12-25T19:43:00",24729385,"Em conclusão","2301","Incêndio em transporte rodoviário",0,1,0,2,"2024-12-25T19:43:00","Vila Velha De Ródão","Castelo Branco","Centro",-7.637098,39.676228
24729501,"Gondomar (São Cosme), Valbom e Jovim","Area M. Porto",309,"2024-12-25T20:20:00",24729501,"Em conclusão","2407","Despiste",0,4,0,8,"2024-12-25T20:20:00","Gondomar","Porto","Norte",-8.523838,41.129143
24729535,"Nogueira da Regedoura","Area M. Porto",309,"2024-12-25T20:33:00",24729535,"Em resolução","2101","Incêndio em edifícios habitacionais",0,5,0,12,"2024-12-25T20:33:00","Santa Maria Da Feira","Aveiro","Norte",-8.587323,41.001032
24729604,"São João da Pesqueira e Várzea de Trevões","Douro",309,"2024-12-25T20:52:00",24729604,"Em despacho","2407","Despiste",0,2,0,4,"2024-12-25T20:52:00",NA,NA,NA,7.700112,41.233765
24729316,"S.julião, N.s. da Anunciada e S. Maria da Graça","Península de Setúbal",311,"2024-12-25T19:09:00",24729316,"Em despacho","2407","Despiste",0,2,0,7,"2024-12-25T19:09:00","Setúbal","Setúbal","Área Metropolitana De Lisboa",-8.889983,38.529955
24729355,"São Bartolomeu de Messines","Algarve",313,"2024-12-25T19:28:00",24729355,"Em curso","4327","Busca e resgate terrestre de pessoas",0,8,0,16,"2024-12-25T19:28:00","Silves","Faro","Algarve",-8.323485,37.223187
24729664,"Lardosa","Beira Baixa",310,"2024-12-25T21:10:00",24729664,"Em resolução","2407","Despiste",0,2,0,4,"2024-12-25T21:10:00","Castelo Branco","Castelo Branco","Centro",-7.45637,39.988718
24729832,"Lagos (São Sebastião e Santa Maria)","Algarve",313,"2024-12-25T22:17:00",24729832,"Em curso","2101","Incêndio em edifícios habitacionais",0,2,0,7,"2024-12-25T22:17:00","Lagos","Faro","Algarve",-8.668524,37.100485
24729615,"Sacavém e Prior Velho","Grande Lisboa",311,"2024-12-25T21:04:00",24729615,"Em conclusão","2129","Incêndio em edifícios degradados ou devolutos",0,2,0,7,"2024-12-25T21:04:00","Loures","Lisboa","Área Metropolitana De Lisboa",-9.11884,38.7899
24729640,"Águas Livres","Grande Lisboa",311,"2024-12-25T21:00:00",24729640,"Em resolução","2403","Colisão rodoviária",0,2,0,8,"2024-12-25T21:00:00","Amadora","Lisboa","Área Metropolitana De Lisboa",-9.219508,38.745534
