"id","address","subregion","neighborhood","date","id.1","state","nature","nature_description","aerial_means","terrestrial_means","aquatic_means","operational","date.1","Concelho","Distrito","NUTII_DSG","longitude","latitude"
25353076,"Gafanha da Nazaré","Região de Aveiro",310,"2025-05-10T01:06:00",25353076,"Em curso","2201","Incêndio em equipamentos ou produtos",0,3,0,7,"2025-05-10T01:06:00","Ílhavo","Aveiro","Centro",-8.700869,40.640606
25353093,"Rio Meão","Area M. Porto",309,"2025-05-10T01:14:00",25353093,"Em resolução","2407","Despiste",0,4,0,9,"2025-05-10T01:14:00","Santa Maria Da Feira","Aveiro","Norte",-8.572823,40.95825
25353110,"Santa Maria da Feira, Travanca, Sanfins e Espargo","Area M. Porto",309,"2025-05-10T01:23:00",25353110,"Em despacho","2407","Despiste",0,1,0,2,"2025-05-10T01:23:00","Santa Maria Da Feira","Aveiro","Norte",-8.520449,40.93376
25071496,"São Manços e São Vicente do Pigeiro","Alentejo Central",312,"2025-03-11T13:18:00",25071496,"Em conclusão","1101","Cheia",0,0,0,0,"2025-03-11T13:18:00","Évora","Évora","Alentejo",-7.713313,38.513673
25352733,"Castelo Branco","Beira Baixa",310,"2025-05-09T22:25:00",25352733,"Em despacho","4331","Busca e resgate terrestre de animais",0,1,0,2,"2025-05-09T22:25:00","Castelo Branco","Castelo Branco","Centro",-7.490756,39.816895
25353084,"Glória e Vera Cruz","Região de Aveiro",310,"2025-05-10T00:53:00",25353084,"Em curso","3315","Inundação de estruturas por precipitação intensa",0,1,0,2,"2025-05-10T00:53:00","Aveiro","Aveiro","Centro",-8.659223,40.645992
25352981,"Alqueidão","Região de Coimbra",310,"2025-05-10T00:12:00",25352981,"Em despacho","2407","Despiste",0,1,0,2,"2025-05-10T00:12:00","Figueira Da Foz","Coimbra","Centro",-8.772228,40.096989
25352997,"Caldas da Rainha - Santo Onofre e Serra do Bouro","Oeste",311,"2025-05-10T00:18:00",25352997,"Em despacho","4331","Busca e resgate terrestre de animais",0,1,0,1,"2025-05-10T00:18:00","Caldas Da Rainha","Leiria","Centro",-9.148929,39.401713
25353074,"Gafanha da Nazaré","Região de Aveiro",310,"2025-05-10T00:59:00",25353074,"Em curso","3315","Inundação de estruturas por precipitação intensa",0,1,0,2,"2025-05-10T00:59:00","Ílhavo","Aveiro","Centro",-8.756128,40.641907
25353097,"Glória e Vera Cruz","Região de Aveiro",310,"2025-05-10T00:54:00",25353097,"Em curso","3315","Inundação de estruturas por precipitação intensa",0,1,0,2,"2025-05-10T00:54:00","Aveiro","Aveiro","Centro",-8.659223,40.645992
25353117,"Montenegro","Algarve",313,"2025-05-10T01:26:00",25353117,"Em despacho","2115","Incêndio em edifícios hoteleiros e de restauração",0,6,0,16,"2025-05-10T01:26:00","Faro","Faro","Algarve",-7.990376,37.005201
25352914,"Palmela","Península de Setúbal",311,"2025-05-09T23:33:00",25352914,"Em conclusão","2403","Colisão rodoviária",0,2,0,7,"2025-05-09T23:33:00","Palmela","Setúbal","Área Metropolitana De Lisboa",-8.894979,38.568658
25353048,"Algés, Linda-a-Velha e Cruz Quebrada-Dafundo","Grande Lisboa",311,"2025-05-10T00:49:00",25353048,"Em conclusão","2407","Despiste",0,3,0,9,"2025-05-10T00:49:00","Oeiras","Lisboa","Área Metropolitana De Lisboa",-9.242367,38.700095
25353055,"Corroios","Península de Setúbal",311,"2025-05-10T00:54:00",25353055,"Em despacho","2403","Colisão rodoviária",0,2,0,5,"2025-05-10T00:54:00","Seixal","Setúbal","Área Metropolitana De Lisboa",-9.16,38.58032
25353073,"Alcochete","Península de Setúbal",311,"2025-05-10T00:55:00",25353073,"Em curso","2403","Colisão rodoviária",0,5,0,14,"2025-05-10T00:55:00","Montijo","Setúbal","Área Metropolitana De Lisboa",-8.927538,38.711669
25353100,"Glória e Vera Cruz","Região de Aveiro",310,"2025-05-10T01:05:00",25353100,"Em curso","3315","Inundação de estruturas por precipitação intensa",0,1,0,2,"2025-05-10T01:05:00","Aveiro","Aveiro","Centro",-8.659223,40.645992
25353123,"Leiria, Pousos, Barreira e Cortes","Região de Leiria",310,"2025-05-10T01:20:00",25353123,"Em despacho","4331","Busca e resgate terrestre de animais",0,2,0,3,"2025-05-10T01:20:00","Leiria","Leiria","Centro",-8.802832,39.749179
