"id","address","subregion","neighborhood","date","id.1","state","nature","nature_description","aerial_means","terrestrial_means","aquatic_means","operational","date.1","Concelho","Distrito","NUTII_DSG","longitude","latitude","state_2"
26220079,"Sapataria","Oeste",311,"2025-11-01T07:13:00",26220079,"Em Despacho","3315","Inundação de estruturas por precipitação intensa",0,1,0,2,"2025-11-01T07:13:00","Sobral De Monte Agraço","Lisboa","Centro",-9.197237,38.988758,"Despacho"
26220080,"Rio de Mouro","Grande Lisboa",311,"2025-11-01T07:20:00",26220080,"Em Despacho","3315","Inundação de estruturas por precipitação intensa",0,0,0,0,"2025-11-01T07:20:00","Sintra","Lisboa","Área Metropolitana De Lisboa",-9.322278,38.77571,"Despacho"
26220114,"Rio de Mouro","Grande Lisboa",311,"2025-11-01T07:33:00",26220114,"Em Despacho","3301","Queda de árvore",0,2,0,9,"2025-11-01T07:33:00","Sintra","Lisboa","Área Metropolitana De Lisboa",-9.344491,38.75763,"Despacho"
26220495,"Odivelas","Grande Lisboa",311,"2025-11-01T09:11:00",26220495,"Em Despacho","4331","Busca e resgate terrestre de animais",0,2,0,4,"2025-11-01T09:11:00","Odivelas","Lisboa","Área Metropolitana De Lisboa",-9.182813,38.793425,"Despacho"
26220514,"Carregueira","Lezíria do Tejo",311,"2025-11-01T09:17:00",26220514,"Em resolução/conclusão","3309","Desabamento de estruturas edificadas",0,2,0,3,"2025-11-01T09:17:00","Chamusca","Santarém","Alentejo",-8.413408,39.416672,"Resolução/Conclusão"
26220530,"Gondesende","Terras de Trás-os-Montes",309,"2025-11-01T09:20:00",26220530,"Em resolução/conclusão","2101","Incêndio em edifícios habitacionais",0,5,0,15,"2025-11-01T09:20:00","Bragança","Bragança","Norte",-6.841655,41.850532,"Resolução/Conclusão"
26220546,"Pontinha e Famões","Grande Lisboa",311,"2025-11-01T09:22:00",26220546,"Em resolução/conclusão","2407","Despiste",0,2,0,5,"2025-11-01T09:22:00","Odivelas","Lisboa","Área Metropolitana De Lisboa",-9.190629,38.777141,"Resolução/Conclusão"
26220563,"Alverca do Ribatejo e Sobralinho","Grande Lisboa",311,"2025-11-01T08:50:00",26220563,"Em Despacho","3315","Inundação de estruturas por precipitação intensa",0,1,0,4,"2025-11-01T08:50:00","Vila Franca De Xira","Lisboa","Área Metropolitana De Lisboa",-9.046012,38.896362,"Despacho"
26220597,"Areias e Pias","Médio Tejo",311,"2025-11-01T09:34:00",26220597,"Em resolução/conclusão","3301","Queda de árvore",0,2,0,5,"2025-11-01T09:34:00","Ferreira Do Zêzere","Santarém","Centro",-8.384317,39.730558,"Resolução/Conclusão"
26220615,"Cascais e Estoril","Grande Lisboa",311,"2025-11-01T09:22:00",26220615,"Em Curso","4339","Corte ou remoção de elementos",0,3,0,7,"2025-11-01T09:22:00","Cascais","Lisboa","Área Metropolitana De Lisboa",-9.472747,38.73135,"Curso"
26219908,"Malveira e São Miguel de Alcainça","Grande Lisboa",311,"2025-11-01T05:20:00",26219908,"Em resolução/conclusão","3315","Inundação de estruturas por precipitação intensa",0,1,0,1,"2025-11-01T05:20:00","Mafra","Lisboa","Área Metropolitana De Lisboa",-9.25517,38.92932,"Resolução/Conclusão"
26220115,"Santo António Dos Cavaleiros e Frielas","Grande Lisboa",311,"2025-11-01T07:35:00",26220115,"Em Despacho","3315","Inundação de estruturas por precipitação intensa",0,0,0,0,"2025-11-01T07:35:00","Loures","Lisboa","Área Metropolitana De Lisboa",-9.151499,38.81613,"Despacho"
26220258,"Constância","Médio Tejo",311,"2025-11-01T08:13:00",26220258,"Em resolução/conclusão","3301","Queda de árvore",0,2,0,7,"2025-11-01T08:13:00","Constância","Santarém","Centro",-8.334164,39.476237,"Resolução/Conclusão"
26220551,"Canedo, Vale e Vila Maior","Area M. Porto",309,"2025-11-01T09:08:00",26220551,"Em Despacho","4331","Busca e resgate terrestre de animais",0,1,0,2,"2025-11-01T09:08:00","Santa Maria Da Feira","Aveiro","Norte",-8.448673,41.011004,"Despacho"
26220592,"Póvoa de Santa Iria e Forte da Casa","Grande Lisboa",311,"2025-11-01T09:33:00",26220592,"Em Curso","3323","Dano na rede de abastecimento de água",0,2,0,3,"2025-11-01T09:33:00","Vila Franca De Xira","Lisboa","Área Metropolitana De Lisboa",-9.074516,38.85114,"Curso"
26220599,"Capelins (Santo António)","Alentejo Central",312,"2025-11-01T09:28:00",26220599,"Em resolução/conclusão","3103","Incêndio rural",0,4,0,9,"2025-11-01T09:28:00","Alandroal","Évora","Alentejo",-7.381637,38.526108,"Resolução/Conclusão"
26220633,"Belazaima do Chão, Castanheira do Vouga e Agadão","Região de Aveiro",310,"2025-11-01T09:30:00",26220633,"Em Despacho","3301","Queda de árvore",0,1,0,2,"2025-11-01T09:30:00","Águeda","Aveiro","Centro",-8.360382,40.588905,"Despacho"
26220717,"Guia, Ilha e Mata Mourisca","Região de Leiria",310,"2025-11-01T09:46:00",26220717,"Em Curso","3301","Queda de árvore",0,3,0,7,"2025-11-01T09:46:00","Pombal","Leiria","Centro",-8.73512,39.920123,"Curso"
26220783,"Santa Maria Maior e Monserrate e Meadela","Alto Minho",309,"2025-11-01T09:46:00",26220783,"Em Despacho","3317","Inundação de estruturas por água canalizada",0,1,0,2,"2025-11-01T09:46:00","Viana Do Castelo","Viana Do Castelo","Norte",-8.81652,41.703882,"Despacho"
26220629,"Braga (São Vítor)","Cávado",309,"2025-11-01T09:30:00",26220629,"Em Despacho","3301","Queda de árvore",0,3,0,6,"2025-11-01T09:30:00","Braga","Braga","Norte",-8.406451,41.557726,"Despacho"
26220697,"Colares","Grande Lisboa",311,"2025-11-01T09:39:00",26220697,"Em Despacho","3301","Queda de árvore",0,1,0,3,"2025-11-01T09:39:00","Sintra","Lisboa","Área Metropolitana De Lisboa",-9.445808,38.824992,"Despacho"
26220698,"Sé Nova, Santa Cruz, Almedina e São Bartolomeu","Região de Coimbra",310,"2025-11-01T09:50:00",26220698,"Em Despacho","3315","Inundação de estruturas por precipitação intensa",0,1,0,3,"2025-11-01T09:50:00","Coimbra","Coimbra","Centro",-8.45395,40.243305,"Despacho"
26220714,"Cantanhede e Pocariça","Região de Coimbra",310,"2025-11-01T09:35:00",26220714,"Em Despacho","4331","Busca e resgate terrestre de animais",0,1,0,2,"2025-11-01T09:35:00","Cantanhede","Coimbra","Centro",-8.590971,40.346407,"Despacho"
26220749,"Caldas da Rainha - Santo Onofre e Serra do Bouro","Oeste",311,"2025-11-01T10:01:00",26220749,"Em Despacho","3317","Inundação de estruturas por água canalizada",0,0,0,0,"2025-11-01T10:01:00","Caldas Da Rainha","Leiria","Centro",-9.148929,39.401713,"Despacho"
26220781,"S.pedro e Santiago, S.maria e S.miguel e Matacães","Oeste",311,"2025-11-01T10:04:00",26220781,"Em Despacho","3315","Inundação de estruturas por precipitação intensa",0,1,0,2,"2025-11-01T10:04:00","Torres Vedras","Lisboa","Centro",-9.251952,39.091829,"Despacho"
26220866,"Ramalhal","Oeste",311,"2025-11-01T10:21:00",26220866,"Em Despacho","3301","Queda de árvore",0,1,0,5,"2025-11-01T10:21:00","Torres Vedras","Lisboa","Centro",-9.24961,39.163007,"Despacho"
26220880,"Sé Nova, Santa Cruz, Almedina e São Bartolomeu","Região de Coimbra",310,"2025-11-01T10:23:00",26220880,"Em Despacho","3301","Queda de árvore",0,1,0,2,"2025-11-01T10:23:00","Coimbra","Coimbra","Centro",-8.425582,40.205556,"Despacho"
26219148,"Minde","Médio Tejo",311,"2025-10-31T23:00:00",26219148,"Em Despacho","3315","Inundação de estruturas por precipitação intensa",0,2,0,6,"2025-10-31T23:00:00","Alcanena","Santarém","Centro",-8.691237,39.511095,"Despacho"
26220141,"Torres Novas (Santa Maria, Salvador e Santiago)","Médio Tejo",311,"2025-11-01T07:43:00",26220141,"Em Despacho","3315","Inundação de estruturas por precipitação intensa",0,1,0,2,"2025-11-01T07:43:00","Torres Novas","Santarém","Centro",-8.539335,39.476394,"Despacho"
26220225,"S.maria, S.miguel, S.martinho, S.pedro Penaferrim","Grande Lisboa",311,"2025-11-01T08:01:00",26220225,"Em Despacho","3315","Inundação de estruturas por precipitação intensa",0,1,0,2,"2025-11-01T08:01:00","Sintra","Lisboa","Área Metropolitana De Lisboa",-9.387899,38.805813,"Despacho"
26220284,"Pontével","Lezíria do Tejo",311,"2025-11-01T08:22:00",26220284,"Em resolução/conclusão","2407","Despiste",0,1,0,2,"2025-11-01T08:22:00","Cartaxo","Santarém","Alentejo",-8.866975,39.15705,"Resolução/Conclusão"
26220318,"Santo Antão e São Julião do Tojal","Grande Lisboa",311,"2025-11-01T08:06:00",26220318,"Em Curso","3315","Inundação de estruturas por precipitação intensa",0,4,0,11,"2025-11-01T08:06:00","Loures","Lisboa","Área Metropolitana De Lisboa",-9.110792,38.86218,"Curso"
26220509,"Moita","Península de Setúbal",311,"2025-11-01T09:13:00",26220509,"Em Curso","4331","Busca e resgate terrestre de animais",0,2,0,6,"2025-11-01T09:13:00","Moita","Setúbal","Área Metropolitana De Lisboa",-8.985364,38.643702,"Curso"
26220527,"Lavos","Região de Coimbra",310,"2025-11-01T09:16:00",26220527,"Em Despacho","3315","Inundação de estruturas por precipitação intensa",0,1,0,6,"2025-11-01T09:16:00","Figueira Da Foz","Coimbra","Centro",-8.827295,40.092169,"Despacho"
26220532,"Santo António Dos Olivais","Região de Coimbra",310,"2025-11-01T09:08:00",26220532,"Em Despacho","3315","Inundação de estruturas por precipitação intensa",0,1,0,3,"2025-11-01T09:08:00","Coimbra","Coimbra","Centro",-8.400274,40.210754,"Despacho"
26220600,"Benedita","Oeste",311,"2025-11-01T09:07:00",26220600,"Em Despacho","3315","Inundação de estruturas por precipitação intensa",0,1,0,3,"2025-11-01T09:07:00","Alcobaça","Leiria","Centro",-8.999343,39.415534,"Despacho"
26219952,"Barbeita","Alto Minho",309,"2025-11-01T06:01:00",26219952,"Em resolução/conclusão","3321","Dano na rede de fornecimento de eletricidade ",0,0,0,0,"2025-11-01T06:01:00","Monção","Viana Do Castelo","Norte",-8.404722,42.06692,"Resolução/Conclusão"
26220053,"Benedita","Oeste",311,"2025-11-01T07:08:00",26220053,"Em resolução/conclusão","2201","Incêndio em equipamentos ou produtos",0,2,0,4,"2025-11-01T07:08:00","Alcobaça","Leiria","Centro",-8.98155,39.39759,"Resolução/Conclusão"
26220287,"Mafra","Grande Lisboa",311,"2025-11-01T08:17:00",26220287,"Em Despacho","3315","Inundação de estruturas por precipitação intensa",0,1,0,4,"2025-11-01T08:17:00","Mafra","Lisboa","Área Metropolitana De Lisboa",-9.337252,38.942359,"Despacho"
26220303,"Vila Nova de Milfontes","Alentejo Litoral",312,"2025-11-01T08:20:00",26220303,"Em resolução/conclusão","2407","Despiste",0,1,0,2,"2025-11-01T08:20:00","Odemira","Beja","Alentejo",-8.787529,37.721575,"Resolução/Conclusão"
26220389,"Vila Franca de Xira","Grande Lisboa",311,"2025-11-01T08:44:00",26220389,"Em Despacho","3315","Inundação de estruturas por precipitação intensa",0,0,0,0,"2025-11-01T08:44:00","Vila Franca De Xira","Lisboa","Área Metropolitana De Lisboa",-8.982169,38.955394,"Despacho"
26220473,"Samora Correia","Lezíria do Tejo",311,"2025-11-01T09:07:00",26220473,"Em resolução/conclusão","2403","Colisão rodoviária",0,5,0,10,"2025-11-01T09:07:00","Benavente","Santarém","Alentejo",-8.868908,38.935447,"Resolução/Conclusão"
26220570,"Alverca do Ribatejo e Sobralinho","Grande Lisboa",311,"2025-11-01T09:03:00",26220570,"Em Despacho","3315","Inundação de estruturas por precipitação intensa",0,1,0,5,"2025-11-01T09:03:00","Vila Franca De Xira","Lisboa","Área Metropolitana De Lisboa",-9.046012,38.896362,"Despacho"
26220621,"Olhão","Algarve",313,"2025-11-01T09:37:00",26220621,"Em resolução/conclusão","2403","Colisão rodoviária",0,3,0,6,"2025-11-01T09:37:00","Olhão","Faro","Algarve",-7.843133,37.022054,"Resolução/Conclusão"
26220707,"Além da Ribeira e Pedreira","Médio Tejo",311,"2025-11-01T09:52:00",26220707,"Em Despacho","3313","Deslizamento de terras",0,2,0,5,"2025-11-01T09:52:00","Tomar","Santarém","Centro",-8.416189,39.64089,"Despacho"
26220772,"Serra D'El-Rei","Oeste",311,"2025-11-01T10:00:00",26220772,"Em Despacho","3315","Inundação de estruturas por precipitação intensa",0,1,0,2,"2025-11-01T10:00:00","Peniche","Leiria","Centro",-9.27897,39.332052,"Despacho"
26220842,"Valada","Lezíria do Tejo",311,"2025-11-01T10:21:00",26220842,"Em Despacho","3315","Inundação de estruturas por precipitação intensa",0,1,0,5,"2025-11-01T10:21:00","Cartaxo","Santarém","Alentejo",-8.764108,39.081983,"Despacho"
26220860,"Eiras, São Julião de Montenegro e Cela","Alto Tâmega e Barroso",309,"2025-11-01T10:25:00",26220860,"Em Despacho","2403","Colisão rodoviária",0,0,0,0,"2025-11-01T10:25:00","Chaves","Vila Real","Norte",-7.41776,41.72382,"Despacho"
26220821,"Pedrógão Grande","Região de Leiria",310,"2025-11-01T09:52:00",26220821,"Em Despacho","3321","Dano na rede de fornecimento de eletricidade ",0,1,0,5,"2025-11-01T09:52:00","Pedrógão Grande","Leiria","Centro",-8.16704,39.937544,"Despacho"
26220823,"Margaride (Santa Eulália), Várzea, Lagares, Varziela e Moure","Tâmega e Sousa",309,"2025-11-01T10:11:00",26220823,"Em Curso","2403","Colisão rodoviária",0,2,0,4,"2025-11-01T10:11:00","Felgueiras","Porto","Norte",-8.213758,41.363422,"Curso"
26220856,"Caminha (Matriz) e Vilarelho","Alto Minho",309,"2025-11-01T10:22:00",26220856,"Em Despacho","3301","Queda de árvore",0,1,0,3,"2025-11-01T10:22:00","Caminha","Viana Do Castelo","Norte",-8.839419,41.867575,"Despacho"
26220889,"Vale da Pedra","Lezíria do Tejo",311,"2025-11-01T10:29:00",26220889,"Em Despacho","2403","Colisão rodoviária",0,3,0,6,"2025-11-01T10:29:00","Cartaxo","Santarém","Alentejo",-8.812939,39.112334,"Despacho"
26220650,"Valada","Lezíria do Tejo",311,"2025-11-01T09:44:00",26220650,"Em resolução/conclusão","3315","Inundação de estruturas por precipitação intensa",0,0,0,0,"2025-11-01T09:44:00","Cartaxo","Santarém","Alentejo",-8.764108,39.081983,"Resolução/Conclusão"
26220666,"Santa Maria do Castelo e Santiago e Santa Susana","Alentejo Litoral",312,"2025-11-01T09:34:00",26220666,"Em Curso","3301","Queda de árvore",0,2,0,6,"2025-11-01T09:34:00","Alcácer Do Sal","Setúbal","Alentejo",-8.639848,38.431178,"Curso"
26220836,"Alverca do Ribatejo e Sobralinho","Grande Lisboa",311,"2025-11-01T10:15:00",26220836,"Em resolução/conclusão","2127","Incêndio em edifícios e recintos industriais, oficinas e armazéns",0,2,0,7,"2025-11-01T10:15:00","Vila Franca De Xira","Lisboa","Área Metropolitana De Lisboa",-9.034761,38.918068,"Resolução/Conclusão"
26220859,"Espinho","Area M. Porto",309,"2025-11-01T10:23:00",26220859,"Em Despacho","3317","Inundação de estruturas por água canalizada",0,1,0,3,"2025-11-01T10:23:00","Espinho","Aveiro","Norte",-8.64078,41.007665,"Despacho"
26220875,"Malveira e São Miguel de Alcainça","Grande Lisboa",311,"2025-11-01T10:25:00",26220875,"Em Despacho","3313","Deslizamento de terras",0,1,0,2,"2025-11-01T10:25:00","Mafra","Lisboa","Área Metropolitana De Lisboa",-9.249398,38.929722,"Despacho"
