"id","address","subregion","neighborhood","date","id.1","state","nature","nature_description","aerial_means","terrestrial_means","aquatic_means","operational","date.1","Concelho","Distrito","NUTII_DSG","longitude","latitude"
24850898,"Sepins e Bolho","Região de Coimbra",310,"2025-01-21T18:50:00",24850898,"Em curso","4327","Busca e resgate terrestre de pessoas",0,7,0,13,"2025-01-21T18:50:00","Cantanhede","Coimbra","Centro",-8.530113,40.405168
24850991,"Santa Maria da Feira, Travanca, Sanfins e Espargo","Area M. Porto",309,"2025-01-21T19:32:00",24850991,"Em despacho","3315","Inundação de estruturas por precipitação intensa",0,1,0,2,"2025-01-21T19:32:00","Santa Maria Da Feira","Aveiro","Norte",-8.53693,40.93173
24852411,"Fronteira","Alto Alentejo",312,"2025-01-22T06:12:00",24852411,"Em curso","3301","Queda de árvore",0,2,0,6,"2025-01-22T06:12:00","Fronteira","Portalegre","Alentejo",-7.64399,39.041888
24852427,"Azeitão (São Lourenço e São Simão)","Península de Setúbal",311,"2025-01-22T06:47:00",24852427,"Em despacho","2201","Incêndio em equipamentos ou produtos",0,1,0,5,"2025-01-22T06:47:00","Setúbal","Setúbal","Área Metropolitana De Lisboa",-9.000141,38.50642
24852486,"Sé Nova, Santa Cruz, Almedina e São Bartolomeu","Região de Coimbra",310,"2025-01-22T07:09:00",24852486,"Em conclusão","2201","Incêndio em equipamentos ou produtos",0,3,0,9,"2025-01-22T07:09:00","Coimbra","Coimbra","Centro",-8.425582,40.205556
24852502,"Serzedelo","Ave",309,"2025-01-22T07:23:00",24852502,"Em resolução","2403","Colisão rodoviária",0,2,0,4,"2025-01-22T07:23:00","Guimarães","Braga","Norte",-8.36693,41.405418
24852570,"São Mamede de Infesta e Senhora da Hora","Area M. Porto",309,"2025-01-22T07:51:00",24852570,"Em curso","2411","Atropelamento ferroviário",0,1,0,2,"2025-01-22T07:51:00","Matosinhos","Porto","Norte",-8.654568,41.18634
24852602,"Caranguejeira","Região de Leiria",310,"2025-01-22T08:03:00",24852602,"Em despacho","3321","Dano na rede de fornecimento de eletricidade ",0,0,0,0,"2025-01-22T08:03:00","Leiria","Leiria","Centro",-8.711905,39.758676
24852627,"Santa Iria de Azoia, São João da Talha e Bobadela","Grande Lisboa",311,"2025-01-22T08:01:00",24852627,"Em resolução","2403","Colisão rodoviária",0,2,0,6,"2025-01-22T08:01:00","Loures","Lisboa","Área Metropolitana De Lisboa",-9.079846,38.840245
24851780,"São Miguel, Santa Eufémia e Rabaçal","Região de Coimbra",310,"2025-01-21T23:25:00",24851780,"Em curso","3315","Inundação de estruturas por precipitação intensa",0,0,0,0,"2025-01-21T23:25:00","Penela","Coimbra","Centro",-8.399036,40.025502
24852348,"S.julião, N.s. da Anunciada e S. Maria da Graça","Península de Setúbal",311,"2025-01-22T05:57:00",24852348,"Em conclusão","2201","Incêndio em equipamentos ou produtos",0,1,0,5,"2025-01-22T05:57:00","Setúbal","Setúbal","Área Metropolitana De Lisboa",-8.889983,38.529955
24852429,"Palmeira","Cávado",309,"2025-01-22T06:50:00",24852429,"Em resolução","2201","Incêndio em equipamentos ou produtos",0,1,0,6,"2025-01-22T06:50:00","Braga","Braga","Norte",-8.428,41.59143
24852464,"Faro (Sé e São Pedro)","Algarve",313,"2025-01-22T07:05:00",24852464,"Em conclusão","2403","Colisão rodoviária",0,1,0,2,"2025-01-22T07:05:00","Faro","Faro","Algarve",-7.942032,37.01865
24852563,"Ílhavo (São Salvador)","Região de Aveiro",310,"2025-01-22T07:43:00",24852563,"Em conclusão","2403","Colisão rodoviária",0,3,0,9,"2025-01-22T07:43:00","Ílhavo","Aveiro","Centro",-8.699143,40.613385
24852597,"São Brás de Alportel","Algarve",313,"2025-01-22T08:04:00",24852597,"Em despacho","3315","Inundação de estruturas por precipitação intensa",0,1,0,5,"2025-01-22T08:04:00","São Brás De Alportel","Faro","Algarve",-7.90377,37.15284
24852598,"N. S. da Vila, N. S. do Bispo e Silveiras","Alentejo Central",312,"2025-01-22T07:57:00",24852598,"Em despacho","3301","Queda de árvore",0,2,0,3,"2025-01-22T07:57:00","Montemor-o-Novo","Évora","Alentejo",-8.164667,38.698117
24852616,"Seixal, Arrentela e Aldeia de Paio Pires","Península de Setúbal",311,"2025-01-22T08:03:00",24852616,"Em despacho","3321","Dano na rede de fornecimento de eletricidade ",0,1,0,3,"2025-01-22T08:03:00","Seixal","Setúbal","Área Metropolitana De Lisboa",-9.092719,38.597829
24852648,"Bonfim","Area M. Porto",309,"2025-01-22T08:09:00",24852648,"Em despacho","3329","Queda de estruturas temporárias ou móveis",0,1,0,5,"2025-01-22T08:09:00","Porto","Porto","Norte",-8.596119,41.151713
24847907,"Aldeia do Bispo, Águas e Aldeia de João Pires","Beira Baixa",310,"2025-01-21T09:20:00",24847907,"Em curso","4327","Busca e resgate terrestre de pessoas",0,4,0,11,"2025-01-21T09:20:00","Penamacor","Castelo Branco","Centro",-7.2077,40.109481
24852419,"Castelo Branco","Beira Baixa",310,"2025-01-22T06:36:00",24852419,"Em resolução","3325","Dano na rede de abastecimento de gás",0,2,0,3,"2025-01-22T06:36:00","Castelo Branco","Castelo Branco","Centro",-7.489248,39.833285
24852478,"Pereira","Região de Coimbra",310,"2025-01-22T07:09:00",24852478,"Em despacho","2407","Despiste",0,2,0,4,"2025-01-22T07:09:00","Montemor-o-Velho","Coimbra","Centro",-8.58521,40.188831
24852551,"Alvorge","Região de Leiria",310,"2025-01-22T07:38:00",24852551,"Em despacho","3315","Inundação de estruturas por precipitação intensa",0,1,0,4,"2025-01-22T07:38:00","Ansião","Leiria","Centro",-8.437457,39.972271
24852560,"Arca e Ponte de Lima","Alto Minho",309,"2025-01-22T07:48:00",24852560,"Em conclusão","2301","Incêndio em transporte rodoviário",0,2,0,7,"2025-01-22T07:48:00","Ponte De Lima","Viana Do Castelo","Norte",-8.58686,41.761372
24852562,"Samora Correia","Lezíria do Tejo",311,"2025-01-22T07:48:00",24852562,"Em despacho","2407","Despiste",0,1,0,2,"2025-01-22T07:48:00","Benavente","Santarém","Alentejo",-8.860734,38.925589
24851587,"Costa da Caparica","Península de Setúbal",311,"2025-01-21T22:25:00",24851587,"Em conclusão","2115","Incêndio em edifícios hoteleiros e de restauração",0,8,0,17,"2025-01-21T22:25:00","Almada","Setúbal","Área Metropolitana De Lisboa",-9.21176,38.60968
24851821,"Santa Maria do Castelo e Santiago e Santa Susana","Alentejo Litoral",312,"2025-01-21T23:41:00",24851821,"Em resolução","1103","Vento forte",0,11,0,21,"2025-01-21T23:41:00","Alcácer Do Sal","Setúbal","Alentejo",-8.598678,38.397168
24852406,"Colmeias e Memória","Região de Leiria",310,"2025-01-22T06:36:00",24852406,"Em despacho","3321","Dano na rede de fornecimento de eletricidade ",0,3,0,5,"2025-01-22T06:36:00","Leiria","Leiria","Centro",-8.683668,39.78304
24852487,"São Brás de Alportel","Algarve",313,"2025-01-22T07:13:00",24852487,"Em despacho","3315","Inundação de estruturas por precipitação intensa",0,1,0,3,"2025-01-22T07:13:00","São Brás De Alportel","Faro","Algarve",-7.897745,37.169047
24852504,"Freixial e Juncal do Campo","Beira Baixa",310,"2025-01-22T07:29:00",24852504,"Em resolução","3313","Deslizamento de terras",0,3,0,6,"2025-01-22T07:29:00","Castelo Branco","Castelo Branco","Centro",-7.60584,39.91218
24852523,"São Brás de Alportel","Algarve",313,"2025-01-22T07:34:00",24852523,"Em despacho","3315","Inundação de estruturas por precipitação intensa",0,0,0,0,"2025-01-22T07:34:00","São Brás De Alportel","Faro","Algarve",-7.89716,37.17049
24852605,"Algés, Linda-a-Velha e Cruz Quebrada-Dafundo","Grande Lisboa",311,"2025-01-22T07:38:00",24852605,"Em despacho","3315","Inundação de estruturas por precipitação intensa",0,1,0,5,"2025-01-22T07:38:00","Oeiras","Lisboa","Área Metropolitana De Lisboa",-9.22967,38.696612
