"id","address","subregion","neighborhood","date","id.1","state","nature","nature_description","aerial_means","terrestrial_means","aquatic_means","operational","date.1","Concelho","Distrito","NUTII_DSG","longitude","latitude"
24851260,"Massamá e Monte Abraão","Grande Lisboa",311,"2025-01-21T20:49:00",24851260,"Em curso","2407","Despiste",0,3,0,6,"2025-01-21T20:49:00","Sintra","Lisboa","Área Metropolitana De Lisboa",-9.26774,38.75879
24851780,"São Miguel, Santa Eufémia e Rabaçal","Região de Coimbra",310,"2025-01-21T23:25:00",24851780,"Em curso","3315","Inundação de estruturas por precipitação intensa",0,0,0,0,"2025-01-21T23:25:00","Penela","Coimbra","Centro",-8.399036,40.025502
24851812,"Couço","Lezíria do Tejo",311,"2025-01-21T23:37:00",24851812,"Em despacho","3311","Queda de elementos de estruturas edificados",0,1,0,1,"2025-01-21T23:37:00","Coruche","Santarém","Alentejo",-8.358237,39.012318
24851844,"Palmela","Península de Setúbal",311,"2025-01-21T23:40:00",24851844,"Em curso","3321","Dano na rede de fornecimento de eletricidade ",0,2,0,7,"2025-01-21T23:40:00","Palmela","Setúbal","Área Metropolitana De Lisboa",-8.894979,38.568658
24851846,"Oliveira do Douro","Area M. Porto",309,"2025-01-21T23:44:00",24851846,"Em despacho","3315","Inundação de estruturas por precipitação intensa",0,1,0,3,"2025-01-21T23:44:00","Vila Nova De Gaia","Porto","Norte",-8.585272,41.125484
24851864,"Miranda do Corvo","Região de Coimbra",310,"2025-01-21T23:50:00",24851864,"Em despacho","3315","Inundação de estruturas por precipitação intensa",0,1,0,2,"2025-01-21T23:50:00","Miranda Do Corvo","Coimbra","Centro",-8.340614,40.075155
24851880,"Nossa Senhora de Fátima","Médio Tejo",311,"2025-01-22T00:05:00",24851880,"Em conclusão","3315","Inundação de estruturas por precipitação intensa",0,1,0,2,"2025-01-22T00:05:00","Entroncamento","Santarém","Centro",-8.485202,39.466869
24851894,"Trevões e Espinhosa","Douro",309,"2025-01-22T00:08:00",24851894,"Em curso","2127","Incêndio em edifícios e recintos industriais, oficinas e armazéns",0,1,0,3,"2025-01-22T00:08:00","São João Da Pesqueira","Viseu","Norte",-7.478538,41.090179
24851929,"Pinhal Novo","Península de Setúbal",311,"2025-01-21T23:46:00",24851929,"Em despacho","3315","Inundação de estruturas por precipitação intensa",0,1,0,5,"2025-01-21T23:46:00","Palmela","Setúbal","Área Metropolitana De Lisboa",-8.91294,38.637902
24851962,"Santa Iria de Azoia, São João da Talha e Bobadela","Grande Lisboa",311,"2025-01-22T00:41:00",24851962,"Em curso","2407","Despiste",0,5,0,17,"2025-01-22T00:41:00","Loures","Lisboa","Área Metropolitana De Lisboa",-9.093217,38.806807
24846892,"Tavira (Santa Maria e Santiago)","Algarve",313,"2025-01-20T23:37:00",24846892,"Em curso","3315","Inundação de estruturas por precipitação intensa",0,0,0,0,"2025-01-20T23:37:00","Tavira","Faro","Algarve",-7.650217,37.141268
24851587,"Costa da Caparica","Península de Setúbal",311,"2025-01-21T22:25:00",24851587,"Em conclusão","2115","Incêndio em edifícios hoteleiros e de restauração",0,19,0,51,"2025-01-21T22:25:00","Almada","Setúbal","Área Metropolitana De Lisboa",-9.21176,38.60968
24851620,"Seixal, Arrentela e Aldeia de Paio Pires","Península de Setúbal",311,"2025-01-21T22:35:00",24851620,"Em despacho","3315","Inundação de estruturas por precipitação intensa",0,1,0,4,"2025-01-21T22:35:00","Seixal","Setúbal","Área Metropolitana De Lisboa",-9.10605,38.59669
24851769,"Santo António da Charneca","Península de Setúbal",311,"2025-01-21T23:03:00",24851769,"Em despacho","3315","Inundação de estruturas por precipitação intensa",0,3,0,11,"2025-01-21T23:03:00","Barreiro","Setúbal","Área Metropolitana De Lisboa",-9.029919,38.624451
24851821,"Santa Maria do Castelo e Santiago e Santa Susana","Alentejo Litoral",312,"2025-01-21T23:41:00",24851821,"Em despacho","3301","Queda de árvore",0,1,0,2,"2025-01-21T23:41:00","Alcácer Do Sal","Setúbal","Alentejo",-8.703333,38.36917
24851839,"Caranguejeira","Região de Leiria",310,"2025-01-21T23:49:00",24851839,"Em despacho","3315","Inundação de estruturas por precipitação intensa",0,1,0,2,"2025-01-21T23:49:00","Leiria","Leiria","Centro",-8.711905,39.758676
24851853,"Glória do Ribatejo e Granho","Lezíria do Tejo",311,"2025-01-21T23:52:00",24851853,"Em resolução","3315","Inundação de estruturas por precipitação intensa",0,2,0,7,"2025-01-21T23:52:00","Salvaterra De Magos","Santarém","Alentejo",-8.655833,39.095893
24851955,"Caparica e Trafaria","Península de Setúbal",311,"2025-01-22T00:40:00",24851955,"Em despacho","3315","Inundação de estruturas por precipitação intensa",0,1,0,4,"2025-01-22T00:40:00","Almada","Setúbal","Área Metropolitana De Lisboa",-9.256667,38.66444
24850898,"Sepins e Bolho","Região de Coimbra",310,"2025-01-21T18:50:00",24850898,"Em curso","4327","Busca e resgate terrestre de pessoas",0,4,0,7,"2025-01-21T18:50:00","Cantanhede","Coimbra","Centro",-8.530113,40.405168
24850991,"Santa Maria da Feira, Travanca, Sanfins e Espargo","Area M. Porto",309,"2025-01-21T19:32:00",24850991,"Em despacho","3315","Inundação de estruturas por precipitação intensa",0,1,0,2,"2025-01-21T19:32:00","Santa Maria Da Feira","Aveiro","Norte",-8.53693,40.93173
24851239,"Caldas da Rainha - Santo Onofre e Serra do Bouro","Oeste",311,"2025-01-21T20:36:00",24851239,"Em curso","2407","Despiste",0,5,0,12,"2025-01-21T20:36:00","Caldas Da Rainha","Leiria","Centro",-9.148929,39.401713
24851400,"Esmoriz","Região de Aveiro",310,"2025-01-21T21:19:00",24851400,"Em despacho","3315","Inundação de estruturas por precipitação intensa",0,1,0,4,"2025-01-21T21:19:00","Ovar","Aveiro","Centro",-8.637974,40.962156
24851857,"Palmela","Península de Setúbal",311,"2025-01-21T23:55:00",24851857,"Em curso","2403","Colisão rodoviária",0,4,0,11,"2025-01-21T23:55:00","Palmela","Setúbal","Área Metropolitana De Lisboa",-8.903334,38.60305
24851859,"São Mamede de Infesta e Senhora da Hora","Area M. Porto",309,"2025-01-21T23:39:00",24851859,"Em despacho","3315","Inundação de estruturas por precipitação intensa",0,1,0,4,"2025-01-21T23:39:00","Matosinhos","Porto","Norte",-8.630369,41.188957
24851875,"Costa da Caparica","Península de Setúbal",311,"2025-01-21T23:59:00",24851875,"Em despacho","3313","Deslizamento de terras",0,2,0,6,"2025-01-21T23:59:00","Almada","Setúbal","Área Metropolitana De Lisboa",-9.227696,38.642583
24851891,"N. S. da Vila, N. S. do Bispo e Silveiras","Alentejo Central",312,"2025-01-22T00:10:00",24851891,"Em conclusão","3315","Inundação de estruturas por precipitação intensa",0,2,0,4,"2025-01-22T00:10:00","Montemor-o-Novo","Évora","Alentejo",-8.226457,38.649897
24851907,"Braga (São Vítor)","Cávado",309,"2025-01-22T00:09:00",24851907,"Em resolução","2515","Fuga de gás em garrafa",0,1,0,6,"2025-01-22T00:09:00","Braga","Braga","Norte",-8.40296,41.549748
24847907,"Aldeia do Bispo, Águas e Aldeia de João Pires","Beira Baixa",310,"2025-01-21T09:20:00",24847907,"Em curso","4327","Busca e resgate terrestre de pessoas",0,3,0,7,"2025-01-21T09:20:00","Penamacor","Castelo Branco","Centro",-7.2077,40.109481
24851088,"Santa Maria da Feira, Travanca, Sanfins e Espargo","Area M. Porto",309,"2025-01-21T19:59:00",24851088,"Em despacho","3315","Inundação de estruturas por precipitação intensa",0,0,0,0,"2025-01-21T19:59:00","Santa Maria Da Feira","Aveiro","Norte",-8.58146,40.91809
24851517,"Almargem do Bispo, Pêro Pinheiro e Montelavar","Grande Lisboa",311,"2025-01-21T22:01:00",24851517,"Em conclusão","2407","Despiste",0,3,0,7,"2025-01-21T22:01:00","Sintra","Lisboa","Área Metropolitana De Lisboa",-9.259873,38.862966
24851633,"Torrão","Alentejo Litoral",312,"2025-01-21T22:30:00",24851633,"Em conclusão","2407","Despiste",0,2,0,4,"2025-01-21T22:30:00","Alcácer Do Sal","Setúbal","Alentejo",-8.358685,38.251255
24851885,"São Miguel, Santa Eufémia e Rabaçal","Região de Coimbra",310,"2025-01-22T00:00:00",24851885,"Em despacho","3315","Inundação de estruturas por precipitação intensa",0,2,0,3,"2025-01-22T00:00:00","Penela","Coimbra","Centro",-8.399036,40.025502
24851917,"Santa Maria do Castelo e Santiago e Santa Susana","Alentejo Litoral",312,"2025-01-22T00:16:00",24851917,"Em despacho","3301","Queda de árvore",0,2,0,3,"2025-01-22T00:16:00","Alcácer Do Sal","Setúbal","Alentejo",-8.527897,38.375893
24851972,"Azeitão (São Lourenço e São Simão)","Península de Setúbal",311,"2025-01-22T00:45:00",24851972,"Em despacho","2127","Incêndio em edifícios e recintos industriais, oficinas e armazéns",0,3,0,12,"2025-01-22T00:45:00","Setúbal","Setúbal","Área Metropolitana De Lisboa",-9.03716,38.53846
24851987,"Algés, Linda-a-Velha e Cruz Quebrada-Dafundo","Grande Lisboa",311,"2025-01-22T00:45:00",24851987,"Em despacho","3315","Inundação de estruturas por precipitação intensa",0,1,0,5,"2025-01-22T00:45:00","Oeiras","Lisboa","Área Metropolitana De Lisboa",-9.244903,38.715384
24851988,"Odivelas","Grande Lisboa",311,"2025-01-22T00:43:00",24851988,"Em despacho","3301","Queda de árvore",0,1,0,5,"2025-01-22T00:43:00","Odivelas","Lisboa","Área Metropolitana De Lisboa",-9.182813,38.793425
24852004,"Avenidas Novas","Grande Lisboa",311,"2025-01-22T00:49:00",24852004,"Em despacho","3315","Inundação de estruturas por precipitação intensa",0,1,0,5,"2025-01-22T00:49:00","Lisboa","Lisboa","Área Metropolitana De Lisboa",-9.152329,38.73746
24851909,"Charneca de Caparica e Sobreda","Península de Setúbal",311,"2025-01-22T00:16:00",24851909,"Em despacho","3315","Inundação de estruturas por precipitação intensa",0,1,0,5,"2025-01-22T00:16:00","Almada","Setúbal","Área Metropolitana De Lisboa",-9.194473,38.648295
24851916,"Palmela","Península de Setúbal",311,"2025-01-22T00:15:00",24851916,"Em despacho","3315","Inundação de estruturas por precipitação intensa",0,1,0,2,"2025-01-22T00:15:00","Palmela","Setúbal","Área Metropolitana De Lisboa",-8.891983,38.611016
24851925,"Glória do Ribatejo e Granho","Lezíria do Tejo",311,"2025-01-22T00:27:00",24851925,"Em resolução","3315","Inundação de estruturas por precipitação intensa",0,1,0,5,"2025-01-22T00:27:00","Salvaterra De Magos","Santarém","Alentejo",-8.657076,39.09118
24851932,"Algés, Linda-a-Velha e Cruz Quebrada-Dafundo","Grande Lisboa",311,"2025-01-22T00:20:00",24851932,"Em despacho","3315","Inundação de estruturas por precipitação intensa",0,1,0,2,"2025-01-22T00:20:00","Oeiras","Lisboa","Área Metropolitana De Lisboa",-9.22967,38.696612
24851950,"Arcozelo","Area M. Porto",309,"2025-01-22T00:39:00",24851950,"Em curso","2101","Incêndio em edifícios habitacionais",0,5,0,17,"2025-01-22T00:39:00","Vila Nova De Gaia","Porto","Norte",-8.64109,41.06139
24851977,"Ovar, São João, Arada e São Vicente de Pereira Jusã","Região de Aveiro",310,"2025-01-22T00:40:00",24851977,"Em despacho","3315","Inundação de estruturas por precipitação intensa",0,1,0,2,"2025-01-22T00:40:00","Ovar","Aveiro","Centro",-8.671695,40.872857
24851991,"Paramos","Area M. Porto",309,"2025-01-22T00:53:00",24851991,"Em despacho","3315","Inundação de estruturas por precipitação intensa",0,0,0,0,"2025-01-22T00:53:00","Espinho","Aveiro","Norte",-8.642231,40.975069
24851993,"Monchique","Algarve",313,"2025-01-22T00:40:00",24851993,"Em despacho","3301","Queda de árvore",0,1,0,5,"2025-01-22T00:40:00","Monchique","Faro","Algarve",-8.569485,37.287407
