"id","address","subregion","neighborhood","date","id.1","state","nature","nature_description","aerial_means","terrestrial_means","aquatic_means","operational","date.1","Concelho","Distrito","NUTII_DSG","longitude","latitude"
24472332,"São Mamede de Infesta e Senhora da Hora","Area M. Porto",309,"2024-10-28T07:05:00",24472332,"Em despacho","3201","Detritos não confinados",0,1,0,4,"2024-10-28T07:05:00","Matosinhos","Porto","Norte",-8.63173,41.18596
24472346,"Cedofeita, Ildefonso, Sé, Miragaia, Nicolau e Vitória","Area M. Porto",309,"2024-10-28T06:51:00",24472346,"Em despacho","2127","Incêndio em edifícios e recintos industriais, oficinas e armazéns",0,1,0,5,"2024-10-28T06:51:00","Porto","Porto","Norte",-8.615939,41.15359
24472256,"Matosinhos e Leça da Palmeira","Area M. Porto",309,"2024-10-28T06:13:00",24472256,"Em conclusão","2407","Despiste",0,3,0,6,"2024-10-28T06:13:00","Matosinhos","Porto","Norte",-8.68919,41.201152
24472273,"São Lourenço de Mamporcão e São Bento de Ana Loura","Alentejo Central",312,"2024-10-28T06:38:00",24472273,"Em conclusão","3201","Detritos não confinados",0,1,0,2,"2024-10-28T06:38:00","Estremoz","Évora","Alentejo",-7.509577,38.931938
24360487,"Mões","Viseu Dão Lafões",310,"2024-10-03T08:00:00",24360487,"Em curso","4339","Corte ou remoção de elementos",0,1,0,1,"2024-10-03T08:00:00","Castro Daire","Viseu","Centro",-7.893519,40.867571
24472302,"Vila Real de Santo António","Algarve",313,"2024-10-28T06:50:00",24472302,"Em conclusão","2307","Incêndio em transporte aquático",0,4,0,12,"2024-10-28T06:50:00","Vila Real De Santo António","Faro","Algarve",-7.413388,37.191428
24472336,"Braga (São Vítor)","Cávado",309,"2024-10-28T07:08:00",24472336,"Em resolução","2101","Incêndio em edifícios habitacionais",0,3,0,10,"2024-10-28T07:08:00","Braga","Braga","Norte",-8.40374,41.55672
24472359,"Caldas da Rainha - Santo Onofre e Serra do Bouro","Oeste",311,"2024-10-28T06:37:00",24472359,"Em despacho","3317","Inundação de estruturas por água canalizada",0,1,0,3,"2024-10-28T06:37:00","Caldas Da Rainha","Leiria","Centro",-9.148929,39.401713
