"id","address","subregion","neighborhood","date","id.1","state","nature","nature_description","aerial_means","terrestrial_means","aquatic_means","operational","date.1","Concelho","Distrito","NUTII_DSG","longitude","latitude"
25026516,"Melres e Medas","Area M. Porto",309,"2025-03-01T11:41:00",25026516,"Em conclusão","4329","Busca e resgate aquático de pessoas",0,0,0,0,"2025-03-01T11:41:00","Gondomar","Porto","Norte",-8.458103,41.061746
25050321,"Custóias, Leça do Balio e Guifões","Area M. Porto",309,"2025-03-06T20:22:00",25050321,"Em conclusão","2301","Incêndio em transporte rodoviário",0,3,0,9,"2025-03-06T20:22:00","Matosinhos","Porto","Norte",-8.667773,41.207865
25050859,"Gouveia (São Pedro e São Julião)","Beiras e Serra da Estrela",310,"2025-03-07T00:00:00",25050859,"Em despacho","2101","Incêndio em edifícios habitacionais",0,2,0,7,"2025-03-07T00:00:00","Gouveia","Guarda","Centro",-7.59199,40.49607
25050660,"Mexilhoeira Grande","Algarve",313,"2025-03-06T22:17:00",25050660,"Em conclusão","3201","Detritos não confinados",0,3,0,9,"2025-03-06T22:17:00","Portimão","Faro","Algarve",-8.628034,37.15681
25050769,"Alhandra, São João Dos Montes e Calhandriz","Grande Lisboa",311,"2025-03-06T23:03:00",25050769,"Em conclusão","2111","Incêndio em edifícios hospitalares e lares de idosos",0,2,0,7,"2025-03-06T23:03:00","Vila Franca De Xira","Lisboa","Área Metropolitana De Lisboa",-9.006082,38.929996
25050855,"Almada, Cova da Piedade, Pragal e Cacilhas","Península de Setúbal",311,"2025-03-06T23:58:00",25050855,"Em despacho","3323","Dano na rede de abastecimento de água",0,0,0,0,"2025-03-06T23:58:00","Almada","Setúbal","Área Metropolitana De Lisboa",-9.17681,38.67091
25050702,"Arnoso (Santa Maria e Santa Eulália) e Sezures","Ave",309,"2025-03-06T22:32:00",25050702,"Em conclusão","2101","Incêndio em edifícios habitacionais",0,7,0,21,"2025-03-06T22:32:00","Vila Nova De Famalicão","Braga","Norte",-8.52659,41.46597
