"id","address","subregion","neighborhood","date","id.1","state","nature","nature_description","aerial_means","terrestrial_means","aquatic_means","operational","date.1","Concelho","Distrito","NUTII_DSG","longitude","latitude"
25024778,"Rio de Mouro","Grande Lisboa",311,"2025-02-28T22:57:00",25024778,"Em conclusão","2403","Colisão rodoviária",0,1,0,2,"2025-02-28T22:57:00","Sintra","Lisboa","Área Metropolitana De Lisboa",-9.321906,38.783084
25025078,"Braga (São Vicente)","Cávado",309,"2025-03-01T01:41:00",25025078,"Em despacho","3317","Inundação de estruturas por água canalizada",0,2,0,5,"2025-03-01T01:41:00","Braga","Braga","Norte",-8.42354,41.5541
25024736,"Campo de Ourique","Grande Lisboa",311,"2025-02-28T22:28:00",25024736,"Em despacho","3325","Dano na rede de abastecimento de gás",0,1,0,2,"2025-02-28T22:28:00","Lisboa","Lisboa","Área Metropolitana De Lisboa",-9.169863,38.718496
25024851,"Termas de São Vicente","Tâmega e Sousa",309,"2025-02-28T23:19:00",25024851,"Em conclusão","2403","Colisão rodoviária",0,7,0,16,"2025-02-28T23:19:00","Penafiel","Porto","Norte",-8.294448,41.125782
25024965,"Odivelas","Grande Lisboa",311,"2025-03-01T00:24:00",25024965,"Em conclusão","2403","Colisão rodoviária",0,4,0,11,"2025-03-01T00:24:00","Odivelas","Lisboa","Área Metropolitana De Lisboa",-9.182813,38.793425
24877003,"Malagueira e Horta Das Figueiras","Alentejo Central",312,"2025-01-27T11:41:00",24877003,"Em conclusão","3315","Inundação de estruturas por precipitação intensa",0,0,0,0,"2025-01-27T11:41:00","Évora","Évora","Alentejo",-7.924277,38.57285
25024657,"Azeitão (São Lourenço e São Simão)","Península de Setúbal",311,"2025-02-28T22:09:00",25024657,"Em curso","2403","Colisão rodoviária",0,0,0,0,"2025-02-28T22:09:00","Setúbal","Setúbal","Área Metropolitana De Lisboa",-9.008871,38.513402
25025041,"São Martinho da Cortiça","Região de Coimbra",310,"2025-03-01T01:21:00",25025041,"Em conclusão","2407","Despiste",0,1,0,2,"2025-03-01T01:21:00","Arganil","Coimbra","Centro",-8.18944,40.25194
25025082,"Santa Catarina da Serra e Chainça","Região de Leiria",310,"2025-03-01T01:42:00",25025082,"Em conclusão","2301","Incêndio em transporte rodoviário",0,1,0,5,"2025-03-01T01:42:00","Leiria","Leiria","Centro",-8.71452,39.66314
