"id","address","subregion","neighborhood","date","id.1","state","nature","nature_description","aerial_means","terrestrial_means","aquatic_means","operational","date.1","Concelho","Distrito","NUTII_DSG","longitude","latitude"
25030942,"Quinta do Conde","Península de Setúbal",311,"2025-03-02T12:11:00",25030942,"Em despacho","4331","Busca e resgate terrestre de animais",0,1,0,4,"2025-03-02T12:11:00","Sesimbra","Setúbal","Área Metropolitana De Lisboa",-9.03613,38.570355
25031081,"Barreiro e Lavradio","Península de Setúbal",311,"2025-03-02T12:49:00",25031081,"Em despacho","2115","Incêndio em edifícios hoteleiros e de restauração",0,1,0,4,"2025-03-02T12:49:00","Barreiro","Setúbal","Área Metropolitana De Lisboa",-9.062184,38.667355
25030400,"Luz de Tavira e Santo Estêvão","Algarve",313,"2025-03-02T09:45:00",25030400,"Em despacho","4331","Busca e resgate terrestre de animais",0,1,0,2,"2025-03-02T09:45:00","Tavira","Faro","Algarve",-7.714632,37.093757
25030450,"Palmela","Península de Setúbal",311,"2025-03-02T10:10:00",25030450,"Em conclusão","2403","Colisão rodoviária",0,1,0,2,"2025-03-02T10:10:00","Palmela","Setúbal","Área Metropolitana De Lisboa",-8.872455,38.582082
25030668,"Rio Frio","Alto Minho",309,"2025-03-02T11:07:00",25030668,"Em resolução","2407","Despiste",0,2,0,5,"2025-03-02T11:07:00","Arcos De Valdevez","Viana Do Castelo","Norte",-8.485212,41.843648
25030921,"Gavião","Ave",309,"2025-03-02T12:04:00",25030921,"Em despacho","2403","Colisão rodoviária",0,1,0,3,"2025-03-02T12:04:00","Vila Nova De Famalicão","Braga","Norte",-8.50734,41.423944
25030953,"S.pedro e Santiago, S.maria e S.miguel e Matacães","Oeste",311,"2025-03-02T12:09:00",25030953,"Em conclusão","2101","Incêndio em edifícios habitacionais",0,5,0,12,"2025-03-02T12:09:00","Torres Vedras","Lisboa","Centro",-9.251952,39.091829
25030986,"Custóias, Leça do Balio e Guifões","Area M. Porto",309,"2025-03-02T12:25:00",25030986,"Em curso","2401","Atropelamento rodoviário",0,1,0,2,"2025-03-02T12:25:00","Matosinhos","Porto","Norte",-8.657682,41.199783
25031018,"Braga (Maximinos, Sé e Cividade)","Cávado",309,"2025-03-02T12:40:00",25031018,"Em curso","2403","Colisão rodoviária",0,3,0,10,"2025-03-02T12:40:00","Braga","Braga","Norte",-8.43507,41.54871
25031072,"Castro Marim","Algarve",313,"2025-03-02T12:45:00",25031072,"Em despacho","2407","Despiste",0,2,0,4,"2025-03-02T12:45:00","Castro Marim","Faro","Algarve",-7.450308,37.218677
24877003,"Malagueira e Horta Das Figueiras","Alentejo Central",312,"2025-01-27T11:41:00",24877003,"Em conclusão","3315","Inundação de estruturas por precipitação intensa",0,0,0,0,"2025-01-27T11:41:00","Évora","Évora","Alentejo",-7.924277,38.57285
25030639,"Laranjeiro e Feijó","Península de Setúbal",311,"2025-03-02T10:55:00",25030639,"Em despacho","2513","Fuga de gás em conduta",0,2,0,8,"2025-03-02T10:55:00","Almada","Setúbal","Área Metropolitana De Lisboa",-9.156624,38.652235
25030723,"Areias, Sequeiró, Lama e Palmeira","Area M. Porto",309,"2025-03-02T11:21:00",25030723,"Em curso","2403","Colisão rodoviária",0,8,0,16,"2025-03-02T11:21:00","Santo Tirso","Porto","Norte",-8.471626,41.359888
25030932,"Santo António Dos Olivais","Região de Coimbra",310,"2025-03-02T12:16:00",25030932,"Em conclusão","3301","Queda de árvore",0,0,0,0,"2025-03-02T12:16:00","Coimbra","Coimbra","Centro",-8.392808,40.235354
25030934,"Peniche","Oeste",311,"2025-03-02T12:05:00",25030934,"Em curso","2403","Colisão rodoviária",0,1,0,2,"2025-03-02T12:05:00","Peniche","Leiria","Centro",-9.376833,39.357166
25030959,"Celeirós, Aveleda e Vimieiro","Cávado",309,"2025-03-02T12:22:00",25030959,"Em resolução","2101","Incêndio em edifícios habitacionais",0,2,0,8,"2025-03-02T12:22:00","Braga","Braga","Norte",-8.46483,41.51967
25031000,"Carcavelos e Parede","Grande Lisboa",311,"2025-03-02T12:33:00",25031000,"Em conclusão","2101","Incêndio em edifícios habitacionais",0,2,0,8,"2025-03-02T12:33:00","Cascais","Lisboa","Área Metropolitana De Lisboa",-9.335061,38.69454
25031025,"Alvão","Alto Tâmega e Barroso",309,"2025-03-02T12:35:00",25031025,"Em despacho","3101","Incêndio rural",0,0,0,0,"2025-03-02T12:35:00","Vila Pouca De Aguiar","Vila Real","Norte",-7.771514,41.488547
25026516,"Melres e Medas","Area M. Porto",309,"2025-03-01T11:41:00",25026516,"Em curso","4329","Busca e resgate aquático de pessoas",0,9,0,15,"2025-03-01T11:41:00","Gondomar","Porto","Norte",-8.458103,41.061746
25030763,"Santo André de Vagos","Região de Aveiro",310,"2025-03-02T11:32:00",25030763,"Em conclusão","2407","Despiste",0,2,0,4,"2025-03-02T11:32:00","Vagos","Aveiro","Centro",-8.673537,40.515351
25030945,"Vila Nova de Cacela","Algarve",313,"2025-03-02T12:08:00",25030945,"Em curso","4331","Busca e resgate terrestre de animais",0,1,0,6,"2025-03-02T12:08:00","Vila Real De Santo António","Faro","Algarve",-7.54655,37.15754
25030946,"Encosta do Sol","Grande Lisboa",311,"2025-03-02T12:13:00",25030946,"Em curso","3323","Dano na rede de abastecimento de água",0,1,0,2,"2025-03-02T12:13:00","Amadora","Lisboa","Área Metropolitana De Lisboa",-9.21408573455781,38.769382964152
25031011,"São João Baptista e Santa Maria Dos Olivais","Médio Tejo",311,"2025-03-02T12:37:00",25031011,"Em resolução","2101","Incêndio em edifícios habitacionais",0,4,0,11,"2025-03-02T12:37:00","Tomar","Santarém","Centro",-8.405122,39.59635
25031012,"Quelfes","Algarve",313,"2025-03-02T11:10:00",25031012,"Em despacho","4331","Busca e resgate terrestre de animais",0,1,0,2,"2025-03-02T11:10:00","Olhão","Faro","Algarve",-7.820507,37.058941
25031062,"Alhos Vedros","Península de Setúbal",311,"2025-03-02T12:50:00",25031062,"Em despacho","2403","Colisão rodoviária",0,2,0,6,"2025-03-02T12:50:00","Moita","Setúbal","Área Metropolitana De Lisboa",-9.007328,38.65525
