"id","address","subregion","neighborhood","date","id.1","state","nature","nature_description","aerial_means","terrestrial_means","aquatic_means","operational","date.1","Concelho","Distrito","NUTII_DSG","longitude","latitude"
24877003,"Malagueira e Horta Das Figueiras","Alentejo Central",312,"2025-01-27T11:41:00",24877003,"Em conclusão","3315","Inundação de estruturas por precipitação intensa",0,0,0,0,"2025-01-27T11:41:00","Évora","Évora","Alentejo",-7.924277,38.57285
24912072,"Romeira e Várzea","Lezíria do Tejo",311,"2025-02-04T01:22:00",24912072,"Em conclusão","2127","Incêndio em edifícios e recintos industriais, oficinas e armazéns",0,2,0,6,"2025-02-04T01:22:00","Santarém","Santarém","Alentejo",-8.714057,39.254832
24926244,"Baixa da Banheira e Vale da Amoreira","Península de Setúbal",311,"2025-02-07T08:40:00",24926244,"Em curso","4331","Busca e resgate terrestre de animais",0,2,0,7,"2025-02-07T08:40:00","Moita","Setúbal","Área Metropolitana De Lisboa",-9.043028,38.662183
24926260,"Montemor-o-Velho e Gatões","Região de Coimbra",310,"2025-02-07T08:47:00",24926260,"Em conclusão","3301","Queda de árvore",0,2,0,5,"2025-02-07T08:47:00","Montemor-o-Velho","Coimbra","Centro",-8.684865,40.169486
24926364,"Seia, São Romão e Lapa Dos Dinheiros","Beiras e Serra da Estrela",310,"2025-02-07T09:03:00",24926364,"Em conclusão","2403","Colisão rodoviária",0,3,0,8,"2025-02-07T09:03:00","Seia","Guarda","Centro",-7.706962,40.416913
24926421,"Cacém e São Marcos","Grande Lisboa",311,"2025-02-07T09:10:00",24926421,"Em conclusão","2407","Despiste",0,3,0,8,"2025-02-07T09:10:00","Sintra","Lisboa","Área Metropolitana De Lisboa",-9.316991,38.764218
24925940,"Moledo","Viseu Dão Lafões",310,"2025-02-07T06:20:00",24925940,"Em resolução","2127","Incêndio em edifícios e recintos industriais, oficinas e armazéns",0,5,0,15,"2025-02-07T06:20:00","Castro Daire","Viseu","Centro",-7.932827,40.814353
24926224,"Infias","Ave",309,"2025-02-07T08:37:00",24926224,"Em despacho","3301","Queda de árvore",0,2,0,3,"2025-02-07T08:37:00","Vizela","Braga","Norte",-8.31057,41.395982
24926391,"Caparica e Trafaria","Península de Setúbal",311,"2025-02-07T09:14:00",24926391,"Em conclusão","2101","Incêndio em edifícios habitacionais",0,1,0,3,"2025-02-07T09:14:00","Almada","Setúbal","Área Metropolitana De Lisboa",-9.22724,38.65222
24926427,"Sé Nova, Santa Cruz, Almedina e São Bartolomeu","Região de Coimbra",310,"2025-02-07T09:19:00",24926427,"Em despacho","3329","Queda de estruturas temporárias ou móveis",0,1,0,4,"2025-02-07T09:19:00","Coimbra","Coimbra","Centro",-8.425582,40.205556
24926510,"Cedofeita, Ildefonso, Sé, Miragaia, Nicolau e Vitória","Area M. Porto",309,"2025-02-07T09:28:00",24926510,"Em despacho","3311","Queda de elementos de estruturas edificados",0,1,0,5,"2025-02-07T09:28:00","Porto","Porto","Norte",-8.615939,41.15359
24926188,"Nossa Senhora da Conceição, São Pedro e São Dinis","Douro",309,"2025-02-07T08:18:00",24926188,"Em conclusão","2403","Colisão rodoviária",0,4,0,10,"2025-02-07T08:18:00","Vila Real","Vila Real","Norte",-7.646127,41.323452
24926211,"Carregado e Cadafais","Oeste",311,"2025-02-07T08:29:00",24926211,"Em conclusão","2127","Incêndio em edifícios e recintos industriais, oficinas e armazéns",0,3,0,8,"2025-02-07T08:29:00","Alenquer","Lisboa","Centro",-8.985297,39.023828
24926338,"Chamusca e Pinheiro Grande","Lezíria do Tejo",311,"2025-02-07T09:02:00",24926338,"Em conclusão","2403","Colisão rodoviária",0,2,0,4,"2025-02-07T09:02:00","Chamusca","Santarém","Alentejo",-8.4541,39.380728
24926411,"Almada, Cova da Piedade, Pragal e Cacilhas","Península de Setúbal",311,"2025-02-07T09:10:00",24926411,"Em conclusão","2403","Colisão rodoviária",0,3,0,10,"2025-02-07T09:10:00","Almada","Setúbal","Área Metropolitana De Lisboa",-9.164498,38.675268
24926506,"Laranjeiro e Feijó","Península de Setúbal",311,"2025-02-07T09:35:00",24926506,"Em despacho","2403","Colisão rodoviária",0,0,0,0,"2025-02-07T09:35:00","Almada","Setúbal","Área Metropolitana De Lisboa",-9.16603,38.65458
24925682,"Guarda","Beiras e Serra da Estrela",310,"2025-02-07T01:02:00",24925682,"Em despacho","3317","Inundação de estruturas por água canalizada",0,1,0,2,"2025-02-07T01:02:00","Guarda","Guarda","Centro",-7.260869,40.536751
24926049,"Santa Iria de Azoia, São João da Talha e Bobadela","Grande Lisboa",311,"2025-02-07T07:26:00",24926049,"Em curso","2201","Incêndio em equipamentos ou produtos",0,2,0,6,"2025-02-07T07:26:00","Loures","Lisboa","Área Metropolitana De Lisboa",-9.093217,38.806807
24926198,"Portimão","Algarve",313,"2025-02-07T08:29:00",24926198,"Em conclusão","2101","Incêndio em edifícios habitacionais",0,7,0,15,"2025-02-07T08:29:00","Portimão","Faro","Algarve",-8.541412,37.183837
24926398,"Serrazes","Viseu Dão Lafões",310,"2025-02-07T09:13:00",24926398,"Em despacho","4339","Corte ou remoção de elementos",0,4,0,9,"2025-02-07T09:13:00","São Pedro Do Sul","Viseu","Centro",-8.108261,40.745348
24926465,"Praia do Ribatejo","Médio Tejo",311,"2025-02-07T09:27:00",24926465,"Em despacho","3313","Deslizamento de terras",0,1,0,3,"2025-02-07T09:27:00","Vila Nova Da Barquinha","Santarém","Centro",-8.358701,39.466491
24926517,"Arcozelo","Area M. Porto",309,"2025-02-07T09:35:00",24926517,"Em despacho","3301","Queda de árvore",0,1,0,4,"2025-02-07T09:35:00","Vila Nova De Gaia","Porto","Norte",-8.640388,41.056331
