"id","address","subregion","neighborhood","date","id.1","state","nature","nature_description","aerial_means","terrestrial_means","aquatic_means","operational","date.1","Concelho","Distrito","NUTII_DSG","longitude","latitude"
24360487,"Mões","Viseu Dão Lafões",310,"2024-10-03T08:00:00",24360487,"Em curso","4339","Corte ou remoção de elementos",0,1,0,1,"2024-10-03T08:00:00","Castro Daire","Viseu","Centro",-7.893519,40.867571
24451451,"Sul","Viseu Dão Lafões",310,"2024-10-23T08:10:00",24451451,"Em curso","4339","Corte ou remoção de elementos",0,1,0,2,"2024-10-23T08:10:00","São Pedro Do Sul","Viseu","Centro",-8.050962,40.841282
24464780,"St.tirso, Couto (S.cristina e S.miguel) e Burgães","Area M. Porto",309,"2024-10-26T08:02:00",24464780,"Em curso","2407","Despiste",0,3,0,5,"2024-10-26T08:02:00","Vila Do Conde","Porto","Norte",-8.641965,41.311557
24464516,"Póvoa de Santo Adrião e Olival Basto","Grande Lisboa",311,"2024-10-26T06:12:00",24464516,"Em conclusão","2101","Incêndio em edifícios habitacionais",0,1,0,5,"2024-10-26T06:12:00","Odivelas","Lisboa","Área Metropolitana De Lisboa",-9.159939,38.803537
24464767,"Pinhal Novo","Península de Setúbal",311,"2024-10-26T08:08:00",24464767,"Em despacho","2127","Incêndio em edifícios e recintos industriais, oficinas e armazéns",0,0,0,0,"2024-10-26T08:08:00","Palmela","Setúbal","Área Metropolitana De Lisboa",-8.899267,38.67279
24464558,"Lagos (São Sebastião e Santa Maria)","Algarve",313,"2024-10-26T06:49:00",24464558,"Em conclusão","2403","Colisão rodoviária",0,2,0,7,"2024-10-26T06:49:00","Lagos","Faro","Algarve",-8.668524,37.100485
24464642,"Massamá e Monte Abraão","Grande Lisboa",311,"2024-10-26T07:33:00",24464642,"Em resolução","3325","Dano na rede de abastecimento de gás",0,2,0,8,"2024-10-26T07:33:00","Sintra","Lisboa","Área Metropolitana De Lisboa",-9.27955,38.75397
24464744,"Oliveira do Douro","Area M. Porto",309,"2024-10-26T08:02:00",24464744,"Em despacho","3321","Dano na rede de fornecimento de eletricidade ",0,0,0,0,"2024-10-26T08:02:00","Vila Nova De Gaia","Porto","Norte",-8.58071,41.13315
24464406,"Porto Salvo","Grande Lisboa",311,"2024-10-26T04:45:00",24464406,"Em curso","2407","Despiste",0,0,0,0,"2024-10-26T04:45:00","Oeiras","Lisboa","Área Metropolitana De Lisboa",-9.291175,38.713493
24464513,"Penso","Alto Minho",309,"2024-10-26T06:19:00",24464513,"Em resolução","2407","Despiste",0,1,0,2,"2024-10-26T06:19:00","Melgaço","Viana Do Castelo","Norte",-8.329287,42.082488
24464588,"Santa Maria da Feira, Travanca, Sanfins e Espargo","Area M. Porto",309,"2024-10-26T06:57:00",24464588,"Em conclusão","2201","Incêndio em equipamentos ou produtos",0,1,0,4,"2024-10-26T06:57:00","Santa Maria Da Feira","Aveiro","Norte",-8.555837,40.9255
24464604,"Moçarria","Lezíria do Tejo",311,"2024-10-26T07:15:00",24464604,"Em conclusão","2201","Incêndio em equipamentos ou produtos",0,0,0,0,"2024-10-26T07:15:00","Santarém","Santarém","Alentejo",-8.784444,39.281833
24464645,"Cidade da Maia","Area M. Porto",309,"2024-10-26T07:20:00",24464645,"Em conclusão","2513","Fuga de gás em conduta",0,2,0,3,"2024-10-26T07:20:00","Maia","Porto","Norte",-8.621722,41.231715
24464722,"Alto do Seixalinho, Santo André e Verderena","Península de Setúbal",311,"2024-10-26T07:56:00",24464722,"Em despacho","3321","Dano na rede de fornecimento de eletricidade ",0,1,0,5,"2024-10-26T07:56:00","Barreiro","Setúbal","Área Metropolitana De Lisboa",-9.05642,38.63795
