"id","address","subregion","neighborhood","date","id.1","state","nature","nature_description","aerial_means","terrestrial_means","aquatic_means","operational","date.1","Concelho","Distrito","NUTII_DSG","longitude","latitude"
24851780,"São Miguel, Santa Eufémia e Rabaçal","Região de Coimbra",310,"2025-01-21T23:25:00",24851780,"Em curso","3315","Inundação de estruturas por precipitação intensa",0,0,0,0,"2025-01-21T23:25:00","Penela","Coimbra","Centro",-8.399036,40.025502
24885245,"Coura","Alto Minho",309,"2025-01-29T04:35:00",24885245,"Em resolução","2201","Incêndio em equipamentos ou produtos",0,3,0,5,"2025-01-29T04:35:00","Paredes De Coura","Viana Do Castelo","Norte",-8.637748,41.87185
24885329,"Arcozelo","Alto Minho",309,"2025-01-29T06:09:00",24885329,"Em despacho","3301","Queda de árvore",0,1,0,3,"2025-01-29T06:09:00","Ponte De Lima","Viana Do Castelo","Norte",-8.604359,41.80342
24874756,"Tocha","Região de Coimbra",310,"2025-01-26T22:40:00",24874756,"Em curso","4327","Busca e resgate terrestre de pessoas",0,5,0,18,"2025-01-26T22:40:00","Cantanhede","Coimbra","Centro",-8.782308,40.341926
24877003,"Malagueira e Horta Das Figueiras","Alentejo Central",312,"2025-01-27T11:41:00",24877003,"Em conclusão","3315","Inundação de estruturas por precipitação intensa",0,0,0,0,"2025-01-27T11:41:00","Évora","Évora","Alentejo",-7.924277,38.57285
24885309,"Oeiras e S. Julião da Barra, Paço de Arcos e Caxias","Grande Lisboa",311,"2025-01-29T05:56:00",24885309,"Em despacho","3317","Inundação de estruturas por água canalizada",0,1,0,4,"2025-01-29T05:56:00","Oeiras","Lisboa","Área Metropolitana De Lisboa",-9.32032,38.67882
