"id","address","subregion","neighborhood","date","id.1","state","nature","nature_description","aerial_means","terrestrial_means","aquatic_means","operational","date.1","Concelho","Distrito","NUTII_DSG","longitude","latitude","state_2"
26205192,"Vila Nova de Foz Côa","Douro",309,"2025-10-29T03:56:00",26205192,"Em resolução/conclusão","2111","Incêndio em edifícios hospitalares e lares de idosos",0,6,0,12,"2025-10-29T03:56:00","Vila Nova De Foz Côa","Guarda","Norte",-7.143153,41.08237,"Resolução/Conclusão"
26203717,"Leiria, Pousos, Barreira e Cortes","Região de Leiria",310,"2025-10-28T18:16:00",26203717,"Em Despacho","3315","Inundação de estruturas por precipitação intensa",0,1,0,2,"2025-10-28T18:16:00","Leiria","Leiria","Centro",-8.80207,39.74722,"Despacho"
26205266,"São Brás de Alportel","Algarve",313,"2025-10-29T04:59:00",26205266,"Em Despacho","3321","Dano na rede de fornecimento de eletricidade ",0,1,0,5,"2025-10-29T04:59:00","São Brás De Alportel","Faro","Algarve",-7.909012,37.166366,"Despacho"
26205211,"Canelas","Tâmega e Sousa",309,"2025-10-29T04:21:00",26205211,"Em resolução/conclusão","2407","Despiste",0,4,0,11,"2025-10-29T04:21:00","Penafiel","Porto","Norte",-8.322085,41.06118,"Resolução/Conclusão"
26205264,"Olhão","Algarve",313,"2025-10-29T05:05:00",26205264,"Em resolução/conclusão","2201","Incêndio em equipamentos ou produtos",0,2,0,5,"2025-10-29T05:05:00","Olhão","Faro","Algarve",-7.843133,37.022054,"Resolução/Conclusão"
26205295,"Faro (Sé e São Pedro)","Algarve",313,"2025-10-29T05:40:00",26205295,"Em Curso","2201","Incêndio em equipamentos ou produtos",0,1,0,5,"2025-10-29T05:40:00","Faro","Faro","Algarve",-7.961044,37.059227,"Curso"
26205297,"Tavira (Santa Maria e Santiago)","Algarve",313,"2025-10-29T05:50:00",26205297,"Em Despacho","2201","Incêndio em equipamentos ou produtos",0,0,0,0,"2025-10-29T05:50:00","Tavira","Faro","Algarve",-7.678349,37.14228,"Despacho"
