"id","address","subregion","neighborhood","date","id.1","state","nature","nature_description","aerial_means","terrestrial_means","aquatic_means","operational","date.1","Concelho","Distrito","NUTII_DSG","longitude","latitude"
24775557,"Baleizão","Baixo Alentejo",312,"2025-01-05T07:33:00",24775557,"Em conclusão","2101","Incêndio em edifícios habitacionais",0,3,0,9,"2025-01-05T07:33:00","Beja","Beja","Alentejo",-7.715188,38.026597
24775559,"Avanca","Região de Aveiro",310,"2025-01-05T07:35:00",24775559,"Em conclusão","2101","Incêndio em edifícios habitacionais",0,5,0,13,"2025-01-05T07:35:00","Estarreja","Aveiro","Centro",-8.58368,40.79786
24775614,"São Martinho do Bispo e Ribeira de Frades","Região de Coimbra",310,"2025-01-05T07:53:00",24775614,"Em curso","3329","Queda de estruturas temporárias ou móveis",0,2,0,5,"2025-01-05T07:53:00","Coimbra","Coimbra","Centro",-8.468894,40.19112
24775623,"Setúbal (São Sebastião)","Península de Setúbal",311,"2025-01-05T08:01:00",24775623,"Em despacho","3321","Dano na rede de fornecimento de eletricidade ",0,1,0,5,"2025-01-05T08:01:00","Setúbal","Setúbal","Área Metropolitana De Lisboa",-8.85635,38.51176
24775632,"Seia, São Romão e Lapa Dos Dinheiros","Beiras e Serra da Estrela",310,"2025-01-05T07:52:00",24775632,"Em resolução","2403","Colisão rodoviária",0,4,0,7,"2025-01-05T07:52:00","Seia","Guarda","Centro",-7.743738,40.401962
24775643,"Oleiros-Amieira","Beira Baixa",310,"2025-01-05T08:03:00",24775643,"Em despacho","3301","Queda de árvore",0,1,0,2,"2025-01-05T08:03:00","Oleiros","Castelo Branco","Centro",-7.91206,39.88914
24775750,"Tocha","Região de Coimbra",310,"2025-01-05T08:35:00",24775750,"Em despacho","3315","Inundação de estruturas por precipitação intensa",0,1,0,2,"2025-01-05T08:35:00","Cantanhede","Coimbra","Centro",-8.840309,40.328939
24775791,"Amora","Península de Setúbal",311,"2025-01-05T08:54:00",24775791,"Em despacho","2115","Incêndio em edifícios hoteleiros e de restauração",0,1,0,3,"2025-01-05T08:54:00","Seixal","Setúbal","Área Metropolitana De Lisboa",-9.125227,38.624582
24775470,"Lourinhã e Atalaia","Oeste",311,"2025-01-05T06:25:00",24775470,"Em conclusão","3201","Detritos não confinados",0,3,0,7,"2025-01-05T06:25:00","Lourinhã","Lisboa","Centro",-9.311131,39.244365
24775669,"Sacavém e Prior Velho","Grande Lisboa",311,"2025-01-05T08:20:00",24775669,"Em conclusão","3311","Queda de elementos de estruturas edificados",0,2,0,7,"2025-01-05T08:20:00","Loures","Lisboa","Área Metropolitana De Lisboa",-9.126385,38.791217
24775670,"Santa Maria Maior","Alto Tâmega e Barroso",309,"2025-01-05T08:06:00",24775670,"Em despacho","2407","Despiste",0,1,0,2,"2025-01-05T08:06:00","Chaves","Vila Real","Norte",-7.477948,41.740078
24775671,"Fornelos e Queijada","Alto Minho",309,"2025-01-05T08:13:00",24775671,"Em resolução","3301","Queda de árvore",0,1,0,3,"2025-01-05T08:13:00","Ponte De Lima","Viana Do Castelo","Norte",-8.563123,41.752173
24775461,"Aljustrel e Rio de Moinhos","Baixo Alentejo",312,"2025-01-05T06:17:00",24775461,"Em conclusão","2407","Despiste",0,0,0,0,"2025-01-05T06:17:00","Aljustrel","Beja","Alentejo",-8.139697,37.895345
24775627,"Malveira e São Miguel de Alcainça","Grande Lisboa",311,"2025-01-05T07:52:00",24775627,"Em curso","3301","Queda de árvore",0,2,0,5,"2025-01-05T07:52:00","Mafra","Lisboa","Área Metropolitana De Lisboa",-9.255135,38.927865
24775663,"Cartaxo e Vale da Pinta","Lezíria do Tejo",311,"2025-01-05T08:13:00",24775663,"Em conclusão","3321","Dano na rede de fornecimento de eletricidade ",0,3,0,8,"2025-01-05T08:13:00","Cartaxo","Santarém","Alentejo",-8.78436,39.16016
24775694,"Camarate, Unhos e Apelação","Grande Lisboa",311,"2025-01-05T08:18:00",24775694,"Em curso","2201","Incêndio em equipamentos ou produtos",0,1,0,5,"2025-01-05T08:18:00","Loures","Lisboa","Área Metropolitana De Lisboa",-9.139208,38.802817
24775729,"Ferrel","Oeste",311,"2025-01-05T08:31:00",24775729,"Em despacho","3315","Inundação de estruturas por precipitação intensa",0,2,0,4,"2025-01-05T08:31:00","Peniche","Leiria","Centro",-9.312058,39.368649
24775795,"Valença, Cristelo Covo e Arão","Alto Minho",309,"2025-01-05T08:55:00",24775795,"Em despacho","3301","Queda de árvore",0,2,0,4,"2025-01-05T08:55:00","Valença","Viana Do Castelo","Norte",-8.657215,42.029011
24775549,"São João Das Lampas e Terrugem","Grande Lisboa",311,"2025-01-05T07:29:00",24775549,"Em conclusão","2101","Incêndio em edifícios habitacionais",0,2,0,4,"2025-01-05T07:29:00","Sintra","Lisboa","Área Metropolitana De Lisboa",-9.349473,38.847654
24775640,"São João de Lourosa","Viseu Dão Lafões",310,"2025-01-05T08:00:00",24775640,"Em curso","3203","Detritos confinados",0,1,0,4,"2025-01-05T08:00:00","Viseu","Viseu","Centro",-7.922843,40.594777
24775667,"Seixal, Arrentela e Aldeia de Paio Pires","Península de Setúbal",311,"2025-01-05T08:14:00",24775667,"Em conclusão","2407","Despiste",0,3,0,7,"2025-01-05T08:14:00","Seixal","Setúbal","Área Metropolitana De Lisboa",-9.051435,38.600863
24775692,"Souto da Casa","Beiras e Serra da Estrela",310,"2025-01-05T08:19:00",24775692,"Em despacho","3301","Queda de árvore",0,3,0,6,"2025-01-05T08:19:00","Fundão","Castelo Branco","Centro",-7.550085,40.120713
24775701,"Alhandra, São João Dos Montes e Calhandriz","Grande Lisboa",311,"2025-01-05T08:20:00",24775701,"Em despacho","3301","Queda de árvore",0,1,0,5,"2025-01-05T08:20:00","Vila Franca De Xira","Lisboa","Área Metropolitana De Lisboa",-9.017736,38.939816
24775726,"Évora de Alcobaça","Oeste",311,"2025-01-05T08:41:00",24775726,"Em despacho","3321","Dano na rede de fornecimento de eletricidade ",0,2,0,5,"2025-01-05T08:41:00","Alcobaça","Leiria","Centro",-8.973952,39.50807
24775756,"S.maria, S.miguel, S.martinho, S.pedro Penaferrim","Grande Lisboa",311,"2025-01-05T08:40:00",24775756,"Em conclusão","3103","Incêndio rural",0,1,0,5,"2025-01-05T08:40:00","Sintra","Lisboa","Área Metropolitana De Lisboa",-9.387899,38.805813
24775758,"Aljezur","Algarve",313,"2025-01-05T08:51:00",24775758,"Em despacho","2101","Incêndio em edifícios habitacionais",0,2,0,6,"2025-01-05T08:51:00","Aljezur","Faro","Algarve",-8.86565,37.29469
24775767,"Cacém e São Marcos","Grande Lisboa",311,"2025-01-05T08:25:00",24775767,"Em resolução","3329","Queda de estruturas temporárias ou móveis",0,1,0,4,"2025-01-05T08:25:00","Sintra","Lisboa","Área Metropolitana De Lisboa",-9.304155,38.761882
24775774,"Malhou, Louriceira e Espinheiro","Médio Tejo",311,"2025-01-05T08:55:00",24775774,"Em despacho","2101","Incêndio em edifícios habitacionais",0,1,0,2,"2025-01-05T08:55:00","Alcanena","Santarém","Centro",-8.684004,39.42466
