"id","address","subregion","neighborhood","date","id.1","state","nature","nature_description","aerial_means","terrestrial_means","aquatic_means","operational","date.1","Concelho","Distrito","NUTII_DSG","longitude","latitude"
24850898,"Sepins e Bolho","Região de Coimbra",310,"2025-01-21T18:50:00",24850898,"Em curso","4327","Busca e resgate terrestre de pessoas",0,4,0,7,"2025-01-21T18:50:00","Cantanhede","Coimbra","Centro",-8.530113,40.405168
24850991,"Santa Maria da Feira, Travanca, Sanfins e Espargo","Area M. Porto",309,"2025-01-21T19:32:00",24850991,"Em despacho","3315","Inundação de estruturas por precipitação intensa",0,1,0,2,"2025-01-21T19:32:00","Santa Maria Da Feira","Aveiro","Norte",-8.53693,40.93173
24852361,"Loulé (São Clemente)","Algarve",313,"2025-01-22T06:08:00",24852361,"Em despacho","3315","Inundação de estruturas por precipitação intensa",0,1,0,1,"2025-01-22T06:08:00","Loulé","Faro","Algarve",-7.987478,37.12554
24852411,"Fronteira","Alto Alentejo",312,"2025-01-22T06:12:00",24852411,"Em curso","3301","Queda de árvore",0,2,0,6,"2025-01-22T06:12:00","Fronteira","Portalegre","Alentejo",-7.64399,39.041888
24852427,"Azeitão (São Lourenço e São Simão)","Península de Setúbal",311,"2025-01-22T06:47:00",24852427,"Em despacho","2201","Incêndio em equipamentos ou produtos",0,1,0,5,"2025-01-22T06:47:00","Setúbal","Setúbal","Área Metropolitana De Lisboa",-9.000141,38.50642
24852450,"São Brás de Alportel","Algarve",313,"2025-01-22T06:59:00",24852450,"Em despacho","3315","Inundação de estruturas por precipitação intensa",0,1,0,3,"2025-01-22T06:59:00","São Brás De Alportel","Faro","Algarve",-7.906798,37.153747
24847907,"Aldeia do Bispo, Águas e Aldeia de João Pires","Beira Baixa",310,"2025-01-21T09:20:00",24847907,"Em curso","4327","Busca e resgate terrestre de pessoas",0,3,0,7,"2025-01-21T09:20:00","Penamacor","Castelo Branco","Centro",-7.2077,40.109481
24852392,"Silves","Algarve",313,"2025-01-22T06:15:00",24852392,"Em conclusão","3301","Queda de árvore",0,2,0,5,"2025-01-22T06:15:00","Silves","Faro","Algarve",-8.464216,37.197646
24852408,"Caia, São Pedro e Alcáçova","Alto Alentejo",312,"2025-01-22T06:39:00",24852408,"Em despacho","3315","Inundação de estruturas por precipitação intensa",0,2,0,4,"2025-01-22T06:39:00","Elvas","Portalegre","Alentejo",-7.15953,38.88055
24846892,"Tavira (Santa Maria e Santiago)","Algarve",313,"2025-01-20T23:37:00",24846892,"Em curso","3315","Inundação de estruturas por precipitação intensa",0,0,0,0,"2025-01-20T23:37:00","Tavira","Faro","Algarve",-7.650217,37.141268
24851587,"Costa da Caparica","Península de Setúbal",311,"2025-01-21T22:25:00",24851587,"Em conclusão","2115","Incêndio em edifícios hoteleiros e de restauração",0,8,0,17,"2025-01-21T22:25:00","Almada","Setúbal","Área Metropolitana De Lisboa",-9.21176,38.60968
24851821,"Santa Maria do Castelo e Santiago e Santa Susana","Alentejo Litoral",312,"2025-01-21T23:41:00",24851821,"Em resolução","1103","Vento forte",0,11,0,21,"2025-01-21T23:41:00","Alcácer Do Sal","Setúbal","Alentejo",-8.703333,38.36917
24852406,"Colmeias e Memória","Região de Leiria",310,"2025-01-22T06:36:00",24852406,"Em despacho","3321","Dano na rede de fornecimento de eletricidade ",0,2,0,4,"2025-01-22T06:36:00","Leiria","Leiria","Centro",-8.683668,39.78304
24852456,"São João Baptista e Santa Maria Dos Olivais","Médio Tejo",311,"2025-01-22T07:06:00",24852456,"Em despacho","3315","Inundação de estruturas por precipitação intensa",0,1,0,2,"2025-01-22T07:06:00","Tomar","Santarém","Centro",-8.405552,39.602187
24851780,"São Miguel, Santa Eufémia e Rabaçal","Região de Coimbra",310,"2025-01-21T23:25:00",24851780,"Em curso","3315","Inundação de estruturas por precipitação intensa",0,0,0,0,"2025-01-21T23:25:00","Penela","Coimbra","Centro",-8.399036,40.025502
24852348,"S.julião, N.s. da Anunciada e S. Maria da Graça","Península de Setúbal",311,"2025-01-22T05:57:00",24852348,"Em despacho","2101","Incêndio em edifícios habitacionais",0,1,0,5,"2025-01-22T05:57:00","Setúbal","Setúbal","Área Metropolitana De Lisboa",-8.889983,38.529955
24852362,"Santa Bárbara de Nexe","Algarve",313,"2025-01-22T06:08:00",24852362,"Em despacho","3315","Inundação de estruturas por precipitação intensa",0,0,0,0,"2025-01-22T06:08:00","Faro","Faro","Algarve",-7.94912,37.13569
24852365,"Sousel","Alto Alentejo",312,"2025-01-22T06:07:00",24852365,"Em curso","3301","Queda de árvore",0,2,0,5,"2025-01-22T06:07:00","Sousel","Portalegre","Alentejo",-7.721727,38.99539
24852380,"Oldrões","Tâmega e Sousa",309,"2025-01-22T06:12:00",24852380,"Em despacho","2401","Atropelamento rodoviário",0,1,0,2,"2025-01-22T06:12:00","Penafiel","Porto","Norte",-8.304665,41.146828
24852429,"Palmeira","Cávado",309,"2025-01-22T06:50:00",24852429,"Em resolução","2201","Incêndio em equipamentos ou produtos",0,1,0,6,"2025-01-22T06:50:00","Braga","Braga","Norte",-8.427956,41.59148
24852432,"São Brás de Alportel","Algarve",313,"2025-01-22T06:45:00",24852432,"Em curso","3315","Inundação de estruturas por precipitação intensa",0,1,0,3,"2025-01-22T06:45:00","São Brás De Alportel","Faro","Algarve",-7.892178,37.149213
