"id","address","subregion","neighborhood","date","id.1","state","nature","nature_description","aerial_means","terrestrial_means","aquatic_means","operational","date.1","Concelho","Distrito","NUTII_DSG","longitude","latitude"
24685054,"Pinhal Novo","Península de Setúbal",311,"2024-12-16T00:40:00",24685054,"Em conclusão","2101","Incêndio em edifícios habitacionais",0,1,0,5,"2024-12-16T00:40:00","Palmela","Setúbal","Área Metropolitana De Lisboa",-8.91294,38.637902
24684977,"Canedo, Vale e Vila Maior","Area M. Porto",309,"2024-12-15T23:51:00",24684977,"Em conclusão","2101","Incêndio em edifícios habitacionais",0,5,0,15,"2024-12-15T23:51:00","Santa Maria Da Feira","Aveiro","Norte",-8.467397,41.010112
24684481,"Beja (Santiago Maior e São João Baptista)","Baixo Alentejo",312,"2024-12-15T20:35:00",24684481,"Em conclusão","2407","Despiste",0,0,0,0,"2024-12-15T20:35:00","Beja","Beja","Alentejo",-7.87538,38.025932
24685101,"Montijo e Afonsoeiro","Península de Setúbal",311,"2024-12-16T01:18:00",24685101,"Em resolução","2401","Atropelamento rodoviário",0,1,0,2,"2024-12-16T01:18:00","Montijo","Setúbal","Área Metropolitana De Lisboa",-8.97377,38.70653
24685135,"Louriçal do Campo","Beira Baixa",310,"2024-12-16T01:46:00",24685135,"Em conclusão","2101","Incêndio em edifícios habitacionais",0,3,0,8,"2024-12-16T01:46:00","Castelo Branco","Castelo Branco","Centro",-7.51025,40.048152
24684845,"Vilar de Maçada","Douro",309,"2024-12-15T22:37:00",24684845,"Em curso","4331","Busca e resgate terrestre de animais",0,0,0,0,"2024-12-15T22:37:00","Alijó","Vila Real","Norte",-7.517898,41.336208
24685162,"S.julião, N.s. da Anunciada e S. Maria da Graça","Península de Setúbal",311,"2024-12-16T02:12:00",24685162,"Em despacho","3317","Inundação de estruturas por água canalizada",0,2,0,10,"2024-12-16T02:12:00","Setúbal","Setúbal","Área Metropolitana De Lisboa",-8.90708,38.52914
