"id","address","subregion","neighborhood","date","id.1","state","nature","nature_description","aerial_means","terrestrial_means","aquatic_means","operational","date.1","Concelho","Distrito","NUTII_DSG","longitude","latitude"
24854272,"Riachos","Médio Tejo",311,"2025-01-22T13:00:00",24854272,"Em curso","3315","Inundação de estruturas por precipitação intensa",0,1,0,2,"2025-01-22T13:00:00","Torres Novas","Santarém","Centro",-8.515126,39.421796
24854583,"Vila Franca de Xira","Grande Lisboa",311,"2025-01-22T13:56:00",24854583,"Em despacho","4331","Busca e resgate terrestre de animais",0,1,0,3,"2025-01-22T13:56:00","Vila Franca De Xira","Lisboa","Área Metropolitana De Lisboa",-8.989293,38.955728
24855142,"Caia, São Pedro e Alcáçova","Alto Alentejo",312,"2025-01-22T15:40:00",24855142,"Em conclusão","3315","Inundação de estruturas por precipitação intensa",0,0,0,0,"2025-01-22T15:40:00","Elvas","Portalegre","Alentejo",-7.159152,38.880757
24855294,"Caia, São Pedro e Alcáçova","Alto Alentejo",312,"2025-01-22T16:13:00",24855294,"Em conclusão","3301","Queda de árvore",0,0,0,0,"2025-01-22T16:13:00","Elvas","Portalegre","Alentejo",-7.173718,38.871475
24855353,"Soalheira","Beiras e Serra da Estrela",310,"2025-01-22T16:30:00",24855353,"Em despacho","4339","Corte ou remoção de elementos",0,1,0,2,"2025-01-22T16:30:00","Fundão","Castelo Branco","Centro",-7.491072,40.033945
24855383,"Almancil","Algarve",313,"2025-01-22T16:28:00",24855383,"Em despacho","3315","Inundação de estruturas por precipitação intensa",0,2,0,4,"2025-01-22T16:28:00","Loulé","Faro","Algarve",-8.01388,37.063796
24855444,"Esmolfe","Viseu Dão Lafões",310,"2025-01-22T16:51:00",24855444,"Em conclusão","2407","Despiste",0,2,0,4,"2025-01-22T16:51:00","Penalva Do Castelo","Viseu","Centro",-7.68347,40.67962
24855519,"Benavente","Lezíria do Tejo",311,"2025-01-22T17:05:00",24855519,"Em conclusão","2403","Colisão rodoviária",0,2,0,4,"2025-01-22T17:05:00","Benavente","Santarém","Alentejo",-8.804753,38.980872
24855544,"São Mamede de Infesta e Senhora da Hora","Area M. Porto",309,"2025-01-22T17:12:00",24855544,"Em conclusão","2403","Colisão rodoviária",0,2,0,8,"2025-01-22T17:12:00","Matosinhos","Porto","Norte",-8.661119,41.17701
24855619,"Faro (Sé e São Pedro)","Algarve",313,"2025-01-22T17:25:00",24855619,"Em conclusão","2403","Colisão rodoviária",0,1,0,2,"2025-01-22T17:25:00","Faro","Faro","Algarve",-7.908261,37.006372
24855794,"Santiago e S. Simão de Litém e Albergaria Dos Doze","Região de Leiria",310,"2025-01-22T18:00:00",24855794,"Em curso","3313","Deslizamento de terras",0,1,0,2,"2025-01-22T18:00:00","Pombal","Leiria","Centro",-8.594224,39.785323
24855835,"Santa Iria de Azoia, São João da Talha e Bobadela","Grande Lisboa",311,"2025-01-22T18:20:00",24855835,"Em despacho","3315","Inundação de estruturas por precipitação intensa",0,1,0,5,"2025-01-22T18:20:00","Loures","Lisboa","Área Metropolitana De Lisboa",-9.098065,38.824783
24855853,"Gâmbia-Pontes-Alto da Guerra","Península de Setúbal",311,"2025-01-22T18:24:00",24855853,"Em despacho","4331","Busca e resgate terrestre de animais",0,1,0,2,"2025-01-22T18:24:00","Setúbal","Setúbal","Área Metropolitana De Lisboa",-8.848808,38.541024
24852551,"Alvorge","Região de Leiria",310,"2025-01-22T07:38:00",24852551,"Em curso","3315","Inundação de estruturas por precipitação intensa",0,1,0,4,"2025-01-22T07:38:00","Ansião","Leiria","Centro",-8.437457,39.972271
24854589,"Fiães","Area M. Porto",309,"2025-01-22T14:02:00",24854589,"Em resolução","2403","Colisão rodoviária",0,4,0,7,"2025-01-22T14:02:00","Santa Maria Da Feira","Aveiro","Norte",-8.53016,40.97921
24855300,"Caia, São Pedro e Alcáçova","Alto Alentejo",312,"2025-01-22T16:14:00",24855300,"Em conclusão","3315","Inundação de estruturas por precipitação intensa",0,1,0,4,"2025-01-22T16:14:00","Elvas","Portalegre","Alentejo",-7.169645,38.882464
24855311,"Caia, São Pedro e Alcáçova","Alto Alentejo",312,"2025-01-22T15:57:00",24855311,"Em conclusão","3315","Inundação de estruturas por precipitação intensa",0,0,0,0,"2025-01-22T15:57:00","Elvas","Portalegre","Alentejo",-7.163023,38.878448
24855552,"São Miguel, Santa Eufémia e Rabaçal","Região de Coimbra",310,"2025-01-22T17:00:00",24855552,"Em despacho","3301","Queda de árvore",0,1,0,2,"2025-01-22T17:00:00","Penela","Coimbra","Centro",-8.327615,40.039154
24855679,"São Martinho do Bispo e Ribeira de Frades","Região de Coimbra",310,"2025-01-22T17:38:00",24855679,"Em despacho","3315","Inundação de estruturas por precipitação intensa",0,1,0,3,"2025-01-22T17:38:00","Coimbra","Coimbra","Centro",-8.454962,40.20908
24855700,"Vila Verde","Região de Coimbra",310,"2025-01-22T17:45:00",24855700,"Em despacho","3301","Queda de árvore",0,1,0,2,"2025-01-22T17:45:00","Figueira Da Foz","Coimbra","Centro",-8.775959,40.119483
24855786,"Santa Maria Maior","Alto Tâmega e Barroso",309,"2025-01-22T18:00:00",24855786,"Em despacho","3301","Queda de árvore",0,1,0,3,"2025-01-22T18:00:00","Chaves","Vila Real","Norte",-7.477948,41.740078
24855827,"Avis","Alto Alentejo",312,"2025-01-22T18:19:00",24855827,"Em curso","2407","Despiste",0,5,0,11,"2025-01-22T18:19:00","Avis","Portalegre","Alentejo",-7.890482,39.057325
24855834,"Poceirão e Marateca","Península de Setúbal",311,"2025-01-22T18:19:00",24855834,"Em despacho","3301","Queda de árvore",0,1,0,3,"2025-01-22T18:19:00","Palmela","Setúbal","Área Metropolitana De Lisboa",-8.78258,38.573841
24851780,"São Miguel, Santa Eufémia e Rabaçal","Região de Coimbra",310,"2025-01-21T23:25:00",24851780,"Em curso","3315","Inundação de estruturas por precipitação intensa",0,0,0,0,"2025-01-21T23:25:00","Penela","Coimbra","Centro",-8.399036,40.025502
24854388,"Avelar","Região de Leiria",310,"2025-01-22T13:18:00",24854388,"Em curso","3315","Inundação de estruturas por precipitação intensa",0,1,0,4,"2025-01-22T13:18:00","Ansião","Leiria","Centro",-8.365894,39.925606
24854703,"Tavira (Santa Maria e Santiago)","Algarve",313,"2025-01-22T10:30:00",24854703,"Em despacho","3315","Inundação de estruturas por precipitação intensa",0,1,0,1,"2025-01-22T10:30:00","Tavira","Faro","Algarve",-7.650217,37.141268
24855071,"Bougado (São Martinho e Santiago)","Area M. Porto",309,"2025-01-22T15:29:00",24855071,"Em conclusão","2401","Atropelamento rodoviário",0,3,0,6,"2025-01-22T15:29:00","Trofa","Porto","Norte",-8.564955,41.336688
24855105,"Ovar, São João, Arada e São Vicente de Pereira Jusã","Região de Aveiro",310,"2025-01-22T15:41:00",24855105,"Em conclusão","2401","Atropelamento rodoviário",0,8,0,17,"2025-01-22T15:41:00","Ovar","Aveiro","Centro",-8.589616,40.910636
24855221,"Caia, São Pedro e Alcáçova","Alto Alentejo",312,"2025-01-22T15:54:00",24855221,"Em conclusão","3315","Inundação de estruturas por precipitação intensa",0,0,0,0,"2025-01-22T15:54:00","Elvas","Portalegre","Alentejo",-7.152338,38.891818
24855239,"Caia, São Pedro e Alcáçova","Alto Alentejo",312,"2025-01-22T16:00:00",24855239,"Em conclusão","3315","Inundação de estruturas por precipitação intensa",0,0,0,0,"2025-01-22T16:00:00","Elvas","Portalegre","Alentejo",-7.159272,38.880835
24855287,"Seiça","Médio Tejo",311,"2025-01-22T16:19:00",24855287,"Em despacho","3313","Deslizamento de terras",0,3,0,6,"2025-01-22T16:19:00","Ourém","Santarém","Centro",-8.537458,39.660344
24855340,"Caia, São Pedro e Alcáçova","Alto Alentejo",312,"2025-01-22T16:25:00",24855340,"Em conclusão","3313","Deslizamento de terras",0,2,0,4,"2025-01-22T16:25:00","Elvas","Portalegre","Alentejo",-7.185282,38.856547
24855422,"Atouguia da Baleia","Oeste",311,"2025-01-22T16:36:00",24855422,"Em conclusão","2403","Colisão rodoviária",0,1,0,2,"2025-01-22T16:36:00","Peniche","Leiria","Centro",-9.315683,39.295773
24851821,"Santa Maria do Castelo e Santiago e Santa Susana","Alentejo Litoral",312,"2025-01-21T23:41:00",24851821,"Em resolução","1103","Vento forte",0,11,0,21,"2025-01-21T23:41:00","Alcácer Do Sal","Setúbal","Alentejo",-8.598678,38.397168
24854279,"Abrigada e Cabanas de Torres","Oeste",311,"2025-01-22T13:00:00",24854279,"Em curso","3315","Inundação de estruturas por precipitação intensa",0,1,0,5,"2025-01-22T13:00:00","Alenquer","Lisboa","Centro",-9.029641,39.148386
24854760,"Faro (Sé e São Pedro)","Algarve",313,"2025-01-22T14:28:00",24854760,"Em conclusão","2403","Colisão rodoviária",0,1,0,2,"2025-01-22T14:28:00","Faro","Faro","Algarve",-7.942032,37.01865
24855215,"Caia, São Pedro e Alcáçova","Alto Alentejo",312,"2025-01-22T15:47:00",24855215,"Em conclusão","3315","Inundação de estruturas por precipitação intensa",0,0,0,0,"2025-01-22T15:47:00","Elvas","Portalegre","Alentejo",-7.169645,38.882464
24855231,"Pias","Baixo Alentejo",312,"2025-01-22T16:08:00",24855231,"Em conclusão","2403","Colisão rodoviária",0,0,0,0,"2025-01-22T16:08:00","Serpa","Beja","Alentejo",-7.48,38.024675
24855330,"Caia, São Pedro e Alcáçova","Alto Alentejo",312,"2025-01-22T16:10:00",24855330,"Em conclusão","3315","Inundação de estruturas por precipitação intensa",0,0,0,0,"2025-01-22T16:10:00","Elvas","Portalegre","Alentejo",-7.171002,38.872887
24855496,"Fátima","Médio Tejo",311,"2025-01-22T17:04:00",24855496,"Em conclusão","2407","Despiste",0,7,0,15,"2025-01-22T17:04:00","Ourém","Santarém","Centro",-8.691147,39.621022
24855498,"Aldeia da Ribeira, Vilar Maior e Badamalos","Beiras e Serra da Estrela",310,"2025-01-22T17:00:00",24855498,"Em despacho","3313","Deslizamento de terras",0,1,0,2,"2025-01-22T17:00:00","Sabugal","Guarda","Centro",-6.950368,40.47456
24855697,"Santa Maria da Feira, Travanca, Sanfins e Espargo","Area M. Porto",309,"2025-01-22T17:42:00",24855697,"Em curso","2403","Colisão rodoviária",0,1,0,2,"2025-01-22T17:42:00","Santa Maria Da Feira","Aveiro","Norte",-8.555837,40.9255
24855731,"Porto Salvo","Grande Lisboa",311,"2025-01-22T17:53:00",24855731,"Em curso","2403","Colisão rodoviária",0,3,0,9,"2025-01-22T17:53:00","Oeiras","Lisboa","Área Metropolitana De Lisboa",-9.29803,38.730179
24855621,"Moreira de Cónegos","Ave",309,"2025-01-22T17:32:00",24855621,"Em conclusão","2101","Incêndio em edifícios habitacionais",0,3,0,9,"2025-01-22T17:32:00","Guimarães","Braga","Norte",-8.317425,41.37796
24855656,"Abrunheira, Verride e Vila Nova da Barca","Região de Coimbra",310,"2025-01-22T17:40:00",24855656,"Em despacho","2407","Despiste",0,2,0,4,"2025-01-22T17:40:00","Montemor-o-Velho","Coimbra","Centro",-8.70609,40.14028
24855673,"Ervedosa do Douro","Douro",309,"2025-01-22T17:40:00",24855673,"Em resolução","2403","Colisão rodoviária",0,3,0,6,"2025-01-22T17:40:00","São João Da Pesqueira","Viseu","Norte",-7.467557,41.16028
24855813,"Matosinhos e Leça da Palmeira","Area M. Porto",309,"2025-01-22T18:17:00",24855813,"Em despacho","4331","Busca e resgate terrestre de animais",0,1,0,2,"2025-01-22T18:17:00","Matosinhos","Porto","Norte",-8.696959,41.192394
24855832,"Costa da Caparica","Península de Setúbal",311,"2025-01-22T18:15:00",24855832,"Em despacho","3315","Inundação de estruturas por precipitação intensa",0,1,0,3,"2025-01-22T18:15:00","Almada","Setúbal","Área Metropolitana De Lisboa",-9.227696,38.642583
24855848,"Santiago do Cacém, S.cruz e São Bartolomeu da Serra","Alentejo Litoral",312,"2025-01-22T18:24:00",24855848,"Em despacho","2407","Despiste",0,1,0,2,"2025-01-22T18:24:00","Santiago Do Cacém","Setúbal","Alentejo",-8.72994,38.034504
24855863,"Póvoa de Varzim, Beiriz e Argivai","Area M. Porto",309,"2025-01-22T18:15:00",24855863,"Em resolução","2407","Despiste",0,1,0,2,"2025-01-22T18:15:00","Póvoa De Varzim","Porto","Norte",-8.741711,41.385553
