"id","address","subregion","neighborhood","date","id.1","state","nature","nature_description","aerial_means","terrestrial_means","aquatic_means","operational","date.1","Concelho","Distrito","NUTII_DSG","longitude","latitude"
24704238,"Seixal, Arrentela e Aldeia de Paio Pires","Península de Setúbal",311,"2024-12-20T00:25:00",24704238,"Em resolução","2403","Colisão rodoviária",0,1,0,2,"2024-12-20T00:25:00","Seixal","Setúbal","Área Metropolitana De Lisboa",-9.081788,38.615401
24704302,"Cedofeita, Ildefonso, Sé, Miragaia, Nicolau e Vitória","Area M. Porto",309,"2024-12-20T01:16:00",24704302,"Em despacho","2403","Colisão rodoviária",0,2,0,4,"2024-12-20T01:16:00","Porto","Porto","Norte",-8.615939,41.15359
24701947,"Safara e Santo Aleixo da Restauração","Baixo Alentejo",312,"2024-12-19T14:08:00",24701947,"Em curso","2127","Incêndio em edifícios e recintos industriais, oficinas e armazéns",0,13,0,30,"2024-12-19T14:08:00","Moura","Beja","Alentejo",-7.254992,38.13351
24704137,"Aldeia da Ribeira, Vilar Maior e Badamalos","Beiras e Serra da Estrela",310,"2024-12-19T23:35:00",24704137,"Em curso","2407","Despiste",0,10,0,24,"2024-12-19T23:35:00","Sabugal","Guarda","Centro",-6.87845,40.45453
24704289,"Olhão","Algarve",313,"2024-12-20T01:05:00",24704289,"Em despacho","4331","Busca e resgate terrestre de animais",0,1,0,1,"2024-12-20T01:05:00","Olhão","Faro","Algarve",-7.843133,37.022054
24704303,"Azoia de Cima e Tremês","Lezíria do Tejo",311,"2024-12-20T01:21:00",24704303,"Em conclusão","2407","Despiste",0,2,0,7,"2024-12-20T01:21:00","Santarém","Santarém","Alentejo",-8.721697,39.369485
24704259,"Peniche","Oeste",311,"2024-12-20T00:38:00",24704259,"Em conclusão","2407","Despiste",0,2,0,4,"2024-12-20T00:38:00","Peniche","Leiria","Centro",-9.376833,39.357166
24703397,"Cabeça Gorda","Baixo Alentejo",312,"2024-12-19T19:24:00",24703397,"Em conclusão","2301","Incêndio em transporte rodoviário",0,0,0,0,"2024-12-19T19:24:00","Beja","Beja","Alentejo",-7.794865,37.950268
24704283,"Anta e Guetim","Area M. Porto",309,"2024-12-20T00:58:00",24704283,"Em conclusão","2403","Colisão rodoviária",0,3,0,9,"2024-12-20T00:58:00","Espinho","Aveiro","Norte",-8.626405,41.007732
24704334,"Encosta do Sol","Grande Lisboa",311,"2024-12-20T01:35:00",24704334,"Em curso","3323","Dano na rede de abastecimento de água",0,1,0,2,"2024-12-20T01:35:00","Amadora","Lisboa","Área Metropolitana De Lisboa",-9.21408573455781,38.769382964152
