"id","address","subregion","neighborhood","date","id.1","state","nature","nature_description","aerial_means","terrestrial_means","aquatic_means","operational","date.1","Concelho","Distrito","NUTII_DSG","longitude","latitude"
25026516,"Melres e Medas","Area M. Porto",309,"2025-03-01T11:41:00",25026516,"Em curso","4329","Busca e resgate aquático de pessoas",0,0,0,0,"2025-03-01T11:41:00","Gondomar","Porto","Norte",-8.458103,41.061746
24877003,"Malagueira e Horta Das Figueiras","Alentejo Central",312,"2025-01-27T11:41:00",24877003,"Em conclusão","3315","Inundação de estruturas por precipitação intensa",0,0,0,0,"2025-01-27T11:41:00","Évora","Évora","Alentejo",-7.924277,38.57285
25038021,"Matosinhos e Leça da Palmeira","Area M. Porto",309,"2025-03-04T01:24:00",25038021,"Em resolução","2201","Incêndio em equipamentos ou produtos",0,1,0,5,"2025-03-04T01:24:00","Matosinhos","Porto","Norte",-8.692583,41.193749
25038122,"Santa Maria Maior","Alto Tâmega e Barroso",309,"2025-03-04T02:35:00",25038122,"Em curso","2101","Incêndio em edifícios habitacionais",0,2,0,6,"2025-03-04T02:35:00","Chaves","Vila Real","Norte",-7.47158,41.746185
25031633,"Alcabideche","Grande Lisboa",311,"2025-03-02T15:04:00",25031633,"Em conclusão","4329","Busca e resgate aquático de pessoas",0,0,0,0,"2025-03-02T15:04:00","Cascais","Lisboa","Área Metropolitana De Lisboa",-9.47686,38.75392
25037181,"Maceira","Região de Leiria",310,"2025-03-03T19:38:00",25037181,"Em despacho","3203","Detritos confinados",0,1,0,2,"2025-03-03T19:38:00","Leiria","Leiria","Centro",-8.929179,39.67723
25038169,"Santo António Dos Olivais","Região de Coimbra",310,"2025-03-04T03:02:00",25038169,"Em despacho","3311","Queda de elementos de estruturas edificados",0,2,0,4,"2025-03-04T03:02:00","Coimbra","Coimbra","Centro",-8.426807,40.217261
