"id","address","subregion","neighborhood","date","id.1","state","nature","nature_description","aerial_means","terrestrial_means","aquatic_means","operational","date.1","Concelho","Distrito","NUTII_DSG","longitude","latitude"
25001398,"Aldeia Galega da Merceana e Aldeia Gavinha","Oeste",311,"2025-02-23T23:10:00",25001398,"Em resolução","2101","Incêndio em edifícios habitacionais",0,2,0,6,"2025-02-23T23:10:00","Alenquer","Lisboa","Centro",-9.083165,39.088824
24877003,"Malagueira e Horta Das Figueiras","Alentejo Central",312,"2025-01-27T11:41:00",24877003,"Em conclusão","3315","Inundação de estruturas por precipitação intensa",0,0,0,0,"2025-01-27T11:41:00","Évora","Évora","Alentejo",-7.924277,38.57285
25001436,"Sandim, Olival, Lever e Crestuma","Area M. Porto",309,"2025-02-23T23:30:00",25001436,"Em despacho","2407","Despiste",0,1,0,2,"2025-02-23T23:30:00","Vila Nova De Gaia","Porto","Norte",-8.545846,41.046266
25001237,"Alto do Seixalinho, Santo André e Verderena","Península de Setúbal",311,"2025-02-23T22:04:00",25001237,"Em conclusão","2403","Colisão rodoviária",0,3,0,9,"2025-02-23T22:04:00","Barreiro","Setúbal","Área Metropolitana De Lisboa",-9.056708,38.653969
25001406,"Carregueira","Lezíria do Tejo",311,"2025-02-23T23:17:00",25001406,"Em curso","2403","Colisão rodoviária",0,4,0,10,"2025-02-23T23:17:00","Chamusca","Santarém","Alentejo",-8.33764,39.402695
24888293,"Pernes","Lezíria do Tejo",311,"2025-01-29T16:41:00",24888293,"Em curso","3301","Queda de árvore",0,0,0,0,"2025-01-29T16:41:00","Santarém","Santarém","Alentejo",-8.658865,39.381547
25001117,"Cernache","Região de Coimbra",310,"2025-02-23T21:20:00",25001117,"Em conclusão","2101","Incêndio em edifícios habitacionais",0,4,0,12,"2025-02-23T21:20:00","Coimbra","Coimbra","Centro",-8.44994,40.139749
