"id","address","subregion","neighborhood","date","id.1","state","nature","nature_description","aerial_means","terrestrial_means","aquatic_means","operational","date.1","Concelho","Distrito","NUTII_DSG","longitude","latitude"
24911314,"Quinta do Conde","Península de Setúbal",311,"2025-02-03T19:35:00",24911314,"Em conclusão","2401","Atropelamento rodoviário",0,4,0,8,"2025-02-03T19:35:00","Sesimbra","Setúbal","Área Metropolitana De Lisboa",-9.03613,38.570355
24911582,"Nossa Senhora do Pópulo, Coto e São Gregório","Oeste",311,"2025-02-03T21:12:00",24911582,"Em conclusão","2101","Incêndio em edifícios habitacionais",0,4,0,9,"2025-02-03T21:12:00","Caldas Da Rainha","Leiria","Centro",-9.13195,39.40742
24911808,"Corroios","Península de Setúbal",311,"2025-02-03T22:37:00",24911808,"Em curso","2403","Colisão rodoviária",0,2,0,7,"2025-02-03T22:37:00","Seixal","Setúbal","Área Metropolitana De Lisboa",-9.166754,38.637734
24911232,"São Salvador e Santa Maria","Alentejo Litoral",312,"2025-02-03T19:14:00",24911232,"Em resolução","2403","Colisão rodoviária",0,3,0,6,"2025-02-03T19:14:00","Odemira","Beja","Alentejo",-8.764685,37.509583
24911282,"Almada, Cova da Piedade, Pragal e Cacilhas","Península de Setúbal",311,"2025-02-03T19:34:00",24911282,"Em conclusão","2201","Incêndio em equipamentos ou produtos",0,0,0,0,"2025-02-03T19:34:00","Almada","Setúbal","Área Metropolitana De Lisboa",-9.17885,38.67221
24911651,"Beirã","Alto Alentejo",312,"2025-02-03T21:34:00",24911651,"Em conclusão","2101","Incêndio em edifícios habitacionais",0,8,0,19,"2025-02-03T21:34:00","Marvão","Portalegre","Alentejo",-7.369857,39.445572
24877003,"Malagueira e Horta Das Figueiras","Alentejo Central",312,"2025-01-27T11:41:00",24877003,"Em conclusão","3315","Inundação de estruturas por precipitação intensa",0,0,0,0,"2025-01-27T11:41:00","Évora","Évora","Alentejo",-7.924277,38.57285
24911690,"Marvila, Ribeira Santarém, S.salvador, S.nicolau","Lezíria do Tejo",311,"2025-02-03T21:48:00",24911690,"Em curso","2513","Fuga de gás em conduta",0,1,0,5,"2025-02-03T21:48:00","Santarém","Santarém","Alentejo",-8.69534,39.263777
24911799,"Galegos","Ave",309,"2025-02-03T22:36:00",24911799,"Em curso","2403","Colisão rodoviária",0,2,0,5,"2025-02-03T22:36:00","Póvoa De Lanhoso","Braga","Norte",-8.280011,41.563344
24911804,"Enxara do Bispo, Gradil e Vila Franca do Rosário","Grande Lisboa",311,"2025-02-03T22:31:00",24911804,"Em curso","2407","Despiste",0,3,0,9,"2025-02-03T22:31:00","Mafra","Lisboa","Área Metropolitana De Lisboa",-9.254962,38.990018
