"id","address","subregion","neighborhood","date","id.1","state","nature","nature_description","aerial_means","terrestrial_means","aquatic_means","operational","date.1","Concelho","Distrito","NUTII_DSG","longitude","latitude"
24573722,"Cedofeita, Ildefonso, Sé, Miragaia, Nicolau e Vitória","Area M. Porto",309,"2024-11-20T16:48:00",24573722,"Em conclusão","2115","Incêndio em edifícios hoteleiros e de restauração",0,0,0,0,"2024-11-20T16:48:00","Porto","Porto","Norte",-8.6073,41.14514
24579209,"Águas Santas","Area M. Porto",309,"2024-11-21T21:59:00",24579209,"Em curso","3313","Deslizamento de terras",0,0,0,0,"2024-11-21T21:59:00","Maia","Porto","Norte",-8.569778,41.208823
24584129,"Queluz e Belas","Grande Lisboa",311,"2024-11-23T00:11:00",24584129,"Em conclusão","2407","Despiste",0,8,0,21,"2024-11-23T00:11:00","Sintra","Lisboa","Área Metropolitana De Lisboa",-9.2661,38.77618
24584280,"Talhadas","Região de Aveiro",310,"2024-11-23T01:51:00",24584280,"Em conclusão","2407","Despiste",0,2,0,4,"2024-11-23T01:51:00","Sever Do Vouga","Aveiro","Centro",-8.330608,40.662334
24584331,"Alverca do Ribatejo e Sobralinho","Grande Lisboa",311,"2024-11-23T02:40:00",24584331,"Em resolução","2301","Incêndio em transporte rodoviário",0,2,0,7,"2024-11-23T02:40:00","Vila Franca De Xira","Lisboa","Área Metropolitana De Lisboa",-9.046012,38.896362
24584238,"Nossa Senhora do Pópulo, Coto e São Gregório","Oeste",311,"2024-11-23T01:16:00",24584238,"Em resolução","2407","Despiste",0,3,0,5,"2024-11-23T01:16:00","Caldas Da Rainha","Leiria","Centro",-9.070578,39.359139
24584286,"Penhalonga e Paços de Gaiolo","Tâmega e Sousa",309,"2024-11-23T02:04:00",24584286,"Em conclusão","2301","Incêndio em transporte rodoviário",0,5,0,13,"2024-11-23T02:04:00","Marco De Canaveses","Porto","Norte",-8.116735,41.10625
24584235,"Nogueira da Regedoura","Area M. Porto",309,"2024-11-23T01:30:00",24584235,"Em conclusão","2403","Colisão rodoviária",0,0,0,0,"2024-11-23T01:30:00","Santa Maria Da Feira","Aveiro","Norte",-8.5995,41.007744
24584308,"Aldeia Galega da Merceana e Aldeia Gavinha","Oeste",311,"2024-11-23T02:21:00",24584308,"Em curso","2301","Incêndio em transporte rodoviário",0,4,0,12,"2024-11-23T02:21:00","Alenquer","Lisboa","Centro",-9.11128,39.09399
