"id","address","subregion","neighborhood","date","id.1","state","nature","nature_description","aerial_means","terrestrial_means","aquatic_means","operational","date.1","Concelho","Distrito","NUTII_DSG","longitude","latitude","state_2"
26302576,"Oliveira do Hospital e São Paio de Gramaços","Região de Coimbra",310,"2025-11-17T19:15:00",26302576,"Em Despacho","2401","Atropelamento rodoviário",0,2,0,4,"2025-11-17T19:15:00","Oliveira Do Hospital","Coimbra","Centro",-7.869418,40.359628,"Despacho"
26303052,"Amora","Península de Setúbal",311,"2025-11-17T21:37:00",26303052,"Em resolução/conclusão","2101","Incêndio em edifícios habitacionais",0,5,0,9,"2025-11-17T21:37:00","Seixal","Setúbal","Área Metropolitana De Lisboa",-9.12204,38.62202,"Resolução/Conclusão"
26303077,"Carregado e Cadafais","Oeste",311,"2025-11-17T21:23:00",26303077,"Em Despacho","3321","Dano na rede de fornecimento de eletricidade ",0,0,0,0,"2025-11-17T21:23:00","Alenquer","Lisboa","Centro",-8.975479,39.031973,"Despacho"
26278163,"Santa Maria Maior e Monserrate e Meadela","Alto Minho",309,"2025-11-13T10:15:00",26278163,"Em Curso","3315","Inundação de estruturas por precipitação intensa",0,1,0,2,"2025-11-13T10:15:00","Viana Do Castelo","Viana Do Castelo","Norte",-8.837157,41.690707,"Curso"
26303198,"Santo António Dos Cavaleiros e Frielas","Grande Lisboa",311,"2025-11-17T22:30:00",26303198,"Em resolução/conclusão","3201","Detritos não confinados",0,1,0,6,"2025-11-17T22:30:00","Loures","Lisboa","Área Metropolitana De Lisboa",-9.14628,38.81656,"Resolução/Conclusão"
26303263,"Melides","Alentejo Litoral",312,"2025-11-17T23:01:00",26303263,"Em Curso","2111","Incêndio em edifícios hospitalares e lares de idosos",0,4,0,10,"2025-11-17T23:01:00","Grândola","Setúbal","Alentejo",-8.729755,38.14828,"Curso"
