"id","address","subregion","neighborhood","date","id.1","state","nature","nature_description","aerial_means","terrestrial_means","aquatic_means","operational","date.1","Concelho","Distrito","NUTII_DSG","longitude","latitude"
24780664,"Póvoa de Varzim, Beiriz e Argivai","Area M. Porto",309,"2025-01-06T10:06:00",24780664,"Em conclusão","4329","Busca e resgate aquático de pessoas",0,0,0,0,"2025-01-06T10:06:00","Póvoa De Varzim","Porto","Norte",-8.76679,41.37906
24789370,"Alcanena e Vila Moreira","Médio Tejo",311,"2025-01-08T07:50:00",24789370,"Em curso","3311","Queda de elementos de estruturas edificados",0,1,0,2,"2025-01-08T07:50:00","Alcanena","Santarém","Centro",-8.669221,39.464869
24789422,"Alcanena e Vila Moreira","Médio Tejo",311,"2025-01-08T08:00:00",24789422,"Em despacho","3311","Queda de elementos de estruturas edificados",0,1,0,3,"2025-01-08T08:00:00","Alcanena","Santarém","Centro",-8.669221,39.464869
24789536,"Alcanena e Vila Moreira","Médio Tejo",311,"2025-01-08T08:30:00",24789536,"Em curso","3311","Queda de elementos de estruturas edificados",0,4,0,9,"2025-01-08T08:30:00","Alcanena","Santarém","Centro",-8.669221,39.464869
24792903,"Lage","Cávado",309,"2025-01-08T19:29:00",24792903,"Em resolução","2403","Colisão rodoviária",0,3,0,6,"2025-01-08T19:29:00","Vila Verde","Braga","Norte",-8.473155,41.625133
24792937,"São João Baptista","Médio Tejo",311,"2025-01-08T19:40:00",24792937,"Em conclusão","2407","Despiste",0,1,0,2,"2025-01-08T19:40:00","Entroncamento","Santarém","Centro",-8.469048,39.461192
24793023,"Santo António da Charneca","Península de Setúbal",311,"2025-01-08T20:02:00",24793023,"Em despacho","3323","Dano na rede de abastecimento de água",0,1,0,5,"2025-01-08T20:02:00","Barreiro","Setúbal","Área Metropolitana De Lisboa",-9.03501,38.63167
24793032,"Nogueira, Fraião e Lamaçães","Cávado",309,"2025-01-08T20:06:00",24793032,"Em despacho","3315","Inundação de estruturas por precipitação intensa",0,1,0,2,"2025-01-08T20:06:00","Braga","Braga","Norte",-8.40157,41.54808
24793039,"Nossa Senhora da Conceição, São Pedro e São Dinis","Douro",309,"2025-01-08T20:06:00",24793039,"Em conclusão","2403","Colisão rodoviária",0,3,0,6,"2025-01-08T20:06:00","Vila Real","Vila Real","Norte",-7.657402,41.319892
24790025,"Santa Maria Maior e Monserrate e Meadela","Alto Minho",309,"2025-01-08T10:02:00",24790025,"Em curso","3315","Inundação de estruturas por precipitação intensa",0,1,0,1,"2025-01-08T10:02:00","Viana Do Castelo","Viana Do Castelo","Norte",-8.841905,41.696425
24792617,"Albufeira e Olhos de Água","Algarve",313,"2025-01-08T18:14:00",24792617,"Em curso","2401","Atropelamento rodoviário",0,2,0,4,"2025-01-08T18:14:00","Albufeira","Faro","Algarve",-8.252292,37.091727
24792902,"Aljezur","Algarve",313,"2025-01-08T19:26:00",24792902,"Em curso","3313","Deslizamento de terras",0,3,0,6,"2025-01-08T19:26:00","Aljezur","Faro","Algarve",-8.798537,37.302557
24793035,"Nogueira da Regedoura","Area M. Porto",309,"2025-01-08T20:06:00",24793035,"Em conclusão","2403","Colisão rodoviária",0,4,0,10,"2025-01-08T20:06:00","Santa Maria Da Feira","Aveiro","Norte",-8.571956,41.01174
24793250,"Cidade da Maia","Area M. Porto",309,"2025-01-08T20:52:00",24793250,"Em curso","3329","Queda de estruturas temporárias ou móveis",0,1,0,4,"2025-01-08T20:52:00","Maia","Porto","Norte",-8.614095,41.229822
24793064,"Souto da Carpalhosa e Ortigosa","Região de Leiria",310,"2025-01-08T20:14:00",24793064,"Em despacho","3301","Queda de árvore",0,1,0,3,"2025-01-08T20:14:00","Leiria","Leiria","Centro",-8.845857,39.847992
24793082,"Torreira","Região de Aveiro",310,"2025-01-08T20:13:00",24793082,"Em conclusão","2407","Despiste",0,1,0,2,"2025-01-08T20:13:00","Murtosa","Aveiro","Centro",-8.711787,40.768901
24793239,"Vale de Santarém","Lezíria do Tejo",311,"2025-01-08T21:01:00",24793239,"Em resolução","2403","Colisão rodoviária",0,4,0,11,"2025-01-08T21:01:00","Santarém","Santarém","Alentejo",-8.723394,39.188484
24793246,"São João da Madeira","Area M. Porto",309,"2025-01-08T20:58:00",24793246,"Em despacho","2101","Incêndio em edifícios habitacionais",0,1,0,4,"2025-01-08T20:58:00","São João Da Madeira","Aveiro","Norte",-8.490365,40.895632
24782982,"Almada, Cova da Piedade, Pragal e Cacilhas","Península de Setúbal",311,"2025-01-06T17:08:00",24782982,"Em conclusão","2425","Abalroamento aquático",0,0,0,0,"2025-01-06T17:08:00","Almada","Setúbal","Área Metropolitana De Lisboa",-9.164498,38.675268
24789367,"Alcanena e Vila Moreira","Médio Tejo",311,"2025-01-08T07:44:00",24789367,"Em curso","3311","Queda de elementos de estruturas edificados",0,1,0,2,"2025-01-08T07:44:00","Alcanena","Santarém","Centro",-8.669221,39.464869
24789401,"Alcanena e Vila Moreira","Médio Tejo",311,"2025-01-08T07:57:00",24789401,"Em despacho","3311","Queda de elementos de estruturas edificados",0,1,0,3,"2025-01-08T07:57:00","Alcanena","Santarém","Centro",-8.669221,39.464869
24793110,"S.julião, N.s. da Anunciada e S. Maria da Graça","Península de Setúbal",311,"2025-01-08T20:16:00",24793110,"Em curso","2401","Atropelamento rodoviário",0,1,0,2,"2025-01-08T20:16:00","Setúbal","Setúbal","Área Metropolitana De Lisboa",-8.889983,38.529955
24793260,"Peso e Vales do Rio","Beiras e Serra da Estrela",310,"2025-01-08T21:05:00",24793260,"Em despacho","3203","Detritos confinados",0,1,0,5,"2025-01-08T21:05:00","Covilhã","Castelo Branco","Centro",-7.568243,40.19465
24789362,"Alcanena e Vila Moreira","Médio Tejo",311,"2025-01-08T07:46:00",24789362,"Em curso","3311","Queda de elementos de estruturas edificados",0,1,0,2,"2025-01-08T07:46:00","Alcanena","Santarém","Centro",-8.669221,39.464869
24792838,"Pinhal Novo","Península de Setúbal",311,"2025-01-08T19:10:00",24792838,"Em curso","4331","Busca e resgate terrestre de animais",0,1,0,5,"2025-01-08T19:10:00","Palmela","Setúbal","Área Metropolitana De Lisboa",-8.881886,38.633601
24792897,"Póvoa de Santo Adrião e Olival Basto","Grande Lisboa",311,"2025-01-08T19:26:00",24792897,"Em conclusão","2403","Colisão rodoviária",0,3,0,9,"2025-01-08T19:26:00","Odivelas","Lisboa","Área Metropolitana De Lisboa",-9.159939,38.803537
24792995,"Ovar, São João, Arada e São Vicente de Pereira Jusã","Região de Aveiro",310,"2025-01-08T19:50:00",24792995,"Em resolução","2403","Colisão rodoviária",0,4,0,11,"2025-01-08T19:50:00","Ovar","Aveiro","Centro",-8.671695,40.872857
24793149,"Loures","Grande Lisboa",311,"2025-01-08T20:34:00",24793149,"Em curso","2301","Incêndio em transporte rodoviário",0,2,0,7,"2025-01-08T20:34:00","Loures","Lisboa","Área Metropolitana De Lisboa",-9.17778,38.82359
24793229,"Cascais e Estoril","Grande Lisboa",311,"2025-01-08T20:59:00",24793229,"Em despacho","2101","Incêndio em edifícios habitacionais",0,1,0,5,"2025-01-08T20:59:00","Cascais","Lisboa","Área Metropolitana De Lisboa",-9.40566,38.72129
24793238,"São Bernardo","Região de Aveiro",310,"2025-01-08T20:57:00",24793238,"Em conclusão","2401","Atropelamento rodoviário",0,2,0,6,"2025-01-08T20:57:00","Aveiro","Aveiro","Centro",-8.625929,40.620025
24793272,"Areosa","Alto Minho",309,"2025-01-08T21:07:00",24793272,"Em despacho","3315","Inundação de estruturas por precipitação intensa",0,1,0,2,"2025-01-08T21:07:00","Viana Do Castelo","Viana Do Castelo","Norte",-8.841057,41.722906
