"id","address","subregion","neighborhood","date","id.1","state","nature","nature_description","aerial_means","terrestrial_means","aquatic_means","operational","date.1","Concelho","Distrito","NUTII_DSG","longitude","latitude"
24851780,"São Miguel, Santa Eufémia e Rabaçal","Região de Coimbra",310,"2025-01-21T23:25:00",24851780,"Em curso","3315","Inundação de estruturas por precipitação intensa",0,0,0,0,"2025-01-21T23:25:00","Penela","Coimbra","Centro",-8.399036,40.025502
24885160,"Vilamar e Corticeiro de Cima","Região de Coimbra",310,"2025-01-29T02:45:00",24885160,"Em conclusão","2101","Incêndio em edifícios habitacionais",0,2,0,8,"2025-01-29T02:45:00","Cantanhede","Coimbra","Centro",-8.65981,40.419958
24885180,"Sesimbra (Castelo)","Península de Setúbal",311,"2025-01-29T03:03:00",24885180,"Em despacho","3311","Queda de elementos de estruturas edificados",0,1,0,5,"2025-01-29T03:03:00","Sesimbra","Setúbal","Área Metropolitana De Lisboa",-9.16503,38.51426
24874756,"Tocha","Região de Coimbra",310,"2025-01-26T22:40:00",24874756,"Em curso","4327","Busca e resgate terrestre de pessoas",0,5,0,18,"2025-01-26T22:40:00","Cantanhede","Coimbra","Centro",-8.782308,40.341926
24877003,"Malagueira e Horta Das Figueiras","Alentejo Central",312,"2025-01-27T11:41:00",24877003,"Em conclusão","3315","Inundação de estruturas por precipitação intensa",0,0,0,0,"2025-01-27T11:41:00","Évora","Évora","Alentejo",-7.924277,38.57285
24884882,"Moscavide e Portela","Grande Lisboa",311,"2025-01-28T23:16:00",24884882,"Em conclusão","2403","Colisão rodoviária",0,1,0,2,"2025-01-28T23:16:00","Loures","Lisboa","Área Metropolitana De Lisboa",-9.105174,38.780504
