"id","address","subregion","neighborhood","date","id.1","state","nature","nature_description","aerial_means","terrestrial_means","aquatic_means","operational","date.1","Concelho","Distrito","NUTII_DSG","longitude","latitude","state_2"
26258349,"Almancil","Algarve",313,"2025-11-09T10:06:00",26258349,"Em resolução/conclusão","3103","Incêndio rural",0,0,0,0,"2025-11-09T10:06:00","Loulé","Faro","Algarve",-7.981112,37.06214,"Resolução/Conclusão"
26258736,"Salvador e Santo Aleixo de Além-Tâmega","Alto Tâmega e Barroso",309,"2025-11-09T11:30:00",26258736,"Em resolução/conclusão","2407","Despiste",0,1,0,3,"2025-11-09T11:30:00","Ribeira De Pena","Vila Real","Norte",-7.787197,41.495767,"Resolução/Conclusão"
26258920,"Faro (Sé e São Pedro)","Algarve",313,"2025-11-09T12:04:00",26258920,"Em resolução/conclusão","2301","Incêndio em transporte rodoviário",0,2,0,6,"2025-11-09T12:04:00","Faro","Faro","Algarve",-7.942032,37.01865,"Resolução/Conclusão"
26258985,"Cascais e Estoril","Grande Lisboa",311,"2025-11-09T12:26:00",26258985,"Em Despacho","2407","Despiste",0,2,0,7,"2025-11-09T12:26:00","Cascais","Lisboa","Área Metropolitana De Lisboa",-9.419397,38.700982,"Despacho"
26259002,"Madalena","Area M. Porto",309,"2025-11-09T12:34:00",26259002,"Em Despacho","4331","Busca e resgate terrestre de animais",0,1,0,3,"2025-11-09T12:34:00","Vila Nova De Gaia","Porto","Norte",-8.654518,41.101651,"Despacho"
26257875,"Vila Pouca de Aguiar","Alto Tâmega e Barroso",309,"2025-11-09T08:00:00",26257875,"Em Despacho","4327","Busca e resgate terrestre de pessoas",0,1,0,2,"2025-11-09T08:00:00","Vila Pouca De Aguiar","Vila Real","Norte",-7.645977,41.499519,"Despacho"
26258959,"Coruche, Fajarda e Erra","Lezíria do Tejo",311,"2025-11-09T12:27:00",26258959,"Em Curso","2201","Incêndio em equipamentos ou produtos",0,1,0,2,"2025-11-09T12:27:00","Coruche","Santarém","Alentejo",-8.52691,38.957947,"Curso"
26258993,"Areosa","Alto Minho",309,"2025-11-09T12:28:00",26258993,"Em Despacho","2403","Colisão rodoviária",0,1,0,2,"2025-11-09T12:28:00","Viana Do Castelo","Viana Do Castelo","Norte",-8.841057,41.722906,"Despacho"
26258504,"Almancil","Algarve",313,"2025-11-09T10:30:00",26258504,"Em resolução/conclusão","3111","Queima",0,2,0,6,"2025-11-09T10:30:00","Loulé","Faro","Algarve",-7.981112,37.06214,"Resolução/Conclusão"
26258531,"Belazaima do Chão, Castanheira do Vouga e Agadão","Região de Aveiro",310,"2025-11-09T10:45:00",26258531,"Em Curso","4327","Busca e resgate terrestre de pessoas",1,3,0,7,"2025-11-09T10:45:00","Águeda","Aveiro","Centro",-8.35639,40.53833,"Curso"
26258899,"Vidago, Arcossó, Selhariz e Vilarinho Das Paranheiras","Alto Tâmega e Barroso",309,"2025-11-09T12:09:00",26258899,"Em Despacho","4331","Busca e resgate terrestre de animais",0,1,0,2,"2025-11-09T12:09:00","Chaves","Vila Real","Norte",-7.569034,41.639896,"Despacho"
26258947,"Faro (Sé e São Pedro)","Algarve",313,"2025-11-09T11:44:00",26258947,"Em Despacho","4331","Busca e resgate terrestre de animais",0,2,0,2,"2025-11-09T11:44:00","Faro","Faro","Algarve",-7.942032,37.01865,"Despacho"
26258949,"Setúbal (São Sebastião)","Península de Setúbal",311,"2025-11-09T12:18:00",26258949,"Em Despacho","4331","Busca e resgate terrestre de animais",0,1,0,3,"2025-11-09T12:18:00","Setúbal","Setúbal","Área Metropolitana De Lisboa",-8.862337,38.527365,"Despacho"
26248654,"Golegã","Lezíria do Tejo",311,"2025-11-07T09:04:00",26248654,"Em Curso","9115","Operação nacional de assistência",0,15,0,21,"2025-11-07T09:04:00","Golegã","Santarém","Alentejo",-8.472127,39.406562,"Curso"
26258471,"Nazaré","Oeste",311,"2025-11-09T10:28:00",26258471,"Em resolução/conclusão","2401","Atropelamento rodoviário",0,2,0,4,"2025-11-09T10:28:00","Nazaré","Leiria","Centro",-9.062127,39.596083,"Resolução/Conclusão"
26258514,"Vidigueira","Baixo Alentejo",312,"2025-11-09T10:29:00",26258514,"Em resolução/conclusão","2403","Colisão rodoviária",0,0,0,0,"2025-11-09T10:29:00","Vidigueira","Beja","Alentejo",-7.80008,38.21632,"Resolução/Conclusão"
26258582,"Alto do Seixalinho, Santo André e Verderena","Península de Setúbal",311,"2025-11-09T10:53:00",26258582,"Em resolução/conclusão","2101","Incêndio em edifícios habitacionais",0,5,0,18,"2025-11-09T10:53:00","Barreiro","Setúbal","Área Metropolitana De Lisboa",-9.066431,38.65441,"Resolução/Conclusão"
26258891,"Cascais e Estoril","Grande Lisboa",311,"2025-11-09T11:42:00",26258891,"Em Despacho","3317","Inundação de estruturas por água canalizada",0,1,0,3,"2025-11-09T11:42:00","Cascais","Lisboa","Área Metropolitana De Lisboa",-9.441282,38.703441,"Despacho"
26258930,"Quarteira","Algarve",313,"2025-11-09T12:21:00",26258930,"Em resolução/conclusão","2101","Incêndio em edifícios habitacionais",0,3,0,8,"2025-11-09T12:21:00","Loulé","Faro","Algarve",-8.098803,37.07267,"Resolução/Conclusão"
26258964,"Ovar, São João, Arada e São Vicente de Pereira Jusã","Região de Aveiro",310,"2025-11-09T12:20:00",26258964,"Em Despacho","4331","Busca e resgate terrestre de animais",0,1,0,5,"2025-11-09T12:20:00","Ovar","Aveiro","Centro",-8.632482,40.864029,"Despacho"
