"id","address","subregion","neighborhood","date","id.1","state","nature","nature_description","aerial_means","terrestrial_means","aquatic_means","operational","date.1","Concelho","Distrito","NUTII_DSG","longitude","latitude"
24924402,"Montenegro","Algarve",313,"2025-02-06T17:47:00",24924402,"Em conclusão","2513","Fuga de gás em conduta",0,0,0,0,"2025-02-06T17:47:00","Faro","Faro","Algarve",-7.968974,37.031305
24877003,"Malagueira e Horta Das Figueiras","Alentejo Central",312,"2025-01-27T11:41:00",24877003,"Em conclusão","3315","Inundação de estruturas por precipitação intensa",0,0,0,0,"2025-01-27T11:41:00","Évora","Évora","Alentejo",-7.924277,38.57285
24912072,"Romeira e Várzea","Lezíria do Tejo",311,"2025-02-04T01:22:00",24912072,"Em conclusão","2127","Incêndio em edifícios e recintos industriais, oficinas e armazéns",0,1,0,1,"2025-02-04T01:22:00","Santarém","Santarém","Alentejo",-8.714057,39.254832
24925702,"Águas Santas","Area M. Porto",309,"2025-02-07T01:10:00",24925702,"Em despacho","2401","Atropelamento rodoviário",0,2,0,4,"2025-02-07T01:10:00","Maia","Porto","Norte",-8.574268,41.21017
24925630,"Canidelo","Area M. Porto",309,"2025-02-07T00:20:00",24925630,"Em conclusão","2101","Incêndio em edifícios habitacionais",0,9,0,25,"2025-02-07T00:20:00","Vila Nova De Gaia","Porto","Norte",-8.660673,41.11508
24925647,"Loures","Grande Lisboa",311,"2025-02-07T00:20:00",24925647,"Em curso","3325","Dano na rede de abastecimento de gás",0,1,0,5,"2025-02-07T00:20:00","Loures","Lisboa","Área Metropolitana De Lisboa",-9.198552,38.845527
24925682,"Guarda","Beiras e Serra da Estrela",310,"2025-02-07T01:02:00",24925682,"Em despacho","3317","Inundação de estruturas por água canalizada",0,1,0,2,"2025-02-07T01:02:00","Guarda","Guarda","Centro",-7.260869,40.536751
