"id","address","subregion","neighborhood","date","id.1","state","nature","nature_description","aerial_means","terrestrial_means","aquatic_means","operational","date.1","Concelho","Distrito","NUTII_DSG","longitude","latitude"
24949270,"Algés, Linda-a-Velha e Cruz Quebrada-Dafundo","Grande Lisboa",311,"2025-02-12T10:32:00",24949270,"Em despacho","2401","Atropelamento rodoviário",0,1,0,2,"2025-02-12T10:32:00","Oeiras","Lisboa","Área Metropolitana De Lisboa",-9.250524,38.707224
24949388,"Mafamude e Vilar do Paraíso","Area M. Porto",309,"2025-02-12T11:07:00",24949388,"Em curso","2407","Despiste",0,2,0,4,"2025-02-12T11:07:00","Vila Nova De Gaia","Porto","Norte",-8.614555,41.114062
24949687,"Vila Velha de Ródão","Beira Baixa",310,"2025-02-12T12:05:00",24949687,"Em resolução","2201","Incêndio em equipamentos ou produtos",0,4,0,8,"2025-02-12T12:05:00","Vila Velha De Ródão","Castelo Branco","Centro",-7.669322,39.672493
24949755,"Oliveirinha","Região de Aveiro",310,"2025-02-12T12:19:00",24949755,"Em despacho","2403","Colisão rodoviária",0,2,0,6,"2025-02-12T12:19:00","Aveiro","Aveiro","Centro",-8.595116,40.607545
24949029,"Vilar do Torno e Alentém","Tâmega e Sousa",309,"2025-02-12T09:50:00",24949029,"Em conclusão","2101","Incêndio em edifícios habitacionais",0,0,0,0,"2025-02-12T09:50:00","Lousada","Porto","Norte",-8.220539,41.282379
24949130,"Coruche, Fajarda e Erra","Lezíria do Tejo",311,"2025-02-12T10:23:00",24949130,"Em conclusão","2403","Colisão rodoviária",0,4,0,8,"2025-02-12T10:23:00","Coruche","Santarém","Alentejo",-8.554513,38.952667
24949147,"São Domingos de Rana","Grande Lisboa",311,"2025-02-12T10:17:00",24949147,"Em conclusão","2301","Incêndio em transporte rodoviário",0,1,0,5,"2025-02-12T10:17:00","Cascais","Lisboa","Área Metropolitana De Lisboa",-9.347651,38.740483
24949395,"Alenquer (Santo Estêvão e Triana)","Oeste",311,"2025-02-12T11:10:00",24949395,"Em despacho","4339","Corte ou remoção de elementos",0,3,0,7,"2025-02-12T11:10:00","Alenquer","Lisboa","Centro",-9.007918,39.054242
24949682,"Sado","Península de Setúbal",311,"2025-02-12T12:06:00",24949682,"Em despacho","2403","Colisão rodoviária",0,3,0,9,"2025-02-12T12:06:00","Setúbal","Setúbal","Área Metropolitana De Lisboa",-8.800255,38.499873
24949746,"Fragosela","Viseu Dão Lafões",310,"2025-02-12T12:21:00",24949746,"Em despacho","2403","Colisão rodoviária",0,2,0,6,"2025-02-12T12:21:00","Viseu","Viseu","Centro",-7.869531,40.63339
24949765,"Abraveses","Viseu Dão Lafões",310,"2025-02-12T12:28:00",24949765,"Em despacho","2101","Incêndio em edifícios habitacionais",0,0,0,0,"2025-02-12T12:28:00","Viseu","Viseu","Centro",-7.93291,40.69345
24949779,"Pombal","Região de Leiria",310,"2025-02-12T12:23:00",24949779,"Em despacho","2101","Incêndio em edifícios habitacionais",0,1,0,5,"2025-02-12T12:23:00","Pombal","Leiria","Centro",-8.689791,39.91009
24949780,"S.julião, N.s. da Anunciada e S. Maria da Graça","Península de Setúbal",311,"2025-02-12T12:24:00",24949780,"Em despacho","3317","Inundação de estruturas por água canalizada",0,2,0,9,"2025-02-12T12:24:00","Setúbal","Setúbal","Área Metropolitana De Lisboa",-8.926392,38.520139
24877003,"Malagueira e Horta Das Figueiras","Alentejo Central",312,"2025-01-27T11:41:00",24877003,"Em conclusão","3315","Inundação de estruturas por precipitação intensa",0,0,0,0,"2025-01-27T11:41:00","Évora","Évora","Alentejo",-7.924277,38.57285
24949628,"Moscavide e Portela","Grande Lisboa",311,"2025-02-12T11:45:00",24949628,"Em conclusão","2403","Colisão rodoviária",0,5,0,12,"2025-02-12T11:45:00","Loures","Lisboa","Área Metropolitana De Lisboa",-9.114803,38.78591
24949792,"Ramada e Caneças","Grande Lisboa",311,"2025-02-12T12:20:00",24949792,"Em curso","3317","Inundação de estruturas por água canalizada",0,0,0,0,"2025-02-12T12:20:00","Odivelas","Lisboa","Área Metropolitana De Lisboa",-9.194441,38.801427
24949000,"Ramada e Caneças","Grande Lisboa",311,"2025-02-12T09:57:00",24949000,"Em despacho","3301","Queda de árvore",0,1,0,2,"2025-02-12T09:57:00","Odivelas","Lisboa","Área Metropolitana De Lisboa",-9.224517,38.811058
24949234,"Fátima","Médio Tejo",311,"2025-02-12T10:42:00",24949234,"Em conclusão","2517","Fuga de gás em reservatório",0,0,0,0,"2025-02-12T10:42:00","Ourém","Santarém","Centro",-8.670447,39.628235
24949368,"Santa Joana","Região de Aveiro",310,"2025-02-12T11:03:00",24949368,"Em conclusão","4339","Corte ou remoção de elementos",0,1,0,3,"2025-02-12T11:03:00","Aveiro","Aveiro","Centro",-8.616608,40.631861
24949559,"Odivelas","Grande Lisboa",311,"2025-02-12T11:35:00",24949559,"Em conclusão","2401","Atropelamento rodoviário",0,1,0,2,"2025-02-12T11:35:00","Odivelas","Lisboa","Área Metropolitana De Lisboa",-9.186546,38.798008
24949618,"Laranjeiro e Feijó","Península de Setúbal",311,"2025-02-12T11:50:00",24949618,"Em despacho","3301","Queda de árvore",0,1,0,3,"2025-02-12T11:50:00","Almada","Setúbal","Área Metropolitana De Lisboa",-9.156624,38.652235
24949725,"Camarate, Unhos e Apelação","Grande Lisboa",311,"2025-02-12T12:06:00",24949725,"Em despacho","2401","Atropelamento rodoviário",0,1,0,2,"2025-02-12T12:06:00","Loures","Lisboa","Área Metropolitana De Lisboa",-9.144887,38.797363
