"id","address","subregion","neighborhood","date","id.1","state","nature","nature_description","aerial_means","terrestrial_means","aquatic_means","operational","date.1","Concelho","Distrito","NUTII_DSG","longitude","latitude"
24925682,"Guarda","Beiras e Serra da Estrela",310,"2025-02-07T01:02:00",24925682,"Em despacho","3317","Inundação de estruturas por água canalizada",0,1,0,2,"2025-02-07T01:02:00","Guarda","Guarda","Centro",-7.260869,40.536751
24925898,"Lama","Cávado",309,"2025-02-07T05:20:00",24925898,"Em despacho","2407","Despiste",0,1,0,2,"2025-02-07T05:20:00","Barcelos","Braga","Norte",-8.542968,41.56928
24925909,"Quarteira","Algarve",313,"2025-02-07T05:36:00",24925909,"Em conclusão","2127","Incêndio em edifícios e recintos industriais, oficinas e armazéns",0,4,0,12,"2025-02-07T05:36:00","Loulé","Faro","Algarve",-8.1072,37.074665
24877003,"Malagueira e Horta Das Figueiras","Alentejo Central",312,"2025-01-27T11:41:00",24877003,"Em conclusão","3315","Inundação de estruturas por precipitação intensa",0,0,0,0,"2025-01-27T11:41:00","Évora","Évora","Alentejo",-7.924277,38.57285
24912072,"Romeira e Várzea","Lezíria do Tejo",311,"2025-02-04T01:22:00",24912072,"Em conclusão","2127","Incêndio em edifícios e recintos industriais, oficinas e armazéns",0,1,0,1,"2025-02-04T01:22:00","Santarém","Santarém","Alentejo",-8.714057,39.254832
