"id","address","subregion","neighborhood","date","id.1","state","nature","nature_description","aerial_means","terrestrial_means","aquatic_means","operational","date.1","Concelho","Distrito","NUTII_DSG","longitude","latitude"
25071496,"São Manços e São Vicente do Pigeiro","Alentejo Central",312,"2025-03-11T13:18:00",25071496,"Em conclusão","1101","Cheia",0,0,0,0,"2025-03-11T13:18:00","Évora","Évora","Alentejo",-7.713313,38.513673
25318424,"Nossa Senhora da Graça Dos Degolados","Alto Alentejo",312,"2025-05-02T13:10:00",25318424,"Em conclusão","1103","Vento forte",0,0,0,0,"2025-05-02T13:10:00","Campo Maior","Portalegre","Alentejo",-7.12147,39.062622
25328219,"Matosinhos e Leça da Palmeira","Area M. Porto",309,"2025-05-04T17:30:00",25328219,"Em conclusão","2129","Incêndio em edifícios degradados ou devolutos",0,3,0,8,"2025-05-04T17:30:00","Matosinhos","Porto","Norte",-8.68898,41.17906
25328251,"S.maria, S.miguel, S.martinho, S.pedro Penaferrim","Grande Lisboa",311,"2025-05-04T17:34:00",25328251,"Em conclusão","2407","Despiste",0,5,0,12,"2025-05-04T17:34:00","Sintra","Lisboa","Área Metropolitana De Lisboa",-9.393304,38.794377
25328818,"Santa Marinha e São Pedro da Afurada","Area M. Porto",309,"2025-05-04T20:27:00",25328818,"Em despacho","4331","Busca e resgate terrestre de animais",0,1,0,3,"2025-05-04T20:27:00","Vila Nova De Gaia","Porto","Norte",-8.624714,41.132843
25328836,"Glória e Vera Cruz","Região de Aveiro",310,"2025-05-04T20:43:00",25328836,"Em despacho","3321","Dano na rede de fornecimento de eletricidade ",0,0,0,0,"2025-05-04T20:43:00","Aveiro","Aveiro","Centro",-8.65353,40.64063
25328471,"São Cipriano e Vil de Souto","Viseu Dão Lafões",310,"2025-05-04T18:40:00",25328471,"Em resolução","2407","Despiste",0,4,0,8,"2025-05-04T18:40:00","Viseu","Viseu","Centro",-7.968183,40.678915
25328689,"Esgueira","Região de Aveiro",310,"2025-05-04T19:50:00",25328689,"Em conclusão","2407","Despiste",0,3,0,9,"2025-05-04T19:50:00","Aveiro","Aveiro","Centro",-8.594631,40.651158
25327724,"Freixo de Numão","Douro",309,"2025-05-04T15:18:00",25327724,"Em conclusão","4327","Busca e resgate terrestre de pessoas",0,5,0,13,"2025-05-04T15:18:00","Vila Nova De Foz Côa","Guarda","Norte",-7.222853,41.058725
25328678,"Cerva e Limões","Alto Tâmega e Barroso",309,"2025-05-04T19:49:00",25328678,"Em resolução","2403","Colisão rodoviária",0,1,0,2,"2025-05-04T19:49:00","Ribeira De Pena","Vila Real","Norte",-7.809228,41.468608
25316776,"Guarda","Beiras e Serra da Estrela",310,"2025-05-02T07:17:00",25316776,"Em conclusão","3311","Queda de elementos de estruturas edificados",0,0,0,0,"2025-05-02T07:17:00","Guarda","Guarda","Centro",-7.269039,40.539292
25328656,"Braga (São José de São Lázaro e São João do Souto)","Cávado",309,"2025-05-04T19:39:00",25328656,"Em conclusão","2101","Incêndio em edifícios habitacionais",0,2,0,8,"2025-05-04T19:39:00","Braga","Braga","Norte",-8.426487,41.542717
25328731,"Benfica do Ribatejo","Lezíria do Tejo",311,"2025-05-04T20:10:00",25328731,"Em resolução","2403","Colisão rodoviária",0,7,0,22,"2025-05-04T20:10:00","Almeirim","Santarém","Alentejo",-8.698283,39.13523
25328790,"Mafamude e Vilar do Paraíso","Area M. Porto",309,"2025-05-04T20:30:00",25328790,"Em curso","3203","Detritos confinados",0,1,0,5,"2025-05-04T20:30:00","Vila Nova De Gaia","Porto","Norte",-8.599569,41.10446
25328797,"Barcelos, V. Boa e V. Frescainha","Cávado",309,"2025-05-04T20:20:00",25328797,"Em despacho","3315","Inundação de estruturas por precipitação intensa",0,1,0,2,"2025-05-04T20:20:00","Barcelos","Braga","Norte",-8.631632,41.537528
25328842,"Moldes","Area M. Porto",309,"2025-05-04T20:05:00",25328842,"Em despacho","3301","Queda de árvore",0,1,0,2,"2025-05-04T20:05:00","Arouca","Aveiro","Norte",-8.252975,40.891166
