"id","address","subregion","neighborhood","date","id.1","state","nature","nature_description","aerial_means","terrestrial_means","aquatic_means","operational","date.1","Concelho","Distrito","NUTII_DSG","longitude","latitude"
24645944,"Oeiras e S. Julião da Barra, Paço de Arcos e Caxias","Grande Lisboa",311,"2024-12-07T02:29:00",24645944,"Em despacho","3317","Inundação de estruturas por água canalizada",0,1,0,4,"2024-12-07T02:29:00","Oeiras","Lisboa","Área Metropolitana De Lisboa",-9.31292,38.69334
24645969,"Agualva e Mira-Sintra","Grande Lisboa",311,"2024-12-07T02:49:00",24645969,"Em despacho","2407","Despiste",0,0,0,0,"2024-12-07T02:49:00","Sintra","Lisboa","Área Metropolitana De Lisboa",-9.297451,38.765315
24645830,"São Mamede de Infesta e Senhora da Hora","Area M. Porto",309,"2024-12-07T00:47:00",24645830,"Em conclusão","2403","Colisão rodoviária",0,4,0,12,"2024-12-07T00:47:00","Matosinhos","Porto","Norte",-8.597035,41.187935
24645848,"Estremoz (Santa Maria e Santo André)","Alentejo Central",312,"2024-12-07T01:10:00",24645848,"Em conclusão","2101","Incêndio em edifícios habitacionais",0,5,0,9,"2024-12-07T01:10:00","Estremoz","Évora","Alentejo",-7.596295,38.84285
24645914,"Lustosa e Barrosas (Santo Estêvão)","Tâmega e Sousa",309,"2024-12-07T02:06:00",24645914,"Em resolução","2127","Incêndio em edifícios e recintos industriais, oficinas e armazéns",0,2,0,6,"2024-12-07T02:06:00","Lousada","Porto","Norte",-8.294208,41.316165
24645950,"Graça","Região de Leiria",310,"2024-12-07T02:16:00",24645950,"Em despacho","2407","Despiste",0,2,0,4,"2024-12-07T02:16:00","Pedrógão Grande","Leiria","Centro",-8.218503,39.924909
24645922,"Santa Eulália","Alto Alentejo",312,"2024-12-07T02:01:00",24645922,"Em resolução","2407","Despiste",0,5,0,12,"2024-12-07T02:01:00","Elvas","Portalegre","Alentejo",-7.260828,39.004127
24645923,"Pontinha e Famões","Grande Lisboa",311,"2024-12-07T02:14:00",24645923,"Em resolução","2403","Colisão rodoviária",0,2,0,6,"2024-12-07T02:14:00","Odivelas","Lisboa","Área Metropolitana De Lisboa",-9.19822,38.76948
