"id","address","subregion","neighborhood","date","id.1","state","nature","nature_description","aerial_means","terrestrial_means","aquatic_means","operational","date.1","Concelho","Distrito","NUTII_DSG","longitude","latitude"
25071496,"São Manços e São Vicente do Pigeiro","Alentejo Central",312,"2025-03-11T13:18:00",25071496,"Em conclusão","1101","Cheia",0,0,0,0,"2025-03-11T13:18:00","Évora","Évora","Alentejo",-7.713313,38.513673
25495190,"Peva e Segões","Douro",309,"2025-06-08T11:17:00",25495190,"Em curso","2127","Incêndio em edifícios e recintos industriais, oficinas e armazéns",0,2,0,7,"2025-06-08T11:17:00","Moimenta Da Beira","Viseu","Norte",-7.69063,40.890053
25497898,"Cascais e Estoril","Grande Lisboa",311,"2025-06-08T22:55:00",25497898,"Em conclusão","3317","Inundação de estruturas por água canalizada",0,2,0,7,"2025-06-08T22:55:00","Cascais","Lisboa","Área Metropolitana De Lisboa",-9.419397,38.700982
25497933,"Paredes de Coura e Resende","Alto Minho",309,"2025-06-08T23:15:00",25497933,"Em resolução","2407","Despiste",0,3,0,5,"2025-06-08T23:15:00","Paredes De Coura","Viana Do Castelo","Norte",-8.554663,41.904485
25498066,"Pedroso e Seixezelo","Area M. Porto",309,"2025-06-09T00:08:00",25498066,"Em conclusão","2127","Incêndio em edifícios e recintos industriais, oficinas e armazéns",0,8,0,24,"2025-06-09T00:08:00","Vila Nova De Gaia","Porto","Norte",-8.538487,41.08813
25498100,"Nossa Senhora da Conceição, São Pedro e São Dinis","Douro",309,"2025-06-09T00:26:00",25498100,"Em despacho","2201","Incêndio em equipamentos ou produtos",0,0,0,0,"2025-06-09T00:26:00","Vila Real","Vila Real","Norte",-7.74004,41.30786
25498118,"Paredes","Area M. Porto",309,"2025-06-09T00:07:00",25498118,"Em despacho","2301","Incêndio em transporte rodoviário",0,1,0,5,"2025-06-09T00:07:00","Paredes","Porto","Norte",-8.32628,41.205322
25498086,"Castelo Branco","Beira Baixa",310,"2025-06-09T00:12:00",25498086,"Em curso","2101","Incêndio em edifícios habitacionais",0,2,0,7,"2025-06-09T00:12:00","Castelo Branco","Castelo Branco","Centro",-7.490756,39.816895
25498088,"São Domingos e Vale de Água","Alentejo Litoral",312,"2025-06-09T00:08:00",25498088,"Em curso","2407","Despiste",0,2,0,4,"2025-06-09T00:08:00","Santiago Do Cacém","Setúbal","Alentejo",-8.558056,37.894422
25496651,"São Salvador e Santa Maria","Alentejo Litoral",312,"2025-06-08T16:57:00",25496651,"Em conclusão","4329","Busca e resgate aquático de pessoas",0,7,0,12,"2025-06-08T16:57:00","Odemira","Beja","Alentejo",-8.64102,37.5976
25497326,"Maceira","Região de Leiria",310,"2025-06-08T19:53:00",25497326,"Em despacho","4331","Busca e resgate terrestre de animais",0,1,0,2,"2025-06-08T19:53:00","Leiria","Leiria","Centro",-8.889652,39.686501
25497953,"Pedroso e Seixezelo","Area M. Porto",309,"2025-06-08T23:15:00",25497953,"Em despacho","4331","Busca e resgate terrestre de animais",0,1,0,2,"2025-06-08T23:15:00","Vila Nova De Gaia","Porto","Norte",-8.55728,41.067659
25498012,"Ribeira do Neiva","Cávado",309,"2025-06-08T23:48:00",25498012,"Em despacho","3103","Incêndio rural",0,4,0,17,"2025-06-08T23:48:00","Vila Verde","Braga","Norte",-8.504574,41.670266
25497774,"Carreira e Refojos de Riba de Ave","Area M. Porto",309,"2025-06-08T22:19:00",25497774,"Em curso","2407","Despiste",0,0,0,0,"2025-06-08T22:19:00","Santo Tirso","Porto","Norte",-8.453274,41.296516
25498041,"Bodiosa","Viseu Dão Lafões",310,"2025-06-08T23:55:00",25498041,"Em resolução","3111","Queima",0,1,0,3,"2025-06-08T23:55:00","Viseu","Viseu","Centro",-7.995132,40.720737
25498077,"Faro (Sé e São Pedro)","Algarve",313,"2025-06-09T00:16:00",25498077,"Em curso","3203","Detritos confinados",0,3,0,6,"2025-06-09T00:16:00","Faro","Faro","Algarve",-7.9324,37.0122
25498091,"Alto do Seixalinho, Santo André e Verderena","Península de Setúbal",311,"2025-06-09T00:11:00",25498091,"Em despacho","4331","Busca e resgate terrestre de animais",0,1,0,5,"2025-06-09T00:11:00","Barreiro","Setúbal","Área Metropolitana De Lisboa",-9.065968,38.6593
