"id","address","subregion","neighborhood","date","id.1","state","nature","nature_description","aerial_means","terrestrial_means","aquatic_means","operational","date.1","Concelho","Distrito","NUTII_DSG","longitude","latitude"
25269310,"Charneca de Caparica e Sobreda","Península de Setúbal",311,"2025-04-21T21:09:00",25269310,"Em conclusão","2513","Fuga de gás em conduta",0,5,0,14,"2025-04-21T21:09:00","Almada","Setúbal","Área Metropolitana De Lisboa",-9.206824,38.629265
25269428,"Alverca do Ribatejo e Sobralinho","Grande Lisboa",311,"2025-04-21T21:53:00",25269428,"Em conclusão","2407","Despiste",0,1,0,2,"2025-04-21T21:53:00","Vila Franca De Xira","Lisboa","Área Metropolitana De Lisboa",-9.046012,38.896362
25269553,"Aguiar de Sousa","Area M. Porto",309,"2025-04-21T22:38:00",25269553,"Em curso","2407","Despiste",0,3,0,10,"2025-04-21T22:38:00","Paredes","Porto","Norte",-8.454193,41.13256
25269402,"Corroios","Península de Setúbal",311,"2025-04-21T21:45:00",25269402,"Em conclusão","2101","Incêndio em edifícios habitacionais",0,1,0,2,"2025-04-21T21:45:00","Seixal","Setúbal","Área Metropolitana De Lisboa",-9.15341,38.6348
25269568,"Póvoa de Santo Adrião e Olival Basto","Grande Lisboa",311,"2025-04-21T22:53:00",25269568,"Em curso","3325","Dano na rede de abastecimento de gás",0,4,0,9,"2025-04-21T22:53:00","Odivelas","Lisboa","Área Metropolitana De Lisboa",-9.16355,38.79777
25269613,"Porto Covo","Alentejo Litoral",312,"2025-04-21T23:04:00",25269613,"Em resolução","2407","Despiste",0,4,0,10,"2025-04-21T23:04:00","Sines","Setúbal","Alentejo",-8.727483,37.87145
25269627,"São João de Ver","Area M. Porto",309,"2025-04-21T23:21:00",25269627,"Em curso","2403","Colisão rodoviária",0,4,0,10,"2025-04-21T23:21:00","Santa Maria Da Feira","Aveiro","Norte",-8.563113,40.96617
25269467,"Santa Bárbara de Nexe","Algarve",313,"2025-04-21T22:09:00",25269467,"Em conclusão","2101","Incêndio em edifícios habitacionais",0,5,0,12,"2025-04-21T22:09:00","Faro","Faro","Algarve",-7.974444,37.103397
25269499,"Melides","Alentejo Litoral",312,"2025-04-21T22:24:00",25269499,"Em curso","2101","Incêndio em edifícios habitacionais",0,7,0,15,"2025-04-21T22:24:00","Grândola","Setúbal","Alentejo",-8.637972,38.191213
25269564,"Canelas","Area M. Porto",309,"2025-04-21T22:46:00",25269564,"Em despacho","4331","Busca e resgate terrestre de animais",0,1,0,2,"2025-04-21T22:46:00","Vila Nova De Gaia","Porto","Norte",-8.600638,41.079331
25269665,"Paranhos","Area M. Porto",309,"2025-04-21T23:37:00",25269665,"Em despacho","2515","Fuga de gás em garrafa",0,0,0,0,"2025-04-21T23:37:00","Porto","Porto","Norte",-8.62058,41.16795
25071496,"São Manços e São Vicente do Pigeiro","Alentejo Central",312,"2025-03-11T13:18:00",25071496,"Em conclusão","1101","Cheia",0,0,0,0,"2025-03-11T13:18:00","Évora","Évora","Alentejo",-7.713313,38.513673
25202441,"Serpa (Salvador e Santa Maria)","Baixo Alentejo",312,"2025-04-06T10:25:00",25202441,"Em conclusão","1101","Cheia",0,0,0,0,"2025-04-06T10:25:00","Serpa","Beja","Alentejo",-7.555783,37.88592
25269541,"Liceia","Região de Coimbra",310,"2025-04-21T22:42:00",25269541,"Em conclusão","2101","Incêndio em edifícios habitacionais",0,2,0,7,"2025-04-21T22:42:00","Montemor-o-Velho","Coimbra","Centro",-8.72463,40.26784
25269557,"Cascais e Estoril","Grande Lisboa",311,"2025-04-21T22:48:00",25269557,"Em resolução","2101","Incêndio em edifícios habitacionais",0,4,0,11,"2025-04-21T22:48:00","Cascais","Lisboa","Área Metropolitana De Lisboa",-9.42544,38.70707
