"id","address","subregion","neighborhood","date","id.1","state","nature","nature_description","aerial_means","terrestrial_means","aquatic_means","operational","date.1","Concelho","Distrito","NUTII_DSG","longitude","latitude"
24570896,"Tentúgal","Região de Coimbra",310,"2024-11-20T04:58:00",24570896,"Em despacho","2407","Despiste",0,3,0,6,"2024-11-20T04:58:00","Montemor-o-Velho","Coimbra","Centro",-8.595527,40.233804
24569858,"Setúbal (São Sebastião)","Península de Setúbal",311,"2024-11-19T19:02:00",24569858,"Em curso","2509","Acidente químico em trânsito",0,3,0,4,"2024-11-19T19:02:00","Setúbal","Setúbal","Área Metropolitana De Lisboa",-8.868915,38.55563
24570910,"Quinta do Anjo","Península de Setúbal",311,"2024-11-20T05:16:00",24570910,"Em resolução","2101","Incêndio em edifícios habitacionais",0,4,0,8,"2024-11-20T05:16:00","Palmela","Setúbal","Área Metropolitana De Lisboa",-8.94798,38.56737
24360487,"Mões","Viseu Dão Lafões",310,"2024-10-03T08:00:00",24360487,"Em curso","4339","Corte ou remoção de elementos",0,0,0,0,"2024-10-03T08:00:00","Castro Daire","Viseu","Centro",-7.893519,40.867571
24523090,"Carnaxide e Queijas","Grande Lisboa",311,"2024-11-08T18:49:00",24523090,"Em curso","9119","Missão internacional de assistência",0,47,0,102,"2024-11-08T18:49:00","Oeiras","Lisboa","Área Metropolitana De Lisboa",-9.243421,38.725234
24570890,"Algés, Linda-a-Velha e Cruz Quebrada-Dafundo","Grande Lisboa",311,"2024-11-20T04:53:00",24570890,"Em despacho","3323","Dano na rede de abastecimento de água",0,1,0,3,"2024-11-20T04:53:00","Oeiras","Lisboa","Área Metropolitana De Lisboa",-9.24227414640936,38.7081610512437
