"id","address","subregion","neighborhood","date","id.1","state","nature","nature_description","aerial_means","terrestrial_means","aquatic_means","operational","date.1","Concelho","Distrito","NUTII_DSG","longitude","latitude"
24360487,"Mões","Viseu Dão Lafões",310,"2024-10-03T08:00:00",24360487,"Em curso","4339","Corte ou remoção de elementos",0,1,0,1,"2024-10-03T08:00:00","Castro Daire","Viseu","Centro",-7.893519,40.867571
24451451,"Sul","Viseu Dão Lafões",310,"2024-10-23T08:10:00",24451451,"Em curso","4339","Corte ou remoção de elementos",0,2,0,4,"2024-10-23T08:10:00","São Pedro Do Sul","Viseu","Centro",-8.050962,40.841282
24456058,"Vila Marim","Douro",309,"2024-10-24T08:30:00",24456058,"Em despacho","3301","Queda de árvore",0,1,0,1,"2024-10-24T08:30:00","Vila Real","Vila Real","Norte",-7.764204,41.298542
24456899,"Sebadelhe","Douro",309,"2024-10-24T11:18:00",24456899,"Em despacho","4331","Busca e resgate terrestre de animais",0,1,0,2,"2024-10-24T11:18:00","Vila Nova De Foz Côa","Guarda","Norte",-7.272825,41.055971
24457194,"Atalaia e Alto-Estanqueiro-Jardia","Península de Setúbal",311,"2024-10-24T12:23:00",24457194,"Em conclusão","2301","Incêndio em transporte rodoviário",0,0,0,0,"2024-10-24T12:23:00","Montijo","Setúbal","Área Metropolitana De Lisboa",-8.939915,38.68213
24458462,"Alcabideche","Grande Lisboa",311,"2024-10-24T16:56:00",24458462,"Em conclusão","3201","Detritos não confinados",0,1,0,4,"2024-10-24T16:56:00","Cascais","Lisboa","Área Metropolitana De Lisboa",-9.385597,38.740082
24458564,"Seixas","Alto Minho",309,"2024-10-24T17:20:00",24458564,"Em resolução","2403","Colisão rodoviária",0,2,0,4,"2024-10-24T17:20:00","Caminha","Viana Do Castelo","Norte",-8.81663,41.898983
24458691,"Lagoa e Carvoeiro","Algarve",313,"2024-10-24T17:59:00",24458691,"Em curso","2301","Incêndio em transporte rodoviário",0,2,0,6,"2024-10-24T17:59:00","Lagoa","Faro","Algarve",-8.449309,37.134614
24458696,"Marinhais","Lezíria do Tejo",311,"2024-10-24T18:00:00",24458696,"Em conclusão","4331","Busca e resgate terrestre de animais",0,1,0,5,"2024-10-24T18:00:00","Salvaterra De Magos","Santarém","Alentejo",-8.729912,39.05841
24458723,"São Domingos de Rana","Grande Lisboa",311,"2024-10-24T18:03:00",24458723,"Em resolução","2407","Despiste",0,3,0,6,"2024-10-24T18:03:00","Cascais","Lisboa","Área Metropolitana De Lisboa",-9.356312,38.708866
24458746,"Braga (São Vicente)","Cávado",309,"2024-10-24T18:12:00",24458746,"Em despacho","2115","Incêndio em edifícios hoteleiros e de restauração",0,1,0,6,"2024-10-24T18:12:00","Braga","Braga","Norte",-8.426045,41.55542
24458065,"Manteigas (São Pedro)","Beiras e Serra da Estrela",310,"2024-10-24T15:25:00",24458065,"Em despacho","4327","Busca e resgate terrestre de pessoas",0,2,0,4,"2024-10-24T15:25:00","Manteigas","Guarda","Centro",-7.55491,40.381901
24458634,"Castêlo da Maia","Area M. Porto",309,"2024-10-24T17:40:00",24458634,"Em despacho","3323","Dano na rede de abastecimento de água",0,0,0,0,"2024-10-24T17:40:00","Maia","Porto","Norte",-8.62282,41.27952
24458652,"Alto do Seixalinho, Santo André e Verderena","Península de Setúbal",311,"2024-10-24T17:47:00",24458652,"Em conclusão","2407","Despiste",0,3,0,9,"2024-10-24T17:47:00","Barreiro","Setúbal","Área Metropolitana De Lisboa",-9.05702,38.63854
24458684,"Santa Marinha e São Pedro da Afurada","Area M. Porto",309,"2024-10-24T17:52:00",24458684,"Em despacho","3311","Queda de elementos de estruturas edificados",0,1,0,3,"2024-10-24T17:52:00","Vila Nova De Gaia","Porto","Norte",-8.624714,41.132843
24457947,"Beja (Santiago Maior e São João Baptista)","Baixo Alentejo",312,"2024-10-24T14:53:00",24457947,"Em conclusão","3105","Incêndio rural",0,4,0,8,"2024-10-24T14:53:00","Beja","Beja","Alentejo",-7.912483,37.99043
24458186,"Pombal","Região de Leiria",310,"2024-10-24T15:55:00",24458186,"Em conclusão","2101","Incêndio em edifícios habitacionais",0,4,0,10,"2024-10-24T15:55:00","Pombal","Leiria","Centro",-8.647826,39.928296
24458654,"Glória e Vera Cruz","Região de Aveiro",310,"2024-10-24T17:45:00",24458654,"Em resolução","3301","Queda de árvore",0,1,0,2,"2024-10-24T17:45:00","Aveiro","Aveiro","Centro",-8.647359,40.640643
24458665,"S.julião, N.s. da Anunciada e S. Maria da Graça","Península de Setúbal",311,"2024-10-24T17:54:00",24458665,"Em despacho","3323","Dano na rede de abastecimento de água",0,1,0,5,"2024-10-24T17:54:00","Setúbal","Setúbal","Área Metropolitana De Lisboa",-8.89287,38.53315
24458699,"Braga (Maximinos, Sé e Cividade)","Cávado",309,"2024-10-24T17:59:00",24458699,"Em curso","2407","Despiste",0,1,0,2,"2024-10-24T17:59:00","Braga","Braga","Norte",-8.435962,41.546004
24458729,"Salto","Alto Tâmega e Barroso",309,"2024-10-24T18:05:00",24458729,"Em despacho","4331","Busca e resgate terrestre de animais",0,1,0,5,"2024-10-24T18:05:00","Montalegre","Vila Real","Norte",-7.993874,41.659198
24458190,"Lagos (São Sebastião e Santa Maria)","Algarve",313,"2024-10-24T15:44:00",24458190,"Em resolução","2403","Colisão rodoviária",0,2,0,4,"2024-10-24T15:44:00","Lagos","Faro","Algarve",-8.668524,37.100485
24458327,"Celeirós, Aveleda e Vimieiro","Cávado",309,"2024-10-24T16:29:00",24458327,"Em conclusão","2407","Despiste",0,5,0,14,"2024-10-24T16:29:00","Braga","Braga","Norte",-8.443668,41.516203
24458461,"Vila Franca de Xira","Grande Lisboa",311,"2024-10-24T16:54:00",24458461,"Em resolução","2403","Colisão rodoviária",0,7,0,18,"2024-10-24T16:54:00","Vila Franca De Xira","Lisboa","Área Metropolitana De Lisboa",-8.946883,38.942752
24458491,"Oliveira do Douro","Area M. Porto",309,"2024-10-24T17:01:00",24458491,"Em despacho","3301","Queda de árvore",0,1,0,3,"2024-10-24T17:01:00","Vila Nova De Gaia","Porto","Norte",-8.585272,41.125484
24458528,"S.julião, N.s. da Anunciada e S. Maria da Graça","Península de Setúbal",311,"2024-10-24T17:08:00",24458528,"Em curso","2407","Despiste",0,3,0,8,"2024-10-24T17:08:00","Setúbal","Setúbal","Área Metropolitana De Lisboa",-8.889983,38.529955
24458726,"Arca e Ponte de Lima","Alto Minho",309,"2024-10-24T18:07:00",24458726,"Em curso","3315","Inundação de estruturas por precipitação intensa",0,1,0,3,"2024-10-24T18:07:00","Ponte De Lima","Viana Do Castelo","Norte",-8.579772,41.763292
24458727,"Rabaçal","Beiras e Serra da Estrela",310,"2024-10-24T18:08:00",24458727,"Em despacho","3103","Incêndio rural",0,1,0,5,"2024-10-24T18:08:00","Mêda","Guarda","Centro",-7.255533,40.854583
