"id","address","subregion","neighborhood","date","id.1","state","nature","nature_description","aerial_means","terrestrial_means","aquatic_means","operational","date.1","Concelho","Distrito","NUTII_DSG","longitude","latitude"
24788571,"Faro (Sé e São Pedro)","Algarve",313,"2025-01-07T22:20:00",24788571,"Em curso","4331","Busca e resgate terrestre de animais",0,1,0,5,"2025-01-07T22:20:00","Faro","Faro","Algarve",-7.949859,37.034881
24782982,"Almada, Cova da Piedade, Pragal e Cacilhas","Península de Setúbal",311,"2025-01-06T17:08:00",24782982,"Em conclusão","2425","Abalroamento aquático",0,0,0,0,"2025-01-06T17:08:00","Almada","Setúbal","Área Metropolitana De Lisboa",-9.164498,38.675268
24788314,"Paramos","Area M. Porto",309,"2025-01-07T20:39:00",24788314,"Em resolução","2101","Incêndio em edifícios habitacionais",0,13,0,32,"2025-01-07T20:39:00","Espinho","Aveiro","Norte",-8.62622,40.97143
24788429,"Gavião","Ave",309,"2025-01-07T21:14:00",24788429,"Em conclusão","2403","Colisão rodoviária",0,5,0,12,"2025-01-07T21:14:00","Vila Nova De Famalicão","Braga","Norte",-8.508307,41.43319
24780664,"Póvoa de Varzim, Beiriz e Argivai","Area M. Porto",309,"2025-01-06T10:06:00",24780664,"Em conclusão","4329","Busca e resgate aquático de pessoas",0,0,0,0,"2025-01-06T10:06:00","Póvoa De Varzim","Porto","Norte",-8.76679,41.37906
24788634,"Cedofeita, Ildefonso, Sé, Miragaia, Nicolau e Vitória","Area M. Porto",309,"2025-01-07T22:39:00",24788634,"Em despacho","4339","Corte ou remoção de elementos",0,1,0,5,"2025-01-07T22:39:00","Porto","Porto","Norte",-8.615939,41.15359
24777071,"Pedrógão Grande","Região de Leiria",310,"2025-01-05T13:18:00",24777071,"Em conclusão","3309","Desabamento de estruturas edificadas",0,1,0,1,"2025-01-05T13:18:00","Pedrógão Grande","Leiria","Centro",-8.177567,39.933038
24787522,"Côja e Barril de Alva","Região de Coimbra",310,"2025-01-07T17:10:00",24787522,"Em conclusão","2407","Despiste",0,2,0,4,"2025-01-07T17:10:00","Arganil","Coimbra","Centro",-7.994385,40.270689
24788592,"Porto Salvo","Grande Lisboa",311,"2025-01-07T22:25:00",24788592,"Em conclusão","3325","Dano na rede de abastecimento de gás",0,1,0,5,"2025-01-07T22:25:00","Oeiras","Lisboa","Área Metropolitana De Lisboa",-9.305901,38.719291
