"id","address","subregion","neighborhood","date","id.1","state","nature","nature_description","aerial_means","terrestrial_means","aquatic_means","operational","date.1","Concelho","Distrito","NUTII_DSG","longitude","latitude"
24851780,"São Miguel, Santa Eufémia e Rabaçal","Região de Coimbra",310,"2025-01-21T23:25:00",24851780,"Em curso","3315","Inundação de estruturas por precipitação intensa",0,0,0,0,"2025-01-21T23:25:00","Penela","Coimbra","Centro",-8.399036,40.025502
24907754,"Castelo Bom","Beiras e Serra da Estrela",310,"2025-02-03T05:55:00",24907754,"Em resolução","2407","Despiste",0,2,0,4,"2025-02-03T05:55:00","Almeida","Guarda","Centro",-6.884767,40.614777
24907761,"Baixa da Banheira e Vale da Amoreira","Península de Setúbal",311,"2025-02-03T06:06:00",24907761,"Em despacho","4331","Busca e resgate terrestre de animais",0,1,0,3,"2025-02-03T06:06:00","Moita","Setúbal","Área Metropolitana De Lisboa",-9.043028,38.662183
24877003,"Malagueira e Horta Das Figueiras","Alentejo Central",312,"2025-01-27T11:41:00",24877003,"Em conclusão","3315","Inundação de estruturas por precipitação intensa",0,0,0,0,"2025-01-27T11:41:00","Évora","Évora","Alentejo",-7.924277,38.57285
24907728,"Palmela","Península de Setúbal",311,"2025-02-03T05:42:00",24907728,"Em resolução","2127","Incêndio em edifícios e recintos industriais, oficinas e armazéns",0,3,0,7,"2025-02-03T05:42:00","Palmela","Setúbal","Área Metropolitana De Lisboa",-8.894979,38.568658
24907762,"Matosinhos e Leça da Palmeira","Area M. Porto",309,"2025-02-03T06:06:00",24907762,"Em conclusão","2419","Afundamento ou adornamento",0,1,0,3,"2025-02-03T06:06:00","Matosinhos","Porto","Norte",-8.697862,41.18235
