"id","address","subregion","neighborhood","date","id.1","state","nature","nature_description","aerial_means","terrestrial_means","aquatic_means","operational","date.1","Concelho","Distrito","NUTII_DSG","longitude","latitude","state_2"
26402449,"Costa da Caparica","Península de Setúbal",311,"2025-12-08T07:45:00",26402449,"Em resolução/conclusão","2407","Despiste",0,1,0,2,"2025-12-08T07:45:00","Almada","Setúbal","Área Metropolitana De Lisboa",-9.227696,38.642583,"Resolução/Conclusão"
26402631,"Rio de Mouro","Grande Lisboa",311,"2025-12-08T08:39:00",26402631,"Em resolução/conclusão","2127","Incêndio em edifícios e recintos industriais, oficinas e armazéns",0,2,0,7,"2025-12-08T08:39:00","Sintra","Lisboa","Área Metropolitana De Lisboa",-9.341345,38.775678,"Resolução/Conclusão"
26402715,"Préstimo e Macieira de Alcoba","Região de Aveiro",310,"2025-12-08T09:11:00",26402715,"Em resolução/conclusão","2407","Despiste",0,6,0,16,"2025-12-08T09:11:00","Águeda","Aveiro","Centro",-8.352524,40.64145,"Resolução/Conclusão"
26402235,"Paio Pires","Península de Setúbal",311,"2025-12-08T05:10:00",26402235,"Em resolução/conclusão","2127","Incêndio em edifícios e recintos industriais, oficinas e armazéns",0,14,0,35,"2025-12-08T05:10:00","Seixal","Setúbal","Área Metropolitana De Lisboa",-9.071001,38.611318,"Resolução/Conclusão"
26402539,"Carcavelos e Parede","Grande Lisboa",311,"2025-12-08T08:21:00",26402539,"Em Despacho","4333","Busca e resgate aquático de animais",0,0,0,0,"2025-12-08T08:21:00","Cascais","Lisboa","Área Metropolitana De Lisboa",-9.335539,38.679903,"Despacho"
26402788,"Aljubarrota","Oeste",311,"2025-12-08T09:19:00",26402788,"Em Curso","2407","Despiste",0,3,0,8,"2025-12-08T09:19:00","Alcobaça","Leiria","Centro",-8.912197,39.514326,"Curso"
