"id","address","subregion","neighborhood","date","id.1","state","nature","nature_description","aerial_means","terrestrial_means","aquatic_means","operational","date.1","Concelho","Distrito","NUTII_DSG","longitude","latitude"
25316776,"Guarda","Beiras e Serra da Estrela",310,"2025-05-02T07:17:00",25316776,"Em conclusão","3311","Queda de elementos de estruturas edificados",0,9,0,18,"2025-05-02T07:17:00","Guarda","Guarda","Centro",-7.269039,40.539292
25318344,"Nossa Senhora da Graça Dos Degolados","Alto Alentejo",312,"2025-05-02T12:45:00",25318344,"Em curso","3309","Desabamento de estruturas edificadas",0,0,0,0,"2025-05-02T12:45:00","Campo Maior","Portalegre","Alentejo",-7.121009,39.061301
25318812,"Anta e Guetim","Area M. Porto",309,"2025-05-02T14:29:00",25318812,"Em resolução","3321","Dano na rede de fornecimento de eletricidade ",0,3,0,6,"2025-05-02T14:29:00","Espinho","Aveiro","Norte",-8.614155,41.008103
25319273,"Vila Nova de Famalicão e Calendário","Ave",309,"2025-05-02T16:06:00",25319273,"Em despacho","3315","Inundação de estruturas por precipitação intensa",0,1,0,2,"2025-05-02T16:06:00","Vila Nova De Famalicão","Braga","Norte",-8.530915,41.39878
25319332,"Santo António Dos Cavaleiros e Frielas","Grande Lisboa",311,"2025-05-02T16:15:00",25319332,"Em conclusão","2403","Colisão rodoviária",0,4,0,10,"2025-05-02T16:15:00","Loures","Lisboa","Área Metropolitana De Lisboa",-9.143018,38.828005
25319380,"Mafamude e Vilar do Paraíso","Area M. Porto",309,"2025-05-02T16:12:00",25319380,"Em despacho","3311","Queda de elementos de estruturas edificados",0,1,0,3,"2025-05-02T16:12:00","Vila Nova De Gaia","Porto","Norte",-8.601126,41.126193
25319430,"Oeiras e S. Julião da Barra, Paço de Arcos e Caxias","Grande Lisboa",311,"2025-05-02T16:25:00",25319430,"Em conclusão","2403","Colisão rodoviária",0,3,0,7,"2025-05-02T16:25:00","Oeiras","Lisboa","Área Metropolitana De Lisboa",-9.307571,38.694618
25319482,"Alhadas","Região de Coimbra",310,"2025-05-02T16:41:00",25319482,"Em despacho","3311","Queda de elementos de estruturas edificados",0,1,0,5,"2025-05-02T16:41:00","Figueira Da Foz","Coimbra","Centro",-8.791408,40.190525
25318361,"Nossa Senhora da Graça Dos Degolados","Alto Alentejo",312,"2025-05-02T13:00:00",25318361,"Em conclusão","3301","Queda de árvore",0,0,0,0,"2025-05-02T13:00:00","Campo Maior","Portalegre","Alentejo",-7.118757,39.056913
25319004,"Nossa Senhora da Graça Dos Degolados","Alto Alentejo",312,"2025-05-02T14:42:00",25319004,"Em conclusão","3321","Dano na rede de fornecimento de eletricidade ",0,2,0,4,"2025-05-02T14:42:00","Campo Maior","Portalegre","Alentejo",-7.121187,39.061477
25319122,"Portimão","Algarve",313,"2025-05-02T15:27:00",25319122,"Em despacho","2403","Colisão rodoviária",0,1,0,2,"2025-05-02T15:27:00","Portimão","Faro","Algarve",-8.532608,37.137966
25319388,"Loureiro","Area M. Porto",309,"2025-05-02T16:30:00",25319388,"Em curso","2407","Despiste",0,3,0,8,"2025-05-02T16:30:00","Oliveira De Azeméis","Aveiro","Norte",-8.538786,40.80568
25319488,"Santo Antão e São Julião do Tojal","Grande Lisboa",311,"2025-05-02T16:43:00",25319488,"Em resolução","2401","Atropelamento rodoviário",0,2,0,7,"2025-05-02T16:43:00","Loures","Lisboa","Área Metropolitana De Lisboa",-9.137133,38.85709
25071496,"São Manços e São Vicente do Pigeiro","Alentejo Central",312,"2025-03-11T13:18:00",25071496,"Em conclusão","1101","Cheia",0,0,0,0,"2025-03-11T13:18:00","Évora","Évora","Alentejo",-7.713313,38.513673
25318424,"Nossa Senhora da Graça Dos Degolados","Alto Alentejo",312,"2025-05-02T13:10:00",25318424,"Em curso","1103","Vento forte",0,1,0,1,"2025-05-02T13:10:00","Campo Maior","Portalegre","Alentejo",-7.12147,39.062622
25318992,"Nossa Senhora da Graça Dos Degolados","Alto Alentejo",312,"2025-05-02T14:50:00",25318992,"Em conclusão","3301","Queda de árvore",0,1,0,1,"2025-05-02T14:50:00","Campo Maior","Portalegre","Alentejo",-7.12101,39.06231
25319011,"Poceirão e Marateca","Península de Setúbal",311,"2025-05-02T15:06:00",25319011,"Em conclusão","2401","Atropelamento rodoviário",0,3,0,5,"2025-05-02T15:06:00","Palmela","Setúbal","Área Metropolitana De Lisboa",-8.741193,38.629608
25319125,"Nossa Senhora da Graça Dos Degolados","Alto Alentejo",312,"2025-05-02T14:30:00",25319125,"Em conclusão","3309","Desabamento de estruturas edificadas",0,0,0,0,"2025-05-02T14:30:00","Campo Maior","Portalegre","Alentejo",-7.11959,39.058483
25319160,"Louro","Ave",309,"2025-05-02T15:28:00",25319160,"Em despacho","3315","Inundação de estruturas por precipitação intensa",0,1,0,2,"2025-05-02T15:28:00","Vila Nova De Famalicão","Braga","Norte",-8.541842,41.432351
25319242,"Lemenhe, Mouquim e Jesufrei","Ave",309,"2025-05-02T15:50:00",25319242,"Em curso","3315","Inundação de estruturas por precipitação intensa",0,1,0,2,"2025-05-02T15:50:00","Vila Nova De Famalicão","Braga","Norte",-8.519555,41.447557
25319276,"Nossa Senhora da Graça Dos Degolados","Alto Alentejo",312,"2025-05-02T16:06:00",25319276,"Em conclusão","3301","Queda de árvore",0,1,0,4,"2025-05-02T16:06:00","Campo Maior","Portalegre","Alentejo",-7.120283,39.059113
25298444,"Carnaxide e Queijas","Grande Lisboa",311,"2025-04-28T11:44:00",25298444,"Em curso","9999","Situação crítica",0,0,0,0,"2025-04-28T11:44:00","Oeiras","Lisboa","Área Metropolitana De Lisboa",-9.243421,38.725234
25319186,"Santa Clara-a-Nova e Gomes Aires","Baixo Alentejo",312,"2025-05-02T15:42:00",25319186,"Em conclusão","2407","Despiste",0,4,0,10,"2025-05-02T15:42:00","Almodôvar","Beja","Alentejo",-8.19308,37.502937
25319217,"Poceirão e Marateca","Península de Setúbal",311,"2025-05-02T15:55:00",25319217,"Em conclusão","2403","Colisão rodoviária",0,2,0,6,"2025-05-02T15:55:00","Palmela","Setúbal","Área Metropolitana De Lisboa",-8.751295,38.672199
25319303,"Águas Santas","Area M. Porto",309,"2025-05-02T16:14:00",25319303,"Em curso","2403","Colisão rodoviária",0,8,0,19,"2025-05-02T16:14:00","Maia","Porto","Norte",-8.586493,41.198292
25319352,"Pechão","Algarve",313,"2025-05-02T16:24:00",25319352,"Em conclusão","3203","Detritos confinados",0,1,0,5,"2025-05-02T16:24:00","Olhão","Faro","Algarve",-7.851161,37.04082
25319404,"Cercal","Alentejo Litoral",312,"2025-05-02T16:09:00",25319404,"Em conclusão","3301","Queda de árvore",0,0,0,0,"2025-05-02T16:09:00","Santiago Do Cacém","Setúbal","Alentejo",-8.667891,37.803265
25319435,"Nossa Senhora da Graça Dos Degolados","Alto Alentejo",312,"2025-05-02T16:26:00",25319435,"Em conclusão","3309","Desabamento de estruturas edificadas",0,2,0,6,"2025-05-02T16:26:00","Campo Maior","Portalegre","Alentejo",-7.120847,39.061692
25319486,"Portimão","Algarve",313,"2025-05-02T16:35:00",25319486,"Em despacho","3311","Queda de elementos de estruturas edificados",0,1,0,1,"2025-05-02T16:35:00","Portimão","Faro","Algarve",-8.532608,37.137966
25319519,"Póvoa de Varzim, Beiriz e Argivai","Area M. Porto",309,"2025-05-02T16:48:00",25319519,"Em despacho","2403","Colisão rodoviária",0,1,0,2,"2025-05-02T16:48:00","Póvoa De Varzim","Porto","Norte",-8.751207,41.383
25319534,"Arca e Ponte de Lima","Alto Minho",309,"2025-05-02T16:50:00",25319534,"Em despacho","4327","Busca e resgate terrestre de pessoas",0,1,0,4,"2025-05-02T16:50:00","Ponte De Lima","Viana Do Castelo","Norte",-8.577281,41.761526
25319537,"Pinheiro da Bemposta, Travanca e Palmaz","Area M. Porto",309,"2025-05-02T16:43:00",25319537,"Em despacho","2403","Colisão rodoviária",0,1,0,2,"2025-05-02T16:43:00","Oliveira De Azeméis","Aveiro","Norte",-8.468107,40.789674
