"id","address","subregion","neighborhood","date","id.1","state","nature","nature_description","aerial_means","terrestrial_means","aquatic_means","operational","date.1","Concelho","Distrito","NUTII_DSG","longitude","latitude"
25274499,"Ramada e Caneças","Grande Lisboa",311,"2025-04-23T01:06:00",25274499,"Em conclusão","2403","Colisão rodoviária",0,3,0,8,"2025-04-23T01:06:00","Odivelas","Lisboa","Área Metropolitana De Lisboa",-9.224517,38.811058
25274515,"Encosta do Sol","Grande Lisboa",311,"2025-04-23T01:24:00",25274515,"Em resolução","3203","Detritos confinados",0,1,0,6,"2025-04-23T01:24:00","Amadora","Lisboa","Área Metropolitana De Lisboa",-9.214086,38.769383
25071496,"São Manços e São Vicente do Pigeiro","Alentejo Central",312,"2025-03-11T13:18:00",25071496,"Em conclusão","1101","Cheia",0,0,0,0,"2025-03-11T13:18:00","Évora","Évora","Alentejo",-7.713313,38.513673
25273135,"Marinha Grande","Região de Leiria",310,"2025-04-22T17:30:00",25273135,"Em curso","4327","Busca e resgate terrestre de pessoas",0,3,0,6,"2025-04-22T17:30:00","Marinha Grande","Leiria","Centro",-8.958105,39.757184
25274355,"Nogueira e Silva Escura","Area M. Porto",309,"2025-04-22T23:47:00",25274355,"Em conclusão","2127","Incêndio em edifícios e recintos industriais, oficinas e armazéns",0,3,0,13,"2025-04-22T23:47:00","Maia","Porto","Norte",-8.572303,41.256897
25274489,"Ermesinde","Area M. Porto",309,"2025-04-23T01:06:00",25274489,"Em despacho","2101","Incêndio em edifícios habitacionais",0,1,0,4,"2025-04-23T01:06:00","Valongo","Porto","Norte",-8.554072,41.216417
25274502,"Mafamude e Vilar do Paraíso","Area M. Porto",309,"2025-04-23T01:08:00",25274502,"Em conclusão","2101","Incêndio em edifícios habitacionais",0,1,0,6,"2025-04-23T01:08:00","Vila Nova De Gaia","Porto","Norte",-8.601126,41.126193
