"id","address","subregion","neighborhood","date","id.1","state","nature","nature_description","aerial_means","terrestrial_means","aquatic_means","operational","date.1","Concelho","Distrito","NUTII_DSG","longitude","latitude"
24739771,"Almada, Cova da Piedade, Pragal e Cacilhas","Península de Setúbal",311,"2024-12-28T05:43:00",24739771,"Em despacho","2101","Incêndio em edifícios habitacionais",0,1,0,4,"2024-12-28T05:43:00","Almada","Setúbal","Área Metropolitana De Lisboa",-9.164498,38.675268
24739491,"Modivas","Area M. Porto",309,"2024-12-28T01:10:00",24739491,"Em conclusão","2301","Incêndio em transporte rodoviário",0,1,0,3,"2024-12-28T01:10:00","Vila Do Conde","Porto","Norte",-8.688294,41.295083
24739768,"Barcouço","Região de Coimbra",310,"2024-12-28T05:37:00",24739768,"Em despacho","2407","Despiste",0,1,0,2,"2024-12-28T05:37:00","Mealhada","Aveiro","Centro",-8.473074,40.30719
24739797,"Nossa Senhora da Conceição, São Pedro e São Dinis","Douro",309,"2024-12-28T06:10:00",24739797,"Em despacho","2101","Incêndio em edifícios habitacionais",0,0,0,0,"2024-12-28T06:10:00","Vila Real","Vila Real","Norte",-7.75214,41.30047
24737936,"Espinhosela","Terras de Trás-os-Montes",309,"2024-12-27T16:44:00",24737936,"Em curso","4327","Busca e resgate terrestre de pessoas",0,14,0,30,"2024-12-27T16:44:00","Bragança","Bragança","Norte",-6.84013,41.898706
