"id","address","subregion","neighborhood","date","id.1","state","nature","nature_description","aerial_means","terrestrial_means","aquatic_means","operational","date.1","Concelho","Distrito","NUTII_DSG","longitude","latitude"
24941257,"Vimieiro","Alentejo Central",312,"2025-02-10T14:50:00",24941257,"Em curso","4329","Busca e resgate aquático de pessoas",0,3,0,7,"2025-02-10T14:50:00","Arraiolos","Évora","Alentejo",-7.837248,38.82704
24945985,"Altura","Algarve",313,"2025-02-11T14:32:00",24945985,"Em despacho","3315","Inundação de estruturas por precipitação intensa",0,2,0,2,"2025-02-11T14:32:00","Castro Marim","Faro","Algarve",-7.501312,37.182018
24945989,"Faíl e Vila Chã de Sá","Viseu Dão Lafões",310,"2025-02-11T14:31:00",24945989,"Em despacho","4331","Busca e resgate terrestre de animais",0,1,0,2,"2025-02-11T14:31:00","Viseu","Viseu","Centro",-7.964147,40.611954
24946003,"Avenidas Novas","Grande Lisboa",311,"2025-02-11T14:35:00",24946003,"Em despacho","2403","Colisão rodoviária",0,1,0,2,"2025-02-11T14:35:00","Lisboa","Lisboa","Área Metropolitana De Lisboa",-9.152329,38.73746
24946070,"Oeiras e S. Julião da Barra, Paço de Arcos e Caxias","Grande Lisboa",311,"2025-02-11T14:55:00",24946070,"Em despacho","2407","Despiste",0,1,0,4,"2025-02-11T14:55:00","Oeiras","Lisboa","Área Metropolitana De Lisboa",-9.310159,38.698531
24946072,"Alvorninha","Oeste",311,"2025-02-11T14:50:00",24946072,"Em despacho","3301","Queda de árvore",0,1,0,5,"2025-02-11T14:50:00","Caldas Da Rainha","Leiria","Centro",-9.016553,39.399192
24946105,"Queluz e Belas","Grande Lisboa",311,"2025-02-11T14:47:00",24946105,"Em despacho","4331","Busca e resgate terrestre de animais",0,1,0,2,"2025-02-11T14:47:00","Sintra","Lisboa","Área Metropolitana De Lisboa",-9.248549,38.801823
24877003,"Malagueira e Horta Das Figueiras","Alentejo Central",312,"2025-01-27T11:41:00",24877003,"Em conclusão","3315","Inundação de estruturas por precipitação intensa",0,0,0,0,"2025-01-27T11:41:00","Évora","Évora","Alentejo",-7.924277,38.57285
24944419,"São Jacinto","Região de Aveiro",310,"2025-02-11T09:29:00",24944419,"Em curso","3311","Queda de elementos de estruturas edificados",0,1,0,2,"2025-02-11T09:29:00","Aveiro","Aveiro","Centro",-8.723538,40.699711
24945600,"Faro (Sé e São Pedro)","Algarve",313,"2025-02-11T13:20:00",24945600,"Em conclusão","2403","Colisão rodoviária",0,3,0,5,"2025-02-11T13:20:00","Faro","Faro","Algarve",-7.942032,37.01865
24945864,"Rio Torto","Alto Tâmega e Barroso",309,"2025-02-11T14:14:00",24945864,"Em conclusão","2101","Incêndio em edifícios habitacionais",0,3,0,8,"2025-02-11T14:14:00","Valpaços","Vila Real","Norte",-7.285212,41.559603
24945875,"Alcoentre","Lezíria do Tejo",311,"2025-02-11T14:16:00",24945875,"Em resolução","2407","Despiste",0,5,0,10,"2025-02-11T14:16:00","Azambuja","Lisboa","Alentejo",-8.933578,39.07355
24945959,"Algés, Linda-a-Velha e Cruz Quebrada-Dafundo","Grande Lisboa",311,"2025-02-11T14:28:00",24945959,"Em curso","2407","Despiste",0,3,0,8,"2025-02-11T14:28:00","Oeiras","Lisboa","Área Metropolitana De Lisboa",-9.225998,38.712219
24944560,"Glória e Vera Cruz","Região de Aveiro",310,"2025-02-11T10:09:00",24944560,"Em curso","3317","Inundação de estruturas por água canalizada",0,1,0,1,"2025-02-11T10:09:00","Aveiro","Aveiro","Centro",-8.647359,40.640643
24944591,"São Bartolomeu de Messines","Algarve",313,"2025-02-11T10:17:00",24944591,"Em curso","1103","Vento forte",0,9,0,23,"2025-02-11T10:17:00","Silves","Faro","Algarve",-8.293242,37.307028
24945159,"Palmela","Península de Setúbal",311,"2025-02-11T11:37:00",24945159,"Em conclusão","2407","Despiste",0,3,0,6,"2025-02-11T11:37:00","Palmela","Setúbal","Área Metropolitana De Lisboa",-8.872455,38.582082
24945275,"Ferragudo","Algarve",313,"2025-02-11T12:08:00",24945275,"Em curso","4339","Corte ou remoção de elementos",0,1,0,2,"2025-02-11T12:08:00","Lagoa","Faro","Algarve",-8.514204,37.11762
24945443,"Mangualde, Mesquitela e Cunha Alta","Viseu Dão Lafões",310,"2025-02-11T12:45:00",24945443,"Em conclusão","2403","Colisão rodoviária",0,1,0,2,"2025-02-11T12:45:00","Mangualde","Viseu","Centro",-7.77046,40.608978
24945445,"São Domingos de Rana","Grande Lisboa",311,"2025-02-11T12:39:00",24945445,"Em despacho","3315","Inundação de estruturas por precipitação intensa",0,1,0,2,"2025-02-11T12:39:00","Cascais","Lisboa","Área Metropolitana De Lisboa",-9.347651,38.740483
24945509,"Cartaxo e Vale da Pinta","Lezíria do Tejo",311,"2025-02-11T13:03:00",24945509,"Em conclusão","2407","Despiste",0,1,0,2,"2025-02-11T13:03:00","Cartaxo","Santarém","Alentejo",-8.797032,39.145945
24945629,"Perafita, Lavra e Santa Cruz do Bispo","Area M. Porto",309,"2025-02-11T13:28:00",24945629,"Em conclusão","2301","Incêndio em transporte rodoviário",0,1,0,5,"2025-02-11T13:28:00","Matosinhos","Porto","Norte",-8.696324,41.23768
24945778,"Palmela","Península de Setúbal",311,"2025-02-11T13:40:00",24945778,"Em conclusão","2407","Despiste",0,0,0,0,"2025-02-11T13:40:00","Palmela","Setúbal","Área Metropolitana De Lisboa",-8.872455,38.582082
24945877,"Couço","Lezíria do Tejo",311,"2025-02-11T14:18:00",24945877,"Em conclusão","3315","Inundação de estruturas por precipitação intensa",0,1,0,2,"2025-02-11T14:18:00","Coruche","Santarém","Alentejo",-8.297213,38.982392
24945715,"Ançã","Região de Coimbra",310,"2025-02-11T13:38:00",24945715,"Em conclusão","2407","Despiste",0,4,0,7,"2025-02-11T13:38:00","Cantanhede","Coimbra","Centro",-8.55056,40.28389
24945783,"Faro (Sé e São Pedro)","Algarve",313,"2025-02-11T13:47:00",24945783,"Em conclusão","3329","Queda de estruturas temporárias ou móveis",0,1,0,2,"2025-02-11T13:47:00","Faro","Faro","Algarve",-7.942032,37.01865
24945831,"Landeira","Alentejo Central",312,"2025-02-11T14:01:00",24945831,"Em resolução","2407","Despiste",0,1,0,2,"2025-02-11T14:01:00","Vendas Novas","Évora","Alentejo",-8.649477,38.595798
24945951,"Vila Real de Santo António","Algarve",313,"2025-02-11T14:26:00",24945951,"Em despacho","3315","Inundação de estruturas por precipitação intensa",0,2,0,5,"2025-02-11T14:26:00","Vila Real De Santo António","Faro","Algarve",-7.413388,37.191428
24946033,"Algueirão-Mem Martins","Grande Lisboa",311,"2025-02-11T14:47:00",24946033,"Em curso","2101","Incêndio em edifícios habitacionais",0,2,0,4,"2025-02-11T14:47:00","Sintra","Lisboa","Área Metropolitana De Lisboa",-9.33007,38.79465
24945930,"Molelos","Viseu Dão Lafões",310,"2025-02-11T14:29:00",24945930,"Em curso","2407","Despiste",0,1,0,2,"2025-02-11T14:29:00","Tondela","Viseu","Centro",-8.105978,40.526523
24946113,"Sé, Santa Maria e Meixedo","Terras de Trás-os-Montes",309,"2025-02-11T14:50:00",24946113,"Em despacho","4331","Busca e resgate terrestre de animais",0,1,0,2,"2025-02-11T14:50:00","Bragança","Bragança","Norte",-6.761223,41.813164
