"id","address","subregion","neighborhood","date","id.1","state","nature","nature_description","aerial_means","terrestrial_means","aquatic_means","operational","date.1","Concelho","Distrito","NUTII_DSG","longitude","latitude"
25498509,"Quarteira","Algarve",313,"2025-06-09T06:16:00",25498509,"Em despacho","2101","Incêndio em edifícios habitacionais",0,1,0,5,"2025-06-09T06:16:00","Loulé","Faro","Algarve",-8.1072,37.074665
25071496,"São Manços e São Vicente do Pigeiro","Alentejo Central",312,"2025-03-11T13:18:00",25071496,"Em conclusão","1101","Cheia",0,0,0,0,"2025-03-11T13:18:00","Évora","Évora","Alentejo",-7.713313,38.513673
25497898,"Cascais e Estoril","Grande Lisboa",311,"2025-06-08T22:55:00",25497898,"Em conclusão","3317","Inundação de estruturas por água canalizada",0,2,0,7,"2025-06-08T22:55:00","Cascais","Lisboa","Área Metropolitana De Lisboa",-9.419397,38.700982
25498519,"Canidelo","Area M. Porto",309,"2025-06-09T06:30:00",25498519,"Em despacho","2403","Colisão rodoviária",0,1,0,2,"2025-06-09T06:30:00","Vila Nova De Gaia","Porto","Norte",-8.652723,41.127681
25496651,"São Salvador e Santa Maria","Alentejo Litoral",312,"2025-06-08T16:57:00",25496651,"Em conclusão","4329","Busca e resgate aquático de pessoas",0,8,0,13,"2025-06-08T16:57:00","Odemira","Beja","Alentejo",-8.64102,37.5976
25497326,"Maceira","Região de Leiria",310,"2025-06-08T19:53:00",25497326,"Em despacho","4331","Busca e resgate terrestre de animais",0,1,0,2,"2025-06-08T19:53:00","Leiria","Leiria","Centro",-8.889652,39.686501
25498328,"Beja (Santiago Maior e São João Baptista)","Baixo Alentejo",312,"2025-06-09T03:05:00",25498328,"Em conclusão","2127","Incêndio em edifícios e recintos industriais, oficinas e armazéns",0,9,0,26,"2025-06-09T03:05:00","Beja","Beja","Alentejo",-7.872212,38.032818
25498388,"Ceira","Região de Coimbra",310,"2025-06-09T03:57:00",25498388,"Em resolução","2127","Incêndio em edifícios e recintos industriais, oficinas e armazéns",0,13,0,41,"2025-06-09T03:57:00","Coimbra","Coimbra","Centro",-8.39222,40.18194
25498488,"São Mamede de Infesta e Senhora da Hora","Area M. Porto",309,"2025-06-09T05:55:00",25498488,"Em conclusão","2101","Incêndio em edifícios habitacionais",0,1,0,2,"2025-06-09T05:55:00","Matosinhos","Porto","Norte",-8.6495,41.18879
