"id","address","subregion","neighborhood","date","id.1","state","nature","nature_description","aerial_means","terrestrial_means","aquatic_means","operational","date.1","Concelho","Distrito","NUTII_DSG","longitude","latitude"
25353543,"Oeiras e S. Julião da Barra, Paço de Arcos e Caxias","Grande Lisboa",311,"2025-05-10T07:04:00",25353543,"Em conclusão","2403","Colisão rodoviária",0,2,0,7,"2025-05-10T07:04:00","Oeiras","Lisboa","Área Metropolitana De Lisboa",-9.310159,38.698531
25353609,"Penamaior","Tâmega e Sousa",309,"2025-05-10T07:39:00",25353609,"Em despacho","4339","Corte ou remoção de elementos",0,0,0,0,"2025-05-10T07:39:00","Paços De Ferreira","Porto","Norte",-8.41072,41.28433
25353608,"Gafanha da Nazaré","Região de Aveiro",310,"2025-05-10T07:20:00",25353608,"Em despacho","3315","Inundação de estruturas por precipitação intensa",0,1,0,3,"2025-05-10T07:20:00","Ílhavo","Aveiro","Centro",-8.756128,40.641907
25071496,"São Manços e São Vicente do Pigeiro","Alentejo Central",312,"2025-03-11T13:18:00",25071496,"Em conclusão","1101","Cheia",0,0,0,0,"2025-03-11T13:18:00","Évora","Évora","Alentejo",-7.713313,38.513673
25353455,"Gondifelos, Cavalões e Outiz","Ave",309,"2025-05-10T06:09:00",25353455,"Em conclusão","2127","Incêndio em edifícios e recintos industriais, oficinas e armazéns",0,12,0,30,"2025-05-10T06:09:00","Vila Nova De Famalicão","Braga","Norte",-8.56093,41.41781
25353505,"Santa Vitória e Mombeja","Baixo Alentejo",312,"2025-05-10T06:35:00",25353505,"Em resolução","2407","Despiste",0,6,0,15,"2025-05-10T06:35:00","Beja","Beja","Alentejo",-7.967148,38.05123
25353570,"Alcabideche","Grande Lisboa",311,"2025-05-10T07:13:00",25353570,"Em resolução","2129","Incêndio em edifícios degradados ou devolutos",0,2,0,7,"2025-05-10T07:13:00","Cascais","Lisboa","Área Metropolitana De Lisboa",-9.402781,38.736294
25353494,"Serzedo e Perosinho","Area M. Porto",309,"2025-05-10T06:27:00",25353494,"Em despacho","2407","Despiste",0,1,0,2,"2025-05-10T06:27:00","Vila Nova De Gaia","Porto","Norte",-8.600642,41.053381
25353595,"Espinho","Cávado",309,"2025-05-10T07:23:00",25353595,"Em despacho","3301","Queda de árvore",0,1,0,3,"2025-05-10T07:23:00","Braga","Braga","Norte",-8.358069,41.545513
