"id","address","subregion","neighborhood","date","id.1","state","nature","nature_description","aerial_means","terrestrial_means","aquatic_means","operational","date.1","Concelho","Distrito","NUTII_DSG","longitude","latitude"
24606744,"Pampilhosa da Serra","Região de Coimbra",310,"2024-11-28T07:12:00",24606744,"Em curso","3109","Gestão de combustível",0,9,0,21,"2024-11-28T07:12:00","Pampilhosa Da Serra","Coimbra","Centro",-7.973746,40.045515
24610595,"Torres Novas (Santa Maria, Salvador e Santiago)","Médio Tejo",311,"2024-11-28T22:02:00",24610595,"Em conclusão","2401","Atropelamento rodoviário",0,2,0,4,"2024-11-28T22:02:00","Torres Novas","Santarém","Centro",-8.539335,39.476394
24610636,"Portimão","Algarve",313,"2024-11-28T22:21:00",24610636,"Em conclusão","2301","Incêndio em transporte rodoviário",0,5,0,15,"2024-11-28T22:21:00","Portimão","Faro","Algarve",-8.55345,37.15119
24610686,"Braga (Maximinos, Sé e Cividade)","Cávado",309,"2024-11-28T22:38:00",24610686,"Em resolução","2201","Incêndio em equipamentos ou produtos",0,3,0,11,"2024-11-28T22:38:00","Braga","Braga","Norte",-8.440407,41.545277
24610720,"Brasfemes","Região de Coimbra",310,"2024-11-28T23:05:00",24610720,"Em despacho","3321","Dano na rede de fornecimento de eletricidade ",0,1,0,2,"2024-11-28T23:05:00","Coimbra","Coimbra","Centro",-8.412952,40.275832
24610360,"Salzedas","Douro",309,"2024-11-28T20:20:00",24610360,"Em despacho","4327","Busca e resgate terrestre de pessoas",0,1,0,3,"2024-11-28T20:20:00","Tarouca","Viseu","Norte",-7.709573,41.067846
24610708,"Avenidas Novas","Grande Lisboa",311,"2024-11-28T22:56:00",24610708,"Em despacho","2403","Colisão rodoviária",0,1,0,2,"2024-11-28T22:56:00","Lisboa","Lisboa","Área Metropolitana De Lisboa",-9.152329,38.73746
24610573,"Baixa da Banheira e Vale da Amoreira","Península de Setúbal",311,"2024-11-28T21:52:00",24610573,"Em conclusão","2403","Colisão rodoviária",0,7,0,18,"2024-11-28T21:52:00","Moita","Setúbal","Área Metropolitana De Lisboa",-9.043028,38.662183
24610639,"Massamá e Monte Abraão","Grande Lisboa",311,"2024-11-28T22:21:00",24610639,"Em conclusão","2101","Incêndio em edifícios habitacionais",0,2,0,8,"2024-11-28T22:21:00","Sintra","Lisboa","Área Metropolitana De Lisboa",-9.27045,38.75541
