"id","address","subregion","neighborhood","date","id.1","state","nature","nature_description","aerial_means","terrestrial_means","aquatic_means","operational","date.1","Concelho","Distrito","NUTII_DSG","longitude","latitude"
24877003,"Malagueira e Horta Das Figueiras","Alentejo Central",312,"2025-01-27T11:41:00",24877003,"Em conclusão","3315","Inundação de estruturas por precipitação intensa",0,0,0,0,"2025-01-27T11:41:00","Évora","Évora","Alentejo",-7.924277,38.57285
25038711,"Folgosa","Area M. Porto",309,"2025-03-04T09:09:00",25038711,"Em conclusão","2403","Colisão rodoviária",0,3,0,10,"2025-03-04T09:09:00","Maia","Porto","Norte",-8.546955,41.259058
25039281,"Lodares","Tâmega e Sousa",309,"2025-03-04T11:29:00",25039281,"Em curso","2403","Colisão rodoviária",0,5,0,9,"2025-03-04T11:29:00","Lousada","Porto","Norte",-8.289419,41.246797
25039295,"Vilar de Andorinho","Area M. Porto",309,"2025-03-04T11:35:00",25039295,"Em curso","2403","Colisão rodoviária",0,1,0,2,"2025-03-04T11:35:00","Vila Nova De Gaia","Porto","Norte",-8.57418,41.09994
25039210,"Foz do Sousa e Covelo","Area M. Porto",309,"2025-03-04T11:14:00",25039210,"Em despacho","4331","Busca e resgate terrestre de animais",0,1,0,3,"2025-03-04T11:14:00","Gondomar","Porto","Norte",-8.482621,41.0963
25039309,"Margaride (Santa Eulália), Várzea, Lagares, Varziela e Moure","Tâmega e Sousa",309,"2025-03-04T11:36:00",25039309,"Em curso","2403","Colisão rodoviária",0,0,0,0,"2025-03-04T11:36:00","Felgueiras","Porto","Norte",-8.203814,41.358592
25031633,"Alcabideche","Grande Lisboa",311,"2025-03-02T15:04:00",25031633,"Em curso","4329","Busca e resgate aquático de pessoas",0,4,0,6,"2025-03-02T15:04:00","Cascais","Lisboa","Área Metropolitana De Lisboa",-9.47686,38.75392
25039012,"Venteira","Grande Lisboa",311,"2025-03-04T10:25:00",25039012,"Em curso","3323","Dano na rede de abastecimento de água",0,1,0,2,"2025-03-04T10:25:00","Amadora","Lisboa","Área Metropolitana De Lisboa",-9.24198977353569,38.74661342854
25039271,"Santa Maria da Feira, Travanca, Sanfins e Espargo","Area M. Porto",309,"2025-03-04T11:31:00",25039271,"Em conclusão","2403","Colisão rodoviária",0,3,0,6,"2025-03-04T11:31:00","Santa Maria Da Feira","Aveiro","Norte",-8.555837,40.9255
25039314,"Gafanha da Boa Hora","Região de Aveiro",310,"2025-03-04T11:32:00",25039314,"Em curso","2403","Colisão rodoviária",0,2,0,4,"2025-03-04T11:32:00","Vagos","Aveiro","Centro",-8.748235,40.56829
25026516,"Melres e Medas","Area M. Porto",309,"2025-03-01T11:41:00",25026516,"Em curso","4329","Busca e resgate aquático de pessoas",0,2,0,7,"2025-03-01T11:41:00","Gondomar","Porto","Norte",-8.458103,41.061746
25039199,"Custóias, Leça do Balio e Guifões","Area M. Porto",309,"2025-03-04T11:17:00",25039199,"Em conclusão","2115","Incêndio em edifícios hoteleiros e de restauração",0,5,0,18,"2025-03-04T11:17:00","Matosinhos","Porto","Norte",-8.63654,41.20725
25039251,"Nossa Senhora de Fátima","Médio Tejo",311,"2025-03-04T11:29:00",25039251,"Em conclusão","2401","Atropelamento rodoviário",0,2,0,4,"2025-03-04T11:29:00","Entroncamento","Santarém","Centro",-8.468295,39.474487
25039285,"Gouveia (São Pedro e São Julião)","Beiras e Serra da Estrela",310,"2025-03-04T11:30:00",25039285,"Em curso","2127","Incêndio em edifícios e recintos industriais, oficinas e armazéns",0,5,0,15,"2025-03-04T11:30:00","Gouveia","Guarda","Centro",-7.586951,40.497325
25039384,"Sameiro","Beiras e Serra da Estrela",310,"2025-03-04T12:00:00",25039384,"Em despacho","4331","Busca e resgate terrestre de animais",0,1,0,5,"2025-03-04T12:00:00","Manteigas","Guarda","Centro",-7.495761,40.410408
