"id","address","subregion","neighborhood","date","id.1","state","nature","nature_description","aerial_means","terrestrial_means","aquatic_means","operational","date.1","Concelho","Distrito","NUTII_DSG","longitude","latitude"
25026516,"Melres e Medas","Area M. Porto",309,"2025-03-01T11:41:00",25026516,"Em conclusão","4329","Busca e resgate aquático de pessoas",0,3,0,5,"2025-03-01T11:41:00","Gondomar","Porto","Norte",-8.458103,41.061746
25029810,"Monte Real e Carvide","Região de Leiria",310,"2025-03-02T06:37:00",25029810,"Em conclusão","2407","Despiste",0,3,0,4,"2025-03-02T06:37:00","Leiria","Leiria","Centro",-8.887198,39.854365
25029782,"Seixal, Arrentela e Aldeia de Paio Pires","Península de Setúbal",311,"2025-03-02T06:10:00",25029782,"Em despacho","2403","Colisão rodoviária",0,2,0,4,"2025-03-02T06:10:00","Seixal","Setúbal","Área Metropolitana De Lisboa",-9.104804,38.642769
24877003,"Malagueira e Horta Das Figueiras","Alentejo Central",312,"2025-01-27T11:41:00",24877003,"Em conclusão","3315","Inundação de estruturas por precipitação intensa",0,0,0,0,"2025-01-27T11:41:00","Évora","Évora","Alentejo",-7.924277,38.57285
25029655,"Vialonga","Grande Lisboa",311,"2025-03-02T04:28:00",25029655,"Em conclusão","2407","Despiste",0,1,0,5,"2025-03-02T04:28:00","Vila Franca De Xira","Lisboa","Área Metropolitana De Lisboa",-9.087262,38.878017
25030037,"São Miguel do Souto e Mosteirô","Area M. Porto",309,"2025-03-02T08:26:00",25030037,"Em despacho","2407","Despiste",0,1,0,2,"2025-03-02T08:26:00","Santa Maria Da Feira","Aveiro","Norte",-8.549941,40.892271
25029686,"São João Das Lampas e Terrugem","Grande Lisboa",311,"2025-03-02T04:55:00",25029686,"Em conclusão","2403","Colisão rodoviária",0,1,0,6,"2025-03-02T04:55:00","Sintra","Lisboa","Área Metropolitana De Lisboa",-9.353329,38.871033
25029881,"Pataias e Martingança","Oeste",311,"2025-03-02T07:31:00",25029881,"Em resolução","3201","Detritos não confinados",0,2,0,7,"2025-03-02T07:31:00","Alcobaça","Leiria","Centro",-8.92977,39.66439
25029922,"Azueira e Sobral da Abelheira","Grande Lisboa",311,"2025-03-02T07:45:00",25029922,"Em curso","2407","Despiste",0,4,0,14,"2025-03-02T07:45:00","Mafra","Lisboa","Área Metropolitana De Lisboa",-9.272315,38.992552
25029945,"Falagueira-Venda Nova","Grande Lisboa",311,"2025-03-02T07:58:00",25029945,"Em conclusão","2407","Despiste",0,2,0,8,"2025-03-02T07:58:00","Amadora","Lisboa","Área Metropolitana De Lisboa",-9.224815,38.755208
