"id","address","subregion","neighborhood","date","id.1","state","nature","nature_description","aerial_means","terrestrial_means","aquatic_means","operational","date.1","Concelho","Distrito","NUTII_DSG","longitude","latitude"
24984326,"Barreiros e Cepões","Viseu Dão Lafões",310,"2025-02-20T06:36:00",24984326,"Em curso","2403","Colisão rodoviária",0,3,0,8,"2025-02-20T06:36:00","Viseu","Viseu","Centro",-7.808679,40.751202
24984335,"Vila Franca Das Naves e Feital","Beiras e Serra da Estrela",310,"2025-02-20T06:50:00",24984335,"Em despacho","3301","Queda de árvore",0,1,0,2,"2025-02-20T06:50:00","Trancoso","Guarda","Centro",-7.258443,40.723136
24888293,"Pernes","Lezíria do Tejo",311,"2025-01-29T16:41:00",24888293,"Em curso","3301","Queda de árvore",0,0,0,0,"2025-01-29T16:41:00","Santarém","Santarém","Alentejo",-8.658865,39.381547
24984337,"São Brás de Alportel","Algarve",313,"2025-02-20T06:56:00",24984337,"Em curso","3321","Dano na rede de fornecimento de eletricidade ",0,1,0,4,"2025-02-20T06:56:00","São Brás De Alportel","Faro","Algarve",-7.909012,37.166366
24984362,"St.tirso, Couto (S.cristina e S.miguel) e Burgães","Area M. Porto",309,"2025-02-20T06:58:00",24984362,"Em despacho","2403","Colisão rodoviária",0,1,0,2,"2025-02-20T06:58:00","Santo Tirso","Porto","Norte",-8.474679,41.335886
24877003,"Malagueira e Horta Das Figueiras","Alentejo Central",312,"2025-01-27T11:41:00",24877003,"Em conclusão","3315","Inundação de estruturas por precipitação intensa",0,0,0,0,"2025-01-27T11:41:00","Évora","Évora","Alentejo",-7.924277,38.57285
24984297,"N. S. da Vila, N. S. do Bispo e Silveiras","Alentejo Central",312,"2025-02-20T06:11:00",24984297,"Em resolução","2301","Incêndio em transporte rodoviário",0,3,0,9,"2025-02-20T06:11:00","Montemor-o-Novo","Évora","Alentejo",-8.07333,38.613367
24984331,"Cedofeita, Ildefonso, Sé, Miragaia, Nicolau e Vitória","Area M. Porto",309,"2025-02-20T06:50:00",24984331,"Em curso","2117","Incêndio em edifícios comerciais e gares de transporte",0,2,0,10,"2025-02-20T06:50:00","Porto","Porto","Norte",-8.60355,41.14935
24984356,"Moreira","Area M. Porto",309,"2025-02-20T06:58:00",24984356,"Em curso","2403","Colisão rodoviária",0,2,0,4,"2025-02-20T06:58:00","Maia","Porto","Norte",-8.651156,41.243233
