"id","address","subregion","neighborhood","date","id.1","state","nature","nature_description","aerial_means","terrestrial_means","aquatic_means","operational","date.1","Concelho","Distrito","NUTII_DSG","longitude","latitude"
25026516,"Melres e Medas","Area M. Porto",309,"2025-03-01T11:41:00",25026516,"Em curso","4329","Busca e resgate aquático de pessoas",0,0,0,0,"2025-03-01T11:41:00","Gondomar","Porto","Norte",-8.458103,41.061746
25037528,"Venda do Pinheiro e Santo Estêvão Das Galés","Grande Lisboa",311,"2025-03-03T21:29:00",25037528,"Em conclusão","2403","Colisão rodoviária",0,4,0,7,"2025-03-03T21:29:00","Mafra","Lisboa","Área Metropolitana De Lisboa",-9.228575,38.925416
25037546,"Azeitão (São Lourenço e São Simão)","Península de Setúbal",311,"2025-03-03T21:34:00",25037546,"Em conclusão","2115","Incêndio em edifícios hoteleiros e de restauração",0,6,0,15,"2025-03-03T21:34:00","Setúbal","Setúbal","Área Metropolitana De Lisboa",-9.008047,38.525528
24877003,"Malagueira e Horta Das Figueiras","Alentejo Central",312,"2025-01-27T11:41:00",24877003,"Em conclusão","3315","Inundação de estruturas por precipitação intensa",0,0,0,0,"2025-01-27T11:41:00","Évora","Évora","Alentejo",-7.924277,38.57285
25037700,"Vila Nova de Cacela","Algarve",313,"2025-03-03T22:38:00",25037700,"Em conclusão","2407","Despiste",0,1,0,2,"2025-03-03T22:38:00","Vila Real De Santo António","Faro","Algarve",-7.548327,37.196753
25031633,"Alcabideche","Grande Lisboa",311,"2025-03-02T15:04:00",25031633,"Em conclusão","4329","Busca e resgate aquático de pessoas",0,0,0,0,"2025-03-02T15:04:00","Cascais","Lisboa","Área Metropolitana De Lisboa",-9.47686,38.75392
25037181,"Maceira","Região de Leiria",310,"2025-03-03T19:38:00",25037181,"Em despacho","3203","Detritos confinados",0,1,0,2,"2025-03-03T19:38:00","Leiria","Leiria","Centro",-8.929179,39.67723
25037392,"Vila do Conde","Area M. Porto",309,"2025-03-03T20:43:00",25037392,"Em despacho","2401","Atropelamento rodoviário",0,1,0,2,"2025-03-03T20:43:00","Vila Do Conde","Porto","Norte",-8.735384,41.352471
25037619,"São Pedro do Sul, Várzea e Baiões","Viseu Dão Lafões",310,"2025-03-03T22:09:00",25037619,"Em conclusão","2101","Incêndio em edifícios habitacionais",0,3,0,9,"2025-03-03T22:09:00","São Pedro Do Sul","Viseu","Centro",-8.070088,40.753842
25037717,"Penedono e Granja","Douro",309,"2025-03-03T22:43:00",25037717,"Em conclusão","2101","Incêndio em edifícios habitacionais",0,1,0,2,"2025-03-03T22:43:00","Penedono","Viseu","Norte",-7.392822,40.98611
25037724,"São Facundo e Vale Das Mós","Médio Tejo",311,"2025-03-03T22:50:00",25037724,"Em resolução","2407","Despiste",0,5,0,13,"2025-03-03T22:50:00","Abrantes","Santarém","Centro",-8.122033,39.346335
25037792,"Silveira","Oeste",311,"2025-03-03T23:22:00",25037792,"Em despacho","2101","Incêndio em edifícios habitacionais",0,0,0,0,"2025-03-03T23:22:00","Torres Vedras","Lisboa","Centro",-9.370168,39.110449
25037486,"Seiça","Médio Tejo",311,"2025-03-03T21:16:00",25037486,"Em resolução","2101","Incêndio em edifícios habitacionais",0,9,0,19,"2025-03-03T21:16:00","Ourém","Santarém","Centro",-8.513945,39.679408
25037522,"Santa Clara e Castelo Viegas","Região de Coimbra",310,"2025-03-03T21:33:00",25037522,"Em resolução","2129","Incêndio em edifícios degradados ou devolutos",0,8,0,22,"2025-03-03T21:33:00","Coimbra","Coimbra","Centro",-8.437323,40.204625
25037738,"Palhais e Coina","Península de Setúbal",311,"2025-03-03T22:56:00",25037738,"Em curso","2403","Colisão rodoviária",0,3,0,9,"2025-03-03T22:56:00","Barreiro","Setúbal","Área Metropolitana De Lisboa",-9.043332,38.595522
25037740,"São João Baptista e Santa Maria Dos Olivais","Médio Tejo",311,"2025-03-03T22:58:00",25037740,"Em curso","4331","Busca e resgate terrestre de animais",0,1,0,2,"2025-03-03T22:58:00","Tomar","Santarém","Centro",-8.405552,39.602187
