"id","address","subregion","neighborhood","date","id.1","state","nature","nature_description","aerial_means","terrestrial_means","aquatic_means","operational","date.1","Concelho","Distrito","NUTII_DSG","longitude","latitude"
24672289,"Caparica e Trafaria","Península de Setúbal",311,"2024-12-13T05:33:00",24672289,"Em curso","2101","Incêndio em edifícios habitacionais",0,9,0,27,"2024-12-13T05:33:00","Almada","Setúbal","Área Metropolitana De Lisboa",-9.205011,38.66171
24672208,"Aljustrel e Rio de Moinhos","Baixo Alentejo",312,"2024-12-13T04:01:00",24672208,"Em conclusão","2401","Atropelamento rodoviário",0,4,0,9,"2024-12-13T04:01:00","Aljustrel","Beja","Alentejo",-8.149549,37.875978
24671374,"Viseu","Viseu Dão Lafões",310,"2024-12-12T20:08:00",24671374,"Em conclusão","2101","Incêndio em edifícios habitacionais",0,0,0,0,"2024-12-12T20:08:00","Viseu","Viseu","Centro",-7.915,40.67154
24672344,"Ramada e Caneças","Grande Lisboa",311,"2024-12-13T06:42:00",24672344,"Em conclusão","2301","Incêndio em transporte rodoviário",0,1,0,5,"2024-12-13T06:42:00","Odivelas","Lisboa","Área Metropolitana De Lisboa",-9.200465,38.80643
24672362,"Ovar, São João, Arada e São Vicente de Pereira Jusã","Região de Aveiro",310,"2024-12-13T06:55:00",24672362,"Em despacho","2127","Incêndio em edifícios e recintos industriais, oficinas e armazéns",0,1,0,4,"2024-12-13T06:55:00","Ovar","Aveiro","Centro",-8.535223,40.86441
