"id","address","subregion","neighborhood","date","id.1","state","nature","nature_description","aerial_means","terrestrial_means","aquatic_means","operational","date.1","Concelho","Distrito","NUTII_DSG","longitude","latitude"
25071496,"São Manços e São Vicente do Pigeiro","Alentejo Central",312,"2025-03-11T13:18:00",25071496,"Em conclusão","1101","Cheia",0,0,0,0,"2025-03-11T13:18:00","Évora","Évora","Alentejo",-7.713313,38.513673
25377853,"Sé, Santa Maria e Meixedo","Terras de Trás-os-Montes",309,"2025-05-15T15:21:00",25377853,"Em despacho","4331","Busca e resgate terrestre de animais",0,1,0,2,"2025-05-15T15:21:00","Bragança","Bragança","Norte",-6.761223,41.813164
25379208,"Portimão","Algarve",313,"2025-05-15T19:43:00",25379208,"Em despacho","4331","Busca e resgate terrestre de animais",0,2,0,7,"2025-05-15T19:43:00","Portimão","Faro","Algarve",-8.532608,37.137966
25379259,"Santo Antão e São Julião do Tojal","Grande Lisboa",311,"2025-05-15T20:55:00",25379259,"Em conclusão","3329","Queda de estruturas temporárias ou móveis",0,2,0,6,"2025-05-15T20:55:00","Loures","Lisboa","Área Metropolitana De Lisboa",-9.165295,38.84251
25379290,"Mafamude e Vilar do Paraíso","Area M. Porto",309,"2025-05-15T21:05:00",25379290,"Em resolução","2515","Fuga de gás em garrafa",0,4,0,15,"2025-05-15T21:05:00","Vila Nova De Gaia","Porto","Norte",-8.61613,41.10911
25379307,"Águas Livres","Grande Lisboa",311,"2025-05-15T21:11:00",25379307,"Em despacho","3323","Dano na rede de abastecimento de água",0,1,0,2,"2025-05-15T21:11:00","Amadora","Lisboa","Área Metropolitana De Lisboa",-9.22052,38.74485
25379390,"Avenidas Novas","Grande Lisboa",311,"2025-05-15T21:16:00",25379390,"Em despacho","2401","Atropelamento rodoviário",0,1,0,2,"2025-05-15T21:16:00","Lisboa","Lisboa","Área Metropolitana De Lisboa",-9.152329,38.73746
25379393,"Vilas Boas","Alto Tâmega e Barroso",309,"2025-05-15T21:26:00",25379393,"Em conclusão","2407","Despiste",0,3,0,9,"2025-05-15T21:26:00","Chaves","Vila Real","Norte",-7.523292,41.654068
25379440,"Sendim","Tâmega e Sousa",309,"2025-05-15T21:44:00",25379440,"Em resolução","2407","Despiste",0,3,0,9,"2025-05-15T21:44:00","Felgueiras","Porto","Norte",-8.16637,41.38084
25379458,"Aljubarrota","Oeste",311,"2025-05-15T21:51:00",25379458,"Em despacho","2201","Incêndio em equipamentos ou produtos",0,3,0,9,"2025-05-15T21:51:00","Alcobaça","Leiria","Centro",-8.96253,39.55025
25379459,"Palmeira de Faro e Curvos","Cávado",309,"2025-05-15T21:45:00",25379459,"Em curso","2403","Colisão rodoviária",0,2,0,4,"2025-05-15T21:45:00","Esposende","Braga","Norte",-8.738948,41.549993
25379492,"Gondomar (São Cosme), Valbom e Jovim","Area M. Porto",309,"2025-05-15T21:54:00",25379492,"Em despacho","2513","Fuga de gás em conduta",0,1,0,5,"2025-05-15T21:54:00","Gondomar","Porto","Norte",-8.535295,41.129255
25379148,"Santiago de Besteiros","Viseu Dão Lafões",310,"2025-05-15T20:15:00",25379148,"Em conclusão","2403","Colisão rodoviária",0,1,0,2,"2025-05-15T20:15:00","Tondela","Viseu","Centro",-8.129387,40.572577
25379232,"Alvalade","Grande Lisboa",311,"2025-05-15T20:41:00",25379232,"Em despacho","2403","Colisão rodoviária",0,1,0,2,"2025-05-15T20:41:00","Lisboa","Lisboa","Área Metropolitana De Lisboa",-9.144275,38.754131
25379385,"Alverca do Ribatejo e Sobralinho","Grande Lisboa",311,"2025-05-15T21:21:00",25379385,"Em conclusão","2129","Incêndio em edifícios degradados ou devolutos",0,2,0,7,"2025-05-15T21:21:00","Vila Franca De Xira","Lisboa","Área Metropolitana De Lisboa",-9.034761,38.918068
25379466,"Ferreira","Tâmega e Sousa",309,"2025-05-15T21:53:00",25379466,"Em curso","2101","Incêndio em edifícios habitacionais",0,1,0,5,"2025-05-15T21:53:00","Paços De Ferreira","Porto","Norte",-8.36554,41.26016
25379076,"Cacém e São Marcos","Grande Lisboa",311,"2025-05-15T19:57:00",25379076,"Em conclusão","3329","Queda de estruturas temporárias ou móveis",0,4,0,8,"2025-05-15T19:57:00","Sintra","Lisboa","Área Metropolitana De Lisboa",-9.296125,38.754519
25379289,"Loulé (São Sebastião)","Algarve",313,"2025-05-15T21:05:00",25379289,"Em conclusão","2101","Incêndio em edifícios habitacionais",0,0,0,0,"2025-05-15T21:05:00","Loulé","Faro","Algarve",-8.06001,37.10771
25379371,"Arões (Santa Cristina)","Ave",309,"2025-05-15T21:27:00",25379371,"Em curso","2407","Despiste",0,9,0,24,"2025-05-15T21:27:00","Fafe","Braga","Norte",-8.222938,41.439735
25379430,"Arcozelo","Area M. Porto",309,"2025-05-15T21:38:00",25379430,"Em resolução","2407","Despiste",0,2,0,4,"2025-05-15T21:38:00","Vila Nova De Gaia","Porto","Norte",-8.648653,41.043565
25379462,"Paranhos","Area M. Porto",309,"2025-05-15T21:49:00",25379462,"Em despacho","3317","Inundação de estruturas por água canalizada",0,0,0,0,"2025-05-15T21:49:00","Porto","Porto","Norte",-8.604254,41.174248
25366291,"Matosinhos e Leça da Palmeira","Area M. Porto",309,"2025-05-12T23:59:00",25366291,"Em curso","9115","Operação nacional de assistência",0,14,0,33,"2025-05-12T23:59:00","Matosinhos","Porto","Norte",-8.682603,41.186161
25379013,"Guarda","Beiras e Serra da Estrela",310,"2025-05-15T19:48:00",25379013,"Em conclusão","2301","Incêndio em transporte rodoviário",0,1,0,4,"2025-05-15T19:48:00","Guarda","Guarda","Centro",-7.250303,40.574563
25379088,"Lagos (São Sebastião e Santa Maria)","Algarve",313,"2025-05-15T19:59:00",25379088,"Em conclusão","2401","Atropelamento rodoviário",0,1,0,2,"2025-05-15T19:59:00","Lagos","Faro","Algarve",-8.686965,37.112811
25379270,"Enxara do Bispo, Gradil e Vila Franca do Rosário","Grande Lisboa",311,"2025-05-15T20:57:00",25379270,"Em resolução","3103","Incêndio rural",0,2,0,7,"2025-05-15T20:57:00","Mafra","Lisboa","Área Metropolitana De Lisboa",-9.22913,39.00693
25379452,"Custóias, Leça do Balio e Guifões","Area M. Porto",309,"2025-05-15T21:45:00",25379452,"Em despacho","2101","Incêndio em edifícios habitacionais",0,1,0,4,"2025-05-15T21:45:00","Matosinhos","Porto","Norte",-8.632716,41.208899
