"id","address","subregion","neighborhood","date","id.1","state","nature","nature_description","aerial_means","terrestrial_means","aquatic_means","operational","date.1","Concelho","Distrito","NUTII_DSG","longitude","latitude"
24411958,"São Martinho Das Moitas e Covas do Rio","Viseu Dão Lafões",310,"2024-10-14T08:00:00",24411958,"Em curso","4339","Corte ou remoção de elementos",0,2,0,6,"2024-10-14T08:00:00","São Pedro Do Sul","Viseu","Centro",-8.08089,40.891495
24360487,"Mões","Viseu Dão Lafões",310,"2024-10-03T08:00:00",24360487,"Em curso","4339","Corte ou remoção de elementos",0,1,0,1,"2024-10-03T08:00:00","Castro Daire","Viseu","Centro",-7.893519,40.867571
24438165,"Sines","Alentejo Litoral",312,"2024-10-20T06:40:00",24438165,"Em resolução","2401","Atropelamento rodoviário",0,2,0,5,"2024-10-20T06:40:00","Sines","Setúbal","Alentejo",-8.854536,37.963534
24438206,"São Domingos de Rana","Grande Lisboa",311,"2024-10-20T07:14:00",24438206,"Em curso","3323","Dano na rede de abastecimento de água",0,1,0,2,"2024-10-20T07:14:00","Cascais","Lisboa","Área Metropolitana De Lisboa",-9.34034930900703,38.7238067198185
24436035,"Bordeira","Algarve",313,"2024-10-19T15:10:00",24436035,"Em curso","4329","Busca e resgate aquático de pessoas",0,2,0,4,"2024-10-19T15:10:00","Aljezur","Faro","Algarve",-8.88472,37.22222
24438082,"São Pedro e Santa Maria e Vila Boa do Mondego","Beiras e Serra da Estrela",310,"2024-10-20T05:37:00",24438082,"Em conclusão","2407","Despiste",0,3,0,6,"2024-10-20T05:37:00","Fornos De Algodres","Guarda","Centro",-7.481445,40.620212
24438157,"Atalaia e Alto-Estanqueiro-Jardia","Península de Setúbal",311,"2024-10-20T06:27:00",24438157,"Em resolução","2407","Despiste",0,2,0,6,"2024-10-20T06:27:00","Montijo","Setúbal","Área Metropolitana De Lisboa",-8.926486,38.656845
