attributes.ID_oc,attributes.Numero,attributes.CodEstadoOcorrencia,attributes.EstadoOcorrencia,attributes.EstadoAgrupado,attributes.CodImportanciaOcorrencia,attributes.ImportanciaOcorrencia,attributes.DataInicioOcorrencia,attributes.DataOcorrencia,attributes.Data,attributes.Hora,attributes.Ano,attributes.Duracao,attributes.DuracaoMinutos,attributes.FaseIncendio,attributes.CodNatureza,attributes.IDFamilia,attributes.Familia,attributes.IDEspecie,attributes.Especie,attributes.IDTipo,attributes.Tipo,attributes.Natureza,attributes.RegiaoID,attributes.Regiao,attributes.SubRegiaoID,attributes.SubRegiao,attributes.DICO,attributes.Concelho,attributes.DICOFRE,attributes.Freguesia,attributes.Localidade,attributes.Endereco,attributes.OperacionaisTerrestres,attributes.OPAereos,attributes.Operacionais,attributes.MeiosTerrestres,attributes.MaqRasto,attributes.MeiosAereos,attributes.QuantEntidades,attributes.Latitude,attributes.Longitude,attributes.DDD,attributes.DDM,attributes.DMS,attributes.DataDosDados,attributes.Simbol,attributes.RASI,attributes.ID,geometry.x,geometry.y,id,address,subregion,neighborhood,date,date.1,state,nature,aerial_means,terrestrial_means,operational,state_2,Concelho,Distrito,NUTII_DSG,longitude,latitude,nature_description
39255349,20240332542,5,Chegada ao TO,Em Despacho,0,N/A,18/03/2024 18:14,1710785640000,2024-03-18,18:14,2024,693/18:32,997592,---,4305,4,Protecção e Assistência a Pessoas e Bens,3,Assistência e Prevenção a actividades humanas,5,Limpeza de Via e Sinalização de Perigo,4305 - Limpeza de Via e Sinalização de Perigo,2,Norte,5,Area M. Porto,188,Paredes,131024,Vilela,Vilela,Av. Fontes,0,0,0,0,0,0,0,41.242851,-8.381106,41.242851°N 8.381106°W,"41°14,5740'N 8°22,8660'W ","41° 14' 34,44'' N 8° 22' 51,96'' W ",1770641160000,43 - Em Curso,Outras ocorrências de proteção e socorro,23461879,-8.381106,41.242851,20240332542,Vilela,Norte,188,2024-03-18T18:14:00Z,2024-03-18,Chegada Ao to,4305,0,0,0,Chegada Ao to,Paredes,Porto,Norte,-8.381106,41.242851,Limpeza de Via e Sinalização de Perigo
39255350,20260093172,6,Em Curso,Em Curso,1,Reduzida,20/01/2026 18:09,1768932540000,2026-01-20,18:09,2026,20/18:37,28477,---,3313,3,Riscos Mistos,3,"Comprometimento total ou parcial de segurança, serviços ou estruturas",13,Movimento de massa,3313 - Movimento de massa,3,Centro,12,Região de Leiria,140,Leiria,100921,Regueira de Pontes,Ortigosa,Rua do Rei Lavrador,3,0,3,2,0,0,2,39.809021,-8.844605,39.809021°N 8.844605°W,"39°48,5400'N 8°50,6760'W ","39° 48' 32,40'' N 8° 50' 40,56'' W ",1770641160000,33 - Em Curso,Intervenções em Infraestruturas e vias de comunicação,26615159,-8.844605,39.809021,20260093172,Ortigosa,Centro,140,2026-01-20T18:09:00Z,2026-01-20,Em Curso,3313,0,2,3,Curso,Leiria,Leiria,Centro,-8.844605,39.809021,Movimento de massa
39255351,20260104984,6,Em Curso,Em Curso,2,Moderada,23/01/2026 07:26,1769153160000,2026-01-23,07:26,2026,17/05:20,24800,---,1101,1,Riscos Naturais,1,Fenómenos Naturais,1,Cheia,1101 - Cheia,5,Alentejo,19,Alentejo Litoral,218,Alcácer do Sal,150104,Torrão,SÃO ROMÃO,EN262 São Romão,0,0,0,0,0,0,0,38.251711,-8.359187,38.251711°N 8.359187°W,"38°15,1020'N 8°21,5520'W ","38° 15' 6,12'' N 8° 21' 33,12'' W ",1770641160000,11 - Em Curso,Outras ocorrências de proteção e socorro,26626976,-8.359187,38.251711,20260104984,SÃO ROMÃO,Alentejo,218,2026-01-23T07:26:00Z,2026-01-23,Em Curso,1101,0,0,0,Curso,Alcácer Do Sal,Setúbal,Alentejo,-8.359187,38.251711,Cheia
39255352,20260106567,6,Em Curso,Em Curso,1,Reduzida,23/01/2026 12:12,1769170320000,2026-01-23,12:12,2026,17/00:34,24514,---,3315,3,Riscos Mistos,3,"Comprometimento total ou parcial de segurança, serviços ou estruturas",15,Inundação de estruturas ou superfícies por precipitação intensa,3315 - Inundação de estruturas ou superfícies por precipitação intensa,4,Lisboa e Vale do Tejo,16,Oeste,143,Óbidos,101210,"Santa Maria, São Pedro e Sobral da Lagoa",ARELHO,Estrada da Relvinha ,2,0,2,1,0,0,1,39.387182,-9.195134,39.387182°N 9.195134°W,"39°23,2320'N 9°11,7060'W ","39° 23' 13,92'' N 9° 11' 42,36'' W ",1770641160000,33 - Em Curso,Intervenções em Infraestruturas e vias de comunicação,26628559,-9.195134,39.387182,20260106567,ARELHO,Lisboa e Vale do Tejo,143,2026-01-23T12:12:00Z,2026-01-23,Em Curso,3315,0,1,2,Curso,Óbidos,Leiria,Centro,-9.195134,39.387182,Inundação de estruturas ou superfícies por precipitação intensa
39255353,20260107356,6,Em Curso,Em Curso,1,Reduzida,23/01/2026 14:20,1769178000000,2026-01-23,14:20,2026,17/22:26,24386,---,3315,3,Riscos Mistos,3,"Comprometimento total ou parcial de segurança, serviços ou estruturas",15,Inundação de estruturas ou superfícies por precipitação intensa,3315 - Inundação de estruturas ou superfícies por precipitação intensa,4,Lisboa e Vale do Tejo,16,Oeste,143,Óbidos,101210,"Santa Maria, São Pedro e Sobral da Lagoa",Óbidos,Estrada da Brogueira - Nadadouro,1,0,1,1,0,0,1,39.395854,-9.173283,39.395854°N 9.173283°W,"39°23,7540'N 9°10,3980'W ","39° 23' 45,24'' N 9° 10' 23,88'' W ",1770641160000,33 - Em Curso,Intervenções em Infraestruturas e vias de comunicação,26629348,-9.173283,39.395854,20260107356,Óbidos,Lisboa e Vale do Tejo,143,2026-01-23T14:20:00Z,2026-01-23,Em Curso,3315,0,1,1,Curso,Óbidos,Leiria,Centro,-9.173283,39.395854,Inundação de estruturas ou superfícies por precipitação intensa
39255354,20260110211,6,Em Curso,Em Curso,3,Elevada,24/01/2026 00:01,1769212860000,2026-01-24,00:01,2026,17/12:45,23805,---,1101,1,Riscos Naturais,1,Fenómenos Naturais,1,Cheia,1101 - Cheia,4,Lisboa e Vale do Tejo,18,Lezíria do Tejo,199,Almeirim,140301,Almeirim,PEECBT, --- ,0,0,0,0,0,0,0,39.187436,-8.635002,39.187436°N 8.635002°W,"39°11,2440'N 8°38,1000'W ","39° 11' 14,64'' N 8° 38' 6,00'' W ",1770641160000,11 - Em Curso,Outras ocorrências de proteção e socorro,26632203,-8.635002,39.187436,20260110211,PEECBT,Lisboa e Vale do Tejo,199,2026-01-24T00:01:00Z,2026-01-24,Em Curso,1101,0,0,0,Curso,Almeirim,Santarém,Alentejo,-8.635002,39.187436,Cheia
39255355,20260110646,6,Em Curso,Em Curso,3,Elevada,24/01/2026 00:01,1769212860000,2026-01-24,00:01,2026,17/12:45,23805,---,1101,1,Riscos Naturais,1,Fenómenos Naturais,1,Cheia,1101 - Cheia,4,Lisboa e Vale do Tejo,17,Médio Tejo,216,Vila Nova da Barquinha,142002,Praia do Ribatejo,CSREPC Médio Tejo, --- ,19,0,19,12,0,0,2,39.468074,-8.364354,39.468074°N 8.364354°W,"39°28,0860'N 8°21,8640'W ","39° 28' 5,16'' N 8° 21' 51,84'' W ",1770641160000,11 - Em Curso,Outras ocorrências de proteção e socorro,26632638,-8.364354,39.468074,20260110646,CSREPC Médio Tejo,Lisboa e Vale do Tejo,216,2026-01-24T00:01:00Z,2026-01-24,Em Curso,1101,0,12,19,Curso,Vila Nova Da Barquinha,Santarém,Centro,-8.364354,39.468074,Cheia
39255356,20260133180,6,Em Curso,Em Curso,3,Elevada,28/01/2026 05:45,1769579100000,2026-01-28,05:45,2026,12/07:01,17701,---,1103,1,Riscos Naturais,1,Fenómenos Naturais,3,Ventos fortes,1103 - Ventos fortes,3,Centro,12,Região de Leiria,146,Pombal,101509,Pombal,POMBAL,PCO Pombal,21,0,21,11,0,0,4,39.910371,-8.62781,39.910371°N 8.627810°W,"39°54,6240'N 8°37,6680'W ","39° 54' 37,44'' N 8° 37' 40,08'' W ",1770641160000,11 - Em Curso,Outras ocorrências de proteção e socorro,26655173,-8.62781,39.910371,20260133180,POMBAL,Centro,146,2026-01-28T05:45:00Z,2026-01-28,Em Curso,1103,0,11,21,Curso,Pombal,Leiria,Centro,-8.62781,39.910371,Ventos fortes
39255357,20260133248,6,Em Curso,Em Curso,3,Elevada,28/01/2026 05:55,1769579700000,2026-01-28,05:55,2026,12/06:51,17691,---,1103,1,Riscos Naturais,1,Fenómenos Naturais,3,Ventos fortes,1103 - Ventos fortes,3,Centro,12,Região de Leiria,140,Leiria,100933,"Leiria, Pousos, Barreira e Cortes",Leiria,PCO Leiria,244,0,244,69,0,0,4,39.741332,-8.800295,39.741332°N 8.800295°W,"39°44,4780'N 8°48,0180'W ","39° 44' 28,68'' N 8° 48' 1,08'' W ",1770641160000,11 - Em Curso,Outras ocorrências de proteção e socorro,26655241,-8.800295,39.741332,20260133248,Leiria,Centro,140,2026-01-28T05:55:00Z,2026-01-28,Em Curso,1103,0,69,244,Curso,Leiria,Leiria,Centro,-8.800295,39.741332,Ventos fortes
39255358,20260133872,6,Em Curso,Em Curso,3,Elevada,28/01/2026 06:50,1769583000000,2026-01-28,06:50,2026,12/05:56,17636,---,1103,1,Riscos Naturais,1,Fenómenos Naturais,3,Ventos fortes,1103 - Ventos fortes,3,Centro,11,Região de Coimbra,85,Soure,061509,Soure,CB Soure,CB Soure,0,0,0,0,0,0,0,40.053098,-8.612815,40.053098°N 8.612815°W,"40°3,1860'N 8°36,7680'W ","40° 3' 11,16'' N 8° 36' 46,08'' W ",1770641160000,11 - Em Curso,Outras ocorrências de proteção e socorro,26655865,-8.612815,40.053098,20260133872,CB Soure,Centro,85,2026-01-28T06:50:00Z,2026-01-28,Em Curso,1103,0,0,0,Curso,Soure,Coimbra,Centro,-8.612815,40.053098,Ventos fortes
39255359,20260134172,6,Em Curso,Em Curso,3,Elevada,28/01/2026 07:20,1769584800000,2026-01-28,07:20,2026,12/05:26,17606,---,1103,1,Riscos Naturais,1,Fenómenos Naturais,3,Ventos fortes,1103 - Ventos fortes,4,Lisboa e Vale do Tejo,17,Médio Tejo,217,Ourém,142115,Nossa Senhora da Piedade,Concelho de Ourém, --- ,91,0,91,29,0,0,9,39.672187,-8.579381,39.672187°N 8.579381°W,"39°40,3320'N 8°34,7640'W ","39° 40' 19,92'' N 8° 34' 45,84'' W ",1770641160000,11 - Em Curso,Outras ocorrências de proteção e socorro,26656165,-8.579381,39.672187,20260134172,Concelho de Ourém,Lisboa e Vale do Tejo,217,2026-01-28T07:20:00Z,2026-01-28,Em Curso,1103,0,29,91,Curso,Ourém,Santarém,Centro,-8.579381,39.672187,Ventos fortes
39255360,20260135107,6,Em Curso,Em Curso,3,Elevada,28/01/2026 08:00,1769587200000,2026-01-28,08:00,2026,12/04:46,17566,---,1103,1,Riscos Naturais,1,Fenómenos Naturais,3,Ventos fortes,1103 - Ventos fortes,4,Lisboa e Vale do Tejo,17,Médio Tejo,214,Tomar,141821,São João Baptista e Santa Maria Dos Olivais,Concelho de Tomar, --- ,23,0,23,6,0,0,2,39.602187,-8.405552,39.602187°N 8.405552°W,"39°36,1320'N 8°24,3360'W ","39° 36' 7,92'' N 8° 24' 20,16'' W ",1770641160000,11 - Em Curso,Outras ocorrências de proteção e socorro,26657100,-8.405552,39.602187,20260135107,Concelho de Tomar,Lisboa e Vale do Tejo,214,2026-01-28T08:00:00Z,2026-01-28,Em Curso,1103,0,6,23,Curso,Tomar,Santarém,Centro,-8.405552,39.602187,Ventos fortes
39255361,20260135208,6,Em Curso,Em Curso,3,Elevada,28/01/2026 08:41,1769589660000,2026-01-28,08:41,2026,12/04:05,17525,---,1103,1,Riscos Naturais,1,Fenómenos Naturais,3,Ventos fortes,1103 - Ventos fortes,4,Lisboa e Vale do Tejo,17,Médio Tejo,207,Ferreira do Zêzere,141106,Ferreira do Zêzere,Concelho de Ferreira do Zêzere, --- ,83,0,83,34,1,0,6,39.695169,-8.290499,39.695169°N 8.290499°W,"39°41,7120'N 8°17,4300'W ","39° 41' 42,72'' N 8° 17' 25,80'' W ",1770641160000,11 - Em Curso,Outras ocorrências de proteção e socorro,26657201,-8.290499,39.695169,20260135208,Concelho de Ferreira do Zêzere,Lisboa e Vale do Tejo,207,2026-01-28T08:41:00Z,2026-01-28,Em Curso,1103,0,34,83,Curso,Ferreira Do Zêzere,Santarém,Centro,-8.290499,39.695169,Ventos fortes
39255362,20260135390,6,Em Curso,Em Curso,1,Reduzida,28/01/2026 08:55,1769590500000,2026-01-28,08:55,2026,12/03:51,17511,---,1103,1,Riscos Naturais,1,Fenómenos Naturais,3,Ventos fortes,1103 - Ventos fortes,4,Lisboa e Vale do Tejo,17,Médio Tejo,204,Constância,140801,Constância,Concelho de Constância, --- ,0,0,0,0,0,0,0,39.476237,-8.334164,39.476237°N 8.334164°W,"39°28,5720'N 8°20,0520'W ","39° 28' 34,32'' N 8° 20' 3,12'' W ",1770641160000,11 - Em Curso,Outras ocorrências de proteção e socorro,26657383,-8.334164,39.476237,20260135390,Concelho de Constância,Lisboa e Vale do Tejo,204,2026-01-28T08:55:00Z,2026-01-28,Em Curso,1103,0,0,0,Curso,Constância,Santarém,Centro,-8.334164,39.476237,Ventos fortes
39255363,20260135401,6,Em Curso,Em Curso,3,Elevada,28/01/2026 08:56,1769590560000,2026-01-28,08:56,2026,12/03:50,17510,---,1103,1,Riscos Naturais,1,Fenómenos Naturais,3,Ventos fortes,1103 - Ventos fortes,4,Lisboa e Vale do Tejo,17,Médio Tejo,216,Vila Nova da Barquinha,142006,Vila Nova da Barquinha,Concelho de Vila Nova da Barquinha, --- ,1,0,1,0,0,0,1,39.467655,-8.428664,39.467655°N 8.428664°W,"39°28,0620'N 8°25,7220'W ","39° 28' 3,72'' N 8° 25' 43,32'' W ",1770641160000,11 - Em Curso,Outras ocorrências de proteção e socorro,26657394,-8.428664,39.467655,20260135401,Concelho de Vila Nova da Barquinha,Lisboa e Vale do Tejo,216,2026-01-28T08:56:00Z,2026-01-28,Em Curso,1103,0,0,1,Curso,Vila Nova Da Barquinha,Santarém,Centro,-8.428664,39.467655,Ventos fortes
39255364,20260135408,6,Em Curso,Em Curso,3,Elevada,28/01/2026 08:57,1769590620000,2026-01-28,08:57,2026,12/03:49,17509,---,1103,1,Riscos Naturais,1,Fenómenos Naturais,3,Ventos fortes,1103 - Ventos fortes,4,Lisboa e Vale do Tejo,17,Médio Tejo,215,Torres Novas,141920,"Torres Novas (Santa Maria, Salvador e Santiago)",Concelho de Torres Novas, --- ,0,0,0,0,0,0,0,39.476394,-8.539335,39.476394°N 8.539335°W,"39°28,5840'N 8°32,3580'W ","39° 28' 35,04'' N 8° 32' 21,48'' W ",1770641160000,11 - Em Curso,Outras ocorrências de proteção e socorro,26657401,-8.539335,39.476394,20260135408,Concelho de Torres Novas,Lisboa e Vale do Tejo,215,2026-01-28T08:57:00Z,2026-01-28,Em Curso,1103,0,0,0,Curso,Torres Novas,Santarém,Centro,-8.539335,39.476394,Ventos fortes
39255365,20260135421,6,Em Curso,Em Curso,3,Elevada,28/01/2026 08:58,1769590680000,2026-01-28,08:58,2026,12/03:48,17508,---,1103,1,Riscos Naturais,1,Fenómenos Naturais,3,Ventos fortes,1103 - Ventos fortes,4,Lisboa e Vale do Tejo,17,Médio Tejo,209,Mação,141309,"Mação, Penhascoso e Aboboreira",Concelho de Mação, --- ,7,0,7,3,0,0,3,39.551093,-7.998144,39.551093°N 7.998144°W,"39°33,0660'N 7°59,8860'W ","39° 33' 3,96'' N 7° 59' 53,16'' W ",1770641160000,11 - Em Curso,Outras ocorrências de proteção e socorro,26657414,-7.998144,39.551093,20260135421,Concelho de Mação,Lisboa e Vale do Tejo,209,2026-01-28T08:58:00Z,2026-01-28,Em Curso,1103,0,3,7,Curso,Mação,Santarém,Centro,-7.998144,39.551093,Ventos fortes
39255366,20260135423,6,Em Curso,Em Curso,1,Reduzida,28/01/2026 08:58,1769590680000,2026-01-28,08:58,2026,12/03:48,17508,---,1103,1,Riscos Naturais,1,Fenómenos Naturais,3,Ventos fortes,1103 - Ventos fortes,4,Lisboa e Vale do Tejo,17,Médio Tejo,198,Alcanena,140211,Alcanena e Vila Moreira,Concelho de Alcanena, --- ,4,0,4,1,0,0,1,39.464869,-8.669221,39.464869°N 8.669221°W,"39°27,8940'N 8°40,1520'W ","39° 27' 53,64'' N 8° 40' 9,12'' W ",1770641160000,11 - Em Curso,Outras ocorrências de proteção e socorro,26657416,-8.669221,39.464869,20260135423,Concelho de Alcanena,Lisboa e Vale do Tejo,198,2026-01-28T08:58:00Z,2026-01-28,Em Curso,1103,0,1,4,Curso,Alcanena,Santarém,Centro,-8.669221,39.464869,Ventos fortes
39255367,20260135434,6,Em Curso,Em Curso,3,Elevada,28/01/2026 08:59,1769590740000,2026-01-28,08:59,2026,12/03:47,17507,---,1103,1,Riscos Naturais,1,Fenómenos Naturais,3,Ventos fortes,1103 - Ventos fortes,4,Lisboa e Vale do Tejo,17,Médio Tejo,206,Entroncamento,141001,São João Baptista,Concelho de Entroncamento, --- ,0,0,0,0,0,0,0,39.45447,-8.473382,39.454470°N 8.473382°W,"39°27,2700'N 8°28,4040'W ","39° 27' 16,20'' N 8° 28' 24,24'' W ",1770641160000,11 - Em Curso,Outras ocorrências de proteção e socorro,26657427,-8.473382,39.45447,20260135434,Concelho de Entroncamento,Lisboa e Vale do Tejo,206,2026-01-28T08:59:00Z,2026-01-28,Em Curso,1103,0,0,0,Curso,Entroncamento,Santarém,Centro,-8.473382,39.45447,Ventos fortes
39255368,20260135448,6,Em Curso,Em Curso,3,Elevada,28/01/2026 09:00,1769590800000,2026-01-28,09:00,2026,12/03:46,17506,---,1103,1,Riscos Naturais,1,Fenómenos Naturais,3,Ventos fortes,1103 - Ventos fortes,4,Lisboa e Vale do Tejo,17,Médio Tejo,213,Sardoal,141703,Sardoal,Concelho de Sardoal, --- ,0,0,0,0,0,0,0,39.542479,-8.15551,39.542479°N 8.155510°W,"39°32,5500'N 8°9,3300'W ","39° 32' 33,00'' N 8° 9' 19,80'' W ",1770641160000,11 - Em Curso,Outras ocorrências de proteção e socorro,26657441,-8.15551,39.542479,20260135448,Concelho de Sardoal,Lisboa e Vale do Tejo,213,2026-01-28T09:00:00Z,2026-01-28,Em Curso,1103,0,0,0,Curso,Sardoal,Santarém,Centro,-8.15551,39.542479,Ventos fortes
39255369,20260135458,6,Em Curso,Em Curso,3,Elevada,28/01/2026 09:00,1769590800000,2026-01-28,09:00,2026,12/03:46,17506,---,1103,1,Riscos Naturais,1,Fenómenos Naturais,3,Ventos fortes,1103 - Ventos fortes,4,Lisboa e Vale do Tejo,17,Médio Tejo,197,Abrantes,140120,Abrantes (São Vicente e São João) e Alferrarede,Concelho de Abrantes, --- ,0,0,0,0,0,0,0,39.499466,-8.195112,39.499466°N 8.195112°W,"39°29,9700'N 8°11,7060'W ","39° 29' 58,20'' N 8° 11' 42,36'' W ",1770641160000,11 - Em Curso,Outras ocorrências de proteção e socorro,26657451,-8.195112,39.499466,20260135458,Concelho de Abrantes,Lisboa e Vale do Tejo,197,2026-01-28T09:00:00Z,2026-01-28,Em Curso,1103,0,0,0,Curso,Abrantes,Santarém,Centro,-8.195112,39.499466,Ventos fortes
39255370,20260135618,6,Em Curso,Em Curso,1,Reduzida,28/01/2026 09:09,1769591340000,2026-01-28,09:09,2026,12/03:37,17497,---,3315,3,Riscos Mistos,3,"Comprometimento total ou parcial de segurança, serviços ou estruturas",15,Inundação de estruturas ou superfícies por precipitação intensa,3315 - Inundação de estruturas ou superfícies por precipitação intensa,2,Norte,2,Alto Minho,239,Viana do Castelo,160948,Santa Maria Maior e Monserrate e Meadela,Campo da Agonia,Campo da Agonia,2,0,2,1,0,0,1,41.691365,-8.83684,41.691365°N 8.836840°W,"41°41,4840'N 8°50,2080'W ","41° 41' 29,04'' N 8° 50' 12,48'' W ",1770641160000,33 - Em Curso,Intervenções em Infraestruturas e vias de comunicação,26657611,-8.83684,41.691365,20260135618,Campo da Agonia,Norte,239,2026-01-28T09:09:00Z,2026-01-28,Em Curso,3315,0,1,2,Curso,Viana Do Castelo,Viana Do Castelo,Norte,-8.83684,41.691365,Inundação de estruturas ou superfícies por precipitação intensa
39255371,20260137542,6,Em Curso,Em Curso,3,Elevada,28/01/2026 08:00,1769587200000,2026-01-28,08:00,2026,12/04:46,17566,---,1103,1,Riscos Naturais,1,Fenómenos Naturais,3,Ventos fortes,1103 - Ventos fortes,4,Lisboa e Vale do Tejo,1,Grande Lisboa,157,Oeiras,111013,Carnaxide e Queijas, --- , --- ,0,0,0,0,0,0,0,38.725234,-9.243421,38.725234°N 9.243421°W,"38°43,5120'N 9°14,6040'W ","38° 43' 30,72'' N 9° 14' 36,24'' W ",1770641160000,11 - Em Curso,Outras ocorrências de proteção e socorro,26659535,-9.243421,38.725234,20260137542, --- ,Lisboa e Vale do Tejo,157,2026-01-28T08:00:00Z,2026-01-28,Em Curso,1103,0,0,0,Curso,Oeiras,Lisboa,Área Metropolitana De Lisboa,-9.243421,38.725234,Ventos fortes
39255372,20260138977,6,Em Curso,Em Curso,3,Elevada,28/01/2026 11:00,1769598000000,2026-01-28,11:00,2026,12/01:46,17386,---,1103,1,Riscos Naturais,1,Fenómenos Naturais,3,Ventos fortes,1103 - Ventos fortes,4,Lisboa e Vale do Tejo,17,Médio Tejo,216,Vila Nova da Barquinha,142002,Praia do Ribatejo,Sub-região Médio Tejo, --- ,1,0,1,1,0,0,1,39.485638,-8.357309,39.485638°N 8.357309°W,"39°29,1360'N 8°21,4380'W ","39° 29' 8,16'' N 8° 21' 26,28'' W ",1770641160000,11 - Em Curso,Outras ocorrências de proteção e socorro,26660970,-8.357309,39.485638,20260138977,Sub-região Médio Tejo,Lisboa e Vale do Tejo,216,2026-01-28T11:00:00Z,2026-01-28,Em Curso,1103,0,1,1,Curso,Vila Nova Da Barquinha,Santarém,Centro,-8.357309,39.485638,Ventos fortes
39255373,20260140949,8,Vigilância,Em Conclusão,1,Reduzida,28/01/2026 17:51,1769622660000,2026-01-28,17:51,2026,12/18:55,16975,---,4329,4,Protecção e Assistência a Pessoas e Bens,3,Assistência e Prevenção a actividades humanas,29,"Busca e Resgate Aquático, de Pessoas","4329 - Busca e Resgate Aquático, de Pessoas",3,Centro,12,Região de Leiria,141,Marinha Grande,101002,Vieira de Leiria,Vieira de Leiria, --- ,10,0,10,2,0,0,1,39.8847,-8.9312,39.884700°N 8.931200°W,"39°53,0820'N 8°55,8720'W ","39° 53' 4,92'' N 8° 55' 52,32'' W ",1770641160000,43 - Em Conclusão,Outras ocorrências de proteção e socorro,26662942,-8.9312,39.8847,20260140949,Vieira de Leiria,Centro,141,2026-01-28T17:51:00Z,2026-01-28,Vigilância,4329,0,2,10,Vigilância,Marinha Grande,Leiria,Centro,-8.9312,39.8847,"Busca e Resgate Aquático, de Pessoas"
39255374,20260142426,6,Em Curso,Em Curso,3,Elevada,28/01/2026 04:00,1769572800000,2026-01-28,04:00,2026,12/08:46,17806,---,1103,1,Riscos Naturais,1,Fenómenos Naturais,3,Ventos fortes,1103 - Ventos fortes,3,Centro,12,Região de Leiria,135,Batalha,100401,Batalha,Batalha ,PCO Batalha,43,0,43,9,0,0,3,39.657621,-8.831646,39.657621°N 8.831646°W,"39°39,4560'N 8°49,8960'W ","39° 39' 27,36'' N 8° 49' 53,76'' W ",1770641160000,11 - Em Curso,Outras ocorrências de proteção e socorro,26664419,-8.831646,39.657621,20260142426,Batalha ,Centro,135,2026-01-28T04:00:00Z,2026-01-28,Em Curso,1103,0,9,43,Curso,Batalha,Leiria,Centro,-8.831646,39.657621,Ventos fortes
39255375,20260142434,6,Em Curso,Em Curso,3,Elevada,28/01/2026 04:00,1769572800000,2026-01-28,04:00,2026,12/08:46,17806,---,1103,1,Riscos Naturais,1,Fenómenos Naturais,3,Ventos fortes,1103 - Ventos fortes,3,Centro,12,Região de Leiria,134,Ansião,100309,Ansião,ANSIÃO,PCO Ansião,0,0,0,0,0,0,0,39.907437,-8.43366,39.907437°N 8.433660°W,"39°54,4440'N 8°26,0220'W ","39° 54' 26,64'' N 8° 26' 1,32'' W ",1770641160000,11 - Em Curso,Outras ocorrências de proteção e socorro,26664427,-8.43366,39.907437,20260142434,ANSIÃO,Centro,134,2026-01-28T04:00:00Z,2026-01-28,Em Curso,1103,0,0,0,Curso,Ansião,Leiria,Centro,-8.43366,39.907437,Ventos fortes
39255376,20260142441,6,Em Curso,Em Curso,3,Elevada,28/01/2026 04:00,1769572800000,2026-01-28,04:00,2026,12/08:46,17806,---,1103,1,Riscos Naturais,1,Fenómenos Naturais,3,Ventos fortes,1103 - Ventos fortes,3,Centro,12,Região de Leiria,133,Alvaiázere,100208,Alvaiázere,Alvaiazere,PCO Alvaiázere,53,0,53,15,0,0,3,39.830695,-8.395151,39.830695°N 8.395151°W,"39°49,8420'N 8°23,7120'W ","39° 49' 50,52'' N 8° 23' 42,72'' W ",1770641160000,11 - Em Curso,Outras ocorrências de proteção e socorro,26664434,-8.395151,39.830695,20260142441,Alvaiazere,Centro,133,2026-01-28T04:00:00Z,2026-01-28,Em Curso,1103,0,15,53,Curso,Alvaiázere,Leiria,Centro,-8.395151,39.830695,Ventos fortes
39255377,20260142449,6,Em Curso,Em Curso,3,Elevada,28/01/2026 04:00,1769572800000,2026-01-28,04:00,2026,12/08:46,17806,---,1103,1,Riscos Naturais,1,Fenómenos Naturais,3,Ventos fortes,1103 - Ventos fortes,3,Centro,12,Região de Leiria,141,Marinha Grande,101001,Marinha Grande,Marinha Grande,PCO Marinha Grande,18,0,18,6,0,0,2,39.768006,-8.95516,39.768006°N 8.955160°W,"39°46,0800'N 8°57,3120'W ","39° 46' 4,80'' N 8° 57' 18,72'' W ",1770641160000,11 - Em Curso,Outras ocorrências de proteção e socorro,26664442,-8.95516,39.768006,20260142449,Marinha Grande,Centro,141,2026-01-28T04:00:00Z,2026-01-28,Em Curso,1103,0,6,18,Curso,Marinha Grande,Leiria,Centro,-8.95516,39.768006,Ventos fortes
39255378,20260142455,6,Em Curso,Em Curso,3,Elevada,28/01/2026 04:00,1769572800000,2026-01-28,04:00,2026,12/08:46,17806,---,1103,1,Riscos Naturais,1,Fenómenos Naturais,3,Ventos fortes,1103 - Ventos fortes,3,Centro,12,Região de Leiria,144,Pedrógão Grande,101302,Pedrógão Grande,Pedrogão Grande,PCO Pedrogão Grande,40,0,40,17,0,0,2,39.916835,-8.144807,39.916835°N 8.144807°W,"39°55,0080'N 8°8,6880'W ","39° 55' 0,48'' N 8° 8' 41,28'' W ",1770641160000,11 - Em Curso,Outras ocorrências de proteção e socorro,26664448,-8.144807,39.916835,20260142455,Pedrogão Grande,Centro,144,2026-01-28T04:00:00Z,2026-01-28,Em Curso,1103,0,17,40,Curso,Pedrógão Grande,Leiria,Centro,-8.144807,39.916835,Ventos fortes
39255379,20260142459,6,Em Curso,Em Curso,3,Elevada,28/01/2026 04:00,1769572800000,2026-01-28,04:00,2026,12/08:46,17806,---,1103,1,Riscos Naturais,1,Fenómenos Naturais,3,Ventos fortes,1103 - Ventos fortes,3,Centro,12,Região de Leiria,139,Figueiró Dos Vinhos,100806,Figueiró Dos Vinhos e Bairradas,Figueiró dos Vinhos,PCO Figueiró dos Vinhos,22,0,22,3,0,0,1,39.886269,-8.269227,39.886269°N 8.269227°W,"39°53,1780'N 8°16,1520'W ","39° 53' 10,68'' N 8° 16' 9,12'' W ",1770641160000,11 - Em Curso,Outras ocorrências de proteção e socorro,26664452,-8.269227,39.886269,20260142459,Figueiró dos Vinhos,Centro,139,2026-01-28T04:00:00Z,2026-01-28,Em Curso,1103,0,3,22,Curso,Figueiró Dos Vinhos,Leiria,Centro,-8.269227,39.886269,Ventos fortes
39255380,20260143255,6,Em Curso,Em Curso,3,Elevada,28/01/2026 04:00,1769572800000,2026-01-28,04:00,2026,12/08:46,17806,---,1103,1,Riscos Naturais,1,Fenómenos Naturais,3,Ventos fortes,1103 - Ventos fortes,3,Centro,12,Região de Leiria,147,Porto de Mós,101614,Porto de Mós - São João Baptista e São Pedro,Porto de Mós,PCO Porto de Mós,0,0,0,0,0,0,0,39.604144,-8.823531,39.604144°N 8.823531°W,"39°36,2460'N 8°49,4100'W ","39° 36' 14,76'' N 8° 49' 24,60'' W ",1770641160000,11 - Em Curso,Outras ocorrências de proteção e socorro,26665248,-8.823531,39.604144,20260143255,Porto de Mós,Centro,147,2026-01-28T04:00:00Z,2026-01-28,Em Curso,1103,0,0,0,Curso,Porto De Mós,Leiria,Centro,-8.823531,39.604144,Ventos fortes
39255381,20260143278,6,Em Curso,Em Curso,3,Elevada,28/01/2026 04:00,1769572800000,2026-01-28,04:00,2026,12/08:46,17806,---,1103,1,Riscos Naturais,1,Fenómenos Naturais,3,Ventos fortes,1103 - Ventos fortes,3,Centro,12,Região de Leiria,138,Castanheira de Pêra,100703,Castanheira de Pêra e Coentral,CASTANHEIRA DE PERA,PCO Castanheira de Pera,0,0,0,0,0,0,0,40.005971,-8.209236,40.005971°N 8.209236°W,"40°0,3600'N 8°12,5520'W ","40° 0' 21,60'' N 8° 12' 33,12'' W ",1770641160000,11 - Em Curso,Outras ocorrências de proteção e socorro,26665271,-8.209236,40.005971,20260143278,CASTANHEIRA DE PERA,Centro,138,2026-01-28T04:00:00Z,2026-01-28,Em Curso,1103,0,0,0,Curso,Castanheira De Pêra,Leiria,Centro,-8.209236,40.005971,Ventos fortes
39255382,20260148785,6,Em Curso,Em Curso,0,N/A,28/01/2026 20:45,1769633100000,2026-01-28,20:45,2026,12/16:01,16801,---,3309,3,Riscos Mistos,3,"Comprometimento total ou parcial de segurança, serviços ou estruturas",9,Desabamento de estruturas edificadas,3309 - Desabamento de estruturas edificadas,3,Centro,11,Região de Coimbra,84,Penela,061407,"São Miguel, Santa Eufémia e Rabaçal",São Paulo, --- ,1,0,1,1,0,0,1,40.016599,-8.387644,40.016599°N 8.387644°W,"40°0,9960'N 8°23,2560'W ","40° 0' 59,76'' N 8° 23' 15,36'' W ",1770641160000,33 - Em Curso,Intervenções em Infraestruturas e vias de comunicação,26670778,-8.387644,40.016599,20260148785,São Paulo,Centro,84,2026-01-28T20:45:00Z,2026-01-28,Em Curso,3309,0,1,1,Curso,Penela,Coimbra,Centro,-8.387644,40.016599,Desabamento de estruturas edificadas
39255383,20260162245,6,Em Curso,Em Curso,3,Elevada,31/01/2026 19:19,1769887140000,2026-01-31,19:19,2026,9/17:27,12567,---,1101,1,Riscos Naturais,1,Fenómenos Naturais,1,Cheia,1101 - Cheia,3,Centro,11,Região de Coimbra,80,Montemor-o-Velho,061016,Montemor-o-Velho e Gatões,MONTEMOR-O-VELHO, --- ,51,0,51,17,0,0,2,40.169486,-8.684865,40.169486°N 8.684865°W,"40°10,1700'N 8°41,0940'W ","40° 10' 10,20'' N 8° 41' 5,64'' W ",1770641160000,11 - Em Curso,Outras ocorrências de proteção e socorro,26684239,-8.684865,40.169486,20260162245,MONTEMOR-O-VELHO,Centro,80,2026-01-31T19:19:00Z,2026-01-31,Em Curso,1101,0,17,51,Curso,Montemor-o-velho,Coimbra,Centro,-8.684865,40.169486,Cheia
39255384,20260165338,6,Em Curso,Em Curso,1,Reduzida,31/01/2026 08:00,1769846400000,2026-01-31,08:00,2026,9/04:46,13246,---,1101,1,Riscos Naturais,1,Fenómenos Naturais,1,Cheia,1101 - Cheia,3,Centro,11,Região de Coimbra,73,Coimbra,060334,"Sé Nova, Santa Cruz, Almedina e São Bartolomeu",COIMBRA, --- ,7,0,7,5,0,0,1,40.205556,-8.425582,40.205556°N 8.425582°W,"40°12,3360'N 8°25,5360'W ","40° 12' 20,16'' N 8° 25' 32,16'' W ",1770641160000,11 - Em Curso,Outras ocorrências de proteção e socorro,26687332,-8.425582,40.205556,20260165338,COIMBRA,Centro,73,2026-01-31T08:00:00Z,2026-01-31,Em Curso,1101,0,5,7,Curso,Coimbra,Coimbra,Centro,-8.425582,40.205556,Cheia
39255385,20260165349,5,Chegada ao TO,Em Despacho,3,Elevada,31/01/2026 08:00,1769846400000,2026-01-31,08:00,2026,9/04:46,13246,---,1101,1,Riscos Naturais,1,Fenómenos Naturais,1,Cheia,1101 - Cheia,3,Centro,11,Região de Coimbra,85,Soure,061509,Soure,Soure, --- ,13,0,13,8,0,0,1,40.055319,-8.639406,40.055319°N 8.639406°W,"40°3,3180'N 8°38,3640'W ","40° 3' 19,08'' N 8° 38' 21,84'' W ",1770641160000,11 - Em Curso,Outras ocorrências de proteção e socorro,26687343,-8.639406,40.055319,20260165349,Soure,Centro,85,2026-01-31T08:00:00Z,2026-01-31,Chegada Ao to,1101,0,8,13,Chegada Ao to,Soure,Coimbra,Centro,-8.639406,40.055319,Cheia
39255386,20260165861,6,Em Curso,Em Curso,3,Elevada,28/01/2026 04:00,1769572800000,2026-01-28,04:00,2026,12/08:46,17806,---,1103,1,Riscos Naturais,1,Fenómenos Naturais,3,Ventos fortes,1103 - Ventos fortes,3,Centro,12,Região de Leiria,140,Leiria,100933,"Leiria, Pousos, Barreira e Cortes",LEIRIA,Região de Leiria,0,0,0,0,0,0,0,39.749179,-8.802832,39.749179°N 8.802832°W,"39°44,9520'N 8°48,1680'W ","39° 44' 57,12'' N 8° 48' 10,08'' W ",1770641160000,11 - Em Curso,Outras ocorrências de proteção e socorro,26687855,-8.802832,39.749179,20260165861,LEIRIA,Centro,140,2026-01-28T04:00:00Z,2026-01-28,Em Curso,1103,0,0,0,Curso,Leiria,Leiria,Centro,-8.802832,39.749179,Ventos fortes
39255387,20260166978,6,Em Curso,Em Curso,2,Moderada,28/01/2026 05:15,1769577300000,2026-01-28,05:15,2026,12/07:31,17731,---,1103,1,Riscos Naturais,1,Fenómenos Naturais,3,Ventos fortes,1103 - Ventos fortes,3,Centro,15,Beira Baixa,61,Castelo Branco,050205,Castelo Branco,Castelo Branco,Sub-Região da Beira Baixa,7,0,7,3,0,0,1,39.816895,-7.490756,39.816895°N 7.490756°W,"39°49,0140'N 7°29,4480'W ","39° 49' 0,84'' N 7° 29' 26,88'' W ",1770641160000,11 - Em Curso,Outras ocorrências de proteção e socorro,26688972,-7.490756,39.816895,20260166978,Castelo Branco,Centro,61,2026-01-28T05:15:00Z,2026-01-28,Em Curso,1103,0,3,7,Curso,Castelo Branco,Castelo Branco,Centro,-7.490756,39.816895,Ventos fortes
39255388,20260167015,6,Em Curso,Em Curso,1,Reduzida,01/02/2026 18:21,1769970060000,2026-02-01,18:21,2026,8/18:25,11185,---,1101,1,Riscos Naturais,1,Fenómenos Naturais,1,Cheia,1101 - Cheia,2,Norte,2,Alto Minho,236,Ponte da Barca,160628,"Ponte da Barca, V. N. Muía e Paço Vedro Magalhães",Rio Lima - Praia Fluvial,Rio Lima - Praia Fluvial,0,0,0,0,0,0,0,41.808215,-8.42233,41.808215°N 8.422330°W,"41°48,4920'N 8°25,3380'W ","41° 48' 29,52'' N 8° 25' 20,28'' W ",1770641160000,11 - Em Curso,Outras ocorrências de proteção e socorro,26689009,-8.42233,41.808215,20260167015,Rio Lima - Praia Fluvial,Norte,236,2026-02-01T18:21:00Z,2026-02-01,Em Curso,1101,0,0,0,Curso,Ponte Da Barca,Viana Do Castelo,Norte,-8.42233,41.808215,Cheia
39255389,20260169421,5,Chegada ao TO,Em Despacho,2,Moderada,02/02/2026 08:59,1770022740000,2026-02-02,08:59,2026,7/03:47,10307,---,1101,1,Riscos Naturais,1,Fenómenos Naturais,1,Cheia,1101 - Cheia,4,Lisboa e Vale do Tejo,18,Lezíria do Tejo,202,Cartaxo,140609,Cartaxo e Vale da Pinta,PCMUN Cartaxo, --- ,0,0,0,2,0,0,1,39.162909,-8.783497,39.162909°N 8.783497°W,"39°9,7740'N 8°47,0100'W ","39° 9' 46,44'' N 8° 47' 0,60'' W ",1770641160000,11 - Em Curso,Outras ocorrências de proteção e socorro,26691415,-8.783497,39.162909,20260169421,PCMUN Cartaxo,Lisboa e Vale do Tejo,202,2026-02-02T08:59:00Z,2026-02-02,Chegada Ao to,1101,0,2,0,Chegada Ao to,Cartaxo,Santarém,Alentejo,-8.783497,39.162909,Cheia
39255390,20260170096,5,Chegada ao TO,Em Despacho,2,Moderada,02/02/2026 10:18,1770027480000,2026-02-02,10:18,2026,7/02:28,10228,---,1101,1,Riscos Naturais,1,Fenómenos Naturais,1,Cheia,1101 - Cheia,4,Lisboa e Vale do Tejo,18,Lezíria do Tejo,212,Santarém,141633,"Marvila, Ribeira Santarém, S.salvador, S.nicolau",PCMun Santarém, --- ,5,0,5,2,0,0,2,39.238096,-8.688446,39.238096°N 8.688446°W,"39°14,2860'N 8°41,3040'W ","39° 14' 17,16'' N 8° 41' 18,24'' W ",1770641160000,11 - Em Curso,Outras ocorrências de proteção e socorro,26692090,-8.688446,39.238096,20260170096,PCMun Santarém,Lisboa e Vale do Tejo,212,2026-02-02T10:18:00Z,2026-02-02,Chegada Ao to,1101,0,2,5,Chegada Ao to,Santarém,Santarém,Alentejo,-8.688446,39.238096,Cheia
39255391,20260171082,5,Chegada ao TO,Em Despacho,2,Moderada,01/02/2026 22:30,1769985000000,2026-02-01,22:30,2026,8/14:16,10936,---,1101,1,Riscos Naturais,1,Fenómenos Naturais,1,Cheia,1101 - Cheia,4,Lisboa e Vale do Tejo,18,Lezíria do Tejo,150,Azambuja,110304,Azambuja,PCMUN Azambuja, --- ,6,0,6,3,1,0,2,39.067579,-8.874179,39.067579°N 8.874179°W,"39°4,0560'N 8°52,4520'W ","39° 4' 3,36'' N 8° 52' 27,12'' W ",1770641160000,11 - Em Curso,Outras ocorrências de proteção e socorro,26693076,-8.874179,39.067579,20260171082,PCMUN Azambuja,Lisboa e Vale do Tejo,150,2026-02-01T22:30:00Z,2026-02-01,Chegada Ao to,1101,0,3,6,Chegada Ao to,Azambuja,Lisboa,Alentejo,-8.874179,39.067579,Cheia
39255392,20260171274,6,Em Curso,Em Curso,2,Moderada,02/02/2026 12:56,1770036960000,2026-02-02,12:56,2026,7/23:50,10070,---,3313,3,Riscos Mistos,3,"Comprometimento total ou parcial de segurança, serviços ou estruturas",13,Movimento de massa,3313 - Movimento de massa,4,Lisboa e Vale do Tejo,18,Lezíria do Tejo,150,Azambuja,110307,Vila Nova da Rainha,Rio Alenquer, --- ,49,0,49,11,0,0,1,39.048643,-8.946922,39.048643°N 8.946922°W,"39°2,9160'N 8°56,8140'W ","39° 2' 54,96'' N 8° 56' 48,84'' W ",1770641160000,33 - Em Curso,Intervenções em Infraestruturas e vias de comunicação,26693268,-8.946922,39.048643,20260171274,Rio Alenquer,Lisboa e Vale do Tejo,150,2026-02-02T12:56:00Z,2026-02-02,Em Curso,3313,0,11,49,Curso,Azambuja,Lisboa,Alentejo,-8.946922,39.048643,Movimento de massa
39255393,20260173131,5,Despacho de 1º Alerta,Em Despacho,2,Moderada,02/02/2026 11:01,1770030060000,2026-02-02,11:01,2026,7/01:45,10185,---,1101,1,Riscos Naturais,1,Fenómenos Naturais,1,Cheia,1101 - Cheia,4,Lisboa e Vale do Tejo,18,Lezíria do Tejo,200,Alpiarça,140401,Alpiarça,PCMUN ALPIARÇA, --- ,0,0,0,0,0,0,0,39.262022,-8.595402,39.262022°N 8.595402°W,"39°15,7200'N 8°35,7240'W ","39° 15' 43,20'' N 8° 35' 43,44'' W ",1770641160000,11 - Em Despacho,Outras ocorrências de proteção e socorro,26695125,-8.595402,39.262022,20260173131,PCMUN ALPIARÇA,Lisboa e Vale do Tejo,200,2026-02-02T11:01:00Z,2026-02-02,Despacho De 1º Alerta,1101,0,0,0,Despacho De 1º Alerta,Alpiarça,Santarém,Alentejo,-8.595402,39.262022,Cheia
39255394,20260173163,5,Chegada ao TO,Em Despacho,2,Moderada,02/02/2026 17:30,1770053400000,2026-02-02,17:30,2026,7/19:16,9796,---,1101,1,Riscos Naturais,1,Fenómenos Naturais,1,Cheia,1101 - Cheia,4,Lisboa e Vale do Tejo,18,Lezíria do Tejo,199,Almeirim,140301,Almeirim,PCMUN ALMEIRIM, --- ,3,0,3,2,0,0,2,39.187436,-8.635002,39.187436°N 8.635002°W,"39°11,2440'N 8°38,1000'W ","39° 11' 14,64'' N 8° 38' 6,00'' W ",1770641160000,11 - Em Curso,Outras ocorrências de proteção e socorro,26695157,-8.635002,39.187436,20260173163,PCMUN ALMEIRIM,Lisboa e Vale do Tejo,199,2026-02-02T17:30:00Z,2026-02-02,Chegada Ao to,1101,0,2,3,Chegada Ao to,Almeirim,Santarém,Alentejo,-8.635002,39.187436,Cheia
39255395,20260176003,6,Em Curso,Em Curso,1,Reduzida,03/02/2026 09:48,1770112080000,2026-02-03,09:48,2026,6/02:58,8818,---,3315,3,Riscos Mistos,3,"Comprometimento total ou parcial de segurança, serviços ou estruturas",15,Inundação de estruturas ou superfícies por precipitação intensa,3315 - Inundação de estruturas ou superfícies por precipitação intensa,2,Norte,2,Alto Minho,239,Viana do Castelo,160904,Anha,Rua Nova       ,Rua Nova       ,0,0,0,0,0,0,0,41.663897,-8.804129,41.663897°N 8.804129°W,"41°39,8340'N 8°48,2460'W ","41° 39' 50,04'' N 8° 48' 14,76'' W ",1770641160000,33 - Em Curso,Intervenções em Infraestruturas e vias de comunicação,26697997,-8.804129,41.663897,20260176003,Rua Nova       ,Norte,239,2026-02-03T09:48:00Z,2026-02-03,Em Curso,3315,0,0,0,Curso,Viana Do Castelo,Viana Do Castelo,Norte,-8.804129,41.663897,Inundação de estruturas ou superfícies por precipitação intensa
39255396,20260176219,6,Em Curso,Em Curso,3,Elevada,31/01/2026 08:00,1769846400000,2026-01-31,08:00,2026,9/04:46,13246,---,1101,1,Riscos Naturais,1,Fenómenos Naturais,1,Cheia,1101 - Cheia,4,Lisboa e Vale do Tejo,1,Grande Lisboa,157,Oeiras,111013,Carnaxide e Queijas, --- , --- ,0,0,0,0,0,0,0,38.725234,-9.243421,38.725234°N 9.243421°W,"38°43,5120'N 9°14,6040'W ","38° 43' 30,72'' N 9° 14' 36,24'' W ",1770641160000,11 - Em Curso,Outras ocorrências de proteção e socorro,26698213,-9.243421,38.725234,20260176219, --- ,Lisboa e Vale do Tejo,157,2026-01-31T08:00:00Z,2026-01-31,Em Curso,1101,0,0,0,Curso,Oeiras,Lisboa,Área Metropolitana De Lisboa,-9.243421,38.725234,Cheia
39255397,20260177262,5,Despacho de 1º Alerta,Em Despacho,2,Moderada,03/02/2026 09:00,1770109200000,2026-02-03,09:00,2026,6/03:46,8866,---,1101,1,Riscos Naturais,1,Fenómenos Naturais,1,Cheia,1101 - Cheia,4,Lisboa e Vale do Tejo,18,Lezíria do Tejo,208,Golegã,141202,Golegã,GOLEGÃ,PCMun Golegã,1,0,1,1,0,0,1,39.406562,-8.472127,39.406562°N 8.472127°W,"39°24,3960'N 8°28,3260'W ","39° 24' 23,76'' N 8° 28' 19,56'' W ",1770641160000,11 - Em Despacho,Outras ocorrências de proteção e socorro,26699256,-8.472127,39.406562,20260177262,GOLEGÃ,Lisboa e Vale do Tejo,208,2026-02-03T09:00:00Z,2026-02-03,Despacho De 1º Alerta,1101,0,1,1,Despacho De 1º Alerta,Golegã,Santarém,Alentejo,-8.472127,39.406562,Cheia
39255398,20260181619,6,Em Curso,Em Curso,2,Moderada,04/02/2026 07:35,1770190500000,2026-02-04,07:35,2026,5/05:11,7511,---,1101,1,Riscos Naturais,1,Fenómenos Naturais,1,Cheia,1101 - Cheia,5,Alentejo,19,Alentejo Litoral,230,Sines,151302,Porto Covo,PORTO COVO,E.M 1109 São Torpes / Porto Covo,1,0,1,1,0,0,1,37.852205,-8.788684,37.852205°N 8.788684°W,"37°51,1320'N 8°47,3220'W ","37° 51' 7,92'' N 8° 47' 19,32'' W ",1770641160000,11 - Em Curso,Outras ocorrências de proteção e socorro,26703619,-8.788684,37.852205,20260181619,PORTO COVO,Alentejo,230,2026-02-04T07:35:00Z,2026-02-04,Em Curso,1101,0,1,1,Curso,Sines,Setúbal,Alentejo,-8.788684,37.852205,Cheia
39255399,20260182752,6,Em Curso,Em Curso,3,Elevada,04/02/2026 10:41,1770201660000,2026-02-04,10:41,2026,5/02:05,7325,---,1101,1,Riscos Naturais,1,Fenómenos Naturais,1,Cheia,1101 - Cheia,6,Algarve,23,Algarve,103,Alcoutim,080206,Alcoutim e Pereiro,Guerreiros do Rio,Guerreiros do Rio,10,0,10,5,0,0,4,37.44537,-7.544111,37.445370°N 7.544111°W,"37°26,7240'N 7°32,6460'W ","37° 26' 43,44'' N 7° 32' 38,76'' W ",1770641160000,11 - Em Curso,Outras ocorrências de proteção e socorro,26704752,-7.544111,37.44537,20260182752,Guerreiros do Rio,Algarve,103,2026-02-04T10:41:00Z,2026-02-04,Em Curso,1101,0,5,10,Curso,Alcoutim,Faro,Algarve,-7.544111,37.44537,Cheia
39255400,20260183179,6,Em Curso,Em Curso,3,Elevada,04/02/2026 11:29,1770204540000,2026-02-04,11:29,2026,5/01:17,7277,---,1103,1,Riscos Naturais,1,Fenómenos Naturais,3,Ventos fortes,1103 - Ventos fortes,3,Centro,11,Região de Coimbra,74,Condeixa-a-Nova,060411,Condeixa-a-Velha e Condeixa-a-Nova,CONDEIXA A NOVA, --- ,22,0,22,7,0,0,1,40.113472,-8.503774,40.113472°N 8.503774°W,"40°6,8100'N 8°30,2280'W ","40° 6' 48,60'' N 8° 30' 13,68'' W ",1770641160000,11 - Em Curso,Outras ocorrências de proteção e socorro,26705179,-8.503774,40.113472,20260183179,CONDEIXA A NOVA,Centro,74,2026-02-04T11:29:00Z,2026-02-04,Em Curso,1103,0,7,22,Curso,Condeixa-a-nova,Coimbra,Centro,-8.503774,40.113472,Ventos fortes
39255401,20260184805,6,Em Curso,Em Curso,1,Reduzida,04/02/2026 15:02,1770217320000,2026-02-04,15:02,2026,5/21:44,7064,---,1101,1,Riscos Naturais,1,Fenómenos Naturais,1,Cheia,1101 - Cheia,2,Norte,2,Alto Minho,234,Monção,160438,Monção e Troviscoso,Parque das Caldas,Parque das Caldas,0,0,0,0,0,0,0,42.070697,-8.465144,42.070697°N 8.465144°W,"42°4,2420'N 8°27,9060'W ","42° 4' 14,52'' N 8° 27' 54,36'' W ",1770641160000,11 - Em Curso,Outras ocorrências de proteção e socorro,26706805,-8.465144,42.070697,20260184805,Parque das Caldas,Norte,234,2026-02-04T15:02:00Z,2026-02-04,Em Curso,1101,0,0,0,Curso,Monção,Viana Do Castelo,Norte,-8.465144,42.070697,Cheia
39255402,20260185621,6,Em Curso,Em Curso,3,Elevada,04/02/2026 17:04,1770224640000,2026-02-04,17:04,2026,5/19:42,6942,---,3315,3,Riscos Mistos,3,"Comprometimento total ou parcial de segurança, serviços ou estruturas",15,Inundação de estruturas ou superfícies por precipitação intensa,3315 - Inundação de estruturas ou superfícies por precipitação intensa,4,Lisboa e Vale do Tejo,16,Oeste,136,Bombarral,100503,Roliça,Paúl,EN8 Km 75.5,1,0,1,1,0,0,1,39.294392,-9.164762,39.294392°N 9.164762°W,"39°17,6640'N 9°9,8880'W ","39° 17' 39,84'' N 9° 9' 53,28'' W ",1770641160000,33 - Em Curso,Intervenções em Infraestruturas e vias de comunicação,26707621,-9.164762,39.294392,20260185621,Paúl,Lisboa e Vale do Tejo,136,2026-02-04T17:04:00Z,2026-02-04,Em Curso,3315,0,1,1,Curso,Bombarral,Leiria,Centro,-9.164762,39.294392,Inundação de estruturas ou superfícies por precipitação intensa
39255403,20260185867,6,Em Curso,Em Curso,3,Elevada,04/02/2026 10:40,1770201600000,2026-02-04,10:40,2026,5/02:06,7326,---,1101,1,Riscos Naturais,1,Fenómenos Naturais,1,Cheia,1101 - Cheia,5,Alentejo,19,Alentejo Litoral,30,Odemira,021120,São Salvador e Santa Maria,Odemira,Concelho Odemira,0,0,0,0,0,0,0,37.614761,-8.604633,37.614761°N 8.604633°W,"37°36,8880'N 8°36,2760'W ","37° 36' 53,28'' N 8° 36' 16,56'' W ",1770641160000,11 - Em Curso,Outras ocorrências de proteção e socorro,26707867,-8.604633,37.614761,20260185867,Odemira,Alentejo,30,2026-02-04T10:40:00Z,2026-02-04,Em Curso,1101,0,0,0,Curso,Odemira,Beja,Alentejo,-8.604633,37.614761,Cheia
39255404,20260188614,8,Em Conclusão,Em Conclusão,3,Elevada,05/02/2026 06:49,1770274140000,2026-02-05,06:49,2026,4/05:57,6117,---,1125,1,Riscos Naturais,1,Fenómenos Naturais,25,Enxurrada/Aluvião,1125 - Enxurrada/Aluvião,5,Alentejo,20,Alto Alentejo,177,Portalegre,121411,Sé e São Lourenço,PORTALEGRE,Avenida de Santo António,5,0,5,3,0,0,3,39.303748,-7.424257,39.303748°N 7.424257°W,"39°18,2220'N 7°25,4580'W ","39° 18' 13,32'' N 7° 25' 27,48'' W ",1770641160000,11 - Em Conclusão,Outras ocorrências de proteção e socorro,26710614,-7.424257,39.303748,20260188614,PORTALEGRE,Alentejo,177,2026-02-05T06:49:00Z,2026-02-05,Em resolução/conclusão,1125,0,3,5,Resolução/Conclusão,Portalegre,Portalegre,Alentejo,-7.424257,39.303748,Enxurrada/Aluvião
39255405,20260188753,6,Em Curso,Em Curso,1,Reduzida,05/02/2026 07:00,1770274800000,2026-02-05,07:00,2026,4/05:46,6106,---,3315,3,Riscos Mistos,3,"Comprometimento total ou parcial de segurança, serviços ou estruturas",15,Inundação de estruturas ou superfícies por precipitação intensa,3315 - Inundação de estruturas ou superfícies por precipitação intensa,3,Centro,11,Região de Coimbra,79,Miranda do Corvo,060902,Miranda do Corvo,MIRANDA DO CORVO,R. Nelo Paiva,0,0,0,0,0,0,1,40.09407,-8.339499,40.094070°N 8.339499°W,"40°5,6460'N 8°20,3700'W ","40° 5' 38,76'' N 8° 20' 22,20'' W ",1770641160000,33 - Em Curso,Intervenções em Infraestruturas e vias de comunicação,26710753,-8.339499,40.09407,20260188753,MIRANDA DO CORVO,Centro,79,2026-02-05T07:00:00Z,2026-02-05,Em Curso,3315,0,0,0,Curso,Miranda Do Corvo,Coimbra,Centro,-8.339499,40.09407,Inundação de estruturas ou superfícies por precipitação intensa
39255406,20260188814,8,Vigilância,Em Conclusão,3,Elevada,05/02/2026 05:15,1770268500000,2026-02-05,05:15,2026,4/07:31,6211,---,1115,1,Riscos Naturais,1,Fenómenos Naturais,15,Inundação por galgamento costeiro,1115 - Inundação por galgamento costeiro,4,Lisboa e Vale do Tejo,1,Grande Lisboa,157,Oeiras,111014,"Oeiras e S. Julião da Barra, Paço de Arcos e Caxias",Caxias,Estação Ferroviária,0,0,0,0,0,0,0,38.698731,-9.2744509999999991,38.698731°N 9.274451°W,"38°41,9220'N 9°16,4700'W ","38° 41' 55,32'' N 9° 16' 28,20'' W ",1770641160000,11 - Em Conclusão,Outras ocorrências de proteção e socorro,26710814,-9.2744509999999991,38.698731,20260188814,Caxias,Lisboa e Vale do Tejo,157,2026-02-05T05:15:00Z,2026-02-05,Vigilância,1115,0,0,0,Vigilância,Oeiras,Lisboa,Área Metropolitana De Lisboa,-9.2744509999999991,38.698731,Inundação por galgamento costeiro
39255407,20260189057,6,Em Curso,Em Curso,3,Elevada,05/02/2026 08:15,1770279300000,2026-02-05,08:15,2026,4/04:31,6031,---,1101,1,Riscos Naturais,1,Fenómenos Naturais,1,Cheia,1101 - Cheia,5,Alentejo,20,Alto Alentejo,172,Gavião,120906,Gavião e Atalaia, --- ,RIO TEJO,1,0,1,1,0,0,1,39.457294,-7.92441,39.457294°N 7.924410°W,"39°27,4380'N 7°55,4640'W ","39° 27' 26,28'' N 7° 55' 27,84'' W ",1770641160000,11 - Em Curso,Outras ocorrências de proteção e socorro,26711057,-7.92441,39.457294,20260189057, --- ,Alentejo,172,2026-02-05T08:15:00Z,2026-02-05,Em Curso,1101,0,1,1,Curso,Gavião,Portalegre,Alentejo,-7.92441,39.457294,Cheia
39255408,20260189347,6,Em Curso,Em Curso,3,Elevada,04/02/2026 21:56,1770242160000,2026-02-04,21:56,2026,5/14:50,6650,---,1101,1,Riscos Naturais,1,Fenómenos Naturais,1,Cheia,1101 - Cheia,5,Alentejo,19,Alentejo Litoral,222,Grândola,150506,Grândola e Santa Margarida da Serra,GRÂNDOLA,Concelho de Grândola,0,0,0,0,0,0,0,38.173088,-8.5587510000000009,38.173088°N 8.558751°W,"38°10,3860'N 8°33,5280'W ","38° 10' 23,16'' N 8° 33' 31,68'' W ",1770641160000,11 - Em Curso,Outras ocorrências de proteção e socorro,26711347,-8.5587510000000009,38.173088,20260189347,GRÂNDOLA,Alentejo,222,2026-02-04T21:56:00Z,2026-02-04,Em Curso,1101,0,0,0,Curso,Grândola,Setúbal,Alentejo,-8.5587510000000009,38.173088,Cheia
39255409,20260190508,7,Em Resolução,Em Resolução,1,Reduzida,05/02/2026 10:15,1770286500000,2026-02-05,10:15,2026,4/02:31,5911,---,1101,1,Riscos Naturais,1,Fenómenos Naturais,1,Cheia,1101 - Cheia,3,Centro,11,Região de Coimbra,84,Penela,061407,"São Miguel, Santa Eufémia e Rabaçal",Dueça, --- ,1,0,1,1,0,0,1,39.994018,-8.38252,39.994018°N 8.382520°W,"39°59,6400'N 8°22,9500'W ","39° 59' 38,40'' N 8° 22' 57,00'' W ",1770641160000,11 - Em Resolução,Outras ocorrências de proteção e socorro,26712508,-8.38252,39.994018,20260190508,Dueça,Centro,84,2026-02-05T10:15:00Z,2026-02-05,Em resolução/conclusão,1101,0,1,1,Resolução/Conclusão,Penela,Coimbra,Centro,-8.38252,39.994018,Cheia
39255410,20260190881,5,Chegada ao TO,Em Despacho,3,Elevada,05/02/2026 10:00,1770285600000,2026-02-05,10:00,2026,4/02:46,5926,---,3313,3,Riscos Mistos,3,"Comprometimento total ou parcial de segurança, serviços ou estruturas",13,Movimento de massa,3313 - Movimento de massa,3,Centro,15,Beira Baixa,68,Sertã,050911,Pedrógão Pequeno,PEDROGÃO PEQUENO,EN 2 - Pedrogão Pequeno,2,0,2,1,0,0,1,39.913035,-8.132459,39.913035°N 8.132459°W,"39°54,7800'N 8°7,9500'W ","39° 54' 46,80'' N 8° 7' 57,00'' W ",1770641160000,33 - Em Curso,Intervenções em Infraestruturas e vias de comunicação,26712881,-8.132459,39.913035,20260190881,PEDROGÃO PEQUENO,Centro,68,2026-02-05T10:00:00Z,2026-02-05,Chegada Ao to,3313,0,1,2,Chegada Ao to,Sertã,Castelo Branco,Centro,-8.132459,39.913035,Movimento de massa
39255411,20260191143,6,Em Curso,Em Curso,1,Reduzida,05/02/2026 11:43,1770291780000,2026-02-05,11:43,2026,4/01:03,5823,---,3313,3,Riscos Mistos,3,"Comprometimento total ou parcial de segurança, serviços ou estruturas",13,Movimento de massa,3313 - Movimento de massa,2,Norte,2,Alto Minho,234,Monção,160415,Merufe,M1131,M1131,1,0,1,1,0,0,1,42.006987,-8.39524,42.006987°N 8.395240°W,"42°0,4200'N 8°23,7120'W ","42° 0' 25,20'' N 8° 23' 42,72'' W ",1770641160000,33 - Em Curso,Intervenções em Infraestruturas e vias de comunicação,26713143,-8.39524,42.006987,20260191143,M1131,Norte,234,2026-02-05T11:43:00Z,2026-02-05,Em Curso,3313,0,1,1,Curso,Monção,Viana Do Castelo,Norte,-8.39524,42.006987,Movimento de massa
39255412,20260192385,6,Em Curso,Em Curso,1,Reduzida,05/02/2026 14:00,1770300000000,2026-02-05,14:00,2026,4/22:46,5686,---,1101,1,Riscos Naturais,1,Fenómenos Naturais,1,Cheia,1101 - Cheia,3,Centro,11,Região de Coimbra,82,Pampilhosa da Serra,061202,Dornelas do Zêzere,DORNELAS DO ZÊZERE, --- ,0,0,0,0,0,0,1,40.107149,-7.754278,40.107149°N 7.754278°W,"40°6,4260'N 7°45,2580'W ","40° 6' 25,56'' N 7° 45' 15,48'' W ",1770641160000,11 - Em Curso,Outras ocorrências de proteção e socorro,26714385,-7.754278,40.107149,20260192385,DORNELAS DO ZÊZERE,Centro,82,2026-02-05T14:00:00Z,2026-02-05,Em Curso,1101,0,0,0,Curso,Pampilhosa Da Serra,Coimbra,Centro,-7.754278,40.107149,Cheia
39255413,20260192608,8,Em Conclusão,Em Conclusão,0,N/A,05/02/2026 14:06,1770300360000,2026-02-05,14:06,2026,4/22:40,5680,---,4305,4,Protecção e Assistência a Pessoas e Bens,3,Assistência e Prevenção a actividades humanas,5,Limpeza de Via e Sinalização de Perigo,4305 - Limpeza de Via e Sinalização de Perigo,3,Centro,12,Região de Leiria,140,Leiria,100933,"Leiria, Pousos, Barreira e Cortes",União das Freguesias de Marrazes e Barosa,Restaurante Pipo Velho,0,0,0,0,0,0,0,39.716662,-8.783991,39.716662°N 8.783991°W,"39°43,0020'N 8°47,0400'W ","39° 43' 0,12'' N 8° 47' 2,40'' W ",1770641160000,43 - Em Conclusão,Outras ocorrências de proteção e socorro,26714608,-8.783991,39.716662,20260192608,União das Freguesias de Marrazes e Barosa,Centro,140,2026-02-05T14:06:00Z,2026-02-05,Em resolução/conclusão,4305,0,0,0,Resolução/Conclusão,Leiria,Leiria,Centro,-8.783991,39.716662,Limpeza de Via e Sinalização de Perigo
39255414,20260192799,6,Em Curso,Em Curso,3,Elevada,05/02/2026 09:00,1770282000000,2026-02-05,09:00,2026,4/03:46,5986,---,1101,1,Riscos Naturais,1,Fenómenos Naturais,1,Cheia,1101 - Cheia,4,Lisboa e Vale do Tejo,17,Médio Tejo,209,Mação,141309,"Mação, Penhascoso e Aboboreira",MAÇÃO, --- ,0,0,0,0,0,0,0,39.551093,-7.998144,39.551093°N 7.998144°W,"39°33,0660'N 7°59,8860'W ","39° 33' 3,96'' N 7° 59' 53,16'' W ",1770641160000,11 - Em Curso,Outras ocorrências de proteção e socorro,26714799,-7.998144,39.551093,20260192799,MAÇÃO,Lisboa e Vale do Tejo,209,2026-02-05T09:00:00Z,2026-02-05,Em Curso,1101,0,0,0,Curso,Mação,Santarém,Centro,-7.998144,39.551093,Cheia
39255415,20260192807,6,Em Curso,Em Curso,3,Elevada,05/02/2026 09:00,1770282000000,2026-02-05,09:00,2026,4/03:46,5986,---,1101,1,Riscos Naturais,1,Fenómenos Naturais,1,Cheia,1101 - Cheia,4,Lisboa e Vale do Tejo,17,Médio Tejo,214,Tomar,141821,São João Baptista e Santa Maria Dos Olivais,TOMAR, --- ,0,0,0,0,0,0,0,39.602187,-8.405552,39.602187°N 8.405552°W,"39°36,1320'N 8°24,3360'W ","39° 36' 7,92'' N 8° 24' 20,16'' W ",1770641160000,11 - Em Curso,Outras ocorrências de proteção e socorro,26714807,-8.405552,39.602187,20260192807,TOMAR,Lisboa e Vale do Tejo,214,2026-02-05T09:00:00Z,2026-02-05,Em Curso,1101,0,0,0,Curso,Tomar,Santarém,Centro,-8.405552,39.602187,Cheia
39255416,20260192816,6,Em Curso,Em Curso,3,Elevada,05/02/2026 09:00,1770282000000,2026-02-05,09:00,2026,4/03:46,5986,---,1101,1,Riscos Naturais,1,Fenómenos Naturais,1,Cheia,1101 - Cheia,4,Lisboa e Vale do Tejo,17,Médio Tejo,216,Vila Nova da Barquinha,142006,Vila Nova da Barquinha,BARQUINHA, --- ,2,0,2,1,0,0,1,39.46435,-8.418956,39.464350°N 8.418956°W,"39°27,8640'N 8°25,1400'W ","39° 27' 51,84'' N 8° 25' 8,40'' W ",1770641160000,11 - Em Curso,Outras ocorrências de proteção e socorro,26714816,-8.418956,39.46435,20260192816,BARQUINHA,Lisboa e Vale do Tejo,216,2026-02-05T09:00:00Z,2026-02-05,Em Curso,1101,0,1,2,Curso,Vila Nova Da Barquinha,Santarém,Centro,-8.418956,39.46435,Cheia
39255417,20260192828,6,Em Curso,Em Curso,3,Elevada,05/02/2026 09:00,1770282000000,2026-02-05,09:00,2026,4/03:46,5986,---,1101,1,Riscos Naturais,1,Fenómenos Naturais,1,Cheia,1101 - Cheia,4,Lisboa e Vale do Tejo,17,Médio Tejo,197,Abrantes,140120,Abrantes (São Vicente e São João) e Alferrarede,ABRANTES, --- ,9,0,9,3,0,0,1,39.462886,-8.193526,39.462886°N 8.193526°W,"39°27,7740'N 8°11,6100'W ","39° 27' 46,44'' N 8° 11' 36,60'' W ",1770641160000,11 - Em Curso,Outras ocorrências de proteção e socorro,26714828,-8.193526,39.462886,20260192828,ABRANTES,Lisboa e Vale do Tejo,197,2026-02-05T09:00:00Z,2026-02-05,Em Curso,1101,0,3,9,Curso,Abrantes,Santarém,Centro,-8.193526,39.462886,Cheia
39255418,20260192895,6,Em Curso,Em Curso,3,Elevada,05/02/2026 09:00,1770282000000,2026-02-05,09:00,2026,4/03:46,5986,---,1101,1,Riscos Naturais,1,Fenómenos Naturais,1,Cheia,1101 - Cheia,4,Lisboa e Vale do Tejo,17,Médio Tejo,204,Constância,140801,Constância,CONSTÂNCIA, --- ,0,0,0,0,0,0,0,39.476237,-8.334164,39.476237°N 8.334164°W,"39°28,5720'N 8°20,0520'W ","39° 28' 34,32'' N 8° 20' 3,12'' W ",1770641160000,11 - Em Curso,Outras ocorrências de proteção e socorro,26714895,-8.334164,39.476237,20260192895,CONSTÂNCIA,Lisboa e Vale do Tejo,204,2026-02-05T09:00:00Z,2026-02-05,Em Curso,1101,0,0,0,Curso,Constância,Santarém,Centro,-8.334164,39.476237,Cheia
39255419,20260192902,6,Em Curso,Em Curso,1,Reduzida,05/02/2026 14:55,1770303300000,2026-02-05,14:55,2026,4/21:51,5631,---,3315,3,Riscos Mistos,3,"Comprometimento total ou parcial de segurança, serviços ou estruturas",15,Inundação de estruturas ou superfícies por precipitação intensa,3315 - Inundação de estruturas ou superfícies por precipitação intensa,3,Centro,11,Região de Coimbra,77,Lousã,060707,Foz de Arouce e Casal de Ermio,Foz Arouce,Rua da Videira,0,0,0,0,0,0,1,40.164534,-8.267414,40.164534°N 8.267414°W,"40°9,8700'N 8°16,0440'W ","40° 9' 52,20'' N 8° 16' 2,64'' W ",1770641160000,33 - Em Curso,Intervenções em Infraestruturas e vias de comunicação,26714902,-8.267414,40.164534,20260192902,Foz Arouce,Centro,77,2026-02-05T14:55:00Z,2026-02-05,Em Curso,3315,0,0,0,Curso,Lousã,Coimbra,Centro,-8.267414,40.164534,Inundação de estruturas ou superfícies por precipitação intensa
39255420,20260194688,5,Chegada ao TO,Em Despacho,1,Reduzida,05/02/2026 19:00,1770318000000,2026-02-05,19:00,2026,4/17:46,5386,---,1101,1,Riscos Naturais,1,Fenómenos Naturais,1,Cheia,1101 - Cheia,3,Centro,15,Beira Baixa,70,Vila Velha de Ródão,051104,Vila Velha de Ródão,Porto do Tejo,Porto do Tejo,5,0,5,1,0,0,1,39.654713,-7.665868,39.654713°N 7.665868°W,"39°39,2820'N 7°39,9540'W ","39° 39' 16,92'' N 7° 39' 57,24'' W ",1770641160000,11 - Em Curso,Outras ocorrências de proteção e socorro,26716688,-7.665868,39.654713,20260194688,Porto do Tejo,Centro,70,2026-02-05T19:00:00Z,2026-02-05,Chegada Ao to,1101,0,1,5,Chegada Ao to,Vila Velha De Ródão,Castelo Branco,Centro,-7.665868,39.654713,Cheia
39255421,20260194718,6,Em Curso,Em Curso,1,Reduzida,05/02/2026 18:22,1770315720000,2026-02-05,18:22,2026,4/18:24,5424,---,3313,3,Riscos Mistos,3,"Comprometimento total ou parcial de segurança, serviços ou estruturas",13,Movimento de massa,3313 - Movimento de massa,5,Alentejo,19,Alentejo Litoral,222,Grândola,150501,Azinheira Dos Barros e São Mamede do Sádão,Lousal,Açude da Tapada do Lousal,0,0,0,0,0,0,0,38.041071,-8.422425,38.041071°N 8.422425°W,"38°2,4660'N 8°25,3440'W ","38° 2' 27,96'' N 8° 25' 20,64'' W ",1770641160000,33 - Em Curso,Intervenções em Infraestruturas e vias de comunicação,26716718,-8.422425,38.041071,20260194718,Lousal,Alentejo,222,2026-02-05T18:22:00Z,2026-02-05,Em Curso,3313,0,0,0,Curso,Grândola,Setúbal,Alentejo,-8.422425,38.041071,Movimento de massa
39255422,20260196640,6,Em Curso,Em Curso,1,Reduzida,05/02/2026 09:00,1770282000000,2026-02-05,09:00,2026,4/03:46,5986,---,1101,1,Riscos Naturais,1,Fenómenos Naturais,1,Cheia,1101 - Cheia,4,Lisboa e Vale do Tejo,17,Médio Tejo,215,Torres Novas,141921,"Torres Novas (São Pedro), Lapas e Ribeira Branca",TORRES NOVAS, --- ,0,0,0,0,0,0,0,39.481931,-8.559665,39.481931°N 8.559665°W,"39°28,9140'N 8°33,5820'W ","39° 28' 54,84'' N 8° 33' 34,92'' W ",1770641160000,11 - Em Curso,Outras ocorrências de proteção e socorro,26718646,-8.559665,39.481931,20260196640,TORRES NOVAS,Lisboa e Vale do Tejo,215,2026-02-05T09:00:00Z,2026-02-05,Em Curso,1101,0,0,0,Curso,Torres Novas,Santarém,Centro,-8.559665,39.481931,Cheia
39255423,20260196644,6,Em Curso,Em Curso,1,Reduzida,05/02/2026 09:00,1770282000000,2026-02-05,09:00,2026,4/03:46,5986,---,1101,1,Riscos Naturais,1,Fenómenos Naturais,1,Cheia,1101 - Cheia,4,Lisboa e Vale do Tejo,17,Médio Tejo,217,Ourém,142111,Nossa Senhora Das Misericórdias,OUREM, --- ,0,0,0,0,0,0,0,39.643,-8.5991,39.643000°N 8.599100°W,"39°38,5800'N 8°35,9460'W ","39° 38' 34,80'' N 8° 35' 56,76'' W ",1770641160000,11 - Em Curso,Outras ocorrências de proteção e socorro,26718650,-8.5991,39.643,20260196644,OUREM,Lisboa e Vale do Tejo,217,2026-02-05T09:00:00Z,2026-02-05,Em Curso,1101,0,0,0,Curso,Ourém,Santarém,Centro,-8.5991,39.643,Cheia
39255424,20260196676,6,Em Curso,Em Curso,1,Reduzida,05/02/2026 09:00,1770282000000,2026-02-05,09:00,2026,4/03:46,5986,---,1101,1,Riscos Naturais,1,Fenómenos Naturais,1,Cheia,1101 - Cheia,4,Lisboa e Vale do Tejo,17,Médio Tejo,198,Alcanena,140211,Alcanena e Vila Moreira,ALCANENA, --- ,0,0,0,0,0,0,0,39.458072,-8.666413,39.458072°N 8.666413°W,"39°27,4860'N 8°39,9840'W ","39° 27' 29,16'' N 8° 39' 59,04'' W ",1770641160000,11 - Em Curso,Outras ocorrências de proteção e socorro,26718682,-8.666413,39.458072,20260196676,ALCANENA,Lisboa e Vale do Tejo,198,2026-02-05T09:00:00Z,2026-02-05,Em Curso,1101,0,0,0,Curso,Alcanena,Santarém,Centro,-8.666413,39.458072,Cheia
39255425,20260197849,5,Despacho de 1º Alerta,Em Despacho,2,Moderada,06/02/2026 11:00,1770375600000,2026-02-06,11:00,2026,3/01:46,4426,---,1101,1,Riscos Naturais,1,Fenómenos Naturais,1,Cheia,1101 - Cheia,4,Lisboa e Vale do Tejo,18,Lezíria do Tejo,201,Benavente,140501,Benavente,PCMUN Benavente, --- ,1,0,1,1,0,0,1,38.980872,-8.804753,38.980872°N 8.804753°W,"38°58,8540'N 8°48,2880'W ","38° 58' 51,24'' N 8° 48' 17,28'' W ",1770641160000,11 - Em Despacho,Outras ocorrências de proteção e socorro,26719855,-8.804753,38.980872,20260197849,PCMUN Benavente,Lisboa e Vale do Tejo,201,2026-02-06T11:00:00Z,2026-02-06,Despacho De 1º Alerta,1101,0,1,1,Despacho De 1º Alerta,Benavente,Santarém,Alentejo,-8.804753,38.980872,Cheia
39255426,20260197909,6,Em Curso,Em Curso,0,N/A,06/02/2026 11:31,1770377460000,2026-02-06,11:31,2026,3/01:15,4395,---,4305,4,Protecção e Assistência a Pessoas e Bens,3,Assistência e Prevenção a actividades humanas,5,Limpeza de Via e Sinalização de Perigo,4305 - Limpeza de Via e Sinalização de Perigo,3,Centro,10,Região de Aveiro,5,Aveiro,010501,Aradas,Rua da Arrochela nº18 - Gloria,Rua da Arrochela nº18 - Gloria,1,0,1,1,0,0,1,40.608865,-8.638828,40.608865°N 8.638828°W,"40°36,5340'N 8°38,3280'W ","40° 36' 32,04'' N 8° 38' 19,68'' W ",1770641160000,43 - Em Curso,Outras ocorrências de proteção e socorro,26719915,-8.638828,40.608865,20260197909,Rua da Arrochela nº18 - Gloria,Centro,5,2026-02-06T11:31:00Z,2026-02-06,Em Curso,4305,0,1,1,Curso,Aveiro,Aveiro,Centro,-8.638828,40.608865,Limpeza de Via e Sinalização de Perigo
39255427,20260198479,6,Em Curso,Em Curso,3,Elevada,05/02/2026 11:10,1770289800000,2026-02-05,11:10,2026,4/01:36,5856,---,1101,1,Riscos Naturais,1,Fenómenos Naturais,1,Cheia,1101 - Cheia,5,Alentejo,22,Baixo Alentejo,24,Beja,020521,Beja (Santiago Maior e São João Baptista),BEJA 1º,Concelho Beja ,0,0,0,0,0,0,0,38.014111,-7.87003,38.014111°N 7.870030°W,"38°0,8460'N 7°52,2000'W ","38° 0' 50,76'' N 7° 52' 12,00'' W ",1770641160000,11 - Em Curso,Outras ocorrências de proteção e socorro,26720485,-7.87003,38.014111,20260198479,BEJA 1º,Alentejo,24,2026-02-05T11:10:00Z,2026-02-05,Em Curso,1101,0,0,0,Curso,Beja,Beja,Alentejo,-7.87003,38.014111,Cheia
39255428,20260198771,6,Em Curso,Em Curso,3,Elevada,06/02/2026 13:57,1770386220000,2026-02-06,13:57,2026,3/22:49,4249,---,3313,3,Riscos Mistos,3,"Comprometimento total ou parcial de segurança, serviços ou estruturas",13,Movimento de massa,3313 - Movimento de massa,4,Lisboa e Vale do Tejo,16,Oeste,148,Alenquer,110114,Vila Verde Dos Francos,Vila Verde dos Francos,EN115 - KM34.3,1,0,1,1,0,0,1,39.17169,-9.125958,39.171690°N 9.125958°W,"39°10,3020'N 9°7,5600'W ","39° 10' 18,12'' N 9° 7' 33,60'' W ",1770641160000,33 - Em Curso,Intervenções em Infraestruturas e vias de comunicação,26720777,-9.125958,39.17169,20260198771,Vila Verde dos Francos,Lisboa e Vale do Tejo,148,2026-02-06T13:57:00Z,2026-02-06,Em Curso,3313,0,1,1,Curso,Alenquer,Lisboa,Centro,-9.125958,39.17169,Movimento de massa
39255429,20260200746,6,Em Curso,Em Curso,3,Elevada,06/02/2026 17:15,1770398100000,2026-02-06,17:15,2026,3/19:31,4051,---,3313,3,Riscos Mistos,3,"Comprometimento total ou parcial de segurança, serviços ou estruturas",13,Movimento de massa,3313 - Movimento de massa,4,Lisboa e Vale do Tejo,16,Oeste,148,Alenquer,110107,Meca,MECA,EN9-3 - Espiçandeira,3,0,3,1,0,0,1,39.083815,-9.033403,39.083815°N 9.033403°W,"39°5,0280'N 9°2,0040'W ","39° 5' 1,68'' N 9° 2' 0,24'' W ",1770641160000,33 - Em Curso,Intervenções em Infraestruturas e vias de comunicação,26722752,-9.033403,39.083815,20260200746,MECA,Lisboa e Vale do Tejo,148,2026-02-06T17:15:00Z,2026-02-06,Em Curso,3313,0,1,3,Curso,Alenquer,Lisboa,Centro,-9.033403,39.083815,Movimento de massa
39255430,20260202601,6,Em Curso,Em Curso,3,Elevada,07/02/2026 08:18,1770452280000,2026-02-07,08:18,2026,2/04:28,3148,---,3313,3,Riscos Mistos,3,"Comprometimento total ou parcial de segurança, serviços ou estruturas",13,Movimento de massa,3313 - Movimento de massa,4,Lisboa e Vale do Tejo,1,Grande Lisboa,156,Mafra,110902,Carvoeira,Foz do Lisandro,EN247,3,0,3,2,0,0,2,38.943452,-9.405164,38.943452°N 9.405164°W,"38°56,6100'N 9°24,3120'W ","38° 56' 36,60'' N 9° 24' 18,72'' W ",1770641160000,33 - Em Curso,Intervenções em Infraestruturas e vias de comunicação,26724607,-9.405164,38.943452,20260202601,Foz do Lisandro,Lisboa e Vale do Tejo,156,2026-02-07T08:18:00Z,2026-02-07,Em Curso,3313,0,2,3,Curso,Mafra,Lisboa,Área Metropolitana De Lisboa,-9.405164,38.943452,Movimento de massa
39255431,20260202896,5,Despacho de 1º Alerta,Em Despacho,1,Reduzida,07/02/2026 09:11,1770455460000,2026-02-07,09:11,2026,2/03:35,3095,---,3315,3,Riscos Mistos,3,"Comprometimento total ou parcial de segurança, serviços ou estruturas",15,Inundação de estruturas ou superfícies por precipitação intensa,3315 - Inundação de estruturas ou superfícies por precipitação intensa,2,Norte,8,Terras de Trás-os-Montes,49,Bragança,040257,"Sé, Santa Maria e Meixedo",BRAGANÇA,Rua Alexandre Herculano Nº160,1,0,1,1,0,0,1,41.813164,-6.761223,41.813164°N 6.761223°W,"41°48,7920'N 6°45,6720'W ","41° 48' 47,52'' N 6° 45' 40,32'' W ",1770641160000,33 - Em Despacho,Intervenções em Infraestruturas e vias de comunicação,26724902,-6.761223,41.813164,20260202896,BRAGANÇA,Norte,49,2026-02-07T09:11:00Z,2026-02-07,Despacho De 1º Alerta,3315,0,1,1,Despacho De 1º Alerta,Bragança,Bragança,Norte,-6.761223,41.813164,Inundação de estruturas ou superfícies por precipitação intensa
39255432,20260202951,5,Despacho de 1º Alerta,Em Despacho,2,Moderada,06/02/2026 23:29,1770420540000,2026-02-06,23:29,2026,3/13:17,3677,---,3313,3,Riscos Mistos,3,"Comprometimento total ou parcial de segurança, serviços ou estruturas",13,Movimento de massa,3313 - Movimento de massa,4,Lisboa e Vale do Tejo,16,Oeste,148,Alenquer,110118,Aldeia Galega da Merceana e Aldeia Gavinha,Mata,Mata ,3,0,3,1,0,0,1,39.085371,-9.064627,39.085371°N 9.064627°W,"39°5,1240'N 9°3,8760'W ","39° 5' 7,44'' N 9° 3' 52,56'' W ",1770641160000,33 - Em Despacho,Intervenções em Infraestruturas e vias de comunicação,26724957,-9.064627,39.085371,20260202951,Mata,Lisboa e Vale do Tejo,148,2026-02-06T23:29:00Z,2026-02-06,Despacho De 1º Alerta,3313,0,1,3,Despacho De 1º Alerta,Alenquer,Lisboa,Centro,-9.064627,39.085371,Movimento de massa
39255433,20260202998,6,Em Curso,Em Curso,2,Moderada,06/02/2026 23:20,1770420000000,2026-02-06,23:20,2026,3/13:26,3686,---,3313,3,Riscos Mistos,3,"Comprometimento total ou parcial de segurança, serviços ou estruturas",13,Movimento de massa,3313 - Movimento de massa,4,Lisboa e Vale do Tejo,16,Oeste,148,Alenquer,110118,Aldeia Galega da Merceana e Aldeia Gavinha,ALDEIA GAVINHA,Aldeia Gavinha,3,0,3,1,0,0,1,39.085941,-9.105085,39.085941°N 9.105085°W,"39°5,1540'N 9°6,3060'W ","39° 5' 9,24'' N 9° 6' 18,36'' W ",1770641160000,33 - Em Curso,Intervenções em Infraestruturas e vias de comunicação,26725004,-9.105085,39.085941,20260202998,ALDEIA GAVINHA,Lisboa e Vale do Tejo,148,2026-02-06T23:20:00Z,2026-02-06,Em Curso,3313,0,1,3,Curso,Alenquer,Lisboa,Centro,-9.105085,39.085941,Movimento de massa
39255434,20260203870,6,Em Curso,Em Curso,1,Reduzida,07/02/2026 11:05,1770462300000,2026-02-07,11:05,2026,2/01:41,2981,---,3313,3,Riscos Mistos,3,"Comprometimento total ou parcial de segurança, serviços ou estruturas",13,Movimento de massa,3313 - Movimento de massa,3,Centro,14,Beiras e Serra da Estrela,124,Guarda,090763,"Mizarela, Pêro Soares e Vila Soeiro",PERO SOARES,Pero Soares - EM 556,2,0,2,1,0,0,1,40.544367,-7.332082,40.544367°N 7.332082°W,"40°32,6640'N 7°19,9260'W ","40° 32' 39,84'' N 7° 19' 55,56'' W ",1770641160000,33 - Em Curso,Intervenções em Infraestruturas e vias de comunicação,26725876,-7.332082,40.544367,20260203870,PERO SOARES,Centro,124,2026-02-07T11:05:00Z,2026-02-07,Em Curso,3313,0,1,2,Curso,Guarda,Guarda,Centro,-7.332082,40.544367,Movimento de massa
39255435,20260205345,6,Em Curso,Em Curso,1,Reduzida,07/02/2026 14:05,1770473100000,2026-02-07,14:05,2026,2/22:41,2801,---,3315,3,Riscos Mistos,3,"Comprometimento total ou parcial de segurança, serviços ou estruturas",15,Inundação de estruturas ou superfícies por precipitação intensa,3315 - Inundação de estruturas ou superfícies por precipitação intensa,3,Centro,11,Região de Coimbra,77,Lousã,060706,Gândaras,Ribeira,rua do povo unido,0,0,0,0,0,0,1,40.130205,-8.263347,40.130205°N 8.263347°W,"40°7,8120'N 8°15,7980'W ","40° 7' 48,72'' N 8° 15' 47,88'' W ",1770641160000,33 - Em Curso,Intervenções em Infraestruturas e vias de comunicação,26727351,-8.263347,40.130205,20260205345,Ribeira,Centro,77,2026-02-07T14:05:00Z,2026-02-07,Em Curso,3315,0,0,0,Curso,Lousã,Coimbra,Centro,-8.263347,40.130205,Inundação de estruturas ou superfícies por precipitação intensa
39255436,20260207978,6,Em Curso,Em Curso,1,Reduzida,07/02/2026 19:35,1770492900000,2026-02-07,19:35,2026,2/17:11,2471,---,3313,3,Riscos Mistos,3,"Comprometimento total ou parcial de segurança, serviços ou estruturas",13,Movimento de massa,3313 - Movimento de massa,3,Centro,11,Região de Coimbra,74,Condeixa-a-Nova,060411,Condeixa-a-Velha e Condeixa-a-Nova,Eira Pedrinha,Rua DA ASSOCIAÇÃO ,0,0,0,0,0,0,1,40.119842,-8.482693,40.119842°N 8.482693°W,"40°7,1880'N 8°28,9620'W ","40° 7' 11,28'' N 8° 28' 57,72'' W ",1770641160000,33 - Em Curso,Intervenções em Infraestruturas e vias de comunicação,26729985,-8.482693,40.119842,20260207978,Eira Pedrinha,Centro,74,2026-02-07T19:35:00Z,2026-02-07,Em Curso,3313,0,0,0,Curso,Condeixa-a-nova,Coimbra,Centro,-8.482693,40.119842,Movimento de massa
39255437,20260210550,6,Em Curso,Em Curso,3,Elevada,08/02/2026 08:00,1770537600000,2026-02-08,08:00,2026,1/04:46,1726,---,3313,3,Riscos Mistos,3,"Comprometimento total ou parcial de segurança, serviços ou estruturas",13,Movimento de massa,3313 - Movimento de massa,4,Lisboa e Vale do Tejo,16,Oeste,159,Sobral de Monte Agraço,111203,Sobral de Monte Agraço,Sobral Monte Agraço, --- ,5,0,5,5,0,0,1,39.019738,-9.152431,39.019738°N 9.152431°W,"39°1,1820'N 9°9,1440'W ","39° 1' 10,92'' N 9° 9' 8,64'' W ",1770641160000,33 - Em Curso,Intervenções em Infraestruturas e vias de comunicação,26732557,-9.152431,39.019738,20260210550,Sobral Monte Agraço,Lisboa e Vale do Tejo,159,2026-02-08T08:00:00Z,2026-02-08,Em Curso,3313,0,5,5,Curso,Sobral De Monte Agraço,Lisboa,Centro,-9.152431,39.019738,Movimento de massa
39255438,20260210969,5,Chegada ao TO,Em Despacho,1,Reduzida,07/02/2026 18:05,1770487500000,2026-02-07,18:05,2026,2/18:41,2561,---,3321,3,Riscos Mistos,3,"Comprometimento total ou parcial de segurança, serviços ou estruturas",21,Dano ou Queda de redes de fornecimento eléctrico,3321 - Dano ou Queda de redes de fornecimento eléctrico,4,Lisboa e Vale do Tejo,16,Oeste,159,Sobral de Monte Agraço,111201,Santo Quintino,Fetais dos Pretos,Rua da Liberdade,0,0,0,0,0,0,0,39.023613,-9.126169,39.023613°N 9.126169°W,"39°1,4160'N 9°7,5720'W ","39° 1' 24,96'' N 9° 7' 34,32'' W ",1770641160000,33 - Em Curso,Intervenções em Infraestruturas e vias de comunicação,26732976,-9.126169,39.023613,20260210969,Fetais dos Pretos,Lisboa e Vale do Tejo,159,2026-02-07T18:05:00Z,2026-02-07,Chegada Ao to,3321,0,0,0,Chegada Ao to,Sobral De Monte Agraço,Lisboa,Centro,-9.126169,39.023613,Dano ou Queda de redes de fornecimento eléctrico
39255439,20260213422,8,Em Conclusão,Em Conclusão,1,Reduzida,08/02/2026 19:32,1770579120000,2026-02-08,19:32,2026,1/17:14,1034,---,3321,3,Riscos Mistos,3,"Comprometimento total ou parcial de segurança, serviços ou estruturas",21,Dano ou Queda de redes de fornecimento eléctrico,3321 - Dano ou Queda de redes de fornecimento eléctrico,4,Lisboa e Vale do Tejo,17,Médio Tejo,214,Tomar,141808,Olalhas,Torrão, --- ,0,0,0,0,0,0,0,39.642778,-8.319167,39.642778°N 8.319167°W,"39°38,5680'N 8°19,1520'W ","39° 38' 34,08'' N 8° 19' 9,12'' W ",1770641160000,33 - Em Conclusão,Intervenções em Infraestruturas e vias de comunicação,26735429,-8.319167,39.642778,20260213422,Torrão,Lisboa e Vale do Tejo,214,2026-02-08T19:32:00Z,2026-02-08,Em resolução/conclusão,3321,0,0,0,Resolução/Conclusão,Tomar,Santarém,Centro,-8.319167,39.642778,Dano ou Queda de redes de fornecimento eléctrico
39255440,20260213451,5,Despacho de 1º Alerta,Em Despacho,1,Reduzida,08/02/2026 19:35,1770579300000,2026-02-08,19:35,2026,1/17:11,1031,---,4325,4,Protecção e Assistência a Pessoas e Bens,3,Assistência e Prevenção a actividades humanas,25,Evacuação,4325 - Evacuação,4,Lisboa e Vale do Tejo,1,Grande Lisboa,161,Vila Franca de Xira,111409,Vila Franca de Xira,Vila Franca Xira,Cabo da Leziria,1,0,1,1,0,0,1,38.955728,-8.989293,38.955728°N 8.989293°W,"38°57,3420'N 8°59,3580'W ","38° 57' 20,52'' N 8° 59' 21,48'' W ",1770641160000,43 - Em Despacho,Outras ocorrências de proteção e socorro,26735458,-8.989293,38.955728,20260213451,Vila Franca Xira,Lisboa e Vale do Tejo,161,2026-02-08T19:35:00Z,2026-02-08,Despacho De 1º Alerta,4325,0,1,1,Despacho De 1º Alerta,Vila Franca De Xira,Lisboa,Área Metropolitana De Lisboa,-8.989293,38.955728,Evacuação
39255441,20260213533,5,Despacho de 1º Alerta,Em Despacho,1,Reduzida,08/02/2026 19:56,1770580560000,2026-02-08,19:56,2026,1/16:50,1010,---,4305,4,Protecção e Assistência a Pessoas e Bens,3,Assistência e Prevenção a actividades humanas,5,Limpeza de Via e Sinalização de Perigo,4305 - Limpeza de Via e Sinalização de Perigo,3,Centro,11,Região de Coimbra,73,Coimbra,060311,Ceira,Ceira,Rua do Vale do Açor,2,0,2,1,0,0,1,40.164217,-8.389014,40.164217°N 8.389014°W,"40°9,8520'N 8°23,3400'W ","40° 9' 51,12'' N 8° 23' 20,40'' W ",1770641160000,43 - Em Despacho,Outras ocorrências de proteção e socorro,26735540,-8.389014,40.164217,20260213533,Ceira,Centro,73,2026-02-08T19:56:00Z,2026-02-08,Despacho De 1º Alerta,4305,0,1,2,Despacho De 1º Alerta,Coimbra,Coimbra,Centro,-8.389014,40.164217,Limpeza de Via e Sinalização de Perigo
39255442,20260214253,6,Em Curso,Em Curso,1,Reduzida,08/02/2026 23:35,1770593700000,2026-02-08,23:35,2026,1/13:11,791,---,3315,3,Riscos Mistos,3,"Comprometimento total ou parcial de segurança, serviços ou estruturas",15,Inundação de estruturas ou superfícies por precipitação intensa,3315 - Inundação de estruturas ou superfícies por precipitação intensa,3,Centro,11,Região de Coimbra,77,Lousã,060706,Gândaras,Gândara,Quelha da troia nº2,0,0,0,0,0,0,1,40.128026,-8.27752,40.128026°N 8.277520°W,"40°7,6800'N 8°16,6500'W ","40° 7' 40,80'' N 8° 16' 39,00'' W ",1770641160000,33 - Em Curso,Intervenções em Infraestruturas e vias de comunicação,26736260,-8.27752,40.128026,20260214253,Gândara,Centro,77,2026-02-08T23:35:00Z,2026-02-08,Em Curso,3315,0,0,0,Curso,Lousã,Coimbra,Centro,-8.27752,40.128026,Inundação de estruturas ou superfícies por precipitação intensa
39255443,20260214571,8,Em Conclusão,Em Conclusão,3,Elevada,09/02/2026 03:15,1770606900000,2026-02-09,03:15,2026,0/09:31,571,---,2403,2,Riscos Tecnológicos,4,Acidentes,3,Colisão rodoviária,2403 - Colisão rodoviária,5,Alentejo,21,Alentejo Central,99,Vendas Novas,071201,Vendas Novas,EN 04 KM 56,EN 04 KM 56,2,0,2,1,0,0,1,38.682703,-8.475742,38.682703°N 8.475742°W,"38°40,9620'N 8°28,5420'W ","38° 40' 57,72'' N 8° 28' 32,52'' W ",1770641160000,24 - Em Conclusão,Acidentes,26736578,-8.475742,38.682703,20260214571,EN 04 KM 56,Alentejo,99,2026-02-09T03:15:00Z,2026-02-09,Em resolução/conclusão,2403,0,1,2,Resolução/Conclusão,Vendas Novas,Évora,Alentejo,-8.475742,38.682703,Colisão rodoviária
39255444,20260214934,5,Despacho de 1º Alerta,Em Despacho,1,Reduzida,09/02/2026 07:59,1770623940000,2026-02-09,07:59,2026,0/04:47,287,---,3301,3,Riscos Mistos,3,"Comprometimento total ou parcial de segurança, serviços ou estruturas",1,Queda de Árvore,3301 - Queda de Árvore,4,Lisboa e Vale do Tejo,18,Lezíria do Tejo,203,Chamusca,140704,Ulme,ULME,EM 574,2,0,2,1,0,0,1,39.317507,-8.42995,39.317507°N 8.429950°W,"39°19,0500'N 8°25,7940'W ","39° 19' 3,00'' N 8° 25' 47,64'' W ",1770641160000,33 - Em Despacho,Intervenções em Infraestruturas e vias de comunicação,26736941,-8.42995,39.317507,20260214934,ULME,Lisboa e Vale do Tejo,203,2026-02-09T07:59:00Z,2026-02-09,Despacho De 1º Alerta,3301,0,1,2,Despacho De 1º Alerta,Chamusca,Santarém,Alentejo,-8.42995,39.317507,Queda de Árvore
39255445,20260214948,5,Chegada ao TO,Em Despacho,1,Reduzida,09/02/2026 08:00,1770624000000,2026-02-09,08:00,2026,0/04:46,286,---,3315,3,Riscos Mistos,3,"Comprometimento total ou parcial de segurança, serviços ou estruturas",15,Inundação de estruturas ou superfícies por precipitação intensa,3315 - Inundação de estruturas ou superfícies por precipitação intensa,3,Centro,13,Viseu Dão Lafões,256,Carregal do Sal,180204,Oliveira do Conde,Oliveirinha,Avenida da Estação,3,0,3,1,0,0,1,40.451668,-7.969262,40.451668°N 7.969262°W,"40°27,1020'N 7°58,1580'W ","40° 27' 6,12'' N 7° 58' 9,48'' W ",1770641160000,33 - Em Curso,Intervenções em Infraestruturas e vias de comunicação,26736955,-7.969262,40.451668,20260214948,Oliveirinha,Centro,256,2026-02-09T08:00:00Z,2026-02-09,Chegada Ao to,3315,0,1,3,Chegada Ao to,Carregal Do Sal,Viseu,Centro,-7.969262,40.451668,Inundação de estruturas ou superfícies por precipitação intensa
39255446,20260215014,5,Despacho de 1º Alerta,Em Despacho,1,Reduzida,09/02/2026 08:21,1770625260000,2026-02-09,08:21,2026,0/04:25,265,---,3313,3,Riscos Mistos,3,"Comprometimento total ou parcial de segurança, serviços ou estruturas",13,Movimento de massa,3313 - Movimento de massa,4,Lisboa e Vale do Tejo,18,Lezíria do Tejo,212,Santarém,141625,Vale de Santarém,Vale de Santarém,"Rua Cabeço do Moinho de Vento 18, 2005-375 Santarém, Portugal",1,0,1,1,1,0,1,39.19075,-8.736,39.190750°N 8.736000°W,"39°11,4480'N 8°44,1600'W ","39° 11' 26,88'' N 8° 44' 9,60'' W ",1770641160000,33 - Em Despacho,Intervenções em Infraestruturas e vias de comunicação,26737021,-8.736,39.19075,20260215014,Vale de Santarém,Lisboa e Vale do Tejo,212,2026-02-09T08:21:00Z,2026-02-09,Despacho De 1º Alerta,3313,0,1,1,Despacho De 1º Alerta,Santarém,Santarém,Alentejo,-8.736,39.19075,Movimento de massa
39255447,20260215057,5,Despacho de 1º Alerta,Em Despacho,1,Reduzida,09/02/2026 08:28,1770625680000,2026-02-09,08:28,2026,0/04:18,258,---,3315,3,Riscos Mistos,3,"Comprometimento total ou parcial de segurança, serviços ou estruturas",15,Inundação de estruturas ou superfícies por precipitação intensa,3315 - Inundação de estruturas ou superfícies por precipitação intensa,2,Norte,8,Terras de Trás-os-Montes,54,Mirandela,040730,Torre de Dona Chama,TORRE DE DONA CHAMA, --- ,2,0,2,1,0,0,1,41.653245,-7.145155,41.653245°N 7.145155°W,"41°39,1920'N 7°8,7120'W ","41° 39' 11,52'' N 7° 8' 42,72'' W ",1770641160000,33 - Em Despacho,Intervenções em Infraestruturas e vias de comunicação,26737064,-7.145155,41.653245,20260215057,TORRE DE DONA CHAMA,Norte,54,2026-02-09T08:28:00Z,2026-02-09,Despacho De 1º Alerta,3315,0,1,2,Despacho De 1º Alerta,Mirandela,Bragança,Norte,-7.145155,41.653245,Inundação de estruturas ou superfícies por precipitação intensa
39255448,20260215096,5,Despacho de 1º Alerta,Em Despacho,1,Reduzida,09/02/2026 08:00,1770624000000,2026-02-09,08:00,2026,0/04:46,286,---,3301,3,Riscos Mistos,3,"Comprometimento total ou parcial de segurança, serviços ou estruturas",1,Queda de Árvore,3301 - Queda de Árvore,3,Centro,15,Beira Baixa,65,Oleiros,050603,Cambas,Selada das Pedras,Seladas das Pedras,10,0,10,3,0,0,2,40.037276,-7.895263,40.037276°N 7.895263°W,"40°2,2380'N 7°53,7180'W ","40° 2' 14,28'' N 7° 53' 43,08'' W ",1770641160000,33 - Em Despacho,Intervenções em Infraestruturas e vias de comunicação,26737103,-7.895263,40.037276,20260215096,Selada das Pedras,Centro,65,2026-02-09T08:00:00Z,2026-02-09,Despacho De 1º Alerta,3301,0,3,10,Despacho De 1º Alerta,Oleiros,Castelo Branco,Centro,-7.895263,40.037276,Queda de Árvore
39255449,20260215100,5,Despacho de 1º Alerta,Em Despacho,1,Reduzida,09/02/2026 08:35,1770626100000,2026-02-09,08:35,2026,0/04:11,251,---,3315,3,Riscos Mistos,3,"Comprometimento total ou parcial de segurança, serviços ou estruturas",15,Inundação de estruturas ou superfícies por precipitação intensa,3315 - Inundação de estruturas ou superfícies por precipitação intensa,2,Norte,5,Area M. Porto,13,Oliveira de Azeméis,011321,"O. Azeméis, Riba-Ul, Ul, Macinhata Seixa, Madail", --- ,Rua Dr. Manuel Arriaga ,2,0,2,1,0,0,1,40.836334,-8.482939,40.836334°N 8.482939°W,"40°50,1780'N 8°28,9740'W ","40° 50' 10,68'' N 8° 28' 58,44'' W ",1770641160000,33 - Em Despacho,Intervenções em Infraestruturas e vias de comunicação,26737107,-8.482939,40.836334,20260215100, --- ,Norte,13,2026-02-09T08:35:00Z,2026-02-09,Despacho De 1º Alerta,3315,0,1,2,Despacho De 1º Alerta,Oliveira De Azeméis,Aveiro,Norte,-8.482939,40.836334,Inundação de estruturas ou superfícies por precipitação intensa
39255450,20260215101,5,Despacho de 1º Alerta,Em Despacho,1,Reduzida,09/02/2026 08:00,1770624000000,2026-02-09,08:00,2026,0/04:46,286,---,3301,3,Riscos Mistos,3,"Comprometimento total ou parcial de segurança, serviços ou estruturas",1,Queda de Árvore,3301 - Queda de Árvore,3,Centro,15,Beira Baixa,65,Oleiros,050601,Álvaro,ÁLVARO,Alvaro,8,0,8,2,0,0,2,39.976159,-7.966883,39.976159°N 7.966883°W,"39°58,5720'N 7°58,0140'W ","39° 58' 34,32'' N 7° 58' 0,84'' W ",1770641160000,33 - Em Despacho,Intervenções em Infraestruturas e vias de comunicação,26737108,-7.966883,39.976159,20260215101,ÁLVARO,Centro,65,2026-02-09T08:00:00Z,2026-02-09,Despacho De 1º Alerta,3301,0,2,8,Despacho De 1º Alerta,Oleiros,Castelo Branco,Centro,-7.966883,39.976159,Queda de Árvore
39255451,20260215175,5,Despacho de 1º Alerta,Em Despacho,1,Reduzida,09/02/2026 08:39,1770626340000,2026-02-09,08:39,2026,0/04:07,247,---,3301,3,Riscos Mistos,3,"Comprometimento total ou parcial de segurança, serviços ou estruturas",1,Queda de Árvore,3301 - Queda de Árvore,3,Centro,12,Região de Leiria,140,Leiria,100933,"Leiria, Pousos, Barreira e Cortes",CORTES,Avª do Lis,1,0,1,1,0,0,1,39.703349,-8.784899,39.703349°N 8.784899°W,"39°42,1980'N 8°47,0940'W ","39° 42' 11,88'' N 8° 47' 5,64'' W ",1770641160000,33 - Em Despacho,Intervenções em Infraestruturas e vias de comunicação,26737182,-8.784899,39.703349,20260215175,CORTES,Centro,140,2026-02-09T08:39:00Z,2026-02-09,Despacho De 1º Alerta,3301,0,1,1,Despacho De 1º Alerta,Leiria,Leiria,Centro,-8.784899,39.703349,Queda de Árvore
39255452,20260215206,5,Despacho de 1º Alerta,Em Despacho,1,Reduzida,09/02/2026 08:51,1770627060000,2026-02-09,08:51,2026,0/03:55,235,---,3301,3,Riscos Mistos,3,"Comprometimento total ou parcial de segurança, serviços ou estruturas",1,Queda de Árvore,3301 - Queda de Árvore,3,Centro,12,Região de Leiria,140,Leiria,100933,"Leiria, Pousos, Barreira e Cortes",Mourã,Mourã,1,0,1,1,0,0,1,39.721152,-8.821221,39.721152°N 8.821221°W,"39°43,2720'N 8°49,2720'W ","39° 43' 16,32'' N 8° 49' 16,32'' W ",1770641160000,33 - Em Despacho,Intervenções em Infraestruturas e vias de comunicação,26737213,-8.821221,39.721152,20260215206,Mourã,Centro,140,2026-02-09T08:51:00Z,2026-02-09,Despacho De 1º Alerta,3301,0,1,1,Despacho De 1º Alerta,Leiria,Leiria,Centro,-8.821221,39.721152,Queda de Árvore
39255453,20260215252,5,Despacho de 1º Alerta,Em Despacho,1,Reduzida,09/02/2026 09:02,1770627720000,2026-02-09,09:02,2026,0/03:44,224,---,3301,3,Riscos Mistos,3,"Comprometimento total ou parcial de segurança, serviços ou estruturas",1,Queda de Árvore,3301 - Queda de Árvore,4,Lisboa e Vale do Tejo,17,Médio Tejo,217,Ourém,142106,Fátima,Cova da Iria, --- ,2,0,2,1,0,0,1,39.632796,-8.667755,39.632796°N 8.667755°W,"39°37,9680'N 8°40,0680'W ","39° 37' 58,08'' N 8° 40' 4,08'' W ",1770641160000,33 - Em Despacho,Intervenções em Infraestruturas e vias de comunicação,26737259,-8.667755,39.632796,20260215252,Cova da Iria,Lisboa e Vale do Tejo,217,2026-02-09T09:02:00Z,2026-02-09,Despacho De 1º Alerta,3301,0,1,2,Despacho De 1º Alerta,Ourém,Santarém,Centro,-8.667755,39.632796,Queda de Árvore
39255454,20260215258,5,Despacho de 1º Alerta,Em Despacho,1,Reduzida,09/02/2026 09:00,1770627600000,2026-02-09,09:00,2026,0/03:46,226,---,3301,3,Riscos Mistos,3,"Comprometimento total ou parcial de segurança, serviços ou estruturas",1,Queda de Árvore,3301 - Queda de Árvore,3,Centro,15,Beira Baixa,69,Vila de Rei,051003,Vila de Rei,Boa Farinha,Boa Farinha,3,0,3,1,0,0,1,39.686269,-8.108626,39.686269°N 8.108626°W,"39°41,1780'N 8°6,5160'W ","39° 41' 10,68'' N 8° 6' 30,96'' W ",1770641160000,33 - Em Despacho,Intervenções em Infraestruturas e vias de comunicação,26737265,-8.108626,39.686269,20260215258,Boa Farinha,Centro,69,2026-02-09T09:00:00Z,2026-02-09,Despacho De 1º Alerta,3301,0,1,3,Despacho De 1º Alerta,Vila De Rei,Castelo Branco,Centro,-8.108626,39.686269,Queda de Árvore
39255455,20260215286,8,Em Conclusão,Em Conclusão,1,Reduzida,09/02/2026 09:04,1770627840000,2026-02-09,09:04,2026,0/03:42,222,---,3301,3,Riscos Mistos,3,"Comprometimento total ou parcial de segurança, serviços ou estruturas",1,Queda de Árvore,3301 - Queda de Árvore,3,Centro,11,Região de Coimbra,72,Cantanhede,060205,Cordinhã,Murtede, --- ,2,0,2,1,0,0,1,40.343956,-8.522691,40.343956°N 8.522691°W,"40°20,6400'N 8°31,3620'W ","40° 20' 38,40'' N 8° 31' 21,72'' W ",1770641160000,33 - Em Conclusão,Intervenções em Infraestruturas e vias de comunicação,26737293,-8.522691,40.343956,20260215286,Murtede,Centro,72,2026-02-09T09:04:00Z,2026-02-09,Em resolução/conclusão,3301,0,1,2,Resolução/Conclusão,Cantanhede,Coimbra,Centro,-8.522691,40.343956,Queda de Árvore
39255456,20260215390,5,Despacho de 1º Alerta,Em Despacho,1,Reduzida,09/02/2026 09:20,1770628800000,2026-02-09,09:20,2026,0/03:26,206,---,3301,3,Riscos Mistos,3,"Comprometimento total ou parcial de segurança, serviços ou estruturas",1,Queda de Árvore,3301 - Queda de Árvore,3,Centro,11,Região de Coimbra,72,Cantanhede,060214,Tocha,TOCHA,N109,4,0,4,2,0,0,2,40.316813,-8.756653,40.316813°N 8.756653°W,"40°19,0080'N 8°45,4020'W ","40° 19' 0,48'' N 8° 45' 24,12'' W ",1770641160000,33 - Em Despacho,Intervenções em Infraestruturas e vias de comunicação,26737397,-8.756653,40.316813,20260215390,TOCHA,Centro,72,2026-02-09T09:20:00Z,2026-02-09,Despacho De 1º Alerta,3301,0,2,4,Despacho De 1º Alerta,Cantanhede,Coimbra,Centro,-8.756653,40.316813,Queda de Árvore
39255457,20260215391,5,Despacho de 1º Alerta,Em Despacho,1,Reduzida,09/02/2026 09:22,1770628920000,2026-02-09,09:22,2026,0/03:24,204,---,3315,3,Riscos Mistos,3,"Comprometimento total ou parcial de segurança, serviços ou estruturas",15,Inundação de estruturas ou superfícies por precipitação intensa,3315 - Inundação de estruturas ou superfícies por precipitação intensa,3,Centro,13,Viseu Dão Lafões,256,Carregal do Sal,180208,Carregal do Sal,Casal Mendo,Rua do Carreiro Nº2,2,0,2,1,0,0,1,40.419282,-7.995262,40.419282°N 7.995262°W,"40°25,1580'N 7°59,7180'W ","40° 25' 9,48'' N 7° 59' 43,08'' W ",1770641160000,33 - Em Despacho,Intervenções em Infraestruturas e vias de comunicação,26737398,-7.995262,40.419282,20260215391,Casal Mendo,Centro,256,2026-02-09T09:22:00Z,2026-02-09,Despacho De 1º Alerta,3315,0,1,2,Despacho De 1º Alerta,Carregal Do Sal,Viseu,Centro,-7.995262,40.419282,Inundação de estruturas ou superfícies por precipitação intensa
39255458,20260215409,5,Despacho de 1º Alerta,Em Despacho,1,Reduzida,09/02/2026 09:19,1770628740000,2026-02-09,09:19,2026,0/03:27,207,---,3301,3,Riscos Mistos,3,"Comprometimento total ou parcial de segurança, serviços ou estruturas",1,Queda de Árvore,3301 - Queda de Árvore,3,Centro,12,Região de Leiria,147,Porto de Mós,101606,Juncal,JUNCAL,Beco do Outeiro,2,0,2,1,0,0,1,39.603593,-8.896898,39.603593°N 8.896898°W,"39°36,2160'N 8°53,8140'W ","39° 36' 12,96'' N 8° 53' 48,84'' W ",1770641160000,33 - Em Despacho,Intervenções em Infraestruturas e vias de comunicação,26737416,-8.896898,39.603593,20260215409,JUNCAL,Centro,147,2026-02-09T09:19:00Z,2026-02-09,Despacho De 1º Alerta,3301,0,1,2,Despacho De 1º Alerta,Porto De Mós,Leiria,Centro,-8.896898,39.603593,Queda de Árvore
39255459,20260215421,5,Despacho de 1º Alerta,Em Despacho,1,Reduzida,09/02/2026 09:09,1770628140000,2026-02-09,09:09,2026,0/03:37,217,---,3301,3,Riscos Mistos,3,"Comprometimento total ou parcial de segurança, serviços ou estruturas",1,Queda de Árvore,3301 - Queda de Árvore,3,Centro,15,Beira Baixa,68,Sertã,050912,Sertã,Sertã,Av. Padre Manuel Antunes,14,0,14,4,0,0,2,39.808756,-8.103914,39.808756°N 8.103914°W,"39°48,5280'N 8°6,2340'W ","39° 48' 31,68'' N 8° 6' 14,04'' W ",1770641160000,33 - Em Despacho,Intervenções em Infraestruturas e vias de comunicação,26737428,-8.103914,39.808756,20260215421,Sertã,Centro,68,2026-02-09T09:09:00Z,2026-02-09,Despacho De 1º Alerta,3301,0,4,14,Despacho De 1º Alerta,Sertã,Castelo Branco,Centro,-8.103914,39.808756,Queda de Árvore
39255460,20260215449,5,Chegada ao TO,Em Despacho,1,Reduzida,09/02/2026 09:09,1770628140000,2026-02-09,09:09,2026,0/03:37,217,---,3301,3,Riscos Mistos,3,"Comprometimento total ou parcial de segurança, serviços ou estruturas",1,Queda de Árvore,3301 - Queda de Árvore,3,Centro,15,Beira Baixa,68,Sertã,050912,Sertã,Sertã,Piscinas Municipais,9,0,9,2,0,0,2,39.808756,-8.103914,39.808756°N 8.103914°W,"39°48,5280'N 8°6,2340'W ","39° 48' 31,68'' N 8° 6' 14,04'' W ",1770641160000,33 - Em Curso,Intervenções em Infraestruturas e vias de comunicação,26737456,-8.103914,39.808756,20260215449,Sertã,Centro,68,2026-02-09T09:09:00Z,2026-02-09,Chegada Ao to,3301,0,2,9,Chegada Ao to,Sertã,Castelo Branco,Centro,-8.103914,39.808756,Queda de Árvore
39255461,20260215462,5,Despacho de 1º Alerta,Em Despacho,1,Reduzida,09/02/2026 09:25,1770629100000,2026-02-09,09:25,2026,0/03:21,201,---,3301,3,Riscos Mistos,3,"Comprometimento total ou parcial de segurança, serviços ou estruturas",1,Queda de Árvore,3301 - Queda de Árvore,4,Lisboa e Vale do Tejo,16,Oeste,151,Cadaval,110401,Alguber,Gouxaria,Estrada da Ribeira,2,0,2,1,0,0,1,39.276719,-9.013852,39.276719°N 9.013852°W,"39°16,6020'N 9°0,8340'W ","39° 16' 36,12'' N 9° 0' 50,04'' W ",1770641160000,33 - Em Despacho,Intervenções em Infraestruturas e vias de comunicação,26737469,-9.013852,39.276719,20260215462,Gouxaria,Lisboa e Vale do Tejo,151,2026-02-09T09:25:00Z,2026-02-09,Despacho De 1º Alerta,3301,0,1,2,Despacho De 1º Alerta,Cadaval,Lisboa,Centro,-9.013852,39.276719,Queda de Árvore
39255462,20260215495,5,Despacho de 1º Alerta,Em Despacho,1,Reduzida,09/02/2026 09:22,1770628920000,2026-02-09,09:22,2026,0/03:24,204,---,3315,3,Riscos Mistos,3,"Comprometimento total ou parcial de segurança, serviços ou estruturas",15,Inundação de estruturas ou superfícies por precipitação intensa,3315 - Inundação de estruturas ou superfícies por precipitação intensa,4,Lisboa e Vale do Tejo,1,Grande Lisboa,157,Oeiras,111012,"Algés, Linda-a-Velha e Cruz Quebrada-Dafundo",Algés,rua margarida Paulla nº 16 B,2,0,2,1,0,0,1,38.696612,-9.22967,38.696612°N 9.229670°W,"38°41,7960'N 9°13,7820'W ","38° 41' 47,76'' N 9° 13' 46,92'' W ",1770641160000,33 - Em Despacho,Intervenções em Infraestruturas e vias de comunicação,26737502,-9.22967,38.696612,20260215495,Algés,Lisboa e Vale do Tejo,157,2026-02-09T09:22:00Z,2026-02-09,Despacho De 1º Alerta,3315,0,1,2,Despacho De 1º Alerta,Oeiras,Lisboa,Área Metropolitana De Lisboa,-9.22967,38.696612,Inundação de estruturas ou superfícies por precipitação intensa
39255463,20260215558,5,Despacho de 1º Alerta,Em Despacho,1,Reduzida,09/02/2026 09:20,1770628800000,2026-02-09,09:20,2026,0/03:26,206,---,3301,3,Riscos Mistos,3,"Comprometimento total ou parcial de segurança, serviços ou estruturas",1,Queda de Árvore,3301 - Queda de Árvore,5,Alentejo,19,Alentejo Litoral,30,Odemira,021102,Relíquias,ODEMIRA,N263 km11,2,0,2,1,0,0,1,37.670902,-8.530582,37.670902°N 8.530582°W,"37°40,2540'N 8°31,8360'W ","37° 40' 15,24'' N 8° 31' 50,16'' W ",1770641160000,33 - Em Despacho,Intervenções em Infraestruturas e vias de comunicação,26737565,-8.530582,37.670902,20260215558,ODEMIRA,Alentejo,30,2026-02-09T09:20:00Z,2026-02-09,Despacho De 1º Alerta,3301,0,1,2,Despacho De 1º Alerta,Odemira,Beja,Alentejo,-8.530582,37.670902,Queda de Árvore
39255464,20260215574,6,Em Curso,Em Curso,0,N/A,09/02/2026 09:47,1770630420000,2026-02-09,09:47,2026,0/02:59,179,---,4305,4,Protecção e Assistência a Pessoas e Bens,3,Assistência e Prevenção a actividades humanas,5,Limpeza de Via e Sinalização de Perigo,4305 - Limpeza de Via e Sinalização de Perigo,4,Lisboa e Vale do Tejo,18,Lezíria do Tejo,210,Rio Maior,141417,Outeiro da Cortiçada e Arruda Dos Pisões,Correias,Rua 1º de Dezembro,2,0,2,1,0,0,1,39.330439,-8.833381,39.330439°N 8.833381°W,"39°19,8240'N 8°50,0040'W ","39° 19' 49,44'' N 8° 50' 0,24'' W ",1770641160000,43 - Em Curso,Outras ocorrências de proteção e socorro,26737581,-8.833381,39.330439,20260215574,Correias,Lisboa e Vale do Tejo,210,2026-02-09T09:47:00Z,2026-02-09,Em Curso,4305,0,1,2,Curso,Rio Maior,Santarém,Alentejo,-8.833381,39.330439,Limpeza de Via e Sinalização de Perigo
39255465,20260215578,8,Em Conclusão,Em Conclusão,1,Reduzida,09/02/2026 09:40,1770630000000,2026-02-09,09:40,2026,0/03:06,186,---,3301,3,Riscos Mistos,3,"Comprometimento total ou parcial de segurança, serviços ou estruturas",1,Queda de Árvore,3301 - Queda de Árvore,5,Alentejo,22,Baixo Alentejo,21,Almodôvar,020203,Rosário,ROSÁRIO,ROSÁRIO,0,0,0,0,0,0,0,37.60536,-8.080978,37.605360°N 8.080978°W,"37°36,3240'N 8°4,8600'W ","37° 36' 19,44'' N 8° 4' 51,60'' W ",1770641160000,33 - Em Conclusão,Intervenções em Infraestruturas e vias de comunicação,26737585,-8.080978,37.60536,20260215578,ROSÁRIO,Alentejo,21,2026-02-09T09:40:00Z,2026-02-09,Em resolução/conclusão,3301,0,0,0,Resolução/Conclusão,Almodôvar,Beja,Alentejo,-8.080978,37.60536,Queda de Árvore
39255466,20260215603,5,Despacho de 1º Alerta,Em Despacho,1,Reduzida,09/02/2026 09:40,1770630000000,2026-02-09,09:40,2026,0/03:06,186,---,3315,3,Riscos Mistos,3,"Comprometimento total ou parcial de segurança, serviços ou estruturas",15,Inundação de estruturas ou superfícies por precipitação intensa,3315 - Inundação de estruturas ou superfícies por precipitação intensa,2,Norte,5,Area M. Porto,192,Santo Tirso,131437,"St.tirso, Couto (S.cristina e S.miguel) e Burgães",Santo Tirso,Rua Alto da Cruz,4,0,4,2,0,0,1,41.348144,-8.473671,41.348144°N 8.473671°W,"41°20,8860'N 8°28,4220'W ","41° 20' 53,16'' N 8° 28' 25,32'' W ",1770641160000,33 - Em Despacho,Intervenções em Infraestruturas e vias de comunicação,26737610,-8.473671,41.348144,20260215603,Santo Tirso,Norte,192,2026-02-09T09:40:00Z,2026-02-09,Despacho De 1º Alerta,3315,0,2,4,Despacho De 1º Alerta,Santo Tirso,Porto,Norte,-8.473671,41.348144,Inundação de estruturas ou superfícies por precipitação intensa
39255467,20260215606,5,Chegada ao TO,Em Despacho,1,Reduzida,09/02/2026 09:20,1770628800000,2026-02-09,09:20,2026,0/03:26,206,---,3315,3,Riscos Mistos,3,"Comprometimento total ou parcial de segurança, serviços ou estruturas",15,Inundação de estruturas ou superfícies por precipitação intensa,3315 - Inundação de estruturas ou superfícies por precipitação intensa,3,Centro,14,Beiras e Serra da Estrela,123,Gouveia,090625,Gouveia (São Pedro e São Julião),GOUVEIA, --- ,2,0,2,1,0,0,1,40.497325,-7.586951,40.497325°N 7.586951°W,"40°29,8380'N 7°35,2200'W ","40° 29' 50,28'' N 7° 35' 13,20'' W ",1770641160000,33 - Em Curso,Intervenções em Infraestruturas e vias de comunicação,26737613,-7.586951,40.497325,20260215606,GOUVEIA,Centro,123,2026-02-09T09:20:00Z,2026-02-09,Chegada Ao to,3315,0,1,2,Chegada Ao to,Gouveia,Guarda,Centro,-7.586951,40.497325,Inundação de estruturas ou superfícies por precipitação intensa
39255468,20260215612,5,Despacho de 1º Alerta,Em Despacho,1,Reduzida,09/02/2026 09:24,1770629040000,2026-02-09,09:24,2026,0/03:22,202,---,3301,3,Riscos Mistos,3,"Comprometimento total ou parcial de segurança, serviços ou estruturas",1,Queda de Árvore,3301 - Queda de Árvore,3,Centro,12,Região de Leiria,140,Leiria,100913,Maceira,MACEIRA,Rua do Casalinho,2,0,2,1,0,0,1,39.686501,-8.889652,39.686501°N 8.889652°W,"39°41,1900'N 8°53,3820'W ","39° 41' 11,40'' N 8° 53' 22,92'' W ",1770641160000,33 - Em Despacho,Intervenções em Infraestruturas e vias de comunicação,26737619,-8.889652,39.686501,20260215612,MACEIRA,Centro,140,2026-02-09T09:24:00Z,2026-02-09,Despacho De 1º Alerta,3301,0,1,2,Despacho De 1º Alerta,Leiria,Leiria,Centro,-8.889652,39.686501,Queda de Árvore
39255469,20260215630,6,Em Curso,Em Curso,0,N/A,09/02/2026 09:50,1770630600000,2026-02-09,09:50,2026,0/02:56,176,---,4305,4,Protecção e Assistência a Pessoas e Bens,3,Assistência e Prevenção a actividades humanas,5,Limpeza de Via e Sinalização de Perigo,4305 - Limpeza de Via e Sinalização de Perigo,2,Norte,6,Tâmega e Sousa,180,Baião,130215,Santa Marinha do Zêzere,Santa Marinha do Zêzere,Rua da Ermida,2,0,2,1,0,0,1,41.138624,-7.950478,41.138624°N 7.950478°W,"41°8,3160'N 7°57,0300'W ","41° 8' 18,96'' N 7° 57' 1,80'' W ",1770641160000,43 - Em Curso,Outras ocorrências de proteção e socorro,26737637,-7.950478,41.138624,20260215630,Santa Marinha do Zêzere,Norte,180,2026-02-09T09:50:00Z,2026-02-09,Em Curso,4305,0,1,2,Curso,Baião,Porto,Norte,-7.950478,41.138624,Limpeza de Via e Sinalização de Perigo
39255470,20260215674,7,Em Resolução,Em Resolução,1,Reduzida,09/02/2026 09:05,1770627900000,2026-02-09,09:05,2026,0/03:41,221,---,3309,3,Riscos Mistos,3,"Comprometimento total ou parcial de segurança, serviços ou estruturas",9,Desabamento de estruturas edificadas,3309 - Desabamento de estruturas edificadas,5,Alentejo,20,Alto Alentejo,175,Nisa,121211,Arez e Amieira do Tejo,AMIEIRA,Rua de Palhais,1,0,1,1,1,0,1,39.509327,-7.822648,39.509327°N 7.822648°W,"39°30,5580'N 7°49,3560'W ","39° 30' 33,48'' N 7° 49' 21,36'' W ",1770641160000,33 - Em Resolução,Intervenções em Infraestruturas e vias de comunicação,26737681,-7.822648,39.509327,20260215674,AMIEIRA,Alentejo,175,2026-02-09T09:05:00Z,2026-02-09,Em resolução/conclusão,3309,0,1,1,Resolução/Conclusão,Nisa,Portalegre,Alentejo,-7.822648,39.509327,Desabamento de estruturas edificadas
39255471,20260215681,5,Despacho de 1º Alerta,Em Despacho,1,Reduzida,09/02/2026 09:30,1770629400000,2026-02-09,09:30,2026,0/03:16,196,---,3301,3,Riscos Mistos,3,"Comprometimento total ou parcial de segurança, serviços ou estruturas",1,Queda de Árvore,3301 - Queda de Árvore,3,Centro,15,Beira Baixa,67,Proença-a-Nova,050807,Proença-a-Nova e Peral,Fábrica de Aglomerados Sotima,PEPA,4,0,4,1,0,0,1,39.71756,-7.898692,39.717560°N 7.898692°W,"39°43,0560'N 7°53,9220'W ","39° 43' 3,36'' N 7° 53' 55,32'' W ",1770641160000,33 - Em Despacho,Intervenções em Infraestruturas e vias de comunicação,26737688,-7.898692,39.71756,20260215681,Fábrica de Aglomerados Sotima,Centro,67,2026-02-09T09:30:00Z,2026-02-09,Despacho De 1º Alerta,3301,0,1,4,Despacho De 1º Alerta,Proença-a-nova,Castelo Branco,Centro,-7.898692,39.71756,Queda de Árvore
39255472,20260215699,5,Despacho de 1º Alerta,Em Despacho,1,Reduzida,09/02/2026 09:30,1770629400000,2026-02-09,09:30,2026,0/03:16,196,---,3301,3,Riscos Mistos,3,"Comprometimento total ou parcial de segurança, serviços ou estruturas",1,Queda de Árvore,3301 - Queda de Árvore,3,Centro,15,Beira Baixa,67,Proença-a-Nova,050808,Sobreira Formosa e Alvito da Beira,Figueira,Figueira,4,0,4,1,0,0,1,39.752598,-7.858902,39.752598°N 7.858902°W,"39°45,1560'N 7°51,5340'W ","39° 45' 9,36'' N 7° 51' 32,04'' W ",1770641160000,33 - Em Despacho,Intervenções em Infraestruturas e vias de comunicação,26737706,-7.858902,39.752598,20260215699,Figueira,Centro,67,2026-02-09T09:30:00Z,2026-02-09,Despacho De 1º Alerta,3301,0,1,4,Despacho De 1º Alerta,Proença-a-nova,Castelo Branco,Centro,-7.858902,39.752598,Queda de Árvore
39255473,20260215726,5,Despacho de 1º Alerta,Em Despacho,1,Reduzida,09/02/2026 09:30,1770629400000,2026-02-09,09:30,2026,0/03:16,196,---,3301,3,Riscos Mistos,3,"Comprometimento total ou parcial de segurança, serviços ou estruturas",1,Queda de Árvore,3301 - Queda de Árvore,3,Centro,15,Beira Baixa,67,Proença-a-Nova,050807,Proença-a-Nova e Peral,Folga,Folga,4,0,4,1,0,0,1,39.779821,-7.966185,39.779821°N 7.966185°W,"39°46,7880'N 7°57,9720'W ","39° 46' 47,28'' N 7° 57' 58,32'' W ",1770641160000,33 - Em Despacho,Intervenções em Infraestruturas e vias de comunicação,26737733,-7.966185,39.779821,20260215726,Folga,Centro,67,2026-02-09T09:30:00Z,2026-02-09,Despacho De 1º Alerta,3301,0,1,4,Despacho De 1º Alerta,Proença-a-nova,Castelo Branco,Centro,-7.966185,39.779821,Queda de Árvore
39255474,20260215741,5,Despacho de 1º Alerta,Em Despacho,1,Reduzida,09/02/2026 09:30,1770629400000,2026-02-09,09:30,2026,0/03:16,196,---,3301,3,Riscos Mistos,3,"Comprometimento total ou parcial de segurança, serviços ou estruturas",1,Queda de Árvore,3301 - Queda de Árvore,3,Centro,15,Beira Baixa,67,Proença-a-Nova,050808,Sobreira Formosa e Alvito da Beira,Sobreira Formosa,Sobreira Formosa,4,0,4,1,0,0,1,39.770586,-7.848327,39.770586°N 7.848327°W,"39°46,2360'N 7°50,8980'W ","39° 46' 14,16'' N 7° 50' 53,88'' W ",1770641160000,33 - Em Despacho,Intervenções em Infraestruturas e vias de comunicação,26737748,-7.848327,39.770586,20260215741,Sobreira Formosa,Centro,67,2026-02-09T09:30:00Z,2026-02-09,Despacho De 1º Alerta,3301,0,1,4,Despacho De 1º Alerta,Proença-a-nova,Castelo Branco,Centro,-7.848327,39.770586,Queda de Árvore
39255475,20260215758,7,Em Resolução,Em Resolução,1,Reduzida,09/02/2026 10:01,1770631260000,2026-02-09,10:01,2026,0/02:45,165,---,3313,3,Riscos Mistos,3,"Comprometimento total ou parcial de segurança, serviços ou estruturas",13,Movimento de massa,3313 - Movimento de massa,4,Lisboa e Vale do Tejo,16,Oeste,145,Peniche,101402,Atouguia da Baleia,Bolhos,Rua de Santo António,0,0,0,0,0,0,0,39.30678,-9.284354,39.306780°N 9.284354°W,"39°18,4080'N 9°17,0640'W ","39° 18' 24,48'' N 9° 17' 3,84'' W ",1770641160000,33 - Em Resolução,Intervenções em Infraestruturas e vias de comunicação,26737765,-9.284354,39.30678,20260215758,Bolhos,Lisboa e Vale do Tejo,145,2026-02-09T10:01:00Z,2026-02-09,Em resolução/conclusão,3313,0,0,0,Resolução/Conclusão,Peniche,Leiria,Centro,-9.284354,39.30678,Movimento de massa
39255476,20260215763,5,Despacho de 1º Alerta,Em Despacho,1,Reduzida,09/02/2026 09:30,1770629400000,2026-02-09,09:30,2026,0/03:16,196,---,3301,3,Riscos Mistos,3,"Comprometimento total ou parcial de segurança, serviços ou estruturas",1,Queda de Árvore,3301 - Queda de Árvore,3,Centro,15,Beira Baixa,65,Oleiros,050614,Oleiros-Amieira,Roda,Roda,4,0,4,2,0,0,2,39.897611,-7.863005,39.897611°N 7.863005°W,"39°53,8560'N 7°51,7800'W ","39° 53' 51,36'' N 7° 51' 46,80'' W ",1770641160000,33 - Em Despacho,Intervenções em Infraestruturas e vias de comunicação,26737770,-7.863005,39.897611,20260215763,Roda,Centro,65,2026-02-09T09:30:00Z,2026-02-09,Despacho De 1º Alerta,3301,0,2,4,Despacho De 1º Alerta,Oleiros,Castelo Branco,Centro,-7.863005,39.897611,Queda de Árvore
39255477,20260215780,5,Despacho de 1º Alerta,Em Despacho,1,Reduzida,09/02/2026 09:30,1770629400000,2026-02-09,09:30,2026,0/03:16,196,---,3301,3,Riscos Mistos,3,"Comprometimento total ou parcial de segurança, serviços ou estruturas",1,Queda de Árvore,3301 - Queda de Árvore,3,Centro,15,Beira Baixa,65,Oleiros,050611,Sobral,Sobral de Cima,EM 528 - Sobral de Cima,8,0,8,2,0,0,2,39.949193,-8.009073,39.949193°N 8.009073°W,"39°56,9520'N 8°0,5460'W ","39° 56' 57,12'' N 8° 0' 32,76'' W ",1770641160000,33 - Em Despacho,Intervenções em Infraestruturas e vias de comunicação,26737787,-8.009073,39.949193,20260215780,Sobral de Cima,Centro,65,2026-02-09T09:30:00Z,2026-02-09,Despacho De 1º Alerta,3301,0,2,8,Despacho De 1º Alerta,Oleiros,Castelo Branco,Centro,-8.009073,39.949193,Queda de Árvore
39255478,20260215799,5,Despacho de 1º Alerta,Em Despacho,1,Reduzida,09/02/2026 09:10,1770628200000,2026-02-09,09:10,2026,0/03:36,216,---,3301,3,Riscos Mistos,3,"Comprometimento total ou parcial de segurança, serviços ou estruturas",1,Queda de Árvore,3301 - Queda de Árvore,3,Centro,15,Beira Baixa,68,Sertã,050915,"Cernache do Bonjardim, Nesperal e Palhais",Quintã,Quintã,2,0,2,1,0,0,1,39.789827,-8.198486,39.789827°N 8.198486°W,"39°47,3880'N 8°11,9100'W ","39° 47' 23,28'' N 8° 11' 54,60'' W ",1770641160000,33 - Em Despacho,Intervenções em Infraestruturas e vias de comunicação,26737806,-8.198486,39.789827,20260215799,Quintã,Centro,68,2026-02-09T09:10:00Z,2026-02-09,Despacho De 1º Alerta,3301,0,1,2,Despacho De 1º Alerta,Sertã,Castelo Branco,Centro,-8.198486,39.789827,Queda de Árvore
