"id","address","subregion","neighborhood","date","id.1","state","nature","nature_description","aerial_means","terrestrial_means","aquatic_means","operational","date.1","Concelho","Distrito","NUTII_DSG","longitude","latitude"
24566120,"Campo de Ourique","Grande Lisboa",311,"2024-11-18T23:53:00",24566120,"Em curso","2101","Incêndio em edifícios habitacionais",0,0,0,0,"2024-11-18T23:53:00","Lisboa","Lisboa","Área Metropolitana De Lisboa",-9.16326,38.71641
24566289,"Sertã","Beira Baixa",310,"2024-11-19T01:59:00",24566289,"Em conclusão","2407","Despiste",0,6,0,14,"2024-11-19T01:59:00","Sertã","Castelo Branco","Centro",-8.12435,39.823042
24360487,"Mões","Viseu Dão Lafões",310,"2024-10-03T08:00:00",24360487,"Em curso","4339","Corte ou remoção de elementos",0,0,0,0,"2024-10-03T08:00:00","Castro Daire","Viseu","Centro",-7.893519,40.867571
24523090,"Carnaxide e Queijas","Grande Lisboa",311,"2024-11-08T18:49:00",24523090,"Em curso","9119","Missão internacional de assistência",0,47,0,102,"2024-11-08T18:49:00","Oeiras","Lisboa","Área Metropolitana De Lisboa",-9.243421,38.725234
24566319,"Palmela","Península de Setúbal",311,"2024-11-19T02:42:00",24566319,"Em despacho","3317","Inundação de estruturas por água canalizada",0,1,0,2,"2024-11-19T02:42:00","Palmela","Setúbal","Área Metropolitana De Lisboa",-8.883534,38.571434
