"id","address","subregion","neighborhood","date","id.1","state","nature","nature_description","aerial_means","terrestrial_means","aquatic_means","operational","date.1","Concelho","Distrito","NUTII_DSG","longitude","latitude"
24842263,"São Domingos de Rana","Grande Lisboa",311,"2025-01-20T00:49:00",24842263,"Em conclusão","2407","Despiste",0,1,0,2,"2025-01-20T00:49:00","Cascais","Lisboa","Área Metropolitana De Lisboa",-9.352849,38.708001
24842235,"Milheirós de Poiares","Area M. Porto",309,"2025-01-20T00:37:00",24842235,"Em conclusão","2301","Incêndio em transporte rodoviário",0,4,0,9,"2025-01-20T00:37:00","Santa Maria Da Feira","Aveiro","Norte",-8.47845,40.93331
24842269,"Adaúfe","Cávado",309,"2025-01-20T01:04:00",24842269,"Em despacho","3301","Queda de árvore",0,1,0,3,"2025-01-20T01:04:00","Braga","Braga","Norte",-8.4077,41.60469
24842071,"Aldeia Galega da Merceana e Aldeia Gavinha","Oeste",311,"2025-01-19T23:00:00",24842071,"Em conclusão","2111","Incêndio em edifícios hospitalares e lares de idosos",0,5,0,12,"2025-01-19T23:00:00","Alenquer","Lisboa","Centro",-9.083165,39.088824
24842339,"Castro Daire","Viseu Dão Lafões",310,"2025-01-20T01:57:00",24842339,"Em despacho","2127","Incêndio em edifícios e recintos industriais, oficinas e armazéns",0,2,0,7,"2025-01-20T01:57:00","Castro Daire","Viseu","Centro",-7.9408,40.925289
24840793,"Alcabideche","Grande Lisboa",311,"2025-01-19T15:38:00",24840793,"Em conclusão","2201","Incêndio em equipamentos ou produtos",0,2,0,6,"2025-01-19T15:38:00","Cascais","Lisboa","Área Metropolitana De Lisboa",-9.430278,38.730587
24842331,"Almancil","Algarve",313,"2025-01-20T01:57:00",24842331,"Em curso","2201","Incêndio em equipamentos ou produtos",0,1,0,5,"2025-01-20T01:57:00","Loulé","Faro","Algarve",-8.03831,37.08693
