"id","address","subregion","neighborhood","date","id.1","state","nature","nature_description","aerial_means","terrestrial_means","aquatic_means","operational","date.1","Concelho","Distrito","NUTII_DSG","longitude","latitude"
25071496,"São Manços e São Vicente do Pigeiro","Alentejo Central",312,"2025-03-11T13:18:00",25071496,"Em conclusão","1101","Cheia",0,0,0,0,"2025-03-11T13:18:00","Évora","Évora","Alentejo",-7.713313,38.513673
25377853,"Sé, Santa Maria e Meixedo","Terras de Trás-os-Montes",309,"2025-05-15T15:21:00",25377853,"Em despacho","4331","Busca e resgate terrestre de animais",0,1,0,2,"2025-05-15T15:21:00","Bragança","Bragança","Norte",-6.761223,41.813164
25379950,"Vila Verde Dos Francos","Oeste",311,"2025-05-16T02:10:00",25379950,"Em resolução","2127","Incêndio em edifícios e recintos industriais, oficinas e armazéns",0,15,0,40,"2025-05-16T02:10:00","Alenquer","Lisboa","Centro",-9.126213,39.177326
25366291,"Matosinhos e Leça da Palmeira","Area M. Porto",309,"2025-05-12T23:59:00",25366291,"Em curso","9115","Operação nacional de assistência",0,31,0,110,"2025-05-12T23:59:00","Matosinhos","Porto","Norte",-8.682603,41.186161
25380154,"Camarate, Unhos e Apelação","Grande Lisboa",311,"2025-05-16T06:04:00",25380154,"Em curso","3323","Dano na rede de abastecimento de água",0,1,0,6,"2025-05-16T06:04:00","Loures","Lisboa","Área Metropolitana De Lisboa",-9.12883611517352,38.8097046248512
