"id","address","subregion","neighborhood","date","id.1","state","nature","nature_description","aerial_means","terrestrial_means","aquatic_means","operational","date.1","Concelho","Distrito","NUTII_DSG","longitude","latitude"
25031633,"Alcabideche","Grande Lisboa",311,"2025-03-02T15:04:00",25031633,"Em conclusão","4329","Busca e resgate aquático de pessoas",0,0,0,0,"2025-03-02T15:04:00","Cascais","Lisboa","Área Metropolitana De Lisboa",-9.47686,38.75392
25026516,"Melres e Medas","Area M. Porto",309,"2025-03-01T11:41:00",25026516,"Em conclusão","4329","Busca e resgate aquático de pessoas",0,0,0,0,"2025-03-01T11:41:00","Gondomar","Porto","Norte",-8.458103,41.061746
25033285,"Albufeira e Olhos de Água","Algarve",313,"2025-03-03T00:26:00",25033285,"Em curso","2403","Colisão rodoviária",0,2,0,4,"2025-03-03T00:26:00","Albufeira","Faro","Algarve",-8.244876,37.091665
25033344,"Vila Chã","Cávado",309,"2025-03-03T01:10:00",25033344,"Em conclusão","2101","Incêndio em edifícios habitacionais",0,6,0,14,"2025-03-03T01:10:00","Esposende","Braga","Norte",-8.760232,41.567458
25033359,"Macieira","Tâmega e Sousa",309,"2025-03-03T01:20:00",25033359,"Em resolução","2407","Despiste",0,3,0,8,"2025-03-03T01:20:00","Lousada","Porto","Norte",-8.237338,41.287175
24877003,"Malagueira e Horta Das Figueiras","Alentejo Central",312,"2025-01-27T11:41:00",24877003,"Em conclusão","3315","Inundação de estruturas por precipitação intensa",0,0,0,0,"2025-01-27T11:41:00","Évora","Évora","Alentejo",-7.924277,38.57285
25033220,"S.pedro e Santiago, S.maria e S.miguel e Matacães","Oeste",311,"2025-03-02T23:39:00",25033220,"Em despacho","3317","Inundação de estruturas por água canalizada",0,1,0,2,"2025-03-02T23:39:00","Torres Vedras","Lisboa","Centro",-9.257516,39.078264
