"id","address","subregion","neighborhood","date","id.1","state","nature","nature_description","aerial_means","terrestrial_means","aquatic_means","operational","date.1","Concelho","Distrito","NUTII_DSG","longitude","latitude"
24725352,"Aldeia do Bispo, Águas e Aldeia de João Pires","Beira Baixa",310,"2024-12-24T19:28:00",24725352,"Em conclusão","2407","Despiste",0,1,0,2,"2024-12-24T19:28:00","Penamacor","Castelo Branco","Centro",-7.149142,40.103596
24725629,"Fontes","Médio Tejo",311,"2024-12-24T21:08:00",24725629,"Em conclusão","3103","Incêndio rural",0,2,0,7,"2024-12-24T21:08:00","Abrantes","Santarém","Centro",-8.228915,39.599253
24725720,"Venteira","Grande Lisboa",311,"2024-12-24T21:39:00",24725720,"Em conclusão","3201","Detritos não confinados",0,1,0,6,"2024-12-24T21:39:00","Amadora","Lisboa","Área Metropolitana De Lisboa",-9.24796,38.75748
24725795,"Mangualde, Mesquitela e Cunha Alta","Viseu Dão Lafões",310,"2024-12-24T21:53:00",24725795,"Em despacho","2101","Incêndio em edifícios habitacionais",0,1,0,2,"2024-12-24T21:53:00","Mangualde","Viseu","Centro",-7.764584,40.587178
24725671,"Massamá e Monte Abraão","Grande Lisboa",311,"2024-12-24T21:23:00",24725671,"Em conclusão","2101","Incêndio em edifícios habitacionais",0,3,0,9,"2024-12-24T21:23:00","Sintra","Lisboa","Área Metropolitana De Lisboa",-9.2763,38.76025
24725694,"Ponte do Rol","Oeste",311,"2024-12-24T21:25:00",24725694,"Em despacho","2401","Atropelamento rodoviário",0,3,0,6,"2024-12-24T21:25:00","Torres Vedras","Lisboa","Centro",-9.319649,39.090897
24725703,"Maçainhas","Beiras e Serra da Estrela",310,"2024-12-24T21:28:00",24725703,"Em conclusão","2201","Incêndio em equipamentos ou produtos",0,2,0,5,"2024-12-24T21:28:00","Belmonte","Castelo Branco","Centro",-7.307501,40.391208
24725769,"Covilhã e Canhoso","Beiras e Serra da Estrela",310,"2024-12-24T21:54:00",24725769,"Em despacho","2101","Incêndio em edifícios habitacionais",0,1,0,2,"2024-12-24T21:54:00","Covilhã","Castelo Branco","Centro",-7.519359,40.276354
24725257,"Laranjeiro e Feijó","Península de Setúbal",311,"2024-12-24T18:50:00",24725257,"Em conclusão","3201","Detritos não confinados",0,1,0,4,"2024-12-24T18:50:00","Almada","Setúbal","Área Metropolitana De Lisboa",-9.156624,38.652235
24725623,"Avintes","Area M. Porto",309,"2024-12-24T21:05:00",24725623,"Em conclusão","2101","Incêndio em edifícios habitacionais",0,7,0,19,"2024-12-24T21:05:00","Vila Nova De Gaia","Porto","Norte",-8.54875,41.11928
24703973,"Olhão","Algarve",313,"2024-12-19T22:06:00",24703973,"Em despacho","4331","Busca e resgate terrestre de animais",0,0,0,0,"2024-12-19T22:06:00","Olhão","Faro","Algarve",-7.84764,37.029053
24725481,"Sé e São Lourenço","Alto Alentejo",312,"2024-12-24T20:06:00",24725481,"Em conclusão","2301","Incêndio em transporte rodoviário",0,5,0,12,"2024-12-24T20:06:00","Portalegre","Portalegre","Alentejo",-7.421752,39.271332
24725499,"Juncal","Região de Leiria",310,"2024-12-24T19:59:00",24725499,"Em resolução","2403","Colisão rodoviária",0,7,0,18,"2024-12-24T19:59:00","Porto De Mós","Leiria","Centro",-8.896898,39.603593
24725532,"Panoias de Cima","Beiras e Serra da Estrela",310,"2024-12-24T20:34:00",24725532,"Em resolução","2101","Incêndio em edifícios habitacionais",0,3,0,9,"2024-12-24T20:34:00","Guarda","Guarda","Centro",-7.215395,40.500512
24725685,"Braga (Maximinos, Sé e Cividade)","Cávado",309,"2024-12-24T21:28:00",24725685,"Em conclusão","2101","Incêndio em edifícios habitacionais",0,1,0,6,"2024-12-24T21:28:00","Braga","Braga","Norte",-8.430415,41.541985
24725782,"Braga (São José de São Lázaro e São João do Souto)","Cávado",309,"2024-12-24T21:58:00",24725782,"Em despacho","2101","Incêndio em edifícios habitacionais",0,0,0,0,"2024-12-24T21:58:00","Braga","Braga","Norte",-8.42711,41.53866
