"id","address","subregion","neighborhood","date","id.1","state","nature","nature_description","aerial_means","terrestrial_means","aquatic_means","operational","date.1","Concelho","Distrito","NUTII_DSG","longitude","latitude"
24570567,"Azeitão (São Lourenço e São Simão)","Península de Setúbal",311,"2024-11-19T23:27:00",24570567,"Em despacho","4331","Busca e resgate terrestre de animais",0,1,0,2,"2024-11-19T23:27:00","Setúbal","Setúbal","Área Metropolitana De Lisboa",-8.999351,38.469742
24569858,"Setúbal (São Sebastião)","Península de Setúbal",311,"2024-11-19T19:02:00",24569858,"Em curso","2509","Acidente químico em trânsito",0,6,0,16,"2024-11-19T19:02:00","Setúbal","Setúbal","Área Metropolitana De Lisboa",-8.868915,38.55563
24570423,"Charneca de Caparica e Sobreda","Península de Setúbal",311,"2024-11-19T22:11:00",24570423,"Em curso","2403","Colisão rodoviária",0,0,0,0,"2024-11-19T22:11:00","Almada","Setúbal","Área Metropolitana De Lisboa",-9.194473,38.648295
24570524,"Longa","Douro",309,"2024-11-19T23:12:00",24570524,"Em conclusão","3321","Dano na rede de fornecimento de eletricidade ",0,2,0,6,"2024-11-19T23:12:00","Tabuaço","Viseu","Norte",-7.59302,41.05963
24570574,"Mafamude e Vilar do Paraíso","Area M. Porto",309,"2024-11-19T23:34:00",24570574,"Em despacho","3317","Inundação de estruturas por água canalizada",0,1,0,2,"2024-11-19T23:34:00","Vila Nova De Gaia","Porto","Norte",-8.611105,41.107184
24570221,"Torrados e Sousa","Tâmega e Sousa",309,"2024-11-19T21:02:00",24570221,"Em resolução","2201","Incêndio em equipamentos ou produtos",0,2,0,4,"2024-11-19T21:02:00","Felgueiras","Porto","Norte",-8.24452,41.35966
24360487,"Mões","Viseu Dão Lafões",310,"2024-10-03T08:00:00",24360487,"Em curso","4339","Corte ou remoção de elementos",0,0,0,0,"2024-10-03T08:00:00","Castro Daire","Viseu","Centro",-7.893519,40.867571
24523090,"Carnaxide e Queijas","Grande Lisboa",311,"2024-11-08T18:49:00",24523090,"Em curso","9119","Missão internacional de assistência",0,47,0,102,"2024-11-08T18:49:00","Oeiras","Lisboa","Área Metropolitana De Lisboa",-9.243421,38.725234
24570529,"Lumiar","Grande Lisboa",311,"2024-11-19T23:07:00",24570529,"Em despacho","2403","Colisão rodoviária",0,1,0,2,"2024-11-19T23:07:00","Lisboa","Lisboa","Área Metropolitana De Lisboa",-9.163492,38.769791
