"id","address","subregion","neighborhood","date","id.1","state","nature","nature_description","aerial_means","terrestrial_means","aquatic_means","operational","date.1","Concelho","Distrito","NUTII_DSG","longitude","latitude"
24623651,"Figueiras e Covas","Tâmega e Sousa",309,"2024-12-02T00:15:00",24623651,"Em conclusão","2403","Colisão rodoviária",0,2,0,4,"2024-12-02T00:15:00","Lousada","Porto","Norte",-8.333288,41.273698
24623480,"Santo António da Charneca","Península de Setúbal",311,"2024-12-01T22:46:00",24623480,"Em conclusão","2407","Despiste",0,4,0,7,"2024-12-01T22:46:00","Barreiro","Setúbal","Área Metropolitana De Lisboa",-9.025237,38.617281
24623560,"Charneca de Caparica e Sobreda","Península de Setúbal",311,"2024-12-01T23:31:00",24623560,"Em conclusão","2301","Incêndio em transporte rodoviário",0,3,0,8,"2024-12-01T23:31:00","Almada","Setúbal","Área Metropolitana De Lisboa",-9.16306,38.58382
24623663,"Tramagal","Médio Tejo",311,"2024-12-02T00:29:00",24623663,"Em curso","2127","Incêndio em edifícios e recintos industriais, oficinas e armazéns",0,4,0,10,"2024-12-02T00:29:00","Abrantes","Santarém","Centro",-8.266692,39.443009
24552947,"Pias","Baixo Alentejo",312,"2024-11-15T20:38:00",24552947,"Em conclusão","2301","Incêndio em transporte rodoviário",0,0,0,0,"2024-11-15T20:38:00","Serpa","Beja","Alentejo",-7.472605,38.015257
24623598,"Mafamude e Vilar do Paraíso","Area M. Porto",309,"2024-12-01T23:50:00",24623598,"Em conclusão","2129","Incêndio em edifícios degradados ou devolutos",0,2,0,7,"2024-12-01T23:50:00","Vila Nova De Gaia","Porto","Norte",-8.604688,41.11591
24623643,"Algueirão-Mem Martins","Grande Lisboa",311,"2024-12-02T00:16:00",24623643,"Em conclusão","2101","Incêndio em edifícios habitacionais",0,2,0,8,"2024-12-02T00:16:00","Sintra","Lisboa","Área Metropolitana De Lisboa",-9.349742,38.80552
