"id","address","subregion","neighborhood","date","id.1","state","nature","nature_description","aerial_means","terrestrial_means","aquatic_means","operational","date.1","Concelho","Distrito","NUTII_DSG","longitude","latitude"
24840796,"Vidigueira","Baixo Alentejo",312,"2025-01-19T15:50:00",24840796,"Em conclusão","3317","Inundação de estruturas por água canalizada",0,2,0,4,"2025-01-19T15:50:00","Vidigueira","Beja","Alentejo",-7.80916,38.205708
24840851,"Algés, Linda-a-Velha e Cruz Quebrada-Dafundo","Grande Lisboa",311,"2025-01-19T15:54:00",24840851,"Em curso","3323","Dano na rede de abastecimento de água",0,0,0,0,"2025-01-19T15:54:00","Oeiras","Lisboa","Área Metropolitana De Lisboa",-9.24227414640936,38.7081610512437
24840869,"Pessegueiro do Vouga","Região de Aveiro",310,"2025-01-19T16:04:00",24840869,"Em conclusão","2407","Despiste",0,2,0,4,"2025-01-19T16:04:00","Sever Do Vouga","Aveiro","Centro",-8.367434,40.709991
24841019,"Seixal, Arrentela e Aldeia de Paio Pires","Península de Setúbal",311,"2025-01-19T17:00:00",24841019,"Em curso","2407","Despiste",0,3,0,9,"2025-01-19T17:00:00","Seixal","Setúbal","Área Metropolitana De Lisboa",-9.102077,38.61358
24841044,"Cercal","Alentejo Litoral",312,"2025-01-19T17:06:00",24841044,"Em resolução","2127","Incêndio em edifícios e recintos industriais, oficinas e armazéns",0,2,0,9,"2025-01-19T17:06:00","Santiago Do Cacém","Setúbal","Alentejo",-8.68472,37.79365
24841046,"Oeiras e S. Julião da Barra, Paço de Arcos e Caxias","Grande Lisboa",311,"2025-01-19T16:58:00",24841046,"Em conclusão","2407","Despiste",0,3,0,8,"2025-01-19T16:58:00","Oeiras","Lisboa","Área Metropolitana De Lisboa",-9.290593,38.696925
24841128,"Tamengos, Aguim e Óis do Bairro","Região de Aveiro",310,"2025-01-19T17:30:00",24841128,"Em despacho","4331","Busca e resgate terrestre de animais",0,1,0,2,"2025-01-19T17:30:00","Anadia","Aveiro","Centro",-8.451195,40.407214
24840624,"Águeda e Borralha","Região de Aveiro",310,"2025-01-19T15:04:00",24840624,"Em conclusão","2101","Incêndio em edifícios habitacionais",0,2,0,7,"2025-01-19T15:04:00","Águeda","Aveiro","Centro",-8.457725,40.58226
24840998,"Milheirós de Poiares","Area M. Porto",309,"2025-01-19T16:54:00",24840998,"Em resolução","2201","Incêndio em equipamentos ou produtos",0,1,0,3,"2025-01-19T16:54:00","Santa Maria Da Feira","Aveiro","Norte",-8.47367,40.93464
24841034,"Queluz e Belas","Grande Lisboa",311,"2025-01-19T17:03:00",24841034,"Em conclusão","2201","Incêndio em equipamentos ou produtos",0,2,0,8,"2025-01-19T17:03:00","Sintra","Lisboa","Área Metropolitana De Lisboa",-9.253541,38.753134
24841051,"Alcoutim e Pereiro","Algarve",313,"2025-01-19T17:09:00",24841051,"Em curso","2101","Incêndio em edifícios habitacionais",0,5,0,12,"2025-01-19T17:09:00","Alcoutim","Faro","Algarve",-7.509075,37.4261
24841148,"Sandim, Olival, Lever e Crestuma","Area M. Porto",309,"2025-01-19T17:26:00",24841148,"Em despacho","4331","Busca e resgate terrestre de animais",0,1,0,2,"2025-01-19T17:26:00","Vila Nova De Gaia","Porto","Norte",-8.502382,41.048753
24840634,"Fráguas","Lezíria do Tejo",311,"2025-01-19T15:06:00",24840634,"Em conclusão","2403","Colisão rodoviária",0,1,0,2,"2025-01-19T15:06:00","Rio Maior","Santarém","Alentejo",-8.86367,39.367843
24840754,"Abrã","Lezíria do Tejo",311,"2025-01-19T15:35:00",24840754,"Em conclusão","2101","Incêndio em edifícios habitacionais",0,1,0,5,"2025-01-19T15:35:00","Santarém","Santarém","Alentejo",-8.734018,39.443015
24840793,"Alcabideche","Grande Lisboa",311,"2025-01-19T15:38:00",24840793,"Em conclusão","2201","Incêndio em equipamentos ou produtos",0,2,0,6,"2025-01-19T15:38:00","Cascais","Lisboa","Área Metropolitana De Lisboa",-9.430278,38.730587
24840920,"S.maria, S.miguel, S.martinho, S.pedro Penaferrim","Grande Lisboa",311,"2025-01-19T16:26:00",24840920,"Em conclusão","2403","Colisão rodoviária",0,7,0,18,"2025-01-19T16:26:00","Sintra","Lisboa","Área Metropolitana De Lisboa",-9.35802,38.8133
24840963,"Eiras e São Paulo de Frades","Região de Coimbra",310,"2025-01-19T16:40:00",24840963,"Em conclusão","2301","Incêndio em transporte rodoviário",0,3,0,10,"2025-01-19T16:40:00","Coimbra","Coimbra","Centro",-8.423418,40.248789
24841102,"Oeiras e S. Julião da Barra, Paço de Arcos e Caxias","Grande Lisboa",311,"2025-01-19T17:16:00",24841102,"Em conclusão","2407","Despiste",0,2,0,8,"2025-01-19T17:16:00","Oeiras","Lisboa","Área Metropolitana De Lisboa",-9.290593,38.696925
