"id","address","subregion","neighborhood","date","id.1","state","nature","nature_description","aerial_means","terrestrial_means","aquatic_means","operational","date.1","Concelho","Distrito","NUTII_DSG","longitude","latitude","state_2"
26328321,"São Salvador da Aramenha","Alto Alentejo",312,"2025-11-23T08:33:00",26328321,"Em resolução/conclusão","2403","Colisão rodoviária",0,4,0,11,"2025-11-23T08:33:00","Marvão","Portalegre","Alentejo",-7.381152,39.359384,"Resolução/Conclusão"
26327993,"Penacova","Tâmega e Sousa",309,"2025-11-23T06:12:00",26327993,"Em resolução/conclusão","2127","Incêndio em edifícios e recintos industriais, oficinas e armazéns",0,4,0,13,"2025-11-23T06:12:00","Felgueiras","Porto","Norte",-8.179322,41.370118,"Resolução/Conclusão"
26328326,"Algés, Linda-a-Velha e Cruz Quebrada-Dafundo","Grande Lisboa",311,"2025-11-23T08:28:00",26328326,"Em Despacho","3311","Queda de elementos de estruturas edificados",0,1,0,5,"2025-11-23T08:28:00","Oeiras","Lisboa","Área Metropolitana De Lisboa",-9.22967,38.696612,"Despacho"
26328013,"Mafamude","Area M. Porto",309,"2025-11-23T06:19:00",26328013,"Em Despacho","2403","Colisão rodoviária",0,2,0,4,"2025-11-23T06:19:00","Vila Nova De Gaia","Porto","Norte",-8.603752,41.114849,"Despacho"
26328177,"Arrentela","Península de Setúbal",311,"2025-11-23T07:48:00",26328177,"Em Despacho","2401","Atropelamento rodoviário",0,1,0,2,"2025-11-23T07:48:00","Seixal","Setúbal","Área Metropolitana De Lisboa",-9.102119,38.613966,"Despacho"
26278163,"Santa Maria Maior e Monserrate e Meadela","Alto Minho",309,"2025-11-13T10:15:00",26278163,"Em Curso","3315","Inundação de estruturas por precipitação intensa",0,1,0,2,"2025-11-13T10:15:00","Viana Do Castelo","Viana Do Castelo","Norte",-8.837157,41.690707,"Curso"
26324357,"Assunção","Alto Alentejo",312,"2025-11-22T10:15:00",26324357,"Em resolução/conclusão","2127","Incêndio em edifícios e recintos industriais, oficinas e armazéns",0,10,0,16,"2025-11-22T10:15:00","Arronches","Portalegre","Alentejo",-7.124845,39.043982,"Resolução/Conclusão"
26328352,"Figueiredo","Cávado",309,"2025-11-23T08:42:00",26328352,"Em Despacho","2101","Incêndio em edifícios habitacionais",0,2,0,8,"2025-11-23T08:42:00","Braga","Braga","Norte",-8.44394,41.49914,"Despacho"
