"id","address","subregion","neighborhood","date","id.1","state","nature","nature_description","aerial_means","terrestrial_means","aquatic_means","operational","date.1","Concelho","Distrito","NUTII_DSG","longitude","latitude"
24877003,"Malagueira e Horta Das Figueiras","Alentejo Central",312,"2025-01-27T11:41:00",24877003,"Em conclusão","3315","Inundação de estruturas por precipitação intensa",0,0,0,0,"2025-01-27T11:41:00","Évora","Évora","Alentejo",-7.924277,38.57285
24975680,"Rio de Mouro","Grande Lisboa",311,"2025-02-18T09:26:00",24975680,"Em conclusão","2101","Incêndio em edifícios habitacionais",0,3,0,9,"2025-02-18T09:26:00","Sintra","Lisboa","Área Metropolitana De Lisboa",-9.344476,38.75673
24975730,"Cacém e São Marcos","Grande Lisboa",311,"2025-02-18T09:24:00",24975730,"Em resolução","2407","Despiste",0,2,0,6,"2025-02-18T09:24:00","Sintra","Lisboa","Área Metropolitana De Lisboa",-9.303217,38.766158
24975746,"Custóias, Leça do Balio e Guifões","Area M. Porto",309,"2025-02-18T09:32:00",24975746,"Em despacho","2407","Despiste",0,1,0,2,"2025-02-18T09:32:00","Matosinhos","Porto","Norte",-8.632716,41.208899
24975764,"Ouca","Região de Aveiro",310,"2025-02-18T09:32:00",24975764,"Em conclusão","2407","Despiste",0,3,0,8,"2025-02-18T09:32:00","Vagos","Aveiro","Centro",-8.648401,40.490453
24888293,"Pernes","Lezíria do Tejo",311,"2025-01-29T16:41:00",24888293,"Em curso","3301","Queda de árvore",0,0,0,0,"2025-01-29T16:41:00","Santarém","Santarém","Alentejo",-8.658865,39.381547
24974804,"Olhão","Algarve",313,"2025-02-18T00:12:00",24974804,"Em despacho","4331","Busca e resgate terrestre de animais",0,1,0,1,"2025-02-18T00:12:00","Olhão","Faro","Algarve",-7.843133,37.022054
24975856,"Benfica","Grande Lisboa",311,"2025-02-18T09:49:00",24975856,"Em curso","2403","Colisão rodoviária",0,2,0,6,"2025-02-18T09:49:00","Lisboa","Lisboa","Área Metropolitana De Lisboa",-9.19935,38.744634
24975865,"Portimão","Algarve",313,"2025-02-18T09:56:00",24975865,"Em curso","2403","Colisão rodoviária",0,2,0,9,"2025-02-18T09:56:00","Portimão","Faro","Algarve",-8.532608,37.137966
24975216,"São João Das Lampas e Terrugem","Grande Lisboa",311,"2025-02-18T07:21:00",24975216,"Em conclusão","2407","Despiste",0,1,0,2,"2025-02-18T07:21:00","Sintra","Lisboa","Área Metropolitana De Lisboa",-9.342867,38.8566
24975603,"Cabanelas","Terras de Trás-os-Montes",309,"2025-02-18T09:07:00",24975603,"Em resolução","2129","Incêndio em edifícios degradados ou devolutos",0,2,0,6,"2025-02-18T09:07:00","Mirandela","Bragança","Norte",-7.215108,41.549548
24975620,"Benfica","Grande Lisboa",311,"2025-02-18T09:05:00",24975620,"Em despacho","2403","Colisão rodoviária",0,1,0,2,"2025-02-18T09:05:00","Lisboa","Lisboa","Área Metropolitana De Lisboa",-9.19935,38.744634
24975719,"Malagueira e Horta Das Figueiras","Alentejo Central",312,"2025-02-18T09:15:00",24975719,"Em conclusão","2127","Incêndio em edifícios e recintos industriais, oficinas e armazéns",0,4,0,9,"2025-02-18T09:15:00","Évora","Évora","Alentejo",-7.909793,38.543093
24972219,"Carnaxide e Queijas","Grande Lisboa",311,"2025-02-17T13:28:00",24972219,"Em curso","1105","Sismo",0,0,0,0,"2025-02-17T13:28:00","Oeiras","Lisboa","Área Metropolitana De Lisboa",-9.243421,38.725234
24975374,"Margaride (Santa Eulália), Várzea, Lagares, Varziela e Moure","Tâmega e Sousa",309,"2025-02-18T08:08:00",24975374,"Em conclusão","2407","Despiste",0,2,0,6,"2025-02-18T08:08:00","Felgueiras","Porto","Norte",-8.233538,41.369315
24975594,"Encarnação","Grande Lisboa",311,"2025-02-18T09:02:00",24975594,"Em conclusão","2407","Despiste",0,3,0,8,"2025-02-18T09:02:00","Mafra","Lisboa","Área Metropolitana De Lisboa",-9.414755,39.018995
24975744,"São João da Madeira","Area M. Porto",309,"2025-02-18T09:34:00",24975744,"Em despacho","2401","Atropelamento rodoviário",0,4,0,8,"2025-02-18T09:34:00","São João Da Madeira","Aveiro","Norte",-8.497441,40.896053
24975759,"Carnaxide e Queijas","Grande Lisboa",311,"2025-02-18T09:30:00",24975759,"Em despacho","3317","Inundação de estruturas por água canalizada",0,1,0,5,"2025-02-18T09:30:00","Oeiras","Lisboa","Área Metropolitana De Lisboa",-9.25881,38.722457
24975775,"S.julião, N.s. da Anunciada e S. Maria da Graça","Península de Setúbal",311,"2025-02-18T09:43:00",24975775,"Em resolução","2403","Colisão rodoviária",0,2,0,7,"2025-02-18T09:43:00","Setúbal","Setúbal","Área Metropolitana De Lisboa",-8.926392,38.520139
24975777,"Ovar, São João, Arada e São Vicente de Pereira Jusã","Região de Aveiro",310,"2025-02-18T09:39:00",24975777,"Em resolução","2403","Colisão rodoviária",0,3,0,9,"2025-02-18T09:39:00","Ovar","Aveiro","Centro",-8.632482,40.864029
24975795,"Lamego (Almacave e Sé)","Douro",309,"2025-02-18T09:48:00",24975795,"Em resolução","2301","Incêndio em transporte rodoviário",0,3,0,12,"2025-02-18T09:48:00","Lamego","Viseu","Norte",-7.798647,41.081925
24975877,"Algés, Linda-a-Velha e Cruz Quebrada-Dafundo","Grande Lisboa",311,"2025-02-18T09:52:00",24975877,"Em despacho","2101","Incêndio em edifícios habitacionais",0,1,0,3,"2025-02-18T09:52:00","Oeiras","Lisboa","Área Metropolitana De Lisboa",-9.22967,38.696612
