"id","address","subregion","neighborhood","date","id.1","state","nature","nature_description","aerial_means","terrestrial_means","aquatic_means","operational","date.1","Concelho","Distrito","NUTII_DSG","longitude","latitude"
24888293,"Pernes","Lezíria do Tejo",311,"2025-01-29T16:41:00",24888293,"Em curso","3301","Queda de árvore",0,0,0,0,"2025-01-29T16:41:00","Santarém","Santarém","Alentejo",-8.658865,39.381547
24877003,"Malagueira e Horta Das Figueiras","Alentejo Central",312,"2025-01-27T11:41:00",24877003,"Em conclusão","3315","Inundação de estruturas por precipitação intensa",0,0,0,0,"2025-01-27T11:41:00","Évora","Évora","Alentejo",-7.924277,38.57285
24961214,"Amora","Península de Setúbal",311,"2025-02-14T20:09:00",24961214,"Em conclusão","2403","Colisão rodoviária",0,1,0,2,"2025-02-14T20:09:00","Seixal","Setúbal","Área Metropolitana De Lisboa",-9.125227,38.624582
24962031,"S.julião, N.s. da Anunciada e S. Maria da Graça","Península de Setúbal",311,"2025-02-15T02:37:00",24962031,"Em despacho","4331","Busca e resgate terrestre de animais",0,1,0,2,"2025-02-15T02:37:00","Setúbal","Setúbal","Área Metropolitana De Lisboa",-8.889983,38.529955
24962046,"Arruda Dos Vinhos","Oeste",311,"2025-02-15T03:04:00",24962046,"Em despacho","2407","Despiste",0,4,0,9,"2025-02-15T03:04:00","Arruda Dos Vinhos","Lisboa","Centro",-9.03476,38.99009
24961889,"São João Das Lampas e Terrugem","Grande Lisboa",311,"2025-02-15T00:38:00",24961889,"Em conclusão","2407","Despiste",0,2,0,4,"2025-02-15T00:38:00","Sintra","Lisboa","Área Metropolitana De Lisboa",-9.368782,38.828514
24961906,"Mafamude e Vilar do Paraíso","Area M. Porto",309,"2025-02-15T00:49:00",24961906,"Em conclusão","2403","Colisão rodoviária",0,1,0,2,"2025-02-15T00:49:00","Vila Nova De Gaia","Porto","Norte",-8.59963,41.125028
