"id","address","subregion","neighborhood","date","id.1","state","nature","nature_description","aerial_means","terrestrial_means","aquatic_means","operational","date.1","Concelho","Distrito","NUTII_DSG","longitude","latitude"
24877003,"Malagueira e Horta Das Figueiras","Alentejo Central",312,"2025-01-27T11:41:00",24877003,"Em conclusão","3315","Inundação de estruturas por precipitação intensa",0,0,0,0,"2025-01-27T11:41:00","Évora","Évora","Alentejo",-7.924277,38.57285
24901885,"Colares","Grande Lisboa",311,"2025-02-01T15:33:00",24901885,"Em conclusão","4327","Busca e resgate terrestre de pessoas",0,0,0,0,"2025-02-01T15:33:00","Sintra","Lisboa","Área Metropolitana De Lisboa",-9.498875,38.780347
24903080,"Samora Correia","Lezíria do Tejo",311,"2025-02-01T20:53:00",24903080,"Em resolução","2407","Despiste",0,3,0,9,"2025-02-01T20:53:00","Benavente","Santarém","Alentejo",-8.868908,38.935447
24902356,"Ameixial (Santa Vitória e São Bento)","Alentejo Central",312,"2025-02-01T17:25:00",24902356,"Em conclusão","2403","Colisão rodoviária",0,0,0,0,"2025-02-01T17:25:00","Estremoz","Évora","Alentejo",-7.625128,38.867048
24902981,"Massamá e Monte Abraão","Grande Lisboa",311,"2025-02-01T20:16:00",24902981,"Em conclusão","2403","Colisão rodoviária",0,2,0,7,"2025-02-01T20:16:00","Sintra","Lisboa","Área Metropolitana De Lisboa",-9.280008,38.753778
24851780,"São Miguel, Santa Eufémia e Rabaçal","Região de Coimbra",310,"2025-01-21T23:25:00",24851780,"Em curso","3315","Inundação de estruturas por precipitação intensa",0,0,0,0,"2025-01-21T23:25:00","Penela","Coimbra","Centro",-8.399036,40.025502
24902467,"Gosende","Viseu Dão Lafões",310,"2025-02-01T17:56:00",24902467,"Em despacho","2401","Atropelamento rodoviário",0,5,0,9,"2025-02-01T17:56:00","Castro Daire","Viseu","Centro",-7.904882,41.013469
24902553,"Castelo Novo","Beiras e Serra da Estrela",310,"2025-02-01T18:23:00",24902553,"Em conclusão","3103","Incêndio rural",0,3,0,8,"2025-02-01T18:23:00","Fundão","Castelo Branco","Centro",-7.475238,40.054405
24902752,"Ramalde","Area M. Porto",309,"2025-02-01T19:21:00",24902752,"Em resolução","2407","Despiste",0,3,0,9,"2025-02-01T19:21:00","Porto","Porto","Norte",-8.642026,41.184143
24902769,"Mafamude e Vilar do Paraíso","Area M. Porto",309,"2025-02-01T19:18:00",24902769,"Em despacho","2401","Atropelamento rodoviário",0,1,0,2,"2025-02-01T19:18:00","Vila Nova De Gaia","Porto","Norte",-8.611105,41.107184
24903069,"Tondela e Nandufe","Viseu Dão Lafões",310,"2025-02-01T20:47:00",24903069,"Em curso","2513","Fuga de gás em conduta",0,1,0,5,"2025-02-01T20:47:00","Tondela","Viseu","Centro",-8.067036,40.523807
24895525,"Roliça","Oeste",311,"2025-01-31T09:00:00",24895525,"Em conclusão","4327","Busca e resgate terrestre de pessoas",0,0,0,0,"2025-01-31T09:00:00","Bombarral","Leiria","Centro",-9.152078,39.299008
24902879,"Sé e São Lourenço","Alto Alentejo",312,"2025-02-01T19:57:00",24902879,"Em conclusão","2101","Incêndio em edifícios habitacionais",0,4,0,14,"2025-02-01T19:57:00","Portalegre","Portalegre","Alentejo",-7.427133,39.297542
24902911,"S.maria, S.miguel, S.martinho, S.pedro Penaferrim","Grande Lisboa",311,"2025-02-01T20:07:00",24902911,"Em conclusão","2101","Incêndio em edifícios habitacionais",0,3,0,9,"2025-02-01T20:07:00","Sintra","Lisboa","Área Metropolitana De Lisboa",-9.40542,38.820035
24902927,"Alhandra, São João Dos Montes e Calhandriz","Grande Lisboa",311,"2025-02-01T20:11:00",24902927,"Em resolução","2403","Colisão rodoviária",0,2,0,7,"2025-02-01T20:11:00","Vila Franca De Xira","Lisboa","Área Metropolitana De Lisboa",-9.006082,38.929996
24902961,"Castêlo da Maia","Area M. Porto",309,"2025-02-01T20:12:00",24902961,"Em conclusão","3321","Dano na rede de fornecimento de eletricidade ",0,1,0,4,"2025-02-01T20:12:00","Maia","Porto","Norte",-8.620003,41.262978
24902996,"Abrantes (São Vicente e São João) e Alferrarede","Médio Tejo",311,"2025-02-01T20:31:00",24902996,"Em resolução","2403","Colisão rodoviária",0,4,0,11,"2025-02-01T20:31:00","Abrantes","Santarém","Centro",-8.186938,39.48215
24903009,"São Mamede de Infesta e Senhora da Hora","Area M. Porto",309,"2025-02-01T20:34:00",24903009,"Em curso","2101","Incêndio em edifícios habitacionais",0,5,0,17,"2025-02-01T20:34:00","Matosinhos","Porto","Norte",-8.660282,41.186057
24903010,"Palmela","Península de Setúbal",311,"2025-02-01T20:34:00",24903010,"Em conclusão","2127","Incêndio em edifícios e recintos industriais, oficinas e armazéns",0,4,0,11,"2025-02-01T20:34:00","Palmela","Setúbal","Área Metropolitana De Lisboa",-8.838218,38.57841
