"id","address","subregion","neighborhood","date","id.1","state","nature","nature_description","aerial_means","terrestrial_means","aquatic_means","operational","date.1","Concelho","Distrito","NUTII_DSG","longitude","latitude"
24911875,"Alhandra, São João Dos Montes e Calhandriz","Grande Lisboa",311,"2025-02-03T23:18:00",24911875,"Em curso","2403","Colisão rodoviária",0,4,0,11,"2025-02-03T23:18:00","Vila Franca De Xira","Lisboa","Área Metropolitana De Lisboa",-9.06022,38.93048
24912092,"Marvila, Ribeira Santarém, S.salvador, S.nicolau","Lezíria do Tejo",311,"2025-02-04T01:27:00",24912092,"Em despacho","2101","Incêndio em edifícios habitacionais",0,0,0,0,"2025-02-04T01:27:00","Santarém","Santarém","Alentejo",-8.72032,39.236238
24911651,"Beirã","Alto Alentejo",312,"2025-02-03T21:34:00",24911651,"Em conclusão","2101","Incêndio em edifícios habitacionais",0,2,0,5,"2025-02-03T21:34:00","Marvão","Portalegre","Alentejo",-7.369857,39.445572
24912070,"São Lourenço de Ribapinhão","Douro",309,"2025-02-04T01:07:00",24912070,"Em despacho","2407","Despiste",0,2,0,5,"2025-02-04T01:07:00","Sabrosa","Vila Real","Norte",-7.577802,41.315803
24877003,"Malagueira e Horta Das Figueiras","Alentejo Central",312,"2025-01-27T11:41:00",24877003,"Em conclusão","3315","Inundação de estruturas por precipitação intensa",0,0,0,0,"2025-01-27T11:41:00","Évora","Évora","Alentejo",-7.924277,38.57285
24911999,"Almada, Cova da Piedade, Pragal e Cacilhas","Península de Setúbal",311,"2025-02-04T00:17:00",24911999,"Em curso","3323","Dano na rede de abastecimento de água",0,6,0,17,"2025-02-04T00:17:00","Almada","Setúbal","Área Metropolitana De Lisboa",-9.156069,38.68273
24912072,"Romeira e Várzea","Lezíria do Tejo",311,"2025-02-04T01:22:00",24912072,"Em curso","2127","Incêndio em edifícios e recintos industriais, oficinas e armazéns",0,7,0,24,"2025-02-04T01:22:00","Santarém","Santarém","Alentejo",-8.71442,39.25503
24912088,"Carregosa","Area M. Porto",309,"2025-02-04T01:28:00",24912088,"Em despacho","3203","Detritos confinados",0,1,0,2,"2025-02-04T01:28:00","Oliveira De Azeméis","Aveiro","Norte",-8.412088,40.890188
