"id","address","subregion","neighborhood","date","id.1","state","nature","nature_description","aerial_means","terrestrial_means","aquatic_means","operational","date.1","Concelho","Distrito","NUTII_DSG","longitude","latitude"
25070044,"Praia do Ribatejo","Médio Tejo",311,"2025-03-10T19:30:00",25070044,"Em curso","1101","Cheia",0,0,0,0,"2025-03-10T19:30:00","Vila Nova Da Barquinha","Santarém","Centro",-8.357309,39.485638
25071496,"São Manços e São Vicente do Pigeiro","Alentejo Central",312,"2025-03-11T13:18:00",25071496,"Em conclusão","1101","Cheia",0,0,0,0,"2025-03-11T13:18:00","Évora","Évora","Alentejo",-7.713313,38.513673
25132882,"Sapataria","Oeste",311,"2025-03-22T13:14:00",25132882,"Em conclusão","3315","Inundação de estruturas por precipitação intensa",0,0,0,0,"2025-03-22T13:14:00","Sobral De Monte Agraço","Lisboa","Centro",-9.19889,38.96778
25132931,"Sapataria","Oeste",311,"2025-03-22T13:14:00",25132931,"Em conclusão","3313","Deslizamento de terras",0,0,0,0,"2025-03-22T13:14:00","Sobral De Monte Agraço","Lisboa","Centro",-9.196712,38.967998
25137028,"Santo Quintino","Oeste",311,"2025-03-23T11:30:00",25137028,"Em conclusão","3315","Inundação de estruturas por precipitação intensa",0,0,0,0,"2025-03-23T11:30:00","Sobral De Monte Agraço","Lisboa","Centro",-9.141897,38.992853
25137544,"Dois Portos e Runa","Oeste",311,"2025-03-23T13:41:00",25137544,"Em conclusão","3313","Deslizamento de terras",0,0,0,0,"2025-03-23T13:41:00","Torres Vedras","Lisboa","Centro",-9.178343,39.036686
25157618,"Carcavelos e Parede","Grande Lisboa",311,"2025-03-27T16:53:00",25157618,"Em curso","3315","Inundação de estruturas por precipitação intensa",0,1,0,1,"2025-03-27T16:53:00","Cascais","Lisboa","Área Metropolitana De Lisboa",-9.337574,38.688343
25158552,"Bougado (São Martinho e Santiago)","Area M. Porto",309,"2025-03-27T20:44:00",25158552,"Em conclusão","2403","Colisão rodoviária",0,2,0,5,"2025-03-27T20:44:00","Trofa","Porto","Norte",-8.580775,41.311267
25158585,"Gondomar (São Cosme), Valbom e Jovim","Area M. Porto",309,"2025-03-27T21:00:00",25158585,"Em conclusão","2201","Incêndio em equipamentos ou produtos",0,3,0,10,"2025-03-27T21:00:00","Gondomar","Porto","Norte",-8.552012,41.140768
25158670,"Santa Marinha e São Pedro da Afurada","Area M. Porto",309,"2025-03-27T21:20:00",25158670,"Em curso","4329","Busca e resgate aquático de pessoas",0,8,0,18,"2025-03-27T21:20:00","Vila Nova De Gaia","Porto","Norte",-8.609393,41.13985
25158686,"Coronado (São Romão e São Mamede)","Area M. Porto",309,"2025-03-27T21:18:00",25158686,"Em curso","2407","Despiste",0,3,0,6,"2025-03-27T21:18:00","Trofa","Porto","Norte",-8.57776,41.284058
25158738,"Carcavelos e Parede","Grande Lisboa",311,"2025-03-27T21:35:00",25158738,"Em despacho","4331","Busca e resgate terrestre de animais",0,1,0,3,"2025-03-27T21:35:00","Cascais","Lisboa","Área Metropolitana De Lisboa",-9.337574,38.688343
25068300,"Almeirim","Lezíria do Tejo",311,"2025-03-10T20:52:00",25068300,"Em curso","1101","Cheia",0,0,0,0,"2025-03-10T20:52:00","Almeirim","Santarém","Alentejo",-8.635002,39.187436
25132921,"Santo Quintino","Oeste",311,"2025-03-22T13:14:00",25132921,"Em conclusão","3315","Inundação de estruturas por precipitação intensa",0,0,0,0,"2025-03-22T13:14:00","Sobral De Monte Agraço","Lisboa","Centro",-9.177632,38.989836
25158307,"Povolide","Viseu Dão Lafões",310,"2025-03-27T19:41:00",25158307,"Em despacho","4331","Busca e resgate terrestre de animais",0,1,0,2,"2025-03-27T19:41:00","Viseu","Viseu","Centro",-7.76781,40.645722
25158439,"Oeiras e S. Julião da Barra, Paço de Arcos e Caxias","Grande Lisboa",311,"2025-03-27T20:12:00",25158439,"Em despacho","3301","Queda de árvore",0,1,0,2,"2025-03-27T20:12:00","Oeiras","Lisboa","Área Metropolitana De Lisboa",-9.290593,38.696925
25158764,"São João de Lourosa","Viseu Dão Lafões",310,"2025-03-27T21:45:00",25158764,"Em curso","2301","Incêndio em transporte rodoviário",0,2,0,8,"2025-03-27T21:45:00","Viseu","Viseu","Centro",-7.931048,40.616404
25158163,"Vreia de Bornes","Alto Tâmega e Barroso",309,"2025-03-27T19:15:00",25158163,"Em despacho","3103","Incêndio rural",0,3,0,9,"2025-03-27T19:15:00","Vila Pouca De Aguiar","Vila Real","Norte",-7.576702,41.582288
25158433,"Braga (Maximinos, Sé e Cividade)","Cávado",309,"2025-03-27T20:12:00",25158433,"Em conclusão","2403","Colisão rodoviária",0,2,0,5,"2025-03-27T20:12:00","Braga","Braga","Norte",-8.435962,41.546004
25121892,"S.maria, S.miguel, S.martinho, S.pedro Penaferrim","Grande Lisboa",311,"2025-03-20T14:00:00",25121892,"Em conclusão","3301","Queda de árvore",0,0,0,0,"2025-03-20T14:00:00","Sintra","Lisboa","Área Metropolitana De Lisboa",-9.393304,38.794377
25137004,"Santo Quintino","Oeste",311,"2025-03-23T11:30:00",25137004,"Em conclusão","3315","Inundação de estruturas por precipitação intensa",0,0,0,0,"2025-03-23T11:30:00","Sobral De Monte Agraço","Lisboa","Centro",-9.108516,38.999442
25158275,"Santa Clara e Castelo Viegas","Região de Coimbra",310,"2025-03-27T19:37:00",25158275,"Em conclusão","2403","Colisão rodoviária",0,7,0,18,"2025-03-27T19:37:00","Coimbra","Coimbra","Centro",-8.426073,40.180842
25158528,"Abadim","Ave",309,"2025-03-27T20:43:00",25158528,"Em conclusão","3111","Queima",0,0,0,0,"2025-03-27T20:43:00","Cabeceiras De Basto","Braga","Norte",-7.970883,41.577892
25158529,"Moita","Península de Setúbal",311,"2025-03-27T20:45:00",25158529,"Em conclusão","2301","Incêndio em transporte rodoviário",0,2,0,5,"2025-03-27T20:45:00","Moita","Setúbal","Área Metropolitana De Lisboa",-8.98049,38.64349
25158543,"Borba (Matriz)","Alentejo Central",312,"2025-03-27T20:47:00",25158543,"Em conclusão","2301","Incêndio em transporte rodoviário",0,1,0,2,"2025-03-27T20:47:00","Borba","Évora","Alentejo",-7.465168,38.795325
25158560,"Viatodos, Grimancelos, Minhotães e Monte de Fralães","Cávado",309,"2025-03-27T20:49:00",25158560,"Em despacho","4327","Busca e resgate terrestre de pessoas",0,5,0,13,"2025-03-27T20:49:00","Barcelos","Braga","Norte",-8.570268,41.444472
25158577,"Gandra e Taião","Alto Minho",309,"2025-03-27T20:50:00",25158577,"Em conclusão","3103","Incêndio rural",0,1,0,6,"2025-03-27T20:50:00","Valença","Viana Do Castelo","Norte",-8.603638,42.016327
25158643,"Faro (Sé e São Pedro)","Algarve",313,"2025-03-27T21:14:00",25158643,"Em resolução","2403","Colisão rodoviária",0,2,0,4,"2025-03-27T21:14:00","Faro","Faro","Algarve",-7.942032,37.01865
25158696,"Salvaterra de Magos e Foros de Salvaterra","Lezíria do Tejo",311,"2025-03-27T21:28:00",25158696,"Em resolução","4331","Busca e resgate terrestre de animais",0,1,0,4,"2025-03-27T21:28:00","Salvaterra De Magos","Santarém","Alentejo",-8.790194,39.028695
25158712,"Rio Tinto","Area M. Porto",309,"2025-03-27T21:36:00",25158712,"Em despacho","2101","Incêndio em edifícios habitacionais",0,2,0,6,"2025-03-27T21:36:00","Gondomar","Porto","Norte",-8.5605,41.19556
