"id","address","subregion","neighborhood","date","id.1","state","nature","nature_description","aerial_means","terrestrial_means","aquatic_means","operational","date.1","Concelho","Distrito","NUTII_DSG","longitude","latitude"
25219914,"Vidais","Oeste",311,"2025-04-10T04:14:00",25219914,"Em despacho","2101","Incêndio em edifícios habitacionais",0,2,0,8,"2025-04-10T04:14:00","Caldas Da Rainha","Leiria","Centro",-9.05297,39.36929
25070044,"Praia do Ribatejo","Médio Tejo",311,"2025-03-10T19:30:00",25070044,"Em curso","1101","Cheia",0,0,0,0,"2025-03-10T19:30:00","Vila Nova Da Barquinha","Santarém","Centro",-8.357309,39.485638
25071496,"São Manços e São Vicente do Pigeiro","Alentejo Central",312,"2025-03-11T13:18:00",25071496,"Em conclusão","1101","Cheia",0,0,0,0,"2025-03-11T13:18:00","Évora","Évora","Alentejo",-7.713313,38.513673
25202441,"Serpa (Salvador e Santa Maria)","Baixo Alentejo",312,"2025-04-06T10:25:00",25202441,"Em conclusão","1101","Cheia",0,0,0,0,"2025-04-06T10:25:00","Serpa","Beja","Alentejo",-7.555783,37.88592
25219869,"Vila Verde e Santão","Tâmega e Sousa",309,"2025-04-10T03:18:00",25219869,"Em conclusão","2301","Incêndio em transporte rodoviário",0,1,0,4,"2025-04-10T03:18:00","Felgueiras","Porto","Norte",-8.182098,41.311724
25068300,"Almeirim","Lezíria do Tejo",311,"2025-03-10T20:52:00",25068300,"Em curso","1101","Cheia",0,0,0,0,"2025-03-10T20:52:00","Almeirim","Santarém","Alentejo",-8.635002,39.187436
25213725,"Costa da Caparica","Península de Setúbal",311,"2025-04-08T18:35:00",25213725,"Em conclusão","4329","Busca e resgate aquático de pessoas",0,0,0,0,"2025-04-08T18:35:00","Almada","Setúbal","Área Metropolitana De Lisboa",-9.220385,38.624272
25218991,"Oeiras e S. Julião da Barra, Paço de Arcos e Caxias","Grande Lisboa",311,"2025-04-09T20:24:00",25218991,"Em despacho","3111","Queima",0,0,0,0,"2025-04-09T20:24:00","Oeiras","Lisboa","Área Metropolitana De Lisboa",-9.27157,38.71288
25219850,"Beato","Grande Lisboa",311,"2025-04-10T03:02:00",25219850,"Em conclusão","3103","Incêndio rural",0,1,0,5,"2025-04-10T03:02:00","Lisboa","Lisboa","Área Metropolitana De Lisboa",-9.117749,38.73809
25219877,"Barreiro e Lavradio","Península de Setúbal",311,"2025-04-10T03:27:00",25219877,"Em conclusão","3103","Incêndio rural",0,3,0,9,"2025-04-10T03:27:00","Barreiro","Setúbal","Área Metropolitana De Lisboa",-9.058035,38.671905
25113184,"Castanheira do Ribatejo e Cachoeiras","Grande Lisboa",311,"2025-03-20T01:20:00",25113184,"Em despacho","3301","Queda de árvore",0,0,0,0,"2025-03-20T01:20:00","Vila Franca De Xira","Lisboa","Área Metropolitana De Lisboa",-8.979234,38.999552
25219676,"Costa","Ave",309,"2025-04-10T00:15:00",25219676,"Em conclusão","2127","Incêndio em edifícios e recintos industriais, oficinas e armazéns",0,6,0,14,"2025-04-10T00:15:00","Guimarães","Braga","Norte",-8.269683,41.44583
25219833,"Colares","Grande Lisboa",311,"2025-04-10T02:35:00",25219833,"Em conclusão","2101","Incêndio em edifícios habitacionais",0,3,0,9,"2025-04-10T02:35:00","Sintra","Lisboa","Área Metropolitana De Lisboa",-9.443134,38.81141
