"id","address","subregion","neighborhood","date","id.1","state","nature","nature_description","aerial_means","terrestrial_means","aquatic_means","operational","date.1","Concelho","Distrito","NUTII_DSG","longitude","latitude"
24877003,"Malagueira e Horta Das Figueiras","Alentejo Central",312,"2025-01-27T11:41:00",24877003,"Em conclusão","3315","Inundação de estruturas por precipitação intensa",0,0,0,0,"2025-01-27T11:41:00","Évora","Évora","Alentejo",-7.924277,38.57285
24966774,"São Domingos de Rana","Grande Lisboa",311,"2025-02-16T09:05:00",24966774,"Em conclusão","3203","Detritos confinados",0,1,0,4,"2025-02-16T09:05:00","Cascais","Lisboa","Área Metropolitana De Lisboa",-9.347651,38.740483
24967324,"Póvoa de Santo Adrião e Olival Basto","Grande Lisboa",311,"2025-02-16T11:25:00",24967324,"Em conclusão","3325","Dano na rede de abastecimento de gás",0,1,0,5,"2025-02-16T11:25:00","Odivelas","Lisboa","Área Metropolitana De Lisboa",-9.159939,38.803537
24967302,"Colares","Grande Lisboa",311,"2025-02-16T11:28:00",24967302,"Em despacho","4331","Busca e resgate terrestre de animais",0,1,0,2,"2025-02-16T11:28:00","Sintra","Lisboa","Área Metropolitana De Lisboa",-9.460841,38.828425
24967354,"Margem","Alto Alentejo",312,"2025-02-16T11:43:00",24967354,"Em despacho","2201","Incêndio em equipamentos ou produtos",0,1,0,3,"2025-02-16T11:43:00","Gavião","Portalegre","Alentejo",-7.93806,39.377953
24888293,"Pernes","Lezíria do Tejo",311,"2025-01-29T16:41:00",24888293,"Em curso","3301","Queda de árvore",0,0,0,0,"2025-01-29T16:41:00","Santarém","Santarém","Alentejo",-8.658865,39.381547
24964526,"Aldoar, Foz do Douro e Nevogilde","Area M. Porto",309,"2025-02-15T16:36:00",24964526,"Em curso","4329","Busca e resgate aquático de pessoas",1,5,0,15,"2025-02-15T16:36:00","Porto","Porto","Norte",-8.67565,41.14698
24966957,"Vilarinho","Area M. Porto",309,"2025-02-16T10:00:00",24966957,"Em curso","4327","Busca e resgate terrestre de pessoas",0,4,0,8,"2025-02-16T10:00:00","Santo Tirso","Porto","Norte",-8.328893,41.3709
