"id","address","subregion","neighborhood","date","id.1","state","nature","nature_description","aerial_means","terrestrial_means","aquatic_means","operational","date.1","Concelho","Distrito","NUTII_DSG","longitude","latitude"
24943839,"Modivas","Area M. Porto",309,"2025-02-11T07:44:00",24943839,"Em despacho","2127","Incêndio em edifícios e recintos industriais, oficinas e armazéns",0,2,0,8,"2025-02-11T07:44:00","Vila Do Conde","Porto","Norte",-8.693729,41.294993
24877003,"Malagueira e Horta Das Figueiras","Alentejo Central",312,"2025-01-27T11:41:00",24877003,"Em conclusão","3315","Inundação de estruturas por precipitação intensa",0,0,0,0,"2025-01-27T11:41:00","Évora","Évora","Alentejo",-7.924277,38.57285
24943703,"Refóios do Lima","Alto Minho",309,"2025-02-11T06:40:00",24943703,"Em resolução","2407","Despiste",0,3,0,7,"2025-02-11T06:40:00","Ponte De Lima","Viana Do Castelo","Norte",-8.54672,41.796917
24943785,"Odivelas","Grande Lisboa",311,"2025-02-11T07:13:00",24943785,"Em conclusão","3325","Dano na rede de abastecimento de gás",0,1,0,5,"2025-02-11T07:13:00","Odivelas","Lisboa","Área Metropolitana De Lisboa",-9.182813,38.793425
24943837,"Cacém e São Marcos","Grande Lisboa",311,"2025-02-11T07:45:00",24943837,"Em despacho","2201","Incêndio em equipamentos ou produtos",0,1,0,4,"2025-02-11T07:45:00","Sintra","Lisboa","Área Metropolitana De Lisboa",-9.316991,38.764218
24941257,"Vimieiro","Alentejo Central",312,"2025-02-10T14:50:00",24941257,"Em curso","4329","Busca e resgate aquático de pessoas",0,3,0,7,"2025-02-10T14:50:00","Arraiolos","Évora","Alentejo",-7.837248,38.82704
24943730,"Galegos","Tâmega e Sousa",309,"2025-02-11T06:52:00",24943730,"Em conclusão","2101","Incêndio em edifícios habitacionais",0,4,0,11,"2025-02-11T06:52:00","Penafiel","Porto","Norte",-8.295158,41.16354
24943863,"São Domingos de Rana","Grande Lisboa",311,"2025-02-11T07:51:00",24943863,"Em despacho","2407","Despiste",0,3,0,7,"2025-02-11T07:51:00","Cascais","Lisboa","Área Metropolitana De Lisboa",-9.347651,38.740483
24943881,"Setúbal (São Sebastião)","Península de Setúbal",311,"2025-02-11T08:00:00",24943881,"Em despacho","2401","Atropelamento rodoviário",0,1,0,5,"2025-02-11T08:00:00","Setúbal","Setúbal","Área Metropolitana De Lisboa",-8.862337,38.527365
