"id","address","subregion","neighborhood","date","id.1","state","nature","nature_description","aerial_means","terrestrial_means","aquatic_means","operational","date.1","Concelho","Distrito","NUTII_DSG","longitude","latitude"
24837798,"Aldoar, Foz do Douro e Nevogilde","Area M. Porto",309,"2025-01-18T20:08:00",24837798,"Em despacho","3317","Inundação de estruturas por água canalizada",0,1,0,4,"2025-01-18T20:08:00","Porto","Porto","Norte",-8.672426,41.161999
24837869,"São João Das Lampas e Terrugem","Grande Lisboa",311,"2025-01-18T20:36:00",24837869,"Em conclusão","2403","Colisão rodoviária",0,1,0,2,"2025-01-18T20:36:00","Sintra","Lisboa","Área Metropolitana De Lisboa",-9.411853,38.857796
24837880,"Salvador e Santo Aleixo de Além-Tâmega","Alto Tâmega e Barroso",309,"2025-01-18T20:42:00",24837880,"Em conclusão","3103","Incêndio rural",0,2,0,7,"2025-01-18T20:42:00","Ribeira De Pena","Vila Real","Norte",-7.77831,41.496467
24837928,"Touguinha e Touguinhó","Area M. Porto",309,"2025-01-18T20:55:00",24837928,"Em despacho","2407","Despiste",0,1,0,2,"2025-01-18T20:55:00","Vila Do Conde","Porto","Norte",-8.711706,41.381417
24837969,"Santo António Dos Olivais","Região de Coimbra",310,"2025-01-18T21:08:00",24837969,"Em conclusão","2201","Incêndio em equipamentos ou produtos",0,2,0,7,"2025-01-18T21:08:00","Coimbra","Coimbra","Centro",-8.426807,40.217261
24837971,"Aldoar, Foz do Douro e Nevogilde","Area M. Porto",309,"2025-01-18T21:05:00",24837971,"Em despacho","3317","Inundação de estruturas por água canalizada",0,1,0,5,"2025-01-18T21:05:00","Porto","Porto","Norte",-8.672426,41.161999
24838069,"Fafe","Ave",309,"2025-01-18T21:40:00",24838069,"Em despacho","2407","Despiste",0,3,0,6,"2025-01-18T21:40:00","Fafe","Braga","Norte",-8.175239,41.449617
24837529,"Vila do Bispo e Raposeira","Algarve",313,"2025-01-18T18:59:00",24837529,"Em curso","4329","Busca e resgate aquático de pessoas",1,9,0,28,"2025-01-18T18:59:00","Vila Do Bispo","Faro","Algarve",-8.955216,37.086227
24837768,"Chamusca e Pinheiro Grande","Lezíria do Tejo",311,"2025-01-18T20:08:00",24837768,"Em resolução","2201","Incêndio em equipamentos ou produtos",0,4,0,9,"2025-01-18T20:08:00","Chamusca","Santarém","Alentejo",-8.424903,39.400982
24837977,"Este (São Pedro e São Mamede)","Cávado",309,"2025-01-18T21:08:00",24837977,"Em conclusão","2127","Incêndio em edifícios e recintos industriais, oficinas e armazéns",0,6,0,19,"2025-01-18T21:08:00","Braga","Braga","Norte",-8.351003,41.55998
24837705,"S.julião, N.s. da Anunciada e S. Maria da Graça","Península de Setúbal",311,"2025-01-18T19:35:00",24837705,"Em curso","2403","Colisão rodoviária",0,1,0,5,"2025-01-18T19:35:00","Setúbal","Setúbal","Área Metropolitana De Lisboa",-8.889983,38.529955
24837722,"Carregado e Cadafais","Oeste",311,"2025-01-18T19:55:00",24837722,"Em conclusão","2407","Despiste",0,2,0,4,"2025-01-18T19:55:00","Alenquer","Lisboa","Centro",-8.985297,39.023828
24837774,"a Dos Cunhados e Maceira","Oeste",311,"2025-01-18T20:09:00",24837774,"Em conclusão","2407","Despiste",0,11,0,30,"2025-01-18T20:09:00","Torres Vedras","Lisboa","Centro",-9.293374,39.15087
24837872,"Fânzeres e São Pedro da Cova","Area M. Porto",309,"2025-01-18T20:37:00",24837872,"Em conclusão","2401","Atropelamento rodoviário",0,2,0,4,"2025-01-18T20:37:00","Gondomar","Porto","Norte",-8.50733,41.15179
24837974,"Fânzeres e São Pedro da Cova","Area M. Porto",309,"2025-01-18T20:57:00",24837974,"Em curso","2403","Colisão rodoviária",0,4,0,11,"2025-01-18T20:57:00","Gondomar","Porto","Norte",-8.519015,41.174615
24838043,"Santo Agostinho e São João Baptista e Santo Amador","Baixo Alentejo",312,"2025-01-18T21:25:00",24838043,"Em resolução","2403","Colisão rodoviária",0,2,0,5,"2025-01-18T21:25:00","Moura","Beja","Alentejo",-7.361893,38.137985
24838074,"Algés, Linda-a-Velha e Cruz Quebrada-Dafundo","Grande Lisboa",311,"2025-01-18T21:41:00",24838074,"Em conclusão","2101","Incêndio em edifícios habitacionais",0,2,0,7,"2025-01-18T21:41:00","Oeiras","Lisboa","Área Metropolitana De Lisboa",-9.250524,38.707224
