"id","address","subregion","neighborhood","date","id.1","state","nature","nature_description","aerial_means","terrestrial_means","aquatic_means","operational","date.1","Concelho","Distrito","NUTII_DSG","longitude","latitude"
25591942,"Folhadela","Douro",309,"2025-06-28T08:59:00",25591942,"Em conclusão","2301","Incêndio em transporte rodoviário",0,2,0,7,"2025-06-28T08:59:00","Vila Real","Vila Real","Norte",-7.739234,41.281351
25592075,"Belém","Grande Lisboa",311,"2025-06-28T08:58:00",25592075,"Em despacho","2403","Colisão rodoviária",0,1,0,2,"2025-06-28T08:58:00","Lisboa","Lisboa","Área Metropolitana De Lisboa",-9.205691,38.697235
25592326,"Castanheira de Pêra e Coentral","Região de Leiria",310,"2025-06-28T10:06:00",25592326,"Em conclusão","2403","Colisão rodoviária",0,2,0,4,"2025-06-28T10:06:00","Castanheira De Pêra","Leiria","Centro",-8.209236,40.005971
25592341,"Lomba","Area M. Porto",309,"2025-06-28T10:12:00",25592341,"Em conclusão","3107","Consolidação de rescaldo de incêndio rural",0,2,0,10,"2025-06-28T10:12:00","Gondomar","Porto","Norte",-8.411494,41.057475
25592709,"Seixal, Arrentela e Aldeia de Paio Pires","Península de Setúbal",311,"2025-06-28T11:23:00",25592709,"Em conclusão","2403","Colisão rodoviária",0,3,0,8,"2025-06-28T11:23:00","Seixal","Setúbal","Área Metropolitana De Lisboa",-9.103194,38.608552
25592711,"Croca","Tâmega e Sousa",309,"2025-06-28T11:24:00",25592711,"Em despacho","4333","Busca e resgate aquático de animais",0,1,0,5,"2025-06-28T11:24:00","Penafiel","Porto","Norte",-8.248818,41.225235
25592808,"Coronado (São Romão e São Mamede)","Area M. Porto",309,"2025-06-28T11:41:00",25592808,"Em despacho","2403","Colisão rodoviária",0,1,0,2,"2025-06-28T11:41:00","Trofa","Porto","Norte",-8.573605,41.283875
25591582,"Oeiras e S. Julião da Barra, Paço de Arcos e Caxias","Grande Lisboa",311,"2025-06-28T07:43:00",25591582,"Em conclusão","2403","Colisão rodoviária",0,1,0,2,"2025-06-28T07:43:00","Oeiras","Lisboa","Área Metropolitana De Lisboa",-9.286155,38.706877
25592668,"Beja (Santiago Maior e São João Baptista)","Baixo Alentejo",312,"2025-06-28T11:10:00",25592668,"Em conclusão","2403","Colisão rodoviária",0,7,0,16,"2025-06-28T11:10:00","Beja","Beja","Alentejo",-7.869395,38.005128
25592684,"Beja (Salvador e Santa Maria da Feira)","Baixo Alentejo",312,"2025-06-28T11:18:00",25592684,"Em conclusão","3105","Incêndio rural",0,6,0,20,"2025-06-28T11:18:00","Beja","Beja","Alentejo",-7.865993,38.02966
25592686,"Sosa","Região de Aveiro",310,"2025-06-28T11:20:00",25592686,"Em conclusão","2301","Incêndio em transporte rodoviário",0,1,0,5,"2025-06-28T11:20:00","Vagos","Aveiro","Centro",-8.657173,40.535238
25592716,"Rebordãos","Terras de Trás-os-Montes",309,"2025-06-28T11:25:00",25592716,"Em resolução","3103","Incêndio rural",0,2,0,7,"2025-06-28T11:25:00","Bragança","Bragança","Norte",-6.8533,41.71852
25592817,"Póvoa de Santa Iria e Forte da Casa","Grande Lisboa",311,"2025-06-28T11:50:00",25592817,"Em despacho","3317","Inundação de estruturas por água canalizada",0,1,0,2,"2025-06-28T11:50:00","Vila Franca De Xira","Lisboa","Área Metropolitana De Lisboa",-9.06846,38.86652
25587798,"Caminha (Matriz) e Vilarelho","Alto Minho",309,"2025-06-27T12:30:00",25587798,"Em curso","2419","Afundamento ou adornamento",0,11,0,61,"2025-06-27T12:30:00","Caminha","Viana Do Castelo","Norte",-8.839419,41.867575
25592428,"Oeiras e S. Julião da Barra, Paço de Arcos e Caxias","Grande Lisboa",311,"2025-06-28T10:29:00",25592428,"Em conclusão","4327","Busca e resgate terrestre de pessoas",0,1,0,2,"2025-06-28T10:29:00","Oeiras","Lisboa","Área Metropolitana De Lisboa",-9.317571,38.67791
25592446,"Viseu","Viseu Dão Lafões",310,"2025-06-28T10:30:00",25592446,"Em despacho","4331","Busca e resgate terrestre de animais",0,1,0,2,"2025-06-28T10:30:00","Viseu","Viseu","Centro",-7.908451,40.659587
25592487,"Moita","Península de Setúbal",311,"2025-06-28T10:33:00",25592487,"Em despacho","4331","Busca e resgate terrestre de animais",0,1,0,2,"2025-06-28T10:33:00","Moita","Setúbal","Área Metropolitana De Lisboa",-8.985364,38.643702
25592623,"Carnaxide e Queijas","Grande Lisboa",311,"2025-06-28T10:53:00",25592623,"Em despacho","3311","Queda de elementos de estruturas edificados",0,1,0,4,"2025-06-28T10:53:00","Oeiras","Lisboa","Área Metropolitana De Lisboa",-9.25881,38.722457
25592721,"S.julião, N.s. da Anunciada e S. Maria da Graça","Península de Setúbal",311,"2025-06-28T11:20:00",25592721,"Em despacho","4331","Busca e resgate terrestre de animais",0,1,0,2,"2025-06-28T11:20:00","Setúbal","Setúbal","Área Metropolitana De Lisboa",-8.889983,38.529955
25592780,"Santiago do Escoural","Alentejo Central",312,"2025-06-28T11:40:00",25592780,"Em despacho","3105","Incêndio rural",0,5,0,19,"2025-06-28T11:40:00","Montemor-o-Novo","Évora","Alentejo",-8.179636,38.579973
25592306,"Vilarinho Dos Freires","Douro",309,"2025-06-28T10:08:00",25592306,"Em resolução","3103","Incêndio rural",0,6,0,27,"2025-06-28T10:08:00","Peso Da Régua","Vila Real","Norte",-7.733775,41.207972
25592397,"Guia, Ilha e Mata Mourisca","Região de Leiria",310,"2025-06-28T10:18:00",25592397,"Em curso","2401","Atropelamento rodoviário",0,2,0,4,"2025-06-28T10:18:00","Pombal","Leiria","Centro",-8.781363,39.947439
25592554,"Guarda","Beiras e Serra da Estrela",310,"2025-06-28T10:55:00",25592554,"Em conclusão","2301","Incêndio em transporte rodoviário",0,4,0,13,"2025-06-28T10:55:00","Guarda","Guarda","Centro",-7.234262,40.533685
25592556,"São Gregório e Santa Justa","Alentejo Central",312,"2025-06-28T10:54:00",25592556,"Em conclusão","3105","Incêndio rural",0,13,0,48,"2025-06-28T10:54:00","Arraiolos","Évora","Alentejo",-7.885787,38.766733
25592672,"Arcozelo","Area M. Porto",309,"2025-06-28T11:14:00",25592672,"Em despacho","4331","Busca e resgate terrestre de animais",0,1,0,2,"2025-06-28T11:14:00","Vila Nova De Gaia","Porto","Norte",-8.640388,41.056331
25592754,"Alcochete","Península de Setúbal",311,"2025-06-28T11:37:00",25592754,"Em resolução","2201","Incêndio em equipamentos ou produtos",0,3,0,8,"2025-06-28T11:37:00","Alcochete","Setúbal","Área Metropolitana De Lisboa",-8.96428,38.75194
25592815,"Sendim","Tâmega e Sousa",309,"2025-06-28T11:43:00",25592815,"Em despacho","2407","Despiste",0,1,0,2,"2025-06-28T11:43:00","Felgueiras","Porto","Norte",-8.186937,41.386455
