"id","address","subregion","neighborhood","date","id.1","state","nature","nature_description","aerial_means","terrestrial_means","aquatic_means","operational","date.1","Concelho","Distrito","NUTII_DSG","longitude","latitude"
25070044,"Praia do Ribatejo","Médio Tejo",311,"2025-03-10T19:30:00",25070044,"Em curso","1101","Cheia",0,0,0,0,"2025-03-10T19:30:00","Vila Nova Da Barquinha","Santarém","Centro",-8.357309,39.485638
25071496,"São Manços e São Vicente do Pigeiro","Alentejo Central",312,"2025-03-11T13:18:00",25071496,"Em conclusão","1101","Cheia",0,0,0,0,"2025-03-11T13:18:00","Évora","Évora","Alentejo",-7.713313,38.513673
25137544,"Dois Portos e Runa","Oeste",311,"2025-03-23T13:41:00",25137544,"Em conclusão","3313","Deslizamento de terras",0,0,0,0,"2025-03-23T13:41:00","Torres Vedras","Lisboa","Centro",-9.178343,39.036686
25187841,"Póvoa de Santo Adrião e Olival Basto","Grande Lisboa",311,"2025-04-03T05:09:00",25187841,"Em despacho","2301","Incêndio em transporte rodoviário",0,0,0,0,"2025-04-03T05:09:00","Odivelas","Lisboa","Área Metropolitana De Lisboa",-9.166024,38.78887
25068300,"Almeirim","Lezíria do Tejo",311,"2025-03-10T20:52:00",25068300,"Em curso","1101","Cheia",0,0,0,0,"2025-03-10T20:52:00","Almeirim","Santarém","Alentejo",-8.635002,39.187436
25171536,"Vila do Bispo e Raposeira","Algarve",313,"2025-03-30T17:20:00",25171536,"Em curso","2409","Acidente aéreo",0,2,0,3,"2025-03-30T17:20:00","Vila Do Bispo","Faro","Algarve",-8.865283,37.043507
25113184,"Castanheira do Ribatejo e Cachoeiras","Grande Lisboa",311,"2025-03-20T01:20:00",25113184,"Em despacho","3301","Queda de árvore",0,0,0,0,"2025-03-20T01:20:00","Vila Franca De Xira","Lisboa","Área Metropolitana De Lisboa",-8.979234,38.999552
25187822,"Achete, Azoia de Baixo e Póvoa de Santarém","Lezíria do Tejo",311,"2025-04-03T04:41:00",25187822,"Em conclusão","2201","Incêndio em equipamentos ou produtos",0,4,0,11,"2025-04-03T04:41:00","Santarém","Santarém","Alentejo",-8.694713,39.362938
