"id","address","subregion","neighborhood","date","id.1","state","nature","nature_description","aerial_means","terrestrial_means","aquatic_means","operational","date.1","Concelho","Distrito","NUTII_DSG","longitude","latitude"
24737936,"Espinhosela","Terras de Trás-os-Montes",309,"2024-12-27T16:44:00",24737936,"Em curso","4327","Busca e resgate terrestre de pessoas",0,12,0,36,"2024-12-27T16:44:00","Bragança","Bragança","Norte",-6.84013,41.898706
24748107,"Vale de Espinho","Beiras e Serra da Estrela",310,"2024-12-30T05:14:00",24748107,"Em conclusão","2101","Incêndio em edifícios habitacionais",0,4,0,8,"2024-12-30T05:14:00","Sabugal","Guarda","Centro",-6.94805,40.295227
24748164,"São Pedro","Região de Coimbra",310,"2024-12-30T06:16:00",24748164,"Em curso","2407","Despiste",0,1,0,2,"2024-12-30T06:16:00","Figueira Da Foz","Coimbra","Centro",-8.853578,40.129593
24748191,"Queluz e Belas","Grande Lisboa",311,"2024-12-30T06:30:00",24748191,"Em curso","2401","Atropelamento rodoviário",0,3,0,6,"2024-12-30T06:30:00","Sintra","Lisboa","Área Metropolitana De Lisboa",-9.253541,38.753134
24748186,"Mealhada, Ventosa do Bairro e Antes","Região de Coimbra",310,"2024-12-30T06:34:00",24748186,"Em curso","2403","Colisão rodoviária",0,3,0,6,"2024-12-30T06:34:00","Mealhada","Aveiro","Centro",-8.458111,40.375676
24748013,"Eiras e São Paulo de Frades","Região de Coimbra",310,"2024-12-30T03:28:00",24748013,"Em resolução","2101","Incêndio em edifícios habitacionais",0,7,0,18,"2024-12-30T03:28:00","Coimbra","Coimbra","Centro",-8.43524,40.2225
24744364,"Sé Nova, Santa Cruz, Almedina e São Bartolomeu","Região de Coimbra",310,"2024-12-29T08:26:00",24744364,"Em conclusão","2115","Incêndio em edifícios hoteleiros e de restauração",0,11,0,31,"2024-12-29T08:26:00","Coimbra","Coimbra","Centro",-8.425582,40.205556
24748206,"Almargem do Bispo, Pêro Pinheiro e Montelavar","Grande Lisboa",311,"2024-12-30T06:48:00",24748206,"Em curso","2201","Incêndio em equipamentos ou produtos",0,1,0,4,"2024-12-30T06:48:00","Sintra","Lisboa","Área Metropolitana De Lisboa",-9.309022,38.82984
