"id","address","subregion","neighborhood","date","id.1","state","nature","nature_description","aerial_means","terrestrial_means","aquatic_means","operational","date.1","Concelho","Distrito","NUTII_DSG","longitude","latitude"
25255711,"Marco","Tâmega e Sousa",309,"2025-04-18T11:11:00",25255711,"Em conclusão","2403","Colisão rodoviária",0,2,0,4,"2025-04-18T11:11:00","Marco De Canaveses","Porto","Norte",-8.150777,41.178845
25255761,"Canidelo","Area M. Porto",309,"2025-04-18T11:32:00",25255761,"Em resolução","2403","Colisão rodoviária",0,2,0,4,"2025-04-18T11:32:00","Vila Nova De Gaia","Porto","Norte",-8.643973,41.123309
25255863,"Oeiras e S. Julião da Barra, Paço de Arcos e Caxias","Grande Lisboa",311,"2025-04-18T12:00:00",25255863,"Em conclusão","3317","Inundação de estruturas por água canalizada",0,1,0,2,"2025-04-18T12:00:00","Oeiras","Lisboa","Área Metropolitana De Lisboa",-9.275682,38.698873
25255927,"Monte Redondo e Carreira","Região de Leiria",310,"2025-04-18T12:16:00",25255927,"Em curso","2403","Colisão rodoviária",0,2,0,3,"2025-04-18T12:16:00","Leiria","Leiria","Centro",-8.847483,39.892112
25255929,"Santa Iria de Azoia, São João da Talha e Bobadela","Grande Lisboa",311,"2025-04-18T12:16:00",25255929,"Em despacho","3321","Dano na rede de fornecimento de eletricidade ",0,1,0,5,"2025-04-18T12:16:00","Loures","Lisboa","Área Metropolitana De Lisboa",-9.098065,38.824783
25255581,"Odivelas","Grande Lisboa",311,"2025-04-18T10:40:00",25255581,"Em conclusão","2101","Incêndio em edifícios habitacionais",0,1,0,5,"2025-04-18T10:40:00","Odivelas","Lisboa","Área Metropolitana De Lisboa",-9.175768,38.787934
25255858,"Rio de Mouro","Grande Lisboa",311,"2025-04-18T12:04:00",25255858,"Em resolução","2407","Despiste",0,2,0,7,"2025-04-18T12:04:00","Sintra","Lisboa","Área Metropolitana De Lisboa",-9.32013,38.77339
25070044,"Praia do Ribatejo","Médio Tejo",311,"2025-03-10T19:30:00",25070044,"Em curso","1101","Cheia",0,0,0,0,"2025-03-10T19:30:00","Vila Nova Da Barquinha","Santarém","Centro",-8.357309,39.485638
25071496,"São Manços e São Vicente do Pigeiro","Alentejo Central",312,"2025-03-11T13:18:00",25071496,"Em conclusão","1101","Cheia",0,0,0,0,"2025-03-11T13:18:00","Évora","Évora","Alentejo",-7.713313,38.513673
25202441,"Serpa (Salvador e Santa Maria)","Baixo Alentejo",312,"2025-04-06T10:25:00",25202441,"Em conclusão","1101","Cheia",0,0,0,0,"2025-04-06T10:25:00","Serpa","Beja","Alentejo",-7.555783,37.88592
25255671,"Fonte Boa e Rio Tinto","Cávado",309,"2025-04-18T11:13:00",25255671,"Em conclusão","2407","Despiste",0,4,0,8,"2025-04-18T11:13:00","Esposende","Braga","Norte",-8.72893,41.496433
25255701,"Querença, Tôr e Benafim","Algarve",313,"2025-04-18T11:21:00",25255701,"Em conclusão","2407","Despiste",0,3,0,8,"2025-04-18T11:21:00","Loulé","Faro","Algarve",-8.027192,37.194462
25255751,"Ovar, São João, Arada e São Vicente de Pereira Jusã","Região de Aveiro",310,"2025-04-18T11:29:00",25255751,"Em conclusão","2403","Colisão rodoviária",0,1,0,2,"2025-04-18T11:29:00","Ovar","Aveiro","Centro",-8.610338,40.860862
25255784,"Prova e Casteição","Beiras e Serra da Estrela",310,"2025-04-18T11:45:00",25255784,"Em resolução","2407","Despiste",0,4,0,13,"2025-04-18T11:45:00","Mêda","Guarda","Centro",-7.314455,40.879955
25255803,"Montijo e Afonsoeiro","Península de Setúbal",311,"2025-04-18T11:45:00",25255803,"Em resolução","2403","Colisão rodoviária",0,3,0,8,"2025-04-18T11:45:00","Montijo","Setúbal","Área Metropolitana De Lisboa",-8.991583,38.707396
25255854,"Santa Maria Maior e Monserrate e Meadela","Alto Minho",309,"2025-04-18T11:54:00",25255854,"Em despacho","3315","Inundação de estruturas por precipitação intensa",0,1,0,2,"2025-04-18T11:54:00","Viana Do Castelo","Viana Do Castelo","Norte",-8.81652,41.703882
25255935,"Marvila","Grande Lisboa",311,"2025-04-18T11:30:00",25255935,"Em curso","2503","Acidente químico dentro de instalação",0,2,0,9,"2025-04-18T11:30:00","Lisboa","Lisboa","Área Metropolitana De Lisboa",-9.110956,38.74793
25068300,"Almeirim","Lezíria do Tejo",311,"2025-03-10T20:52:00",25068300,"Em curso","1101","Cheia",0,0,0,0,"2025-03-10T20:52:00","Almeirim","Santarém","Alentejo",-8.635002,39.187436
25255391,"Albufeira e Olhos de Água","Algarve",313,"2025-04-18T09:35:00",25255391,"Em conclusão","3301","Queda de árvore",0,2,0,4,"2025-04-18T09:35:00","Albufeira","Faro","Algarve",-8.229652,37.095927
25255764,"Bonfim","Area M. Porto",309,"2025-04-18T11:35:00",25255764,"Em despacho","3315","Inundação de estruturas por precipitação intensa",0,1,0,5,"2025-04-18T11:35:00","Porto","Porto","Norte",-8.596119,41.151713
25255791,"Santa Comba Dão e Couto do Mosteiro","Viseu Dão Lafões",310,"2025-04-18T11:47:00",25255791,"Em conclusão","2101","Incêndio em edifícios habitacionais",0,1,0,2,"2025-04-18T11:47:00","Santa Comba Dão","Viseu","Centro",-8.127394,40.39547
25255800,"Bodiosa","Viseu Dão Lafões",310,"2025-04-18T11:50:00",25255800,"Em conclusão","2101","Incêndio em edifícios habitacionais",0,2,0,9,"2025-04-18T11:50:00","Viseu","Viseu","Centro",-7.979264,40.719136
25255805,"Alfragide","Grande Lisboa",311,"2025-04-18T11:47:00",25255805,"Em conclusão","3321","Dano na rede de fornecimento de eletricidade ",0,2,0,8,"2025-04-18T11:47:00","Amadora","Lisboa","Área Metropolitana De Lisboa",-9.225704,38.738085
25255859,"Azeitão (São Lourenço e São Simão)","Península de Setúbal",311,"2025-04-18T11:59:00",25255859,"Em curso","2403","Colisão rodoviária",0,6,0,17,"2025-04-18T11:59:00","Setúbal","Setúbal","Área Metropolitana De Lisboa",-9.008871,38.513402
25255882,"Souto da Carpalhosa e Ortigosa","Região de Leiria",310,"2025-04-18T12:06:00",25255882,"Em curso","2403","Colisão rodoviária",0,5,0,12,"2025-04-18T12:06:00","Leiria","Leiria","Centro",-8.837503,39.830931
25255909,"São João Das Lampas e Terrugem","Grande Lisboa",311,"2025-04-18T12:18:00",25255909,"Em despacho","4329","Busca e resgate aquático de pessoas",0,0,0,0,"2025-04-18T12:18:00","Sintra","Lisboa","Área Metropolitana De Lisboa",-9.420122,38.93142
25255916,"Gulpilhares e Valadares","Area M. Porto",309,"2025-04-18T12:20:00",25255916,"Em despacho","3321","Dano na rede de fornecimento de eletricidade ",0,0,0,0,"2025-04-18T12:20:00","Vila Nova De Gaia","Porto","Norte",-8.635994,41.08239
