"id","address","subregion","neighborhood","date","id.1","state","nature","nature_description","aerial_means","terrestrial_means","aquatic_means","operational","date.1","Concelho","Distrito","NUTII_DSG","longitude","latitude"
24775332,"São João Das Lampas e Terrugem","Grande Lisboa",311,"2025-01-05T04:06:00",24775332,"Em conclusão","3203","Detritos confinados",0,2,0,6,"2025-01-05T04:06:00","Sintra","Lisboa","Área Metropolitana De Lisboa",-9.37591,38.84657
24775356,"Cedofeita, Ildefonso, Sé, Miragaia, Nicolau e Vitória","Area M. Porto",309,"2025-01-05T04:27:00",24775356,"Em conclusão","2401","Atropelamento rodoviário",0,2,0,5,"2025-01-05T04:27:00","Porto","Porto","Norte",-8.611215,41.146471
24775319,"Loivo","Alto Minho",309,"2025-01-05T03:43:00",24775319,"Em conclusão","3111","Queima",0,0,0,0,"2025-01-05T03:43:00","Vila Nova De Cerveira","Viana Do Castelo","Norte",-8.73384,41.931068
24775337,"Medelo","Ave",309,"2025-01-05T04:05:00",24775337,"Em despacho","2407","Despiste",0,2,0,4,"2025-01-05T04:05:00","Fafe","Braga","Norte",-8.159613,41.46982
24775369,"Mesão Frio","Ave",309,"2025-01-05T04:52:00",24775369,"Em despacho","2301","Incêndio em transporte rodoviário",0,2,0,7,"2025-01-05T04:52:00","Guimarães","Braga","Norte",-8.2704,41.45423
24775371,"São Paio de Oleiros","Area M. Porto",309,"2025-01-05T04:43:00",24775371,"Em despacho","2127","Incêndio em edifícios e recintos industriais, oficinas e armazéns",0,1,0,3,"2025-01-05T04:43:00","Santa Maria Da Feira","Aveiro","Norte",-8.597091,40.987787
