"id","address","subregion","neighborhood","date","id.1","state","nature","nature_description","aerial_means","terrestrial_means","aquatic_means","operational","date.1","Concelho","Distrito","NUTII_DSG","longitude","latitude"
25015401,"Soure","Região de Coimbra",310,"2025-02-26T22:08:00",25015401,"Em despacho","2403","Colisão rodoviária",0,2,0,3,"2025-02-26T22:08:00","Soure","Coimbra","Centro",-8.57738,40.04033
25005550,"Sines","Alentejo Litoral",312,"2025-02-24T19:12:00",25005550,"Em conclusão","3313","Deslizamento de terras",0,0,0,0,"2025-02-24T19:12:00","Sines","Setúbal","Alentejo",-8.849778,37.961314
25011248,"Sacavém e Prior Velho","Grande Lisboa",311,"2025-02-26T03:53:00",25011248,"Em conclusão","2503","Acidente químico dentro de instalação",0,0,0,0,"2025-02-26T03:53:00","Loures","Lisboa","Área Metropolitana De Lisboa",-9.12696,38.787774
25014607,"Almeirim","Lezíria do Tejo",311,"2025-02-26T18:20:00",25014607,"Em conclusão","2407","Despiste",0,3,0,4,"2025-02-26T18:20:00","Almeirim","Santarém","Alentejo",-8.626158,39.169375
25015294,"Santa Maria Maior e Monserrate e Meadela","Alto Minho",309,"2025-02-26T21:29:00",25015294,"Em conclusão","3203","Detritos confinados",0,1,0,3,"2025-02-26T21:29:00","Viana Do Castelo","Viana Do Castelo","Norte",-8.826611,41.70074
25015295,"Paço de Sousa","Tâmega e Sousa",309,"2025-02-26T21:29:00",25015295,"Em conclusão","2101","Incêndio em edifícios habitacionais",0,4,0,12,"2025-02-26T21:29:00","Penafiel","Porto","Norte",-8.32827,41.1604
25015342,"Chamusca e Pinheiro Grande","Lezíria do Tejo",311,"2025-02-26T21:42:00",25015342,"Em conclusão","2301","Incêndio em transporte rodoviário",0,2,0,6,"2025-02-26T21:42:00","Chamusca","Santarém","Alentejo",-8.490477,39.362372
25015444,"Moscavide e Portela","Grande Lisboa",311,"2025-02-26T22:21:00",25015444,"Em curso","2115","Incêndio em edifícios hoteleiros e de restauração",0,2,0,7,"2025-02-26T22:21:00","Lisboa","Lisboa","Área Metropolitana De Lisboa",-9.099341,38.780698
24877003,"Malagueira e Horta Das Figueiras","Alentejo Central",312,"2025-01-27T11:41:00",24877003,"Em conclusão","3315","Inundação de estruturas por precipitação intensa",0,0,0,0,"2025-01-27T11:41:00","Évora","Évora","Alentejo",-7.924277,38.57285
25015383,"Costa da Caparica","Península de Setúbal",311,"2025-02-26T21:58:00",25015383,"Em conclusão","2101","Incêndio em edifícios habitacionais",0,2,0,8,"2025-02-26T21:58:00","Almada","Setúbal","Área Metropolitana De Lisboa",-9.23867,38.64499
25015440,"Vila Cova à Coelheira","Viseu Dão Lafões",310,"2025-02-26T22:26:00",25015440,"Em despacho","2101","Incêndio em edifícios habitacionais",0,0,0,0,"2025-02-26T22:26:00","Vila Nova De Paiva","Viseu","Centro",-7.80145,40.88372
25015449,"Poceirão e Marateca","Península de Setúbal",311,"2025-02-26T22:29:00",25015449,"Em despacho","2201","Incêndio em equipamentos ou produtos",0,0,0,0,"2025-02-26T22:29:00","Palmela","Setúbal","Área Metropolitana De Lisboa",-8.768227,38.60934
24888293,"Pernes","Lezíria do Tejo",311,"2025-01-29T16:41:00",24888293,"Em curso","3301","Queda de árvore",0,0,0,0,"2025-01-29T16:41:00","Santarém","Santarém","Alentejo",-8.658865,39.381547
25014678,"São Mamede de Infesta e Senhora da Hora","Area M. Porto",309,"2025-02-26T18:34:00",25014678,"Em conclusão","2119","Incêndio em edifícios e recintos desportivos e de lazer",0,4,0,12,"2025-02-26T18:34:00","Matosinhos","Porto","Norte",-8.65702,41.18433
25015166,"Relíquias","Alentejo Litoral",312,"2025-02-26T20:44:00",25015166,"Em conclusão","2407","Despiste",0,2,0,4,"2025-02-26T20:44:00","Odemira","Beja","Alentejo",-8.594993,37.703205
25015357,"Santa Maria Maior e Monserrate e Meadela","Alto Minho",309,"2025-02-26T21:34:00",25015357,"Em conclusão","3203","Detritos confinados",0,1,0,5,"2025-02-26T21:34:00","Viana Do Castelo","Viana Do Castelo","Norte",-8.823133,41.70229
25015407,"Cascais e Estoril","Grande Lisboa",311,"2025-02-26T22:10:00",25015407,"Em curso","2101","Incêndio em edifícios habitacionais",0,4,0,11,"2025-02-26T22:10:00","Cascais","Lisboa","Área Metropolitana De Lisboa",-9.43799,38.69884
