"id","address","subregion","neighborhood","date","id.1","state","nature","nature_description","aerial_means","terrestrial_means","aquatic_means","operational","date.1","Concelho","Distrito","NUTII_DSG","longitude","latitude"
25059714,"Torrão","Alentejo Litoral",312,"2025-03-08T22:10:00",25059714,"Em curso","1101","Cheia",0,2,0,3,"2025-03-08T22:10:00","Alcácer Do Sal","Setúbal","Alentejo",-8.359133,38.252053
25065114,"Santana do Mato","Lezíria do Tejo",311,"2025-03-10T09:46:00",25065114,"Em despacho","3333","Rutura de barragem",0,2,0,4,"2025-03-10T09:46:00","Coruche","Santarém","Alentejo",-8.468222,38.831897
25065132,"Outeiro da Cortiçada e Arruda Dos Pisões","Lezíria do Tejo",311,"2025-03-10T09:49:00",25065132,"Em conclusão","2127","Incêndio em edifícios e recintos industriais, oficinas e armazéns",0,6,0,13,"2025-03-10T09:49:00","Rio Maior","Santarém","Alentejo",-8.79679,39.344097
25065162,"Almeirim","Lezíria do Tejo",311,"2025-03-10T09:57:00",25065162,"Em conclusão","2407","Despiste",0,2,0,4,"2025-03-10T09:57:00","Almeirim","Santarém","Alentejo",-8.630072,39.235152
25065249,"Ílhavo (São Salvador)","Região de Aveiro",310,"2025-03-10T10:12:00",25065249,"Em conclusão","2403","Colisão rodoviária",0,1,0,2,"2025-03-10T10:12:00","Ílhavo","Aveiro","Centro",-8.684741,40.586439
25065464,"Massamá e Monte Abraão","Grande Lisboa",311,"2025-03-10T10:40:00",25065464,"Em despacho","2401","Atropelamento rodoviário",0,2,0,4,"2025-03-10T10:40:00","Sintra","Lisboa","Área Metropolitana De Lisboa",-9.27045,38.75541
25065513,"Guisande e Oliveira (São Pedro)","Cávado",309,"2025-03-10T10:51:00",25065513,"Em resolução","2407","Despiste",0,5,0,12,"2025-03-10T10:51:00","Braga","Braga","Norte",-8.465492,41.477313
25065582,"Torres Novas (Santa Maria, Salvador e Santiago)","Médio Tejo",311,"2025-03-10T11:11:00",25065582,"Em conclusão","2407","Despiste",0,3,0,8,"2025-03-10T11:11:00","Torres Novas","Santarém","Centro",-8.574957,39.471485
25065647,"Alverca do Ribatejo e Sobralinho","Grande Lisboa",311,"2025-03-10T11:22:00",25065647,"Em despacho","3301","Queda de árvore",0,1,0,5,"2025-03-10T11:22:00","Vila Franca De Xira","Lisboa","Área Metropolitana De Lisboa",-9.04568,38.90465
25065681,"Ferreira do Alentejo e Canhestros","Baixo Alentejo",312,"2025-03-10T11:30:00",25065681,"Em despacho","3301","Queda de árvore",0,1,0,3,"2025-03-10T11:30:00","Ferreira Do Alentejo","Beja","Alentejo",-8.2895,38.03496
25065700,"São Salvador e Santa Maria","Alentejo Litoral",312,"2025-03-10T09:00:00",25065700,"Em despacho","3313","Deslizamento de terras",0,2,0,3,"2025-03-10T09:00:00","Odemira","Beja","Alentejo",-8.644199,37.597442
25063232,"Santa Maria do Castelo e Santiago e Santa Susana","Alentejo Litoral",312,"2025-03-09T19:02:00",25063232,"Em curso","1101","Cheia",0,1,0,1,"2025-03-09T19:02:00","Alcácer Do Sal","Setúbal","Alentejo",-8.48167,38.29806
25064586,"Santa Maria, São Pedro e Sobral da Lagoa","Oeste",311,"2025-03-10T08:01:00",25064586,"Em conclusão","2407","Despiste",0,2,0,4,"2025-03-10T08:01:00","Óbidos","Leiria","Centro",-9.161155,39.364678
25064922,"Arruda Dos Vinhos","Oeste",311,"2025-03-10T09:03:00",25064922,"Em curso","3315","Inundação de estruturas por precipitação intensa",0,2,0,3,"2025-03-10T09:03:00","Arruda Dos Vinhos","Lisboa","Centro",-9.098654,39.001645
25064939,"Venda do Pinheiro e Santo Estêvão Das Galés","Grande Lisboa",311,"2025-03-10T09:11:00",25064939,"Em conclusão","2401","Atropelamento rodoviário",0,2,0,4,"2025-03-10T09:11:00","Mafra","Lisboa","Área Metropolitana De Lisboa",-9.228575,38.925416
25065337,"Sandim, Olival, Lever e Crestuma","Area M. Porto",309,"2025-03-10T10:31:00",25065337,"Em conclusão","2127","Incêndio em edifícios e recintos industriais, oficinas e armazéns",0,8,0,24,"2025-03-10T10:31:00","Vila Nova De Gaia","Porto","Norte",-8.51956,41.04005
25065354,"Nazaré","Oeste",311,"2025-03-10T10:29:00",25065354,"Em conclusão","3315","Inundação de estruturas por precipitação intensa",0,1,0,2,"2025-03-10T10:29:00","Nazaré","Leiria","Centro",-9.062127,39.596083
25065541,"Quelfes","Algarve",313,"2025-03-10T11:02:00",25065541,"Em conclusão","2403","Colisão rodoviária",0,5,0,13,"2025-03-10T11:02:00","Olhão","Faro","Algarve",-7.820507,37.058941
25065574,"Salvaterra de Magos e Foros de Salvaterra","Lezíria do Tejo",311,"2025-03-10T11:10:00",25065574,"Em conclusão","3315","Inundação de estruturas por precipitação intensa",0,1,0,1,"2025-03-10T11:10:00","Salvaterra De Magos","Santarém","Alentejo",-8.759168,39.005492
25065606,"São João Das Lampas e Terrugem","Grande Lisboa",311,"2025-03-10T11:17:00",25065606,"Em despacho","3315","Inundação de estruturas por precipitação intensa",0,1,0,2,"2025-03-10T11:17:00","Sintra","Lisboa","Área Metropolitana De Lisboa",-9.358215,38.887195
25064774,"Aljezur","Algarve",313,"2025-03-10T08:41:00",25064774,"Em curso","3301","Queda de árvore",0,1,0,4,"2025-03-10T08:41:00","Aljezur","Faro","Algarve",-8.803144,37.313343
25064801,"Mira","Região de Coimbra",310,"2025-03-10T08:34:00",25064801,"Em despacho","3315","Inundação de estruturas por precipitação intensa",0,1,0,1,"2025-03-10T08:34:00","Mira","Coimbra","Centro",-8.734102,40.4268
25065067,"Quiaios","Região de Coimbra",310,"2025-03-10T09:39:00",25065067,"Em conclusão","2407","Despiste",0,3,0,10,"2025-03-10T09:39:00","Figueira Da Foz","Coimbra","Centro",-8.84465,40.21339
25065403,"Marmelete","Algarve",313,"2025-03-10T10:26:00",25065403,"Em despacho","3313","Deslizamento de terras",0,1,0,2,"2025-03-10T10:26:00","Monchique","Faro","Algarve",-8.697881,37.26614
25065460,"Sado","Península de Setúbal",311,"2025-03-10T10:41:00",25065460,"Em despacho","3301","Queda de árvore",0,1,0,5,"2025-03-10T10:41:00","Setúbal","Setúbal","Área Metropolitana De Lisboa",-8.830049,38.498799
25065467,"Cartaxo e Vale da Pinta","Lezíria do Tejo",311,"2025-03-10T10:50:00",25065467,"Em despacho","3309","Desabamento de estruturas edificadas",0,1,0,2,"2025-03-10T10:50:00","Cartaxo","Santarém","Alentejo",-8.794948,39.166481
25065576,"Azambujeira e Malaqueijo","Lezíria do Tejo",311,"2025-03-10T11:06:00",25065576,"Em resolução","2403","Colisão rodoviária",0,4,0,11,"2025-03-10T11:06:00","Santarém","Santarém","Alentejo",-8.801862,39.291572
25065585,"Benavente","Lezíria do Tejo",311,"2025-03-10T11:12:00",25065585,"Em conclusão","3315","Inundação de estruturas por precipitação intensa",0,3,0,5,"2025-03-10T11:12:00","Benavente","Santarém","Alentejo",-8.8096,38.97811
25065719,"Carnaxide e Queijas","Grande Lisboa",311,"2025-03-10T11:29:00",25065719,"Em resolução","3315","Inundação de estruturas por precipitação intensa",0,1,0,5,"2025-03-10T11:29:00","Oeiras","Lisboa","Área Metropolitana De Lisboa",-9.259903,38.718843
25065735,"Odeceixe","Algarve",313,"2025-03-10T11:30:00",25065735,"Em despacho","3301","Queda de árvore",0,2,0,6,"2025-03-10T11:30:00","Aljezur","Faro","Algarve",-8.752101,37.416337
25063971,"Salir","Algarve",313,"2025-03-09T23:45:00",25063971,"Em resolução","3313","Deslizamento de terras",0,3,0,3,"2025-03-09T23:45:00","Loulé","Faro","Algarve",-7.945758,37.230723
25064668,"São João do Monte e Mosteirinho","Viseu Dão Lafões",310,"2025-03-10T08:14:00",25064668,"Em conclusão","4327","Busca e resgate terrestre de pessoas",0,1,0,2,"2025-03-10T08:14:00","Tondela","Viseu","Centro",-8.235887,40.586815
25064866,"Beja (Salvador e Santa Maria da Feira)","Baixo Alentejo",312,"2025-03-10T09:03:00",25064866,"Em conclusão","2101","Incêndio em edifícios habitacionais",0,3,0,7,"2025-03-10T09:03:00","Beja","Beja","Alentejo",-7.85537,38.014323
25064916,"Santo Antão e São Julião do Tojal","Grande Lisboa",311,"2025-03-10T08:56:00",25064916,"Em despacho","3315","Inundação de estruturas por precipitação intensa",0,1,0,4,"2025-03-10T08:56:00","Loures","Lisboa","Área Metropolitana De Lisboa",-9.137133,38.85709
25065325,"Odeceixe","Algarve",313,"2025-03-10T10:09:00",25065325,"Em curso","3301","Queda de árvore",0,1,0,4,"2025-03-10T10:09:00","Aljezur","Faro","Algarve",-8.742576,37.399882
25065334,"Guilhadeses e Santar","Alto Minho",309,"2025-03-10T10:25:00",25065334,"Em conclusão","2407","Despiste",0,1,0,2,"2025-03-10T10:25:00","Arcos De Valdevez","Viana Do Castelo","Norte",-8.423207,41.819172
25065377,"Fazendas de Almeirim","Lezíria do Tejo",311,"2025-03-10T10:37:00",25065377,"Em curso","3321","Dano na rede de fornecimento de eletricidade ",0,1,0,2,"2025-03-10T10:37:00","Almeirim","Santarém","Alentejo",-8.538074,39.165858
25065459,"Aveiras de Cima","Lezíria do Tejo",311,"2025-03-10T10:48:00",25065459,"Em resolução","2403","Colisão rodoviária",0,4,0,11,"2025-03-10T10:48:00","Azambuja","Lisboa","Alentejo",-8.90117,39.127097
25065493,"Vila Ruiva","Baixo Alentejo",312,"2025-03-10T10:50:00",25065493,"Em curso","2407","Despiste",0,7,0,18,"2025-03-10T10:50:00","Cuba","Beja","Alentejo",-7.946047,38.244478
25065502,"Lagos (São Sebastião e Santa Maria)","Algarve",313,"2025-03-10T10:52:00",25065502,"Em conclusão","3329","Queda de estruturas temporárias ou móveis",0,1,0,5,"2025-03-10T10:52:00","Lagos","Faro","Algarve",-8.668524,37.100485
25065771,"Malveira e São Miguel de Alcainça","Grande Lisboa",311,"2025-03-10T11:35:00",25065771,"Em despacho","3315","Inundação de estruturas por precipitação intensa",0,1,0,5,"2025-03-10T11:35:00","Mafra","Lisboa","Área Metropolitana De Lisboa",-9.255135,38.927865
25065657,"Gavião e Atalaia","Alto Alentejo",312,"2025-03-10T11:23:00",25065657,"Em curso","3309","Desabamento de estruturas edificadas",0,3,0,5,"2025-03-10T11:23:00","Gavião","Portalegre","Alentejo",-7.950913,39.428242
25065722,"Igreja Nova e Cheleiros","Grande Lisboa",311,"2025-03-10T11:32:00",25065722,"Em despacho","3315","Inundação de estruturas por precipitação intensa",0,1,0,2,"2025-03-10T11:32:00","Mafra","Lisboa","Área Metropolitana De Lisboa",-9.321418,38.89208
25065740,"Vialonga","Grande Lisboa",311,"2025-03-10T11:35:00",25065740,"Em conclusão","3315","Inundação de estruturas por precipitação intensa",0,1,0,5,"2025-03-10T11:35:00","Vila Franca De Xira","Lisboa","Área Metropolitana De Lisboa",-9.091665,38.862668
25065757,"Alhandra, São João Dos Montes e Calhandriz","Grande Lisboa",311,"2025-03-10T11:44:00",25065757,"Em despacho","2201","Incêndio em equipamentos ou produtos",0,0,0,0,"2025-03-10T11:44:00","Vila Franca De Xira","Lisboa","Área Metropolitana De Lisboa",-9.011526,38.92345
25065570,"São Martinho de Árvore e Lamarosa","Região de Coimbra",310,"2025-03-10T11:06:00",25065570,"Em despacho","2403","Colisão rodoviária",0,2,0,4,"2025-03-10T11:06:00","Coimbra","Coimbra","Centro",-8.551362,40.22228
25065702,"Serzedo e Perosinho","Area M. Porto",309,"2025-03-10T11:25:00",25065702,"Em conclusão","2515","Fuga de gás em garrafa",0,3,0,8,"2025-03-10T11:25:00","Vila Nova De Gaia","Porto","Norte",-8.600642,41.053381
25065754,"Sardoal","Médio Tejo",311,"2025-03-10T11:43:00",25065754,"Em curso","2301","Incêndio em transporte rodoviário",0,3,0,8,"2025-03-10T11:43:00","Sardoal","Santarém","Centro",-8.158693,39.533153
25065761,"Salvaterra de Magos e Foros de Salvaterra","Lezíria do Tejo",311,"2025-03-10T11:43:00",25065761,"Em despacho","3315","Inundação de estruturas por precipitação intensa",0,1,0,5,"2025-03-10T11:43:00","Salvaterra De Magos","Santarém","Alentejo",-8.790194,39.028695
