"id","address","subregion","neighborhood","date","id.1","state","nature","nature_description","aerial_means","terrestrial_means","aquatic_means","operational","date.1","Concelho","Distrito","NUTII_DSG","longitude","latitude"
25020666,"Aljezur","Algarve",313,"2025-02-28T06:31:00",25020666,"Em despacho","3315","Inundação de estruturas por precipitação intensa",0,2,0,3,"2025-02-28T06:31:00","Aljezur","Faro","Algarve",-8.803144,37.313343
25020765,"Oliveira do Hospital e São Paio de Gramaços","Região de Coimbra",310,"2025-02-28T07:25:00",25020765,"Em despacho","4331","Busca e resgate terrestre de animais",0,1,0,2,"2025-02-28T07:25:00","Oliveira Do Hospital","Coimbra","Centro",-7.852908,40.366794
25005550,"Sines","Alentejo Litoral",312,"2025-02-24T19:12:00",25005550,"Em conclusão","3313","Deslizamento de terras",0,0,0,0,"2025-02-24T19:12:00","Sines","Setúbal","Alentejo",-8.849778,37.961314
25020623,"São Salvador e Santa Maria","Alentejo Litoral",312,"2025-02-28T05:30:00",25020623,"Em curso","3301","Queda de árvore",0,3,0,5,"2025-02-28T05:30:00","Odemira","Beja","Alentejo",-8.721337,37.612495
24877003,"Malagueira e Horta Das Figueiras","Alentejo Central",312,"2025-01-27T11:41:00",24877003,"Em conclusão","3315","Inundação de estruturas por precipitação intensa",0,0,0,0,"2025-01-27T11:41:00","Évora","Évora","Alentejo",-7.924277,38.57285
25020622,"Charneca de Caparica e Sobreda","Península de Setúbal",311,"2025-02-28T05:56:00",25020622,"Em conclusão","2407","Despiste",0,2,0,6,"2025-02-28T05:56:00","Almada","Setúbal","Área Metropolitana De Lisboa",-9.194473,38.648295
25020652,"Rio de Mouro","Grande Lisboa",311,"2025-02-28T06:32:00",25020652,"Em conclusão","2301","Incêndio em transporte rodoviário",0,2,0,8,"2025-02-28T06:32:00","Sintra","Lisboa","Área Metropolitana De Lisboa",-9.33482,38.77484
25020753,"Gafanha da Encarnação","Região de Aveiro",310,"2025-02-28T07:28:00",25020753,"Em curso","2407","Despiste",0,3,0,9,"2025-02-28T07:28:00","Ílhavo","Aveiro","Centro",-8.73345,40.617714
25020778,"Sanguedo","Area M. Porto",309,"2025-02-28T07:36:00",25020778,"Em resolução","2127","Incêndio em edifícios e recintos industriais, oficinas e armazéns",0,2,0,7,"2025-02-28T07:36:00","Santa Maria Da Feira","Aveiro","Norte",-8.511128,41.006765
