"id","address","subregion","neighborhood","date","id.1","state","nature","nature_description","aerial_means","terrestrial_means","aquatic_means","operational","date.1","Concelho","Distrito","NUTII_DSG","longitude","latitude"
24851780,"São Miguel, Santa Eufémia e Rabaçal","Região de Coimbra",310,"2025-01-21T23:25:00",24851780,"Em curso","3315","Inundação de estruturas por precipitação intensa",0,0,0,0,"2025-01-21T23:25:00","Penela","Coimbra","Centro",-8.399036,40.025502
24861484,"Arrifana","Area M. Porto",309,"2025-01-23T22:04:00",24861484,"Em conclusão","2403","Colisão rodoviária",0,1,0,2,"2025-01-23T22:04:00","Santa Maria Da Feira","Aveiro","Norte",-8.495162,40.913169
24861820,"Miranda do Corvo","Região de Coimbra",310,"2025-01-24T00:45:00",24861820,"Em curso","4327","Busca e resgate terrestre de pessoas",0,3,0,6,"2025-01-24T00:45:00","Miranda Do Corvo","Coimbra","Centro",-8.339499,40.09407
24861886,"Carcavelos e Parede","Grande Lisboa",311,"2025-01-24T01:44:00",24861886,"Em curso","2101","Incêndio em edifícios habitacionais",0,3,0,7,"2025-01-24T01:44:00","Cascais","Lisboa","Área Metropolitana De Lisboa",-9.36535,38.69397
24861883,"Encarnação","Grande Lisboa",311,"2025-01-24T01:43:00",24861883,"Em curso","2301","Incêndio em transporte rodoviário",0,2,0,10,"2025-01-24T01:43:00","Mafra","Lisboa","Área Metropolitana De Lisboa",-9.422873,39.02392
