"id","address","subregion","neighborhood","date","id.1","state","nature","nature_description","aerial_means","terrestrial_means","aquatic_means","operational","date.1","Concelho","Distrito","NUTII_DSG","longitude","latitude"
24934215,"Adaúfe","Cávado",309,"2025-02-08T23:24:00",24934215,"Em conclusão","2101","Incêndio em edifícios habitacionais",0,2,0,8,"2025-02-08T23:24:00","Braga","Braga","Norte",-8.385802,41.595192
24934265,"Gulpilhares e Valadares","Area M. Porto",309,"2025-02-08T23:40:00",24934265,"Em conclusão","3317","Inundação de estruturas por água canalizada",0,1,0,4,"2025-02-08T23:40:00","Vila Nova De Gaia","Porto","Norte",-8.617158,41.077673
24934363,"Ermesinde","Area M. Porto",309,"2025-02-09T00:28:00",24934363,"Em resolução","2407","Despiste",0,2,0,4,"2025-02-09T00:28:00","Valongo","Porto","Norte",-8.550915,41.204772
24934414,"Aljezur","Algarve",313,"2025-02-09T00:55:00",24934414,"Em curso","2515","Fuga de gás em garrafa",0,0,0,0,"2025-02-09T00:55:00","Aljezur","Faro","Algarve",-8.803144,37.313343
24877003,"Malagueira e Horta Das Figueiras","Alentejo Central",312,"2025-01-27T11:41:00",24877003,"Em conclusão","3315","Inundação de estruturas por precipitação intensa",0,0,0,0,"2025-01-27T11:41:00","Évora","Évora","Alentejo",-7.924277,38.57285
24912072,"Romeira e Várzea","Lezíria do Tejo",311,"2025-02-04T01:22:00",24912072,"Em conclusão","2127","Incêndio em edifícios e recintos industriais, oficinas e armazéns",0,1,0,1,"2025-02-04T01:22:00","Santarém","Santarém","Alentejo",-8.714057,39.254832
24934072,"Oliveira do Conde","Viseu Dão Lafões",310,"2025-02-08T22:25:00",24934072,"Em curso","4327","Busca e resgate terrestre de pessoas",0,3,0,8,"2025-02-08T22:25:00","Carregal Do Sal","Viseu","Centro",-7.929933,40.43778
24934351,"Braga (São José de São Lázaro e São João do Souto)","Cávado",309,"2025-02-09T00:28:00",24934351,"Em despacho","4327","Busca e resgate terrestre de pessoas",0,5,0,12,"2025-02-09T00:28:00","Braga","Braga","Norte",-8.41677,41.53811
24934410,"S.julião, N.s. da Anunciada e S. Maria da Graça","Península de Setúbal",311,"2025-02-09T01:01:00",24934410,"Em curso","2403","Colisão rodoviária",0,3,0,11,"2025-02-09T01:01:00","Setúbal","Setúbal","Área Metropolitana De Lisboa",-8.889983,38.529955
