"id","address","subregion","neighborhood","date","id.1","state","nature","nature_description","aerial_means","terrestrial_means","aquatic_means","operational","date.1","Concelho","Distrito","NUTII_DSG","longitude","latitude"
24979261,"Cidade da Maia","Area M. Porto",309,"2025-02-19T00:14:00",24979261,"Em conclusão","2101","Incêndio em edifícios habitacionais",0,3,0,10,"2025-02-19T00:14:00","Maia","Porto","Norte",-8.60988,41.23066
24979277,"Ramada e Caneças","Grande Lisboa",311,"2025-02-19T00:25:00",24979277,"Em conclusão","3203","Detritos confinados",0,1,0,4,"2025-02-19T00:25:00","Odivelas","Lisboa","Área Metropolitana De Lisboa",-9.22078,38.80455
24877003,"Malagueira e Horta Das Figueiras","Alentejo Central",312,"2025-01-27T11:41:00",24877003,"Em conclusão","3315","Inundação de estruturas por precipitação intensa",0,0,0,0,"2025-01-27T11:41:00","Évora","Évora","Alentejo",-7.924277,38.57285
24888293,"Pernes","Lezíria do Tejo",311,"2025-01-29T16:41:00",24888293,"Em curso","3301","Queda de árvore",0,0,0,0,"2025-01-29T16:41:00","Santarém","Santarém","Alentejo",-8.658865,39.381547
24979400,"Castanheira do Ribatejo e Cachoeiras","Grande Lisboa",311,"2025-02-19T02:10:00",24979400,"Em despacho","2117","Incêndio em edifícios comerciais e gares de transporte",0,1,0,5,"2025-02-19T02:10:00","Vila Franca De Xira","Lisboa","Área Metropolitana De Lisboa",-8.966389,38.987034
24978918,"Carnide","Grande Lisboa",311,"2025-02-18T21:25:00",24978918,"Em despacho","2407","Despiste",0,1,0,2,"2025-02-18T21:25:00","Lisboa","Lisboa","Área Metropolitana De Lisboa",-9.191486,38.757316
24979387,"Nogueira, Fraião e Lamaçães","Cávado",309,"2025-02-19T01:53:00",24979387,"Em despacho","4331","Busca e resgate terrestre de animais",0,1,0,3,"2025-02-19T01:53:00","Braga","Braga","Norte",-8.399912,41.531469
