"id","address","subregion","neighborhood","date","id.1","state","nature","nature_description","aerial_means","terrestrial_means","aquatic_means","operational","date.1","Concelho","Distrito","NUTII_DSG","longitude","latitude"
24620580,"Leiria, Pousos, Barreira e Cortes","Região de Leiria",310,"2024-12-01T08:36:00",24620580,"Em despacho","4331","Busca e resgate terrestre de animais",0,2,0,4,"2024-12-01T08:36:00","Leiria","Leiria","Centro",-8.784899,39.703349
24552947,"Pias","Baixo Alentejo",312,"2024-11-15T20:38:00",24552947,"Em conclusão","2301","Incêndio em transporte rodoviário",0,0,0,0,"2024-11-15T20:38:00","Serpa","Beja","Alentejo",-7.472605,38.015257
24620835,"Paderne","Algarve",313,"2024-12-01T09:44:00",24620835,"Em despacho","4331","Busca e resgate terrestre de animais",0,1,0,2,"2024-12-01T09:44:00","Albufeira","Faro","Algarve",-8.207386,37.177364
24620883,"Azeitão (São Lourenço e São Simão)","Península de Setúbal",311,"2024-12-01T10:05:00",24620883,"Em despacho","2407","Despiste",0,2,0,10,"2024-12-01T10:05:00","Setúbal","Setúbal","Área Metropolitana De Lisboa",-9.04265,38.541479
24620793,"Corroios","Península de Setúbal",311,"2024-12-01T09:51:00",24620793,"Em curso","2403","Colisão rodoviária",0,4,0,9,"2024-12-01T09:51:00","Seixal","Setúbal","Área Metropolitana De Lisboa",-9.1662,38.64123
24620850,"Santo António Dos Olivais","Região de Coimbra",310,"2024-12-01T09:59:00",24620850,"Em despacho","4339","Corte ou remoção de elementos",0,2,0,4,"2024-12-01T09:59:00","Coimbra","Coimbra","Centro",-8.426807,40.217261
