"id","address","subregion","neighborhood","date","id.1","state","nature","nature_description","aerial_means","terrestrial_means","aquatic_means","operational","date.1","Concelho","Distrito","NUTII_DSG","longitude","latitude","state_2"
26402056,"Pontinha e Famões","Grande Lisboa",311,"2025-12-08T02:27:00",26402056,"Em Despacho","3317","Inundação de estruturas por água canalizada",0,1,0,5,"2025-12-08T02:27:00","Odivelas","Lisboa","Área Metropolitana De Lisboa",-9.200151,38.76628,"Despacho"
26402175,"Portel","Alentejo Central",312,"2025-12-08T04:15:00",26402175,"Em resolução/conclusão","2101","Incêndio em edifícios habitacionais",0,3,0,10,"2025-12-08T04:15:00","Portel","Évora","Alentejo",-7.707988,38.30758,"Resolução/Conclusão"
26400722,"Póvoa de Varzim","Area M. Porto",309,"2025-12-07T18:42:00",26400722,"Em resolução/conclusão","2101","Incêndio em edifícios habitacionais",0,1,0,2,"2025-12-07T18:42:00","Póvoa De Varzim","Porto","Norte",-8.751207,41.383,"Resolução/Conclusão"
26402043,"Santo António Dos Olivais","Região de Coimbra",310,"2025-12-08T02:11:00",26402043,"Em resolução/conclusão","2513","Fuga de gás em conduta",0,0,0,0,"2025-12-08T02:11:00","Coimbra","Coimbra","Centro",-8.426807,40.217261,"Resolução/Conclusão"
26402235,"Paio Pires","Península de Setúbal",311,"2025-12-08T05:10:00",26402235,"Em Curso","2127","Incêndio em edifícios e recintos industriais, oficinas e armazéns",0,9,0,26,"2025-12-08T05:10:00","Seixal","Setúbal","Área Metropolitana De Lisboa",-9.071001,38.611318,"Curso"
