id,address,subregion,neighborhood,date,id.1,state,nature,nature_description,aerial_means,terrestrial_means,aquatic_means,operational,date.1,Concelho,Distrito,NUTII_DSG,longitude,latitude
25316776,Guarda,Beiras e Serra da Estrela,310,2025-05-02T07:17:00Z,25316776,Em conclusão,3311,Queda de elementos de estruturas edificados,0,0,0,0,2025-05-02T07:17:00Z,Guarda,Guarda,Centro,-7.269039,40.539292
25326207,Monte Redondo e Carreira,Região de Leiria,310,2025-05-04T09:15:00Z,25326207,Em resolução,3315,Inundação de estruturas por precipitação intensa,0,2,0,4,2025-05-04T09:15:00Z,Leiria,Leiria,Centro,-8.837307,39.893268
25326807,Queluz e Belas,Grande Lisboa,311,2025-05-04T11:35:00Z,25326807,Em despacho,3315,Inundação de estruturas por precipitação intensa,0,1,0,3,2025-05-04T11:35:00Z,Sintra,Lisboa,Área Metropolitana De Lisboa,-9.264678,38.74824
25326889,Venteira,Grande Lisboa,311,2025-05-04T11:20:00Z,25326889,Em conclusão,3301,Queda de árvore,0,1,0,6,2025-05-04T11:20:00Z,Amadora,Lisboa,Área Metropolitana De Lisboa,-9.240965,38.755077
25326760,Mafamude e Vilar do Paraíso,Area M. Porto,309,2025-05-04T11:21:00Z,25326760,Em despacho,3315,Inundação de estruturas por precipitação intensa,0,1,0,4,2025-05-04T11:21:00Z,Vila Nova De Gaia,Porto,Norte,-8.611105,41.107184
25326844,Apúlia e Fão,Cávado,309,2025-05-04T11:40:00Z,25326844,Em despacho,3315,Inundação de estruturas por precipitação intensa,0,1,0,3,2025-05-04T11:40:00Z,Esposende,Braga,Norte,-8.764428,41.484909
25326912,"Santa Maria da Feira, Travanca, Sanfins e Espargo",Area M. Porto,309,2025-05-04T11:51:00Z,25326912,Em despacho,3301,Queda de árvore,0,1,0,3,2025-05-04T11:51:00Z,Santa Maria Da Feira,Aveiro,Norte,-8.555837,40.9255
25071496,São Manços e São Vicente do Pigeiro,Alentejo Central,312,2025-03-11T13:18:00Z,25071496,Em conclusão,1101,Cheia,0,0,0,0,2025-03-11T13:18:00Z,Évora,Évora,Alentejo,-7.713313,38.513673
25318424,Nossa Senhora da Graça Dos Degolados,Alto Alentejo,312,2025-05-02T13:10:00Z,25318424,Em conclusão,1103,Vento forte,0,0,0,0,2025-05-02T13:10:00Z,Campo Maior,Portalegre,Alentejo,-7.12147,39.062622
25326344,"Ovar, São João, Arada e São Vicente de Pereira Jusã",Região de Aveiro,310,2025-05-04T09:44:00Z,25326344,Em despacho,3315,Inundação de estruturas por precipitação intensa,0,1,0,3,2025-05-04T09:44:00Z,Ovar,Aveiro,Centro,-8.632482,40.864029
