id,address,subregion,neighborhood,date,id.1,state,nature,nature_description,aerial_means,terrestrial_means,aquatic_means,operational,date.1,Concelho,Distrito,NUTII_DSG,longitude,latitude
25522282,Salvaterra de Magos e Foros de Salvaterra,Lezíria do Tejo,311,2025-06-13T22:38:00Z,25522282,Em conclusão,2111,Incêndio em edifícios hospitalares e lares de idosos,0,1,0,1,2025-06-13T22:38:00Z,Salvaterra De Magos,Santarém,Alentejo,-8.746905,39.024535
25522903,Melides,Alentejo Litoral,312,2025-06-14T04:50:00Z,25522903,Em resolução,3103,Incêndio rural,0,2,0,7,2025-06-14T04:50:00Z,Grândola,Setúbal,Alentejo,-8.726303,38.148035
25522508,São Miguel do Souto e Mosteirô,Area M. Porto,309,2025-06-14T00:02:00Z,25522508,Em conclusão,2127,"Incêndio em edifícios e recintos industriais, oficinas e armazéns",0,1,0,5,2025-06-14T00:02:00Z,Santa Maria Da Feira,Aveiro,Norte,-8.55046,40.89128
25522921,"Aldoar, Foz do Douro e Nevogilde",Area M. Porto,309,2025-06-14T05:21:00Z,25522921,Em despacho,3201,Detritos não confinados,0,1,0,5,2025-06-14T05:21:00Z,Porto,Porto,Norte,-8.67782,41.15524
25522932,Loures,Grande Lisboa,311,2025-06-14T05:41:00Z,25522932,Em despacho,2101,Incêndio em edifícios habitacionais,0,3,0,10,2025-06-14T05:41:00Z,Loures,Lisboa,Área Metropolitana De Lisboa,-9.20122,38.81733
25522939,"Seixal, Arrentela e Aldeia de Paio Pires",Península de Setúbal,311,2025-06-14T05:48:00Z,25522939,Em despacho,3103,Incêndio rural,0,2,0,10,2025-06-14T05:48:00Z,Seixal,Setúbal,Área Metropolitana De Lisboa,-9.097423,38.61361
