id,address,subregion,neighborhood,date,id.1,state,nature,nature_description,aerial_means,terrestrial_means,aquatic_means,operational,date.1,Concelho,Distrito,NUTII_DSG,longitude,latitude
25321942,Alcobaça e Vestiaria,Oeste,311,2025-05-03T08:46:00Z,25321942,Em despacho,3301,Queda de árvore,0,0,0,0,2025-05-03T08:46:00Z,Alcobaça,Leiria,Centro,-8.991927,39.567803
25071496,São Manços e São Vicente do Pigeiro,Alentejo Central,312,2025-03-11T13:18:00Z,25071496,Em conclusão,1101,Cheia,0,0,0,0,2025-03-11T13:18:00Z,Évora,Évora,Alentejo,-7.713313,38.513673
25318424,Nossa Senhora da Graça Dos Degolados,Alto Alentejo,312,2025-05-02T13:10:00Z,25318424,Em conclusão,1103,Vento forte,0,0,0,0,2025-05-02T13:10:00Z,Campo Maior,Portalegre,Alentejo,-7.12147,39.062622
25321932,Moita,Península de Setúbal,311,2025-05-03T08:36:00Z,25321932,Em despacho,3321,Dano na rede de fornecimento de eletricidade ,0,1,0,4,2025-05-03T08:36:00Z,Moita,Setúbal,Área Metropolitana De Lisboa,-8.985364,38.643702
25316776,Guarda,Beiras e Serra da Estrela,310,2025-05-02T07:17:00Z,25316776,Em conclusão,3311,Queda de elementos de estruturas edificados,0,9,0,18,2025-05-02T07:17:00Z,Guarda,Guarda,Centro,-7.269039,40.539292
25321888,Sesimbra (Castelo),Península de Setúbal,311,2025-05-03T08:32:00Z,25321888,Em despacho,3315,Inundação de estruturas por precipitação intensa,0,1,0,4,2025-05-03T08:32:00Z,Sesimbra,Setúbal,Área Metropolitana De Lisboa,-9.06487,38.48575
