id,address,subregion,neighborhood,date,id.1,state,nature,nature_description,aerial_means,terrestrial_means,aquatic_means,operational,date.1,Concelho,Distrito,NUTII_DSG,longitude,latitude
25068300,Almeirim,Lezíria do Tejo,311,2025-03-10T20:52:00Z,25068300,Em curso,1101,Cheia,0,0,0,0,2025-03-10T20:52:00Z,Almeirim,Santarém,Alentejo,-8.635002,39.187436
25253103,"Fundão, Valverde, Donas, Aldeia de Joanes e Aldeia Nova do Cabo",Beiras e Serra da Estrela,310,2025-04-17T16:10:00Z,25253103,Em despacho,3329,Queda de estruturas temporárias ou móveis,0,1,0,4,2025-04-17T16:10:00Z,Fundão,Castelo Branco,Centro,-7.500903,40.136375
25070044,Praia do Ribatejo,Médio Tejo,311,2025-03-10T19:30:00Z,25070044,Em curso,1101,Cheia,0,0,0,0,2025-03-10T19:30:00Z,Vila Nova Da Barquinha,Santarém,Centro,-8.357309,39.485638
25071496,São Manços e São Vicente do Pigeiro,Alentejo Central,312,2025-03-11T13:18:00Z,25071496,Em conclusão,1101,Cheia,0,0,0,0,2025-03-11T13:18:00Z,Évora,Évora,Alentejo,-7.713313,38.513673
25202441,Serpa (Salvador e Santa Maria),Baixo Alentejo,312,2025-04-06T10:25:00Z,25202441,Em conclusão,1101,Cheia,0,0,0,0,2025-04-06T10:25:00Z,Serpa,Beja,Alentejo,-7.555783,37.88592
25253023,Santo António Dos Olivais,Região de Coimbra,310,2025-04-17T16:01:00Z,25253023,Em despacho,3329,Queda de estruturas temporárias ou móveis,0,1,0,2,2025-04-17T16:01:00Z,Coimbra,Coimbra,Centro,-8.426807,40.217261
