id,address,subregion,neighborhood,date,id.1,state,nature,nature_description,aerial_means,terrestrial_means,aquatic_means,operational,date.1,Concelho,Distrito,NUTII_DSG,longitude,latitude
25497469,"Sé Nova, Santa Cruz, Almedina e São Bartolomeu",Região de Coimbra,310,2025-06-08T20:47:00Z,25497469,Em despacho,2201,Incêndio em equipamentos ou produtos,0,0,0,0,2025-06-08T20:47:00Z,Coimbra,Coimbra,Centro,-8.425582,40.205556
25496975,Sendim,Tâmega e Sousa,309,2025-06-08T18:32:00Z,25496975,Em conclusão,3103,Incêndio rural,0,1,0,5,2025-06-08T18:32:00Z,Felgueiras,Porto,Norte,-8.191015,41.392435
25497236,Alcabideche,Grande Lisboa,311,2025-06-08T19:42:00Z,25497236,Em resolução,3203,Detritos confinados,0,1,0,5,2025-06-08T19:42:00Z,Cascais,Lisboa,Área Metropolitana De Lisboa,-9.399427,38.741735
25497427,Albufeira e Olhos de Água,Algarve,313,2025-06-08T20:23:00Z,25497427,Em curso,3203,Detritos confinados,0,1,0,2,2025-06-08T20:23:00Z,Albufeira,Faro,Algarve,-8.24556,37.102546
25495190,Peva e Segões,Douro,309,2025-06-08T11:17:00Z,25495190,Em conclusão,2127,"Incêndio em edifícios e recintos industriais, oficinas e armazéns",0,4,0,13,2025-06-08T11:17:00Z,Moimenta Da Beira,Viseu,Norte,-7.69063,40.890053
25497363,São Martinho do Bispo e Ribeira de Frades,Região de Coimbra,310,2025-06-08T20:15:00Z,25497363,Em conclusão,3201,Detritos não confinados,0,3,0,12,2025-06-08T20:15:00Z,Coimbra,Coimbra,Centro,-8.454962,40.20908
25497400,Pontinha e Famões,Grande Lisboa,311,2025-06-08T20:24:00Z,25497400,Em despacho,2201,Incêndio em equipamentos ou produtos,0,1,0,5,2025-06-08T20:24:00Z,Odivelas,Lisboa,Área Metropolitana De Lisboa,-9.206555,38.786187
