id,address,subregion,neighborhood,date,id.1,state,nature,nature_description,aerial_means,terrestrial_means,aquatic_means,operational,date.1,Concelho,Distrito,NUTII_DSG,longitude,latitude
25533960,Nossa Senhora da Tourega e Nossa Senhora de Guadalupe,Alentejo Central,312,2025-06-16T14:13:00Z,25533960,Em conclusão,3101,Incêndio rural,0,7,0,15,2025-06-16T14:13:00Z,Évora,Évora,Alentejo,-8.04123,38.527212
25536625,Quinta do Anjo,Península de Setúbal,311,2025-06-17T02:21:00Z,25536625,Em conclusão,3103,Incêndio rural,0,5,0,20,2025-06-17T02:21:00Z,Palmela,Setúbal,Área Metropolitana De Lisboa,-8.964877,38.594398
25536659,Algueirão-Mem Martins,Grande Lisboa,311,2025-06-17T03:00:00Z,25536659,Em curso,2201,Incêndio em equipamentos ou produtos,0,2,0,7,2025-06-17T03:00:00Z,Sintra,Lisboa,Área Metropolitana De Lisboa,-9.35048,38.78905
25536462,"Enxara do Bispo, Gradil e Vila Franca do Rosário",Grande Lisboa,311,2025-06-17T00:24:00Z,25536462,Em conclusão,2301,Incêndio em transporte rodoviário,0,0,0,0,2025-06-17T00:24:00Z,Mafra,Lisboa,Área Metropolitana De Lisboa,-9.215631,38.984085
25536682,Bonfim,Area M. Porto,309,2025-06-17T03:20:00Z,25536682,Em despacho,3201,Detritos não confinados,0,0,0,0,2025-06-17T03:20:00Z,Porto,Porto,Norte,-8.59771,41.14867
25534277,Caldas de São Jorge e Pigeiros,Area M. Porto,309,2025-06-16T15:11:00Z,25534277,Em conclusão,3101,Incêndio rural,0,1,0,5,2025-06-16T15:11:00Z,Santa Maria Da Feira,Aveiro,Norte,-8.486413,40.939453
25534804,Alvares,Região de Coimbra,310,2025-06-16T17:00:00Z,25534804,Em conclusão,3101,Incêndio rural,0,1,0,2,2025-06-16T17:00:00Z,Góis,Coimbra,Centro,-8.08667,40.05333
25535747,Alvares,Região de Coimbra,310,2025-06-16T20:38:00Z,25535747,Em conclusão,3103,Incêndio rural,0,2,0,5,2025-06-16T20:38:00Z,Góis,Coimbra,Centro,-8.07249,40.03204
25533546,Capelins (Santo António),Alentejo Central,312,2025-06-16T12:49:00Z,25533546,Em conclusão,3103,Incêndio rural,0,29,0,84,2025-06-16T12:49:00Z,Alandroal,Évora,Alentejo,-7.336945,38.553132
25536504,Mafamude e Vilar do Paraíso,Area M. Porto,309,2025-06-17T01:01:00Z,25536504,Em conclusão,2127,"Incêndio em edifícios e recintos industriais, oficinas e armazéns",0,12,0,32,2025-06-17T01:01:00Z,Vila Nova De Gaia,Porto,Norte,-8.61531,41.10721
