id,address,subregion,neighborhood,date,id.1,state,nature,nature_description,aerial_means,terrestrial_means,aquatic_means,operational,date.1,Concelho,Distrito,NUTII_DSG,longitude,latitude
25308127,Covilhã e Canhoso,Beiras e Serra da Estrela,310,2025-04-30T08:22:00Z,25308127,Em despacho,3317,Inundação de estruturas por água canalizada,0,1,0,2,2025-04-30T08:22:00Z,Covilhã,Castelo Branco,Centro,-7.519359,40.276354
25071496,São Manços e São Vicente do Pigeiro,Alentejo Central,312,2025-03-11T13:18:00Z,25071496,Em conclusão,1101,Cheia,0,0,0,0,2025-03-11T13:18:00Z,Évora,Évora,Alentejo,-7.713313,38.513673
25308014,"Cedofeita, Ildefonso, Sé, Miragaia, Nicolau e Vitória",Area M. Porto,309,2025-04-30T07:52:00Z,25308014,Em despacho,3315,Inundação de estruturas por precipitação intensa,0,1,0,5,2025-04-30T07:52:00Z,Porto,Porto,Norte,-8.615939,41.15359
25308363,"Gondomar (São Cosme), Valbom e Jovim",Area M. Porto,309,2025-04-30T09:14:00Z,25308363,Em despacho,3301,Queda de árvore,0,1,0,2,2025-04-30T09:14:00Z,Gondomar,Porto,Norte,-8.535295,41.129255
25308514,Torreira,Região de Aveiro,310,2025-04-30T09:34:00Z,25308514,Em despacho,3315,Inundação de estruturas por precipitação intensa,0,1,0,2,2025-04-30T09:34:00Z,Murtosa,Aveiro,Centro,-8.699212,40.761066
25308438,Póvoa de Lanhoso (Nossa Senhora do Amparo),Ave,309,2025-04-30T09:22:00Z,25308438,Em despacho,3317,Inundação de estruturas por água canalizada,0,1,0,2,2025-04-30T09:22:00Z,Póvoa De Lanhoso,Braga,Norte,-8.26784,41.577971
