attributes.ID_oc,attributes.Numero,attributes.CodEstadoOcorrencia,attributes.EstadoOcorrencia,attributes.EstadoAgrupado,attributes.DataInicioOcorrencia,attributes.DataOcorrencia,attributes.Data,attributes.Hora,attributes.Ano,attributes.Duracao,attributes.DuracaoMinutos,attributes.FaseIncendio,attributes.CodNatureza,attributes.Natureza,attributes.Regiao,attributes.SubRegiao,attributes.Concelho,attributes.Freguesia,attributes.Localidade,attributes.Endereco,attributes.OperacionaisTerrestres,attributes.OPAereos,attributes.Operacionais,attributes.MeiosTerrestres,attributes.MeiosAereos,attributes.QuantEntidades,attributes.Latitude,attributes.Longitude,attributes.DDD,attributes.DDM,attributes.DMS,attributes.DataDosDados,attributes.Simbol,attributes.RASI,attributes.ID,geometry.x,geometry.y,id,address,subregion,date,date.1,state,nature,aerial_means,terrestrial_means,operational,state_2,Concelho,Distrito,NUTII_DSG,longitude,latitude,nature_description
43618013,20260190881,5,Chegada ao TO,Em Despacho,05/02/2026 10:00,1770285600000,2026-02-05,10:00,2026,117/08:02,168962,---,3313,3313 - Movimento de massa,Centro,Beira Baixa,Sertã,Pedrógão Pequeno,PEDROGÃO PEQUENO,EN 2 - Pedrogão Pequeno,2,0,2,1,0,1,39.913035,-8.132459,39.913035°N 8.132459°W,"39°54,7800'N 8°7,9500'W ","39° 54' 46,80'' N 8° 7' 57,00'' W ",1780423320000,33 - Em Curso,Intervenções em Infraestruturas e vias de comunicação,26712881,-8.132459,39.913035,20260190881,PEDROGÃO PEQUENO,Centro,2026-02-05T10:00:00Z,2026-02-05,Chegada Ao to,3313,0,1,2,Chegada Ao to,Sertã,Castelo Branco,Centro,-8.132459,39.913035,Movimento de massa
43618014,20260231505,5,Despacho de 1º Alerta,Em Despacho,11/02/2026 11:00,1770807600000,2026-02-11,11:00,2026,111/07:02,160262,---,3313,3313 - Movimento de massa,Centro,Beira Baixa,Vila Velha de Ródão,Sarnadas de Ródão,Sarnadas de Rodão,Linha da Beira Baixa PK 67.700,2,0,2,1,0,1,39.748197,-7.622069,39.748197°N 7.622069°W,"39°44,8920'N 7°37,3260'W ","39° 44' 53,52'' N 7° 37' 19,56'' W ",1780423320000,33 - Em Despacho,Intervenções em Infraestruturas e vias de comunicação,26753513,-7.622069,39.748197,20260231505,Sarnadas de Rodão,Centro,2026-02-11T11:00:00Z,2026-02-11,Despacho De 1º Alerta,3313,0,1,2,Despacho De 1º Alerta,Vila Velha De Ródão,Castelo Branco,Centro,-7.622069,39.748197,Movimento de massa
43618053,20260771374,5,Despacho de 1º Alerta,Em Despacho,02/06/2026 15:18,1780409880000,2026-06-02,15:18,2026,0/02:44,164,---,3301,3301 - Queda de Árvore,Norte,Area M. Porto,Santo Tirso,"St.tirso, Couto (S.cristina e S.miguel) e Burgães",Santo Tirso,Alameda da Ponte,2,0,2,1,0,1,41.348144,-8.473671,41.348144°N 8.473671°W,"41°20,8860'N 8°28,4220'W ","41° 20' 53,16'' N 8° 28' 25,32'' W ",1780423320000,33 - Em Despacho,Intervenções em Infraestruturas e vias de comunicação,27293395,-8.473671,41.348144,20260771374,Santo Tirso,Norte,2026-06-02T14:18:00Z,2026-06-02,Despacho De 1º Alerta,3301,0,1,2,Despacho De 1º Alerta,Santo Tirso,Porto,Norte,-8.473671,41.348144,Queda de Árvore
43618072,20260771888,5,Despacho de 1º Alerta,Em Despacho,02/06/2026 17:11,1780416660000,2026-06-02,17:11,2026,0/00:51,51,---,3311,3311 - Queda de elementos de construção em estruturas edificadas,Norte,Area M. Porto,Porto,Lordelo do Ouro e Massarelos,LORDELO DO OURO,Rua Professor Augusto Nobre,5,0,5,1,0,1,41.152985,-8.652543,41.152985°N 8.652543°W,"41°9,1800'N 8°39,1500'W ","41° 9' 10,80'' N 8° 39' 9,00'' W ",1780423320000,33 - Em Despacho,Intervenções em Infraestruturas e vias de comunicação,27293909,-8.652543,41.152985,20260771888,LORDELO DO OURO,Norte,2026-06-02T16:11:00Z,2026-06-02,Despacho De 1º Alerta,3311,0,1,5,Despacho De 1º Alerta,Porto,Porto,Norte,-8.652543,41.152985,Queda de elementos de construção em estruturas edificadas
43618081,20260772006,6,Em Curso,Em Curso,02/06/2026 17:35,1780418100000,2026-06-02,17:35,2026,0/00:27,27,---,3311,3311 - Queda de elementos de construção em estruturas edificadas,Lisboa e Vale do Tejo,Península de Setúbal,Moita,Alhos Vedros,ALHOS VEDROS,R. parque dos Pinheiros Nº8 1ºFrt,6,0,6,2,0,2,38.657804,-9.026889,38.657804°N 9.026889°W,"38°39,4680'N 9°1,6140'W ","38° 39' 28,08'' N 9° 1' 36,84'' W ",1780423320000,33 - Em Curso,Intervenções em Infraestruturas e vias de comunicação,27294027,-9.026889,38.657804,20260772006,ALHOS VEDROS,Lisboa e Vale do Tejo,2026-06-02T16:35:00Z,2026-06-02,Em Curso,3311,0,2,6,Curso,Moita,Setúbal,Área Metropolitana De Lisboa,-9.026889,38.657804,Queda de elementos de construção em estruturas edificadas
