id,address,subregion,neighborhood,date,id.1,state,nature,nature_description,aerial_means,terrestrial_means,aquatic_means,operational,date.1,Concelho,Distrito,NUTII_DSG,longitude,latitude
24775543,Alhos Vedros,Península de Setúbal,311,2025-01-05T07:26:00Z,24775543,Em despacho,3315,Inundação de estruturas por precipitação intensa,0,1,0,4,2025-01-05T07:26:00Z,Moita,Setúbal,Área Metropolitana De Lisboa,-9.01932,38.65533
24775578,Areias e Pias,Médio Tejo,311,2025-01-05T07:41:00Z,24775578,Em conclusão,3301,Queda de árvore,0,2,0,5,2025-01-05T07:41:00Z,Ferreira Do Zêzere,Santarém,Centro,-8.316191,39.711343
24775627,Malveira e São Miguel de Alcainça,Grande Lisboa,311,2025-01-05T07:52:00Z,24775627,Em curso,3301,Queda de árvore,0,2,0,5,2025-01-05T07:52:00Z,Mafra,Lisboa,Área Metropolitana De Lisboa,-9.255135,38.927865
24775661,"Esqueiros, Nevogilde e Travassós",Cávado,309,2025-01-05T08:08:00Z,24775661,Em despacho,3329,Queda de estruturas temporárias ou móveis,0,0,0,0,2025-01-05T08:08:00Z,Vila Verde,Braga,Norte,-8.460355,41.663657
24775663,Cartaxo e Vale da Pinta,Lezíria do Tejo,311,2025-01-05T08:13:00Z,24775663,Em despacho,3321,Dano na rede de fornecimento de eletricidade ,0,2,0,7,2025-01-05T08:13:00Z,Cartaxo,Santarém,Alentejo,-8.794948,39.166481
24775604,Agualva e Mira-Sintra,Grande Lisboa,311,2025-01-05T07:51:00Z,24775604,Em curso,3301,Queda de árvore,0,1,0,4,2025-01-05T07:51:00Z,Sintra,Lisboa,Área Metropolitana De Lisboa,-9.294104,38.769933
24775614,São Martinho do Bispo e Ribeira de Frades,Região de Coimbra,310,2025-01-05T07:53:00Z,24775614,Em despacho,3321,Dano na rede de fornecimento de eletricidade ,0,2,0,5,2025-01-05T07:53:00Z,Coimbra,Coimbra,Centro,-8.468894,40.19112
24775623,Setúbal (São Sebastião),Península de Setúbal,311,2025-01-05T08:01:00Z,24775623,Em despacho,3321,Dano na rede de fornecimento de eletricidade ,0,0,0,0,2025-01-05T08:01:00Z,Setúbal,Setúbal,Área Metropolitana De Lisboa,-8.85635,38.51176
