id,address,subregion,neighborhood,date,id.1,state,nature,nature_description,aerial_means,terrestrial_means,aquatic_means,operational,date.1,Concelho,Distrito,NUTII_DSG,longitude,latitude
24865929,Ramada e Caneças,Grande Lisboa,311,2025-01-24T21:15:00Z,24865929,Em despacho,3321,Dano na rede de fornecimento de eletricidade ,0,1,0,4,2025-01-24T21:15:00Z,Odivelas,Lisboa,Área Metropolitana De Lisboa,-9.224517,38.811058
24851780,"São Miguel, Santa Eufémia e Rabaçal",Região de Coimbra,310,2025-01-21T23:25:00Z,24851780,Em curso,3315,Inundação de estruturas por precipitação intensa,0,0,0,0,2025-01-21T23:25:00Z,Penela,Coimbra,Centro,-8.399036,40.025502
24866086,Calvelo,Alto Minho,309,2025-01-24T22:19:00Z,24866086,Em despacho,3301,Queda de árvore,0,0,0,0,2025-01-24T22:19:00Z,Ponte De Lima,Viana Do Castelo,Norte,-8.54961,41.678076
24864975,"Marvila, Ribeira Santarém, S.salvador, S.nicolau",Lezíria do Tejo,311,2025-01-24T17:14:00Z,24864975,Em despacho,3313,Deslizamento de terras,0,1,0,1,2025-01-24T17:14:00Z,Santarém,Santarém,Alentejo,-8.678591,39.231938
24865676,Santo António Dos Olivais,Região de Coimbra,310,2025-01-24T20:07:00Z,24865676,Em despacho,3315,Inundação de estruturas por precipitação intensa,0,2,0,6,2025-01-24T20:07:00Z,Coimbra,Coimbra,Centro,-8.426807,40.217261
