id,address,subregion,neighborhood,date,id.1,state,nature,nature_description,aerial_means,terrestrial_means,aquatic_means,operational,date.1,Concelho,Distrito,NUTII_DSG,longitude,latitude
25476644,Palmela,Península de Setúbal,311,2025-06-04T15:12:00Z,25476644,Em conclusão,3105,Incêndio rural,0,0,0,0,2025-06-04T15:12:00Z,Palmela,Setúbal,Área Metropolitana De Lisboa,-8.824663,38.595798
25477352,Cidade da Maia,Area M. Porto,309,2025-06-04T17:46:00Z,25477352,Em conclusão,2117,Incêndio em edifícios comerciais e gares de transporte,0,5,0,17,2025-06-04T17:46:00Z,Maia,Porto,Norte,-8.604123,41.219248
25477637,"Custóias, Leça do Balio e Guifões",Area M. Porto,309,2025-06-04T18:50:00Z,25477637,Em conclusão,2101,Incêndio em edifícios habitacionais,0,0,0,0,2025-06-04T18:50:00Z,Matosinhos,Porto,Norte,-8.63616,41.18981
25477374,Massamá e Monte Abraão,Grande Lisboa,311,2025-06-04T17:40:00Z,25477374,Em conclusão,3103,Incêndio rural,0,2,0,7,2025-06-04T17:40:00Z,Sintra,Lisboa,Área Metropolitana De Lisboa,-9.27045,38.75541
25477399,Setúbal (São Sebastião),Península de Setúbal,311,2025-06-04T17:57:00Z,25477399,Em conclusão,3103,Incêndio rural,0,4,0,18,2025-06-04T17:57:00Z,Setúbal,Setúbal,Área Metropolitana De Lisboa,-8.848585,38.559813
25477728,Chancelaria,Alto Alentejo,312,2025-06-04T19:05:00Z,25477728,Em despacho,2101,Incêndio em edifícios habitacionais,0,4,0,11,2025-06-04T19:05:00Z,Alter Do Chão,Portalegre,Alentejo,-7.818007,39.24811
