id,address,subregion,neighborhood,date,id.1,state,nature,nature_description,aerial_means,terrestrial_means,aquatic_means,operational,date.1,Concelho,Distrito,NUTII_DSG,longitude,latitude
25522967,Pinhal Novo,Península de Setúbal,311,2025-06-14T05:57:00Z,25522967,Em resolução,2201,Incêndio em equipamentos ou produtos,0,1,0,2,2025-06-14T05:57:00Z,Palmela,Setúbal,Área Metropolitana De Lisboa,-8.91294,38.637902
25523788,"Algés, Linda-a-Velha e Cruz Quebrada-Dafundo",Grande Lisboa,311,2025-06-14T10:13:00Z,25523788,Em despacho,2101,Incêndio em edifícios habitacionais,0,0,0,0,2025-06-14T10:13:00Z,Oeiras,Lisboa,Área Metropolitana De Lisboa,-9.23123,38.70961
25523789,Rebordelo,Terras de Trás-os-Montes,309,2025-06-14T10:13:00Z,25523789,Em despacho,3107,Consolidação de rescaldo de incêndio rural,0,3,0,8,2025-06-14T10:13:00Z,Vinhais,Bragança,Norte,-7.164225,41.742539
25523157,São Miguel do Souto e Mosteirô,Area M. Porto,309,2025-06-14T08:01:00Z,25523157,Em conclusão,2127,"Incêndio em edifícios e recintos industriais, oficinas e armazéns",0,3,0,9,2025-06-14T08:01:00Z,Santa Maria Da Feira,Aveiro,Norte,-8.550099,40.8903
25523159,Macieira de Cambra,Area M. Porto,309,2025-06-14T07:54:00Z,25523159,Em curso,3107,Consolidação de rescaldo de incêndio rural,0,2,0,6,2025-06-14T07:54:00Z,Vale De Cambra,Aveiro,Norte,-8.367205,40.870286
25523663,Cedrim e Paradela,Região de Aveiro,310,2025-06-14T09:41:00Z,25523663,Em conclusão,2101,Incêndio em edifícios habitacionais,0,2,0,7,2025-06-14T09:41:00Z,Sever Do Vouga,Aveiro,Centro,-8.35439,40.701913
