id,address,subregion,neighborhood,date,id.1,state,nature,nature_description,aerial_means,terrestrial_means,aquatic_means,operational,date.1,Concelho,Distrito,NUTII_DSG,longitude,latitude
25476884,São João de Ver,Area M. Porto,309,2025-06-04T15:58:00Z,25476884,Em conclusão,2129,Incêndio em edifícios degradados ou devolutos,0,5,0,11,2025-06-04T15:58:00Z,Santa Maria Da Feira,Aveiro,Norte,-8.549167,40.95385
25477352,Cidade da Maia,Area M. Porto,309,2025-06-04T17:46:00Z,25477352,Em conclusão,2117,Incêndio em edifícios comerciais e gares de transporte,0,2,0,8,2025-06-04T17:46:00Z,Maia,Porto,Norte,-8.605833,41.21695
25466369,Melides,Alentejo Litoral,312,2025-06-02T13:27:00Z,25466369,Em conclusão,3103,Incêndio rural,0,1,0,2,2025-06-02T13:27:00Z,Grândola,Setúbal,Alentejo,-8.754243,38.19534
25476477,"Coz, Alpedriz e Montes",Oeste,311,2025-06-04T14:42:00Z,25476477,Em conclusão,3103,Incêndio rural,0,0,0,0,2025-06-04T14:42:00Z,Alcobaça,Leiria,Centro,-8.934833,39.593113
25476797,Mezio e Moura Morta,Viseu Dão Lafões,310,2025-06-04T15:38:00Z,25476797,Em conclusão,3103,Incêndio rural,0,1,0,5,2025-06-04T15:38:00Z,Castro Daire,Viseu,Centro,-7.859535,40.982073
25477374,Massamá e Monte Abraão,Grande Lisboa,311,2025-06-04T17:40:00Z,25477374,Em conclusão,3103,Incêndio rural,0,2,0,7,2025-06-04T17:40:00Z,Sintra,Lisboa,Área Metropolitana De Lisboa,-9.27045,38.75541
25476741,Caparica e Trafaria,Península de Setúbal,311,2025-06-04T15:28:00Z,25476741,Em conclusão,2101,Incêndio em edifícios habitacionais,0,2,0,7,2025-06-04T15:28:00Z,Almada,Setúbal,Área Metropolitana De Lisboa,-9.1884,38.67258
25476644,Palmela,Península de Setúbal,311,2025-06-04T15:12:00Z,25476644,Em conclusão,3105,Incêndio rural,0,0,0,0,2025-06-04T15:12:00Z,Palmela,Setúbal,Área Metropolitana De Lisboa,-8.824663,38.595798
25477139,Charneca de Caparica e Sobreda,Península de Setúbal,311,2025-06-04T16:55:00Z,25477139,Em despacho,2201,Incêndio em equipamentos ou produtos,0,2,0,6,2025-06-04T16:55:00Z,Almada,Setúbal,Área Metropolitana De Lisboa,-9.190193,38.591584
25477330,Lordelo do Ouro e Massarelos,Area M. Porto,309,2025-06-04T17:37:00Z,25477330,Em despacho,3201,Detritos não confinados,0,1,0,5,2025-06-04T17:37:00Z,Porto,Porto,Norte,-8.644953,41.152973
25477446,"Seixal, Arrentela e Aldeia de Paio Pires",Península de Setúbal,311,2025-06-04T18:04:00Z,25477446,Em conclusão,2201,Incêndio em equipamentos ou produtos,0,1,0,4,2025-06-04T18:04:00Z,Seixal,Setúbal,Área Metropolitana De Lisboa,-9.094891,38.61109
25477399,Setúbal (São Sebastião),Península de Setúbal,311,2025-06-04T17:57:00Z,25477399,Em conclusão,3103,Incêndio rural,0,6,0,24,2025-06-04T17:57:00Z,Setúbal,Setúbal,Área Metropolitana De Lisboa,-8.848537,38.55982
