attributes.ID_oc,attributes.Numero,attributes.CodEstadoOcorrencia,attributes.EstadoOcorrencia,attributes.EstadoAgrupado,attributes.DataInicioOcorrencia,attributes.DataOcorrencia,attributes.Data,attributes.Hora,attributes.Ano,attributes.Duracao,attributes.DuracaoMinutos,attributes.FaseIncendio,attributes.CodNatureza,attributes.Natureza,attributes.Regiao,attributes.SubRegiao,attributes.Concelho,attributes.Freguesia,attributes.Localidade,attributes.Endereco,attributes.OperacionaisTerrestres,attributes.OPAereos,attributes.Operacionais,attributes.MeiosTerrestres,attributes.MeiosAereos,attributes.QuantEntidades,attributes.Latitude,attributes.Longitude,attributes.DDD,attributes.DDM,attributes.DMS,attributes.DataDosDados,attributes.Simbol,attributes.RASI,attributes.ID,geometry.x,geometry.y,id,address,subregion,date,date.1,state,nature,aerial_means,terrestrial_means,operational,state_2,Concelho,Distrito,NUTII_DSG,longitude,latitude,nature_description
45197461,20260190881,5,Chegada ao TO,Em Despacho,05/02/2026 10:00,1770285600000,2026-02-05,10:00,2026,149/11:12,215232,---,3313,3313 - Movimento de massa,Centro,Beira Baixa,Sertã,Pedrógão Pequeno,PEDROGÃO PEQUENO,EN 2 - Pedrogão Pequeno,2,0,2,1,0,1,39.913035,-8.132459,39.913035°N 8.132459°W,"39°54,7800'N 8°7,9500'W ","39° 54' 46,80'' N 8° 7' 57,00'' W ",1783199520000,33 - Em Curso,Intervenções em Infraestruturas e vias de comunicação,26712881,-8.132459,39.913035,20260190881,PEDROGÃO PEQUENO,Centro,2026-02-05T10:00:00Z,2026-02-05,Chegada Ao to,3313,0,1,2,Chegada Ao to,Sertã,Castelo Branco,Centro,-8.132459,39.913035,Movimento de massa
45197462,20260231505,5,Despacho de 1º Alerta,Em Despacho,11/02/2026 11:00,1770807600000,2026-02-11,11:00,2026,143/10:12,206532,---,3313,3313 - Movimento de massa,Centro,Beira Baixa,Vila Velha de Ródão,Sarnadas de Ródão,Sarnadas de Rodão,Linha da Beira Baixa PK 67.700,2,0,2,1,0,1,39.748197,-7.622069,39.748197°N 7.622069°W,"39°44,8920'N 7°37,3260'W ","39° 44' 53,52'' N 7° 37' 19,56'' W ",1783199520000,33 - Em Despacho,Intervenções em Infraestruturas e vias de comunicação,26753513,-7.622069,39.748197,20260231505,Sarnadas de Rodão,Centro,2026-02-11T11:00:00Z,2026-02-11,Despacho De 1º Alerta,3313,0,1,2,Despacho De 1º Alerta,Vila Velha De Ródão,Castelo Branco,Centro,-7.622069,39.748197,Movimento de massa
45197532,20260936881,5,Despacho de 1º Alerta,Em Despacho,04/07/2026 18:43,1783186980000,2026-07-04,18:43,2026,0/02:29,149,---,3301,3301 - Queda de Árvore,Norte,Alto Minho,Viana do Castelo,Santa Maria Maior e Monserrate e Meadela,Estrada de Santa Luzia,Estrada de Santa Luzia,7,0,7,2,0,2,41.703882,-8.81652,41.703882°N 8.816520°W,"41°42,2340'N 8°48,9900'W ","41° 42' 14,04'' N 8° 48' 59,40'' W ",1783199520000,33 - Em Despacho,Intervenções em Infraestruturas e vias de comunicação,27458904,-8.81652,41.703882,20260936881,Estrada de Santa Luzia,Norte,2026-07-04T17:43:00Z,2026-07-04,Despacho De 1º Alerta,3301,0,2,7,Despacho De 1º Alerta,Viana Do Castelo,Viana Do Castelo,Norte,-8.81652,41.703882,Queda de Árvore
45197547,20260937125,5,Chegada ao TO,Em Despacho,04/07/2026 19:37,1783190220000,2026-07-04,19:37,2026,0/01:35,95,---,3301,3301 - Queda de Árvore,Norte,Alto Minho,Caminha,Caminha (Matriz) e Vilarelho,Estrada Candosa,Estrada Candosa,5,0,5,1,0,1,41.867575,-8.839419,41.867575°N 8.839419°W,"41°52,0560'N 8°50,3640'W ","41° 52' 3,36'' N 8° 50' 21,84'' W ",1783199520000,33 - Em Curso,Intervenções em Infraestruturas e vias de comunicação,27459148,-8.839419,41.867575,20260937125,Estrada Candosa,Norte,2026-07-04T18:37:00Z,2026-07-04,Chegada Ao to,3301,0,1,5,Chegada Ao to,Caminha,Viana Do Castelo,Norte,-8.839419,41.867575,Queda de Árvore
45197575,20260937435,8,Em Conclusão,Em Conclusão,04/07/2026 20:23,1783192980000,2026-07-04,20:23,2026,0/00:49,49,---,3311,3311 - Queda de elementos de construção em estruturas edificadas,Lisboa e Vale do Tejo,Grande Lisboa,Vila Franca de Xira,Alverca do Ribatejo e Sobralinho,ALVERCA,Urbanização da Malvarosa - Praceta Capitão José Santos Leite - Bloco 2,5,0,5,1,0,1,38.896362,-9.046012,38.896362°N 9.046012°W,"38°53,7840'N 9°2,7600'W ","38° 53' 47,04'' N 9° 2' 45,60'' W ",1783199520000,33 - Em Conclusão,Intervenções em Infraestruturas e vias de comunicação,27459458,-9.046012,38.896362,20260937435,ALVERCA,Lisboa e Vale do Tejo,2026-07-04T19:23:00Z,2026-07-04,Em resolução/conclusão,3311,0,1,5,Resolução/Conclusão,Vila Franca De Xira,Lisboa,Área Metropolitana De Lisboa,-9.046012,38.896362,Queda de elementos de construção em estruturas edificadas
