id,address,subregion,neighborhood,date,id.1,state,nature,nature_description,aerial_means,terrestrial_means,aquatic_means,operational,date.1,Concelho,Distrito,NUTII_DSG,longitude,latitude
25513421,Canedo,Alto Tâmega e Barroso,309,2025-06-12T08:20:00Z,25513421,Em despacho,3107,Consolidação de rescaldo de incêndio rural,0,1,0,5,2025-06-12T08:20:00Z,Ribeira De Pena,Vila Real,Norte,-7.739478,41.637903
25514230,"Ovar, São João, Arada e São Vicente de Pereira Jusã",Região de Aveiro,310,2025-06-12T10:47:00Z,25514230,Em despacho,2301,Incêndio em transporte rodoviário,0,0,0,0,2025-06-12T10:47:00Z,Ovar,Aveiro,Centro,-8.632482,40.864029
25513847,Ermelo e Pardelhas,Ave,309,2025-06-12T09:41:00Z,25513847,Em despacho,3107,Consolidação de rescaldo de incêndio rural,0,2,0,9,2025-06-12T09:41:00Z,Mondim De Basto,Vila Real,Norte,-7.870974,41.353823
25514281,"Assunção, Ajuda, Salvador e Santo Ildefonso",Alto Alentejo,312,2025-06-12T10:56:00Z,25514281,Em despacho,2109,Incêndio em edifícios escolares,0,0,0,0,2025-06-12T10:56:00Z,Elvas,Portalegre,Alentejo,-7.16919,38.87437
25513566,Chão de Couce,Região de Leiria,310,2025-06-12T08:44:00Z,25513566,Em curso,2127,"Incêndio em edifícios e recintos industriais, oficinas e armazéns",0,3,0,8,2025-06-12T08:44:00Z,Ansião,Leiria,Centro,-8.380977,39.89135
25514101,Rebordelo,Terras de Trás-os-Montes,309,2025-06-12T10:20:00Z,25514101,Em resolução,3103,Incêndio rural,0,2,0,7,2025-06-12T10:20:00Z,Vinhais,Bragança,Norte,-7.159647,41.738258
25514221,Macieira de Cambra,Area M. Porto,309,2025-06-12T10:41:00Z,25514221,Em conclusão,2301,Incêndio em transporte rodoviário,0,3,0,5,2025-06-12T10:41:00Z,Vale De Cambra,Aveiro,Norte,-8.367205,40.870286
25513641,Azambuja,Lezíria do Tejo,311,2025-06-12T09:03:00Z,25513641,Em despacho,3109,Gestão de combustível,0,1,0,2,2025-06-12T09:03:00Z,Azambuja,Lisboa,Alentejo,-8.864506,39.067885
25513825,Favaios,Douro,309,2025-06-12T09:30:00Z,25513825,Em despacho,3107,Consolidação de rescaldo de incêndio rural,0,2,0,7,2025-06-12T09:30:00Z,Alijó,Vila Real,Norte,-7.495697,41.276963
