id,address,subregion,neighborhood,date,id.1,state,nature,nature_description,aerial_means,terrestrial_means,aquatic_means,operational,date.1,Concelho,Distrito,NUTII_DSG,longitude,latitude
25262510,Abiul,Região de Leiria,310,2025-04-20T07:50:00Z,25262510,Em despacho,3315,Inundação de estruturas por precipitação intensa,0,1,0,4,2025-04-20T07:50:00Z,Pombal,Leiria,Centro,-8.520112,39.891869
25071496,São Manços e São Vicente do Pigeiro,Alentejo Central,312,2025-03-11T13:18:00Z,25071496,Em conclusão,1101,Cheia,0,0,0,0,2025-03-11T13:18:00Z,Évora,Évora,Alentejo,-7.713313,38.513673
25202441,Serpa (Salvador e Santa Maria),Baixo Alentejo,312,2025-04-06T10:25:00Z,25202441,Em conclusão,1101,Cheia,0,0,0,0,2025-04-06T10:25:00Z,Serpa,Beja,Alentejo,-7.555783,37.88592
25262395,Sobral de Monte Agraço,Oeste,311,2025-04-20T06:01:00Z,25262395,Em despacho,3321,Dano na rede de fornecimento de eletricidade ,0,1,0,2,2025-04-20T06:01:00Z,Sobral De Monte Agraço,Lisboa,Centro,-9.152431,39.019738
25262444,Setúbal (São Sebastião),Península de Setúbal,311,2025-04-20T06:51:00Z,25262444,Em despacho,3321,Dano na rede de fornecimento de eletricidade ,0,1,0,5,2025-04-20T06:51:00Z,Setúbal,Setúbal,Área Metropolitana De Lisboa,-8.874702,38.52258
25261966,Souselas e Botão,Região de Coimbra,310,2025-04-19T23:58:00Z,25261966,Em curso,3313,Deslizamento de terras,0,2,0,4,2025-04-19T23:58:00Z,Coimbra,Coimbra,Centro,-8.446077,40.291836000000004
25262443,Ermesinde,Area M. Porto,309,2025-04-20T06:51:00Z,25262443,Em despacho,3321,Dano na rede de fornecimento de eletricidade ,0,1,0,2,2025-04-20T06:51:00Z,Valongo,Porto,Norte,-8.543016,41.21933
25262452,Gulpilhares e Valadares,Area M. Porto,309,2025-04-20T06:32:00Z,25262452,Em despacho,3315,Inundação de estruturas por precipitação intensa,0,1,0,4,2025-04-20T06:32:00Z,Vila Nova De Gaia,Porto,Norte,-8.637978,41.084091
