id,address,subregion,neighborhood,date,id.1,state,nature,nature_description,aerial_means,terrestrial_means,aquatic_means,operational,date.1,Concelho,Distrito,NUTII_DSG,longitude,latitude
25466369,Melides,Alentejo Litoral,312,2025-06-02T13:27:00Z,25466369,Em conclusão,3103,Incêndio rural,0,1,0,2,2025-06-02T13:27:00Z,Grândola,Setúbal,Alentejo,-8.754243,38.19534
25467128,Monte Redondo e Carreira,Região de Leiria,310,2025-06-02T15:48:00Z,25467128,Em conclusão,3103,Incêndio rural,0,1,0,2,2025-06-02T15:48:00Z,Leiria,Leiria,Centro,-8.860783,39.89848
25473778,Bougado (São Martinho e Santiago),Area M. Porto,309,2025-06-04T00:23:00Z,25473778,Em conclusão,2127,"Incêndio em edifícios e recintos industriais, oficinas e armazéns",0,10,0,28,2025-06-04T00:23:00Z,Trofa,Porto,Norte,-8.561468,41.334938
25474033,"Ponte de Sor, Tramaga e Vale de Açor",Alto Alentejo,312,2025-06-04T04:40:00Z,25474033,Em despacho,3103,Incêndio rural,0,0,0,0,2025-06-04T04:40:00Z,Ponte De Sor,Portalegre,Alentejo,-8.048473,39.22029
25473943,Massamá e Monte Abraão,Grande Lisboa,311,2025-06-04T02:46:00Z,25473943,Em conclusão,2301,Incêndio em transporte rodoviário,0,1,0,5,2025-06-04T02:46:00Z,Sintra,Lisboa,Área Metropolitana De Lisboa,-9.296238,38.76203
25473991,Mazarefes e Vila Fria,Alto Minho,309,2025-06-04T03:50:00Z,25473991,Em curso,2201,Incêndio em equipamentos ou produtos,0,4,0,15,2025-06-04T03:50:00Z,Viana Do Castelo,Viana Do Castelo,Norte,-8.750468,41.65542
