id,address,subregion,neighborhood,date,id.1,state,nature,nature_description,aerial_means,terrestrial_means,aquatic_means,operational,date.1,Concelho,Distrito,NUTII_DSG,longitude,latitude
24851780,"São Miguel, Santa Eufémia e Rabaçal",Região de Coimbra,310,2025-01-21T23:25:00Z,24851780,Em curso,3315,Inundação de estruturas por precipitação intensa,0,0,0,0,2025-01-21T23:25:00Z,Penela,Coimbra,Centro,-8.399036,40.025502
24879754,Massamá e Monte Abraão,Grande Lisboa,311,2025-01-27T20:28:00Z,24879754,Em despacho,3301,Queda de árvore,0,1,0,2,2025-01-27T20:28:00Z,Sintra,Lisboa,Área Metropolitana De Lisboa,-9.280008,38.753778
24879891,"Ovar, São João, Arada e São Vicente de Pereira Jusã",Região de Aveiro,310,2025-01-27T21:12:00Z,24879891,Em curso,3301,Queda de árvore,0,2,0,3,2025-01-27T21:12:00Z,Ovar,Aveiro,Centro,-8.632482,40.864029
24879905,Albergaria-a-Velha e Valmaior,Região de Aveiro,310,2025-01-27T21:19:00Z,24879905,Em curso,3301,Queda de árvore,0,3,0,4,2025-01-27T21:19:00Z,Albergaria-a-Velha,Aveiro,Centro,-8.481182,40.69637
24879921,Campanhã,Area M. Porto,309,2025-01-27T19:51:00Z,24879921,Em despacho,3311,Queda de elementos de estruturas edificados,0,1,0,5,2025-01-27T19:51:00Z,Porto,Porto,Norte,-8.575994,41.158637
24879971,Oliveira do Bairro,Região de Aveiro,310,2025-01-27T21:35:00Z,24879971,Em despacho,3301,Queda de árvore,0,1,0,3,2025-01-27T21:35:00Z,Oliveira Do Bairro,Aveiro,Centro,-8.518994,40.520475
24874564,"Sé, Santa Maria e Meixedo",Terras de Trás-os-Montes,309,2025-01-26T21:55:00Z,24874564,Em curso,3315,Inundação de estruturas por precipitação intensa,0,1,0,2,2025-01-26T21:55:00Z,Bragança,Bragança,Norte,-6.761223,41.813164
24876200,Ceira,Região de Coimbra,310,2025-01-27T09:56:00Z,24876200,Em despacho,3315,Inundação de estruturas por precipitação intensa,0,1,0,2,2025-01-27T09:56:00Z,Coimbra,Coimbra,Centro,-8.376144,40.175952
24876893,"Sé, Santa Maria e Meixedo",Terras de Trás-os-Montes,309,2025-01-27T11:22:00Z,24876893,Em curso,3315,Inundação de estruturas por precipitação intensa,0,1,0,1,2025-01-27T11:22:00Z,Bragança,Bragança,Norte,-6.761223,41.813164
24878747,Costa da Caparica,Península de Setúbal,311,2025-01-27T16:45:00Z,24878747,Em despacho,3301,Queda de árvore,0,1,0,3,2025-01-27T16:45:00Z,Almada,Setúbal,Área Metropolitana De Lisboa,-9.227696,38.642583
24878958,"Mogadouro, Valverde, Vale de Porco e Vilar de Rei",Terras de Trás-os-Montes,309,2025-01-27T17:29:00Z,24878958,Em curso,3315,Inundação de estruturas por precipitação intensa,0,1,0,2,2025-01-27T17:29:00Z,Mogadouro,Bragança,Norte,-6.706687,41.339826
24879090,"N. S. da Vila, N. S. do Bispo e Silveiras",Alentejo Central,312,2025-01-27T17:53:00Z,24879090,Em despacho,3301,Queda de árvore,0,1,0,2,2025-01-27T17:53:00Z,Montemor-o-Novo,Évora,Alentejo,-8.206765,38.623083
24879692,Santiago da Guarda,Região de Leiria,310,2025-01-27T20:16:00Z,24879692,Em curso,3301,Queda de árvore,0,2,0,5,2025-01-27T20:16:00Z,Ansião,Leiria,Centro,-8.516841,39.934209
24877003,Malagueira e Horta Das Figueiras,Alentejo Central,312,2025-01-27T11:41:00Z,24877003,Em conclusão,3315,Inundação de estruturas por precipitação intensa,0,1,0,2,2025-01-27T11:41:00Z,Évora,Évora,Alentejo,-7.924277,38.57285
24878984,"Sé, Santa Maria e Meixedo",Terras de Trás-os-Montes,309,2025-01-27T17:32:00Z,24878984,Em curso,3315,Inundação de estruturas por precipitação intensa,0,1,0,2,2025-01-27T17:32:00Z,Bragança,Bragança,Norte,-6.761223,41.813164
24879952,Valhelhas,Beiras e Serra da Estrela,310,2025-01-27T21:30:00Z,24879952,Em despacho,3301,Queda de árvore,0,1,0,3,2025-01-27T21:30:00Z,Guarda,Guarda,Centro,-7.403949,40.406617
24879961,Praia de Mira,Região de Coimbra,310,2025-01-27T21:29:00Z,24879961,Em despacho,3301,Queda de árvore,0,1,0,2,2025-01-27T21:29:00Z,Mira,Coimbra,Centro,-8.8004270000000009,40.460655
24879986,Viseu,Viseu Dão Lafões,310,2025-01-27T21:44:00Z,24879986,Em despacho,3329,Queda de estruturas temporárias ou móveis,0,1,0,2,2025-01-27T21:44:00Z,Viseu,Viseu,Centro,-7.908451,40.659587
24879578,Valado Dos Frades,Oeste,311,2025-01-27T19:44:00Z,24879578,Em curso,3301,Queda de árvore,0,5,0,8,2025-01-27T19:44:00Z,Nazaré,Leiria,Centro,-9.001832,39.574315
24879849,São Mamede de Infesta e Senhora da Hora,Area M. Porto,309,2025-01-27T20:25:00Z,24879849,Em despacho,3301,Queda de árvore,0,1,0,2,2025-01-27T20:25:00Z,Matosinhos,Porto,Norte,-8.603992,41.193713
24879864,Cascais e Estoril,Grande Lisboa,311,2025-01-27T21:01:00Z,24879864,Em curso,3301,Queda de árvore,0,1,0,3,2025-01-27T21:01:00Z,Cascais,Lisboa,Área Metropolitana De Lisboa,-9.398759,38.70391
24879964,São Miguel do Mato,Viseu Dão Lafões,310,2025-01-27T21:34:00Z,24879964,Em despacho,3301,Queda de árvore,0,0,0,0,2025-01-27T21:34:00Z,Vouzela,Viseu,Centro,-8.023922,40.725998
24879980,Castanheira do Ribatejo e Cachoeiras,Grande Lisboa,311,2025-01-27T21:40:00Z,24879980,Em curso,3321,Dano na rede de fornecimento de eletricidade ,0,1,0,2,2025-01-27T21:40:00Z,Vila Franca De Xira,Lisboa,Área Metropolitana De Lisboa,-8.966389,38.987034
24879794,São João Baptista,Alto Alentejo,312,2025-01-27T20:44:00Z,24879794,Em conclusão,3301,Queda de árvore,0,4,0,6,2025-01-27T20:44:00Z,Campo Maior,Portalegre,Alentejo,-7.063012,39.021305
24879801,"Cedofeita, Ildefonso, Sé, Miragaia, Nicolau e Vitória",Area M. Porto,309,2025-01-27T20:49:00Z,24879801,Em curso,3311,Queda de elementos de estruturas edificados,0,1,0,5,2025-01-27T20:49:00Z,Porto,Porto,Norte,-8.615939,41.15359
24879926,Gafanha da Encarnação,Região de Aveiro,310,2025-01-27T21:26:00Z,24879926,Em despacho,3301,Queda de árvore,0,1,0,3,2025-01-27T21:26:00Z,Ílhavo,Aveiro,Centro,-8.750661,40.615534
24879942,"Santa Maria da Feira, Travanca, Sanfins e Espargo",Area M. Porto,309,2025-01-27T21:10:00Z,24879942,Em despacho,3315,Inundação de estruturas por precipitação intensa,0,1,0,2,2025-01-27T21:10:00Z,Santa Maria Da Feira,Aveiro,Norte,-8.555837,40.9255
24879985,Cinfães,Tâmega e Sousa,309,2025-01-27T21:42:00Z,24879985,Em despacho,1107,Nevão,0,1,0,2,2025-01-27T21:42:00Z,Cinfães,Viseu,Norte,-8.086727,41.072213
24879987,"Mortágua, Vale de Remígio, Cortegaça e Almaça",Região de Coimbra,310,2025-01-27T21:45:00Z,24879987,Em despacho,3301,Queda de árvore,0,1,0,5,2025-01-27T21:45:00Z,Mortágua,Viseu,Centro,-8.233244,40.400406
