id,address,subregion,neighborhood,date,id.1,state,nature,nature_description,aerial_means,terrestrial_means,aquatic_means,operational,date.1,Concelho,Distrito,NUTII_DSG,longitude,latitude
24846775,Monchique,Algarve,313,2025-01-20T22:27:00Z,24846775,Em despacho,3301,Queda de árvore,0,1,0,3,2025-01-20T22:27:00Z,Monchique,Faro,Algarve,-8.567422,37.320753
24845864,Ferreiras,Algarve,313,2025-01-20T17:56:00Z,24845864,Em despacho,3315,Inundação de estruturas por precipitação intensa,0,1,0,2,2025-01-20T17:56:00Z,Albufeira,Faro,Algarve,-8.236596,37.128685
24846229,Tavira (Santa Maria e Santiago),Algarve,313,2025-01-20T18:49:00Z,24846229,Em curso,3315,Inundação de estruturas por precipitação intensa,0,1,0,2,2025-01-20T18:49:00Z,Tavira,Faro,Algarve,-7.64691,37.130442
24846293,"S.maria, S.miguel, S.martinho, S.pedro Penaferrim",Grande Lisboa,311,2025-01-20T19:49:00Z,24846293,Em conclusão,3321,Dano na rede de fornecimento de eletricidade ,0,2,0,3,2025-01-20T19:49:00Z,Sintra,Lisboa,Área Metropolitana De Lisboa,-9.372095,38.757341
24846668,Corroios,Península de Setúbal,311,2025-01-20T21:56:00Z,24846668,Em despacho,3317,Inundação de estruturas por água canalizada,0,2,0,6,2025-01-20T21:56:00Z,Seixal,Setúbal,Área Metropolitana De Lisboa,-9.156509,38.644129
24846712,Massamá e Monte Abraão,Grande Lisboa,311,2025-01-20T22:16:00Z,24846712,Em despacho,3315,Inundação de estruturas por precipitação intensa,0,1,0,4,2025-01-20T22:16:00Z,Sintra,Lisboa,Área Metropolitana De Lisboa,-9.280008,38.753778
