id,address,subregion,neighborhood,date,id.1,state,nature,nature_description,aerial_means,terrestrial_means,aquatic_means,operational,date.1,Concelho,Distrito,NUTII_DSG,longitude,latitude
25068300,Almeirim,Lezíria do Tejo,311,2025-03-10T20:52:00Z,25068300,Em curso,1101,Cheia,0,0,0,0,2025-03-10T20:52:00Z,Almeirim,Santarém,Alentejo,-8.635002,39.187436
25249555,Massamá e Monte Abraão,Grande Lisboa,311,2025-04-16T18:20:00Z,25249555,Em despacho,3301,Queda de árvore,0,1,0,2,2025-04-16T18:20:00Z,Sintra,Lisboa,Área Metropolitana De Lisboa,-9.280008,38.753778
25249630,Fazendas de Almeirim,Lezíria do Tejo,311,2025-04-16T18:47:00Z,25249630,Em conclusão,3301,Queda de árvore,0,1,0,4,2025-04-16T18:47:00Z,Almeirim,Santarém,Alentejo,-8.528002,39.190697
25249813,"S.julião, N.s. da Anunciada e S. Maria da Graça",Península de Setúbal,311,2025-04-16T19:41:00Z,25249813,Em despacho,3311,Queda de elementos de estruturas edificados,0,1,0,5,2025-04-16T19:41:00Z,Setúbal,Setúbal,Área Metropolitana De Lisboa,-8.889983,38.529955
25070044,Praia do Ribatejo,Médio Tejo,311,2025-03-10T19:30:00Z,25070044,Em curso,1101,Cheia,0,0,0,0,2025-03-10T19:30:00Z,Vila Nova Da Barquinha,Santarém,Centro,-8.357309,39.485638
25071496,São Manços e São Vicente do Pigeiro,Alentejo Central,312,2025-03-11T13:18:00Z,25071496,Em conclusão,1101,Cheia,0,0,0,0,2025-03-11T13:18:00Z,Évora,Évora,Alentejo,-7.713313,38.513673
25202441,Serpa (Salvador e Santa Maria),Baixo Alentejo,312,2025-04-06T10:25:00Z,25202441,Em conclusão,1101,Cheia,0,0,0,0,2025-04-06T10:25:00Z,Serpa,Beja,Alentejo,-7.555783,37.88592
25249720,Rio de Mouro,Grande Lisboa,311,2025-04-16T19:17:00Z,25249720,Em despacho,3309,Desabamento de estruturas edificadas,0,1,0,2,2025-04-16T19:17:00Z,Sintra,Lisboa,Área Metropolitana De Lisboa,-9.343349,38.76614
25249483,Monchique,Algarve,313,2025-04-16T17:53:00Z,25249483,Em despacho,3317,Inundação de estruturas por água canalizada,0,1,0,5,2025-04-16T17:53:00Z,Monchique,Faro,Algarve,-8.567422,37.320753
