id,address,subregion,neighborhood,date,id.1,state,nature,nature_description,aerial_means,terrestrial_means,aquatic_means,operational,date.1,Concelho,Distrito,NUTII_DSG,longitude,latitude
25473874,Grândola e Santa Margarida da Serra,Alentejo Litoral,312,2025-06-04T01:27:00Z,25473874,Em conclusão,3103,Incêndio rural,0,3,0,8,2025-06-04T01:27:00Z,Grândola,Setúbal,Alentejo,-8.49366,38.16711
25473924,Águeda e Borralha,Região de Aveiro,310,2025-06-04T02:27:00Z,25473924,Em resolução,2301,Incêndio em transporte rodoviário,0,2,0,7,2025-06-04T02:27:00Z,Águeda,Aveiro,Centro,-8.45263,40.57548
25473943,Massamá e Monte Abraão,Grande Lisboa,311,2025-06-04T02:46:00Z,25473943,Em despacho,2301,Incêndio em transporte rodoviário,0,0,0,0,2025-06-04T02:46:00Z,Sintra,Lisboa,Área Metropolitana De Lisboa,-9.296238,38.76203
25473822,Canha,Península de Setúbal,311,2025-06-04T00:55:00Z,25473822,Em conclusão,3105,Incêndio rural,0,1,0,2,2025-06-04T00:55:00Z,Montijo,Setúbal,Área Metropolitana De Lisboa,-8.640513,38.768722
25466369,Melides,Alentejo Litoral,312,2025-06-02T13:27:00Z,25466369,Em conclusão,3103,Incêndio rural,0,1,0,2,2025-06-02T13:27:00Z,Grândola,Setúbal,Alentejo,-8.754243,38.19534
25467128,Monte Redondo e Carreira,Região de Leiria,310,2025-06-02T15:48:00Z,25467128,Em conclusão,3103,Incêndio rural,0,1,0,2,2025-06-02T15:48:00Z,Leiria,Leiria,Centro,-8.860783,39.89848
25473778,Bougado (São Martinho e Santiago),Area M. Porto,309,2025-06-04T00:23:00Z,25473778,Em conclusão,2127,"Incêndio em edifícios e recintos industriais, oficinas e armazéns",0,15,0,43,2025-06-04T00:23:00Z,Trofa,Porto,Norte,-8.561468,41.334938
