id,address,subregion,neighborhood,date,id.1,state,nature,nature_description,aerial_means,terrestrial_means,aquatic_means,operational,date.1,Concelho,Distrito,NUTII_DSG,longitude,latitude
25573529,"Sé Nova, Santa Cruz, Almedina e São Bartolomeu",Região de Coimbra,310,2025-06-24T14:21:00Z,25573529,Em resolução,2201,Incêndio em equipamentos ou produtos,0,3,0,13,2025-06-24T14:21:00Z,Coimbra,Coimbra,Centro,-8.425582,40.205556
25573518,Mondim de Basto,Ave,309,2025-06-24T14:24:00Z,25573518,Em resolução,2201,Incêndio em equipamentos ou produtos,0,2,0,7,2025-06-24T14:24:00Z,Mondim De Basto,Vila Real,Norte,-7.957933,41.407065
25573595,"São Pedro do Sul, Várzea e Baiões",Viseu Dão Lafões,310,2025-06-24T14:35:00Z,25573595,Em conclusão,2201,Incêndio em equipamentos ou produtos,0,4,0,13,2025-06-24T14:35:00Z,São Pedro Do Sul,Viseu,Centro,-8.082212,40.746241
25573402,Sousel,Alto Alentejo,312,2025-06-24T13:58:00Z,25573402,Em conclusão,2101,Incêndio em edifícios habitacionais,0,8,0,25,2025-06-24T13:58:00Z,Sousel,Portalegre,Alentejo,-7.675005,38.951775
25573145,Nespereira,Ave,309,2025-06-24T12:59:00Z,25573145,Em despacho,3107,Consolidação de rescaldo de incêndio rural,0,1,0,5,2025-06-24T12:59:00Z,Guimarães,Braga,Norte,-8.328117,41.411398
25572861,Poceirão e Marateca,Península de Setúbal,311,2025-06-24T11:54:00Z,25572861,Em conclusão,3105,Incêndio rural,0,0,0,0,2025-06-24T11:54:00Z,Palmela,Setúbal,Área Metropolitana De Lisboa,-8.702358,38.586871
25573630,Sendim,Tâmega e Sousa,309,2025-06-24T14:37:00Z,25573630,Em despacho,3107,Consolidação de rescaldo de incêndio rural,0,1,0,5,2025-06-24T14:37:00Z,Felgueiras,Porto,Norte,-8.189135,41.391572
25573498,Quinta do Conde,Península de Setúbal,311,2025-06-24T14:22:00Z,25573498,Em conclusão,2101,Incêndio em edifícios habitacionais,0,6,0,20,2025-06-24T14:22:00Z,Sesimbra,Setúbal,Área Metropolitana De Lisboa,-9.07478,38.54899
25573394,Sado,Península de Setúbal,311,2025-06-24T13:58:00Z,25573394,Em conclusão,3105,Incêndio rural,0,2,0,9,2025-06-24T13:58:00Z,Setúbal,Setúbal,Área Metropolitana De Lisboa,-8.81201,38.48917
25573260,Aljustrel e Rio de Moinhos,Baixo Alentejo,312,2025-06-24T13:37:00Z,25573260,Em conclusão,3105,Incêndio rural,0,1,0,2,2025-06-24T13:37:00Z,Aljustrel,Beja,Alentejo,-8.169328,37.896
25572508,Gouveia (São Simão),Tâmega e Sousa,309,2025-06-24T10:55:00Z,25572508,Em despacho,3107,Consolidação de rescaldo de incêndio rural,0,1,0,5,2025-06-24T10:55:00Z,Amarante,Porto,Norte,-8.06252,41.23046
25573592,"Algés, Linda-a-Velha e Cruz Quebrada-Dafundo",Grande Lisboa,311,2025-06-24T14:31:00Z,25573592,Em curso,2101,Incêndio em edifícios habitacionais,0,3,0,9,2025-06-24T14:31:00Z,Oeiras,Lisboa,Área Metropolitana De Lisboa,-9.22967,38.696612
25573658,Colares,Grande Lisboa,311,2025-06-24T14:42:00Z,25573658,Em curso,2101,Incêndio em edifícios habitacionais,0,4,0,11,2025-06-24T14:42:00Z,Sintra,Lisboa,Área Metropolitana De Lisboa,-9.461505,38.840719
