id,address,subregion,neighborhood,date,id.1,state,nature,nature_description,aerial_means,terrestrial_means,aquatic_means,operational,date.1,Concelho,Distrito,NUTII_DSG,longitude,latitude
24851780,"São Miguel, Santa Eufémia e Rabaçal",Região de Coimbra,310,2025-01-21T23:25:00Z,24851780,Em curso,3315,Inundação de estruturas por precipitação intensa,0,0,0,0,2025-01-21T23:25:00Z,Penela,Coimbra,Centro,-8.399036,40.025502
24885722,"Aldoar, Foz do Douro e Nevogilde",Area M. Porto,309,2025-01-29T08:47:00Z,24885722,Em despacho,3311,Queda de elementos de estruturas edificados,0,0,0,0,2025-01-29T08:47:00Z,Porto,Porto,Norte,-8.66587,41.16295
24885737,Matosinhos e Leça da Palmeira,Area M. Porto,309,2025-01-29T08:29:00Z,24885737,Em curso,3301,Queda de árvore,0,1,0,2,2025-01-29T08:29:00Z,Matosinhos,Porto,Norte,-8.692583,41.193749
24886021,Lamas e Cercal,Oeste,311,2025-01-29T09:39:00Z,24886021,Em resolução,3321,Dano na rede de fornecimento de eletricidade ,0,3,0,6,2025-01-29T09:39:00Z,Cadaval,Lisboa,Centro,-8.99533,39.21899
24886058,Palmeira,Cávado,309,2025-01-29T09:42:00Z,24886058,Em despacho,3329,Queda de estruturas temporárias ou móveis,0,1,0,2,2025-01-29T09:42:00Z,Braga,Braga,Norte,-8.434231,41.59113
24886140,Castanheira de Pêra e Coentral,Região de Leiria,310,2025-01-29T09:54:00Z,24886140,Em despacho,3301,Queda de árvore,0,1,0,2,2025-01-29T09:54:00Z,Castanheira De Pêra,Leiria,Centro,-8.196364,40.017687
24886225,Atouguia da Baleia,Oeste,311,2025-01-29T10:10:00Z,24886225,Em curso,3321,Dano na rede de fornecimento de eletricidade ,0,1,0,2,2025-01-29T10:10:00Z,Peniche,Leiria,Centro,-9.312128,39.3038
24886181,Rendufinho,Ave,309,2025-01-29T09:55:00Z,24886181,Em despacho,3315,Inundação de estruturas por precipitação intensa,0,1,0,2,2025-01-29T09:55:00Z,Póvoa De Lanhoso,Braga,Norte,-8.264356,41.616025
24886183,Buarcos,Região de Coimbra,310,2025-01-29T09:58:00Z,24886183,Em despacho,3315,Inundação de estruturas por precipitação intensa,0,2,0,4,2025-01-29T09:58:00Z,Figueira Da Foz,Coimbra,Centro,-8.880897,40.168384
24886216,"Caldelas, Sequeiros e Paranhos",Cávado,309,2025-01-29T10:10:00Z,24886216,Em despacho,3315,Inundação de estruturas por precipitação intensa,0,1,0,2,2025-01-29T10:10:00Z,Amares,Braga,Norte,-8.358872,41.673712
24886263,"O. Azeméis, Riba-Ul, Ul, Macinhata Seixa, Madail",Area M. Porto,309,2025-01-29T10:17:00Z,24886263,Em despacho,3329,Queda de estruturas temporárias ou móveis,0,1,0,2,2025-01-29T10:17:00Z,Oliveira De Azeméis,Aveiro,Norte,-8.481537,40.83287
24886266,São Pedro da Cadeira,Oeste,311,2025-01-29T10:18:00Z,24886266,Em despacho,3315,Inundação de estruturas por precipitação intensa,0,2,0,4,2025-01-29T10:18:00Z,Torres Vedras,Lisboa,Centro,-9.372278,39.07254
24886258,Barcarena,Grande Lisboa,311,2025-01-29T10:13:00Z,24886258,Em curso,3311,Queda de elementos de estruturas edificados,0,2,0,4,2025-01-29T10:13:00Z,Oeiras,Lisboa,Área Metropolitana De Lisboa,-9.277392,38.733987
24886275,Canidelo,Area M. Porto,309,2025-01-29T10:00:00Z,24886275,Em despacho,3301,Queda de árvore,0,1,0,5,2025-01-29T10:00:00Z,Vila Nova De Gaia,Porto,Norte,-8.647622,41.133197
24886356,Sangalhos,Região de Aveiro,310,2025-01-29T10:15:00Z,24886356,Em despacho,3301,Queda de árvore,0,2,0,7,2025-01-29T10:15:00Z,Anadia,Aveiro,Centro,-8.478739,40.494487
24886373,Arganil,Região de Coimbra,310,2025-01-29T10:27:00Z,24886373,Em despacho,3301,Queda de árvore,0,1,0,5,2025-01-29T10:27:00Z,Arganil,Coimbra,Centro,-8.069689,40.205912
24886492,Armamar,Douro,309,2025-01-29T10:44:00Z,24886492,Em despacho,3301,Queda de árvore,0,1,0,2,2025-01-29T10:44:00Z,Armamar,Viseu,Norte,-7.698587,41.110126
24886506,"Nossa Senhora da Conceição, São Pedro e São Dinis",Douro,309,2025-01-29T10:45:00Z,24886506,Em despacho,3311,Queda de elementos de estruturas edificados,0,1,0,1,2025-01-29T10:45:00Z,Vila Real,Vila Real,Norte,-7.744039,41.314067
24886509,Louredo e Fornelos,Douro,309,2025-01-29T10:54:00Z,24886509,Em despacho,3301,Queda de árvore,0,1,0,2,2025-01-29T10:54:00Z,Santa Marta De Penaguião,Vila Real,Norte,-7.812212,41.247361
24886523,Sesimbra (Castelo),Península de Setúbal,311,2025-01-29T10:48:00Z,24886523,Em despacho,3321,Dano na rede de fornecimento de eletricidade ,0,1,0,4,2025-01-29T10:48:00Z,Sesimbra,Setúbal,Área Metropolitana De Lisboa,-9.179861,38.512406
24886525,"Marvila, Ribeira Santarém, S.salvador, S.nicolau",Lezíria do Tejo,311,2025-01-29T10:57:00Z,24886525,Em conclusão,3315,Inundação de estruturas por precipitação intensa,0,1,0,3,2025-01-29T10:57:00Z,Santarém,Santarém,Alentejo,-8.691313,39.216268
24886300,"Sé, Santa Maria e Meixedo",Terras de Trás-os-Montes,309,2025-01-29T10:22:00Z,24886300,Em despacho,3315,Inundação de estruturas por precipitação intensa,0,1,0,2,2025-01-29T10:22:00Z,Bragança,Bragança,Norte,-6.76349,41.81617
24886350,Junqueira,Area M. Porto,309,2025-01-29T10:20:00Z,24886350,Em resolução,3301,Queda de árvore,0,1,0,2,2025-01-29T10:20:00Z,Vale De Cambra,Aveiro,Norte,-8.335001,40.802871
24886364,Peso da Régua e Godim,Douro,309,2025-01-29T10:27:00Z,24886364,Em despacho,3315,Inundação de estruturas por precipitação intensa,0,1,0,2,2025-01-29T10:27:00Z,Peso Da Régua,Vila Real,Norte,-7.799499,41.166288
24886400,"Sandim, Olival, Lever e Crestuma",Area M. Porto,309,2025-01-29T10:29:00Z,24886400,Em despacho,3329,Queda de estruturas temporárias ou móveis,0,1,0,2,2025-01-29T10:29:00Z,Vila Nova De Gaia,Porto,Norte,-8.485122,41.033861
24886416,Lamas,Região de Coimbra,310,2025-01-29T10:35:00Z,24886416,Em despacho,3315,Inundação de estruturas por precipitação intensa,0,1,0,2,2025-01-29T10:35:00Z,Miranda Do Corvo,Coimbra,Centro,-8.38289,40.094885
24886417,Abitureiras,Lezíria do Tejo,311,2025-01-29T10:40:00Z,24886417,Em conclusão,3313,Deslizamento de terras,0,1,0,1,2025-01-29T10:40:00Z,Santarém,Santarém,Alentejo,-8.767135,39.323093
24886430,Tabuaço,Douro,309,2025-01-29T10:34:00Z,24886430,Em despacho,3321,Dano na rede de fornecimento de eletricidade ,0,1,0,2,2025-01-29T10:34:00Z,Tabuaço,Viseu,Norte,-7.569946,41.117674
24886466,Fazendas de Almeirim,Lezíria do Tejo,311,2025-01-29T10:48:00Z,24886466,Em despacho,3301,Queda de árvore,0,1,0,3,2025-01-29T10:48:00Z,Almeirim,Santarém,Alentejo,-8.515938,39.13801
24886498,"Oeiras e S. Julião da Barra, Paço de Arcos e Caxias",Grande Lisboa,311,2025-01-29T10:39:00Z,24886498,Em despacho,3301,Queda de árvore,0,1,0,4,2025-01-29T10:39:00Z,Oeiras,Lisboa,Área Metropolitana De Lisboa,-9.310159,38.698531
24877003,Malagueira e Horta Das Figueiras,Alentejo Central,312,2025-01-27T11:41:00Z,24877003,Em conclusão,3315,Inundação de estruturas por precipitação intensa,0,0,0,0,2025-01-27T11:41:00Z,Évora,Évora,Alentejo,-7.924277,38.57285
24885816,Paranhos,Area M. Porto,309,2025-01-29T08:54:00Z,24885816,Em despacho,3311,Queda de elementos de estruturas edificados,0,1,0,3,2025-01-29T08:54:00Z,Porto,Porto,Norte,-8.607437,41.17569
24886059,Santo André,Alentejo Litoral,312,2025-01-29T09:39:00Z,24886059,Em curso,3301,Queda de árvore,0,2,0,5,2025-01-29T09:39:00Z,Santiago Do Cacém,Setúbal,Alentejo,-8.751748,38.054211
24886261,Rio Tinto,Area M. Porto,309,2025-01-29T10:17:00Z,24886261,Em despacho,3321,Dano na rede de fornecimento de eletricidade ,0,1,0,1,2025-01-29T10:17:00Z,Gondomar,Porto,Norte,-8.55251,41.17102
24886309,Almeirim,Lezíria do Tejo,311,2025-01-29T10:22:00Z,24886309,Em resolução,3315,Inundação de estruturas por precipitação intensa,0,1,0,2,2025-01-29T10:22:00Z,Almeirim,Santarém,Alentejo,-8.588832,39.142251
24886361,Lourinhã e Atalaia,Oeste,311,2025-01-29T10:32:00Z,24886361,Em despacho,3315,Inundação de estruturas por precipitação intensa,0,2,0,4,2025-01-29T10:32:00Z,Lourinhã,Lisboa,Centro,-9.281329,39.263577
24886386,Buarcos,Região de Coimbra,310,2025-01-29T10:33:00Z,24886386,Em despacho,3315,Inundação de estruturas por precipitação intensa,0,1,0,5,2025-01-29T10:33:00Z,Figueira Da Foz,Coimbra,Centro,-8.880897,40.168384
24885494,Vila Cova e Feitos,Cávado,309,2025-01-29T07:44:00Z,24885494,Em curso,3301,Queda de árvore,0,1,0,2,2025-01-29T07:44:00Z,Barcelos,Braga,Norte,-8.688002,41.573305
24885769,Gulpilhares e Valadares,Area M. Porto,309,2025-01-29T08:29:00Z,24885769,Em despacho,3315,Inundação de estruturas por precipitação intensa,0,1,0,2,2025-01-29T08:29:00Z,Vila Nova De Gaia,Porto,Norte,-8.637978,41.084091
24885778,"St.tirso, Couto (S.cristina e S.miguel) e Burgães",Area M. Porto,309,2025-01-29T08:57:00Z,24885778,Em curso,3301,Queda de árvore,0,4,0,8,2025-01-29T08:57:00Z,Santo Tirso,Porto,Norte,-8.46516,41.35088
24885783,São Félix da Marinha,Area M. Porto,309,2025-01-29T08:42:00Z,24885783,Em despacho,3301,Queda de árvore,0,1,0,3,2025-01-29T08:42:00Z,Vila Nova De Gaia,Porto,Norte,-8.629189,41.030125
24885810,Mozelos,Area M. Porto,309,2025-01-29T08:54:00Z,24885810,Em resolução,3301,Queda de árvore,0,1,0,2,2025-01-29T08:54:00Z,Santa Maria Da Feira,Aveiro,Norte,-8.56526,40.997101
24886062,Alhadas,Região de Coimbra,310,2025-01-29T09:40:00Z,24886062,Em despacho,3315,Inundação de estruturas por precipitação intensa,0,1,0,3,2025-01-29T09:40:00Z,Figueira Da Foz,Coimbra,Centro,-8.808093,40.16613
24886404,Poiares (Santo André),Região de Coimbra,310,2025-01-29T10:26:00Z,24886404,Em despacho,3315,Inundação de estruturas por precipitação intensa,0,1,0,2,2025-01-29T10:26:00Z,Vila Nova De Poiares,Coimbra,Centro,-8.256455,40.211265
24886201,Lourinhã e Atalaia,Oeste,311,2025-01-29T09:30:00Z,24886201,Em conclusão,3315,Inundação de estruturas por precipitação intensa,0,2,0,6,2025-01-29T09:30:00Z,Lourinhã,Lisboa,Centro,-9.311131,39.244365
24886287,Cardigos,Médio Tejo,311,2025-01-29T10:21:00Z,24886287,Em despacho,3301,Queda de árvore,0,2,0,3,2025-01-29T10:21:00Z,Mação,Santarém,Centro,-7.976818,39.723094
24886426,Condeixa-a-Velha e Condeixa-a-Nova,Região de Coimbra,310,2025-01-29T10:40:00Z,24886426,Em despacho,3315,Inundação de estruturas por precipitação intensa,0,1,0,2,2025-01-29T10:40:00Z,Condeixa-a-Nova,Coimbra,Centro,-8.492045,40.113509
24886460,Bordonhos,Viseu Dão Lafões,310,2025-01-29T10:44:00Z,24886460,Em despacho,3301,Queda de árvore,0,1,0,5,2025-01-29T10:44:00Z,São Pedro Do Sul,Viseu,Centro,-8.083379,40.770555
24886476,Valongo,Area M. Porto,309,2025-01-29T10:51:00Z,24886476,Em despacho,3301,Queda de árvore,0,0,0,0,2025-01-29T10:51:00Z,Valongo,Porto,Norte,-8.485,41.18446
24886537,Tavarede,Região de Coimbra,310,2025-01-29T10:58:00Z,24886537,Em despacho,3315,Inundação de estruturas por precipitação intensa,0,1,0,3,2025-01-29T10:58:00Z,Figueira Da Foz,Coimbra,Centro,-8.853871,40.165854
24886553,Roliça,Oeste,311,2025-01-29T10:55:00Z,24886553,Em despacho,3313,Deslizamento de terras,0,4,0,6,2025-01-29T10:55:00Z,Bombarral,Leiria,Centro,-9.19011,39.284257
24886562,Cunha,Douro,309,2025-01-29T11:00:00Z,24886562,Em despacho,3301,Queda de árvore,0,1,0,3,2025-01-29T11:00:00Z,Sernancelhe,Viseu,Norte,-7.453734,40.83971
