id,address,subregion,neighborhood,date,id.1,state,nature,nature_description,aerial_means,terrestrial_means,aquatic_means,operational,date.1,Concelho,Distrito,NUTII_DSG,longitude,latitude
24848470,"N. S. da Vila, N. S. do Bispo e Silveiras",Alentejo Central,312,2025-01-21T11:03:00Z,24848470,Em despacho,3301,Queda de árvore,0,1,0,2,2025-01-21T11:03:00Z,Montemor-o-Novo,Évora,Alentejo,-8.206568,38.611659
24848621,São Bartolomeu de Messines,Algarve,313,2025-01-21T11:22:00Z,24848621,Em resolução,3301,Queda de árvore,0,1,0,5,2025-01-21T11:22:00Z,Silves,Faro,Algarve,-8.292757,37.2592
24847222,Castelo Branco,Beira Baixa,310,2025-01-21T04:20:00Z,24847222,Em conclusão,3309,Desabamento de estruturas edificadas,0,2,0,3,2025-01-21T04:20:00Z,Castelo Branco,Castelo Branco,Centro,-7.493762,39.824047
24848406,Ferreiras,Algarve,313,2025-01-21T10:40:00Z,24848406,Em despacho,3315,Inundação de estruturas por precipitação intensa,0,1,0,2,2025-01-21T10:40:00Z,Albufeira,Faro,Algarve,-8.24221,37.119669
24848683,Bacelo e Senhora da Saúde,Alentejo Central,312,2025-01-21T11:37:00Z,24848683,Em despacho,3315,Inundação de estruturas por precipitação intensa,0,1,0,2,2025-01-21T11:37:00Z,Évora,Évora,Alentejo,-7.869122,38.593644
24848708,Monchique,Algarve,313,2025-01-21T11:30:00Z,24848708,Em despacho,3301,Queda de árvore,0,1,0,5,2025-01-21T11:30:00Z,Monchique,Faro,Algarve,-8.567422,37.320753
24848441,Castelo Branco,Beira Baixa,310,2025-01-21T10:50:00Z,24848441,Em resolução,3315,Inundação de estruturas por precipitação intensa,0,2,0,4,2025-01-21T10:50:00Z,Castelo Branco,Castelo Branco,Centro,-7.490756,39.816895
24848575,"S.julião, N.s. da Anunciada e S. Maria da Graça",Península de Setúbal,311,2025-01-21T11:21:00Z,24848575,Em despacho,3315,Inundação de estruturas por precipitação intensa,0,3,0,12,2025-01-21T11:21:00Z,Setúbal,Setúbal,Área Metropolitana De Lisboa,-8.91115,38.54302
