id,address,subregion,neighborhood,date,id.1,state,nature,nature_description,aerial_means,terrestrial_means,aquatic_means,operational,date.1,Concelho,Distrito,NUTII_DSG,longitude,latitude
24777785,Peniche,Oeste,311,2025-01-05T15:45:00Z,24777785,Em curso,1103,Vento forte,0,14,0,40,2025-01-05T15:45:00Z,Peniche,Leiria,Centro,-9.3885,39.354248
24778284,Nogueiró e Tenões,Cávado,309,2025-01-05T17:10:00Z,24778284,Em despacho,3315,Inundação de estruturas por precipitação intensa,0,1,0,2,2025-01-05T17:10:00Z,Braga,Braga,Norte,-8.38588,41.558044
24778401,"Santa Maria da Feira, Travanca, Sanfins e Espargo",Area M. Porto,309,2025-01-05T18:10:00Z,24778401,Em curso,3301,Queda de árvore,0,1,0,2,2025-01-05T18:10:00Z,Santa Maria Da Feira,Aveiro,Norte,-8.555837,40.9255
24778535,Abrantes (São Vicente e São João) e Alferrarede,Médio Tejo,311,2025-01-05T18:49:00Z,24778535,Em resolução,3315,Inundação de estruturas por precipitação intensa,0,1,0,2,2025-01-05T18:49:00Z,Abrantes,Santarém,Centro,-8.192287,39.492107
24777071,Pedrógão Grande,Região de Leiria,310,2025-01-05T13:18:00Z,24777071,Em conclusão,3309,Desabamento de estruturas edificadas,0,1,0,1,2025-01-05T13:18:00Z,Pedrógão Grande,Leiria,Centro,-8.177567,39.933038
24778432,Eiras e São Paulo de Frades,Região de Coimbra,310,2025-01-05T18:20:00Z,24778432,Em despacho,3315,Inundação de estruturas por precipitação intensa,0,1,0,2,2025-01-05T18:20:00Z,Coimbra,Coimbra,Centro,-8.439766,40.225332
24776541,Minde,Médio Tejo,311,2025-01-05T11:42:00Z,24776541,Em curso,3315,Inundação de estruturas por precipitação intensa,0,1,0,4,2025-01-05T11:42:00Z,Alcanena,Santarém,Centro,-8.691237,39.511095
24777375,Guarda,Beiras e Serra da Estrela,310,2025-01-05T14:16:00Z,24777375,Em despacho,3315,Inundação de estruturas por precipitação intensa,0,1,0,2,2025-01-05T14:16:00Z,Guarda,Guarda,Centro,-7.260869,40.536751
24778428,Braga (São Vítor),Cávado,309,2025-01-05T18:14:00Z,24778428,Em despacho,3315,Inundação de estruturas por precipitação intensa,0,1,0,3,2025-01-05T18:14:00Z,Braga,Braga,Norte,-8.406451,41.557726
24778238,Santa Marinha e São Pedro da Afurada,Area M. Porto,309,2025-01-05T17:11:00Z,24778238,Em despacho,3317,Inundação de estruturas por água canalizada,0,1,0,3,2025-01-05T17:11:00Z,Vila Nova De Gaia,Porto,Norte,-8.624714,41.132843
24778467,"Seixal, Arrentela e Aldeia de Paio Pires",Península de Setúbal,311,2025-01-05T18:31:00Z,24778467,Em conclusão,3317,Inundação de estruturas por água canalizada,0,1,0,3,2025-01-05T18:31:00Z,Seixal,Setúbal,Área Metropolitana De Lisboa,-9.0793,38.62295
24778483,Viseu,Viseu Dão Lafões,310,2025-01-05T18:28:00Z,24778483,Em despacho,3311,Queda de elementos de estruturas edificados,0,1,0,2,2025-01-05T18:28:00Z,Viseu,Viseu,Centro,-7.908451,40.659587
24778547,Oliveira (São Mateus),Ave,309,2025-01-05T18:53:00Z,24778547,Em despacho,3301,Queda de árvore,0,0,0,0,2025-01-05T18:53:00Z,Vila Nova De Famalicão,Braga,Norte,-8.408561,41.393162
