attributes.ID_oc,attributes.Numero,attributes.CodEstadoOcorrencia,attributes.EstadoOcorrencia,attributes.EstadoAgrupado,attributes.DataInicioOcorrencia,attributes.DataOcorrencia,attributes.Data,attributes.Hora,attributes.Ano,attributes.Duracao,attributes.DuracaoMinutos,attributes.FaseIncendio,attributes.CodNatureza,attributes.Natureza,attributes.Regiao,attributes.SubRegiao,attributes.Concelho,attributes.Freguesia,attributes.Localidade,attributes.Endereco,attributes.OperacionaisTerrestres,attributes.OPAereos,attributes.Operacionais,attributes.MeiosTerrestres,attributes.MeiosAereos,attributes.QuantEntidades,attributes.Latitude,attributes.Longitude,attributes.DDD,attributes.DDM,attributes.DMS,attributes.DataDosDados,attributes.Simbol,attributes.RASI,attributes.ID,geometry.x,geometry.y,id,address,subregion,date,date.1,state,nature,aerial_means,terrestrial_means,operational,state_2,Concelho,Distrito,NUTII_DSG,longitude,latitude,nature_description
44314457,20260190881,5,Chegada ao TO,Em Despacho,05/02/2026 10:00,1770285600000,2026-02-05,10:00,2026,132/05:32,190412,---,3313,3313 - Movimento de massa,Centro,Beira Baixa,Sertã,Pedrógão Pequeno,PEDROGÃO PEQUENO,EN 2 - Pedrogão Pequeno,2,0,2,1,0,1,39.913035,-8.132459,39.913035°N 8.132459°W,"39°54,7800'N 8°7,9500'W ","39° 54' 46,80'' N 8° 7' 57,00'' W ",1781710320000,33 - Em Curso,Intervenções em Infraestruturas e vias de comunicação,26712881,-8.132459,39.913035,20260190881,PEDROGÃO PEQUENO,Centro,2026-02-05T10:00:00Z,2026-02-05,Chegada Ao to,3313,0,1,2,Chegada Ao to,Sertã,Castelo Branco,Centro,-8.132459,39.913035,Movimento de massa
44314458,20260231505,5,Despacho de 1º Alerta,Em Despacho,11/02/2026 11:00,1770807600000,2026-02-11,11:00,2026,126/04:32,181712,---,3313,3313 - Movimento de massa,Centro,Beira Baixa,Vila Velha de Ródão,Sarnadas de Ródão,Sarnadas de Rodão,Linha da Beira Baixa PK 67.700,2,0,2,1,0,1,39.748197,-7.622069,39.748197°N 7.622069°W,"39°44,8920'N 7°37,3260'W ","39° 44' 53,52'' N 7° 37' 19,56'' W ",1781710320000,33 - Em Despacho,Intervenções em Infraestruturas e vias de comunicação,26753513,-7.622069,39.748197,20260231505,Sarnadas de Rodão,Centro,2026-02-11T11:00:00Z,2026-02-11,Despacho De 1º Alerta,3313,0,1,2,Despacho De 1º Alerta,Vila Velha De Ródão,Castelo Branco,Centro,-7.622069,39.748197,Movimento de massa
44314492,20260841379,5,Despacho de 1º Alerta,Em Despacho,16/06/2026 15:30,1781620200000,2026-06-16,15:30,2026,1/00:02,1442,---,3309,3309 - Desabamento de estruturas edificadas,Norte,Douro,Murça,Candedo,Porrais,Gimnodesportivo,6,0,6,3,0,2,41.346197,-7.380401,41.346197°N 7.380401°W,"41°20,7720'N 7°22,8240'W ","41° 20' 46,32'' N 7° 22' 49,44'' W ",1781710320000,33 - Em Despacho,Intervenções em Infraestruturas e vias de comunicação,27363402,-7.380401,41.346197,20260841379,Porrais,Norte,2026-06-16T14:30:00Z,2026-06-16,Despacho De 1º Alerta,3309,0,3,6,Despacho De 1º Alerta,Murça,Vila Real,Norte,-7.380401,41.346197,Desabamento de estruturas edificadas
44314518,20260845959,6,Em Curso,Em Curso,17/06/2026 14:09,1781701740000,2026-06-17,14:09,2026,0/01:23,83,---,3313,3313 - Movimento de massa,Centro,Região de Leiria,Figueiró Dos Vinhos,Aguda,AGUDA,Piscinas Fluviais - Fragas de S. Simão,6,0,6,2,0,2,39.910359,-8.331926,39.910359°N 8.331926°W,"39°54,6240'N 8°19,9140'W ","39° 54' 37,44'' N 8° 19' 54,84'' W ",1781710320000,33 - Em Curso,Intervenções em Infraestruturas e vias de comunicação,27367982,-8.331926,39.910359,20260845959,AGUDA,Centro,2026-06-17T13:09:00Z,2026-06-17,Em Curso,3313,0,2,6,Curso,Figueiró Dos Vinhos,Leiria,Centro,-8.331926,39.910359,Movimento de massa
44314523,20260846013,5,Despacho de 1º Alerta,Em Despacho,17/06/2026 14:20,1781702400000,2026-06-17,14:20,2026,0/01:12,72,---,3301,3301 - Queda de Árvore,Lisboa e Vale do Tejo,Oeste,Alcobaça,São Martinho do Porto,SÃO MARTINHO DO PORTO,Fundação Manuel Francisco Clerigo,2,0,2,1,0,1,39.510842,-9.131915,39.510842°N 9.131915°W,"39°30,6480'N 9°7,9140'W ","39° 30' 38,88'' N 9° 7' 54,84'' W ",1781710320000,33 - Em Despacho,Intervenções em Infraestruturas e vias de comunicação,27368036,-9.131915,39.510842,20260846013,SÃO MARTINHO DO PORTO,Lisboa e Vale do Tejo,2026-06-17T13:20:00Z,2026-06-17,Despacho De 1º Alerta,3301,0,1,2,Despacho De 1º Alerta,Alcobaça,Leiria,Centro,-9.131915,39.510842,Queda de Árvore
44314536,20260846247,5,Despacho de 1º Alerta,Em Despacho,17/06/2026 15:06,1781705160000,2026-06-17,15:06,2026,0/00:26,26,---,3301,3301 - Queda de Árvore,Norte,Douro,Tabuaço,Távora e Pereiro,União das Freguesias de Távora e Pereiro,"Távora, Tabuaço, Portugal",5,0,5,1,0,1,41.09923,-7.53329,41.099230°N 7.533290°W,"41°5,9520'N 7°31,9980'W ","41° 5' 57,12'' N 7° 31' 59,88'' W ",1781710320000,33 - Em Despacho,Intervenções em Infraestruturas e vias de comunicação,27368270,-7.53329,41.09923,20260846247,União das Freguesias de Távora e Pereiro,Norte,2026-06-17T14:06:00Z,2026-06-17,Despacho De 1º Alerta,3301,0,1,5,Despacho De 1º Alerta,Tabuaço,Viseu,Norte,-7.53329,41.09923,Queda de Árvore
44314545,20260846329,5,Despacho de 1º Alerta,Em Despacho,17/06/2026 15:00,1781704800000,2026-06-17,15:00,2026,0/00:32,32,---,3315,3315 - Inundação de estruturas ou superfícies por precipitação intensa,Norte,Douro,São João da Pesqueira,Ervedosa do Douro,ERVEDOSA,Escola Primária de Ervedosa do Douro,5,0,5,1,0,1,41.16753,-7.479562,41.167530°N 7.479562°W,"41°10,0500'N 7°28,7760'W ","41° 10' 3,00'' N 7° 28' 46,56'' W ",1781710320000,33 - Em Despacho,Intervenções em Infraestruturas e vias de comunicação,27368352,-7.479562,41.16753,20260846329,ERVEDOSA,Norte,2026-06-17T14:00:00Z,2026-06-17,Despacho De 1º Alerta,3315,0,1,5,Despacho De 1º Alerta,São João Da Pesqueira,Viseu,Norte,-7.479562,41.16753,Inundação de estruturas ou superfícies por precipitação intensa
44314547,20260846340,5,Despacho de 1º Alerta,Em Despacho,17/06/2026 15:00,1781704800000,2026-06-17,15:00,2026,0/00:32,32,---,3315,3315 - Inundação de estruturas ou superfícies por precipitação intensa,Norte,Douro,São João da Pesqueira,Ervedosa do Douro,ERVEDOSA,Rua da Praça Nº72,5,0,5,1,0,1,41.165844,-7.483745,41.165844°N 7.483745°W,"41°9,9480'N 7°29,0220'W ","41° 9' 56,88'' N 7° 29' 1,32'' W ",1781710320000,33 - Em Despacho,Intervenções em Infraestruturas e vias de comunicação,27368363,-7.483745,41.165844,20260846340,ERVEDOSA,Norte,2026-06-17T14:00:00Z,2026-06-17,Despacho De 1º Alerta,3315,0,1,5,Despacho De 1º Alerta,São João Da Pesqueira,Viseu,Norte,-7.483745,41.165844,Inundação de estruturas ou superfícies por precipitação intensa
44314548,20260846344,5,Despacho de 1º Alerta,Em Despacho,17/06/2026 15:19,1781705940000,2026-06-17,15:19,2026,0/00:13,13,---,3315,3315 - Inundação de estruturas ou superfícies por precipitação intensa,Norte,Douro,Tabuaço,Chavães,CHAVÃES,Rua da Portela nº 8,2,0,2,1,0,1,41.086194,-7.577355,41.086194°N 7.577355°W,"41°5,1720'N 7°34,6440'W ","41° 5' 10,32'' N 7° 34' 38,64'' W ",1781710320000,33 - Em Despacho,Intervenções em Infraestruturas e vias de comunicação,27368367,-7.577355,41.086194,20260846344,CHAVÃES,Norte,2026-06-17T14:19:00Z,2026-06-17,Despacho De 1º Alerta,3315,0,1,2,Despacho De 1º Alerta,Tabuaço,Viseu,Norte,-7.577355,41.086194,Inundação de estruturas ou superfícies por precipitação intensa
