id,address,subregion,neighborhood,date,id.1,state,nature,nature_description,aerial_means,terrestrial_means,aquatic_means,operational,date.1,Concelho,Distrito,NUTII_DSG,longitude,latitude
24875937,Açores e Velosa,Beiras e Serra da Estrela,310,2025-01-27T09:15:00Z,24875937,Em despacho,3301,Queda de árvore,0,2,0,4,2025-01-27T09:15:00Z,Celorico Da Beira,Guarda,Centro,-7.293622,40.654959
24878043,Salto,Alto Tâmega e Barroso,309,2025-01-27T14:30:00Z,24878043,Em despacho,3301,Queda de árvore,0,1,0,4,2025-01-27T14:30:00Z,Montalegre,Vila Real,Norte,-7.930242,41.659104
24879177,Lavos,Região de Coimbra,310,2025-01-27T18:13:00Z,24879177,Em despacho,3301,Queda de árvore,0,2,0,7,2025-01-27T18:13:00Z,Figueira Da Foz,Coimbra,Centro,-8.827295,40.092169
24879313,"Almada, Cova da Piedade, Pragal e Cacilhas",Península de Setúbal,311,2025-01-27T18:30:00Z,24879313,Em conclusão,3329,Queda de estruturas temporárias ou móveis,0,2,0,6,2025-01-27T18:30:00Z,Almada,Setúbal,Área Metropolitana De Lisboa,-9.173069,38.677312
24879461,Caparica e Trafaria,Península de Setúbal,311,2025-01-27T18:15:00Z,24879461,Em curso,3301,Queda de árvore,0,1,0,3,2025-01-27T18:15:00Z,Almada,Setúbal,Área Metropolitana De Lisboa,-9.198172,38.665376
24851780,"São Miguel, Santa Eufémia e Rabaçal",Região de Coimbra,310,2025-01-21T23:25:00Z,24851780,Em curso,3315,Inundação de estruturas por precipitação intensa,0,0,0,0,2025-01-21T23:25:00Z,Penela,Coimbra,Centro,-8.399036,40.025502
24878704,Salto,Alto Tâmega e Barroso,309,2025-01-27T16:44:00Z,24878704,Em despacho,1107,Nevão,0,3,0,6,2025-01-27T16:44:00Z,Montalegre,Vila Real,Norte,-7.953108,41.639334
24879336,Santo Estêvão,Lezíria do Tejo,311,2025-01-27T18:47:00Z,24879336,Em resolução,3301,Queda de árvore,0,1,0,5,2025-01-27T18:47:00Z,Benavente,Santarém,Alentejo,-8.679095,38.897528
24879405,Cinco Vilas e Reigada,Beiras e Serra da Estrela,310,2025-01-27T19:03:00Z,24879405,Em resolução,3311,Queda de elementos de estruturas edificados,0,3,0,5,2025-01-27T19:03:00Z,Figueira De Castelo Rodrigo,Guarda,Centro,-6.955238,40.802385
24879421,Carregado e Cadafais,Oeste,311,2025-01-27T19:09:00Z,24879421,Em despacho,3301,Queda de árvore,0,3,0,5,2025-01-27T19:09:00Z,Alenquer,Lisboa,Centro,-8.98,39.0264
24879464,Mafamude e Vilar do Paraíso,Area M. Porto,309,2025-01-27T19:16:00Z,24879464,Em despacho,3311,Queda de elementos de estruturas edificados,0,1,0,5,2025-01-27T19:16:00Z,Vila Nova De Gaia,Porto,Norte,-8.611105,41.107184
24879578,Valado Dos Frades,Oeste,311,2025-01-27T19:44:00Z,24879578,Em curso,3301,Queda de árvore,0,1,0,2,2025-01-27T19:44:00Z,Nazaré,Leiria,Centro,-9.041021,39.584542
24879597,Gondar,Ave,309,2025-01-27T19:56:00Z,24879597,Em despacho,3317,Inundação de estruturas por água canalizada,0,0,0,0,2025-01-27T19:56:00Z,Guimarães,Braga,Norte,-8.37351,41.42217
24874564,"Sé, Santa Maria e Meixedo",Terras de Trás-os-Montes,309,2025-01-26T21:55:00Z,24874564,Em curso,3315,Inundação de estruturas por precipitação intensa,0,1,0,2,2025-01-26T21:55:00Z,Bragança,Bragança,Norte,-6.761223,41.813164
24876200,Ceira,Região de Coimbra,310,2025-01-27T09:56:00Z,24876200,Em despacho,3315,Inundação de estruturas por precipitação intensa,0,1,0,2,2025-01-27T09:56:00Z,Coimbra,Coimbra,Centro,-8.376144,40.175952
24876893,"Sé, Santa Maria e Meixedo",Terras de Trás-os-Montes,309,2025-01-27T11:22:00Z,24876893,Em curso,3315,Inundação de estruturas por precipitação intensa,0,1,0,1,2025-01-27T11:22:00Z,Bragança,Bragança,Norte,-6.761223,41.813164
24878747,Costa da Caparica,Península de Setúbal,311,2025-01-27T16:45:00Z,24878747,Em despacho,3301,Queda de árvore,0,1,0,3,2025-01-27T16:45:00Z,Almada,Setúbal,Área Metropolitana De Lisboa,-9.227696,38.642583
24878958,"Mogadouro, Valverde, Vale de Porco e Vilar de Rei",Terras de Trás-os-Montes,309,2025-01-27T17:29:00Z,24878958,Em curso,3315,Inundação de estruturas por precipitação intensa,0,1,0,2,2025-01-27T17:29:00Z,Mogadouro,Bragança,Norte,-6.706687,41.339826
24879090,"N. S. da Vila, N. S. do Bispo e Silveiras",Alentejo Central,312,2025-01-27T17:53:00Z,24879090,Em despacho,3301,Queda de árvore,0,1,0,2,2025-01-27T17:53:00Z,Montemor-o-Novo,Évora,Alentejo,-8.206765,38.623083
24879183,Santo António Dos Olivais,Região de Coimbra,310,2025-01-27T17:59:00Z,24879183,Em despacho,3315,Inundação de estruturas por precipitação intensa,0,1,0,3,2025-01-27T17:59:00Z,Coimbra,Coimbra,Centro,-8.426807,40.217261
24875758,Valhelhas,Beiras e Serra da Estrela,310,2025-01-27T08:41:00Z,24875758,Em curso,3301,Queda de árvore,0,1,0,2,2025-01-27T08:41:00Z,Guarda,Guarda,Centro,-7.405093,40.406271
24877003,Malagueira e Horta Das Figueiras,Alentejo Central,312,2025-01-27T11:41:00Z,24877003,Em conclusão,3315,Inundação de estruturas por precipitação intensa,0,1,0,2,2025-01-27T11:41:00Z,Évora,Évora,Alentejo,-7.924277,38.57285
24878057,Salto,Alto Tâmega e Barroso,309,2025-01-27T14:42:00Z,24878057,Em despacho,3301,Queda de árvore,0,1,0,4,2025-01-27T14:42:00Z,Montalegre,Vila Real,Norte,-7.929191,41.611383
24878657,"S.maria, S.miguel, S.martinho, S.pedro Penaferrim",Grande Lisboa,311,2025-01-27T16:38:00Z,24878657,Em despacho,3321,Dano na rede de fornecimento de eletricidade ,0,1,0,2,2025-01-27T16:38:00Z,Sintra,Lisboa,Área Metropolitana De Lisboa,-9.363811,38.743917
24878882,Poceirão e Marateca,Península de Setúbal,311,2025-01-27T17:16:00Z,24878882,Em conclusão,3301,Queda de árvore,0,1,0,1,2025-01-27T17:16:00Z,Palmela,Setúbal,Área Metropolitana De Lisboa,-8.741193,38.629608
24878984,"Sé, Santa Maria e Meixedo",Terras de Trás-os-Montes,309,2025-01-27T17:32:00Z,24878984,Em curso,3315,Inundação de estruturas por precipitação intensa,0,1,0,2,2025-01-27T17:32:00Z,Bragança,Bragança,Norte,-6.761223,41.813164
24879569,Castanheira do Ribatejo e Cachoeiras,Grande Lisboa,311,2025-01-27T19:35:00Z,24879569,Em despacho,3301,Queda de árvore,0,1,0,5,2025-01-27T19:35:00Z,Vila Franca De Xira,Lisboa,Área Metropolitana De Lisboa,-8.966389,38.987034
24879277,Foz de Arouce e Casal de Ermio,Região de Coimbra,310,2025-01-27T18:30:00Z,24879277,Em curso,3301,Queda de árvore,0,0,0,0,2025-01-27T18:30:00Z,Lousã,Coimbra,Centro,-8.25635,40.153628
24879284,a Dos Cunhados e Maceira,Oeste,311,2025-01-27T18:32:00Z,24879284,Em resolução,3309,Desabamento de estruturas edificadas,0,1,0,1,2025-01-27T18:32:00Z,Torres Vedras,Lisboa,Centro,-9.336366,39.162143
24879409,"Sandim, Olival, Lever e Crestuma",Area M. Porto,309,2025-01-27T19:00:00Z,24879409,Em despacho,3315,Inundação de estruturas por precipitação intensa,0,1,0,2,2025-01-27T19:00:00Z,Vila Nova De Gaia,Porto,Norte,-8.507685,41.028387
