id,address,subregion,neighborhood,date,id.1,state,nature,nature_description,aerial_means,terrestrial_means,aquatic_means,operational,date.1,Concelho,Distrito,NUTII_DSG,longitude,latitude
25277185,"Alto do Seixalinho, Santo André e Verderena",Península de Setúbal,311,2025-04-23T15:06:00Z,25277185,Em curso,3317,Inundação de estruturas por água canalizada,0,1,0,4,2025-04-23T15:06:00Z,Barreiro,Setúbal,Área Metropolitana De Lisboa,-9.065968,38.6593
25277303,Arcos de Valdevez (São Paio) e Giela,Alto Minho,309,2025-04-23T15:44:00Z,25277303,Em despacho,3301,Queda de árvore,0,1,0,2,2025-04-23T15:44:00Z,Arcos De Valdevez,Viana Do Castelo,Norte,-8.407297,41.847054
25277955,"Sé, Santa Maria e Meixedo",Terras de Trás-os-Montes,309,2025-04-23T17:49:00Z,25277955,Em despacho,3311,Queda de elementos de estruturas edificados,0,2,0,4,2025-04-23T17:49:00Z,Bragança,Bragança,Norte,-6.761223,41.813164
25278039,Loures,Grande Lisboa,311,2025-04-23T18:30:00Z,25278039,Em despacho,3317,Inundação de estruturas por água canalizada,0,0,0,0,2025-04-23T18:30:00Z,Loures,Lisboa,Área Metropolitana De Lisboa,-9.1672,38.82474
25277926,Lousã e Vilarinho,Região de Coimbra,310,2025-04-23T17:56:00Z,25277926,Em despacho,3301,Queda de árvore,0,1,0,2,2025-04-23T17:56:00Z,Lousã,Coimbra,Centro,-8.257429,40.102293
25071496,São Manços e São Vicente do Pigeiro,Alentejo Central,312,2025-03-11T13:18:00Z,25071496,Em conclusão,1101,Cheia,0,0,0,0,2025-03-11T13:18:00Z,Évora,Évora,Alentejo,-7.713313,38.513673
