id,address,subregion,neighborhood,date,id.1,state,nature,nature_description,aerial_means,terrestrial_means,aquatic_means,operational,date.1,Concelho,Distrito,NUTII_DSG,longitude,latitude
24775614,São Martinho do Bispo e Ribeira de Frades,Região de Coimbra,310,2025-01-05T07:53:00Z,24775614,Em despacho,3321,Dano na rede de fornecimento de eletricidade ,0,2,0,5,2025-01-05T07:53:00Z,Coimbra,Coimbra,Centro,-8.468894,40.19112
24775623,Setúbal (São Sebastião),Península de Setúbal,311,2025-01-05T08:01:00Z,24775623,Em despacho,3321,Dano na rede de fornecimento de eletricidade ,0,1,0,5,2025-01-05T08:01:00Z,Setúbal,Setúbal,Área Metropolitana De Lisboa,-8.85635,38.51176
24775643,Oleiros-Amieira,Beira Baixa,310,2025-01-05T08:03:00Z,24775643,Em despacho,3301,Queda de árvore,0,1,0,2,2025-01-05T08:03:00Z,Oleiros,Castelo Branco,Centro,-7.896733,39.926411
24775604,Agualva e Mira-Sintra,Grande Lisboa,311,2025-01-05T07:51:00Z,24775604,Em curso,3301,Queda de árvore,0,1,0,4,2025-01-05T07:51:00Z,Sintra,Lisboa,Área Metropolitana De Lisboa,-9.294104,38.769933
24775669,Sacavém e Prior Velho,Grande Lisboa,311,2025-01-05T08:20:00Z,24775669,Em despacho,3311,Queda de elementos de estruturas edificados,0,1,0,4,2025-01-05T08:20:00Z,Loures,Lisboa,Área Metropolitana De Lisboa,-9.126385,38.791217
24775671,Fornelos e Queijada,Alto Minho,309,2025-01-05T08:13:00Z,24775671,Em curso,3301,Queda de árvore,0,1,0,3,2025-01-05T08:13:00Z,Ponte De Lima,Viana Do Castelo,Norte,-8.540544,41.732269
24775627,Malveira e São Miguel de Alcainça,Grande Lisboa,311,2025-01-05T07:52:00Z,24775627,Em curso,3301,Queda de árvore,0,2,0,5,2025-01-05T07:52:00Z,Mafra,Lisboa,Área Metropolitana De Lisboa,-9.255135,38.927865
24775663,Cartaxo e Vale da Pinta,Lezíria do Tejo,311,2025-01-05T08:13:00Z,24775663,Em resolução,3321,Dano na rede de fornecimento de eletricidade ,0,3,0,8,2025-01-05T08:13:00Z,Cartaxo,Santarém,Alentejo,-8.78436,39.16016
24775692,Souto da Casa,Beiras e Serra da Estrela,310,2025-01-05T08:19:00Z,24775692,Em despacho,3301,Queda de árvore,0,2,0,4,2025-01-05T08:19:00Z,Fundão,Castelo Branco,Centro,-7.550085,40.120713
