id,address,subregion,neighborhood,date,id.1,state,nature,nature_description,aerial_means,terrestrial_means,aquatic_means,operational,date.1,Concelho,Distrito,NUTII_DSG,longitude,latitude
24775828,São João da Madeira,Area M. Porto,309,2025-01-05T08:50:00Z,24775828,Em despacho,3315,Inundação de estruturas por precipitação intensa,0,1,0,2,2025-01-05T08:50:00Z,São João Da Madeira,Aveiro,Norte,-8.490365,40.895632
24775829,Encosta do Sol,Grande Lisboa,311,2025-01-05T08:58:00Z,24775829,Em conclusão,3321,Dano na rede de fornecimento de eletricidade ,0,1,0,6,2025-01-05T08:58:00Z,Amadora,Lisboa,Área Metropolitana De Lisboa,-9.2229120000000009,38.781348
24775928,"Nogueira, Fraião e Lamaçães",Cávado,309,2025-01-05T09:26:00Z,24775928,Em despacho,3301,Queda de árvore,0,1,0,2,2025-01-05T09:26:00Z,Braga,Braga,Norte,-8.399912,41.531469
24775750,Tocha,Região de Coimbra,310,2025-01-05T08:35:00Z,24775750,Em curso,3315,Inundação de estruturas por precipitação intensa,0,1,0,2,2025-01-05T08:35:00Z,Cantanhede,Coimbra,Centro,-8.840309,40.328939
24775859,"Cedofeita, Ildefonso, Sé, Miragaia, Nicolau e Vitória",Area M. Porto,309,2025-01-05T09:06:00Z,24775859,Em despacho,3315,Inundação de estruturas por precipitação intensa,0,1,0,5,2025-01-05T09:06:00Z,Porto,Porto,Norte,-8.615939,41.15359
24775868,Arcozelo,Alto Minho,309,2025-01-05T08:15:00Z,24775868,Em conclusão,3301,Queda de árvore,0,1,0,3,2025-01-05T08:15:00Z,Ponte De Lima,Viana Do Castelo,Norte,-8.600628,41.788428
24775875,Alcanena e Vila Moreira,Médio Tejo,311,2025-01-05T09:16:00Z,24775875,Em resolução,3315,Inundação de estruturas por precipitação intensa,0,3,0,8,2025-01-05T09:16:00Z,Alcanena,Santarém,Centro,-8.666413,39.458072
24775669,Sacavém e Prior Velho,Grande Lisboa,311,2025-01-05T08:20:00Z,24775669,Em conclusão,3311,Queda de elementos de estruturas edificados,0,1,0,3,2025-01-05T08:20:00Z,Loures,Lisboa,Área Metropolitana De Lisboa,-9.126385,38.791217
24775671,Fornelos e Queijada,Alto Minho,309,2025-01-05T08:13:00Z,24775671,Em resolução,3301,Queda de árvore,0,0,0,0,2025-01-05T08:13:00Z,Ponte De Lima,Viana Do Castelo,Norte,-8.563123,41.752173
24775869,"Ovar, São João, Arada e São Vicente de Pereira Jusã",Região de Aveiro,310,2025-01-05T09:19:00Z,24775869,Em despacho,3315,Inundação de estruturas por precipitação intensa,0,1,0,2,2025-01-05T09:19:00Z,Ovar,Aveiro,Centro,-8.632482,40.864029
24775692,Souto da Casa,Beiras e Serra da Estrela,310,2025-01-05T08:19:00Z,24775692,Em despacho,3301,Queda de árvore,0,3,0,6,2025-01-05T08:19:00Z,Fundão,Castelo Branco,Centro,-7.550085,40.120713
24775833,Santo António da Charneca,Península de Setúbal,311,2025-01-05T09:03:00Z,24775833,Em despacho,3321,Dano na rede de fornecimento de eletricidade ,0,1,0,5,2025-01-05T09:03:00Z,Barreiro,Setúbal,Área Metropolitana De Lisboa,-9.029919,38.624451
24775883,Charneca de Caparica e Sobreda,Península de Setúbal,311,2025-01-05T09:20:00Z,24775883,Em despacho,3301,Queda de árvore,0,1,0,5,2025-01-05T09:20:00Z,Almada,Setúbal,Área Metropolitana De Lisboa,-9.190193,38.591584
