id,address,subregion,neighborhood,date,id.1,state,nature,nature_description,aerial_means,terrestrial_means,aquatic_means,operational,date.1,Concelho,Distrito,NUTII_DSG,longitude,latitude
25071496,São Manços e São Vicente do Pigeiro,Alentejo Central,312,2025-03-11T13:18:00Z,25071496,Em conclusão,1101,Cheia,0,0,0,0,2025-03-11T13:18:00Z,Évora,Évora,Alentejo,-7.713313,38.513673
25299253,Malagueira e Horta Das Figueiras,Alentejo Central,312,2025-04-28T13:20:00Z,25299253,Em despacho,3317,Inundação de estruturas por água canalizada,0,1,0,2,2025-04-28T13:20:00Z,Évora,Évora,Alentejo,-7.917338,38.579056
25302714,Rio Torto e Lagarinhos,Beiras e Serra da Estrela,310,2025-04-29T07:18:00Z,25302714,Em despacho,3301,Queda de árvore,0,1,0,2,2025-04-29T07:18:00Z,Gouveia,Guarda,Centro,-7.66867,40.483041
25301542,Samora Correia,Lezíria do Tejo,311,2025-04-28T21:53:00Z,25301542,Em despacho,3317,Inundação de estruturas por água canalizada,0,1,0,3,2025-04-28T21:53:00Z,Benavente,Santarém,Alentejo,-8.868908,38.935447
25301572,Ramalde,Area M. Porto,309,2025-04-28T22:03:00Z,25301572,Em despacho,3317,Inundação de estruturas por água canalizada,0,0,0,0,2025-04-28T22:03:00Z,Porto,Porto,Norte,-8.63784,41.17182
25300315,Bonfim,Area M. Porto,309,2025-04-28T16:56:00Z,25300315,Em despacho,3315,Inundação de estruturas por precipitação intensa,0,0,0,0,2025-04-28T16:56:00Z,Porto,Porto,Norte,-8.59788,41.14874
