id,address,subregion,neighborhood,date,id.1,state,nature,nature_description,aerial_means,terrestrial_means,aquatic_means,operational,date.1,Concelho,Distrito,NUTII_DSG,longitude,latitude
24851780,"São Miguel, Santa Eufémia e Rabaçal",Região de Coimbra,310,2025-01-21T23:25:00Z,24851780,Em curso,3315,Inundação de estruturas por precipitação intensa,0,0,0,0,2025-01-21T23:25:00Z,Penela,Coimbra,Centro,-8.399036,40.025502
24889581,Grândola e Santa Margarida da Serra,Alentejo Litoral,312,2025-01-29T20:32:00Z,24889581,Em curso,3301,Queda de árvore,0,2,0,5,2025-01-29T20:32:00Z,Grândola,Setúbal,Alentejo,-8.5587510000000009,38.173088
24889733,"Sé, Santa Maria e Meixedo",Terras de Trás-os-Montes,309,2025-01-29T21:44:00Z,24889733,Em resolução,3315,Inundação de estruturas por precipitação intensa,0,1,0,2,2025-01-29T21:44:00Z,Bragança,Bragança,Norte,-6.761223,41.813164
24890161,Semide e Rio Vide,Região de Coimbra,310,2025-01-30T01:24:00Z,24890161,Em despacho,3301,Queda de árvore,0,1,0,2,2025-01-30T01:24:00Z,Miranda Do Corvo,Coimbra,Centro,-8.338528,40.160715
24888768,Salvaterra de Magos e Foros de Salvaterra,Lezíria do Tejo,311,2025-01-29T17:55:00Z,24888768,Em conclusão,3301,Queda de árvore,0,2,0,7,2025-01-29T17:55:00Z,Salvaterra De Magos,Santarém,Alentejo,-8.742882,39.064162
24890231,"Ovar, São João, Arada e São Vicente de Pereira Jusã",Região de Aveiro,310,2025-01-30T02:34:00Z,24890231,Em resolução,1115,Galgamento costeiro,0,1,0,1,2025-01-30T02:34:00Z,Ovar,Aveiro,Centro,-8.671695,40.872857
24877003,Malagueira e Horta Das Figueiras,Alentejo Central,312,2025-01-27T11:41:00Z,24877003,Em conclusão,3315,Inundação de estruturas por precipitação intensa,0,0,0,0,2025-01-27T11:41:00Z,Évora,Évora,Alentejo,-7.924277,38.57285
24890198,São José da Lamarosa,Lezíria do Tejo,311,2025-01-30T02:06:00Z,24890198,Em resolução,3301,Queda de árvore,0,2,0,6,2025-01-30T02:06:00Z,Coruche,Santarém,Alentejo,-8.473502,39.061607
24890228,"S.maria, S.miguel, S.martinho, S.pedro Penaferrim",Grande Lisboa,311,2025-01-30T02:27:00Z,24890228,Em curso,3301,Queda de árvore,0,1,0,5,2025-01-30T02:27:00Z,Sintra,Lisboa,Área Metropolitana De Lisboa,-9.387899,38.805813
