id,address,subregion,neighborhood,date,id.1,state,nature,nature_description,aerial_means,terrestrial_means,aquatic_means,operational,date.1,Concelho,Distrito,NUTII_DSG,longitude,latitude
24908415,São Félix da Marinha,Area M. Porto,309,2025-02-03T09:40:00Z,24908415,Em despacho,3315,Inundação de estruturas por precipitação intensa,0,1,0,4,2025-02-03T09:40:00Z,Vila Nova De Gaia,Porto,Norte,-8.629189,41.030125
24851780,"São Miguel, Santa Eufémia e Rabaçal",Região de Coimbra,310,2025-01-21T23:25:00Z,24851780,Em curso,3315,Inundação de estruturas por precipitação intensa,0,0,0,0,2025-01-21T23:25:00Z,Penela,Coimbra,Centro,-8.399036,40.025502
24908584,"Ovar, São João, Arada e São Vicente de Pereira Jusã",Região de Aveiro,310,2025-02-03T10:19:00Z,24908584,Em despacho,3301,Queda de árvore,0,1,0,2,2025-02-03T10:19:00Z,Ovar,Aveiro,Centro,-8.632482,40.864029
24877003,Malagueira e Horta Das Figueiras,Alentejo Central,312,2025-01-27T11:41:00Z,24877003,Em conclusão,3315,Inundação de estruturas por precipitação intensa,0,0,0,0,2025-01-27T11:41:00Z,Évora,Évora,Alentejo,-7.924277,38.57285
24908580,Távora e Pereiro,Douro,309,2025-02-03T10:19:00Z,24908580,Em curso,3301,Queda de árvore,0,1,0,2,2025-02-03T10:19:00Z,Tabuaço,Viseu,Norte,-7.530812,41.100368
