id,address,subregion,neighborhood,date,id.1,state,nature,nature_description,aerial_means,terrestrial_means,aquatic_means,operational,date.1,Concelho,Distrito,NUTII_DSG,longitude,latitude
25499380,Freiriz,Cávado,309,2025-06-09T09:54:00Z,25499380,Em despacho,3107,Consolidação de rescaldo de incêndio rural,0,5,0,15,2025-06-09T09:54:00Z,Vila Verde,Braga,Norte,-8.502703,41.633588
25499564,Vila Franca de Xira,Grande Lisboa,311,2025-06-09T10:26:00Z,25499564,Em conclusão,2101,Incêndio em edifícios habitacionais,0,5,0,14,2025-06-09T10:26:00Z,Vila Franca De Xira,Lisboa,Área Metropolitana De Lisboa,-8.984616,38.97222
25499578,Charneca de Caparica e Sobreda,Península de Setúbal,311,2025-06-09T10:21:00Z,25499578,Em conclusão,3103,Incêndio rural,0,2,0,7,2025-06-09T10:21:00Z,Almada,Setúbal,Área Metropolitana De Lisboa,-9.194473,38.648295
25499287,"Aldeia do Bispo, Águas e Aldeia de João Pires",Beira Baixa,310,2025-06-09T09:45:00Z,25499287,Em conclusão,2301,Incêndio em transporte rodoviário,0,3,0,8,2025-06-09T09:45:00Z,Penamacor,Castelo Branco,Centro,-7.142657,40.083078
25499452,Penha Garcia,Beira Baixa,310,2025-06-09T10:10:00Z,25499452,Em conclusão,3201,Detritos não confinados,0,4,0,11,2025-06-09T10:10:00Z,Idanha-a-Nova,Castelo Branco,Centro,-7.012832,40.039362
25499470,Agualva e Mira-Sintra,Grande Lisboa,311,2025-06-09T10:13:00Z,25499470,Em conclusão,3103,Incêndio rural,0,1,0,5,2025-06-09T10:13:00Z,Sintra,Lisboa,Área Metropolitana De Lisboa,-9.29534,38.76655
25498388,Ceira,Região de Coimbra,310,2025-06-09T03:57:00Z,25498388,Em conclusão,2127,"Incêndio em edifícios e recintos industriais, oficinas e armazéns",0,4,0,15,2025-06-09T03:57:00Z,Coimbra,Coimbra,Centro,-8.39222,40.18194
25499426,"Aldeia do Bispo, Águas e Aldeia de João Pires",Beira Baixa,310,2025-06-09T09:59:00Z,25499426,Em conclusão,3105,Incêndio rural,0,4,0,6,2025-06-09T09:59:00Z,Penamacor,Castelo Branco,Centro,-7.142657,40.083078
