id,address,subregion,neighborhood,date,id.1,state,nature,nature_description,aerial_means,terrestrial_means,aquatic_means,operational,date.1,Concelho,Distrito,NUTII_DSG,longitude,latitude
24776500,Sesimbra (Castelo),Península de Setúbal,311,2025-01-05T11:34:00Z,24776500,Em curso,3301,Queda de árvore,0,2,0,5,2025-01-05T11:34:00Z,Sesimbra,Setúbal,Área Metropolitana De Lisboa,-9.179861,38.512406
24777963,Gonçalo,Beiras e Serra da Estrela,310,2025-01-05T16:20:00Z,24777963,Em despacho,3315,Inundação de estruturas por precipitação intensa,0,1,0,2,2025-01-05T16:20:00Z,Guarda,Guarda,Centro,-7.35192,40.420334
24778024,Sabugal e Aldeia de Santo António,Beiras e Serra da Estrela,310,2025-01-05T16:28:00Z,24778024,Em despacho,3315,Inundação de estruturas por precipitação intensa,0,1,0,4,2025-01-05T16:28:00Z,Sabugal,Guarda,Centro,-7.106719,40.35088
24778238,Santa Marinha e São Pedro da Afurada,Area M. Porto,309,2025-01-05T17:11:00Z,24778238,Em despacho,3317,Inundação de estruturas por água canalizada,0,1,0,3,2025-01-05T17:11:00Z,Vila Nova De Gaia,Porto,Norte,-8.624714,41.132843
24776928,Monchique,Algarve,313,2025-01-05T12:40:00Z,24776928,Em despacho,3313,Deslizamento de terras,0,1,0,3,2025-01-05T12:40:00Z,Monchique,Faro,Algarve,-8.598954,37.311622
24777071,Pedrógão Grande,Região de Leiria,310,2025-01-05T13:18:00Z,24777071,Em conclusão,3309,Desabamento de estruturas edificadas,0,1,0,1,2025-01-05T13:18:00Z,Pedrógão Grande,Leiria,Centro,-8.177567,39.933038
24776541,Minde,Médio Tejo,311,2025-01-05T11:42:00Z,24776541,Em curso,3315,Inundação de estruturas por precipitação intensa,0,1,0,4,2025-01-05T11:42:00Z,Alcanena,Santarém,Centro,-8.691237,39.511095
24777375,Guarda,Beiras e Serra da Estrela,310,2025-01-05T14:16:00Z,24777375,Em despacho,3315,Inundação de estruturas por precipitação intensa,0,1,0,2,2025-01-05T14:16:00Z,Guarda,Guarda,Centro,-7.260869,40.536751
24777926,"Gondifelos, Cavalões e Outiz",Ave,309,2025-01-05T16:02:00Z,24777926,Em despacho,3315,Inundação de estruturas por precipitação intensa,0,1,0,2,2025-01-05T16:02:00Z,Vila Nova De Famalicão,Braga,Norte,-8.562923,41.414107
24778178,Sátão,Viseu Dão Lafões,310,2025-01-05T17:16:00Z,24778178,Em despacho,3301,Queda de árvore,0,1,0,2,2025-01-05T17:16:00Z,Sátão,Viseu,Centro,-7.74005,40.742885
24777768,Joane,Ave,309,2025-01-05T15:43:00Z,24777768,Em despacho,3313,Deslizamento de terras,0,1,0,3,2025-01-05T15:43:00Z,Vila Nova De Famalicão,Braga,Norte,-8.42238,41.440941
24777783,"Nogueira, Fraião e Lamaçães",Cávado,309,2025-01-05T15:47:00Z,24777783,Em curso,3315,Inundação de estruturas por precipitação intensa,0,1,0,2,2025-01-05T15:47:00Z,Braga,Braga,Norte,-8.399912,41.531469
24777785,Peniche,Oeste,311,2025-01-05T15:45:00Z,24777785,Em curso,1103,Vento forte,0,15,0,43,2025-01-05T15:45:00Z,Peniche,Leiria,Centro,-9.376833,39.357166
24778019,Quiaios,Região de Coimbra,310,2025-01-05T16:34:00Z,24778019,Em despacho,3315,Inundação de estruturas por precipitação intensa,0,1,0,3,2025-01-05T16:34:00Z,Figueira Da Foz,Coimbra,Centro,-8.892014,40.217842
24778135,Aljezur,Algarve,313,2025-01-05T17:05:00Z,24778135,Em despacho,3311,Queda de elementos de estruturas edificados,0,1,0,2,2025-01-05T17:05:00Z,Aljezur,Faro,Algarve,-8.834795,37.320368
24778185,"S.julião, N.s. da Anunciada e S. Maria da Graça",Península de Setúbal,311,2025-01-05T17:11:00Z,24778185,Em despacho,3311,Queda de elementos de estruturas edificados,0,2,0,7,2025-01-05T17:11:00Z,Setúbal,Setúbal,Área Metropolitana De Lisboa,-8.889983,38.529955
24778123,Alverca do Ribatejo e Sobralinho,Grande Lisboa,311,2025-01-05T16:58:00Z,24778123,Em despacho,3315,Inundação de estruturas por precipitação intensa,0,1,0,2,2025-01-05T16:58:00Z,Vila Franca De Xira,Lisboa,Área Metropolitana De Lisboa,-9.046012,38.896362
24778196,"Nogueira, Fraião e Lamaçães",Cávado,309,2025-01-05T17:00:00Z,24778196,Em despacho,3315,Inundação de estruturas por precipitação intensa,0,1,0,3,2025-01-05T17:00:00Z,Braga,Braga,Norte,-8.399912,41.531469
24778223,Buarcos,Região de Coimbra,310,2025-01-05T16:50:00Z,24778223,Em despacho,3315,Inundação de estruturas por precipitação intensa,0,1,0,6,2025-01-05T16:50:00Z,Figueira Da Foz,Coimbra,Centro,-8.880897,40.168384
24778217,Viseu,Viseu Dão Lafões,310,2025-01-05T17:25:00Z,24778217,Em despacho,3315,Inundação de estruturas por precipitação intensa,0,1,0,2,2025-01-05T17:25:00Z,Viseu,Viseu,Centro,-7.908451,40.659587
24778284,Nogueiró e Tenões,Cávado,309,2025-01-05T17:10:00Z,24778284,Em despacho,3315,Inundação de estruturas por precipitação intensa,0,1,0,2,2025-01-05T17:10:00Z,Braga,Braga,Norte,-8.38588,41.558044
24778287,"Torres Novas (São Pedro), Lapas e Ribeira Branca",Médio Tejo,311,2025-01-05T17:43:00Z,24778287,Em despacho,3315,Inundação de estruturas por precipitação intensa,0,1,0,2,2025-01-05T17:43:00Z,Torres Novas,Santarém,Centro,-8.559665,39.481931
