id,address,subregion,neighborhood,date,id.1,state,nature,nature_description,aerial_means,terrestrial_means,aquatic_means,operational,date.1,Concelho,Distrito,NUTII_DSG,longitude,latitude
25466369,Melides,Alentejo Litoral,312,2025-06-02T13:27:00Z,25466369,Em conclusão,3103,Incêndio rural,0,30,0,73,2025-06-02T13:27:00Z,Grândola,Setúbal,Alentejo,-8.754243,38.19534
25467128,Monte Redondo e Carreira,Região de Leiria,310,2025-06-02T15:48:00Z,25467128,Em conclusão,3103,Incêndio rural,0,1,0,2,2025-06-02T15:48:00Z,Leiria,Leiria,Centro,-8.860783,39.89848
25468589,Alfena,Area M. Porto,309,2025-06-02T21:46:00Z,25468589,Em curso,2101,Incêndio em edifícios habitacionais,0,3,0,10,2025-06-02T21:46:00Z,Valongo,Porto,Norte,-8.525864,41.238625
25457724,Santo André,Alentejo Litoral,312,2025-05-31T18:30:00Z,25457724,Em conclusão,2127,"Incêndio em edifícios e recintos industriais, oficinas e armazéns",0,1,0,2,2025-05-31T18:30:00Z,Santiago Do Cacém,Setúbal,Alentejo,-8.784407,38.048083
25467776,Gouveia (São Simão),Tâmega e Sousa,309,2025-06-02T18:17:00Z,25467776,Em conclusão,3103,Incêndio rural,0,0,0,0,2025-06-02T18:17:00Z,Amarante,Porto,Norte,-8.064293,41.229668
25468461,"Sandim, Olival, Lever e Crestuma",Area M. Porto,309,2025-06-02T21:07:00Z,25468461,Em conclusão,3103,Incêndio rural,0,2,0,3,2025-06-02T21:07:00Z,Vila Nova De Gaia,Porto,Norte,-8.478048,41.033095
25468695,"Aldoar, Foz do Douro e Nevogilde",Area M. Porto,309,2025-06-02T22:24:00Z,25468695,Em conclusão,2101,Incêndio em edifícios habitacionais,0,4,0,17,2025-06-02T22:24:00Z,Porto,Porto,Norte,-8.67145,41.16579
25468761,Paços de Ferreira,Tâmega e Sousa,309,2025-06-02T22:46:00Z,25468761,Em curso,2129,Incêndio em edifícios degradados ou devolutos,0,1,0,5,2025-06-02T22:46:00Z,Paços De Ferreira,Porto,Norte,-8.370658,41.278172
25468777,Vila Nova de Cacela,Algarve,313,2025-06-02T23:03:00Z,25468777,Em despacho,2201,Incêndio em equipamentos ou produtos,0,0,0,0,2025-06-02T23:03:00Z,Vila Real De Santo António,Faro,Algarve,-7.567767,37.17472
