id,address,subregion,neighborhood,date,id.1,state,nature,nature_description,aerial_means,terrestrial_means,aquatic_means,operational,date.1,Concelho,Distrito,NUTII_DSG,longitude,latitude
25581155,Azambuja,Lezíria do Tejo,311,2025-06-26T07:29:00Z,25581155,Em despacho,3109,Gestão de combustível,0,1,0,4,2025-06-26T07:29:00Z,Azambuja,Lisboa,Alentejo,-8.898558,39.118107
25581054,Beringel,Baixo Alentejo,312,2025-06-26T06:48:00Z,25581054,Em curso,2301,Incêndio em transporte rodoviário,0,7,0,20,2025-06-26T06:48:00Z,Beja,Beja,Alentejo,-8.009313,38.05808
25581119,"Sé Nova, Santa Cruz, Almedina e São Bartolomeu",Região de Coimbra,310,2025-06-26T07:07:00Z,25581119,Em conclusão,2109,Incêndio em edifícios escolares,0,3,0,12,2025-06-26T07:07:00Z,Coimbra,Coimbra,Centro,-8.41961,40.203684
25581137,Paredes de Viadores e Manhuncelos,Tâmega e Sousa,309,2025-06-26T07:05:00Z,25581137,Em resolução,2101,Incêndio em edifícios habitacionais,0,4,0,10,2025-06-26T07:05:00Z,Marco De Canaveses,Porto,Norte,-8.114447,41.131908
25581185,"Cedofeita, Ildefonso, Sé, Miragaia, Nicolau e Vitória",Area M. Porto,309,2025-06-26T07:40:00Z,25581185,Em despacho,2201,Incêndio em equipamentos ou produtos,0,0,0,0,2025-06-26T07:40:00Z,Porto,Porto,Norte,-8.60595,41.1452
25581095,Gulpilhares e Valadares,Area M. Porto,309,2025-06-26T07:03:00Z,25581095,Em conclusão,3103,Incêndio rural,0,2,0,5,2025-06-26T07:03:00Z,Vila Nova De Gaia,Porto,Norte,-8.635397,41.091832
