attributes.ID_oc,attributes.Numero,attributes.CodEstadoOcorrencia,attributes.EstadoOcorrencia,attributes.EstadoAgrupado,attributes.CodImportanciaOcorrencia,attributes.ImportanciaOcorrencia,attributes.DataInicioOcorrencia,attributes.DataOcorrencia,attributes.Data,attributes.Hora,attributes.Ano,attributes.Duracao,attributes.DuracaoMinutos,attributes.FaseIncendio,attributes.CodNatureza,attributes.IDFamilia,attributes.Familia,attributes.IDEspecie,attributes.Especie,attributes.IDTipo,attributes.Tipo,attributes.Natureza,attributes.RegiaoID,attributes.Regiao,attributes.SubRegiaoID,attributes.SubRegiao,attributes.DICO,attributes.Concelho,attributes.DICOFRE,attributes.Freguesia,attributes.Localidade,attributes.Endereco,attributes.OperacionaisTerrestres,attributes.OPAereos,attributes.Operacionais,attributes.MeiosTerrestres,attributes.MaqRasto,attributes.MeiosAereos,attributes.QuantEntidades,attributes.Latitude,attributes.Longitude,attributes.DDD,attributes.DDM,attributes.DMS,attributes.DataDosDados,attributes.Simbol,attributes.RASI,attributes.ID,geometry.x,geometry.y,id,address,subregion,neighborhood,date,date.1,state,nature,aerial_means,terrestrial_means,operational,state_2,Concelho,Distrito,NUTII_DSG,longitude,latitude,nature_description
38412301,20260093172,6,Em Curso,Em Curso,1,Reduzida,20/01/2026 18:09,1768932540000,2026-01-20,18:09,2026,15/16:23,21143,---,3313,3,Riscos Mistos,3,"Comprometimento total ou parcial de segurança, serviços ou estruturas",13,Movimento de massa,3313 - Movimento de massa,3,Centro,12,Região de Leiria,140,Leiria,100921,Regueira de Pontes,Ortigosa,Rua do Rei Lavrador,3,0,3,2,0,0,2,39.809021,-8.844605,39.809021°N 8.844605°W,"39°48,5400'N 8°50,6760'W ","39° 48' 32,40'' N 8° 50' 40,56'' W ",1770201120000,33 - Em Curso,Intervenções em Infraestruturas e vias de comunicação,26615159,-8.844605,39.809021,20260093172,Ortigosa,Centro,140,2026-01-20T18:09:00Z,2026-01-20,Em Curso,3313,0,2,3,Curso,Leiria,Leiria,Centro,-8.844605,39.809021,Movimento de massa
38412302,20260104984,6,Em Curso,Em Curso,2,Moderada,23/01/2026 07:26,1769153160000,2026-01-23,07:26,2026,12/03:06,17466,---,1101,1,Riscos Naturais,1,Fenómenos Naturais,1,Cheia,1101 - Cheia,5,Alentejo,19,Alentejo Litoral,218,Alcácer do Sal,150104,Torrão,SÃO ROMÃO,EN262 São Romão,0,0,0,0,0,0,0,38.251711,-8.359187,38.251711°N 8.359187°W,"38°15,1020'N 8°21,5520'W ","38° 15' 6,12'' N 8° 21' 33,12'' W ",1770201120000,11 - Em Curso,Outras ocorrências de proteção e socorro,26626976,-8.359187,38.251711,20260104984,SÃO ROMÃO,Alentejo,218,2026-01-23T07:26:00Z,2026-01-23,Em Curso,1101,0,0,0,Curso,Alcácer Do Sal,Setúbal,Alentejo,-8.359187,38.251711,Cheia
38412303,20260106567,6,Em Curso,Em Curso,1,Reduzida,23/01/2026 12:12,1769170320000,2026-01-23,12:12,2026,12/22:20,17180,---,3315,3,Riscos Mistos,3,"Comprometimento total ou parcial de segurança, serviços ou estruturas",15,Inundação de estruturas ou superfícies por precipitação intensa,3315 - Inundação de estruturas ou superfícies por precipitação intensa,4,Lisboa e Vale do Tejo,16,Oeste,143,Óbidos,101210,"Santa Maria, São Pedro e Sobral da Lagoa",ARELHO,Estrada da Relvinha ,2,0,2,1,0,0,1,39.387182,-9.195134,39.387182°N 9.195134°W,"39°23,2320'N 9°11,7060'W ","39° 23' 13,92'' N 9° 11' 42,36'' W ",1770201120000,33 - Em Curso,Intervenções em Infraestruturas e vias de comunicação,26628559,-9.195134,39.387182,20260106567,ARELHO,Lisboa e Vale do Tejo,143,2026-01-23T12:12:00Z,2026-01-23,Em Curso,3315,0,1,2,Curso,Óbidos,Leiria,Centro,-9.195134,39.387182,Inundação de estruturas ou superfícies por precipitação intensa
38412304,20260107356,6,Em Curso,Em Curso,1,Reduzida,23/01/2026 14:20,1769178000000,2026-01-23,14:20,2026,12/20:12,17052,---,3315,3,Riscos Mistos,3,"Comprometimento total ou parcial de segurança, serviços ou estruturas",15,Inundação de estruturas ou superfícies por precipitação intensa,3315 - Inundação de estruturas ou superfícies por precipitação intensa,4,Lisboa e Vale do Tejo,16,Oeste,143,Óbidos,101210,"Santa Maria, São Pedro e Sobral da Lagoa",Óbidos,Estrada da Brogueira - Nadadouro,1,0,1,1,0,0,1,39.395854,-9.173283,39.395854°N 9.173283°W,"39°23,7540'N 9°10,3980'W ","39° 23' 45,24'' N 9° 10' 23,88'' W ",1770201120000,33 - Em Curso,Intervenções em Infraestruturas e vias de comunicação,26629348,-9.173283,39.395854,20260107356,Óbidos,Lisboa e Vale do Tejo,143,2026-01-23T14:20:00Z,2026-01-23,Em Curso,3315,0,1,1,Curso,Óbidos,Leiria,Centro,-9.173283,39.395854,Inundação de estruturas ou superfícies por precipitação intensa
38412305,20260110211,6,Em Curso,Em Curso,3,Elevada,24/01/2026 00:01,1769212860000,2026-01-24,00:01,2026,11/10:31,16471,---,1101,1,Riscos Naturais,1,Fenómenos Naturais,1,Cheia,1101 - Cheia,4,Lisboa e Vale do Tejo,18,Lezíria do Tejo,199,Almeirim,140301,Almeirim,PEECBT, --- ,0,0,0,0,0,0,0,39.187436,-8.635002,39.187436°N 8.635002°W,"39°11,2440'N 8°38,1000'W ","39° 11' 14,64'' N 8° 38' 6,00'' W ",1770201120000,11 - Em Curso,Outras ocorrências de proteção e socorro,26632203,-8.635002,39.187436,20260110211,PEECBT,Lisboa e Vale do Tejo,199,2026-01-24T00:01:00Z,2026-01-24,Em Curso,1101,0,0,0,Curso,Almeirim,Santarém,Alentejo,-8.635002,39.187436,Cheia
38412306,20260110646,6,Em Curso,Em Curso,3,Elevada,24/01/2026 00:01,1769212860000,2026-01-24,00:01,2026,11/10:31,16471,---,1101,1,Riscos Naturais,1,Fenómenos Naturais,1,Cheia,1101 - Cheia,4,Lisboa e Vale do Tejo,17,Médio Tejo,216,Vila Nova da Barquinha,142002,Praia do Ribatejo,CSREPC Médio Tejo, --- ,19,0,19,12,0,0,2,39.468074,-8.364354,39.468074°N 8.364354°W,"39°28,0860'N 8°21,8640'W ","39° 28' 5,16'' N 8° 21' 51,84'' W ",1770201120000,11 - Em Curso,Outras ocorrências de proteção e socorro,26632638,-8.364354,39.468074,20260110646,CSREPC Médio Tejo,Lisboa e Vale do Tejo,216,2026-01-24T00:01:00Z,2026-01-24,Em Curso,1101,0,12,19,Curso,Vila Nova Da Barquinha,Santarém,Centro,-8.364354,39.468074,Cheia
38412307,20260133180,6,Em Curso,Em Curso,3,Elevada,28/01/2026 05:45,1769579100000,2026-01-28,05:45,2026,7/04:47,10367,---,1103,1,Riscos Naturais,1,Fenómenos Naturais,3,Ventos fortes,1103 - Ventos fortes,3,Centro,12,Região de Leiria,146,Pombal,101509,Pombal,POMBAL,PCO Pombal,94,0,94,35,0,0,5,39.910371,-8.62781,39.910371°N 8.627810°W,"39°54,6240'N 8°37,6680'W ","39° 54' 37,44'' N 8° 37' 40,08'' W ",1770201120000,11 - Em Curso,Outras ocorrências de proteção e socorro,26655173,-8.62781,39.910371,20260133180,POMBAL,Centro,146,2026-01-28T05:45:00Z,2026-01-28,Em Curso,1103,0,35,94,Curso,Pombal,Leiria,Centro,-8.62781,39.910371,Ventos fortes
38412308,20260133248,6,Em Curso,Em Curso,3,Elevada,28/01/2026 05:55,1769579700000,2026-01-28,05:55,2026,7/04:37,10357,---,1103,1,Riscos Naturais,1,Fenómenos Naturais,3,Ventos fortes,1103 - Ventos fortes,3,Centro,12,Região de Leiria,140,Leiria,100933,"Leiria, Pousos, Barreira e Cortes",Leiria,PCO Leiria,308,0,308,110,2,0,6,39.749179,-8.802832,39.749179°N 8.802832°W,"39°44,9520'N 8°48,1680'W ","39° 44' 57,12'' N 8° 48' 10,08'' W ",1770201120000,11 - Em Curso,Outras ocorrências de proteção e socorro,26655241,-8.802832,39.749179,20260133248,Leiria,Centro,140,2026-01-28T05:55:00Z,2026-01-28,Em Curso,1103,0,110,308,Curso,Leiria,Leiria,Centro,-8.802832,39.749179,Ventos fortes
38412309,20260133872,6,Em Curso,Em Curso,3,Elevada,28/01/2026 06:50,1769583000000,2026-01-28,06:50,2026,7/03:42,10302,---,1103,1,Riscos Naturais,1,Fenómenos Naturais,3,Ventos fortes,1103 - Ventos fortes,3,Centro,11,Região de Coimbra,85,Soure,061509,Soure, --- ,CB Soure,0,0,0,0,0,0,0,40.053098,-8.612815,40.053098°N 8.612815°W,"40°3,1860'N 8°36,7680'W ","40° 3' 11,16'' N 8° 36' 46,08'' W ",1770201120000,11 - Em Curso,Outras ocorrências de proteção e socorro,26655865,-8.612815,40.053098,20260133872, --- ,Centro,85,2026-01-28T06:50:00Z,2026-01-28,Em Curso,1103,0,0,0,Curso,Soure,Coimbra,Centro,-8.612815,40.053098,Ventos fortes
38412310,20260133908,6,Em Curso,Em Curso,2,Moderada,28/01/2026 07:00,1769583600000,2026-01-28,07:00,2026,7/03:32,10292,---,1103,1,Riscos Naturais,1,Fenómenos Naturais,3,Ventos fortes,1103 - Ventos fortes,3,Centro,11,Região de Coimbra,73,Coimbra,060334,"Sé Nova, Santa Cruz, Almedina e São Bartolomeu", --- ,Sapadores Coimbra,0,0,0,0,0,0,0,40.221746,-8.437288,40.221746°N 8.437288°W,"40°13,3020'N 8°26,2380'W ","40° 13' 18,12'' N 8° 26' 14,28'' W ",1770201120000,11 - Em Curso,Outras ocorrências de proteção e socorro,26655901,-8.437288,40.221746,20260133908, --- ,Centro,73,2026-01-28T07:00:00Z,2026-01-28,Em Curso,1103,0,0,0,Curso,Coimbra,Coimbra,Centro,-8.437288,40.221746,Ventos fortes
38412311,20260134172,6,Em Curso,Em Curso,3,Elevada,28/01/2026 07:20,1769584800000,2026-01-28,07:20,2026,7/03:12,10272,---,1103,1,Riscos Naturais,1,Fenómenos Naturais,3,Ventos fortes,1103 - Ventos fortes,4,Lisboa e Vale do Tejo,17,Médio Tejo,217,Ourém,142115,Nossa Senhora da Piedade,Concelho de Ourém, --- ,213,0,213,62,3,0,9,39.672187,-8.579381,39.672187°N 8.579381°W,"39°40,3320'N 8°34,7640'W ","39° 40' 19,92'' N 8° 34' 45,84'' W ",1770201120000,11 - Em Curso,Outras ocorrências de proteção e socorro,26656165,-8.579381,39.672187,20260134172,Concelho de Ourém,Lisboa e Vale do Tejo,217,2026-01-28T07:20:00Z,2026-01-28,Em Curso,1103,0,62,213,Curso,Ourém,Santarém,Centro,-8.579381,39.672187,Ventos fortes
38412312,20260135107,6,Em Curso,Em Curso,3,Elevada,28/01/2026 08:00,1769587200000,2026-01-28,08:00,2026,7/02:32,10232,---,1103,1,Riscos Naturais,1,Fenómenos Naturais,3,Ventos fortes,1103 - Ventos fortes,4,Lisboa e Vale do Tejo,17,Médio Tejo,214,Tomar,141821,São João Baptista e Santa Maria Dos Olivais,Concelho de Tomar, --- ,31,0,31,7,0,0,4,39.602187,-8.405552,39.602187°N 8.405552°W,"39°36,1320'N 8°24,3360'W ","39° 36' 7,92'' N 8° 24' 20,16'' W ",1770201120000,11 - Em Curso,Outras ocorrências de proteção e socorro,26657100,-8.405552,39.602187,20260135107,Concelho de Tomar,Lisboa e Vale do Tejo,214,2026-01-28T08:00:00Z,2026-01-28,Em Curso,1103,0,7,31,Curso,Tomar,Santarém,Centro,-8.405552,39.602187,Ventos fortes
38412313,20260135208,6,Em Curso,Em Curso,3,Elevada,28/01/2026 08:41,1769589660000,2026-01-28,08:41,2026,7/01:51,10191,---,1103,1,Riscos Naturais,1,Fenómenos Naturais,3,Ventos fortes,1103 - Ventos fortes,4,Lisboa e Vale do Tejo,17,Médio Tejo,207,Ferreira do Zêzere,141106,Ferreira do Zêzere,Concelho de Ferreira do Zêzere, --- ,105,0,105,33,0,0,6,39.695169,-8.290499,39.695169°N 8.290499°W,"39°41,7120'N 8°17,4300'W ","39° 41' 42,72'' N 8° 17' 25,80'' W ",1770201120000,11 - Em Curso,Outras ocorrências de proteção e socorro,26657201,-8.290499,39.695169,20260135208,Concelho de Ferreira do Zêzere,Lisboa e Vale do Tejo,207,2026-01-28T08:41:00Z,2026-01-28,Em Curso,1103,0,33,105,Curso,Ferreira Do Zêzere,Santarém,Centro,-8.290499,39.695169,Ventos fortes
38412314,20260135390,6,Em Curso,Em Curso,1,Reduzida,28/01/2026 08:55,1769590500000,2026-01-28,08:55,2026,7/01:37,10177,---,1103,1,Riscos Naturais,1,Fenómenos Naturais,3,Ventos fortes,1103 - Ventos fortes,4,Lisboa e Vale do Tejo,17,Médio Tejo,204,Constância,140801,Constância,Concelho de Constância, --- ,0,0,0,0,0,0,0,39.476237,-8.334164,39.476237°N 8.334164°W,"39°28,5720'N 8°20,0520'W ","39° 28' 34,32'' N 8° 20' 3,12'' W ",1770201120000,11 - Em Curso,Outras ocorrências de proteção e socorro,26657383,-8.334164,39.476237,20260135390,Concelho de Constância,Lisboa e Vale do Tejo,204,2026-01-28T08:55:00Z,2026-01-28,Em Curso,1103,0,0,0,Curso,Constância,Santarém,Centro,-8.334164,39.476237,Ventos fortes
38412315,20260135401,6,Em Curso,Em Curso,3,Elevada,28/01/2026 08:56,1769590560000,2026-01-28,08:56,2026,7/01:36,10176,---,1103,1,Riscos Naturais,1,Fenómenos Naturais,3,Ventos fortes,1103 - Ventos fortes,4,Lisboa e Vale do Tejo,17,Médio Tejo,216,Vila Nova da Barquinha,142006,Vila Nova da Barquinha,Concelho de Vila Nova da Barquinha, --- ,1,0,1,0,0,0,1,39.467655,-8.428664,39.467655°N 8.428664°W,"39°28,0620'N 8°25,7220'W ","39° 28' 3,72'' N 8° 25' 43,32'' W ",1770201120000,11 - Em Curso,Outras ocorrências de proteção e socorro,26657394,-8.428664,39.467655,20260135401,Concelho de Vila Nova da Barquinha,Lisboa e Vale do Tejo,216,2026-01-28T08:56:00Z,2026-01-28,Em Curso,1103,0,0,1,Curso,Vila Nova Da Barquinha,Santarém,Centro,-8.428664,39.467655,Ventos fortes
38412316,20260135408,6,Em Curso,Em Curso,3,Elevada,28/01/2026 08:57,1769590620000,2026-01-28,08:57,2026,7/01:35,10175,---,1103,1,Riscos Naturais,1,Fenómenos Naturais,3,Ventos fortes,1103 - Ventos fortes,4,Lisboa e Vale do Tejo,17,Médio Tejo,215,Torres Novas,141920,"Torres Novas (Santa Maria, Salvador e Santiago)",Concelho de Torres Novas, --- ,0,0,0,0,0,0,0,39.476394,-8.539335,39.476394°N 8.539335°W,"39°28,5840'N 8°32,3580'W ","39° 28' 35,04'' N 8° 32' 21,48'' W ",1770201120000,11 - Em Curso,Outras ocorrências de proteção e socorro,26657401,-8.539335,39.476394,20260135408,Concelho de Torres Novas,Lisboa e Vale do Tejo,215,2026-01-28T08:57:00Z,2026-01-28,Em Curso,1103,0,0,0,Curso,Torres Novas,Santarém,Centro,-8.539335,39.476394,Ventos fortes
38412317,20260135421,6,Em Curso,Em Curso,3,Elevada,28/01/2026 08:58,1769590680000,2026-01-28,08:58,2026,7/01:34,10174,---,1103,1,Riscos Naturais,1,Fenómenos Naturais,3,Ventos fortes,1103 - Ventos fortes,4,Lisboa e Vale do Tejo,17,Médio Tejo,209,Mação,141309,"Mação, Penhascoso e Aboboreira",Concelho de Mação, --- ,7,0,7,3,0,0,3,39.551093,-7.998144,39.551093°N 7.998144°W,"39°33,0660'N 7°59,8860'W ","39° 33' 3,96'' N 7° 59' 53,16'' W ",1770201120000,11 - Em Curso,Outras ocorrências de proteção e socorro,26657414,-7.998144,39.551093,20260135421,Concelho de Mação,Lisboa e Vale do Tejo,209,2026-01-28T08:58:00Z,2026-01-28,Em Curso,1103,0,3,7,Curso,Mação,Santarém,Centro,-7.998144,39.551093,Ventos fortes
38412318,20260135423,6,Em Curso,Em Curso,1,Reduzida,28/01/2026 08:58,1769590680000,2026-01-28,08:58,2026,7/01:34,10174,---,1103,1,Riscos Naturais,1,Fenómenos Naturais,3,Ventos fortes,1103 - Ventos fortes,4,Lisboa e Vale do Tejo,17,Médio Tejo,198,Alcanena,140211,Alcanena e Vila Moreira,Concelho de Alcanena, --- ,4,0,4,1,0,0,1,39.464869,-8.669221,39.464869°N 8.669221°W,"39°27,8940'N 8°40,1520'W ","39° 27' 53,64'' N 8° 40' 9,12'' W ",1770201120000,11 - Em Curso,Outras ocorrências de proteção e socorro,26657416,-8.669221,39.464869,20260135423,Concelho de Alcanena,Lisboa e Vale do Tejo,198,2026-01-28T08:58:00Z,2026-01-28,Em Curso,1103,0,1,4,Curso,Alcanena,Santarém,Centro,-8.669221,39.464869,Ventos fortes
38412319,20260135434,6,Em Curso,Em Curso,3,Elevada,28/01/2026 08:59,1769590740000,2026-01-28,08:59,2026,7/01:33,10173,---,1103,1,Riscos Naturais,1,Fenómenos Naturais,3,Ventos fortes,1103 - Ventos fortes,4,Lisboa e Vale do Tejo,17,Médio Tejo,206,Entroncamento,141001,São João Baptista,Concelho de Entroncamento, --- ,0,0,0,0,0,0,0,39.45447,-8.473382,39.454470°N 8.473382°W,"39°27,2700'N 8°28,4040'W ","39° 27' 16,20'' N 8° 28' 24,24'' W ",1770201120000,11 - Em Curso,Outras ocorrências de proteção e socorro,26657427,-8.473382,39.45447,20260135434,Concelho de Entroncamento,Lisboa e Vale do Tejo,206,2026-01-28T08:59:00Z,2026-01-28,Em Curso,1103,0,0,0,Curso,Entroncamento,Santarém,Centro,-8.473382,39.45447,Ventos fortes
38412320,20260135448,6,Em Curso,Em Curso,3,Elevada,28/01/2026 09:00,1769590800000,2026-01-28,09:00,2026,7/01:32,10172,---,1103,1,Riscos Naturais,1,Fenómenos Naturais,3,Ventos fortes,1103 - Ventos fortes,4,Lisboa e Vale do Tejo,17,Médio Tejo,213,Sardoal,141703,Sardoal,Concelho de Sardoal, --- ,0,0,0,0,0,0,0,39.542479,-8.15551,39.542479°N 8.155510°W,"39°32,5500'N 8°9,3300'W ","39° 32' 33,00'' N 8° 9' 19,80'' W ",1770201120000,11 - Em Curso,Outras ocorrências de proteção e socorro,26657441,-8.15551,39.542479,20260135448,Concelho de Sardoal,Lisboa e Vale do Tejo,213,2026-01-28T09:00:00Z,2026-01-28,Em Curso,1103,0,0,0,Curso,Sardoal,Santarém,Centro,-8.15551,39.542479,Ventos fortes
38412321,20260135458,6,Em Curso,Em Curso,3,Elevada,28/01/2026 09:00,1769590800000,2026-01-28,09:00,2026,7/01:32,10172,---,1103,1,Riscos Naturais,1,Fenómenos Naturais,3,Ventos fortes,1103 - Ventos fortes,4,Lisboa e Vale do Tejo,17,Médio Tejo,197,Abrantes,140120,Abrantes (São Vicente e São João) e Alferrarede,Concelho de Abrantes, --- ,1,0,1,1,0,0,1,39.499466,-8.195112,39.499466°N 8.195112°W,"39°29,9700'N 8°11,7060'W ","39° 29' 58,20'' N 8° 11' 42,36'' W ",1770201120000,11 - Em Curso,Outras ocorrências de proteção e socorro,26657451,-8.195112,39.499466,20260135458,Concelho de Abrantes,Lisboa e Vale do Tejo,197,2026-01-28T09:00:00Z,2026-01-28,Em Curso,1103,0,1,1,Curso,Abrantes,Santarém,Centro,-8.195112,39.499466,Ventos fortes
38412322,20260135618,5,Chegada ao TO,Em Despacho,1,Reduzida,28/01/2026 09:09,1769591340000,2026-01-28,09:09,2026,7/01:23,10163,---,3315,3,Riscos Mistos,3,"Comprometimento total ou parcial de segurança, serviços ou estruturas",15,Inundação de estruturas ou superfícies por precipitação intensa,3315 - Inundação de estruturas ou superfícies por precipitação intensa,2,Norte,2,Alto Minho,239,Viana do Castelo,160948,Santa Maria Maior e Monserrate e Meadela,Campo da Agonia,Campo da Agonia,0,0,0,0,0,0,0,41.691365,-8.83684,41.691365°N 8.836840°W,"41°41,4840'N 8°50,2080'W ","41° 41' 29,04'' N 8° 50' 12,48'' W ",1770201120000,33 - Em Curso,Intervenções em Infraestruturas e vias de comunicação,26657611,-8.83684,41.691365,20260135618,Campo da Agonia,Norte,239,2026-01-28T09:09:00Z,2026-01-28,Chegada Ao to,3315,0,0,0,Chegada Ao to,Viana Do Castelo,Viana Do Castelo,Norte,-8.83684,41.691365,Inundação de estruturas ou superfícies por precipitação intensa
38412323,20260137542,6,Em Curso,Em Curso,3,Elevada,28/01/2026 08:00,1769587200000,2026-01-28,08:00,2026,7/02:32,10232,---,1103,1,Riscos Naturais,1,Fenómenos Naturais,3,Ventos fortes,1103 - Ventos fortes,4,Lisboa e Vale do Tejo,1,Grande Lisboa,157,Oeiras,111013,Carnaxide e Queijas, --- , --- ,0,0,0,0,0,0,0,38.725234,-9.243421,38.725234°N 9.243421°W,"38°43,5120'N 9°14,6040'W ","38° 43' 30,72'' N 9° 14' 36,24'' W ",1770201120000,11 - Em Curso,Outras ocorrências de proteção e socorro,26659535,-9.243421,38.725234,20260137542, --- ,Lisboa e Vale do Tejo,157,2026-01-28T08:00:00Z,2026-01-28,Em Curso,1103,0,0,0,Curso,Oeiras,Lisboa,Área Metropolitana De Lisboa,-9.243421,38.725234,Ventos fortes
38412324,20260138977,6,Em Curso,Em Curso,3,Elevada,28/01/2026 11:00,1769598000000,2026-01-28,11:00,2026,7/23:32,10052,---,1103,1,Riscos Naturais,1,Fenómenos Naturais,3,Ventos fortes,1103 - Ventos fortes,4,Lisboa e Vale do Tejo,17,Médio Tejo,216,Vila Nova da Barquinha,142002,Praia do Ribatejo,Sub-região Médio Tejo, --- ,1,0,1,1,0,0,1,39.485638,-8.357309,39.485638°N 8.357309°W,"39°29,1360'N 8°21,4380'W ","39° 29' 8,16'' N 8° 21' 26,28'' W ",1770201120000,11 - Em Curso,Outras ocorrências de proteção e socorro,26660970,-8.357309,39.485638,20260138977,Sub-região Médio Tejo,Lisboa e Vale do Tejo,216,2026-01-28T11:00:00Z,2026-01-28,Em Curso,1103,0,1,1,Curso,Vila Nova Da Barquinha,Santarém,Centro,-8.357309,39.485638,Ventos fortes
38412326,20260142426,6,Em Curso,Em Curso,3,Elevada,28/01/2026 04:00,1769572800000,2026-01-28,04:00,2026,7/06:32,10472,---,1103,1,Riscos Naturais,1,Fenómenos Naturais,3,Ventos fortes,1103 - Ventos fortes,3,Centro,12,Região de Leiria,135,Batalha,100401,Batalha,Batalha ,PCO Batalha,23,0,23,6,0,0,2,39.657621,-8.831646,39.657621°N 8.831646°W,"39°39,4560'N 8°49,8960'W ","39° 39' 27,36'' N 8° 49' 53,76'' W ",1770201120000,11 - Em Curso,Outras ocorrências de proteção e socorro,26664419,-8.831646,39.657621,20260142426,Batalha ,Centro,135,2026-01-28T04:00:00Z,2026-01-28,Em Curso,1103,0,6,23,Curso,Batalha,Leiria,Centro,-8.831646,39.657621,Ventos fortes
38412327,20260142434,6,Em Curso,Em Curso,3,Elevada,28/01/2026 04:00,1769572800000,2026-01-28,04:00,2026,7/06:32,10472,---,1103,1,Riscos Naturais,1,Fenómenos Naturais,3,Ventos fortes,1103 - Ventos fortes,3,Centro,12,Região de Leiria,134,Ansião,100309,Ansião,ANSIÃO,PCO Ansião,0,0,0,0,0,0,0,39.907437,-8.43366,39.907437°N 8.433660°W,"39°54,4440'N 8°26,0220'W ","39° 54' 26,64'' N 8° 26' 1,32'' W ",1770201120000,11 - Em Curso,Outras ocorrências de proteção e socorro,26664427,-8.43366,39.907437,20260142434,ANSIÃO,Centro,134,2026-01-28T04:00:00Z,2026-01-28,Em Curso,1103,0,0,0,Curso,Ansião,Leiria,Centro,-8.43366,39.907437,Ventos fortes
38412328,20260142441,6,Em Curso,Em Curso,3,Elevada,28/01/2026 04:00,1769572800000,2026-01-28,04:00,2026,7/06:32,10472,---,1103,1,Riscos Naturais,1,Fenómenos Naturais,3,Ventos fortes,1103 - Ventos fortes,3,Centro,12,Região de Leiria,133,Alvaiázere,100208,Alvaiázere,Alvaiazere,PCO Alvaiázere,108,0,108,30,0,0,5,39.830695,-8.395151,39.830695°N 8.395151°W,"39°49,8420'N 8°23,7120'W ","39° 49' 50,52'' N 8° 23' 42,72'' W ",1770201120000,11 - Em Curso,Outras ocorrências de proteção e socorro,26664434,-8.395151,39.830695,20260142441,Alvaiazere,Centro,133,2026-01-28T04:00:00Z,2026-01-28,Em Curso,1103,0,30,108,Curso,Alvaiázere,Leiria,Centro,-8.395151,39.830695,Ventos fortes
38412329,20260142449,6,Em Curso,Em Curso,3,Elevada,28/01/2026 04:00,1769572800000,2026-01-28,04:00,2026,7/06:32,10472,---,1103,1,Riscos Naturais,1,Fenómenos Naturais,3,Ventos fortes,1103 - Ventos fortes,3,Centro,12,Região de Leiria,141,Marinha Grande,101001,Marinha Grande,Marinha Grande,PCO Marinha Grande,13,0,13,5,0,0,1,39.768006,-8.95516,39.768006°N 8.955160°W,"39°46,0800'N 8°57,3120'W ","39° 46' 4,80'' N 8° 57' 18,72'' W ",1770201120000,11 - Em Curso,Outras ocorrências de proteção e socorro,26664442,-8.95516,39.768006,20260142449,Marinha Grande,Centro,141,2026-01-28T04:00:00Z,2026-01-28,Em Curso,1103,0,5,13,Curso,Marinha Grande,Leiria,Centro,-8.95516,39.768006,Ventos fortes
38412330,20260142455,6,Em Curso,Em Curso,3,Elevada,28/01/2026 04:00,1769572800000,2026-01-28,04:00,2026,7/06:32,10472,---,1103,1,Riscos Naturais,1,Fenómenos Naturais,3,Ventos fortes,1103 - Ventos fortes,3,Centro,12,Região de Leiria,144,Pedrógão Grande,101302,Pedrógão Grande,Pedrogão Grande,PCO Pedrogão Grande,38,0,38,15,0,0,2,39.916835,-8.144807,39.916835°N 8.144807°W,"39°55,0080'N 8°8,6880'W ","39° 55' 0,48'' N 8° 8' 41,28'' W ",1770201120000,11 - Em Curso,Outras ocorrências de proteção e socorro,26664448,-8.144807,39.916835,20260142455,Pedrogão Grande,Centro,144,2026-01-28T04:00:00Z,2026-01-28,Em Curso,1103,0,15,38,Curso,Pedrógão Grande,Leiria,Centro,-8.144807,39.916835,Ventos fortes
38412331,20260142459,6,Em Curso,Em Curso,3,Elevada,28/01/2026 04:00,1769572800000,2026-01-28,04:00,2026,7/06:32,10472,---,1103,1,Riscos Naturais,1,Fenómenos Naturais,3,Ventos fortes,1103 - Ventos fortes,3,Centro,12,Região de Leiria,139,Figueiró Dos Vinhos,100806,Figueiró Dos Vinhos e Bairradas,Figueiró dos Vinhos,PCO Figueiró dos Vinhos,0,0,0,0,0,0,0,39.886269,-8.269227,39.886269°N 8.269227°W,"39°53,1780'N 8°16,1520'W ","39° 53' 10,68'' N 8° 16' 9,12'' W ",1770201120000,11 - Em Curso,Outras ocorrências de proteção e socorro,26664452,-8.269227,39.886269,20260142459,Figueiró dos Vinhos,Centro,139,2026-01-28T04:00:00Z,2026-01-28,Em Curso,1103,0,0,0,Curso,Figueiró Dos Vinhos,Leiria,Centro,-8.269227,39.886269,Ventos fortes
38412332,20260143255,6,Em Curso,Em Curso,3,Elevada,28/01/2026 04:00,1769572800000,2026-01-28,04:00,2026,7/06:32,10472,---,1103,1,Riscos Naturais,1,Fenómenos Naturais,3,Ventos fortes,1103 - Ventos fortes,3,Centro,12,Região de Leiria,147,Porto de Mós,101614,Porto de Mós - São João Baptista e São Pedro,Porto de Mós,PCO Porto de Mós,0,0,0,0,0,0,0,39.604144,-8.823531,39.604144°N 8.823531°W,"39°36,2460'N 8°49,4100'W ","39° 36' 14,76'' N 8° 49' 24,60'' W ",1770201120000,11 - Em Curso,Outras ocorrências de proteção e socorro,26665248,-8.823531,39.604144,20260143255,Porto de Mós,Centro,147,2026-01-28T04:00:00Z,2026-01-28,Em Curso,1103,0,0,0,Curso,Porto De Mós,Leiria,Centro,-8.823531,39.604144,Ventos fortes
38412333,20260143278,6,Em Curso,Em Curso,3,Elevada,28/01/2026 04:00,1769572800000,2026-01-28,04:00,2026,7/06:32,10472,---,1103,1,Riscos Naturais,1,Fenómenos Naturais,3,Ventos fortes,1103 - Ventos fortes,3,Centro,12,Região de Leiria,138,Castanheira de Pêra,100703,Castanheira de Pêra e Coentral,CASTANHEIRA DE PERA,PCO Castanheira de Pera,0,0,0,0,0,0,0,40.005971,-8.209236,40.005971°N 8.209236°W,"40°0,3600'N 8°12,5520'W ","40° 0' 21,60'' N 8° 12' 33,12'' W ",1770201120000,11 - Em Curso,Outras ocorrências de proteção e socorro,26665271,-8.209236,40.005971,20260143278,CASTANHEIRA DE PERA,Centro,138,2026-01-28T04:00:00Z,2026-01-28,Em Curso,1103,0,0,0,Curso,Castanheira De Pêra,Leiria,Centro,-8.209236,40.005971,Ventos fortes
38412334,20260145533,5,Despacho de 1º Alerta,Em Despacho,1,Reduzida,29/01/2026 10:30,1769682600000,2026-01-29,10:30,2026,6/00:02,8642,---,1101,1,Riscos Naturais,1,Fenómenos Naturais,1,Cheia,1101 - Cheia,3,Centro,14,Beiras e Serra da Estrela,129,Seia,091236,Vide e Cabeça,VIDE,EN230 Ponte de Vide,6,0,6,2,0,0,2,40.291308,-7.78487,40.291308°N 7.784870°W,"40°17,4780'N 7°47,0940'W ","40° 17' 28,68'' N 7° 47' 5,64'' W ",1770201120000,11 - Em Despacho,Outras ocorrências de proteção e socorro,26667526,-7.78487,40.291308,20260145533,VIDE,Centro,129,2026-01-29T10:30:00Z,2026-01-29,Despacho De 1º Alerta,1101,0,2,6,Despacho De 1º Alerta,Seia,Guarda,Centro,-7.78487,40.291308,Cheia
38412335,20260146485,8,Vigilância,Em Conclusão,2,Moderada,29/01/2026 11:27,1769686020000,2026-01-29,11:27,2026,6/23:05,8585,---,3301,3,Riscos Mistos,3,"Comprometimento total ou parcial de segurança, serviços ou estruturas",1,Queda de Árvore,3301 - Queda de Árvore,4,Lisboa e Vale do Tejo,1,Grande Lisboa,158,Sintra,111105,Colares,COLARES,EN375 - Estrada Nova da Rainha,5,0,5,1,0,0,1,38.795124,-9.432472,38.795124°N 9.432472°W,"38°47,7060'N 9°25,9500'W ","38° 47' 42,36'' N 9° 25' 57,00'' W ",1770201120000,33 - Em Conclusão,Intervenções em Infraestruturas e vias de comunicação,26668478,-9.432472,38.795124,20260146485,COLARES,Lisboa e Vale do Tejo,158,2026-01-29T11:27:00Z,2026-01-29,Vigilância,3301,0,1,5,Vigilância,Sintra,Lisboa,Área Metropolitana De Lisboa,-9.432472,38.795124,Queda de Árvore
38412336,20260147577,6,Em Curso,Em Curso,2,Moderada,29/01/2026 14:20,1769696400000,2026-01-29,14:20,2026,6/20:12,8412,---,1103,1,Riscos Naturais,1,Fenómenos Naturais,3,Ventos fortes,1103 - Ventos fortes,3,Centro,15,Beira Baixa,65,Oleiros,050614,Oleiros-Amieira,CB Oleiros, --- ,0,0,0,0,0,0,0,39.926411,-7.896733,39.926411°N 7.896733°W,"39°55,5840'N 7°53,8020'W ","39° 55' 35,04'' N 7° 53' 48,12'' W ",1770201120000,11 - Em Curso,Outras ocorrências de proteção e socorro,26669570,-7.896733,39.926411,20260147577,CB Oleiros,Centro,65,2026-01-29T14:20:00Z,2026-01-29,Em Curso,1103,0,0,0,Curso,Oleiros,Castelo Branco,Centro,-7.896733,39.926411,Ventos fortes
38412337,20260159259,6,Em Curso,Em Curso,3,Elevada,31/01/2026 10:23,1769854980000,2026-01-31,10:23,2026,4/00:09,5769,---,3313,3,Riscos Mistos,3,"Comprometimento total ou parcial de segurança, serviços ou estruturas",13,Movimento de massa,3313 - Movimento de massa,2,Norte,9,Douro,259,Lamego,180528,Parada do Bispo e Valdigem,VALDIGEM,A24,2,0,2,1,0,0,1,41.126564,-7.765165,41.126564°N 7.765165°W,"41°7,5960'N 7°45,9120'W ","41° 7' 35,76'' N 7° 45' 54,72'' W ",1770201120000,33 - Em Curso,Intervenções em Infraestruturas e vias de comunicação,26681252,-7.765165,41.126564,20260159259,VALDIGEM,Norte,259,2026-01-31T10:23:00Z,2026-01-31,Em Curso,3313,0,1,2,Curso,Lamego,Viseu,Norte,-7.765165,41.126564,Movimento de massa
38412339,20260162245,6,Em Curso,Em Curso,3,Elevada,31/01/2026 19:19,1769887140000,2026-01-31,19:19,2026,4/15:13,5233,---,1101,1,Riscos Naturais,1,Fenómenos Naturais,1,Cheia,1101 - Cheia,3,Centro,11,Região de Coimbra,80,Montemor-o-Velho,061016,Montemor-o-Velho e Gatões,MONTEMOR-O-VELHO, --- ,38,0,38,10,0,0,2,40.169486,-8.684865,40.169486°N 8.684865°W,"40°10,1700'N 8°41,0940'W ","40° 10' 10,20'' N 8° 41' 5,64'' W ",1770201120000,11 - Em Curso,Outras ocorrências de proteção e socorro,26684239,-8.684865,40.169486,20260162245,MONTEMOR-O-VELHO,Centro,80,2026-01-31T19:19:00Z,2026-01-31,Em Curso,1101,0,10,38,Curso,Montemor-o-velho,Coimbra,Centro,-8.684865,40.169486,Cheia
38412340,20260165338,5,Chegada ao TO,Em Despacho,1,Reduzida,31/01/2026 08:00,1769846400000,2026-01-31,08:00,2026,4/02:32,5912,---,1101,1,Riscos Naturais,1,Fenómenos Naturais,1,Cheia,1101 - Cheia,3,Centro,11,Região de Coimbra,73,Coimbra,060334,"Sé Nova, Santa Cruz, Almedina e São Bartolomeu",COIMBRA, --- ,0,0,0,0,0,0,0,40.205556,-8.425582,40.205556°N 8.425582°W,"40°12,3360'N 8°25,5360'W ","40° 12' 20,16'' N 8° 25' 32,16'' W ",1770201120000,11 - Em Curso,Outras ocorrências de proteção e socorro,26687332,-8.425582,40.205556,20260165338,COIMBRA,Centro,73,2026-01-31T08:00:00Z,2026-01-31,Chegada Ao to,1101,0,0,0,Chegada Ao to,Coimbra,Coimbra,Centro,-8.425582,40.205556,Cheia
38412341,20260165349,5,Chegada ao TO,Em Despacho,3,Elevada,31/01/2026 08:00,1769846400000,2026-01-31,08:00,2026,4/02:32,5912,---,1101,1,Riscos Naturais,1,Fenómenos Naturais,1,Cheia,1101 - Cheia,3,Centro,11,Região de Coimbra,85,Soure,061509,Soure,Soure, --- ,2,0,2,2,0,0,1,40.055319,-8.639406,40.055319°N 8.639406°W,"40°3,3180'N 8°38,3640'W ","40° 3' 19,08'' N 8° 38' 21,84'' W ",1770201120000,11 - Em Curso,Outras ocorrências de proteção e socorro,26687343,-8.639406,40.055319,20260165349,Soure,Centro,85,2026-01-31T08:00:00Z,2026-01-31,Chegada Ao to,1101,0,2,2,Chegada Ao to,Soure,Coimbra,Centro,-8.639406,40.055319,Cheia
38412342,20260165861,6,Em Curso,Em Curso,3,Elevada,28/01/2026 04:00,1769572800000,2026-01-28,04:00,2026,7/06:32,10472,---,1103,1,Riscos Naturais,1,Fenómenos Naturais,3,Ventos fortes,1103 - Ventos fortes,3,Centro,12,Região de Leiria,140,Leiria,100933,"Leiria, Pousos, Barreira e Cortes",LEIRIA,Região de Leiria,0,0,0,0,0,0,0,39.749179,-8.802832,39.749179°N 8.802832°W,"39°44,9520'N 8°48,1680'W ","39° 44' 57,12'' N 8° 48' 10,08'' W ",1770201120000,11 - Em Curso,Outras ocorrências de proteção e socorro,26687855,-8.802832,39.749179,20260165861,LEIRIA,Centro,140,2026-01-28T04:00:00Z,2026-01-28,Em Curso,1103,0,0,0,Curso,Leiria,Leiria,Centro,-8.802832,39.749179,Ventos fortes
38412343,20260166978,6,Em Curso,Em Curso,1,Reduzida,28/01/2026 05:15,1769577300000,2026-01-28,05:15,2026,7/05:17,10397,---,1103,1,Riscos Naturais,1,Fenómenos Naturais,3,Ventos fortes,1103 - Ventos fortes,3,Centro,15,Beira Baixa,61,Castelo Branco,050205,Castelo Branco,Castelo Branco,Sub-Região da Beira Baixa,0,0,0,0,0,0,0,39.816895,-7.490756,39.816895°N 7.490756°W,"39°49,0140'N 7°29,4480'W ","39° 49' 0,84'' N 7° 29' 26,88'' W ",1770201120000,11 - Em Curso,Outras ocorrências de proteção e socorro,26688972,-7.490756,39.816895,20260166978,Castelo Branco,Centro,61,2026-01-28T05:15:00Z,2026-01-28,Em Curso,1103,0,0,0,Curso,Castelo Branco,Castelo Branco,Centro,-7.490756,39.816895,Ventos fortes
38412344,20260167015,6,Em Curso,Em Curso,1,Reduzida,01/02/2026 18:21,1769970060000,2026-02-01,18:21,2026,3/16:11,3851,---,1101,1,Riscos Naturais,1,Fenómenos Naturais,1,Cheia,1101 - Cheia,2,Norte,2,Alto Minho,236,Ponte da Barca,160628,"Ponte da Barca, V. N. Muía e Paço Vedro Magalhães",Rio Lima - Praia Fluvial,Rio Lima - Praia Fluvial,0,0,0,0,0,0,0,41.808215,-8.42233,41.808215°N 8.422330°W,"41°48,4920'N 8°25,3380'W ","41° 48' 29,52'' N 8° 25' 20,28'' W ",1770201120000,11 - Em Curso,Outras ocorrências de proteção e socorro,26689009,-8.42233,41.808215,20260167015,Rio Lima - Praia Fluvial,Norte,236,2026-02-01T18:21:00Z,2026-02-01,Em Curso,1101,0,0,0,Curso,Ponte Da Barca,Viana Do Castelo,Norte,-8.42233,41.808215,Cheia
38412345,20260168462,6,Em Curso,Em Curso,1,Reduzida,02/02/2026 03:12,1770001920000,2026-02-02,03:12,2026,2/07:20,3320,---,1101,1,Riscos Naturais,1,Fenómenos Naturais,1,Cheia,1101 - Cheia,2,Norte,2,Alto Minho,237,Ponte de Lima,160717,Estorãos,Ponte Romana Estorãos,Ponte Romana Estorãos,0,0,0,0,0,0,0,41.80017,-8.662986,41.800170°N 8.662986°W,"41°48,0120'N 8°39,7800'W ","41° 48' 0,72'' N 8° 39' 46,80'' W ",1770201120000,11 - Em Curso,Outras ocorrências de proteção e socorro,26690456,-8.662986,41.80017,20260168462,Ponte Romana Estorãos,Norte,237,2026-02-02T03:12:00Z,2026-02-02,Em Curso,1101,0,0,0,Curso,Ponte De Lima,Viana Do Castelo,Norte,-8.662986,41.80017,Cheia
38412346,20260169421,5,Chegada ao TO,Em Despacho,2,Moderada,02/02/2026 08:59,1770022740000,2026-02-02,08:59,2026,2/01:33,2973,---,1101,1,Riscos Naturais,1,Fenómenos Naturais,1,Cheia,1101 - Cheia,4,Lisboa e Vale do Tejo,18,Lezíria do Tejo,202,Cartaxo,140609,Cartaxo e Vale da Pinta,PCMUN Cartaxo, --- ,5,0,5,5,0,0,1,39.162909,-8.783497,39.162909°N 8.783497°W,"39°9,7740'N 8°47,0100'W ","39° 9' 46,44'' N 8° 47' 0,60'' W ",1770201120000,11 - Em Curso,Outras ocorrências de proteção e socorro,26691415,-8.783497,39.162909,20260169421,PCMUN Cartaxo,Lisboa e Vale do Tejo,202,2026-02-02T08:59:00Z,2026-02-02,Chegada Ao to,1101,0,5,5,Chegada Ao to,Cartaxo,Santarém,Alentejo,-8.783497,39.162909,Cheia
38412347,20260169817,6,Em Curso,Em Curso,1,Reduzida,02/02/2026 09:45,1770025500000,2026-02-02,09:45,2026,2/00:47,2927,---,1101,1,Riscos Naturais,1,Fenómenos Naturais,1,Cheia,1101 - Cheia,2,Norte,2,Alto Minho,232,Caminha,160218,Vilar de Mouros,Ponte Vilar De Mouros,Ponte Vilar De Mouros,0,0,0,0,0,0,0,41.890548,-8.795847,41.890548°N 8.795847°W,"41°53,4300'N 8°47,7480'W ","41° 53' 25,80'' N 8° 47' 44,88'' W ",1770201120000,11 - Em Curso,Outras ocorrências de proteção e socorro,26691811,-8.795847,41.890548,20260169817,Ponte Vilar De Mouros,Norte,232,2026-02-02T09:45:00Z,2026-02-02,Em Curso,1101,0,0,0,Curso,Caminha,Viana Do Castelo,Norte,-8.795847,41.890548,Cheia
38412349,20260171082,5,Chegada ao TO,Em Despacho,2,Moderada,01/02/2026 22:30,1769985000000,2026-02-01,22:30,2026,3/12:02,3602,---,1101,1,Riscos Naturais,1,Fenómenos Naturais,1,Cheia,1101 - Cheia,4,Lisboa e Vale do Tejo,18,Lezíria do Tejo,150,Azambuja,110304,Azambuja,PCMUN Azambuja, --- ,2,0,2,1,0,0,1,39.067579,-8.874179,39.067579°N 8.874179°W,"39°4,0560'N 8°52,4520'W ","39° 4' 3,36'' N 8° 52' 27,12'' W ",1770201120000,11 - Em Curso,Outras ocorrências de proteção e socorro,26693076,-8.874179,39.067579,20260171082,PCMUN Azambuja,Lisboa e Vale do Tejo,150,2026-02-01T22:30:00Z,2026-02-01,Chegada Ao to,1101,0,1,2,Chegada Ao to,Azambuja,Lisboa,Alentejo,-8.874179,39.067579,Cheia
38412350,20260173163,5,Despacho de 1º Alerta,Em Despacho,2,Moderada,02/02/2026 17:30,1770053400000,2026-02-02,17:30,2026,2/17:02,2462,---,1101,1,Riscos Naturais,1,Fenómenos Naturais,1,Cheia,1101 - Cheia,4,Lisboa e Vale do Tejo,18,Lezíria do Tejo,199,Almeirim,140301,Almeirim,PCMUN ALMEIRIM, --- ,1,0,1,1,0,0,1,39.187436,-8.635002,39.187436°N 8.635002°W,"39°11,2440'N 8°38,1000'W ","39° 11' 14,64'' N 8° 38' 6,00'' W ",1770201120000,11 - Em Despacho,Outras ocorrências de proteção e socorro,26695157,-8.635002,39.187436,20260173163,PCMUN ALMEIRIM,Lisboa e Vale do Tejo,199,2026-02-02T17:30:00Z,2026-02-02,Despacho De 1º Alerta,1101,0,1,1,Despacho De 1º Alerta,Almeirim,Santarém,Alentejo,-8.635002,39.187436,Cheia
38412351,20260173364,6,Em Curso,Em Curso,1,Reduzida,02/02/2026 18:26,1770056760000,2026-02-02,18:26,2026,2/16:06,2406,---,3315,3,Riscos Mistos,3,"Comprometimento total ou parcial de segurança, serviços ou estruturas",15,Inundação de estruturas ou superfícies por precipitação intensa,3315 - Inundação de estruturas ou superfícies por precipitação intensa,4,Lisboa e Vale do Tejo,16,Oeste,132,Alcobaça,100105,Benedita,BENEDITA,Caminho do Rafael nº 6,0,0,0,0,0,0,1,39.424686,-8.979714,39.424686°N 8.979714°W,"39°25,4820'N 8°58,7820'W ","39° 25' 28,92'' N 8° 58' 46,92'' W ",1770201120000,33 - Em Curso,Intervenções em Infraestruturas e vias de comunicação,26695358,-8.979714,39.424686,20260173364,BENEDITA,Lisboa e Vale do Tejo,132,2026-02-02T18:26:00Z,2026-02-02,Em Curso,3315,0,0,0,Curso,Alcobaça,Leiria,Centro,-8.979714,39.424686,Inundação de estruturas ou superfícies por precipitação intensa
38412352,20260176003,5,Chegada ao TO,Em Despacho,1,Reduzida,03/02/2026 09:48,1770112080000,2026-02-03,09:48,2026,1/00:44,1484,---,3315,3,Riscos Mistos,3,"Comprometimento total ou parcial de segurança, serviços ou estruturas",15,Inundação de estruturas ou superfícies por precipitação intensa,3315 - Inundação de estruturas ou superfícies por precipitação intensa,2,Norte,2,Alto Minho,239,Viana do Castelo,160904,Anha,Rua Nova       ,Rua Nova       ,0,0,0,0,0,0,0,41.663897,-8.804129,41.663897°N 8.804129°W,"41°39,8340'N 8°48,2460'W ","41° 39' 50,04'' N 8° 48' 14,76'' W ",1770201120000,33 - Em Curso,Intervenções em Infraestruturas e vias de comunicação,26697997,-8.804129,41.663897,20260176003,Rua Nova       ,Norte,239,2026-02-03T09:48:00Z,2026-02-03,Chegada Ao to,3315,0,0,0,Chegada Ao to,Viana Do Castelo,Viana Do Castelo,Norte,-8.804129,41.663897,Inundação de estruturas ou superfícies por precipitação intensa
38412353,20260176219,6,Em Curso,Em Curso,3,Elevada,31/01/2026 08:00,1769846400000,2026-01-31,08:00,2026,4/02:32,5912,---,1101,1,Riscos Naturais,1,Fenómenos Naturais,1,Cheia,1101 - Cheia,4,Lisboa e Vale do Tejo,1,Grande Lisboa,157,Oeiras,111013,Carnaxide e Queijas, --- , --- ,0,0,0,0,0,0,0,38.725234,-9.243421,38.725234°N 9.243421°W,"38°43,5120'N 9°14,6040'W ","38° 43' 30,72'' N 9° 14' 36,24'' W ",1770201120000,11 - Em Curso,Outras ocorrências de proteção e socorro,26698213,-9.243421,38.725234,20260176219, --- ,Lisboa e Vale do Tejo,157,2026-01-31T08:00:00Z,2026-01-31,Em Curso,1101,0,0,0,Curso,Oeiras,Lisboa,Área Metropolitana De Lisboa,-9.243421,38.725234,Cheia
38412354,20260176957,5,Chegada ao TO,Em Despacho,1,Reduzida,03/02/2026 12:02,1770120120000,2026-02-03,12:02,2026,1/22:30,1350,---,3301,3,Riscos Mistos,3,"Comprometimento total ou parcial de segurança, serviços ou estruturas",1,Queda de Árvore,3301 - Queda de Árvore,3,Centro,11,Região de Coimbra,73,Coimbra,060334,"Sé Nova, Santa Cruz, Almedina e São Bartolomeu",COIMBRA,Rua do Padrão,1,0,1,1,0,0,1,40.205556,-8.425582,40.205556°N 8.425582°W,"40°12,3360'N 8°25,5360'W ","40° 12' 20,16'' N 8° 25' 32,16'' W ",1770201120000,33 - Em Curso,Intervenções em Infraestruturas e vias de comunicação,26698951,-8.425582,40.205556,20260176957,COIMBRA,Centro,73,2026-02-03T12:02:00Z,2026-02-03,Chegada Ao to,3301,0,1,1,Chegada Ao to,Coimbra,Coimbra,Centro,-8.425582,40.205556,Queda de Árvore
38412355,20260177270,7,Em Resolução,Em Resolução,3,Elevada,03/02/2026 10:00,1770112800000,2026-02-03,10:00,2026,1/00:32,1472,---,1101,1,Riscos Naturais,1,Fenómenos Naturais,1,Cheia,1101 - Cheia,5,Alentejo,22,Baixo Alentejo,28,Mértola,020905,Santana de Cambas,Pomarão,Pomarão,0,0,0,0,0,0,0,37.557891,-7.530979,37.557891°N 7.530979°W,"37°33,4740'N 7°31,8600'W ","37° 33' 28,44'' N 7° 31' 51,60'' W ",1770201120000,11 - Em Resolução,Outras ocorrências de proteção e socorro,26699264,-7.530979,37.557891,20260177270,Pomarão,Alentejo,28,2026-02-03T10:00:00Z,2026-02-03,Em resolução/conclusão,1101,0,0,0,Resolução/Conclusão,Mértola,Beja,Alentejo,-7.530979,37.557891,Cheia
38412356,20260177602,5,Chegada ao TO,Em Despacho,3,Elevada,03/02/2026 13:40,1770126000000,2026-02-03,13:40,2026,1/20:52,1252,---,1101,1,Riscos Naturais,1,Fenómenos Naturais,1,Cheia,1101 - Cheia,5,Alentejo,22,Baixo Alentejo,28,Mértola,020904,Mértola,MÉRTOLA,Mértola,0,0,0,0,0,0,0,37.645009,-7.669644,37.645009°N 7.669644°W,"37°38,7000'N 7°40,1760'W ","37° 38' 42,00'' N 7° 40' 10,56'' W ",1770201120000,11 - Em Curso,Outras ocorrências de proteção e socorro,26699596,-7.669644,37.645009,20260177602,MÉRTOLA,Alentejo,28,2026-02-03T13:40:00Z,2026-02-03,Chegada Ao to,1101,0,0,0,Chegada Ao to,Mértola,Beja,Alentejo,-7.669644,37.645009,Cheia
38412357,20260177854,6,Em Curso,Em Curso,3,Elevada,03/02/2026 14:30,1770129000000,2026-02-03,14:30,2026,1/20:02,1202,---,1103,1,Riscos Naturais,1,Fenómenos Naturais,3,Ventos fortes,1103 - Ventos fortes,4,Lisboa e Vale do Tejo,16,Oeste,142,Nazaré,101102,Nazaré,NAZARÉ, --- ,0,0,0,0,0,0,0,39.596083,-9.062127,39.596083°N 9.062127°W,"39°35,7660'N 9°3,7260'W ","39° 35' 45,96'' N 9° 3' 43,56'' W ",1770201120000,11 - Em Curso,Outras ocorrências de proteção e socorro,26699849,-9.062127,39.596083,20260177854,NAZARÉ,Lisboa e Vale do Tejo,142,2026-02-03T14:30:00Z,2026-02-03,Em Curso,1103,0,0,0,Curso,Nazaré,Leiria,Centro,-9.062127,39.596083,Ventos fortes
38412358,20260179237,5,Chegada ao TO,Em Despacho,1,Reduzida,02/02/2026 08:00,1770019200000,2026-02-02,08:00,2026,2/02:32,3032,---,3311,3,Riscos Mistos,3,"Comprometimento total ou parcial de segurança, serviços ou estruturas",11,Queda de elementos de construção em estruturas edificadas,3311 - Queda de elementos de construção em estruturas edificadas,4,Lisboa e Vale do Tejo,16,Oeste,142,Nazaré,101102,Nazaré,NAZARÉ, --- ,3,0,3,2,0,0,2,39.596083,-9.062127,39.596083°N 9.062127°W,"39°35,7660'N 9°3,7260'W ","39° 35' 45,96'' N 9° 3' 43,56'' W ",1770201120000,33 - Em Curso,Intervenções em Infraestruturas e vias de comunicação,26701233,-9.062127,39.596083,20260179237,NAZARÉ,Lisboa e Vale do Tejo,142,2026-02-02T08:00:00Z,2026-02-02,Chegada Ao to,3311,0,2,3,Chegada Ao to,Nazaré,Leiria,Centro,-9.062127,39.596083,Queda de elementos de construção em estruturas edificadas
38412359,20260179499,5,Despacho de 1º Alerta,Em Despacho,1,Reduzida,03/02/2026 19:26,1770146760000,2026-02-03,19:26,2026,1/15:06,906,---,3313,3,Riscos Mistos,3,"Comprometimento total ou parcial de segurança, serviços ou estruturas",13,Movimento de massa,3313 - Movimento de massa,5,Alentejo,19,Alentejo Litoral,30,Odemira,021120,São Salvador e Santa Maria,ODEMIRA,EN 266,1,0,1,1,0,0,1,37.594321,-8.650536,37.594321°N 8.650536°W,"37°35,6580'N 8°39,0300'W ","37° 35' 39,48'' N 8° 39' 1,80'' W ",1770201120000,33 - Em Despacho,Intervenções em Infraestruturas e vias de comunicação,26701495,-8.650536,37.594321,20260179499,ODEMIRA,Alentejo,30,2026-02-03T19:26:00Z,2026-02-03,Despacho De 1º Alerta,3313,0,1,1,Despacho De 1º Alerta,Odemira,Beja,Alentejo,-8.650536,37.594321,Movimento de massa
38412360,20260180020,6,Em Curso,Em Curso,1,Reduzida,03/02/2026 21:40,1770154800000,2026-02-03,21:40,2026,1/12:52,772,---,3301,3,Riscos Mistos,3,"Comprometimento total ou parcial de segurança, serviços ou estruturas",1,Queda de Árvore,3301 - Queda de Árvore,3,Centro,11,Região de Coimbra,85,Soure,061501,Alfarelos,Casal do Redinho, --- ,2,0,2,1,0,0,1,40.138191,-8.635329,40.138191°N 8.635329°W,"40°8,2920'N 8°38,1180'W ","40° 8' 17,52'' N 8° 38' 7,08'' W ",1770201120000,33 - Em Curso,Intervenções em Infraestruturas e vias de comunicação,26702016,-8.635329,40.138191,20260180020,Casal do Redinho,Centro,85,2026-02-03T21:40:00Z,2026-02-03,Em Curso,3301,0,1,2,Curso,Soure,Coimbra,Centro,-8.635329,40.138191,Queda de Árvore
38412361,20260180204,5,Despacho de 1º Alerta,Em Despacho,1,Reduzida,03/02/2026 22:20,1770157200000,2026-02-03,22:20,2026,1/12:12,732,---,3315,3,Riscos Mistos,3,"Comprometimento total ou parcial de segurança, serviços ou estruturas",15,Inundação de estruturas ou superfícies por precipitação intensa,3315 - Inundação de estruturas ou superfícies por precipitação intensa,2,Norte,5,Area M. Porto,196,Trofa,131810,Bougado (São Martinho e Santiago), --- ,"Rua Imaculada Conceição, 231",2,0,2,1,0,0,1,41.329536,-8.558796,41.329536°N 8.558796°W,"41°19,7700'N 8°33,5280'W ","41° 19' 46,20'' N 8° 33' 31,68'' W ",1770201120000,33 - Em Despacho,Intervenções em Infraestruturas e vias de comunicação,26702200,-8.558796,41.329536,20260180204, --- ,Norte,196,2026-02-03T22:20:00Z,2026-02-03,Despacho De 1º Alerta,3315,0,1,2,Despacho De 1º Alerta,Trofa,Porto,Norte,-8.558796,41.329536,Inundação de estruturas ou superfícies por precipitação intensa
38412362,20260180297,5,Chegada ao TO,Em Despacho,1,Reduzida,03/02/2026 22:49,1770158940000,2026-02-03,22:49,2026,0/11:43,703,---,3313,3,Riscos Mistos,3,"Comprometimento total ou parcial de segurança, serviços ou estruturas",13,Movimento de massa,3313 - Movimento de massa,4,Lisboa e Vale do Tejo,16,Oeste,160,Torres Vedras,111326,"S.pedro e Santiago, S.maria e S.miguel e Matacães",Cucos,N9  Km 69,2,0,2,1,0,0,1,39.09284,-9.24041,39.092840°N 9.240410°W,"39°5,5680'N 9°14,4240'W ","39° 5' 34,08'' N 9° 14' 25,44'' W ",1770201120000,33 - Em Curso,Intervenções em Infraestruturas e vias de comunicação,26702293,-9.24041,39.09284,20260180297,Cucos,Lisboa e Vale do Tejo,160,2026-02-03T22:49:00Z,2026-02-03,Chegada Ao to,3313,0,1,2,Chegada Ao to,Torres Vedras,Lisboa,Centro,-9.24041,39.09284,Movimento de massa
38412364,20260180709,6,Em Curso,Em Curso,1,Reduzida,03/02/2026 20:20,1770150000000,2026-02-03,20:20,2026,1/14:12,852,---,3315,3,Riscos Mistos,3,"Comprometimento total ou parcial de segurança, serviços ou estruturas",15,Inundação de estruturas ou superfícies por precipitação intensa,3315 - Inundação de estruturas ou superfícies por precipitação intensa,4,Lisboa e Vale do Tejo,1,Grande Lisboa,152,Cascais,110506,São Domingos de Rana,SÃO DOMINGOS DE RANA,EN249 Junto Auto BArao,0,0,0,0,0,0,0,38.702729,-9.340115,38.702729°N 9.340115°W,"38°42,1620'N 9°20,4060'W ","38° 42' 9,72'' N 9° 20' 24,36'' W ",1770201120000,33 - Em Curso,Intervenções em Infraestruturas e vias de comunicação,26702709,-9.340115,38.702729,20260180709,SÃO DOMINGOS DE RANA,Lisboa e Vale do Tejo,152,2026-02-03T20:20:00Z,2026-02-03,Em Curso,3315,0,0,0,Curso,Cascais,Lisboa,Área Metropolitana De Lisboa,-9.340115,38.702729,Inundação de estruturas ou superfícies por precipitação intensa
38412365,20260180807,6,Em Curso,Em Curso,2,Moderada,04/02/2026 01:16,1770167760000,2026-02-04,01:16,2026,0/09:16,556,---,1101,1,Riscos Naturais,1,Fenómenos Naturais,1,Cheia,1101 - Cheia,5,Alentejo,19,Alentejo Litoral,226,Santiago do Cacém,150912,"Santiago do Cacém, S.cruz e São Bartolomeu da Serra",Santiago do Cacém,E.N. 261 Moinhos do Escaravelhos,0,0,0,0,0,0,0,38.017495,-8.708165,38.017495°N 8.708165°W,"38°1,0500'N 8°42,4920'W ","38° 1' 3,00'' N 8° 42' 29,52'' W ",1770201120000,11 - Em Curso,Outras ocorrências de proteção e socorro,26702807,-8.708165,38.017495,20260180807,Santiago do Cacém,Alentejo,226,2026-02-04T01:16:00Z,2026-02-04,Em Curso,1101,0,0,0,Curso,Santiago Do Cacém,Setúbal,Alentejo,-8.708165,38.017495,Cheia
38412366,20260180882,6,Em Curso,Em Curso,1,Reduzida,04/02/2026 02:05,1770170700000,2026-02-04,02:05,2026,0/08:27,507,---,3313,3,Riscos Mistos,3,"Comprometimento total ou parcial de segurança, serviços ou estruturas",13,Movimento de massa,3313 - Movimento de massa,5,Alentejo,19,Alentejo Litoral,230,Sines,151301,Sines,SINES,E. R 1109 Junto á Herdade da Samoqueira - Porto Covo,0,0,0,0,0,0,0,37.963534,-8.854536,37.963534°N 8.854536°W,"37°57,8100'N 8°51,2700'W ","37° 57' 48,60'' N 8° 51' 16,20'' W ",1770201120000,33 - Em Curso,Intervenções em Infraestruturas e vias de comunicação,26702882,-8.854536,37.963534,20260180882,SINES,Alentejo,230,2026-02-04T02:05:00Z,2026-02-04,Em Curso,3313,0,0,0,Curso,Sines,Setúbal,Alentejo,-8.854536,37.963534,Movimento de massa
38412367,20260180941,5,Chegada ao TO,Em Despacho,2,Moderada,04/02/2026 02:30,1770172200000,2026-02-04,02:30,2026,0/08:02,482,---,1101,1,Riscos Naturais,1,Fenómenos Naturais,1,Cheia,1101 - Cheia,5,Alentejo,19,Alentejo Litoral,226,Santiago do Cacém,150901,Abela,ABELA,Ponte Monte Feio / E.N 390 Cruzamento de São Domingos / Abela,3,0,3,1,0,0,1,38.005515,-8.560055,38.005515°N 8.560055°W,"38°0,3300'N 8°33,6060'W ","38° 0' 19,80'' N 8° 33' 36,36'' W ",1770201120000,11 - Em Curso,Outras ocorrências de proteção e socorro,26702941,-8.560055,38.005515,20260180941,ABELA,Alentejo,226,2026-02-04T02:30:00Z,2026-02-04,Chegada Ao to,1101,0,1,3,Chegada Ao to,Santiago Do Cacém,Setúbal,Alentejo,-8.560055,38.005515,Cheia
38412371,20260181228,5,Despacho de 1º Alerta,Em Despacho,1,Reduzida,04/02/2026 06:38,1770187080000,2026-02-04,06:38,2026,0/03:54,234,---,3315,3,Riscos Mistos,3,"Comprometimento total ou parcial de segurança, serviços ou estruturas",15,Inundação de estruturas ou superfícies por precipitação intensa,3315 - Inundação de estruturas ou superfícies por precipitação intensa,4,Lisboa e Vale do Tejo,26,Península de Setúbal,225,Palmela,150804,Quinta do Anjo,Quinta do Anjo,"R laranjeiras lt18 Quinta do Anjo, Palmela, Portugal",3,0,3,1,0,0,1,38.56685,-8.94285,38.566850°N 8.942850°W,"38°34,0140'N 8°56,5740'W ","38° 34' 0,84'' N 8° 56' 34,44'' W ",1770201120000,33 - Em Despacho,Intervenções em Infraestruturas e vias de comunicação,26703228,-8.94285,38.56685,20260181228,Quinta do Anjo,Lisboa e Vale do Tejo,225,2026-02-04T06:38:00Z,2026-02-04,Despacho De 1º Alerta,3315,0,1,3,Despacho De 1º Alerta,Palmela,Setúbal,Área Metropolitana De Lisboa,-8.94285,38.56685,Inundação de estruturas ou superfícies por precipitação intensa
38412372,20260181236,7,Em Resolução,Em Resolução,1,Reduzida,04/02/2026 06:30,1770186600000,2026-02-04,06:30,2026,0/04:02,242,---,3315,3,Riscos Mistos,3,"Comprometimento total ou parcial de segurança, serviços ou estruturas",15,Inundação de estruturas ou superfícies por precipitação intensa,3315 - Inundação de estruturas ou superfícies por precipitação intensa,4,Lisboa e Vale do Tejo,1,Grande Lisboa,161,Vila Franca de Xira,111414,Castanheira do Ribatejo e Cachoeiras,Castanheira do Ribatejo,Rua da Estação,7,0,7,2,0,0,2,38.987034,-8.966389,38.987034°N 8.966389°W,"38°59,2200'N 8°57,9840'W ","38° 59' 13,20'' N 8° 57' 59,04'' W ",1770201120000,33 - Em Resolução,Intervenções em Infraestruturas e vias de comunicação,26703236,-8.966389,38.987034,20260181236,Castanheira do Ribatejo,Lisboa e Vale do Tejo,161,2026-02-04T06:30:00Z,2026-02-04,Em resolução/conclusão,3315,0,2,7,Resolução/Conclusão,Vila Franca De Xira,Lisboa,Área Metropolitana De Lisboa,-8.966389,38.987034,Inundação de estruturas ou superfícies por precipitação intensa
38412373,20260181280,8,Em Conclusão,Em Conclusão,1,Reduzida,04/02/2026 06:58,1770188280000,2026-02-04,06:58,2026,0/03:34,214,---,3315,3,Riscos Mistos,3,"Comprometimento total ou parcial de segurança, serviços ou estruturas",15,Inundação de estruturas ou superfícies por precipitação intensa,3315 - Inundação de estruturas ou superfícies por precipitação intensa,3,Centro,10,Região de Aveiro,10,Ílhavo,011008,Ílhavo (São Salvador),Ílhavo (São Salvador),Estrada da Ponte ,2,0,2,1,0,0,1,40.58811,-8.684811,40.588110°N 8.684811°W,"40°35,2860'N 8°41,0880'W ","40° 35' 17,16'' N 8° 41' 5,28'' W ",1770201120000,33 - Em Conclusão,Intervenções em Infraestruturas e vias de comunicação,26703280,-8.684811,40.58811,20260181280,Ílhavo (São Salvador),Centro,10,2026-02-04T06:58:00Z,2026-02-04,Em resolução/conclusão,3315,0,1,2,Resolução/Conclusão,Ílhavo,Aveiro,Centro,-8.684811,40.58811,Inundação de estruturas ou superfícies por precipitação intensa
38412375,20260181287,5,Despacho de 1º Alerta,Em Despacho,1,Reduzida,04/02/2026 06:30,1770186600000,2026-02-04,06:30,2026,0/04:02,242,---,3315,3,Riscos Mistos,3,"Comprometimento total ou parcial de segurança, serviços ou estruturas",15,Inundação de estruturas ou superfícies por precipitação intensa,3315 - Inundação de estruturas ou superfícies por precipitação intensa,5,Alentejo,19,Alentejo Litoral,222,Grândola,150506,Grândola e Santa Margarida da Serra,GRÂNDOLA,IC1 / Saída da A2 para Grândola,0,0,0,0,0,0,0,38.173088,-8.5587510000000009,38.173088°N 8.558751°W,"38°10,3860'N 8°33,5280'W ","38° 10' 23,16'' N 8° 33' 31,68'' W ",1770201120000,33 - Em Despacho,Intervenções em Infraestruturas e vias de comunicação,26703287,-8.5587510000000009,38.173088,20260181287,GRÂNDOLA,Alentejo,222,2026-02-04T06:30:00Z,2026-02-04,Despacho De 1º Alerta,3315,0,0,0,Despacho De 1º Alerta,Grândola,Setúbal,Alentejo,-8.5587510000000009,38.173088,Inundação de estruturas ou superfícies por precipitação intensa
38412376,20260181311,6,Em Curso,Em Curso,1,Reduzida,04/02/2026 07:09,1770188940000,2026-02-04,07:09,2026,0/03:23,203,---,3315,3,Riscos Mistos,3,"Comprometimento total ou parcial de segurança, serviços ou estruturas",15,Inundação de estruturas ou superfícies por precipitação intensa,3315 - Inundação de estruturas ou superfícies por precipitação intensa,6,Algarve,23,Algarve,113,São Brás de Alportel,081201,São Brás de Alportel,São Brás de Alportel,Rua Padre Inácio,3,0,3,1,0,0,1,37.15396,-7.880108,37.153960°N 7.880108°W,"37°9,2400'N 7°52,8060'W ","37° 9' 14,40'' N 7° 52' 48,36'' W ",1770201120000,33 - Em Curso,Intervenções em Infraestruturas e vias de comunicação,26703311,-7.880108,37.15396,20260181311,São Brás de Alportel,Algarve,113,2026-02-04T07:09:00Z,2026-02-04,Em Curso,3315,0,1,3,Curso,São Brás De Alportel,Faro,Algarve,-7.880108,37.15396,Inundação de estruturas ou superfícies por precipitação intensa
38412377,20260181316,6,Em Curso,Em Curso,1,Reduzida,04/02/2026 07:02,1770188520000,2026-02-04,07:02,2026,0/03:30,210,---,3301,3,Riscos Mistos,3,"Comprometimento total ou parcial de segurança, serviços ou estruturas",1,Queda de Árvore,3301 - Queda de Árvore,4,Lisboa e Vale do Tejo,1,Grande Lisboa,152,Cascais,110507,Carcavelos e Parede,Carcavelos,Av de poirtugal,7,0,7,2,0,0,1,38.688343,-9.337574,38.688343°N 9.337574°W,"38°41,2980'N 9°20,2560'W ","38° 41' 17,88'' N 9° 20' 15,36'' W ",1770201120000,33 - Em Curso,Intervenções em Infraestruturas e vias de comunicação,26703316,-9.337574,38.688343,20260181316,Carcavelos,Lisboa e Vale do Tejo,152,2026-02-04T07:02:00Z,2026-02-04,Em Curso,3301,0,2,7,Curso,Cascais,Lisboa,Área Metropolitana De Lisboa,-9.337574,38.688343,Queda de Árvore
38412380,20260181415,5,Despacho de 1º Alerta,Em Despacho,1,Reduzida,04/02/2026 07:32,1770190320000,2026-02-04,07:32,2026,0/03:00,180,---,3313,3,Riscos Mistos,3,"Comprometimento total ou parcial de segurança, serviços ou estruturas",13,Movimento de massa,3313 - Movimento de massa,5,Alentejo,22,Baixo Alentejo,32,Serpa,021303,Pias,EN 392 - Junto à linha Comboio,EN 392 - Junto à linha Comboio,2,0,2,1,0,0,1,38.00606,-7.467487,38.006060°N 7.467487°W,"38°0,3660'N 7°28,0500'W ","38° 0' 21,96'' N 7° 28' 3,00'' W ",1770201120000,33 - Em Despacho,Intervenções em Infraestruturas e vias de comunicação,26703415,-7.467487,38.00606,20260181415,EN 392 - Junto à linha Comboio,Alentejo,32,2026-02-04T07:32:00Z,2026-02-04,Despacho De 1º Alerta,3313,0,1,2,Despacho De 1º Alerta,Serpa,Beja,Alentejo,-7.467487,38.00606,Movimento de massa
38412381,20260181442,5,Despacho de 1º Alerta,Em Despacho,1,Reduzida,04/02/2026 07:44,1770191040000,2026-02-04,07:44,2026,0/02:48,168,---,3315,3,Riscos Mistos,3,"Comprometimento total ou parcial de segurança, serviços ou estruturas",15,Inundação de estruturas ou superfícies por precipitação intensa,3315 - Inundação de estruturas ou superfícies por precipitação intensa,5,Alentejo,22,Baixo Alentejo,24,Beja,020524,Trigaches e São Brissos,Trigaches,Rua do Poço da Aldeia,0,0,0,0,0,0,0,38.089965,-7.967792,38.089965°N 7.967792°W,"38°5,4000'N 7°58,0680'W ","38° 5' 24,00'' N 7° 58' 4,08'' W ",1770201120000,33 - Em Despacho,Intervenções em Infraestruturas e vias de comunicação,26703442,-7.967792,38.089965,20260181442,Trigaches,Alentejo,24,2026-02-04T07:44:00Z,2026-02-04,Despacho De 1º Alerta,3315,0,0,0,Despacho De 1º Alerta,Beja,Beja,Alentejo,-7.967792,38.089965,Inundação de estruturas ou superfícies por precipitação intensa
38412382,20260181517,5,Chegada ao TO,Em Despacho,1,Reduzida,04/02/2026 08:02,1770192120000,2026-02-04,08:02,2026,0/02:30,150,---,3301,3,Riscos Mistos,3,"Comprometimento total ou parcial de segurança, serviços ou estruturas",1,Queda de Árvore,3301 - Queda de Árvore,3,Centro,11,Região de Coimbra,73,Coimbra,060336,Santa Clara e Castelo Viegas,Lages,Rua Central das Lages 16,0,0,0,0,0,0,0,40.194738,-8.430232,40.194738°N 8.430232°W,"40°11,6820'N 8°25,8120'W ","40° 11' 40,92'' N 8° 25' 48,72'' W ",1770201120000,33 - Em Curso,Intervenções em Infraestruturas e vias de comunicação,26703517,-8.430232,40.194738,20260181517,Lages,Centro,73,2026-02-04T08:02:00Z,2026-02-04,Chegada Ao to,3301,0,0,0,Chegada Ao to,Coimbra,Coimbra,Centro,-8.430232,40.194738,Queda de Árvore
38412383,20260181523,5,Despacho de 1º Alerta,Em Despacho,1,Reduzida,04/02/2026 07:55,1770191700000,2026-02-04,07:55,2026,0/02:37,157,---,3301,3,Riscos Mistos,3,"Comprometimento total ou parcial de segurança, serviços ou estruturas",1,Queda de Árvore,3301 - Queda de Árvore,4,Lisboa e Vale do Tejo,16,Oeste,132,Alcobaça,100121,Alcobaça e Vestiaria,ALCOBAÇA,Junto ao cemitério,2,0,2,1,0,0,1,39.549944000000004,-8.970766,39.549944°N 8.970766°W,"39°32,9940'N 8°58,2480'W ","39° 32' 59,64'' N 8° 58' 14,88'' W ",1770201120000,33 - Em Despacho,Intervenções em Infraestruturas e vias de comunicação,26703523,-8.970766,39.549944000000004,20260181523,ALCOBAÇA,Lisboa e Vale do Tejo,132,2026-02-04T07:55:00Z,2026-02-04,Despacho De 1º Alerta,3301,0,1,2,Despacho De 1º Alerta,Alcobaça,Leiria,Centro,-8.970766,39.549944000000004,Queda de Árvore
38412384,20260181540,5,Despacho de 1º Alerta,Em Despacho,1,Reduzida,04/02/2026 08:07,1770192420000,2026-02-04,08:07,2026,0/02:25,145,---,3315,3,Riscos Mistos,3,"Comprometimento total ou parcial de segurança, serviços ou estruturas",15,Inundação de estruturas ou superfícies por precipitação intensa,3315 - Inundação de estruturas ou superfícies por precipitação intensa,5,Alentejo,22,Baixo Alentejo,24,Beja,020520,Beja (Salvador e Santa Maria da Feira),União das Freguesias de Beja (Salvador e Santa Maria da Feira),"Estrada dos Apolinários, 7800 Beja, Portugal",0,0,0,0,0,0,0,38.0223,-7.84494,38.022300°N 7.844940°W,"38°1,3380'N 7°50,6940'W ","38° 1' 20,28'' N 7° 50' 41,64'' W ",1770201120000,33 - Em Despacho,Intervenções em Infraestruturas e vias de comunicação,26703540,-7.84494,38.0223,20260181540,União das Freguesias de Beja (Salvador e Santa Maria da Feira),Alentejo,24,2026-02-04T08:07:00Z,2026-02-04,Despacho De 1º Alerta,3315,0,0,0,Despacho De 1º Alerta,Beja,Beja,Alentejo,-7.84494,38.0223,Inundação de estruturas ou superfícies por precipitação intensa
38412385,20260181572,5,Despacho de 1º Alerta,Em Despacho,1,Reduzida,04/02/2026 08:11,1770192660000,2026-02-04,08:11,2026,0/02:21,141,---,3301,3,Riscos Mistos,3,"Comprometimento total ou parcial de segurança, serviços ou estruturas",1,Queda de Árvore,3301 - Queda de Árvore,4,Lisboa e Vale do Tejo,18,Lezíria do Tejo,150,Azambuja,110303,Aveiras de Cima,AVEIRAS DE CIMA, --- ,3,0,3,1,0,0,1,39.139731,-8.897636,39.139731°N 8.897636°W,"39°8,3820'N 8°53,8560'W ","39° 8' 22,92'' N 8° 53' 51,36'' W ",1770201120000,33 - Em Despacho,Intervenções em Infraestruturas e vias de comunicação,26703572,-8.897636,39.139731,20260181572,AVEIRAS DE CIMA,Lisboa e Vale do Tejo,150,2026-02-04T08:11:00Z,2026-02-04,Despacho De 1º Alerta,3301,0,1,3,Despacho De 1º Alerta,Azambuja,Lisboa,Alentejo,-8.897636,39.139731,Queda de Árvore
38412386,20260181602,5,Despacho de 1º Alerta,Em Despacho,1,Reduzida,04/02/2026 08:10,1770192600000,2026-02-04,08:10,2026,0/02:22,142,---,3301,3,Riscos Mistos,3,"Comprometimento total ou parcial de segurança, serviços ou estruturas",1,Queda de Árvore,3301 - Queda de Árvore,3,Centro,12,Região de Leiria,138,Castanheira de Pêra,100703,Castanheira de Pêra e Coentral,CASTANHEIRA DE PERA,Castanheira de Pera,2,0,2,1,0,0,1,40.005971,-8.209236,40.005971°N 8.209236°W,"40°0,3600'N 8°12,5520'W ","40° 0' 21,60'' N 8° 12' 33,12'' W ",1770201120000,33 - Em Despacho,Intervenções em Infraestruturas e vias de comunicação,26703602,-8.209236,40.005971,20260181602,CASTANHEIRA DE PERA,Centro,138,2026-02-04T08:10:00Z,2026-02-04,Despacho De 1º Alerta,3301,0,1,2,Despacho De 1º Alerta,Castanheira De Pêra,Leiria,Centro,-8.209236,40.005971,Queda de Árvore
38412387,20260181604,5,Despacho de 1º Alerta,Em Despacho,1,Reduzida,04/02/2026 08:10,1770192600000,2026-02-04,08:10,2026,0/02:22,142,---,3301,3,Riscos Mistos,3,"Comprometimento total ou parcial de segurança, serviços ou estruturas",1,Queda de Árvore,3301 - Queda de Árvore,4,Lisboa e Vale do Tejo,1,Grande Lisboa,154,Loures,110708,Lousa,Freixeira,Estrada Velha da Freixeira,9,0,9,3,0,0,2,38.906557,-9.222521,38.906557°N 9.222521°W,"38°54,3960'N 9°13,3500'W ","38° 54' 23,76'' N 9° 13' 21,00'' W ",1770201120000,33 - Em Despacho,Intervenções em Infraestruturas e vias de comunicação,26703604,-9.222521,38.906557,20260181604,Freixeira,Lisboa e Vale do Tejo,154,2026-02-04T08:10:00Z,2026-02-04,Despacho De 1º Alerta,3301,0,3,9,Despacho De 1º Alerta,Loures,Lisboa,Área Metropolitana De Lisboa,-9.222521,38.906557,Queda de Árvore
38412388,20260181606,5,Despacho de 1º Alerta,Em Despacho,1,Reduzida,04/02/2026 08:14,1770192840000,2026-02-04,08:14,2026,0/02:18,138,---,3315,3,Riscos Mistos,3,"Comprometimento total ou parcial de segurança, serviços ou estruturas",15,Inundação de estruturas ou superfícies por precipitação intensa,3315 - Inundação de estruturas ou superfícies por precipitação intensa,3,Centro,14,Beiras e Serra da Estrela,63,Fundão,050434,"Fundão, Valverde, Donas, Aldeia de Joanes e Aldeia Nova do Cabo",FUNDÃO,Caminho das Cesmarias,3,0,3,1,0,0,1,40.138491,-7.505345,40.138491°N 7.505345°W,"40°8,3100'N 7°30,3180'W ","40° 8' 18,60'' N 7° 30' 19,08'' W ",1770201120000,33 - Em Despacho,Intervenções em Infraestruturas e vias de comunicação,26703606,-7.505345,40.138491,20260181606,FUNDÃO,Centro,63,2026-02-04T08:14:00Z,2026-02-04,Despacho De 1º Alerta,3315,0,1,3,Despacho De 1º Alerta,Fundão,Castelo Branco,Centro,-7.505345,40.138491,Inundação de estruturas ou superfícies por precipitação intensa
38412389,20260181612,6,Em Curso,Em Curso,1,Reduzida,04/02/2026 08:18,1770193080000,2026-02-04,08:18,2026,0/02:14,134,---,3313,3,Riscos Mistos,3,"Comprometimento total ou parcial de segurança, serviços ou estruturas",13,Movimento de massa,3313 - Movimento de massa,4,Lisboa e Vale do Tejo,1,Grande Lisboa,157,Oeiras,111012,"Algés, Linda-a-Velha e Cruz Quebrada-Dafundo",Cruz Quebrada,Rua Sacadura Cabral 53,11,0,11,5,0,0,3,38.70033,-9.2461,38.700330°N 9.246100°W,"38°42,0180'N 9°14,7660'W ","38° 42' 1,08'' N 9° 14' 45,96'' W ",1770201120000,33 - Em Curso,Intervenções em Infraestruturas e vias de comunicação,26703612,-9.2461,38.70033,20260181612,Cruz Quebrada,Lisboa e Vale do Tejo,157,2026-02-04T08:18:00Z,2026-02-04,Em Curso,3313,0,5,11,Curso,Oeiras,Lisboa,Área Metropolitana De Lisboa,-9.2461,38.70033,Movimento de massa
38412390,20260181619,5,Despacho de 1º Alerta,Em Despacho,1,Reduzida,04/02/2026 07:35,1770190500000,2026-02-04,07:35,2026,0/02:57,177,---,1101,1,Riscos Naturais,1,Fenómenos Naturais,1,Cheia,1101 - Cheia,5,Alentejo,19,Alentejo Litoral,230,Sines,151302,Porto Covo,PORTO COVO,E.M 1109 São Torpes / Porto Covo,1,0,1,1,0,0,1,37.852205,-8.788684,37.852205°N 8.788684°W,"37°51,1320'N 8°47,3220'W ","37° 51' 7,92'' N 8° 47' 19,32'' W ",1770201120000,11 - Em Despacho,Outras ocorrências de proteção e socorro,26703619,-8.788684,37.852205,20260181619,PORTO COVO,Alentejo,230,2026-02-04T07:35:00Z,2026-02-04,Despacho De 1º Alerta,1101,0,1,1,Despacho De 1º Alerta,Sines,Setúbal,Alentejo,-8.788684,37.852205,Cheia
38412392,20260181626,5,Despacho de 1º Alerta,Em Despacho,1,Reduzida,04/02/2026 08:20,1770193200000,2026-02-04,08:20,2026,0/02:12,132,---,3301,3,Riscos Mistos,3,"Comprometimento total ou parcial de segurança, serviços ou estruturas",1,Queda de Árvore,3301 - Queda de Árvore,4,Lisboa e Vale do Tejo,26,Península de Setúbal,229,Setúbal,151210,"S.julião, N.s. da Anunciada e S. Maria da Graça","União das Freguesias de Setúbal (São Julião, Nossa Senhora da Anunciada e Santa Maria da Graça)","Ecoparque do Outão, N379-1, 2900 Setúbal, Portugal",5,0,5,1,0,0,1,38.50343,-8.92841,38.503430°N 8.928410°W,"38°30,2040'N 8°55,7040'W ","38° 30' 12,24'' N 8° 55' 42,24'' W ",1770201120000,33 - Em Despacho,Intervenções em Infraestruturas e vias de comunicação,26703626,-8.92841,38.50343,20260181626,"União das Freguesias de Setúbal (São Julião, Nossa Senhora da Anunciada e Santa Maria da Graça)",Lisboa e Vale do Tejo,229,2026-02-04T08:20:00Z,2026-02-04,Despacho De 1º Alerta,3301,0,1,5,Despacho De 1º Alerta,Setúbal,Setúbal,Área Metropolitana De Lisboa,-8.92841,38.50343,Queda de Árvore
38412393,20260181629,7,Em Resolução,Em Resolução,3,Elevada,04/02/2026 08:21,1770193260000,2026-02-04,08:21,2026,0/02:11,131,---,3315,3,Riscos Mistos,3,"Comprometimento total ou parcial de segurança, serviços ou estruturas",15,Inundação de estruturas ou superfícies por precipitação intensa,3315 - Inundação de estruturas ou superfícies por precipitação intensa,5,Alentejo,21,Alentejo Central,96,Portel,070906,Santana,IP2 km 313,IP2 km 313,2,0,2,1,0,0,1,38.260823,-7.774307,38.260823°N 7.774307°W,"38°15,6480'N 7°46,4580'W ","38° 15' 38,88'' N 7° 46' 27,48'' W ",1770201120000,33 - Em Resolução,Intervenções em Infraestruturas e vias de comunicação,26703629,-7.774307,38.260823,20260181629,IP2 km 313,Alentejo,96,2026-02-04T08:21:00Z,2026-02-04,Em resolução/conclusão,3315,0,1,2,Resolução/Conclusão,Portel,Évora,Alentejo,-7.774307,38.260823,Inundação de estruturas ou superfícies por precipitação intensa
38412394,20260181636,5,Despacho de 1º Alerta,Em Despacho,1,Reduzida,04/02/2026 08:20,1770193200000,2026-02-04,08:20,2026,0/02:12,132,---,3301,3,Riscos Mistos,3,"Comprometimento total ou parcial de segurança, serviços ou estruturas",1,Queda de Árvore,3301 - Queda de Árvore,3,Centro,15,Beira Baixa,69,Vila de Rei,051001,Fundada,Monte Novo,Monte Novo,5,0,5,1,0,0,1,39.740308,-8.154107,39.740308°N 8.154107°W,"39°44,4180'N 8°9,2460'W ","39° 44' 25,08'' N 8° 9' 14,76'' W ",1770201120000,33 - Em Despacho,Intervenções em Infraestruturas e vias de comunicação,26703636,-8.154107,39.740308,20260181636,Monte Novo,Centro,69,2026-02-04T08:20:00Z,2026-02-04,Despacho De 1º Alerta,3301,0,1,5,Despacho De 1º Alerta,Vila De Rei,Castelo Branco,Centro,-8.154107,39.740308,Queda de Árvore
38412395,20260181653,5,Despacho de 1º Alerta,Em Despacho,1,Reduzida,04/02/2026 07:35,1770190500000,2026-02-04,07:35,2026,0/02:57,177,---,3315,3,Riscos Mistos,3,"Comprometimento total ou parcial de segurança, serviços ou estruturas",15,Inundação de estruturas ou superfícies por precipitação intensa,3315 - Inundação de estruturas ou superfícies por precipitação intensa,4,Lisboa e Vale do Tejo,1,Grande Lisboa,152,Cascais,110507,Carcavelos e Parede,Parede,Rua Padre Agostinho Pereira da Silva nº618,2,0,2,1,0,0,1,38.690219,-9.355169,38.690219°N 9.355169°W,"38°41,4120'N 9°21,3120'W ","38° 41' 24,72'' N 9° 21' 18,72'' W ",1770201120000,33 - Em Despacho,Intervenções em Infraestruturas e vias de comunicação,26703653,-9.355169,38.690219,20260181653,Parede,Lisboa e Vale do Tejo,152,2026-02-04T07:35:00Z,2026-02-04,Despacho De 1º Alerta,3315,0,1,2,Despacho De 1º Alerta,Cascais,Lisboa,Área Metropolitana De Lisboa,-9.355169,38.690219,Inundação de estruturas ou superfícies por precipitação intensa
38412397,20260181677,5,Despacho de 1º Alerta,Em Despacho,1,Reduzida,04/02/2026 08:29,1770193740000,2026-02-04,08:29,2026,0/02:03,123,---,3301,3,Riscos Mistos,3,"Comprometimento total ou parcial de segurança, serviços ou estruturas",1,Queda de Árvore,3301 - Queda de Árvore,4,Lisboa e Vale do Tejo,1,Grande Lisboa,158,Sintra,111128,"S.maria, S.miguel, S.martinho, S.pedro Penaferrim",Linhó,Alameda da Fonte Velha 50C1,7,0,7,2,0,0,1,38.768062,-9.380334,38.768062°N 9.380334°W,"38°46,0860'N 9°22,8180'W ","38° 46' 5,16'' N 9° 22' 49,08'' W ",1770201120000,33 - Em Despacho,Intervenções em Infraestruturas e vias de comunicação,26703677,-9.380334,38.768062,20260181677,Linhó,Lisboa e Vale do Tejo,158,2026-02-04T08:29:00Z,2026-02-04,Despacho De 1º Alerta,3301,0,2,7,Despacho De 1º Alerta,Sintra,Lisboa,Área Metropolitana De Lisboa,-9.380334,38.768062,Queda de Árvore
38412398,20260181680,5,Despacho de 1º Alerta,Em Despacho,1,Reduzida,04/02/2026 08:22,1770193320000,2026-02-04,08:22,2026,0/02:10,130,---,3313,3,Riscos Mistos,3,"Comprometimento total ou parcial de segurança, serviços ou estruturas",13,Movimento de massa,3313 - Movimento de massa,3,Centro,14,Beiras e Serra da Estrela,126,Mêda,090907,Longroiva,LONGROIVA,EN 331 - N 102 ,6,0,6,4,0,0,2,40.963165,-7.207772,40.963165°N 7.207772°W,"40°57,7920'N 7°12,4680'W ","40° 57' 47,52'' N 7° 12' 28,08'' W ",1770201120000,33 - Em Despacho,Intervenções em Infraestruturas e vias de comunicação,26703680,-7.207772,40.963165,20260181680,LONGROIVA,Centro,126,2026-02-04T08:22:00Z,2026-02-04,Despacho De 1º Alerta,3313,0,4,6,Despacho De 1º Alerta,Mêda,Guarda,Centro,-7.207772,40.963165,Movimento de massa
38412399,20260181698,5,Despacho de 1º Alerta,Em Despacho,1,Reduzida,04/02/2026 08:29,1770193740000,2026-02-04,08:29,2026,0/02:03,123,---,3301,3,Riscos Mistos,3,"Comprometimento total ou parcial de segurança, serviços ou estruturas",1,Queda de Árvore,3301 - Queda de Árvore,3,Centro,15,Beira Baixa,68,Sertã,050912,Sertã,Cabeçudo,Vale das Aveias,3,0,3,1,0,0,1,39.824425,-8.084891,39.824425°N 8.084891°W,"39°49,4640'N 8°5,0940'W ","39° 49' 27,84'' N 8° 5' 5,64'' W ",1770201120000,33 - Em Despacho,Intervenções em Infraestruturas e vias de comunicação,26703698,-8.084891,39.824425,20260181698,Cabeçudo,Centro,68,2026-02-04T08:29:00Z,2026-02-04,Despacho De 1º Alerta,3301,0,1,3,Despacho De 1º Alerta,Sertã,Castelo Branco,Centro,-8.084891,39.824425,Queda de Árvore
38412400,20260181712,7,Em Resolução,Em Resolução,1,Reduzida,04/02/2026 08:30,1770193800000,2026-02-04,08:30,2026,0/02:02,122,---,3313,3,Riscos Mistos,3,"Comprometimento total ou parcial de segurança, serviços ou estruturas",13,Movimento de massa,3313 - Movimento de massa,6,Algarve,23,Algarve,113,São Brás de Alportel,081201,São Brás de Alportel,Cova da Muda, --- ,6,0,6,4,0,0,1,37.197881,-7.897656,37.197881°N 7.897656°W,"37°11,8740'N 7°53,8620'W ","37° 11' 52,44'' N 7° 53' 51,72'' W ",1770201120000,33 - Em Resolução,Intervenções em Infraestruturas e vias de comunicação,26703712,-7.897656,37.197881,20260181712,Cova da Muda,Algarve,113,2026-02-04T08:30:00Z,2026-02-04,Em resolução/conclusão,3313,0,4,6,Resolução/Conclusão,São Brás De Alportel,Faro,Algarve,-7.897656,37.197881,Movimento de massa
38412401,20260181726,5,Despacho de 1º Alerta,Em Despacho,1,Reduzida,04/02/2026 08:30,1770193800000,2026-02-04,08:30,2026,0/02:02,122,---,3301,3,Riscos Mistos,3,"Comprometimento total ou parcial de segurança, serviços ou estruturas",1,Queda de Árvore,3301 - Queda de Árvore,3,Centro,15,Beira Baixa,69,Vila de Rei,051003,Vila de Rei,VALE DA URRA,Vale da Urra,5,0,5,1,0,0,1,39.692563,-8.077147,39.692563°N 8.077147°W,"39°41,5560'N 8°4,6260'W ","39° 41' 33,36'' N 8° 4' 37,56'' W ",1770201120000,33 - Em Despacho,Intervenções em Infraestruturas e vias de comunicação,26703726,-8.077147,39.692563,20260181726,VALE DA URRA,Centro,69,2026-02-04T08:30:00Z,2026-02-04,Despacho De 1º Alerta,3301,0,1,5,Despacho De 1º Alerta,Vila De Rei,Castelo Branco,Centro,-8.077147,39.692563,Queda de Árvore
38412402,20260181733,5,Despacho de 1º Alerta,Em Despacho,1,Reduzida,04/02/2026 08:18,1770193080000,2026-02-04,08:18,2026,0/02:14,134,---,3301,3,Riscos Mistos,3,"Comprometimento total ou parcial de segurança, serviços ou estruturas",1,Queda de Árvore,3301 - Queda de Árvore,3,Centro,11,Região de Coimbra,72,Cantanhede,060209,Ourentã,Póvoa do Bispo, --- ,2,0,2,1,0,0,1,40.385278,-8.552372,40.385278°N 8.552372°W,"40°23,1180'N 8°33,1440'W ","40° 23' 7,08'' N 8° 33' 8,64'' W ",1770201120000,33 - Em Despacho,Intervenções em Infraestruturas e vias de comunicação,26703733,-8.552372,40.385278,20260181733,Póvoa do Bispo,Centro,72,2026-02-04T08:18:00Z,2026-02-04,Despacho De 1º Alerta,3301,0,1,2,Despacho De 1º Alerta,Cantanhede,Coimbra,Centro,-8.552372,40.385278,Queda de Árvore
38412404,20260181787,5,Despacho de 1º Alerta,Em Despacho,1,Reduzida,04/02/2026 08:35,1770194100000,2026-02-04,08:35,2026,0/01:57,117,---,3315,3,Riscos Mistos,3,"Comprometimento total ou parcial de segurança, serviços ou estruturas",15,Inundação de estruturas ou superfícies por precipitação intensa,3315 - Inundação de estruturas ou superfícies por precipitação intensa,4,Lisboa e Vale do Tejo,1,Grande Lisboa,157,Oeiras,111012,"Algés, Linda-a-Velha e Cruz Quebrada-Dafundo",Linda a Velha,Lg Lagoa nº15 G,5,0,5,1,0,0,1,38.715384,-9.244903,38.715384°N 9.244903°W,"38°42,9240'N 9°14,6940'W ","38° 42' 55,44'' N 9° 14' 41,64'' W ",1770201120000,33 - Em Despacho,Intervenções em Infraestruturas e vias de comunicação,26703787,-9.244903,38.715384,20260181787,Linda a Velha,Lisboa e Vale do Tejo,157,2026-02-04T08:35:00Z,2026-02-04,Despacho De 1º Alerta,3315,0,1,5,Despacho De 1º Alerta,Oeiras,Lisboa,Área Metropolitana De Lisboa,-9.244903,38.715384,Inundação de estruturas ou superfícies por precipitação intensa
38412405,20260181823,5,Despacho de 1º Alerta,Em Despacho,1,Reduzida,04/02/2026 08:47,1770194820000,2026-02-04,08:47,2026,0/01:45,105,---,3315,3,Riscos Mistos,3,"Comprometimento total ou parcial de segurança, serviços ou estruturas",15,Inundação de estruturas ou superfícies por precipitação intensa,3315 - Inundação de estruturas ou superfícies por precipitação intensa,5,Alentejo,22,Baixo Alentejo,29,Moura,021008,Sobral da Adiça,SOBRAL DA ADIÇA,Rua Outeiro do Pocinho,2,0,2,1,0,0,1,38.02016,-7.257329,38.020160°N 7.257329°W,"38°1,2120'N 7°15,4380'W ","38° 1' 12,72'' N 7° 15' 26,28'' W ",1770201120000,33 - Em Despacho,Intervenções em Infraestruturas e vias de comunicação,26703823,-7.257329,38.02016,20260181823,SOBRAL DA ADIÇA,Alentejo,29,2026-02-04T08:47:00Z,2026-02-04,Despacho De 1º Alerta,3315,0,1,2,Despacho De 1º Alerta,Moura,Beja,Alentejo,-7.257329,38.02016,Inundação de estruturas ou superfícies por precipitação intensa
38412406,20260181826,5,Despacho de 1º Alerta,Em Despacho,1,Reduzida,04/02/2026 08:50,1770195000000,2026-02-04,08:50,2026,0/01:42,102,---,3313,3,Riscos Mistos,3,"Comprometimento total ou parcial de segurança, serviços ou estruturas",13,Movimento de massa,3313 - Movimento de massa,3,Centro,15,Beira Baixa,68,Sertã,050911,Pedrógão Pequeno,PEDROGÃO PEQUENO,EN2 - Pedrogão Pequeno,3,0,3,1,0,0,1,39.903326,-8.130771,39.903326°N 8.130771°W,"39°54,1980'N 8°7,8480'W ","39° 54' 11,88'' N 8° 7' 50,88'' W ",1770201120000,33 - Em Despacho,Intervenções em Infraestruturas e vias de comunicação,26703826,-8.130771,39.903326,20260181826,PEDROGÃO PEQUENO,Centro,68,2026-02-04T08:50:00Z,2026-02-04,Despacho De 1º Alerta,3313,0,1,3,Despacho De 1º Alerta,Sertã,Castelo Branco,Centro,-8.130771,39.903326,Movimento de massa
38412407,20260181838,5,Despacho de 1º Alerta,Em Despacho,1,Reduzida,04/02/2026 08:54,1770195240000,2026-02-04,08:54,2026,0/01:38,98,---,3315,3,Riscos Mistos,3,"Comprometimento total ou parcial de segurança, serviços ou estruturas",15,Inundação de estruturas ou superfícies por precipitação intensa,3315 - Inundação de estruturas ou superfícies por precipitação intensa,2,Norte,5,Area M. Porto,188,Paredes,131021,Sobrosa,Sobrosa,"Travessa das Campas 34, 4580-625 Paredes, Portugal",2,0,2,1,0,0,1,41.25815,-8.351181,41.258150°N 8.351181°W,"41°15,4920'N 8°21,0720'W ","41° 15' 29,52'' N 8° 21' 4,32'' W ",1770201120000,33 - Em Despacho,Intervenções em Infraestruturas e vias de comunicação,26703838,-8.351181,41.25815,20260181838,Sobrosa,Norte,188,2026-02-04T08:54:00Z,2026-02-04,Despacho De 1º Alerta,3315,0,1,2,Despacho De 1º Alerta,Paredes,Porto,Norte,-8.351181,41.25815,Inundação de estruturas ou superfícies por precipitação intensa
38412408,20260181850,5,Despacho de 1º Alerta,Em Despacho,1,Reduzida,04/02/2026 08:56,1770195360000,2026-02-04,08:56,2026,0/01:36,96,---,3313,3,Riscos Mistos,3,"Comprometimento total ou parcial de segurança, serviços ou estruturas",13,Movimento de massa,3313 - Movimento de massa,4,Lisboa e Vale do Tejo,16,Oeste,137,Caldas da Rainha,100602,Alvorninha,Alvorninha,Rua de Santa Cecilia ,2,0,2,1,0,0,1,39.40603,-9.051929,39.406030°N 9.051929°W,"39°24,3600'N 9°3,1140'W ","39° 24' 21,60'' N 9° 3' 6,84'' W ",1770201120000,33 - Em Despacho,Intervenções em Infraestruturas e vias de comunicação,26703850,-9.051929,39.40603,20260181850,Alvorninha,Lisboa e Vale do Tejo,137,2026-02-04T08:56:00Z,2026-02-04,Despacho De 1º Alerta,3313,0,1,2,Despacho De 1º Alerta,Caldas Da Rainha,Leiria,Centro,-9.051929,39.40603,Movimento de massa
38412409,20260181865,5,Despacho de 1º Alerta,Em Despacho,1,Reduzida,04/02/2026 08:29,1770193740000,2026-02-04,08:29,2026,0/02:03,123,---,3315,3,Riscos Mistos,3,"Comprometimento total ou parcial de segurança, serviços ou estruturas",15,Inundação de estruturas ou superfícies por precipitação intensa,3315 - Inundação de estruturas ou superfícies por precipitação intensa,4,Lisboa e Vale do Tejo,1,Grande Lisboa,152,Cascais,110506,São Domingos de Rana,Abóboda,R Henrique Mendes nº274,2,0,2,1,0,0,1,38.727273,-9.331695,38.727273°N 9.331695°W,"38°43,6380'N 9°19,9020'W ","38° 43' 38,28'' N 9° 19' 54,12'' W ",1770201120000,33 - Em Despacho,Intervenções em Infraestruturas e vias de comunicação,26703865,-9.331695,38.727273,20260181865,Abóboda,Lisboa e Vale do Tejo,152,2026-02-04T08:29:00Z,2026-02-04,Despacho De 1º Alerta,3315,0,1,2,Despacho De 1º Alerta,Cascais,Lisboa,Área Metropolitana De Lisboa,-9.331695,38.727273,Inundação de estruturas ou superfícies por precipitação intensa
38412410,20260181876,5,Despacho de 1º Alerta,Em Despacho,1,Reduzida,04/02/2026 08:00,1770192000000,2026-02-04,08:00,2026,0/02:32,152,---,3321,3,Riscos Mistos,3,"Comprometimento total ou parcial de segurança, serviços ou estruturas",21,Dano ou Queda de redes de fornecimento eléctrico,3321 - Dano ou Queda de redes de fornecimento eléctrico,3,Centro,15,Beira Baixa,67,Proença-a-Nova,050807,Proença-a-Nova e Peral,Serimogão,Serimogão,4,0,4,2,0,0,2,39.68611,-7.938432,39.686110°N 7.938432°W,"39°41,1660'N 7°56,3040'W ","39° 41' 9,96'' N 7° 56' 18,24'' W ",1770201120000,33 - Em Despacho,Intervenções em Infraestruturas e vias de comunicação,26703876,-7.938432,39.68611,20260181876,Serimogão,Centro,67,2026-02-04T08:00:00Z,2026-02-04,Despacho De 1º Alerta,3321,0,2,4,Despacho De 1º Alerta,Proença-a-nova,Castelo Branco,Centro,-7.938432,39.68611,Dano ou Queda de redes de fornecimento eléctrico
38412411,20260181878,5,Despacho de 1º Alerta,Em Despacho,1,Reduzida,04/02/2026 08:58,1770195480000,2026-02-04,08:58,2026,0/01:34,94,---,3313,3,Riscos Mistos,3,"Comprometimento total ou parcial de segurança, serviços ou estruturas",13,Movimento de massa,3313 - Movimento de massa,3,Centro,13,Viseu Dão Lafões,263,Nelas,180911,Santar e Moreira,Casal Sancho, --- ,5,0,5,1,0,0,1,40.57219,-7.885123,40.572190°N 7.885123°W,"40°34,3320'N 7°53,1060'W ","40° 34' 19,92'' N 7° 53' 6,36'' W ",1770201120000,33 - Em Despacho,Intervenções em Infraestruturas e vias de comunicação,26703878,-7.885123,40.57219,20260181878,Casal Sancho,Centro,263,2026-02-04T08:58:00Z,2026-02-04,Despacho De 1º Alerta,3313,0,1,5,Despacho De 1º Alerta,Nelas,Viseu,Centro,-7.885123,40.57219,Movimento de massa
38412413,20260181883,5,Despacho de 1º Alerta,Em Despacho,1,Reduzida,04/02/2026 08:50,1770195000000,2026-02-04,08:50,2026,0/01:42,102,---,3301,3,Riscos Mistos,3,"Comprometimento total ou parcial de segurança, serviços ou estruturas",1,Queda de Árvore,3301 - Queda de Árvore,3,Centro,15,Beira Baixa,65,Oleiros,050606,Madeirã,Vilar Fundeiro,Vilar Fundeiro,8,0,8,2,0,0,2,39.942941,-8.076948,39.942941°N 8.076948°W,"39°56,5740'N 8°4,6140'W ","39° 56' 34,44'' N 8° 4' 36,84'' W ",1770201120000,33 - Em Despacho,Intervenções em Infraestruturas e vias de comunicação,26703883,-8.076948,39.942941,20260181883,Vilar Fundeiro,Centro,65,2026-02-04T08:50:00Z,2026-02-04,Despacho De 1º Alerta,3301,0,2,8,Despacho De 1º Alerta,Oleiros,Castelo Branco,Centro,-8.076948,39.942941,Queda de Árvore
38412415,20260181894,5,Chegada ao TO,Em Despacho,1,Reduzida,04/02/2026 08:26,1770193560000,2026-02-04,08:26,2026,0/02:06,126,---,3315,3,Riscos Mistos,3,"Comprometimento total ou parcial de segurança, serviços ou estruturas",15,Inundação de estruturas ou superfícies por precipitação intensa,3315 - Inundação de estruturas ou superfícies por precipitação intensa,5,Alentejo,22,Baixo Alentejo,24,Beja,020504,Cabeça Gorda,SALVADA,Rua da Horta Nova nº2,0,0,0,0,0,0,0,37.937309,-7.783849,37.937309°N 7.783849°W,"37°56,2380'N 7°47,0280'W ","37° 56' 14,28'' N 7° 47' 1,68'' W ",1770201120000,33 - Em Curso,Intervenções em Infraestruturas e vias de comunicação,26703894,-7.783849,37.937309,20260181894,SALVADA,Alentejo,24,2026-02-04T08:26:00Z,2026-02-04,Chegada Ao to,3315,0,0,0,Chegada Ao to,Beja,Beja,Alentejo,-7.783849,37.937309,Inundação de estruturas ou superfícies por precipitação intensa
38412416,20260181898,5,Despacho de 1º Alerta,Em Despacho,1,Reduzida,04/02/2026 08:51,1770195060000,2026-02-04,08:51,2026,0/01:41,101,---,3315,3,Riscos Mistos,3,"Comprometimento total ou parcial de segurança, serviços ou estruturas",15,Inundação de estruturas ou superfícies por precipitação intensa,3315 - Inundação de estruturas ou superfícies por precipitação intensa,2,Norte,3,Cávado,36,Braga,030301,Adaúfe, --- ,Rua de Freire nº12 ,2,0,2,1,0,0,1,41.589984,-8.398076,41.589984°N 8.398076°W,"41°35,4000'N 8°23,8860'W ","41° 35' 24,00'' N 8° 23' 53,16'' W ",1770201120000,33 - Em Despacho,Intervenções em Infraestruturas e vias de comunicação,26703898,-8.398076,41.589984,20260181898, --- ,Norte,36,2026-02-04T08:51:00Z,2026-02-04,Despacho De 1º Alerta,3315,0,1,2,Despacho De 1º Alerta,Braga,Braga,Norte,-8.398076,41.589984,Inundação de estruturas ou superfícies por precipitação intensa
38412417,20260181899,5,Despacho de 1º Alerta,Em Despacho,1,Reduzida,04/02/2026 08:55,1770195300000,2026-02-04,08:55,2026,0/01:37,97,---,3301,3,Riscos Mistos,3,"Comprometimento total ou parcial de segurança, serviços ou estruturas",1,Queda de Árvore,3301 - Queda de Árvore,3,Centro,15,Beira Baixa,65,Oleiros,050606,Madeirã,Cava,Cava,7,0,7,2,0,0,2,39.918584,-8.020824,39.918584°N 8.020824°W,"39°55,1160'N 8°1,2480'W ","39° 55' 6,96'' N 8° 1' 14,88'' W ",1770201120000,33 - Em Despacho,Intervenções em Infraestruturas e vias de comunicação,26703899,-8.020824,39.918584,20260181899,Cava,Centro,65,2026-02-04T08:55:00Z,2026-02-04,Despacho De 1º Alerta,3301,0,2,7,Despacho De 1º Alerta,Oleiros,Castelo Branco,Centro,-8.020824,39.918584,Queda de Árvore
38412418,20260181908,5,Despacho de 1º Alerta,Em Despacho,1,Reduzida,04/02/2026 09:00,1770195600000,2026-02-04,09:00,2026,0/01:32,92,---,3311,3,Riscos Mistos,3,"Comprometimento total ou parcial de segurança, serviços ou estruturas",11,Queda de elementos de construção em estruturas edificadas,3311 - Queda de elementos de construção em estruturas edificadas,4,Lisboa e Vale do Tejo,16,Oeste,142,Nazaré,101102,Nazaré,NAZARÉ,Rua França Borges ,2,0,2,1,0,0,1,39.596083,-9.062127,39.596083°N 9.062127°W,"39°35,7660'N 9°3,7260'W ","39° 35' 45,96'' N 9° 3' 43,56'' W ",1770201120000,33 - Em Despacho,Intervenções em Infraestruturas e vias de comunicação,26703908,-9.062127,39.596083,20260181908,NAZARÉ,Lisboa e Vale do Tejo,142,2026-02-04T09:00:00Z,2026-02-04,Despacho De 1º Alerta,3311,0,1,2,Despacho De 1º Alerta,Nazaré,Leiria,Centro,-9.062127,39.596083,Queda de elementos de construção em estruturas edificadas
38412419,20260181911,5,Chegada ao TO,Em Despacho,1,Reduzida,04/02/2026 09:05,1770195900000,2026-02-04,09:05,2026,0/01:27,87,---,3313,3,Riscos Mistos,3,"Comprometimento total ou parcial de segurança, serviços ou estruturas",13,Movimento de massa,3313 - Movimento de massa,4,Lisboa e Vale do Tejo,26,Península de Setúbal,220,Almada,150313,Caparica e Trafaria,União das Freguesias de Caparica e Trafaria,Raposeira,0,0,0,0,0,0,0,38.66324,-9.24259,38.663240°N 9.242590°W,"38°39,7920'N 9°14,5560'W ","38° 39' 47,52'' N 9° 14' 33,36'' W ",1770201120000,33 - Em Curso,Intervenções em Infraestruturas e vias de comunicação,26703911,-9.24259,38.66324,20260181911,União das Freguesias de Caparica e Trafaria,Lisboa e Vale do Tejo,220,2026-02-04T09:05:00Z,2026-02-04,Chegada Ao to,3313,0,0,0,Chegada Ao to,Almada,Setúbal,Área Metropolitana De Lisboa,-9.24259,38.66324,Movimento de massa
38412420,20260181914,5,Despacho de 1º Alerta,Em Despacho,1,Reduzida,04/02/2026 08:48,1770194880000,2026-02-04,08:48,2026,0/01:44,104,---,3315,3,Riscos Mistos,3,"Comprometimento total ou parcial de segurança, serviços ou estruturas",15,Inundação de estruturas ou superfícies por precipitação intensa,3315 - Inundação de estruturas ou superfícies por precipitação intensa,4,Lisboa e Vale do Tejo,26,Península de Setúbal,223,Moita,150603,Moita,PENTEADO,Rua Antonio casquinha,4,0,4,1,0,0,1,38.636677,-8.960014,38.636677°N 8.960014°W,"38°38,2020'N 8°57,6000'W ","38° 38' 12,12'' N 8° 57' 36,00'' W ",1770201120000,33 - Em Despacho,Intervenções em Infraestruturas e vias de comunicação,26703914,-8.960014,38.636677,20260181914,PENTEADO,Lisboa e Vale do Tejo,223,2026-02-04T08:48:00Z,2026-02-04,Despacho De 1º Alerta,3315,0,1,4,Despacho De 1º Alerta,Moita,Setúbal,Área Metropolitana De Lisboa,-8.960014,38.636677,Inundação de estruturas ou superfícies por precipitação intensa
38412421,20260181927,5,Despacho de 1º Alerta,Em Despacho,1,Reduzida,04/02/2026 08:50,1770195000000,2026-02-04,08:50,2026,0/01:42,102,---,1101,1,Riscos Naturais,1,Fenómenos Naturais,1,Cheia,1101 - Cheia,5,Alentejo,22,Baixo Alentejo,24,Beja,020521,Beja (Santiago Maior e São João Baptista),BEJA 1º,Concelho Beja,1,0,1,1,0,0,1,38.014111,-7.87003,38.014111°N 7.870030°W,"38°0,8460'N 7°52,2000'W ","38° 0' 50,76'' N 7° 52' 12,00'' W ",1770201120000,11 - Em Despacho,Outras ocorrências de proteção e socorro,26703927,-7.87003,38.014111,20260181927,BEJA 1º,Alentejo,24,2026-02-04T08:50:00Z,2026-02-04,Despacho De 1º Alerta,1101,0,1,1,Despacho De 1º Alerta,Beja,Beja,Alentejo,-7.87003,38.014111,Cheia
38412422,20260181929,6,Em Curso,Em Curso,0,N/A,04/02/2026 09:05,1770195900000,2026-02-04,09:05,2026,0/01:27,87,---,3301,3,Riscos Mistos,3,"Comprometimento total ou parcial de segurança, serviços ou estruturas",1,Queda de Árvore,3301 - Queda de Árvore,6,Algarve,23,Algarve,108,Lagos,080708,Lagos (São Sebastião e Santa Maria),São Gonçalo de Lagos,Avenida da República,1,0,1,1,0,0,1,37.112811,-8.686965,37.112811°N 8.686965°W,"37°6,7680'N 8°41,2200'W ","37° 6' 46,08'' N 8° 41' 13,20'' W ",1770201120000,33 - Em Curso,Intervenções em Infraestruturas e vias de comunicação,26703929,-8.686965,37.112811,20260181929,São Gonçalo de Lagos,Algarve,108,2026-02-04T09:05:00Z,2026-02-04,Em Curso,3301,0,1,1,Curso,Lagos,Faro,Algarve,-8.686965,37.112811,Queda de Árvore
38412423,20260181943,5,Despacho de 1º Alerta,Em Despacho,1,Reduzida,04/02/2026 08:56,1770195360000,2026-02-04,08:56,2026,0/01:36,96,---,3301,3,Riscos Mistos,3,"Comprometimento total ou parcial de segurança, serviços ou estruturas",1,Queda de Árvore,3301 - Queda de Árvore,5,Alentejo,19,Alentejo Litoral,222,Grândola,150506,Grândola e Santa Margarida da Serra,Canal Caveira,IC1 KM603,5,0,5,1,0,0,1,38.134589,-8.486669,38.134589°N 8.486669°W,"38°8,0760'N 8°29,2020'W ","38° 8' 4,56'' N 8° 29' 12,12'' W ",1770201120000,33 - Em Despacho,Intervenções em Infraestruturas e vias de comunicação,26703943,-8.486669,38.134589,20260181943,Canal Caveira,Alentejo,222,2026-02-04T08:56:00Z,2026-02-04,Despacho De 1º Alerta,3301,0,1,5,Despacho De 1º Alerta,Grândola,Setúbal,Alentejo,-8.486669,38.134589,Queda de Árvore
38412424,20260181964,5,Despacho de 1º Alerta,Em Despacho,1,Reduzida,04/02/2026 08:00,1770192000000,2026-02-04,08:00,2026,0/02:32,152,---,3301,3,Riscos Mistos,3,"Comprometimento total ou parcial de segurança, serviços ou estruturas",1,Queda de Árvore,3301 - Queda de Árvore,3,Centro,15,Beira Baixa,67,Proença-a-Nova,050805,São Pedro do Esteval,SÃO PEDRO DO ESTEVAL,ER 351,4,0,4,1,0,0,1,39.635511,-7.858198,39.635511°N 7.858198°W,"39°38,1300'N 7°51,4920'W ","39° 38' 7,80'' N 7° 51' 29,52'' W ",1770201120000,33 - Em Despacho,Intervenções em Infraestruturas e vias de comunicação,26703964,-7.858198,39.635511,20260181964,SÃO PEDRO DO ESTEVAL,Centro,67,2026-02-04T08:00:00Z,2026-02-04,Despacho De 1º Alerta,3301,0,1,4,Despacho De 1º Alerta,Proença-a-nova,Castelo Branco,Centro,-7.858198,39.635511,Queda de Árvore
38412425,20260181969,5,Chegada ao TO,Em Despacho,1,Reduzida,04/02/2026 09:00,1770195600000,2026-02-04,09:00,2026,0/01:32,92,---,3301,3,Riscos Mistos,3,"Comprometimento total ou parcial de segurança, serviços ou estruturas",1,Queda de Árvore,3301 - Queda de Árvore,2,Norte,2,Alto Minho,236,Ponte da Barca,160611,Lavradas,Rua do Lestriz,Rua do Lestriz,5,0,5,2,1,0,2,41.783079,-8.46494,41.783079°N 8.464940°W,"41°46,9860'N 8°27,8940'W ","41° 46' 59,16'' N 8° 27' 53,64'' W ",1770201120000,33 - Em Curso,Intervenções em Infraestruturas e vias de comunicação,26703969,-8.46494,41.783079,20260181969,Rua do Lestriz,Norte,236,2026-02-04T09:00:00Z,2026-02-04,Chegada Ao to,3301,0,2,5,Chegada Ao to,Ponte Da Barca,Viana Do Castelo,Norte,-8.46494,41.783079,Queda de Árvore
38412427,20260181977,5,Despacho de 1º Alerta,Em Despacho,1,Reduzida,04/02/2026 08:41,1770194460000,2026-02-04,08:41,2026,0/01:51,111,---,3309,3,Riscos Mistos,3,"Comprometimento total ou parcial de segurança, serviços ou estruturas",9,Desabamento de estruturas edificadas,3309 - Desabamento de estruturas edificadas,3,Centro,15,Beira Baixa,68,Sertã,050912,Sertã,Sertã,Igreja Matriz,5,0,5,2,0,0,2,39.808756,-8.103914,39.808756°N 8.103914°W,"39°48,5280'N 8°6,2340'W ","39° 48' 31,68'' N 8° 6' 14,04'' W ",1770201120000,33 - Em Despacho,Intervenções em Infraestruturas e vias de comunicação,26703977,-8.103914,39.808756,20260181977,Sertã,Centro,68,2026-02-04T08:41:00Z,2026-02-04,Despacho De 1º Alerta,3309,0,2,5,Despacho De 1º Alerta,Sertã,Castelo Branco,Centro,-8.103914,39.808756,Desabamento de estruturas edificadas
38412428,20260181983,5,Despacho de 1º Alerta,Em Despacho,1,Reduzida,04/02/2026 08:00,1770192000000,2026-02-04,08:00,2026,0/02:32,152,---,3301,3,Riscos Mistos,3,"Comprometimento total ou parcial de segurança, serviços ou estruturas",1,Queda de Árvore,3301 - Queda de Árvore,3,Centro,15,Beira Baixa,67,Proença-a-Nova,050807,Proença-a-Nova e Peral,Proença-a-Nova,Câmara Municipal PNV,4,0,4,1,0,0,1,39.754529,-7.920738,39.754529°N 7.920738°W,"39°45,2700'N 7°55,2420'W ","39° 45' 16,20'' N 7° 55' 14,52'' W ",1770201120000,33 - Em Despacho,Intervenções em Infraestruturas e vias de comunicação,26703983,-7.920738,39.754529,20260181983,Proença-a-Nova,Centro,67,2026-02-04T08:00:00Z,2026-02-04,Despacho De 1º Alerta,3301,0,1,4,Despacho De 1º Alerta,Proença-a-nova,Castelo Branco,Centro,-7.920738,39.754529,Queda de Árvore
38412429,20260181986,7,Em Resolução,Em Resolução,1,Reduzida,04/02/2026 09:10,1770196200000,2026-02-04,09:10,2026,0/01:22,82,---,3315,3,Riscos Mistos,3,"Comprometimento total ou parcial de segurança, serviços ou estruturas",15,Inundação de estruturas ou superfícies por precipitação intensa,3315 - Inundação de estruturas ou superfícies por precipitação intensa,5,Alentejo,21,Alentejo Central,91,Estremoz,070417,Ameixial (Santa Vitória e São Bento),EM 503 Santa Vitória - Cano,EM 503 Santa Vitória - Cano,0,0,0,0,0,0,0,38.874049,-7.687328,38.874049°N 7.687328°W,"38°52,4400'N 7°41,2380'W ","38° 52' 26,40'' N 7° 41' 14,28'' W ",1770201120000,33 - Em Resolução,Intervenções em Infraestruturas e vias de comunicação,26703986,-7.687328,38.874049,20260181986,EM 503 Santa Vitória - Cano,Alentejo,91,2026-02-04T09:10:00Z,2026-02-04,Em resolução/conclusão,3315,0,0,0,Resolução/Conclusão,Estremoz,Évora,Alentejo,-7.687328,38.874049,Inundação de estruturas ou superfícies por precipitação intensa
38412430,20260181991,5,Despacho de 1º Alerta,Em Despacho,1,Reduzida,04/02/2026 09:11,1770196260000,2026-02-04,09:11,2026,0/01:21,81,---,3309,3,Riscos Mistos,3,"Comprometimento total ou parcial de segurança, serviços ou estruturas",9,Desabamento de estruturas edificadas,3309 - Desabamento de estruturas edificadas,3,Centro,15,Beira Baixa,68,Sertã,050916,Cumeada e Marmeleiro,Marmeleiro,Escola Marmeleiro,6,0,6,2,0,0,1,39.761914,-8.079426,39.761914°N 8.079426°W,"39°45,7140'N 8°4,7640'W ","39° 45' 42,84'' N 8° 4' 45,84'' W ",1770201120000,33 - Em Despacho,Intervenções em Infraestruturas e vias de comunicação,26703991,-8.079426,39.761914,20260181991,Marmeleiro,Centro,68,2026-02-04T09:11:00Z,2026-02-04,Despacho De 1º Alerta,3309,0,2,6,Despacho De 1º Alerta,Sertã,Castelo Branco,Centro,-8.079426,39.761914,Desabamento de estruturas edificadas
38412433,20260182050,5,Despacho de 1º Alerta,Em Despacho,1,Reduzida,04/02/2026 09:20,1770196800000,2026-02-04,09:20,2026,0/01:12,72,---,3301,3,Riscos Mistos,3,"Comprometimento total ou parcial de segurança, serviços ou estruturas",1,Queda de Árvore,3301 - Queda de Árvore,3,Centro,15,Beira Baixa,67,Proença-a-Nova,050802,Montes da Senhora,MONTES DA SENHORA,Montes da senhora / Froia,7,0,7,4,0,0,2,39.775896,-7.812121,39.775896°N 7.812121°W,"39°46,5540'N 7°48,7260'W ","39° 46' 33,24'' N 7° 48' 43,56'' W ",1770201120000,33 - Em Despacho,Intervenções em Infraestruturas e vias de comunicação,26704050,-7.812121,39.775896,20260182050,MONTES DA SENHORA,Centro,67,2026-02-04T09:20:00Z,2026-02-04,Despacho De 1º Alerta,3301,0,4,7,Despacho De 1º Alerta,Proença-a-nova,Castelo Branco,Centro,-7.812121,39.775896,Queda de Árvore
38412434,20260182054,5,Despacho de 1º Alerta,Em Despacho,1,Reduzida,04/02/2026 08:15,1770192900000,2026-02-04,08:15,2026,0/02:17,137,---,3315,3,Riscos Mistos,3,"Comprometimento total ou parcial de segurança, serviços ou estruturas",15,Inundação de estruturas ou superfícies por precipitação intensa,3315 - Inundação de estruturas ou superfícies por precipitação intensa,4,Lisboa e Vale do Tejo,1,Grande Lisboa,157,Oeiras,111012,"Algés, Linda-a-Velha e Cruz Quebrada-Dafundo",Dafundo,Rua Sacadura Cabral ,4,0,4,1,0,0,1,38.700095,-9.242367,38.700095°N 9.242367°W,"38°42,0060'N 9°14,5440'W ","38° 42' 0,36'' N 9° 14' 32,64'' W ",1770201120000,33 - Em Despacho,Intervenções em Infraestruturas e vias de comunicação,26704054,-9.242367,38.700095,20260182054,Dafundo,Lisboa e Vale do Tejo,157,2026-02-04T08:15:00Z,2026-02-04,Despacho De 1º Alerta,3315,0,1,4,Despacho De 1º Alerta,Oeiras,Lisboa,Área Metropolitana De Lisboa,-9.242367,38.700095,Inundação de estruturas ou superfícies por precipitação intensa
38412435,20260182056,5,Despacho de 1º Alerta,Em Despacho,1,Reduzida,04/02/2026 09:23,1770196980000,2026-02-04,09:23,2026,0/01:09,69,---,3315,3,Riscos Mistos,3,"Comprometimento total ou parcial de segurança, serviços ou estruturas",15,Inundação de estruturas ou superfícies por precipitação intensa,3315 - Inundação de estruturas ou superfícies por precipitação intensa,5,Alentejo,22,Baixo Alentejo,24,Beja,020521,Beja (Santiago Maior e São João Baptista),PENEDO GORDO,Rua 10 de Junho nº6,3,0,3,1,0,0,1,37.98629,-7.923629,37.986290°N 7.923629°W,"37°59,1780'N 7°55,4160'W ","37° 59' 10,68'' N 7° 55' 24,96'' W ",1770201120000,33 - Em Despacho,Intervenções em Infraestruturas e vias de comunicação,26704056,-7.923629,37.98629,20260182056,PENEDO GORDO,Alentejo,24,2026-02-04T09:23:00Z,2026-02-04,Despacho De 1º Alerta,3315,0,1,3,Despacho De 1º Alerta,Beja,Beja,Alentejo,-7.923629,37.98629,Inundação de estruturas ou superfícies por precipitação intensa
38412436,20260182064,5,Despacho de 1º Alerta,Em Despacho,1,Reduzida,04/02/2026 08:09,1770192540000,2026-02-04,08:09,2026,0/02:23,143,---,3315,3,Riscos Mistos,3,"Comprometimento total ou parcial de segurança, serviços ou estruturas",15,Inundação de estruturas ou superfícies por precipitação intensa,3315 - Inundação de estruturas ou superfícies por precipitação intensa,4,Lisboa e Vale do Tejo,1,Grande Lisboa,152,Cascais,110508,Cascais e Estoril,Cascais,Av. Valbom,7,0,7,3,0,0,1,38.700982,-9.419397,38.700982°N 9.419397°W,"38°42,0600'N 9°25,1640'W ","38° 42' 3,60'' N 9° 25' 9,84'' W ",1770201120000,33 - Em Despacho,Intervenções em Infraestruturas e vias de comunicação,26704064,-9.419397,38.700982,20260182064,Cascais,Lisboa e Vale do Tejo,152,2026-02-04T08:09:00Z,2026-02-04,Despacho De 1º Alerta,3315,0,3,7,Despacho De 1º Alerta,Cascais,Lisboa,Área Metropolitana De Lisboa,-9.419397,38.700982,Inundação de estruturas ou superfícies por precipitação intensa
38412437,20260182073,8,Em Conclusão,Em Conclusão,1,Reduzida,04/02/2026 09:26,1770197160000,2026-02-04,09:26,2026,0/01:06,66,---,3301,3,Riscos Mistos,3,"Comprometimento total ou parcial de segurança, serviços ou estruturas",1,Queda de Árvore,3301 - Queda de Árvore,4,Lisboa e Vale do Tejo,17,Médio Tejo,217,Ourém,142106,Fátima,FÁTIMA, --- ,0,0,0,0,0,0,0,39.619848,-8.652303,39.619848°N 8.652303°W,"39°37,1880'N 8°39,1380'W ","39° 37' 11,28'' N 8° 39' 8,28'' W ",1770201120000,33 - Em Conclusão,Intervenções em Infraestruturas e vias de comunicação,26704073,-8.652303,39.619848,20260182073,FÁTIMA,Lisboa e Vale do Tejo,217,2026-02-04T09:26:00Z,2026-02-04,Em resolução/conclusão,3301,0,0,0,Resolução/Conclusão,Ourém,Santarém,Centro,-8.652303,39.619848,Queda de Árvore
38412438,20260182076,5,Despacho de 1º Alerta,Em Despacho,1,Reduzida,04/02/2026 09:23,1770196980000,2026-02-04,09:23,2026,0/01:09,69,---,3315,3,Riscos Mistos,3,"Comprometimento total ou parcial de segurança, serviços ou estruturas",15,Inundação de estruturas ou superfícies por precipitação intensa,3315 - Inundação de estruturas ou superfícies por precipitação intensa,4,Lisboa e Vale do Tejo,1,Grande Lisboa,152,Cascais,110507,Carcavelos e Parede,Parede,Rua do Liz ,2,0,2,1,0,0,1,38.690219,-9.355169,38.690219°N 9.355169°W,"38°41,4120'N 9°21,3120'W ","38° 41' 24,72'' N 9° 21' 18,72'' W ",1770201120000,33 - Em Despacho,Intervenções em Infraestruturas e vias de comunicação,26704076,-9.355169,38.690219,20260182076,Parede,Lisboa e Vale do Tejo,152,2026-02-04T09:23:00Z,2026-02-04,Despacho De 1º Alerta,3315,0,1,2,Despacho De 1º Alerta,Cascais,Lisboa,Área Metropolitana De Lisboa,-9.355169,38.690219,Inundação de estruturas ou superfícies por precipitação intensa
38412439,20260182077,5,Despacho de 1º Alerta,Em Despacho,1,Reduzida,04/02/2026 08:00,1770192000000,2026-02-04,08:00,2026,0/02:32,152,---,3301,3,Riscos Mistos,3,"Comprometimento total ou parcial de segurança, serviços ou estruturas",1,Queda de Árvore,3301 - Queda de Árvore,3,Centro,15,Beira Baixa,67,Proença-a-Nova,050808,Sobreira Formosa e Alvito da Beira,SOBREIRA FORMOSA,Caminho Municipal 1338,4,0,4,1,0,0,1,39.770586,-7.848327,39.770586°N 7.848327°W,"39°46,2360'N 7°50,8980'W ","39° 46' 14,16'' N 7° 50' 53,88'' W ",1770201120000,33 - Em Despacho,Intervenções em Infraestruturas e vias de comunicação,26704077,-7.848327,39.770586,20260182077,SOBREIRA FORMOSA,Centro,67,2026-02-04T08:00:00Z,2026-02-04,Despacho De 1º Alerta,3301,0,1,4,Despacho De 1º Alerta,Proença-a-nova,Castelo Branco,Centro,-7.848327,39.770586,Queda de Árvore
38412440,20260182113,5,Despacho de 1º Alerta,Em Despacho,1,Reduzida,04/02/2026 08:00,1770192000000,2026-02-04,08:00,2026,0/02:32,152,---,3301,3,Riscos Mistos,3,"Comprometimento total ou parcial de segurança, serviços ou estruturas",1,Queda de Árvore,3301 - Queda de Árvore,3,Centro,15,Beira Baixa,67,Proença-a-Nova,050807,Proença-a-Nova e Peral,Corgas,Corgas,6,0,6,2,0,0,2,39.805857,-7.91591,39.805857°N 7.915910°W,"39°48,3540'N 7°54,9540'W ","39° 48' 21,24'' N 7° 54' 57,24'' W ",1770201120000,33 - Em Despacho,Intervenções em Infraestruturas e vias de comunicação,26704113,-7.91591,39.805857,20260182113,Corgas,Centro,67,2026-02-04T08:00:00Z,2026-02-04,Despacho De 1º Alerta,3301,0,2,6,Despacho De 1º Alerta,Proença-a-nova,Castelo Branco,Centro,-7.91591,39.805857,Queda de Árvore
38412441,20260182116,5,Despacho de 1º Alerta,Em Despacho,1,Reduzida,04/02/2026 09:12,1770196320000,2026-02-04,09:12,2026,0/01:20,80,---,3301,3,Riscos Mistos,3,"Comprometimento total ou parcial de segurança, serviços ou estruturas",1,Queda de Árvore,3301 - Queda de Árvore,3,Centro,15,Beira Baixa,68,Sertã,050902,Carvalhal,CARVALHAL,Carvalhal,5,0,5,1,0,0,1,39.868201,-8.141291,39.868201°N 8.141291°W,"39°52,0920'N 8°8,4780'W ","39° 52' 5,52'' N 8° 8' 28,68'' W ",1770201120000,33 - Em Despacho,Intervenções em Infraestruturas e vias de comunicação,26704116,-8.141291,39.868201,20260182116,CARVALHAL,Centro,68,2026-02-04T09:12:00Z,2026-02-04,Despacho De 1º Alerta,3301,0,1,5,Despacho De 1º Alerta,Sertã,Castelo Branco,Centro,-8.141291,39.868201,Queda de Árvore
38412442,20260182118,5,Despacho de 1º Alerta,Em Despacho,1,Reduzida,04/02/2026 08:30,1770193800000,2026-02-04,08:30,2026,0/02:02,122,---,3315,3,Riscos Mistos,3,"Comprometimento total ou parcial de segurança, serviços ou estruturas",15,Inundação de estruturas ou superfícies por precipitação intensa,3315 - Inundação de estruturas ou superfícies por precipitação intensa,4,Lisboa e Vale do Tejo,16,Oeste,155,Lourinhã,110808,Vimeiro,VIMEIRO,Vimeiro ( Rio Alcabrichel),3,0,3,3,0,0,1,39.17942,-9.32046,39.179420°N 9.320460°W,"39°10,7640'N 9°19,2300'W ","39° 10' 45,84'' N 9° 19' 13,80'' W ",1770201120000,33 - Em Despacho,Intervenções em Infraestruturas e vias de comunicação,26704118,-9.32046,39.17942,20260182118,VIMEIRO,Lisboa e Vale do Tejo,155,2026-02-04T08:30:00Z,2026-02-04,Despacho De 1º Alerta,3315,0,3,3,Despacho De 1º Alerta,Lourinhã,Lisboa,Centro,-9.32046,39.17942,Inundação de estruturas ou superfícies por precipitação intensa
