id,address,subregion,neighborhood,date,id.1,state,nature,nature_description,aerial_means,terrestrial_means,aquatic_means,operational,date.1,Concelho,Distrito,NUTII_DSG,longitude,latitude
25049125,Malveira e São Miguel de Alcainça,Grande Lisboa,311,2025-03-06T15:07:00Z,25049125,Em conclusão,3315,Inundação de estruturas por precipitação intensa,0,1,0,5,2025-03-06T15:07:00Z,Mafra,Lisboa,Área Metropolitana De Lisboa,-9.288438,38.919433
25049139,Alcobaça e Vestiaria,Oeste,311,2025-03-06T15:23:00Z,25049139,Em despacho,3315,Inundação de estruturas por precipitação intensa,0,1,0,2,2025-03-06T15:23:00Z,Alcobaça,Leiria,Centro,-8.970766,39.549944000000004
25049124,Alcobaça e Vestiaria,Oeste,311,2025-03-06T15:17:00Z,25049124,Em conclusão,3315,Inundação de estruturas por precipitação intensa,0,1,0,2,2025-03-06T15:17:00Z,Alcobaça,Leiria,Centro,-8.970766,39.549944000000004
25048193,Amora,Península de Setúbal,311,2025-03-06T12:02:00Z,25048193,Em conclusão,3315,Inundação de estruturas por precipitação intensa,0,2,0,4,2025-03-06T12:02:00Z,Seixal,Setúbal,Área Metropolitana De Lisboa,-9.125227,38.624582
25049126,Peniche,Oeste,311,2025-03-06T15:11:00Z,25049126,Em despacho,3321,Dano na rede de fornecimento de eletricidade ,0,1,0,5,2025-03-06T15:11:00Z,Peniche,Leiria,Centro,-9.376833,39.357166
