id,address,subregion,neighborhood,date,id.1,state,nature,nature_description,aerial_means,terrestrial_means,aquatic_means,operational,date.1,Concelho,Distrito,NUTII_DSG,longitude,latitude
25056091,"Almargem do Bispo, Pêro Pinheiro e Montelavar",Grande Lisboa,311,2025-03-08T05:25:00Z,25056091,Em conclusão,3313,Deslizamento de terras,0,3,0,5,2025-03-08T05:25:00Z,Sintra,Lisboa,Área Metropolitana De Lisboa,-9.28663,38.818606
25056922,Bougado (São Martinho e Santiago),Area M. Porto,309,2025-01-22T10:38:00Z,25056922,Em despacho,1101,Cheia,0,0,0,0,2025-01-22T10:38:00Z,Trofa,Porto,Norte,-8.558796,41.329536
25057045,"Marvila, Ribeira Santarém, S.salvador, S.nicolau",Lezíria do Tejo,311,2025-03-08T10:35:00Z,25057045,Em conclusão,3301,Queda de árvore,0,1,0,6,2025-03-08T10:35:00Z,Santarém,Santarém,Alentejo,-8.675153,39.256125
25057097,Colares,Grande Lisboa,311,2025-03-08T10:43:00Z,25057097,Em despacho,3313,Deslizamento de terras,0,2,0,6,2025-03-08T10:43:00Z,Sintra,Lisboa,Área Metropolitana De Lisboa,-9.436603,38.79617
25057236,"Amarante (São Gonçalo), Madalena, Cepelos e Gatão",Tâmega e Sousa,309,2025-03-08T11:01:00Z,25057236,Em despacho,3301,Queda de árvore,0,1,0,3,2025-03-08T11:01:00Z,Amarante,Porto,Norte,-8.063896,41.289204
25056740,Alcanede,Lezíria do Tejo,311,2025-03-08T09:32:00Z,25056740,Em conclusão,3309,Desabamento de estruturas edificadas,0,1,0,4,2025-03-08T09:32:00Z,Santarém,Santarém,Alentejo,-8.793268,39.357442
25056808,Salvaterra de Magos e Foros de Salvaterra,Lezíria do Tejo,311,2025-03-08T09:47:00Z,25056808,Em conclusão,3315,Inundação de estruturas por precipitação intensa,0,2,0,7,2025-03-08T09:47:00Z,Salvaterra De Magos,Santarém,Alentejo,-8.790194,39.028695
25056906,Corroios,Península de Setúbal,311,2025-03-08T10:05:00Z,25056906,Em curso,3301,Queda de árvore,0,2,0,5,2025-03-08T10:05:00Z,Seixal,Setúbal,Área Metropolitana De Lisboa,-9.15139,38.58
25056957,Alcantarilha e Pêra,Algarve,313,2025-03-08T10:20:00Z,25056957,Em conclusão,3329,Queda de estruturas temporárias ou móveis,0,1,0,5,2025-03-08T10:20:00Z,Silves,Faro,Algarve,-8.33971,37.12126
25056993,São João da Pesqueira e Várzea de Trevões,Douro,309,2025-03-08T10:26:00Z,25056993,Em despacho,3313,Deslizamento de terras,0,0,0,0,2025-03-08T10:26:00Z,São João Da Pesqueira,Viseu,Norte,-7.45358,41.11825
25057025,"S.maria, S.miguel, S.martinho, S.pedro Penaferrim",Grande Lisboa,311,2025-03-08T10:25:00Z,25057025,Em despacho,3301,Queda de árvore,0,1,0,2,2025-03-08T10:25:00Z,Sintra,Lisboa,Área Metropolitana De Lisboa,-9.414924,38.772191
25057092,Portimão,Algarve,313,2025-03-08T10:47:00Z,25057092,Em conclusão,3329,Queda de estruturas temporárias ou móveis,0,3,0,10,2025-03-08T10:47:00Z,Portimão,Faro,Algarve,-8.54469,37.13245
25057110,Conceição e Estoi,Algarve,313,2025-03-08T10:49:00Z,25057110,Em curso,3321,Dano na rede de fornecimento de eletricidade ,0,1,0,1,2025-03-08T10:49:00Z,Faro,Faro,Algarve,-7.910512,37.038455
25056576,Fernão Ferro,Península de Setúbal,311,2025-03-08T08:54:00Z,25056576,Em conclusão,3301,Queda de árvore,0,1,0,2,2025-03-08T08:54:00Z,Seixal,Setúbal,Área Metropolitana De Lisboa,-9.087621,38.571409
25056603,"Alto do Seixalinho, Santo André e Verderena",Península de Setúbal,311,2025-03-08T08:14:00Z,25056603,Em curso,3329,Queda de estruturas temporárias ou móveis,0,0,0,0,2025-03-08T08:14:00Z,Barreiro,Setúbal,Área Metropolitana De Lisboa,-9.065968,38.6593
25056696,Serzedo e Perosinho,Area M. Porto,309,2025-03-08T09:19:00Z,25056696,Em despacho,3311,Queda de elementos de estruturas edificados,0,2,0,4,2025-03-08T09:19:00Z,Vila Nova De Gaia,Porto,Norte,-8.600642,41.053381
25057194,Nossa Senhora do Pranto,Médio Tejo,311,2025-03-08T11:06:00Z,25057194,Em despacho,3321,Dano na rede de fornecimento de eletricidade ,0,2,0,5,2025-03-08T11:06:00Z,Ferreira Do Zêzere,Santarém,Centro,-8.31141,39.7502
25057196,Abiul,Região de Leiria,310,2025-03-08T10:55:00Z,25057196,Em despacho,3321,Dano na rede de fornecimento de eletricidade ,0,1,0,2,2025-03-08T10:55:00Z,Pombal,Leiria,Centro,-8.536554,39.904421
25057228,Carregueira,Lezíria do Tejo,311,2025-03-08T11:12:00Z,25057228,Em despacho,3313,Deslizamento de terras,0,1,0,1,2025-03-08T11:12:00Z,Chamusca,Santarém,Alentejo,-8.411811,39.421134
25056614,Almancil,Algarve,313,2025-03-08T08:00:00Z,25056614,Em curso,3301,Queda de árvore,0,3,0,8,2025-03-08T08:00:00Z,Loulé,Faro,Algarve,-8.057739,37.054821
25057015,Santa Maria do Castelo e Santiago e Santa Susana,Alentejo Litoral,312,2025-03-08T10:20:00Z,25057015,Em despacho,1101,Cheia,0,1,0,1,2025-03-08T10:20:00Z,Alcácer Do Sal,Setúbal,Alentejo,-8.434123,38.391487
25057016,"S.julião, N.s. da Anunciada e S. Maria da Graça",Península de Setúbal,311,2025-03-08T10:24:00Z,25057016,Em despacho,3311,Queda de elementos de estruturas edificados,0,1,0,5,2025-03-08T10:24:00Z,Setúbal,Setúbal,Área Metropolitana De Lisboa,-8.889983,38.529955
25057149,Monsanto e Idanha-a-Velha,Beira Baixa,310,2025-03-08T10:40:00Z,25057149,Em despacho,3313,Deslizamento de terras,0,1,0,2,2025-03-08T10:40:00Z,Idanha-a-Nova,Castelo Branco,Centro,-7.1413,39.99726
25057150,Ulme,Lezíria do Tejo,311,2025-03-08T10:56:00Z,25057150,Em resolução,3301,Queda de árvore,0,2,0,7,2025-03-08T10:56:00Z,Chamusca,Santarém,Alentejo,-8.300107,39.329477
25057248,Lorvão,Região de Coimbra,310,2025-03-08T11:17:00Z,25057248,Em despacho,3301,Queda de árvore,0,1,0,2,2025-03-08T11:17:00Z,Penacova,Coimbra,Centro,-8.328179,40.235482
25057253,Grândola e Santa Margarida da Serra,Alentejo Litoral,312,2025-03-08T10:34:00Z,25057253,Em despacho,3313,Deslizamento de terras,0,1,0,1,2025-03-08T10:34:00Z,Grândola,Setúbal,Alentejo,-8.5587510000000009,38.173088
25057227,Estômbar e Parchal,Algarve,313,2025-03-08T11:05:00Z,25057227,Em curso,3321,Dano na rede de fornecimento de eletricidade ,0,1,0,4,2025-03-08T11:05:00Z,Lagoa,Faro,Algarve,-8.517968,37.136212
25057274,Aranhas,Beira Baixa,310,2025-03-08T11:19:00Z,25057274,Em despacho,3301,Queda de árvore,0,1,0,3,2025-03-08T11:19:00Z,Penamacor,Castelo Branco,Centro,-7.126743,40.111508
25057233,Barreiro e Lavradio,Península de Setúbal,311,2025-03-08T11:06:00Z,25057233,Em despacho,3315,Inundação de estruturas por precipitação intensa,0,1,0,5,2025-03-08T11:06:00Z,Barreiro,Setúbal,Área Metropolitana De Lisboa,-9.060271,38.662949
25057265,Faro (Sé e São Pedro),Algarve,313,2025-03-08T11:00:00Z,25057265,Em resolução,3329,Queda de estruturas temporárias ou móveis,0,2,0,4,2025-03-08T11:00:00Z,Faro,Faro,Algarve,-7.942032,37.01865
