id,address,subregion,neighborhood,date,id.1,state,nature,nature_description,aerial_means,terrestrial_means,aquatic_means,operational,date.1,Concelho,Distrito,NUTII_DSG,longitude,latitude
24851780,"São Miguel, Santa Eufémia e Rabaçal",Região de Coimbra,310,2025-01-21T23:25:00Z,24851780,Em curso,3315,Inundação de estruturas por precipitação intensa,0,0,0,0,2025-01-21T23:25:00Z,Penela,Coimbra,Centro,-8.399036,40.025502
24859768,Padroso,Alto Minho,309,2025-01-23T14:53:00Z,24859768,Em conclusão,3301,Queda de árvore,0,1,0,2,2025-01-23T14:53:00Z,Arcos De Valdevez,Viana Do Castelo,Norte,-8.491789,41.943946
24859785,Gondemaria e Olival,Médio Tejo,311,2025-01-23T15:04:00Z,24859785,Em despacho,3313,Deslizamento de terras,0,4,0,7,2025-01-23T15:04:00Z,Ourém,Santarém,Centro,-8.607563,39.687999
24859899,Penamacor,Beira Baixa,310,2025-01-23T15:22:00Z,24859899,Em despacho,3315,Inundação de estruturas por precipitação intensa,0,1,0,1,2025-01-23T15:22:00Z,Penamacor,Castelo Branco,Centro,-7.165826,40.167676
24859129,Carnaxide e Queijas,Grande Lisboa,311,2025-01-23T13:04:00Z,24859129,Em despacho,3315,Inundação de estruturas por precipitação intensa,0,1,0,3,2025-01-23T13:04:00Z,Oeiras,Lisboa,Área Metropolitana De Lisboa,-9.25881,38.722457
24859778,Quarteira,Algarve,313,2025-01-23T14:52:00Z,24859778,Em despacho,3315,Inundação de estruturas por precipitação intensa,0,1,0,5,2025-01-23T14:52:00Z,Loulé,Faro,Algarve,-8.12969,37.102601
24851821,Santa Maria do Castelo e Santiago e Santa Susana,Alentejo Litoral,312,2025-01-21T23:41:00Z,24851821,Em resolução,1103,Vento forte,0,11,0,21,2025-01-21T23:41:00Z,Alcácer Do Sal,Setúbal,Alentejo,-8.598678,38.397168
