id,address,subregion,neighborhood,date,id.1,state,nature,nature_description,aerial_means,terrestrial_means,aquatic_means,operational,date.1,Concelho,Distrito,NUTII_DSG,longitude,latitude
25468695,"Aldoar, Foz do Douro e Nevogilde",Area M. Porto,309,2025-06-02T22:24:00Z,25468695,Em conclusão,2101,Incêndio em edifícios habitacionais,0,3,0,12,2025-06-02T22:24:00Z,Porto,Porto,Norte,-8.67145,41.16579
25468761,Paços de Ferreira,Tâmega e Sousa,309,2025-06-02T22:46:00Z,25468761,Em conclusão,2129,Incêndio em edifícios degradados ou devolutos,0,2,0,7,2025-06-02T22:46:00Z,Paços De Ferreira,Porto,Norte,-8.384118,41.277077
25468777,Vila Nova de Cacela,Algarve,313,2025-06-02T23:03:00Z,25468777,Em curso,2201,Incêndio em equipamentos ou produtos,0,1,0,5,2025-06-02T23:03:00Z,Vila Real De Santo António,Faro,Algarve,-7.567767,37.17472
25468879,Gaio-Rosário e Sarilhos Pequenos,Península de Setúbal,311,2025-06-02T23:44:00Z,25468879,Em resolução,3103,Incêndio rural,0,4,0,17,2025-06-02T23:44:00Z,Moita,Setúbal,Área Metropolitana De Lisboa,-9.00815,38.67682
25457724,Santo André,Alentejo Litoral,312,2025-05-31T18:30:00Z,25457724,Em conclusão,2127,"Incêndio em edifícios e recintos industriais, oficinas e armazéns",0,1,0,2,2025-05-31T18:30:00Z,Santiago Do Cacém,Setúbal,Alentejo,-8.784407,38.048083
25466369,Melides,Alentejo Litoral,312,2025-06-02T13:27:00Z,25466369,Em conclusão,3103,Incêndio rural,0,9,0,21,2025-06-02T13:27:00Z,Grândola,Setúbal,Alentejo,-8.754243,38.19534
25467128,Monte Redondo e Carreira,Região de Leiria,310,2025-06-02T15:48:00Z,25467128,Em conclusão,3103,Incêndio rural,0,2,0,6,2025-06-02T15:48:00Z,Leiria,Leiria,Centro,-8.860783,39.89848
25468832,"Alto do Seixalinho, Santo André e Verderena",Península de Setúbal,311,2025-06-02T23:15:00Z,25468832,Em conclusão,2201,Incêndio em equipamentos ou produtos,0,1,0,5,2025-06-02T23:15:00Z,Barreiro,Setúbal,Área Metropolitana De Lisboa,-9.061632,38.64534
25468859,São Bento do Mato,Alentejo Central,312,2025-06-02T23:35:00Z,25468859,Em resolução,2301,Incêndio em transporte rodoviário,0,2,0,7,2025-06-02T23:35:00Z,Évora,Évora,Alentejo,-7.805613,38.695255
