id,address,subregion,neighborhood,date,id.1,state,nature,nature_description,aerial_means,terrestrial_means,aquatic_means,operational,date.1,Concelho,Distrito,NUTII_DSG,longitude,latitude
24851780,"São Miguel, Santa Eufémia e Rabaçal",Região de Coimbra,310,2025-01-21T23:25:00Z,24851780,Em curso,3315,Inundação de estruturas por precipitação intensa,0,0,0,0,2025-01-21T23:25:00Z,Penela,Coimbra,Centro,-8.399036,40.025502
24908536,"Algés, Linda-a-Velha e Cruz Quebrada-Dafundo",Grande Lisboa,311,2025-02-03T10:02:00Z,24908536,Em despacho,3317,Inundação de estruturas por água canalizada,0,1,0,4,2025-02-03T10:02:00Z,Oeiras,Lisboa,Área Metropolitana De Lisboa,-9.242367,38.700095
24908409,Pedrouços,Area M. Porto,309,2025-02-03T09:50:00Z,24908409,Em despacho,3317,Inundação de estruturas por água canalizada,0,1,0,4,2025-02-03T09:50:00Z,Maia,Porto,Norte,-8.588851,41.189901
24908395,São Domingos de Rana,Grande Lisboa,311,2025-02-03T09:52:00Z,24908395,Em despacho,3301,Queda de árvore,0,1,0,4,2025-02-03T09:52:00Z,Cascais,Lisboa,Área Metropolitana De Lisboa,-9.336142,38.70662
24908415,São Félix da Marinha,Area M. Porto,309,2025-02-03T09:40:00Z,24908415,Em despacho,3315,Inundação de estruturas por precipitação intensa,0,1,0,4,2025-02-03T09:40:00Z,Vila Nova De Gaia,Porto,Norte,-8.629189,41.030125
24877003,Malagueira e Horta Das Figueiras,Alentejo Central,312,2025-01-27T11:41:00Z,24877003,Em conclusão,3315,Inundação de estruturas por precipitação intensa,0,0,0,0,2025-01-27T11:41:00Z,Évora,Évora,Alentejo,-7.924277,38.57285
24908387,"Oeiras e S. Julião da Barra, Paço de Arcos e Caxias",Grande Lisboa,311,2025-02-03T09:22:00Z,24908387,Em despacho,3301,Queda de árvore,0,1,0,2,2025-02-03T09:22:00Z,Oeiras,Lisboa,Área Metropolitana De Lisboa,-9.310159,38.698531
